HCH_009_070_000283	九年，拜樞密使，上疏論五事：其一，女直人可依漢人以文理選試。
HCH_009_070_000284	其二，契丹人可分隸女直猛安。
HCH_009_070_000285	其三，鹽濼官可罷去。
HCH_009_070_000286	其四，與猛安同勾當副千戶官亦可罷。
HCH_009_070_000287	其五，親王府官屬以文資官擬注，教以女直語言文字。
HCH_009_070_000288	上皆從之。
HCH_009_070_000289	其後女直人試進士，夾谷衡、尼厖古鑒、徒單鎰、完顏匡輩，皆由此致宰相，實思敬啟之也。
HCH_009_070_000290	久之，上謂思敬曰：「朕欲修《熙宗實錄》，卿嘗為侍從，必能記其事蹟。」
HCH_009_070_000291	對曰：「熙宗時，內外皆得人，風雨時，年谷豐，盜賊息，百姓安，此其大概也，何必餘事。」
HCH_009_070_000292	上大悅。
HCH_009_070_000293	世宗喜立事，故其微諫如此。
HCH_009_070_000294	大定十三年，薨。
HCH_009_070_000295	上輟朝，親臨喪，哭之慟。
HCH_009_070_000296	曰：「舊臣也。」
HCH_009_070_000297	賻贈加厚，葬禮悉從官給。
HCH_009_070_000298	孫吾侃術特，大定二十四年，除明威將軍，授速濱路寶鄰山猛安。
HCH_009_070_000299	贊曰：劾者讓國世祖，以開帝業。
HCH_009_070_000300	撒改治國家，定社稷，尊立太祖，深謀遠略，為一代宗臣，賢矣哉。
HCH_009_070_000301	習不失蓋前人之愆，著勳五世。
HCH_009_070_000302	《易》曰「有子考無咎」，其此之謂乎。
HCH_009_070_000303	始祖與季弟異部而處，子孫俱為強宗，而取遼之策，卒定于迪古乃，豈天道陰有以相之邪。
