HCH_010_110_000000	《春秋》褒貶，善惡並書，示勸懲也。
HCH_010_110_000001	故遷、固傳佞幸、酷吏，歐陽修則並奸臣錄之，將俾為君者知所鑒，為臣者知所戒。
HCH_010_110_000002	此天地聖賢之心，國家安危之機，治亂之原也。
HCH_010_110_000003	遼自耶律乙辛而下，奸臣十人，其敗國皆足以為戒，故列於《傳》。
HCH_010_110_000004	耶律乙辛，字胡睹袞，五院部人。
HCH_010_110_000005	父叠剌，家貧，服用不給，部人號「窮叠剌」。
HCH_010_110_000006	初，乙辛母方娠，夜夢手搏羖羊，拔其角尾。
HCH_010_110_000007	既寤占之，術者曰：「此吉兆也。羊去角尾為王字，汝後有子當王。」
HCH_010_110_000008	及乙辛生，適在路，無水以浴，回車破轍，忽見湧泉。
HCH_010_110_000009	叠剌自以得子，欲酒以慶，聞酒香，於草棘間得二榼，因祭東焉。
HCH_010_110_000010	乙辛幼慧黠。
HCH_010_110_000011	嘗牧羊至日昃，叠剌視之，乙辛熟寢。
HCH_010_110_000012	叠剌觸之覺，乙辛怒曰：「何遽驚我！適夢人手執日月以食我，我已食月，啖日方半而覺，惜不盡食之。」
HCH_010_110_000013	叠剌自是不令牧羊。
HCH_010_110_000014	及長，美風儀，外和內狡。
HCH_010_110_000015	重熙中，為文班吏，掌太保印，陪從入宮。
HCH_010_110_000016	皇后見乙辛詳雅如素宦，令補筆硯吏；帝亦愛之，累遷護衛太保。
HCH_010_110_000017	道宗即位，以乙辛先朝任使，賜漢人戶四十，同知點檢司事，常召決疑議，升北院同知，歷樞密副使。
HCH_010_110_000018	清寧五年，為南院樞密使，改知北院，封趙王。
HCH_010_110_000019	九年，耶律仁先為南院樞密使，時駙馬都尉蕭胡睹與重元黨，惡仁先在朝，奏曰：「仁先可任西北路招討使。」
HCH_010_110_000020	帝將從之。
HCH_010_110_000021	乙辛奏曰：「臣新參國政，未知治體。仁先乃先帝舊臣，不可遽離朝廷。」
HCH_010_110_000022	帝然之。
HCH_010_110_000023	重元亂平，拜北院樞密使，進王魏，賜匡時翊聖竭忠平亂功臣。
HCH_010_110_000024	咸雍五年，加守太師。
HCH_010_110_000025	詔四方有軍旅，許以便宜從事，勢震中外，門下饋賂不絕。
HCH_010_110_000026	凡阿順者蒙薦擢，忠直者被斥竄。
HCH_010_110_000027	大康元年，皇太子始預朝政，法度修明。
HCH_010_110_000028	乙辛不得逞，謀以事誣皇后。
HCH_010_110_000029	后既死，乙辛不自安，又欲害太子。
HCH_010_110_000030	乘間入奏曰：「帝與后如天地並位，中宮豈可曠？」
HCH_010_110_000031	盛稱其黨駙馬都尉蕭霞抹之妹美而賢。
HCH_010_110_000032	上信之，納於宮，尋冊為皇后。
HCH_010_110_000033	時護衛蕭忽古知乙辛奸狀，伏橋下，欲殺之。
HCH_010_110_000034	俄暴雨壞橋，謀不遂。
HCH_010_110_000035	林牙蕭巖壽密奏曰：「乙辛自皇太子預政，內懷疑懼，又與宰相張孝傑相附會。恐有異圖，不可使居要地。」
HCH_010_110_000036	出為中京留守。
HCH_010_110_000037	乙辛泣謂人曰：「乙辛無過，因讒見出。」
HCH_010_110_000038	其黨蕭霞抹輩以其言聞於上。
HCH_010_110_000039	上悔之。
HCH_010_110_000040	無何，出蕭巖壽為順義軍節度使，詔近臣議召乙辛事。
HCH_010_110_000041	北面官屬無敢言者，耶律撒剌曰：「初以蕭巖壽奏出乙辛，若所言不當，宜坐以罪，若當，則不可復召。」
HCH_010_110_000042	累諫不從。
HCH_010_110_000043	乃復召為北院樞密使。
HCH_010_110_000044	時皇太子以母後之故，憂見顏色。
HCH_010_110_000045	乙辛黨欣躍相慶，讒謗沸騰，忠良之士，斥逐殆盡。
HCH_010_110_000046	乙辛因蕭十三之言，夜召蕭得裏特謀構太子，令護衛太保耶律查剌誣告耶律撒剌等同謀立皇太子。
HCH_010_110_000047	詔按無跡而罷。
HCH_010_110_000048	又令牌印郎君蕭訛都斡詣上誣首：「耶律查剌前告耶律撒剌等事皆實，臣亦與其謀。本欲殺乙辛等而立太子。臣等若不言，恐事白連坐。」
HCH_010_110_000049	詔使鞫劾，乙辛迫令具伏。
HCH_010_110_000050	上怒，命誅撒剌及速撒等。
HCH_010_110_000051	乙辛恐帝疑，引數人庭詰，各令荷重校，繩系其頸，不能出氣，人人不堪其酷，惟求速死。
HCH_010_110_000052	反奏曰：「別無異辭。」
HCH_010_110_000053	時方暑，屍不得瘞，以至地臭。
HCH_010_110_000054	乃囚皇太子於上京，監衛者皆其黨。
HCH_010_110_000055	尋遣蕭達魯古、撒把害太子。
HCH_010_110_000056	乙辛黨大喜，聚飲數日。
HCH_010_110_000057	上京留守蕭撻得以卒聞。
HCH_010_110_000058	上哀悼，欲召其妻，乙辛陰遣人殺之，以滅其口。
HCH_010_110_000059	五年正月，上將出獵，乙辛奏留皇孫，上欲從之。
HCH_010_110_000060	同知點檢蕭兀納諫曰：「陛下若從乙辛留皇孫，皇孫尚幼，左右無人，願留臣保護，以防不測。」
HCH_010_110_000061	遂與皇孫俱行。
HCH_010_110_000062	由是上始疑乙辛，頗知其奸。
HCH_010_110_000063	會北幸，將次黑山之平澱，上適見扈從官屬多隨乙辛後，惡之，出乙辛知南院大王事。
HCH_010_110_000064	及例削一字王爵，改王混同，意稍自安。
HCH_010_110_000065	及赴闕入謝，帝即日遣還，改知興中府事。
HCH_010_110_000066	七年冬，坐以禁物鬻入外國，下有司議，法當死。
HCH_010_110_000067	乙辛黨耶律燕哥獨奏當入八議，得減死論，擊以鐵骨朵，幽於來州。
HCH_010_110_000068	後謀奔宋及私藏兵甲事覺，縊殺之。
HCH_010_110_000069	乾統二年，發冢，戮其屍。
HCH_010_110_000070	張孝傑，建州永霸縣人。
HCH_010_110_000071	家貧，好學。
HCH_010_110_000072	重熙二十四年，擢進士第一。
HCH_010_110_000073	清寧間，累遷樞密直學士。
HCH_010_110_000074	咸雍初，坐誤奏事，出為惠州刺史。
HCH_010_110_000075	俄召復舊職，兼知戶部司事。
HCH_010_110_000076	三年，參知政事，同知樞密院事，加工部侍郎。
HCH_010_110_000077	八年，封陳國公。
HCH_010_110_000078	上以孝傑勤幹，數問以事，為北府宰相。
HCH_010_110_000079	漢人貴幸無比。
HCH_010_110_000080	大康元年，賜國姓。
HCH_010_110_000081	明年秋獵，帝一日射鹿三十，燕從官。
HCH_010_110_000082	酒酣，命賦《雲上於天詩》，詔孝傑坐禦榻旁。
HCH_010_110_000083	上誦《黍離》詩：「知我者謂我心憂，不知我者謂我何求。」
HCH_010_110_000084	孝傑奏曰：「今天下太平，陛下何憂？富有四海，陛下何求？」
HCH_010_110_000085	帝大悅。
HCH_010_110_000086	三年，群臣侍燕，上曰：「先帝用仁先、化葛，以賢智也。朕有孝傑、乙辛，不在仁先、化葛下，誠為得人。」
HCH_010_110_000087	歡飲至夜，乃罷。
HCH_010_110_000088	是年夏，乙辛譖皇太子，孝傑同力相濟。
HCH_010_110_000089	及乙辛受詔按皇太子黨人，誣害忠良，孝傑之謀居多。
HCH_010_110_000090	乙辛薦孝傑忠於社稷，帝謂孝傑可比狄仁傑，賜名仁傑，乃許放海東青鶻。
HCH_010_110_000091	六年，既出乙辛，上亦悟孝傑奸佞，尋出為武定軍節度使。
HCH_010_110_000092	坐私販廣濟湖鹽及擅改詔旨，削爵，貶安肅州，數年乃歸。
HCH_010_110_000093	大安中，死於鄉。
HCH_010_110_000094	乾統初，剖棺戮屍，以族產分賜臣下。
HCH_010_110_000095	孝傑久在相位，貪貨無厭，時與親戚會飲，嘗曰：「無百萬兩黃金，不足為宰相家。」
HCH_010_110_000096	初，孝傑及第，詣佛寺，忽迅風吹孝傑襆頭，與浮圖齊，墜地而碎。
HCH_010_110_000097	有老僧曰：「此人必驟貴，然亦不得其死。」
HCH_010_110_000098	竟如其言。
HCH_010_110_000099	耶律燕哥，字善寧，季父房之後。
HCH_010_110_000100	四世祖鐸穩，太祖異母弟。
HCH_010_110_000101	父曰豁裏斯，官至太師。
HCH_010_110_000102	燕哥狡佞而敏。
HCH_010_110_000103	清寧間，為左護衛太保。
HCH_010_110_000104	大康初，轉北面林牙。
HCH_010_110_000105	初，耶律乙辛自中京留守復為樞密使，以燕哥為耳目，凡聞見必以告。
HCH_010_110_000106	乙辛愛而薦之，帝亦以為賢，拜左夷離畢。
HCH_010_110_000107	及皇太子被誣，帝遣燕哥往訊之，太子謂燕哥曰：「帝惟我一子，今為儲嗣，復何求，敢為此事！公與我為昆弟行，當念無辜，達意於帝。」
HCH_010_110_000108	禱之甚懇。
HCH_010_110_000109	蕭十三聞之，謂燕哥曰：「宜以太子言易為伏狀。」
HCH_010_110_000110	燕哥頷之，盡如所教以奏。
HCH_010_110_000111	及太子被逐，乙辛殺害忠良，多燕哥之謀，為契丹行宮都部署。
HCH_010_110_000112	五年夏，拜南府宰相，遷惕隱。
HCH_010_110_000113	大安三年，為西京留守，致仕。
HCH_010_110_000114	壽隆初，以疾卒。
HCH_010_110_000115	蕭十三，蔑古乃部人。
HCH_010_110_000116	父鐸魯斡，歷官節度使。
HCH_010_110_000117	十三辨黠，善揣摩人意。
HCH_010_110_000118	清寧間，以年勞遷護衛太保。
HCH_010_110_000119	大康初，耶律乙辛復入樞府，益橫恣。
HCH_010_110_000120	時十三出入乙辛家，以朝臣不附者輒使出之，十三由宿衛遷殿前副點檢。
HCH_010_110_000121	三年夏，護衛蕭忽古等謀殺乙辛，事覺下獄。
HCH_010_110_000122	十三謂乙辛曰：「今太子猶在，臣民屬心。大王素無根柢之助，復有誣皇后之怨。若太子立，王置身何地？宜熟計之。」
HCH_010_110_000123	乙辛曰：「吾憂此久矣！」
HCH_010_110_000124	是夜，召蕭得裏特謀所以構太子事。
HCH_010_110_000125	十三計既行，尋遷殿前都點檢，兼同知樞密院事。
HCH_010_110_000126	復令蕭訛都斡等誣首耶律查剌前告耶律撒剌等事皆實，詔究其事。
HCH_010_110_000127	太子不服，別遣夷離畢耶律燕哥問太子，太子具陳所以見誣之狀。
HCH_010_110_000128	十三聞之，謂燕哥曰：「如此奏，則大事去矣，當易其辭為伏款。」
HCH_010_110_000129	燕哥入，如十三言奏之。
HCH_010_110_000130	上大怒，廢太子。
HCH_010_110_000131	太子將出，曰：「我何罪至是！」
HCH_010_110_000132	十三叱令登車，遣衛卒闔車門。
HCH_010_110_000133	是年，遷北院樞密副使，復陳陰害太子計，乙辛從之。
HCH_010_110_000134	及乙辛出知南院大王事，亦出十三為保州統軍使，卒。
HCH_010_110_000135	乾統間，剖棺戮屍。
HCH_010_110_000136	二子：的裏得、念經，皆伏誅。
HCH_010_110_000137	本元朝作品在全世界都属于公有领域，因为作者逝世已经遠遠超过100年。
