HCH_012_040_001312	西有清溝、西北有喻口鎮二巡檢司。
HCH_012_040_001313	安東府東北。
HCH_012_040_001314	元安東州。
HCH_012_040_001315	洪武二年正月降爲縣。
HCH_012_040_001316	東北朐山在南。
HCH_012_040_001317	東北有鬱洲山，在海中，洪武初，置東海巡檢司於此，後移於州南之新壩。
HCH_012_040_001318	西南有漣河，又有桑墟湖，濱海。
HCH_012_040_001319	南有淮水，東北過雲梯關，折旋入於海。
HCH_012_040_001320	自清口至此，皆淮水故道，爲黃河所奪者也。
HCH_012_040_001321	又漣水自西北來，東南流入淮。
HCH_012_040_001322	又西北有碩項湖。
HCH_012_040_001323	東北有五港口、長樂鎮，東南有壩上三巡檢司。
HCH_012_040_001324	桃源府西北。
HCH_012_040_001325	元曰桃園。
HCH_012_040_001326	洪武初，更名。
HCH_012_040_001327	北有大河，即泗水故道。
HCH_012_040_001328	西北有古城巡檢司。
HCH_012_040_001329	東有三義鎮巡檢司，崇禎末，移於縣西之白洋河鎮。
HCH_012_040_001330	沭陽府北。
HCH_012_040_001331	元屬海寧州。
HCH_012_040_001332	洪武初改屬。
HCH_012_040_001333	東南有沭水，自山東郯城縣流入，其下流爲漣水。
HCH_012_040_001334	又北有桑墟湖。
HCH_012_040_001335	海州元曰海寧州。
HCH_012_040_001336	洪武初，復曰海州，以州治朐山縣省入。
HCH_012_040_001337	北有於公、白溝等浦，皆產鹽。
HCH_012_040_001338	南有惠澤、西北有高橋二巡檢司。
HCH_012_040_001339	南距府二百七十里。
HCH_012_040_001340	領縣一：贛榆州北。
HCH_012_040_001341	西北有羽山。
HCH_012_040_001342	東濱海。
HCH_012_040_001343	東北有荻水鎮、南有臨洪鎮二巡檢司。
HCH_012_040_001344	邳州元屬歸德府。
HCH_012_040_001345	洪武初，以州治下邳縣省入。
HCH_012_040_001346	四年二月改屬中都。
HCH_012_040_001347	十五年來屬。
HCH_012_040_001348	北有艾山，接山東沂水縣界。
HCH_012_040_001349	西有沂水，自沂州西流，至下邳入泗。
HCH_012_040_001350	又西北有泇河。
HCH_012_040_001351	萬曆三十五年開泇以通運，自沛縣夏鎮迄直河口，長二百六十餘里，避黃河險者三百餘里。
HCH_012_040_001352	有直河口巡檢司。
HCH_012_040_001353	又西有新安巡檢司。
HCH_012_040_001354	東南距府四百五十里。
HCH_012_040_001355	領縣二：宿遷州東南。
HCH_012_040_001356	北有峒峿山。
HCH_012_040_001357	南有大河，即泗水故道。
HCH_012_040_001358	又東南有睢水，入大河，曰睢口，亦曰小河口。
HCH_012_040_001359	又東南有白洋河，西北有駱馬湖，皆入大河。
HCH_012_040_001360	東北有劉家莊巡檢司。
HCH_012_040_001361	睢寧州南。
HCH_012_040_001362	北濱大河。
HCH_012_040_001363	有睢水自西來，經縣界，至睢口入河。
HCH_012_040_001364	揚州府元揚州路，屬淮東道宣慰司。
HCH_012_040_001365	太祖丁酉年十月曰淮海府。
HCH_012_040_001366	辛丑年十二月曰維揚府。
HCH_012_040_001367	丙午年正月曰揚州府。
HCH_012_040_001368	領州三，縣七。
HCH_012_040_001369	西距南京二百二十里。
HCH_012_040_001370	洪武二十六年編戶一十二萬三千九十七，口七十三萬六千一百六十五。
HCH_012_040_001371	弘治四年，戶一十萬四千一百四，口六十五萬六千五百四十七。
HCH_012_040_001372	萬曆六年，戶一十四萬七千二百一十六，口八十一萬七千八百五十六。
HCH_012_040_001373	江都倚。
HCH_012_040_001374	元末廢。
HCH_012_040_001375	太祖辛丑年復置。
HCH_012_040_001376	西有蜀岡。
HCH_012_040_001377	東有官河，即古邗溝，今運河也。
HCH_012_040_001378	南濱大江。
HCH_012_040_001379	東北有艾陵湖。
HCH_012_040_001380	北有邵伯湖，有邵伯鎮巡檢司。
HCH_012_040_001381	又東有萬壽鎮、西北有上官橋、南有瓜洲鎮三巡檢司。
HCH_012_040_001382	又東有歸仁鎮巡檢司，後遷便益河口。
HCH_012_040_001383	儀真府西。
HCH_012_040_001384	元真州，治揚子縣。
HCH_012_040_001385	洪武二年，州廢，改縣曰儀真。
HCH_012_040_001386	西北有大、小銅山。
HCH_012_040_001387	南濱江。
HCH_012_040_001388	南有運河。
HCH_012_040_001389	東南有舊江口巡檢司，尋移於縣南汊河口。
HCH_012_040_001390	泰興府南。
HCH_012_040_001391	南濱江。
HCH_012_040_001392	西北有口岸鎮、東有黃橋鎮、南有印莊三巡檢司。
HCH_012_040_001393	高郵州元高郵府，屬淮東道宣慰司。
HCH_012_040_001394	洪武元年閏七月降爲州，以州治高郵縣省入。
HCH_012_040_001395	西有運河。
HCH_012_040_001396	西北有樊梁、甓社、新開等湖。
HCH_012_040_001397	西南有白馬塘。
HCH_012_040_001398	北有張家溝、東北有時堡二巡檢司。
HCH_012_040_001399	又西有北阿鎮。
HCH_012_040_001400	東有三垛鎮。
HCH_012_040_001401	西南距府百二十里。
HCH_012_040_001402	領縣二：寶應州北。
HCH_012_040_001403	西有運河，又有汜光、白馬、射陽等湖。
HCH_012_040_001404	南有槐樓鎮、西南有衡陽二巡檢司。
HCH_012_040_001405	興化州東。
HCH_012_040_001406	南有運河。
HCH_012_040_001407	東有得勝湖。
HCH_012_040_001408	東北有安豐巡檢司。
HCH_012_040_001409	又東北有鹽場。
HCH_012_040_001410	泰州洪武初，以州治海陵縣省入。
HCH_012_040_001411	東濱海。
HCH_012_040_001412	南濱江。
HCH_012_040_001413	西有運河。
HCH_012_040_001414	東北有西溪鎮、北有寧鄉鎮、東南有海安鎮三巡檢司。
HCH_012_040_001415	西距府百二十里。
HCH_012_040_001416	領縣一：如皋州東南。
HCH_012_040_001417	大江在縣南。
HCH_012_040_001418	運河在縣北。
HCH_012_040_001419	東有掘港、南有石莊、北有西場三巡檢司。
HCH_012_040_001420	又東南有白浦鎮。
HCH_012_040_001421	通州洪武初，以州治靜海縣省入。
HCH_012_040_001422	南有狼山，臨大江，有狼山巡檢司。
HCH_012_040_001423	東南濱海，舊有海門島及布州夾。
HCH_012_040_001424	西有運鹽河。
HCH_012_040_001425	又東北有石港巡檢司。
HCH_012_040_001426	城南有利豐監，宋置。
HCH_012_040_001427	西距府四百里。
HCH_012_040_001428	領縣一：海門州東。
HCH_012_040_001429	舊治禮安鄉圮於海，正德七年徙治餘中場。
HCH_012_040_001430	嘉靖二十四年八月遷於金沙場以避水患。
HCH_012_040_001431	海在東，大江於此入海。
HCH_012_040_001432	又西有張港、東有吳陵、又有安東壩上、又有白塔河四巡檢司。
HCH_012_040_001433	東南有料角嘴。
HCH_012_040_001434	蘇州府元平江路，屬江浙行省。
HCH_012_040_001435	太祖吳元年九月曰蘇州府。
HCH_012_040_001436	領州一，縣七。
HCH_012_040_001437	西距南京五百八十八里。
HCH_012_040_001438	洪武二十六年編戶四十九萬一千五百一十四，口二百三十五萬五千三十。
HCH_012_040_001439	弘治四年，戶五十三萬五千四百九，口二百四萬八千九十七。
HCH_012_040_001440	萬曆六年，戶六十萬七百五十五，口二百一萬一千九百八十五。
HCH_012_040_001441	吳倚。
HCH_012_040_001442	西有姑蘇山。
HCH_012_040_001443	西南有橫山，又有穹窿、光福等山。
HCH_012_040_001444	又有太湖。
HCH_012_040_001445	湖縱廣三百八十三里，周三萬六千頃，跨蘇、常、嘉、湖四府之境，亦曰具區，亦曰五湖，中有包山、莫釐山。
HCH_012_040_001446	又南有吳淞江，亦曰松江，亦曰鬆陵江，亦曰笠澤，自太湖分流，東入海。
HCH_012_040_001447	又西有運河。
HCH_012_040_001448	西南有木瀆、東山、甪頭三巡檢司。
HCH_012_040_001449	又有橫金巡檢司，後廢。
HCH_012_040_001450	長洲倚。
HCH_012_040_001451	西北有虎丘山，又有陽山，又有長蕩、陽城等湖。
HCH_012_040_001452	東有婁江，源出太湖。
HCH_012_040_001453	東南有運河。
HCH_012_040_001454	又北有吳塔、東南有陳墓二巡檢司。
HCH_012_040_001455	又東有唐湖巡檢司。
HCH_012_040_001456	後廢。
HCH_012_040_001457	吳江府東南。
HCH_012_040_001458	元吳江州。
HCH_012_040_001459	洪武二年降爲縣。
HCH_012_040_001460	西濱太湖。
HCH_012_040_001461	東有吳淞江，又有運河。
HCH_012_040_001462	又東南有白蜆江。
HCH_012_040_001463	又東有同里，南有平望，西南有震澤，東南有簡村、汾湖五巡檢司。
HCH_012_040_001464	又東有長橋、西南有瀾溪、東南有因瀆三巡檢司，後廢。
HCH_012_040_001465	崑山府東。
HCH_012_040_001466	元崑山州。
HCH_012_040_001467	洪武二年降爲縣。
HCH_012_040_001468	南有吳淞江。
HCH_012_040_001469	西有女婁江。
HCH_012_040_001470	東南有澱山湖。
HCH_012_040_001471	又南有千墩浦，東有夏駕浦，皆注於婁江。
HCH_012_040_001472	東南有石浦巡檢司，後移於千墩浦口。
HCH_012_040_001473	西北有巴城巡檢司，後移於縣西之真義鎮。
HCH_012_040_001474	常熟府北。
HCH_012_040_001475	元常熟州。
HCH_012_040_001476	洪武二年降爲縣。
HCH_012_040_001477	萬曆末避諱曰嘗熟。
HCH_012_040_001478	西北有虞山。
HCH_012_040_001479	北有福山，下臨大江。
HCH_012_040_001480	有福山浦，又東有白茆浦，東北有許浦，西北有奚浦、黃泗浦，爲五大浦。
HCH_012_040_001481	皆分太湖西北之水，注於大江。
HCH_012_040_001482	南有運河。
HCH_012_040_001483	有許浦、白茅、黃泗、福山四巡檢司。
HCH_012_040_001484	嘉定府東。
HCH_012_040_001485	元嘉定州。
HCH_012_040_001486	洪武二年降爲縣。
HCH_012_040_001487	東濱海，南有運河。
HCH_012_040_001488	又南有吳淞江，東南有白鶴江，西南有青龍江，南有蟠龍江，皆匯吳淞江入海。
HCH_012_040_001489	又劉河在縣北，即婁江也。
HCH_012_040_001490	又東南有吳淞江守禦千戶所，洪武十九年置。
HCH_012_040_001491	又有寶山守禦千戶所，本協守吳淞中千戶所，嘉靖三十六年置，萬曆五年更名。
HCH_012_040_001492	又東有顧徑、東南有江灣二巡檢司。
HCH_012_040_001493	又西南有吳塘、南有南翔二巡檢司，後廢。
HCH_012_040_001494	太倉州本太倉衛，太祖吳元年四月置。
HCH_012_040_001495	弘治十年正月置州於衛城，析崑山、常熟、嘉定三縣地益之。
HCH_012_040_001496	東濱海。
HCH_012_040_001497	海口有鎮海衛，洪武十二年十月置，後移於太倉衛城。
HCH_012_040_001498	南有劉河，其入海處曰劉河口，有劉家港巡檢司。
HCH_012_040_001499	北有七鴉浦，亦東入海。
HCH_012_040_001500	又東北有甘草巡檢司。
HCH_012_040_001501	又有唐茜涇口巡檢司，後移於東花浦口，尋廢。
HCH_012_040_001502	又有茜涇巡檢司，亦廢。
HCH_012_040_001503	西距府一百零五里。
HCH_012_040_001504	領縣一：崇明州東。
HCH_012_040_001505	元崇明州，屬揚州路。
HCH_012_040_001506	洪武二年降爲縣。
HCH_012_040_001507	八年改屬蘇州府。
HCH_012_040_001508	弘治十年正月來屬。
HCH_012_040_001509	舊治在縣東北曰東沙，爲海所圮。
HCH_012_040_001510	永樂十九年、嘉靖八年、三十三年三遷，亦俱圮於水。
HCH_012_040_001511	萬曆十三年遷於平洋沙巡檢司，即今治也。
HCH_012_040_001512	四面環海。
HCH_012_040_001513	西有西沙、北有三沙二巡檢司。
HCH_012_040_001514	松江府元直隸江浙行省。
HCH_012_040_001515	太祖吳元年正月因之。
HCH_012_040_001516	領縣三。
HCH_012_040_001517	西北距南京七百七十里。
HCH_012_040_001518	洪武二十六年編戶二十四萬九千九百五十，口一百二十一萬九千九百三十七。
HCH_012_040_001519	弘治四年，戶二十萬五百二十，口六十二萬七千三百一十三。
HCH_012_040_001520	萬曆六年，戶二十一萬八千三百五十九，口四十八萬四千四百一十四。
HCH_012_040_001521	華亭倚。
HCH_012_040_001522	崑山在縣西北。
HCH_012_040_001523	東南濱海，有鹽場。
HCH_012_040_001524	又西北有澱山湖，西有泖湖。
HCH_012_040_001525	東南有黃浦，西北有趙屯、大盈、顧會、松子、磐龍等五浦，俱會吳淞江入海。
HCH_012_040_001526	東南有金山衛，又東有青村守禦千戶所，俱洪武二十年二月置。
HCH_012_040_001527	西北有小貞村、西南有泖橋二巡檢司。
HCH_012_040_001528	南有金山巡檢司，本治張堰，後徙胡家巷。
HCH_012_040_001529	東南有南橋巡檢司，本戚睦，後徙治更名。
HCH_012_040_001530	又有陶宅巡檢司，後廢。
HCH_012_040_001531	又東南有柘林鎮，嘉靖間築城戍守。
HCH_012_040_001532	上海府東北。
HCH_012_040_001533	東濱海，有鹽場。
HCH_012_040_001534	北有吳淞江，有巡檢司。
HCH_012_040_001535	東有黃浦，有巡檢司。
HCH_012_040_001536	東南有南匯觜守禦中、後千戶所，洪武二十年二月置。
HCH_012_040_001537	又有三林莊巡檢司。
HCH_012_040_001538	又有南蹌巡檢司，後廢。
HCH_012_040_001539	嘉靖三十六年築城曰川沙堡，置兵戍守焉。
HCH_012_040_001540	青浦府西北。
HCH_012_040_001541	嘉靖二十一年四月以今縣東北之新徑巡檢司置，析華亭、上海二縣地益之。
HCH_012_040_001542	三十二年廢爲青龍鎮，仍置新徑巡檢司。
HCH_012_040_001543	萬曆元年復於唐行鎮置縣，即今治也。
HCH_012_040_001544	北有吳淞江。
HCH_012_040_001545	東有顧會等浦。
HCH_012_040_001546	西南有澱山湖。
HCH_012_040_001547	又西有安莊鎮，殿山巡檢司置於此。
HCH_012_040_001548	常州府元常州路，屬江浙行省。
HCH_012_040_001549	太祖丁酉年三月丁亥曰長春府，己丑曰常州府。
HCH_012_040_001550	萬曆末，避諱曰嘗州府。
HCH_012_040_001551	領縣五。
HCH_012_040_001552	西北距南京三百六十里。
HCH_012_040_001553	洪武二十六年編戶一十五萬二千一百六十四，口七十七萬五千五百一十三。
HCH_012_040_001554	弘治四年，戶五萬一百三十一，口二十二萬八千三百六十三。
HCH_012_040_001555	萬曆六年，戶二十五萬四千四百六十，口一百萬二千七百七十九。
HCH_012_040_001556	武進倚。
HCH_012_040_001557	東爲晉陵縣，元時同治郭內。
HCH_012_040_001558	太祖丁酉年三月改武進縣曰永定，晉陵縣曰京臨。
HCH_012_040_001559	尋以京臨省入永定。
HCH_012_040_001560	壬寅年八月仍改永定曰武進。
HCH_012_040_001561	東南有馬跡山，濱太湖。
HCH_012_040_001562	北有大江。
HCH_012_040_001563	西有孟瀆，又有得勝新河，俱北入江。
HCH_012_040_001564	南有運河。
HCH_012_040_001565	西南有滆湖。
HCH_012_040_001566	與宜興界。
HCH_012_040_001567	東有陽湖，與無錫界。
HCH_012_040_001568	西有魏村閘守禦百戶所，洪武三年置。
HCH_012_040_001569	又有奔牛巡檢司。
HCH_012_040_001570	西北有小河巡檢司，舊在鄭港，後移小河寨，尋復遷孟河城。
HCH_012_040_001571	北有澡江巡檢司，舊在江北沙新河，後遷縣北於塘村。
HCH_012_040_001572	無錫府東。
HCH_012_040_001573	元無錫州。
HCH_012_040_001574	洪武二年四月降爲縣。
HCH_012_040_001575	西有慧山，梁溪出焉，西南入太湖，其別阜曰錫山。
HCH_012_040_001576	西南有太湖。
HCH_012_040_001577	東南有運河。
HCH_012_040_001578	又西北有高橋、東南有望亭二巡檢司。
HCH_012_040_001579	宜興府南。
HCH_012_040_001580	元宜興州。
HCH_012_040_001581	太祖戊戌年十月曰建寧州，尋復曰宜興州。
HCH_012_040_001582	洪武二年降爲縣。
HCH_012_040_001583	西南有荊南山，又有國山，又有龍池山。
HCH_012_040_001584	又東南有香蘭山，臨太湖。
HCH_012_040_001585	又有唐貢山，產茶。
HCH_012_040_001586	西北有掞山，有長蕩湖。
HCH_012_040_001587	北有運河。
HCH_012_040_001588	南有荊溪。
HCH_012_040_001589	西南有百瀆，疏荊溪之下流，注於太湖，後多堙廢。
HCH_012_040_001590	東北有下邾、北有鍾溪、東南有湖㳇、西南有張渚四巡檢司。
HCH_012_040_001591	江陰府西北。
HCH_012_040_001592	元江陰州，直隸江浙行省。
HCH_012_040_001593	太祖甲辰年曰連洋州，尋復曰江陰州。
HCH_012_040_001594	吳元年四月降爲縣，來屬。
HCH_012_040_001595	北有君山，濱大江。
HCH_012_040_001596	西南又有秦望山。
HCH_012_040_001597	東有香山。
HCH_012_040_001598	南有運河。
HCH_012_040_001599	又申浦在西，又有黃田等港，俱注大江。
HCH_012_040_001600	東有石頭港巡檢司。
HCH_012_040_001601	西有利港巡檢司，後移於夏港。
HCH_012_040_001602	又東有範港巡檢司，後廢。
HCH_012_040_001603	又有楊舍鎮，嘉靖三十七年築城。
HCH_012_040_001604	靖江府東北。
HCH_012_040_001605	成化七年閏九月以江陰縣馬馱沙置。
HCH_012_040_001606	大江舊分二派，繞縣南北。
HCH_012_040_001607	天啓後，潮沙壅積，縣北大江漸爲平陸。
HCH_012_040_001608	西南有新港巡檢司。
HCH_012_040_001609	鎮江府元鎮江路，屬江浙行省。
HCH_012_040_001610	太祖丙申年三月曰江淮府，十二月曰鎮江府。
HCH_012_040_001611	領縣三。
HCH_012_040_001612	西距南京城二百里。
HCH_012_040_001613	洪武二十六年編戶八萬七千三百六十四，口五十二萬二千三百八十三。
HCH_012_040_001614	弘治四年，戶六萬八千三百四十四，口一十七萬一千五百八。
HCH_012_040_001615	萬曆六年，戶六萬九千三十九，口一十六萬五千五百八十九。
HCH_012_040_001616	丹徒倚。
HCH_012_040_001617	北有北固山，濱大江。
HCH_012_040_001618	江中西北有金山，東北有焦山。
HCH_012_040_001619	又城西江口有蒜山。
HCH_012_040_001620	又京峴山在東，圌山在北，濱江爲險。
HCH_012_040_001621	又南有運河。
HCH_012_040_001622	西有高資鎮、東北有安巷、東有丹徒鎮、北有姜家觜四巡檢司。
HCH_012_040_001623	丹陽府東南。
HCH_012_040_001624	北濱大江，又有練湖。
HCH_012_040_001625	南有運河。
HCH_012_040_001626	又東有呂城鎮巡檢司，尋移鎮東。
HCH_012_040_001627	又有包港巡檢司，尋移顧巷。
HCH_012_040_001628	金壇府東南。
HCH_012_040_001629	西有茅山。
HCH_012_040_001630	東南有長蕩湖，一名洮湖，有湖溪巡檢司。
HCH_012_040_001631	北有白鶴溪。
HCH_012_040_001632	廬州府元廬州路，屬河南江北行省。
HCH_012_040_001633	太祖甲辰年七月爲府，置江淮中書行省於此，尋罷。
HCH_012_040_001634	領州二，縣六。
HCH_012_040_001635	距南京五百十里。
HCH_012_040_001636	洪武二十六年編戶四萬八千七百二十，口三十六萬七千二百。
HCH_012_040_001637	弘治四年，戶三萬六千五百四十八，口四十八萬六千五百四十九。
HCH_012_040_001638	萬曆六年，戶四萬七千三百七十三，口六十二萬二千六百九十八。
HCH_012_040_001639	合肥倚。
HCH_012_040_001640	西有雞鳴山，肥水所出，東南流入巢湖。
HCH_012_040_001641	西南有紫篷山。
HCH_012_040_001642	東有浮槎山、橫山。
HCH_012_040_001643	又東南有四頂山，俯瞰巢湖，湖周四百餘里，中有姥山、孤山。
HCH_012_040_001644	又東北有滁水，源出龍潭，下流至六合縣入江。
HCH_012_040_001645	又東有店阜河，南有三汊河，皆入巢湖。
HCH_012_040_001646	東北有梁縣，洪武初省。
HCH_012_040_001647	西南有廬鎮關巡檢司，後徙於縣東之石梁鎮。
HCH_012_040_001648	舒城府西南。
HCH_012_040_001649	西南有龍眠山，與桐城縣界。
HCH_012_040_001650	西有三角山。
HCH_012_040_001651	又巢湖在東。
HCH_012_040_001652	又南有北峽關，亦與桐城界。
HCH_012_040_001653	廬江府南。
HCH_012_040_001654	元屬無爲州。
HCH_012_040_001655	洪武初，改屬府。
HCH_012_040_001656	東北有冶父山。
HCH_012_040_001657	東有巢湖。
HCH_012_040_001658	東南有黃陂湖。
HCH_012_040_001659	西有冷水關，有巡檢司。
HCH_012_040_001660	無爲州洪武中，以州治無爲縣省入。
HCH_012_040_001661	大江在東南。
HCH_012_040_001662	東有濡須水，一名天河，自巢湖分流，東北入江。
HCH_012_040_001663	又東有奧龍河鎮，東南有泥汊河鎮、土橋河鎮，北有黃落河鎮四巡檢司。
HCH_012_040_001664	西北距府二百八十里。
HCH_012_040_001665	領縣一：巢州北。
HCH_012_040_001666	東南有七寶山，與含山縣濡須山相對峙，有西關在其上。
HCH_012_040_001667	巢湖在西，西北有柘皋河流入焉。
HCH_012_040_001668	南有石梁河，即濡須上流也，東南有清溪入焉。
HCH_012_040_001669	西南有焦湖巡檢司。
HCH_012_040_001670	六安州洪武四年二月屬中都臨濠府，以州治六安縣省入。
HCH_012_040_001671	十五年改屬。
HCH_012_040_001672	西有淠水，亦曰沘水，下流至壽州入淮。
HCH_012_040_001673	西南有麻埠巡檢司，後廢。
HCH_012_040_001674	又西北有和尚灘巡檢司，弘治間屬霍山縣，後移於新店，仍來屬。
HCH_012_040_001675	東距府百八十里。
HCH_012_040_001676	領縣二：英山州西南。
HCH_012_040_001677	縣治本直河鄉，崇禎十二年徙於西北之章山，十六年又遷於北境之添樓鄉。
HCH_012_040_001678	多雲山在西北，接湖廣羅田縣界。
HCH_012_040_001679	西有英山河，湖廣浠水之上源也。
HCH_012_040_001680	霍山州西南。
HCH_012_040_001681	本六安州故埠鎮巡檢司，弘治二年改爲縣。
HCH_012_040_001682	南有霍山，亦曰天柱山，亦曰衡山，又謂之南嶽也。
HCH_012_040_001683	東南有鐵爐山，多鐵冶。
HCH_012_040_001684	又西南有四十八盤山，又淠河在東，源出霍山，下流至壽州入淮。
HCH_012_040_001685	西北有千羅畈、西南有上土市二巡檢司。
HCH_012_040_001686	安慶府元安慶路，屬河南江北行省。
HCH_012_040_001687	太祖辛丑年八月曰寧江府，壬寅年四月曰安慶府。
HCH_012_040_001688	領縣六。
HCH_012_040_001689	北距南京六百五十里。
HCH_012_040_001690	洪武二十六年編戶五萬五千五百七十三，口四十二萬二千八百四。
HCH_012_040_001691	弘治四年，戶四萬六千五十，口六十一萬六千八十九。
HCH_012_040_001692	萬曆六年，戶四萬六千六百九，口五十四萬三千四百七十六。
HCH_012_040_001693	懷寧倚。
HCH_012_040_001694	南濱大江，西有皖水流入焉，曰皖口。
HCH_012_040_001695	西北有觀音港巡檢司。
HCH_012_040_001696	東有長風沙鎮巡檢司。
HCH_012_040_001697	桐城府東北。
HCH_012_040_001698	東有浮山，一名浮度山。
HCH_012_040_001699	西北有龍眠山。
HCH_012_040_001700	北有北峽山，與舒城界，有北峽關巡檢司。
HCH_012_040_001701	又北有西峽山，亦謂之南峽石，對壽州峽石則此爲南也。
HCH_012_040_001702	東南濱江，有樅陽河，自西北流入焉。
HCH_012_040_001703	又東有六百丈、東南有馬踏石、源子港三巡檢司。
HCH_012_040_001704	潛山府西北。
HCH_012_040_001705	元末廢。
HCH_012_040_001706	洪武初復置。
HCH_012_040_001707	西北有灊山，亦曰天柱山，亦曰皖公山，即霍山也，皖水出焉，別流曰灊水，合流注大江。
HCH_012_040_001708	又有天堂山，後部河所出，有天堂寨巡檢司。
HCH_012_040_001709	太湖府西北。
HCH_012_040_001710	西北有司空山。
HCH_012_040_001711	城西有馬路河，即後部河之下流也，東合於灊水。
HCH_012_040_001712	又西北有南陽、白沙，東北有小池，北有後部四巡檢司。
HCH_012_040_001713	宿松府西南。
HCH_012_040_001714	東有馬頭山。
HCH_012_040_001715	又小姑山在縣南大江中，與江西彭澤縣界，有小姑山巡檢司。
HCH_012_040_001716	又西南有歸林灘、南有涇江口二巡檢司。
HCH_012_040_001717	望江府西南。
HCH_012_040_001718	南濱江。
HCH_012_040_001719	東有雷池，南入江，曰雷江口，亦曰雷港，有巡檢司。
HCH_012_040_001720	西有泊湖，北有慈湖，東北有漳湖，下流俱入江。
HCH_012_040_001721	又西南有楊灣鎮巡檢司。
HCH_012_040_001722	太平府元太平路，屬江浙行省江東道。
HCH_012_040_001723	太祖乙未年六月爲府。
HCH_012_040_001724	領縣三。
HCH_012_040_001725	東距南京百三十五里。
HCH_012_040_001726	洪武二十六年編戶三萬九千二百九十，口二十五萬九千九百三十七。
HCH_012_040_001727	弘治四年，戶二萬九千四百六十六，口一十七萬三千六百九十九。
HCH_012_040_001728	萬曆六年，戶三萬三千二百六十二，口一十七萬六千八十五。
HCH_012_040_001729	當塗倚。
HCH_012_040_001730	城北有采石山，一名牛渚山，臨大江。
HCH_012_040_001731	西南有博望山，與和州梁山夾江相對，亦曰東梁山。
HCH_012_040_001732	又丹陽湖在東南，周三百餘里，分流蕪湖，西入江。
HCH_012_040_001733	南有姑熟溪，又有黃池河，西南有大信河，北有慈湖，皆入大江。
HCH_012_040_001734	有采石、大信二巡檢司。
HCH_012_040_001735	蕪湖府西南。
HCH_012_040_001736	西南有戰鳥山，在大江中，西北有七磯。
HCH_012_040_001737	南有魯明江，一名魯港，又有石洈河，俱注大江。
HCH_012_040_001738	西有河口鎮巡檢司，後移於魯港鎮。
HCH_012_040_001739	繁昌府西南。
HCH_012_040_001740	西北有磕山，在江中。
HCH_012_040_001741	又三山磯在東北，濱江。
HCH_012_040_001742	又西有荻港，入大江。
