HCH_012_040_000000	自黃帝畫野置監，唐、虞分州建牧，沿及三代，下逮宋、元，廢興因革此類推，萬物無所差別，「天與地卑，山與澤平」。
HCH_012_040_000001	其學說與，前史備矣。
HCH_012_040_000002	明太祖奮起淮右，首定金陵，西克湖、湘，東兼吳、會，然後遣將北伐，並山東，收河南，進取幽、燕，分軍四出，芟除秦、晉，訖於嶺表。
HCH_012_040_000003	最後削平巴、蜀，收復滇南。
HCH_012_040_000004	禹跡所奄，盡入版圖。
HCH_012_040_000005	近古以來，所未有也。
HCH_012_040_000006	洪武初，建都江表，革元中書省，以京畿應天諸府直隸京師。
HCH_012_040_000007	後乃盡革行中書省，置十三布政使司，分領天下府州縣及羈縻諸司。
HCH_012_040_000008	又置十五都指揮使司以領衛所番漢諸軍，其邊境海疆則增置行都指揮使司，而於京師建五軍都督府，俾外都指揮使司各以其方附焉。
HCH_012_040_000009	成祖定都北京，北倚羣山，東臨滄海，南面而臨天下，乃以北平爲直隸，又增設貴州、交址二布政使司。
HCH_012_040_000010	仁、宣之際，南交屢叛，旋復棄之外徼。
HCH_012_040_000011	終明之世，爲直隸者二：曰京師，曰南京。
HCH_012_040_000012	爲布政使司者十三：曰山東，曰山西，曰河南，曰陝西，曰四川，曰湖廣，曰浙江，曰江西，曰福建，曰廣東，曰廣西，曰雲南，曰貴州。
HCH_012_040_000013	其分統之府百有四十，州百九十有三，縣千一百三十有八。
HCH_012_040_000014	羈縻之府十有九，州四十有七，縣六。
HCH_012_040_000015	編里六萬九千五百五十有六。
HCH_012_040_000016	而兩京都督府分統都指揮使司十有六，行都指揮使司五，曰北平、曰山西、曰陝西、曰四川、曰福建，留守司二。
HCH_012_040_000017	所屬衛四百九十有三，所二千五百九十有三，守禦千戶所三百一十有五。
HCH_012_040_000018	又土官宣慰司十有一，宣撫司十，安撫司二十有二，招討司一，長官司一百六十有九，蠻夷長官司五。
HCH_012_040_000019	其邊陲要地稱重鎮者凡九：曰遼東，曰薊州，曰宣府，曰大同，曰榆林，曰寧夏，曰甘肅，曰太原，曰固原。
HCH_012_040_000020	皆分統衛所關堡，環列兵戎。
HCH_012_040_000021	綱維佈置，可謂深且固矣。
HCH_012_040_000022	計明初封略，東起朝鮮，西據吐番，南包安南，北距大磧，東西一萬一千七百五十里，南北一萬零九百四里。
HCH_012_040_000023	自成祖棄大寧，徙東勝，宣宗遷開平於獨石，世宗時復棄哈密、河套，則東起遼海，西至嘉峪，南至瓊、崖，北抵雲、朔，東西萬餘里，南北萬里。
HCH_012_040_000024	其聲教所訖，歲時納贄，而非命吏置籍，侯尉羈屬者，不在此數。
HCH_012_040_000025	嗚呼盛矣！
HCH_012_040_000026	論者謂交趾之棄，未爲失圖，而開平近遷，則守衛益薄，雖置萬全都指揮使司，不足以鎮伏山後諸部，故再傳而有土木之變。
HCH_012_040_000027	然睿皇自以失律蒙塵，非由經制未備。
HCH_012_040_000028	景帝任賢才，修守禦，國步未移，乘輿旋復。
HCH_012_040_000029	由是觀之，三衛者，一隅之隘，而無關大計也審矣。
HCH_012_040_000030	至其季世，流寇首禍於西陲，浸尋蔓延，中原爲之糜爛。
HCH_012_040_000031	金湯之固不足以制土崩，皈宇之廣不足以成掎角。
HCH_012_040_000032	疆圉不蹙於曩時，形勝無虧於初盛，而強弱懸殊，興亡異數者，天降喪亂，昏椓內訌，人事之乖，而非地利之失也。
HCH_012_040_000033	語曰：「在德不在險」，詎不信夫！
HCH_012_040_000034	今考其陞降之差，沿革之故，具著於篇。
HCH_012_040_000035	作《地理志》。
HCH_012_040_000036	京師《禹貢》冀、兗、豫三州之域，元直隸中書省。
HCH_012_040_000037	洪武元年四月分屬河南、山東兩行中書省。
HCH_012_040_000038	二年三月置北平等處行中書省，治北平府。
HCH_012_040_000039	先屬山東、河南者皆復其舊。
HCH_012_040_000040	領府八，州三十七，縣一百三十六。
HCH_012_040_000041	八月置燕山都衛。
HCH_012_040_000042	與行中書省同治。
HCH_012_040_000043	八年十月改都衛爲北平都指揮使司。
HCH_012_040_000044	九年六月改行中書省爲承宣布政使司。
HCH_012_040_000045	永樂元年正月建北京於順天府，稱爲「行在」。
HCH_012_040_000046	二月罷北平布政使司，以所領直隸北京行部；罷北平都指揮使司，以所領直隸北京留守行後軍都督府。
HCH_012_040_000047	十九年正月改北京爲京師。
HCH_012_040_000048	罷北京留守行後軍都督府，直隸後軍都督府。
HCH_012_040_000049	衛所有實土者附見，無實土者不載。
HCH_012_040_000050	罷北京行部，直隸六部。
HCH_012_040_000051	洪熙初，仍稱行在。
HCH_012_040_000052	正統六年十一月罷稱行在，定爲京師。
HCH_012_040_000053	府八，直隸州二，屬州十七，縣一百一十六。
HCH_012_040_000054	爲里三千二百三十有奇。
HCH_012_040_000055	府州縣建置沿革，俱自元始。
HCH_012_040_000056	其沿革年月已見《元史志》者，不載。
HCH_012_040_000057	其未見《元史志》及明改元舊，並新增、新廢者，悉書。
HCH_012_040_000058	北至宣府，外爲邊地。
HCH_012_040_000059	東至遼海，與山東界。
HCH_012_040_000060	南至東明，與山東、河南界。
HCH_012_040_000061	西至阜平，與山西界。
HCH_012_040_000062	洪武二十六，年編戶三十三萬四千七百九十二，口一百九十二萬六千五百九十五。
HCH_012_040_000063	順天府元大都路，直隸中書省。
HCH_012_040_000064	洪武元年八月改爲北平府。
HCH_012_040_000065	十月屬山東行省。
HCH_012_040_000066	二年三月改屬北平。
HCH_012_040_000067	三年四月建燕王府。
HCH_012_040_000068	永樂元年正月陞爲北京，改府爲順天府。
HCH_012_040_000069	永樂四年閏七月詔建北京宮殿，修城垣。
HCH_012_040_000070	十九年正月告成。
HCH_012_040_000071	宮城周六里一十六步，亦曰紫禁城。
HCH_012_040_000072	門八：正南第一重曰承天，第二重曰端門，第三重曰午門，東曰東華，西曰西華，北曰玄武。
HCH_012_040_000073	宮城之外爲皇城，周一十八里有奇。
HCH_012_040_000074	門六：正南曰大明，東曰東安，西曰西安，北曰北安，大明門東轉曰長安左，西轉曰長安右。
HCH_012_040_000075	皇城之外曰京城，周四十五里。
HCH_012_040_000076	門九：正南曰麗正，正統初改曰正陽；南之左曰文明，後曰崇文；南之右曰順城，後曰宣武；東之南曰齊化，後曰朝陽；東之北曰東直；西之南曰平則，後曰阜成；西之北曰彰儀，後曰西直；北之東曰安定；北之西曰德勝。
HCH_012_040_000077	嘉靖三十二年築重城，包京城之南，轉抱東西角樓，長二十八里。
HCH_012_040_000078	門七：正南曰永定，南之左爲左安，南之右爲右安，東曰廣渠，東之北曰東便，西曰廣寧，西之北曰西便。
HCH_012_040_000079	領州五，縣二十二。
HCH_012_040_000080	弘治四年編戶一十萬五百一十八，口六十六萬九千三十三。
HCH_012_040_000081	萬曆六年，戶一十萬一千一百三十四，口七十萬六千八百六十一。
HCH_012_040_000082	大興倚。
HCH_012_040_000083	東南有大通河，亦日通惠河，水自玉河出，繞都城東南，下流至高麗莊，入白河，即元運河也。
HCH_012_040_000084	又有玉河，源自玉泉山，流經大內，出都城東南，注大通河。
HCH_012_040_000085	宛平倚。
HCH_012_040_000086	西山在西。
HCH_012_040_000087	有桑乾河出山西馬邑縣，流千里入京師宛平縣境。
HCH_012_040_000088	出盧溝橋下，又東南分爲二：一至通州，入白河；一至武清小直沽，合衛河，入於海。
HCH_012_040_000089	又有沙河、高梁河、清河，皆在西北。
HCH_012_040_000090	西又有沿河口守禦千戶所，有盧溝、王平口、石港口、齊家莊四巡檢司。
HCH_012_040_000091	良鄉府西南。
HCH_012_040_000092	有琉璃河，即古聖水，下流入澱。
HCH_012_040_000093	北有天津關。
HCH_012_040_000094	固安府西南。
HCH_012_040_000095	元固安州。
HCH_012_040_000096	洪武元年十二月降爲縣。
HCH_012_040_000097	西南有拒馬河，即淶水。
HCH_012_040_000098	源自代郡，下流合易水爲白溝，入三角澱。
HCH_012_040_000099	永清府南。
HCH_012_040_000100	南有拒馬河。
HCH_012_040_000101	東安府東南。
HCH_012_040_000102	元東安州，治在西。
HCH_012_040_000103	洪武元年十二月降爲縣。
HCH_012_040_000104	三年徙今治。
HCH_012_040_000105	南有鳳河，即桑乾分流，南入三角澱。
HCH_012_040_000106	香河府東南。
HCH_012_040_000107	元屬漷州。
HCH_012_040_000108	洪武十年二月省入州。
HCH_012_040_000109	十三年二月復置，改屬府。
HCH_012_040_000110	西有板罾口河，源出通州東之孤山，經縣界，入於白河。
HCH_012_040_000111	通州洪武初，以州治潞縣省入。
HCH_012_040_000112	西有通惠河，西南有渾河，即桑乾，至州東張家灣，俱合於白河。
HCH_012_040_000113	有張家灣巡檢司。
HCH_012_040_000114	西南有弘仁橋巡檢司。
HCH_012_040_000115	西距府四十里。
HCH_012_040_000116	領縣四：三河州東。
HCH_012_040_000117	北有泃河。
HCH_012_040_000118	又西有洳河，西南有鮑丘河，一名矣榆河，即東潞水，俱流入於泃河。
HCH_012_040_000119	西有泥窪鋪巡檢司，後移於夏店鋪。
HCH_012_040_000120	武清州南。
HCH_012_040_000121	元屬漷州。
HCH_012_040_000122	洪武十二年來屬。
HCH_012_040_000123	有三角澱，在縣南，即古之雍奴，周二百餘里，諸水所聚。
HCH_012_040_000124	有直沽，在縣東南，衛河、白河、丁字沽合流於此入海。
HCH_012_040_000125	有巡檢司。
HCH_012_040_000126	又東北有河西務、東南有楊村二巡檢司。
HCH_012_040_000127	漷縣州南。
HCH_012_040_000128	元漷州。
HCH_012_040_000129	洪武十四年二月降爲縣來屬。
HCH_012_040_000130	有漷河，一名新河，東入於白河，即盧溝之下流。
HCH_012_040_000131	寶坻州東南。
HCH_012_040_000132	元直隸大都路。
HCH_012_040_000133	洪武十年二月來屬。
HCH_012_040_000134	東有潮河。
HCH_012_040_000135	南有泃河。
HCH_012_040_000136	又縣東南有梁城守禦千戶所，建文二年，燕王置。
HCH_012_040_000137	有蘆臺巡檢司。
HCH_012_040_000138	霸州洪武初，以州治益津縣省入。
HCH_012_040_000139	拒馬河舊在北，後徙治南。
HCH_012_040_000140	又南有沙河。
HCH_012_040_000141	東有苑家口巡檢司。
HCH_012_040_000142	北距府二百十里。
HCH_012_040_000143	領縣三：文安州南少東。
HCH_012_040_000144	西有易水。
HCH_012_040_000145	東北有得勝、火燒等澱。
HCH_012_040_000146	大城州東南。
HCH_012_040_000147	東北有黃汊河，源自交河，分流至縣境，入三角澱。
HCH_012_040_000148	保定州南少西。
HCH_012_040_000149	洪武七年九月省入霸州。
HCH_012_040_000150	十三年十一月復置。
HCH_012_040_000151	玉帶河在北，東流入會通河。
HCH_012_040_000152	西南有磁河，東南與玉帶河合。
HCH_012_040_000153	涿州洪武初以州治范陽縣省入。
HCH_012_040_000154	西有獨鹿山。
HCH_012_040_000155	北有涿水，西北有挾河，合焉。
HCH_012_040_000156	南有範水。
HCH_012_040_000157	東北距府百四十里。
HCH_012_040_000158	領縣一。
HCH_012_040_000159	房山州北，少西。
HCH_012_040_000160	西有大房山。
HCH_012_040_000161	北有大安山。
HCH_012_040_000162	西南有青龍潭，其下流爲挾河，一名韓村河，至涿州與胡良河合。
HCH_012_040_000163	北有磁家務巡檢司。
HCH_012_040_000164	昌平州元昌平縣，直隸大都路。
HCH_012_040_000165	正德元年七月陞爲州，旋罷。
HCH_012_040_000166	八年復升爲州。
HCH_012_040_000167	舊治白浮圖城，景泰元年築永安城於東，三年遷縣治焉。
HCH_012_040_000168	北有天壽山，成祖以下陵寢咸在。
HCH_012_040_000169	東南有白浮山。
HCH_012_040_000170	西南有駐蹕山。
HCH_012_040_000171	又南有榆河，一名溫餘河，下流爲沙河，入於白河。
HCH_012_040_000172	又東南有鞏華城，嘉靖十九年築。
HCH_012_040_000173	東北有黃花鎮。
HCH_012_040_000174	弘治中，置渤海守禦千戶所於此，萬曆元年移於慕田峪，四年復故。
HCH_012_040_000175	西有鎮邊城，又有常峪城，俱正德十年五月築，各置守禦千戶所。
HCH_012_040_000176	又有白陽守禦千戶所，亦正德中置。
HCH_012_040_000177	西北有居庸關。
HCH_012_040_000178	南距府九十里。
HCH_012_040_000179	領縣三：順義州東少南。
HCH_012_040_000180	元順州。
HCH_012_040_000181	洪武元年十二月改爲順義縣，屬府。
HCH_012_040_000182	正德元年七月來屬。
HCH_012_040_000183	東有白河，西南有榆河，又有潮河，俱流入焉。
HCH_012_040_000184	懷柔州東北。
HCH_012_040_000185	洪武元年十一月省入檀州。
HCH_012_040_000186	十二月復分密雲、昌平二縣地置，屬府。
HCH_012_040_000187	正德元年七月來屬。
HCH_012_040_000188	東有黍谷山。
HCH_012_040_000189	西有白河。
HCH_012_040_000190	密雲州東北。
HCH_012_040_000191	元檀州，後置縣，爲州治。
HCH_012_040_000192	洪武元年十一月省縣入州。
HCH_012_040_000193	十二月復置縣，省州入焉，屬府。
HCH_012_040_000194	正德元年七月來屬。
HCH_012_040_000195	南有白檀山。
HCH_012_040_000196	西有白河。
HCH_012_040_000197	東有潮河。
HCH_012_040_000198	北有古北口，洪武十二年九月置守禦千戶所於此。
HCH_012_040_000199	三十年改爲密雲後衛。
HCH_012_040_000200	又有石塘嶺、牆子嶺等關。
HCH_012_040_000201	薊州洪武初，以州治漁陽縣省入。
HCH_012_040_000202	西北有盤山。
HCH_012_040_000203	東北有崆峒山。
HCH_012_040_000204	又泃水在北，沽河在南。
HCH_012_040_000205	州北有黃崖峪、寬佃峪等關。
HCH_012_040_000206	東又有石門鎮。
HCH_012_040_000207	西距府二百里。
HCH_012_040_000208	領縣四：玉田州東南。
HCH_012_040_000209	東北有無終山，又有徐無山。
HCH_012_040_000210	又東有梨河。
HCH_012_040_000211	北有浭水。
HCH_012_040_000212	東南有興州左屯衛，永樂元年自故開平境移置於此。
HCH_012_040_000213	豐潤州東南。
HCH_012_040_000214	南有沙河。
HCH_012_040_000215	西南有浭水。
HCH_012_040_000216	遵化州東。
HCH_012_040_000217	東北有五峯山。
HCH_012_040_000218	南有靈靈山及龍門峽。
HCH_012_040_000219	又東有灤河。
HCH_012_040_000220	西南有梨河。
HCH_012_040_000221	北有喜峯口、馬蘭峪、鬆亭等關。
HCH_012_040_000222	平谷州西北。
HCH_012_040_000223	洪武十年二月省入三河縣。
HCH_012_040_000224	十三年十一月復置。
HCH_012_040_000225	東南有泃河，又有洳河。
HCH_012_040_000226	西北有營州中屯衛，永樂元年自故龍山縣移置於此。
HCH_012_040_000227	又東有黃松峪關，與密雲縣將軍石關相接。
HCH_012_040_000228	保定府元保定路，直隸中書省。
HCH_012_040_000229	洪武元年九月爲府。
HCH_012_040_000230	十月屬河南分省。
HCH_012_040_000231	二年三月來屬。
HCH_012_040_000232	領州三，縣十七。
HCH_012_040_000233	東北距京師三百五十里。
HCH_012_040_000234	弘治四年編戶五萬六百三十九，口五十八萬二千四百八十二。
HCH_012_040_000235	萬曆六年，戶四萬五千七百一十三，口五十二萬五千八十三。
HCH_012_040_000236	清苑倚。
HCH_012_040_000237	北有徐河，一名大冊水，自滿城經縣北至安州，東入澱。
HCH_012_040_000238	又西有清苑河。
HCH_012_040_000239	又南有張登巡檢司，嘉靖十三年自滿城縣方順橋移置於此。
HCH_012_040_000240	滿城府西少北。
HCH_012_040_000241	洪武十年五月省入慶都縣。
HCH_012_040_000242	十三年十一月復置。
HCH_012_040_000243	北有徐河。
HCH_012_040_000244	南有方順河。
HCH_012_040_000245	安肅府北少東。
HCH_012_040_000246	元安肅州。
HCH_012_040_000247	洪武二年七月降爲縣。
HCH_012_040_000248	易水在北。
HCH_012_040_000249	曹河在南。
HCH_012_040_000250	徐河在西。
HCH_012_040_000251	西南又有鮑河。
HCH_012_040_000252	又西有遂州，元屬保定路。
HCH_012_040_000253	洪武初降爲縣。
HCH_012_040_000254	八年二月省。
HCH_012_040_000255	定興府北少東。
HCH_012_040_000256	元屬易州。
HCH_012_040_000257	洪武六年五月改屬府。
HCH_012_040_000258	西有拒馬河，即淶水也。
HCH_012_040_000259	又易水自西來，合焉，謂之白溝河。
HCH_012_040_000260	南有河陽巡檢司，後移於清苑縣界之固城鎮。
HCH_012_040_000261	新城府東北。
HCH_012_040_000262	元屬雄州。
HCH_012_040_000263	洪武初屬北平府。
HCH_012_040_000264	六年五月改屬府。
HCH_012_040_000265	南有白溝河。
HCH_012_040_000266	西南有巨河鎮巡檢司。
HCH_012_040_000267	雄府東北。
HCH_012_040_000268	元雄州。
HCH_012_040_000269	洪武二年七月省州治歸信縣入焉。
HCH_012_040_000270	七年四月降爲縣。
HCH_012_040_000271	北有白溝河。
HCH_012_040_000272	南有瓦濟河。
HCH_012_040_000273	容城府東北。
HCH_012_040_000274	元屬雄州。
HCH_012_040_000275	洪武七年四月省入州。
HCH_012_040_000276	十三年十一月復置，來屬。
HCH_012_040_000277	舊治在拒馬河南，景泰二年遷於河北。
HCH_012_040_000278	西有易水，又有濡水。
HCH_012_040_000279	唐府西，少南。
HCH_012_040_000280	西北有大茂山，即恆嶽也，東麓有嶽嶺口巡檢司。
HCH_012_040_000281	又唐河在西，源出恆山，流經定州曰滱水，下流合於南易水。
HCH_012_040_000282	又西北有倒馬關，有巡檢司，後移於縣西之橫河口。
HCH_012_040_000283	又有周家鋪、軍城鎮二巡檢司。
HCH_012_040_000284	慶都府西南，南有唐河。
HCH_012_040_000285	北有祁水。
HCH_012_040_000286	博野府南。
HCH_012_040_000287	舊治在今蠡縣界，直隸保定路。
HCH_012_040_000288	洪武元年從今治，改屬祁州。
HCH_012_040_000289	六年五月還屬府。
HCH_012_040_000290	西北有博水。
HCH_012_040_000291	南有唐河，亦曰滱水。
HCH_012_040_000292	又有永安鎮巡檢司，有鐵燈盞巡檢司。
HCH_012_040_000293	蠡府南少東。
HCH_012_040_000294	元蠡州，屬真定路。
HCH_012_040_000295	洪武二年七月來屬。
HCH_012_040_000296	八年正月降爲縣。
HCH_012_040_000297	楊村河在南，滋、沙、唐三河之下流也，俗亦謂之唐河。
HCH_012_040_000298	完府西。
HCH_012_040_000299	元完州。
HCH_012_040_000300	洪武二年七月降爲縣。
HCH_012_040_000301	西有伊祁山，祁水出焉，其下流爲方順河。
HCH_012_040_000302	祁州洪武二年七月以州治蒲陰縣省入。
HCH_012_040_000303	北有唐河，西南有滋河，至州東南合沙河，流入易水。
HCH_012_040_000304	北距府百二十里。
HCH_012_040_000305	領縣二：深澤州南少西。
HCH_012_040_000306	西有滋河。
HCH_012_040_000307	束鹿州東南。
HCH_012_040_000308	北有故城。
HCH_012_040_000309	今治，天啓二年所徙。
HCH_012_040_000310	滹沱河在南。
HCH_012_040_000311	又南有百天口巡檢司。
HCH_012_040_000312	安州洪武二年七月以州治葛城縣省入。
HCH_012_040_000313	七年降爲縣。
HCH_012_040_000314	十三年十一月復升爲州。
HCH_012_040_000315	北有易水，府境九河之水所匯也，下流至雄縣南，爲瓦濟河。
HCH_012_040_000316	西距府七十里。
HCH_012_040_000317	領縣二：高陽州南。
HCH_012_040_000318	元屬安州，洪武六年五月改屬府。
HCH_012_040_000319	尋屬蠡州。
HCH_012_040_000320	八年正月省入蠡縣。
HCH_012_040_000321	十三年十一月復置，還屬。
HCH_012_040_000322	故城在東，洪武三年圮於水，遷於今治。
HCH_012_040_000323	東有馬家河，其上流爲蠡縣之楊村河。
HCH_012_040_000324	新安州東少北。
HCH_012_040_000325	元直隸保定路。
HCH_012_040_000326	洪武七年七月省入安州。
HCH_012_040_000327	十三年十一月復置，來屬。
HCH_012_040_000328	西有長流河，一名長溝河，其上源爲鮑河。
HCH_012_040_000329	南有曹河，又有徐河，經縣南，合流爲溫義河，又南與長流河合，又東南入於瓦濟河。
HCH_012_040_000330	易州洪武初，以州治易縣省入。
HCH_012_040_000331	西南有五回山，雷溪出焉，徐河之上源也。
HCH_012_040_000332	西北有窮獨山，濡水所出。
HCH_012_040_000333	又南有易水，出州境之西山，與濡水並東流，而爲白溝河，所謂北易水也。
HCH_012_040_000334	又有雹水，一名鮑河，出縣西南，東南流爲長流河，所謂南易水也。
HCH_012_040_000335	西有紫荊關，洪武中置守禦千戶所於此。
HCH_012_040_000336	又有安座嶺、五回嶺、金陂鎮、奇峯口、塔崖口五巡檢司。
HCH_012_040_000337	南距府百二十里。
HCH_012_040_000338	領縣一：淶水州東北。
HCH_012_040_000339	東有淶水，亦曰拒馬河，源出山西代郡，下流合易水。
HCH_012_040_000340	北有乾河口、西北有黃兒莊二巡檢司。
HCH_012_040_000341	河間府元河間路，直隸中書省。
HCH_012_040_000342	洪武元年十月爲府，屬河南分省。
HCH_012_040_000343	二年三月來屬。
HCH_012_040_000344	領州二，縣十六。
HCH_012_040_000345	北距京師四百十里。
HCH_012_040_000346	弘治四年編戶四萬二千五百四十八，口三十七萬八千六百五十八。
HCH_012_040_000347	萬曆六年，戶四萬五千二十四，口四十一萬九千一百五十二。
HCH_012_040_000348	河間倚。
HCH_012_040_000349	西南有滹沱河。
HCH_012_040_000350	西有滱水。
HCH_012_040_000351	西南有景和鎮巡檢司。
HCH_012_040_000352	獻府南。
HCH_012_040_000353	元獻州。
HCH_012_040_000354	洪武初，省州治樂壽縣入焉。
HCH_012_040_000355	八年四月降爲縣。
HCH_012_040_000356	有滹沱河自代郡流入境，經縣南，至青縣合衛河達於海。
HCH_012_040_000357	有單家橋巡檢司。
HCH_012_040_000358	阜城府南。
HCH_012_040_000359	元屬景州。
HCH_012_040_000360	洪武七年改屬府。
HCH_012_040_000361	西北有胡盧河，即《禹貢》衡漳水。
HCH_012_040_000362	肅寧府西。
HCH_012_040_000363	中堡河在縣東。
HCH_012_040_000364	任丘府北少西。
HCH_012_040_000365	元屬莫州。
HCH_012_040_000366	洪武七年改屬府。
HCH_012_040_000367	西北有瓦濟河，下流爲五官澱，注於滹沱河。
HCH_012_040_000368	北有莫州，元治莫亭縣，屬河間路。
HCH_012_040_000369	洪武七年七月，州縣俱省。
HCH_012_040_000370	交河府東南。
HCH_012_040_000371	元屬獻州。
HCH_012_040_000372	洪武八年四月改屬府。
HCH_012_040_000373	十年五月省入獻縣。
HCH_012_040_000374	十三年十一月復置。
HCH_012_040_000375	東有衛河，源自衛輝，流入故城境，經縣東，過滄州，又東北至直沽入海，一名御河。
HCH_012_040_000376	又西北有高河，經縣南，合滹沱，謂之交河，下流入衛縣，以此名。
HCH_012_040_000377	又南有洚河。
HCH_012_040_000378	又東有泊頭鎮巡檢司。
HCH_012_040_000379	青府東北。
HCH_012_040_000380	元清州。
HCH_012_040_000381	洪武初，以州治會川縣省入。
HCH_012_040_000382	八年四月降爲縣，尋改清爲青。
HCH_012_040_000383	滹沱河自縣南流入衛，謂之岔河口。
HCH_012_040_000384	其支流經縣之北者，曰獨流河。
HCH_012_040_000385	興濟元屬清州。
HCH_012_040_000386	洪武初省。
HCH_012_040_000387	十三年復置，屬府。
HCH_012_040_000388	衛河在城西。
HCH_012_040_000389	靜海府東北。
HCH_012_040_000390	元曰靖海，屬清州。
HCH_012_040_000391	洪武初，更名。
HCH_012_040_000392	八年四月改屬北平府。
HCH_012_040_000393	十年五月來屬。
HCH_012_040_000394	縣北有小直沽，衛河自西來，與白河合，入於海。
HCH_012_040_000395	又有丁字沽、鹼水沽。
HCH_012_040_000396	又北有天津衛，永樂二年十一月置。
HCH_012_040_000397	寧津府東南。
HCH_012_040_000398	南有土河，自山東德州流入，又東入山東樂陵縣界。
HCH_012_040_000399	景州洪武初，以州治蓚縣省入。
HCH_012_040_000400	東有衛河。
HCH_012_040_000401	東北有胡盧河。
HCH_012_040_000402	又東有安陵、西北有宋門二巡檢司。
HCH_012_040_000403	又東北有李晏鎮。
HCH_012_040_000404	西北距府百八十五里。
HCH_012_040_000405	領縣三：吳橋州東，少南。
HCH_012_040_000406	西有衛河。
HCH_012_040_000407	東光州東北。
HCH_012_040_000408	洪武七年七月省入阜城縣。
HCH_012_040_000409	十三年十一月復置。
HCH_012_040_000410	南有衛河，又有胡盧河。
HCH_012_040_000411	故城州南少西。
HCH_012_040_000412	有衛河，自山東武城縣流入境。
HCH_012_040_000413	又西南有索盧枯河。
HCH_012_040_000414	滄州洪武初，以州治清池縣省入。
HCH_012_040_000415	舊治在東南。
HCH_012_040_000416	洪武二年五月徙於長蘆，即今治也。
HCH_012_040_000417	東濱海。
HCH_012_040_000418	西有衛河。
