HCH_009_124_000278	兵退，升遙授靜難軍節度使，尋改通遠軍節度使，授山東西路斡可必剌謀克，仍遣使賞賚，遍諭諸郡焉。
HCH_009_124_000279	是年冬，蝦蟆與鞏州元帥田瑞攻取會州。
HCH_009_124_000280	蝦蟆率騎兵五百皆被赭衲，蔽州之南山而下，夏人猝望之以為神。
HCH_009_124_000281	城上有舉手於懸風版者，蝦蟆射之，手與版俱貫。
HCH_009_124_000282	凡射死數百人。
HCH_009_124_000283	夏人震恐，乃出降。
HCH_009_124_000284	蓋會州為夏人所據近四年，至是複焉。
HCH_009_124_000285	正大初，田瑞據鞏州叛，詔陝西兩行省並力擊之。
HCH_009_124_000286	蝦蟆率眾先登，瑞開門突出，為其弟濟所殺，斬首五千餘級，以功遷遙授知鳳翔府事、本路兵馬都總管、元帥左都監、兼行蘭、會、洮、河元帥府事。
HCH_009_124_000287	六年九月，蝦蟆進西馬二匹，詔曰：「卿武藝超絕。此馬可充戰用，朕乘此豈能盡其力。既入進，即尚廄物也，就以賜卿。」
HCH_009_124_000288	仍賜金鼎一、玉兔鶻一，並所遣郭倫哥等物有差。
HCH_009_124_000289	天興二年，哀宗遷蔡州，慮孤城不能保，擬遷鞏昌，以粘葛完展為鞏昌行省。
HCH_009_124_000290	三年春正月，完展聞蔡已破，欲安眾心，城守以待嗣立者，乃遣人稱使者至自蔡，有旨宣諭。
HCH_009_124_000291	綏德州帥汪世顯者亦知蔡凶問，且嫉完展制己，欲發矯詔事，因以兵圖之，然懼蝦蟆威望，乃遣使約蝦蟆並力破鞏昌。
HCH_009_124_000292	使者至，蝦蟆謂之曰：「粘葛公奉詔為行省，號令孰敢不從。今主上受圍于蔡，擬遷鞏昌。國家危急之際，我輩既不能致死赴援，又不能葉眾奉迎，乃欲攻粘葛公，先廢遷幸之地，上至何所歸乎。汝帥若欲背國家，任自為之，何及於我。」
HCH_009_124_000293	世顯即攻鞏昌破之，劫殺完展，送款於大元，複遣使者二十余輩諭蝦蟆以禍福，不從。
HCH_009_124_000294	甲午春，金國已亡，西州無不歸順者，獨蝦蟆堅守孤城。
HCH_009_124_000295	丙申歲冬十月，大兵並力攻之。
HCH_009_124_000296	蝦蟆度不能支，集州中所有金銀銅鐵，雜鑄為砲以擊攻者，殺牛馬以食戰士，又自焚盧舍積聚，曰：「無至資兵。」
HCH_009_124_000297	日與血戰，而大兵亦不能卒拔。
HCH_009_124_000298	及軍士死傷者眾，乃命積薪於州廨，呼集家人及城中將校妻女，閉諸一室，將自焚之。
HCH_009_124_000299	蝦蟆之妾欲有所訴，立斬以徇。
HCH_009_124_000300	火既熾，率將士於火前持滿以待。
HCH_009_124_000301	城破，兵填委以入，鏖戰既久，士卒有弓盡矢絕者，挺身入火中。
HCH_009_124_000302	蝦蟆獨上大草積，以門扉自蔽，發二三百矢無不中者，矢盡，投弓劍於火自焚。
HCH_009_124_000303	城中無一人肯降者。
HCH_009_124_000304	蝦蟆死時年四十五。
HCH_009_124_000305	土人為立祠。
HCH_009_124_000306	完展字世昌。
HCH_009_124_000307	泰和三年策論進士。
HCH_009_124_000308	初為行省，以蠟丸為詔，期以天興二年九月集大軍與上會于饒峰關，出宋不意取興元。
HCH_009_124_000309	既而不果雲。
