HCH_013_029_000000	宣宗宣德十年春正月甲戌，帝崩于乾清宮。
HCH_013_029_000001	時皇太子方九歲，即皇帝位，詔以明年為正統元年。
HCH_013_029_000002	秋七月，命司禮太監王振偕文武大臣閱武于將臺。
HCH_013_029_000003	振矯旨以隆慶右衛指揮僉事紀廣為都督僉事。
HCH_013_029_000004	振，山西大同人。
HCH_013_029_000005	初侍上東宮，及即位，遂命掌司禮監，寵信之，呼為「先生」而不名，振遂擅作威福。
HCH_013_029_000006	時輔臣方議開經筵，而振乃導上閱武將臺。
HCH_013_029_000007	臺在朝陽門外近郊，集京營及諸衛武職試騎射，殿最之。
HCH_013_029_000008	紀廣者，常以衛卒守居庸，往投振門，大見親暱，遂奏廣第一，超擢之。
HCH_013_029_000009	宦官專政自此始。
HCH_013_029_000010	太皇太后張氏嘗御便殿，英國公張輔，大學士楊士奇、楊榮、楊溥，尚書胡濙被旨入朝。
HCH_013_029_000011	上東立，太皇太后顧上曰：「此五人，先朝所簡貽皇帝者，有行必與之計。非五人贊成，不可行也。」
HCH_013_029_000012	上受命。
HCH_013_029_000013	有頃，宣太監王振。
HCH_013_029_000014	振至，俯伏，太皇太后顏色頓異，曰：「汝侍皇帝起居多不律，今當賜汝死。」
HCH_013_029_000015	女官遂加刃振頸。
HCH_013_029_000016	英宗跪為之請，諸大臣皆跪。
HCH_013_029_000017	太皇太后曰：「皇帝年少，豈知此輩禍人家國？我聽皇帝暨諸大臣貸振，此後不可令干國事也。」
HCH_013_029_000018	英宗正統元年冬十月，上閱武于將臺，命諸將騎射，以三矢為率。
HCH_013_029_000019	受命者萬騎，惟駙馬都尉井源彎弓躍馬，三發三中。
HCH_013_029_000020	上大喜，撤上尊賜之。
HCH_013_029_000021	觀者皆曰：「往年王太監閱武，紀廣驟陞。今天子自來，顧一杯酒耶？」
HCH_013_029_000022	然竟無殊擢。
HCH_013_029_000023	四年冬十月，福建按察僉事廖謨杖死驛丞。
HCH_013_029_000024	丞故楊溥鄉里，僉事又士奇鄉里也。
HCH_013_029_000025	溥怨謨，論死。
HCH_013_029_000026	士奇欲坐謨因公殺人。
HCH_013_029_000027	爭議不決，請裁太后。
HCH_013_029_000028	振曰：「二人皆挾鄉故，抵命太重，因公太輕，〔宜〕對品降調。」
HCH_013_029_000029	太后從之，降謨同知。
HCH_013_029_000030	振言既售，自是漸摭朝事。
HCH_013_029_000031	五年春二月，命侍講學士馬愉、侍講曹鼐並直內閣，預機務。
HCH_013_029_000032	先是，王振語楊士奇曰：「朝廷事賴三位老先生。然三公亦高年倦勤矣，後當何如？」
HCH_013_029_000033	士奇曰：「老臣當盡瘁報國，死而後已。」
HCH_013_029_000034	榮曰：「先生安得為此言！吾輩老，無能效力，當以人事君耳。」
HCH_013_029_000035	振喜。
HCH_013_029_000036	越日，即薦曹鼐、苗衷、陳循、高穀等，遂次第擢用。
HCH_013_029_000037	士奇因尤榮，榮曰：「彼厭吾輩，吾輩縱自立，彼容能已乎？一旦內中出片紙，命某某入閣，則吾輩束手矣。今四人竟是我輩人，何傷也？」
HCH_013_029_000038	士奇是其言。
HCH_013_029_000039	六年夏四月，太監王振矯旨以工部郎中王佑為工部右侍郎。
HCH_013_029_000040	振既弄權，佑以諂媚超擢，與兵部侍郎徐晞極意逢迎之。
HCH_013_029_000041	佑貌美而無鬚，善伺候振顏色。
HCH_013_029_000042	一日，振問曰：「王侍郎何無鬚？」
HCH_013_029_000043	對曰：「老爺所無，兒安敢有！」
HCH_013_029_000044	聞者鄙之。
HCH_013_029_000045	五月，兵科給事中王永和劾掌錦衣衛事指揮馬順怙寵驕恣，欺罔不法。
HCH_013_029_000046	不報。
HCH_013_029_000047	順，王振黨也。
HCH_013_029_000048	八月，召山東提學僉事薛瑄為大理寺左少卿。
HCH_013_029_000049	初，王振問楊士奇曰：「吾鄉人誰可大用者？」
HCH_013_029_000050	士奇薦瑄，乃有是召。
HCH_013_029_000051	至京朝見，不謁振。
HCH_013_029_000052	振至閣下，問：「何不見薛少卿？」
HCH_013_029_000053	二楊為謝。
HCH_013_029_000054	振知李賢素與瑄厚，召至閣下，令致己意，且言振素問之。
HCH_013_029_000055	賢至朝房與瑄言，瑄曰：「厚德亦為是言乎？拜爵公朝，謝恩私室，吾不為也。」
HCH_013_029_000056	久之，振知其意，亦不復問。
HCH_013_029_000057	一日，會議東閣，公卿見振皆拜，一人獨立。
HCH_013_029_000058	振知其為瑄也，先揖之，且告罪。
HCH_013_029_000059	然自是益深銜之。
HCH_013_029_000060	十月，三殿工成，宴百官。
HCH_013_029_000061	故事，宦者雖寵，不得預王庭宴。
HCH_013_029_000062	是日，上使人視王先生何為。
HCH_013_029_000063	振方大怒，曰：「周公輔成王，我獨不可一坐乎！」
HCH_013_029_000064	使以聞，上為蹙然，乃命東華開中門，聽振出入。
HCH_013_029_000065	振至問故，曰：「詔命也。」
HCH_013_029_000066	至門外，百官皆望風拜，振悅。
HCH_013_029_000067	械戶部尚書劉中敷，侍郎吳璽、陳瑺于長安門。
HCH_013_029_000068	時以京城乏草，御用牛馬欲分牧民間。
HCH_013_029_000069	言官劾其紊制，王振命械之。
HCH_013_029_000070	閱十六日得釋，以侍郎王佐署部事。
HCH_013_029_000071	七年冬十月，太皇太后張氏崩。
HCH_013_029_000072	初，宣宗崩，上沖年踐祚，事皆白太后然後行。
HCH_013_029_000073	委用三楊，政歸臺閣。
HCH_013_029_000074	每數日，太后必遣中官入閣，問施行何事，具以聞。
HCH_013_029_000075	或王振自斷不付閣議者，必立召振責之。
HCH_013_029_000076	太后既崩，振益無所憚矣。
HCH_013_029_000077	太監王振盜去太祖禁內臣碑。
HCH_013_029_000078	洪武中，太祖鑒前代宦官之失，置鐵碑高三尺，上鑄「內臣不得干預政事」八字，在宮門內。
HCH_013_029_000079	宣德時尚存，至振，去之。
HCH_013_029_000080	十二月，太監王振矯旨以徐晞為兵部尚書。
HCH_013_029_000081	時振權日重，晞以諂見擢。
HCH_013_029_000082	于是府、部、院諸大臣及百執事，在外方面，俱攫金進見。
HCH_013_029_000083	每當朝覲日，進見者以百金為恆，千金者始得醉飽出。
HCH_013_029_000084	由是競趨苞苴，乃被容接，都御史陳鎰、王文俱跪門俯首焉。
HCH_013_029_000085	振姪千戶山，為錦衣衛指揮同知世襲，尋命侍經筵。
HCH_013_029_000086	八年夏四月，雷震奉天殿鴟吻，詔求直言。
HCH_013_029_000087	初，張太后既崩，王振遂無忌憚，作大第于皇城，又作智化寺于居東，以祝釐，自撰碑，始弄威福。
HCH_013_029_000088	時楊榮先卒，楊士奇以子稷故，堅臥不出。
HCH_013_029_000089	惟楊溥在朝，年老勢孤。
HCH_013_029_000090	繼登庸者悉皆委靡，于是大權悉歸振矣。
HCH_013_029_000091	侍講劉球上言十事：「勤聖學以正心德，親政務以總乾綱，別賢否以清正士，選禮臣以隆祀典，嚴考核以篤吏治，慎刑罰以彰憲典，罷營作以蘇民勞，定法守以杜下移，息兵威以重民命，修武備以防外患。」
HCH_013_029_000092	疏入，下獄。
HCH_013_029_000093	初，王振憾球阻麓川之師。
HCH_013_029_000094	錦衣指揮彭德清，球鄉人也，往來王振門用事。
HCH_013_029_000095	公卿率趨謁，球獨不為禮，德清銜之。
HCH_013_029_000096	會球疏上，乃激振曰：「公知之乎？劉侍讀疏之三章，蓋詆公也。」
HCH_013_029_000097	振怒，欲置之死。
HCH_013_029_000098	會編修董璘自陳願為太常，而球疏有「太常不可用道士，宜易儒臣」語，乃逮璘及球俱下獄。
HCH_013_029_000099	振即令其黨錦衣衛指揮馬順以計殺球。
HCH_013_029_000100	一夕五更，順獨攜一校，推獄門入，球與董璘同臥，小校前持球，球知不免，大呼曰：「死訴太祖、太宗！」
HCH_013_029_000101	校持刀斷球頸，流血被體，屹立不動。
HCH_013_029_000102	順舉足倒之，曰：「如此無禮！」
HCH_013_029_000103	遂支解之，裹以蒲，埋衛後隙地。
HCH_013_029_000104	董璘從旁匿球血裙。
HCH_013_029_000105	尋得釋，密歸球家，家人始知球死。
HCH_013_029_000106	子釪、鉞求屍，僅得一臂，乃以血裙葬焉。
HCH_013_029_000107	小校，盧氏人，故與耿九疇鄰。
HCH_013_029_000108	一日，見九疇，視其瘠不類平時，曰：「汝得無疾乎？」
HCH_013_029_000109	校具以實告，且曰：「馬順將舉事，密語我曰：「今夕有事，汝當早來。』至則使懷刃相隨，迫于勢，不得不爾。比聞劉公忠，吾儕小人，死有餘罪矣！」因慟哭死。未幾，馬順子亦死，死時捽順髮，拳且蹴之，曰：「老賊！令爾異日禍踰我。我劉球也！」太監王振陷大理寺少卿薛瑄下錦衣獄，誣死罪。瑄素不為振屈，振銜之。會有武吏病死，其妾有色，振姪王山欲奪之，妻持不可，妾因誣告妻毒其夫。都御史王文究問，已誣服。瑄辨其寃，屢駁還之。王文諂事振，譛之，嗾御史劾瑄受賄，故出人罪。廷鞫，竟坐瑄死，下獄。瑄怡然曰：「辨寃獲咎，死何愧焉？」在獄讀《易》以自娛。初，瑄既論死，子淳等三人請一人代死，二人戍，贖父罪。不許。將決，王振老僕泣于爨下，振問之，曰：「薛少卿不免，是以泣。」曰：「何以知之？」曰：「鄉人也。」因述其平生。振少解。會侍郎王偉申救之，得免死，除名放歸田里。南京國子監祭酒陳敬宗考績至京，振素慕敬宗名，欲致之門下。適南畿巡撫周忱亦在京師謁振，知忱與敬宗同年，語之意。忱詣敬宗達之，敬宗曰：「為人師表而求謁中官，可乎？」忱乃謂振曰：「陳祭酒善書法。以求書為名，先之禮幣，彼將謁謝矣。」振然之，乃遺金綺求書程子《四箴》。敬宗為書之，
HCH_013_029_000110	而返其幣，竟不往見。
HCH_013_029_000111	敬宗為祭酒十八年不遷。
HCH_013_029_000112	秋八月，王振枷祭酒李時勉于國子監門，尋釋之。
HCH_013_029_000113	王振嘗詣監，銜時勉無加禮，令人廉其事，無所得。
HCH_013_029_000114	彝倫堂有古樹，故許衡所值也。
HCH_013_029_000115	時勉嫌其陰翳，妨諸生班列，稍命伐其旁枝。
HCH_013_029_000116	振遂誣以伐官木，私家用，矯旨令荷校，肆諸成均。
HCH_013_029_000117	時為三械，與司業趙琬、掌饌金鑑同校。
HCH_013_029_000118	時勉校特重，而竅隘。
HCH_013_029_000119	鑑請易之，時勉不可。
HCH_013_029_000120	監生石大用乞以身代，號哭奔走闕下。
HCH_013_029_000121	上疏求解者數千人。
HCH_013_029_000122	會昌伯孫繼宗言于孫太后，太后為上言之，始知振所為也，命立釋之。
HCH_013_029_000123	內使張環、顧忠匿名寫誹謗語，錦衣衛鞫之，得實，詔磔于市。
HCH_013_029_000124	仍令內官出觀，乃知誹謗者訐振惡也。
HCH_013_029_000125	九年秋七月，駙馬都尉石璟詈家閹呂寶，太監王振惡之，下錦衣獄。
HCH_013_029_000126	冬十月，下監察御史李儼錦衣獄。
HCH_013_029_000127	時儼監收光祿寺祭物，值太監王振不跪，遂得罪，戍鐵嶺衛。
HCH_013_029_000128	十年春正月，錦衣衛卒王永陰揭王振罪于通逵，匿其名。
HCH_013_029_000129	邏校緝得之，詔即磔于市，不覆奏。
HCH_013_029_000130	秋七月，霸州知州張需下錦衣獄。
HCH_013_029_000131	需善字民，順天府丞王鐸嘗旌異之。
HCH_013_029_000132	有牧馬官擾民，需置于法。
HCH_013_029_000133	牧馬官以譖太監王振，遂被逮，箠楚幾死，謫戍邊。
HCH_013_029_000134	併坐鐸私舉，下于理。
HCH_013_029_000135	十一年春正月，賜司禮太監王振白金、寶楮、綵幣諸物，振姪林為錦衣衛指揮僉事。
HCH_013_029_000136	賜振敕曰：「朕惟旌德報功，帝王大典。忠臣報國，臣子至情。爾振性資忠孝，度量弘深。昔皇曾祖時，特用內臣選拔，事我皇祖。教以詩書，玉成令器。眷愛既隆，勤誠彌篤。肆我皇考，以爾先帝所重，簡朕左右。朕自在春宮，至登大位，幾二十年。爾夙夜在側，寢食弗違，保護贊輔，克盡乃心，正言忠告，裨益實至。特茲敕賞，擢爾後官。《詩》云：「無德不報。』《書》曰：「謹終如始。』朕朝夕念勞，爾其體至意焉。」
HCH_013_029_000137	三月，降巡撫山西、河南兵部侍郎于謙為大理寺左少卿，仍巡撫。
HCH_013_029_000138	謙撫梁、晉十餘年，懼盈滿，舉參政孫原貞、王來自代。
HCH_013_029_000139	時王振方用事，謙每入京，未嘗持一物交當路。
HCH_013_029_000140	又御史有姓名類謙者常忤振，振意以為謙，嗾言官劾之，罷為大理少卿。
HCH_013_029_000141	二省民倍道赴闕乞留，親藩亦以不可無謙請，乃復命巡撫。
HCH_013_029_000142	十三年春二月，修大興隆寺。
HCH_013_029_000143	寺初名慶壽，在禁城西，金章宗建。
HCH_013_029_000144	太監王振言其敝，命役軍民修之，費巨萬，壯麗甲于京都。
HCH_013_029_000145	上臨幸焉。
HCH_013_029_000146	十四年秋七月，瓦剌也先大舉入寇，王振挾帝親征。
HCH_013_029_000147	八月，師潰于土木，帝北狩。
HCH_013_029_000148	護衛將軍樊忠者，從帝旁以所持棰捶死振，曰：「吾為天下誅此賊！」
HCH_013_029_000149	遂突圍殺數十人，死之。
HCH_013_029_000150	報至，廷臣請族誅振。
HCH_013_029_000151	振所親馬順及王、毛二侍一時被擊死。
HCH_013_029_000152	都御史陳鎰奉郕王令旨籍其家，并振從子山臠于市，族屬無少長皆斬。
HCH_013_029_000153	振家當京城內外，凡數處，重堂邃閣，擬于宸居，器服綺麗，尚方不逮，玉盤百面，珊瑚高六七尺者二十餘株，金銀六十餘庫，幣帛珠寶無算。
HCH_013_029_000154	天順元年五月，英宗復辟。
HCH_013_029_000155	思振，諱為忠所殺。
HCH_013_029_000156	詔復振官，刻木為振形，招魂葬之。
HCH_013_029_000157	祀智化寺，賜額曰「旌忠」。
