HCH_011_028_000001	裴邃字淵明，河東聞喜人，魏襄州刺史綽之後也。
HCH_011_028_000002	祖壽孫，寓居壽陽，爲宋武帝前軍長史。
HCH_011_028_000003	父仲穆，驍騎將軍。
HCH_011_028_000004	邃十歲能屬文，善《左氏春秋》。
HCH_011_028_000005	齊建武初，刺史蕭遙昌引爲府主簿。
HCH_011_028_000006	壽陽有八公山廟，遙昌爲立碑，使邃爲文，甚見稱賞。
HCH_011_028_000007	舉秀才，對策高第，奉朝請。
HCH_011_028_000008	東昏踐阼，始安王蕭遙光爲撫軍將軍、揚州刺史，引邃爲參軍。
HCH_011_028_000009	後遙光敗，邃還壽陽，值刺史裴叔業以壽陽降魏，豫州豪族皆被驅掠，邃遂隨衆北徙。
HCH_011_028_000010	魏主宣武帝雅重之，以爲司徒屬，中書郎，魏郡太守。
HCH_011_028_000011	魏遣王肅鎮壽陽，邃固求隨肅，密圖南歸。
HCH_011_028_000012	天監初，自拔還朝，除後軍諮議參軍。
HCH_011_028_000013	邃求邊境自效，以爲輔國將軍、廬江太守。
HCH_011_028_000014	時魏將呂頗率衆五萬奄來攻郡，邃率麾下拒破之，加右軍將軍。
HCH_011_028_000015	五年，征邵陽洲，魏人爲長橋斷淮以濟。
HCH_011_028_000016	邃築壘逼橋，每戰輒克，於是密作沒突艦。
HCH_011_028_000017	會甚雨，淮水暴溢，邃乘艦徑造橋側，魏衆驚潰，邃乘勝追擊，大破之。
HCH_011_028_000018	進克羊石城，斬城主元康。
HCH_011_028_000019	又破霍丘城，斬城主甯永仁。
HCH_011_028_000020	平小峴，攻合肥。
HCH_011_028_000021	以功封夷陵縣子，邑三百戶。
HCH_011_028_000022	遷冠軍長史、廣陵太守。
HCH_011_028_000023	邃與鄉人共入魏武廟，因論帝王功業。
HCH_011_028_000024	其妻甥王篆之密啓高祖，云「裴邃多大言，有不臣之迹。」
HCH_011_028_000025	由是左遷爲始安太守。
HCH_011_028_000026	邃志欲立功邊陲，不願閑遠，乃致書於呂僧珍曰：「昔阮咸、顏延有『二始』之歎。吾才不逮古人，今爲三始，非其願也，將如之何！」
HCH_011_028_000027	未及至郡，會魏攻宿預，詔邃拒焉。
HCH_011_028_000028	行次直瀆，魏衆退。
HCH_011_028_000029	遷右軍諮議參軍、豫章王雲麾府司馬，率所領助守石頭。
HCH_011_028_000030	出爲竟陵太守，開置屯田，公私便之。
HCH_011_028_000031	遷爲遊擊將軍、朱衣直閤，直殿省。
HCH_011_028_000032	尋遷假節、明威將軍、西戎校尉、北梁、秦二州刺史。
HCH_011_028_000033	復開創屯田數千頃，倉廩盈實，省息邊運，民吏獲安，乃相率餉絹千餘匹。
HCH_011_028_000034	邃從容曰：「汝等不應爾；吾又不可逆。」
HCH_011_028_000035	納其絹二匹而已。
HCH_011_028_000036	還爲給事中、雲騎將軍、朱衣直閤將軍，遷大匠卿。
HCH_011_028_000037	普通二年，義州刺史文僧明以州叛入于魏，魏軍來援。
HCH_011_028_000038	以邃爲假節、信武將軍，督衆軍討焉。
HCH_011_028_000039	邃深入魏境，從邊城道，出其不意。
HCH_011_028_000040	魏所署義州刺史封壽據檀公峴，邃擊破之，遂圍其城，壽麵縛請降，義州平。
HCH_011_028_000041	除持節、督北徐州諸軍事、信武將軍、北徐州刺史。
HCH_011_028_000042	未之職，又遷督豫州北豫霍三州諸軍事、豫州刺史，鎮合肥。
HCH_011_028_000043	四年，進號宣毅將軍。
HCH_011_028_000044	是歲，大軍將北伐，以邃督征討諸軍事，率騎三千，先襲壽陽。
HCH_011_028_000045	九月壬戌，夜至壽陽，攻其郛，斬關而入，一日戰九合，爲後軍蔡秀成失道不至，邃以援絕拔還。
HCH_011_028_000046	於是邃復整兵，收集士卒，令諸將各以服色相別。
HCH_011_028_000047	邃自爲黃袍騎，先攻狄丘、甓城、黎漿等城，皆拔之。
HCH_011_028_000048	屠安成、馬頭、沙陵等戍。
HCH_011_028_000049	是冬，始修芍陂。
HCH_011_028_000050	明年，復破魏新蔡郡，略地至於鄭城，汝潁之間，所在回應。
HCH_011_028_000051	魏壽陽守將長孫稚、河間王元琛率衆五萬，出城挑戰。
HCH_011_028_000052	邃勒諸將爲四甄以待之，令直閤將軍李祖憐偽遁以引稚，稚等悉衆追之，四甄競發，魏衆大敗。
HCH_011_028_000053	斬首萬餘級。
HCH_011_028_000054	稚等奔走，閉門自固，不敢復出。
HCH_011_028_000055	其年五月，卒於軍中。
HCH_011_028_000056	追贈侍中、左衛將軍，給鼓吹一部，進爵爲侯，增邑七百戶。
HCH_011_028_000057	諡曰烈。
HCH_011_028_000058	邃少言笑，沉深有思略，爲政寬明，能得士心。
HCH_011_028_000059	居身方正有威重，將吏憚之，少敢犯法。
HCH_011_028_000060	及其卒也，淮、肥間莫不流涕，以爲邃不死，洛陽不足拔也。
HCH_011_028_000061	子之禮，字子義，自國子生推第，補邵陵王國左常侍、信威行參軍。
HCH_011_028_000062	王爲南兗，除長流參軍，未行，仍留宿衛，補直閤將軍。
HCH_011_028_000063	丁父憂，服闋襲封，因請隨軍討壽陽，除雲麾將軍，遷散騎常侍。
HCH_011_028_000064	又別攻魏廣陵城，平之，除信武將軍、西豫州刺史，加輕車將軍，除黃門侍郎，遷中軍宣城王司馬。
HCH_011_028_000065	尋爲都督北徐仁睢三州諸軍事、信武將軍、北徐州刺史。
HCH_011_028_000066	徵太子左衛率，兼衛尉卿，轉少府卿。
HCH_011_028_000067	卒，諡曰壯。
HCH_011_028_000068	子政，承聖中，官至給事黃門侍郎。
HCH_011_028_000069	江陵陷，隨例入西魏。
HCH_011_028_000070	之高字如山，邃兄中散大夫髦之子也。
HCH_011_028_000071	起家州從事、新都令、奉朝請，遷參軍。
HCH_011_028_000072	頗讀書，少負意氣，常隨叔父邃征討，所在立功，甚爲邃所器重，戎政咸以委焉。
HCH_011_028_000073	壽陽之役，邃卒於軍所，之高隸夏侯夔，平壽陽，仍除平北豫章長史、梁郡太守，封都城縣男，邑二百五十戶。
HCH_011_028_000074	時魏汝陰來附，敕之高應接，仍除假節、飆勇將軍、潁州刺史。
HCH_011_028_000075	士民夜反，逾城而入，之高率家僮與麾下奮擊，賊乃散走。
HCH_011_028_000076	父憂還京。
HCH_011_028_000077	起爲光遠將軍，合討陰陵盜賊，平之，以爲譙州刺史。
HCH_011_028_000078	又還爲左軍將軍，出爲南譙太守、監北徐州，遷員外散騎常侍。
HCH_011_028_000079	尋除雄信將軍、西豫州刺史，餘如故。
HCH_011_028_000080	侯景亂，之高率衆入援，南豫州刺史、鄱陽嗣王範命之高總督江右援軍諸軍事，頓于張公洲。
HCH_011_028_000081	柳仲禮至橫江，之高遣船舸二百餘艘迎致仲禮，與韋粲等俱會青塘立營，據建興苑。
HCH_011_028_000082	及城陷，之高還合肥，與鄱陽王範西上。
HCH_011_028_000083	稍至新蔡，衆將一萬，未有所屬。
HCH_011_028_000084	元帝遣蕭慧正召之，以爲侍中、護軍將軍。
HCH_011_028_000085	到江陵，承制除特進、金紫光祿大夫。
HCH_011_028_000086	卒，時年七十三。
HCH_011_028_000087	贈侍中、儀同三司，鼓吹一部。
HCH_011_028_000088	諡曰恭。
HCH_011_028_000089	子畿，累官太子右衛率、雋州刺史。
HCH_011_028_000090	西魏攻陷江陵，畿力戰死之。
HCH_011_028_000091	之平字如原，之高第五弟。
HCH_011_028_000092	少亦隨邃征討，以軍功封都亭侯。
HCH_011_028_000093	歷武陵王常侍、扶風、弘農二郡太守，不行，除譙州長史、陽平太守。
HCH_011_028_000094	拒侯景，城陷後，遷散騎常侍、右衛將軍、太子詹事。
HCH_011_028_000095	之橫字如岳，之高第十三弟也。
HCH_011_028_000096	少好賓遊，重氣俠，不事產業。
HCH_011_028_000097	之高以其縱誕，乃爲狹被蔬食以激厲之。
HCH_011_028_000098	之橫歎曰：「大丈夫富貴，必作百幅被。」
HCH_011_028_000099	遂與僮屬數百人，於芍陂大營田墅，遂致殷積。
HCH_011_028_000100	太宗在東宮，聞而要之，以爲河東王常侍、直殿主帥，遷直閤將軍。
HCH_011_028_000101	侯景亂，出爲貞威將軍，隸鄱陽王範討景。
HCH_011_028_000102	景濟江，仍與範長子嗣入援。
HCH_011_028_000103	連營度淮，據東城。
HCH_011_028_000104	京都陷，退還合肥，與範溯流赴湓城。
HCH_011_028_000105	景遣任約上逼晉熙，範令之橫下援，未及至，範薨，之橫乃還。
HCH_011_028_000106	時尋陽王大心在江州，範副梅思立密要大心襲湓城，之橫斬思立而拒大心。
HCH_011_028_000107	大心以州降景。
HCH_011_028_000108	之橫率衆與兄之高同歸元帝，承制除散騎常侍、廷尉卿，出爲河東內史。
HCH_011_028_000109	又隨王僧辯拒侯景於巴陵，景退，遷持節、平北將軍、東徐州刺史，中護軍，封豫寧侯，邑三千戶。
HCH_011_028_000110	又隨僧辯追景，平郢、魯、江、晉等州，恒爲前鋒陷陣。
HCH_011_028_000111	仍至石頭，破景，景東奔，僧辯令之橫與杜崱入守臺城。
HCH_011_028_000112	及陸納據湘州叛，又隸王僧辯南討焉。
HCH_011_028_000113	于陣斬納將李賢明，遂平之。
HCH_011_028_000114	又破武陵王於硤口。
HCH_011_028_000115	還除吳興太守，乃作百幅被，以成其初志。
HCH_011_028_000116	後江陵陷，齊遣上黨王高渙挾貞陽侯攻東關，晉安王方智承制，以之橫爲使持節、鎮北將軍、徐州刺史，都督衆軍，給鼓吹一部，出守蘄城。
HCH_011_028_000117	之橫營壘未周，而齊軍大至，兵盡矢窮，遂於陣沒，時年四十一。
HCH_011_028_000118	贈侍中、司空公，諡曰忠壯。
HCH_011_028_000119	子鳳寶嗣。
HCH_011_028_000120	夏侯亶字世龍，車騎將軍詳長子也。
HCH_011_028_000121	齊初，起家奉朝請。
HCH_011_028_000122	永元末，詳爲西中郎南康王司馬，隨府鎮荊州，亶留京師，爲東昏聽政主帥。
HCH_011_028_000123	及崔慧景作亂，亶以捍禦功，除驍騎將軍。
HCH_011_028_000124	及高祖起師，詳與長史蕭穎胄協同義舉，密遣信下都迎亶，亶乃齎宣德皇后令，令南康王纂承大統，封十郡爲宣城王，進位相國，置僚屬，選百官。
HCH_011_028_000125	建康城平，以亶爲尚書吏部郎，俄遷侍中，奉璽於高祖。
HCH_011_028_000126	天監元年，出爲宣城太守。
HCH_011_028_000127	尋入爲散騎常侍，領右驍騎將軍。
HCH_011_028_000128	六年，出爲平西始興王長史、南郡太守，父憂解職。
HCH_011_028_000129	居喪盡禮，廬于墓側，遺財悉推諸弟。
HCH_011_028_000130	八年，起爲持節、督司州諸軍事、信武將軍、司州刺史，領安陸太守。
HCH_011_028_000131	服闋，襲封豊城縣公。
HCH_011_028_000132	居州甚有威惠，爲邊人所悅服。
HCH_011_028_000133	十二年，以本號還朝，除都官尚書，遷給事中、右衛將軍、領豫州大中正。
HCH_011_028_000134	十五年，出爲信武將軍、安西長史、江夏太守。
HCH_011_028_000135	十七年，入爲通直散騎常侍、太子右衛率，遷左衛將軍，領前軍將軍。
HCH_011_028_000136	俄出爲明威將軍、吳興太守。
HCH_011_028_000137	在郡復有惠政，吏民圖其像，立碑頌美焉。
HCH_011_028_000138	普通三年，入爲散騎常侍，領右驍騎將軍，轉太府卿，常侍如故。
HCH_011_028_000139	以公事免，未幾，優詔復職。
HCH_011_028_000140	五年，遷中護軍。
HCH_011_028_000141	六年，大舉北伐。
HCH_011_028_000142	先遣豫州刺史裴邃帥譙州刺史湛僧智、歷陽太守明紹世、南譙太守魚弘、晉熙太守張澄，並世之驍將，自南道伐壽陽城，未克而邃卒。
HCH_011_028_000143	乃加亶使持節，馳驛代邃，與魏將河間王元琛、臨淮王元彧等相拒，頻戰克捷。
HCH_011_028_000144	尋有密敕，班師合肥，以休士馬，須堰成復進。
HCH_011_028_000145	七年夏，淮堰水盛，壽陽城將沒，高祖復遣北道軍元樹帥彭寶孫、陳慶之等稍進，亶帥湛僧智、魚弘、張澄等通清流澗，將入淮、肥。
HCH_011_028_000146	魏軍夾肥築城，出亶軍後，亶與僧智還襲，破之。
HCH_011_028_000147	進攻黎漿，貞威將軍韋放自北道會焉。
HCH_011_028_000148	兩軍既合，所向皆降下。
HCH_011_028_000149	凡降城五十二，獲男女口七萬五千人，米二十萬石。
HCH_011_028_000150	詔以壽陽依前代置豫州，合肥鎮改爲南豫州，以亶爲使持節、都督豫州緣淮南豫霍義定五州諸軍事、雲麾將軍、豫、南豫二州刺史。
HCH_011_028_000151	壽春久罹兵荒，百姓多流散，亶輕刑薄賦，務農省役，頃之民戶充復。
HCH_011_028_000152	大通二年，進號平北將軍。
HCH_011_028_000153	三年，卒於州鎮。
HCH_011_028_000154	高祖聞之，卽日素服舉哀，贈車騎將軍。
HCH_011_028_000155	諡曰襄。
HCH_011_028_000156	州民夏侯簡等五百人表請爲亶立碑置祠，詔許之。
HCH_011_028_000157	亶爲人美風儀，寬厚有器量，涉獵文史，辯給能專對。
HCH_011_028_000158	宗人夏侯溢爲衡陽內史，辭日，亶侍御坐，高祖謂亶曰：「夏侯溢於卿疏近？」
HCH_011_028_000159	稟答曰：「是臣從弟。」
HCH_011_028_000160	高祖知溢于亶已疏，乃曰：「卿傖人，好不辨族從。」
HCH_011_028_000161	亶對曰：「臣聞服屬易疏，所以不忍言族。」
HCH_011_028_000162	時以爲能對。
HCH_011_028_000163	亶歷爲六郡三州，不修產業，祿賜所得，隨散親故。
HCH_011_028_000164	性儉率，居處服用，充足而已，不事華侈。
HCH_011_028_000165	晚年頗好音樂，有妓妾十數人，並無被服姿容。
HCH_011_028_000166	每有客，常隔簾奏之，時謂簾爲夏侯妓衣也。
HCH_011_028_000167	亶二子：誼，損。
HCH_011_028_000168	誼襲封豊城公，歷官太子舍人，洗馬。
HCH_011_028_000169	太清中，侯景入寇，誼與弟損帥部曲入城，並卒圍內。
HCH_011_028_000170	夔字季龍，亶弟也。
HCH_011_028_000171	起家齊南康王府行參軍。
HCH_011_028_000172	中興初，遷司徒屬。
HCH_011_028_000173	天監元年，爲太子洗馬，中舍人，中書郎。
HCH_011_028_000174	丁父憂，服闋，除大匠卿，知造太極殿事。
HCH_011_028_000175	普通元年，爲邵陵王信威長史，行府國事。
HCH_011_028_000176	其年，出爲假節、征遠將軍，隨機北討，還除給事黃門侍郎。
HCH_011_028_000177	二年，副裴邃討義州，平之。
HCH_011_028_000178	三年，代兄亶爲吳興太守，尋遷假節、征遠將軍、西陽、武昌二郡太守。
HCH_011_028_000179	七年，徵爲衛尉，未拜，改授持節、督司州諸軍事、信武將軍、司州刺史，領安陸太守。
HCH_011_028_000180	八年，敕夔帥壯武將軍裴之禮、直閤將軍任思祖出義陽道，攻平靜、穆陵、陰山三關，克之。
HCH_011_028_000181	是時譙州刺史湛僧智圍魏東豫州刺史元慶和於廣陵，入其郛。
HCH_011_028_000182	魏將元顯伯率軍赴援，僧智逆擊破之，夔自武陽會僧智，斷魏軍歸路。
HCH_011_028_000183	慶和於內築柵以自固，及夔至，遂請降。
HCH_011_028_000184	夔讓僧智，僧智曰：「慶和志欲降公，不願降僧智，今往必乖其意；且僧智所將爲烏合募人，不可御之以法。公持軍素嚴，必無犯令，受降納附，深得其宜。」
HCH_011_028_000185	於是夔乃登城拔魏幟，建官軍旗鼓，衆莫敢妄動，慶和束兵以出，軍無私焉。
HCH_011_028_000186	凡降男女口四萬餘人，粟六十萬斛，餘物稱是。
HCH_011_028_000187	顯伯聞之夜遁，衆軍追之，生擒二萬餘人，斬獲不可勝數。
HCH_011_028_000188	詔以僧智領東豫州，鎮廣陵。
HCH_011_028_000189	夔引軍屯安陽。
HCH_011_028_000190	夔又遣偏將屠楚城，盡俘其衆，由是義陽北道遂與魏絕。
HCH_011_028_000191	大通二年，魏郢州刺史元願達請降，高祖敕郢州刺史元樹往迎願達，夔亦自楚城會之，遂留鎮焉。
HCH_011_028_000192	詔改魏郢州爲北司州，以夔爲刺史，兼督司州。
HCH_011_028_000193	三年，遷使持節，進號仁威將軍，封保城縣侯，邑一千五百戶。
HCH_011_028_000194	中大通二年，徵爲右衛將軍，丁所生母憂去職。
HCH_011_028_000195	時魏南兗州刺史劉明以譙城入附，詔遣鎮北將軍元樹帥軍應接，起夔爲雲麾將軍，隨機北討。
HCH_011_028_000196	尋授使持節、督南豫州諸軍事、南豫州刺史。
HCH_011_028_000197	六年，轉使持節、督豫淮陳潁建霍義七州諸軍事、豫州刺史。
HCH_011_028_000198	豫州積歲寇戎，人頗失業，夔乃帥軍人于蒼陵立堰，溉田千餘頃。
HCH_011_028_000199	歲收穀百餘萬石，以充儲備，兼贍貧人，境內賴之。
HCH_011_028_000200	夔兄亶先經此任，至是夔又居焉。
HCH_011_028_000201	兄弟並有恩惠於鄉里，百姓歌之曰：「我之有州，頻仍夏侯；前兄後弟，布政優優。」
HCH_011_028_000202	在州七年，甚有聲績，遠近多附之。
HCH_011_028_000203	有部曲萬人，馬二千匹，並服習精強，爲當時之盛。
HCH_011_028_000204	性奢豪，後房伎妾曳羅縠飾金翠者亦有百數。
HCH_011_028_000205	愛好人士，不以貴勢自高，文武賓客常滿坐，時亦以此稱之。
HCH_011_028_000206	大同四年，卒于州，時年五十六。
HCH_011_028_000207	有詔舉哀，賻錢二十萬，布二百匹。
HCH_011_028_000208	追贈侍中、安北將軍。
HCH_011_028_000209	諡曰桓。
HCH_011_028_000210	子撰嗣，官至太僕卿。
HCH_011_028_000211	撰弟譒，少粗險薄行，常停鄉里，領其父部曲，爲州助防，刺史蕭淵明引爲府長史。
HCH_011_028_000212	淵明彭城戰沒，復爲侯景長史。
HCH_011_028_000213	景尋舉兵反，譒前驅濟江，頓兵城西士林館，破掠邸第及居人富室，子女財貨，盡略有之。
HCH_011_028_000214	淵明在州有四妾，章、於、王、阮，並有國色。
HCH_011_028_000215	淵明沒魏，其妾並還京第，譒至，破第納焉。
HCH_011_028_000216	魚弘，襄陽人。
HCH_011_028_000217	身長八尺，白皙美姿容。
HCH_011_028_000218	累從征討，常爲軍鋒，歷南譙、盱眙、竟陵太守。
HCH_011_028_000219	常語人曰：「我爲郡，所謂四盡：水中魚鱉盡，山中麞鹿盡，田中米穀盡，村里民庶盡。丈夫生世，如輕塵栖弱草，白駒之過隙。人生歡樂富貴幾何時！」
HCH_011_028_000220	於是恣意酣賞，侍妾百餘人，不勝金翠，服玩車馬，皆窮一時之絕。
HCH_011_028_000221	遷爲平西湘東王司馬、新興、永寧二郡太守，卒官。
HCH_011_028_000222	韋放字元直，車騎將軍叡之子。
HCH_011_028_000223	初爲齊晉安王寧朔迎主簿，高祖臨雍州，又召爲主簿。
HCH_011_028_000224	放身長七尺七寸，腰帶八圍，容貌甚偉。
HCH_011_028_000225	天監元年，爲盱眙太守，還除通直郎，尋爲輕車晉安王中兵參軍，遷鎮右始興王諮議參軍，以父憂去職。
HCH_011_028_000226	服闋，襲封永昌縣侯，出爲輕車南平王長史、襄陽太守。
HCH_011_028_000227	轉假節、明威將軍、竟陵太守。
HCH_011_028_000228	在郡和理，爲吏民所稱。
HCH_011_028_000229	六年，大舉北伐，以放爲貞威將軍，與胡龍牙會曹仲宗進軍。
HCH_011_028_000230	七年，夏侯亶攻黎漿不克，高祖復使帥軍自北道會壽春城。
HCH_011_028_000231	尋遷雲麾南康王長史、尋陽太守。
HCH_011_028_000232	放累爲籓佐，並著聲績。
HCH_011_028_000233	普通八年，高祖遣兼領軍曹仲宗等攻渦陽，又以放爲明威將軍，帥師會之。
HCH_011_028_000234	魏大將費穆帥衆奄至，放軍營未立，麾下止有二百餘人。
HCH_011_028_000235	放從弟洵驍果有勇力，一軍所仗，放令洵單騎擊刺，屢折魏軍，洵馬亦被傷不能進，放胄又三貫流矢。
HCH_011_028_000236	衆皆失色，請放突去。
HCH_011_028_000237	放厲聲叱之曰：「今日唯有死耳。」
HCH_011_028_000238	乃免胄下馬，據胡床處分。
HCH_011_028_000239	於是士皆殊死戰，莫不一當百。
HCH_011_028_000240	魏軍遂退，放逐北至渦陽。
HCH_011_028_000241	魏又遣常山王元昭、大將軍李獎、乞佛寶、費穆等衆五萬來援，放率所督將陳度、趙伯超等夾擊，大破之。
HCH_011_028_000242	渦陽城主王緯以城降。
HCH_011_028_000243	放乃登城，簡出降口四千二百人，器仗充牣；又遣降人三十，分報李獎、費穆等。
HCH_011_028_000244	魏人棄諸營壘，一時奔潰，衆軍乘之，斬獲略盡。
HCH_011_028_000245	擒穆弟超，並王緯送於京師。
HCH_011_028_000246	還爲太子右衛率，轉通直散騎常侍。
HCH_011_028_000247	出爲持節、督梁南秦二州諸軍事、信武將軍、梁南秦二州刺史。
HCH_011_028_000248	中大通二年，徙督北徐州諸軍事、北徐州刺史，增封四百戶，持節、將軍如故。
HCH_011_028_000249	在鎮三年，卒，時年五十九。
HCH_011_028_000250	諡曰宜侯。
HCH_011_028_000251	放性弘厚篤實，輕財好施，于諸弟尤雍睦。
HCH_011_028_000252	每將遠別及行役初還，常同一室臥起，時稱爲「三姜」。
HCH_011_028_000253	初，放與吳郡張率皆有側室懷孕，因指爲婚姻。
HCH_011_028_000254	其後各產男女，未及成長而率亡，遺嗣孤弱，放常贍卹之。
HCH_011_028_000255	及爲北徐州，時有勢族請姻者，放曰：「吾不失信於故友。」
HCH_011_028_000256	乃以息岐娶率女，又以女適率子，時稱放能篤舊。
HCH_011_028_000257	長子粲嗣，別有傳。
HCH_011_028_000258	史臣曰：裴邃之詞采早著，兼思略沉深，夏侯稟之好學辯給，夔之奢豪愛士，韋放之弘厚篤行，並遇主逢時，展其才用矣。
HCH_011_028_000259	及牧州典郡，破敵安邊，咸著功績，允文武之任，蓋梁室之名臣歟。
HCH_011_028_000260	本唐朝作品在全世界都属于公有领域，因为作者逝世已经遠遠超过100年。
