HCH_012_279_000619	吉翔不悅，即令國璽獻出險策。
HCH_012_279_000620	國璽忿然曰：「時事至此，猶抑言官使不言耶！」
HCH_012_279_000621	時緬甸弟弒兄自立，欲盡殺文武諸臣，遣人來言曰：「蠻俗貴詛盟，請與天朝諸公飲咒水。」
HCH_012_279_000622	吉翔、國泰邀諸臣盡往。
HCH_012_279_000623	至則以兵圍之，令諸臣以次出外，出輒殺之，凡殺四十二人。
HCH_012_279_000624	國璽及在、天波、吉翔、國泰、華亭侯王維恭、綏寧伯蒲纓、都督馬雄飛、吏部侍郎鄧士廉等皆預焉。
HCH_012_279_000625	惟都督同知鄧凱以傷足不行，獲免。
HCH_012_279_000626	時順冶十八年七月也。
HCH_012_279_000627	自是由榔左右無人。
HCH_012_279_000628	至十二月，緬人遂送之出境，事具國史。
HCH_012_279_000629	初，由榔之走緬甸也，昆明諸生薛大觀嘆息曰：「不能背城戰，君臣同死社稷，顧欲走蠻邦以茍活，不重可羞耶！」
HCH_012_279_000630	顧子之翰曰：「吾不惜七尺軀，為天下明大義，汝其勉之！」
HCH_012_279_000631	之翰曰：「大人死忠，兒當死孝。」
HCH_012_279_000632	大觀曰：「汝有母在。」
HCH_012_279_000633	時其母適在旁，顧之翰妻曰：「彼父子能死忠孝，吾兩人獨不能死節義耶？」
HCH_012_279_000634	其侍女方抱幼子，問曰：「主人皆死，何以處我？」
HCH_012_279_000635	大觀曰：「爾能死，甚善。」
HCH_012_279_000636	於是五人偕赴城北黑龍潭死。
HCH_012_279_000637	次日，諸屍相牽浮水上，幼子在侍女懷中，兩手堅抱如故。
HCH_012_279_000638	大觀次女已適人，避兵山中，相去數十里，亦同日赴火死。
HCH_012_279_000639	有那嵩者，沅江土官也。
HCH_012_279_000640	世為知府。
HCH_012_279_000641	嵩嗣職，循法無過。
HCH_012_279_000642	王走緬甸，過沅江，嵩與子燾迎謁，供奉甚謹，設宴皆金銀器。
HCH_012_279_000643	宴畢，悉以獻，曰：「此行上供者少，聊以佐缺乏耳。」
HCH_012_279_000644	後李定國號召諸土司兵，嵩即起兵應之。
HCH_012_279_000645	已而城破，登樓自焚，闔家皆死，其士民亦多巷戰死。
HCH_012_279_000646	贊曰：明自神宗而後，浸微浸滅，不可復振。
HCH_012_279_000647	揆厥所由，國是紛呶，朝端水火，寧坐視社稷之淪胥，而不能破除門戶之角立。
HCH_012_279_000648	故至桂林播越，旦夕不支，而吳、楚之樹黨相傾，猶仍南都翻案之故態也。
HCH_012_279_000649	顛覆之端，有自來矣，於當時任事諸臣何責哉。
