HCH_010_039_000001	中京大定府，虞为营州，夏属冀州，周在幽州之分。
HCH_010_039_000002	秦郡天下，是为辽西。
HCH_010_039_000003	汉为新安平县。
HCH_010_039_000004	汉末步奚居之，幅员千里，多大山深谷，阻险足以自固。
HCH_010_039_000005	魏武北征，纵兵大战，降者一十余万，去之松漠。
HCH_010_039_000006	其后拓拔氏乘辽建牙于此，当饶乐河水之南，温渝河水之北。
HCH_010_039_000007	唐太宗伐高丽，驻跸于此。
HCH_010_039_000008	部帅苏支从征有功，奚长可度率众内附，为置饶乐都督府。
HCH_010_039_000009	咸通以后，契丹始大，奚族不敢复抗。
HCH_010_039_000010	太祖建国，举族臣属。
HCH_010_039_000011	圣宗尝过七金山土河之滨，南望云气，有郛郭楼阙之状，因议建都。
HCH_010_039_000012	择良工于燕、蓟，董役二岁，郛郭、宫掖、楼阁、府库、市肆廊庑，拟神都之制。
HCH_010_039_000013	统和二十四年，五帐院进故奚王牙帐地。
HCH_010_039_000014	二十五年，城之，实以汉户，号曰中京，府曰大定。
HCH_010_039_000015	皇城中有祖庙，景宗、承天皇后御容殿。
HCH_010_039_000016	城池湫湿，多凿井泄之，人以不便。
HCH_010_039_000017	大同驿以待宋使，朝天馆待新罗使，来宾馆待夏使。
HCH_010_039_000018	有七金山、马盂山、双山、松山、土河。
HCH_010_039_000019	统州十、县九：大定县。
HCH_010_039_000020	白霫故地。
HCH_010_039_000021	以诸国俘户居之。
HCH_010_039_000022	长兴县。
HCH_010_039_000023	本汉宾从县。
HCH_010_039_000024	以诸部人居之。
HCH_010_039_000025	富庶县。
HCH_010_039_000026	本汉新安平地，开泰二年析京民置。
HCH_010_039_000027	劝农县。
HCH_010_039_000028	本汉宾从县地。
HCH_010_039_000029	开泰二年析京民置。
HCH_010_039_000030	文定县。
HCH_010_039_000031	开泰二年析京民置。
HCH_010_039_000032	升平县。
HCH_010_039_000033	开泰二年析京民置。
HCH_010_039_000034	归化县。
HCH_010_039_000035	本汉柳城县地。
HCH_010_039_000036	神水县。
HCH_010_039_000037	本汉徒河县地。
HCH_010_039_000038	开泰二年置。
HCH_010_039_000039	金源县。
HCH_010_039_000040	本唐青山县境。
HCH_010_039_000041	开泰二年析京民置。
HCH_010_039_000042	恩州，怀德军，下，刺史。
HCH_010_039_000043	本汉新安平县地。
HCH_010_039_000044	太宗建州。
HCH_010_039_000045	开泰中，以渤海户实之。
HCH_010_039_000046	初隶永兴宫，后属中京。
HCH_010_039_000047	统县一：恩化县。
HCH_010_039_000048	开泰中渤海人户置。
HCH_010_039_000049	惠州，惠和军，中，刺史。
HCH_010_039_000050	本唐归义州地。
HCH_010_039_000051	太祖俘汉民数百户兔鹿山下，创城居之，置州。
HCH_010_039_000052	属中京，统县一：惠和县。
HCH_010_039_000053	圣宗迁上京惠州民，括诸宫院落帐户置。
HCH_010_039_000054	高州，观察。
HCH_010_039_000055	唐信州之地。
HCH_010_039_000056	万岁通天元年，以契丹室活部置。
HCH_010_039_000057	开泰中，圣宗伐高丽，以俘户置高州。
HCH_010_039_000058	有平顶山、滦河。
HCH_010_039_000059	属中京。
HCH_010_039_000060	统县一：三韩县，辰韩为扶余，弁韩为新罗，马韩为高丽。
HCH_010_039_000061	开泰中，圣宗伐高丽，俘三国之遗人置县。
HCH_010_039_000062	户五千。
HCH_010_039_000063	武安州，观察。
HCH_010_039_000064	唐沃州地。
HCH_010_039_000065	太祖俘民居木叶山下，因建城以迁之，号杏埚新城。
HCH_010_039_000066	复以辽西户益之，更曰新州。
HCH_010_039_000067	统和八年改今名。
HCH_010_039_000068	初刺史，后升。
HCH_010_039_000069	有黄柏岭、袅罗水、个没里水。
HCH_010_039_000070	属中京。
HCH_010_039_000071	统县一：沃野县。
HCH_010_039_000072	利州，中、观察。
HCH_010_039_000073	本中京阜俗县。
HCH_010_039_000074	统和二十六年置刺史州，开泰元年升。
HCH_010_039_000075	属中京。
HCH_010_039_000076	统县一：阜俗县。
HCH_010_039_000077	唐末，契丹渐炽，役使奚人，迁居琵琶川。
HCH_010_039_000078	统和四年置县。
HCH_010_039_000079	初隶彰愍宫，更隶中京。
HCH_010_039_000080	后置州，仍属中京。
HCH_010_039_000081	榆州，高平军，下，刺史。
HCH_010_039_000082	本汉临渝县地。
HCH_010_039_000083	后隶右北平骊城县。
HCH_010_039_000084	唐载初二年，析慎州置黎州，处靺鞨部落，后为奚人所据。
HCH_010_039_000085	太宗南征，横帐解里以所俘镇州民置州，开泰中没入。
HCH_010_039_000086	属中京。
HCH_010_039_000087	统县二：和众县。
HCH_010_039_000088	本新黎县地。
HCH_010_039_000089	永和县。
HCH_010_039_000090	本汉昌城县地。
HCH_010_039_000091	统和二十二年置。
HCH_010_039_000092	泽州，广济军，下，刺史。
HCH_010_039_000093	本汉土垠县地。
HCH_010_039_000094	太祖俘蔚州民，立寨居之，采炼陷河银冶。
HCH_010_039_000095	隶中京留守司。
HCH_010_039_000096	开泰中置泽州。
HCH_010_039_000097	有松亭关、神山、九宫岭、石子岭、泺河、撒河。
HCH_010_039_000098	属中京。
HCH_010_039_000099	统县二：神山县。
HCH_010_039_000100	神山在西南。
HCH_010_039_000101	滦河县。
HCH_010_039_000102	本汉徐无县地。
HCH_010_039_000103	属永兴宫。
HCH_010_039_000104	北安州，兴化军，上，刺史。
HCH_010_039_000105	本汉女祁县地，属上谷郡。
HCH_010_039_000106	晋为冯跋所据。
HCH_010_039_000107	唐为奚王府西省地。
HCH_010_039_000108	圣宗以汉户置北安州。
HCH_010_039_000109	属中京。
HCH_010_039_000110	统县一：兴化县。
HCH_010_039_000111	本汉且居县地。
HCH_010_039_000112	潭州，广润军，下，刺史。
HCH_010_039_000113	本中京之龙山县，开泰中置州，仍属中京。
HCH_010_039_000114	统县一：龙山县。
HCH_010_039_000115	本汉交黎县地。
HCH_010_039_000116	开泰二年以习家寨置。
HCH_010_039_000117	松山州，胜安地，下，刺史。
HCH_010_039_000118	开泰中置。
HCH_010_039_000119	统和八年省，复置。
HCH_010_039_000120	属中京。
HCH_010_039_000121	统县一：松山县。
HCH_010_039_000122	本汉文成县地。
HCH_010_039_000123	边松漠，商贾会冲。
HCH_010_039_000124	开泰二年置县。
HCH_010_039_000125	有松山川。
HCH_010_039_000126	宋王曾《上契丹事》曰：出燕京北门，至望京馆。
HCH_010_039_000127	五十里至顺州。
HCH_010_039_000128	七十里至檀州，渐入山。
HCH_010_039_000129	五十里至金沟馆。
HCH_010_039_000130	将至馆，川原平旷，谓之金沟淀。
HCH_010_039_000131	自此入山，诘曲登陟，无复里堠，但以马行记日，约其里数。
HCH_010_039_000132	九十里至古北口，两傍峻崖，仅容车轨。
HCH_010_039_000133	又度德胜岭，盘道数层，俗名思乡岭，八十里至新馆。
HCH_010_039_000134	过雕窠岭、偏枪岭，四十里至如来馆。
HCH_010_039_000135	过乌泺河，东有滦州，又过摸斗岭，一名渡云岭，芹菜岭，七十里至柳河馆。
HCH_010_039_000136	松亭岭甚险峻，七十里至打造部落馆。
HCH_010_039_000137	东南行五十里至牛山馆。
HCH_010_039_000138	八十里至鹿儿峡馆。
HCH_010_039_000139	过虾蟆岭，九十里至铁桨馆。
HCH_010_039_000140	过石子岭，自此渐出山，七十里至富谷馆。
HCH_010_039_000141	八十里至通天馆，二十里至中京大定府。
HCH_010_039_000142	城垣卑小，方圆才四里许。
HCH_010_039_000143	门但重屋，无筑阇之制。
HCH_010_039_000144	南门曰朱夏，门内通步廊，多坊门。
HCH_010_039_000145	又有市楼四：曰天方、大衢、通闤、望阙。
HCH_010_039_000146	次至大同馆。
HCH_010_039_000147	其门正北曰阳德、阊阖。
HCH_010_039_000148	城内西南隅冈上有寺。
HCH_010_039_000149	城南有园圃，宴射之所。
HCH_010_039_000150	自过古北口，居人草庵板屋，耕种，但无桑柘；所种皆从垅上，虞吹沙所壅。
HCH_010_039_000151	山中长松郁然，深谷中时见畜牧牛马橐驼，多青羊黄豕。
HCH_010_039_000152	成州，兴府军，节度。
HCH_010_039_000153	晋国长公主以媵户置，军曰长庆，隶上京。
HCH_010_039_000154	复改军名。
HCH_010_039_000155	统县一：同昌县。
HCH_010_039_000156	兴中府。
HCH_010_039_000157	本霸州彰武军，节度。
HCH_010_039_000158	古孤竹国。
HCH_010_039_000159	汉柳城县地。
HCH_010_039_000160	慕容皝以柳城之北，龙山之南，福德之地，乃筑龙城，构宫庙，改柳城为龙城县，遂迁都，号曰和龙宫。
HCH_010_039_000161	慕容垂复居焉，后为北跋所灭。
HCH_010_039_000162	元魏取为辽西郡。
HCH_010_039_000163	隋平高保宁，置营州。
HCH_010_039_000164	炀帝废州置柳城郡。
HCH_010_039_000165	唐武德初改营州总管府，寻为都督府。
HCH_010_039_000166	万岁通天中，陷李万荣。
HCH_010_039_000167	神龙初，移府幽州。
HCH_010_039_000168	开元四年，复治柳城。
HCH_010_039_000169	八年，西徙渔阳。
HCH_010_039_000170	十年，还柳城。
HCH_010_039_000171	后为奚所据。
HCH_010_039_000172	太祖平奚及俘燕民，将建城，命韩知方择其处。
HCH_010_039_000173	乃完葺柳城，号霸州彰武军，节度。
HCH_010_039_000174	统和中，制置建、霸、宜、锦、白川等五州。
HCH_010_039_000175	寻落制置，隶积庆宫。
HCH_010_039_000176	后属兴圣宫。
HCH_010_039_000177	重熙十年升兴中府。
HCH_010_039_000178	有大华山、小华山、香高山、麝香崖，天授皇帝刻石在焉，驻龙峪、神射泉、小灵河。
HCH_010_039_000179	统州二、县四：兴中县。
HCH_010_039_000180	本汉柳城县地。
HCH_010_039_000181	太祖掠汉民居此，建霸城县。
HCH_010_039_000182	重熙中置府，更名。
HCH_010_039_000183	营丘县。
HCH_010_039_000184	析霸城置。
HCH_010_039_000185	象雷县。
HCH_010_039_000186	开泰二年以麦务川置。
HCH_010_039_000187	初隶中京。
HCH_010_039_000188	后属。
HCH_010_039_000189	闾山县。
HCH_010_039_000190	本汉且虑县。
HCH_010_039_000191	开泰二年以罗家军置。
HCH_010_039_000192	隶中京，后属。
HCH_010_039_000193	安德州，化平军，下，刺史。
HCH_010_039_000194	以霸州安德县置，来属。
HCH_010_039_000195	统县一：安德县。
HCH_010_039_000196	统和八年析霸城东南龙山徒河境户置。
HCH_010_039_000197	初隶乾州，更属霸州，置州来属。
HCH_010_039_000198	黔州，阜昌军，下，刺史。
HCH_010_039_000199	本汉辽西郡地。
HCH_010_039_000200	太祖平渤海，以所俘户居之，隶黑水河提辖司。
HCH_010_039_000201	安帝置州，析宜、霸二州汉户益之。
HCH_010_039_000202	初隶永兴宫，更隶中京，后置府，来属。
HCH_010_039_000203	统县一：盛吉县。
HCH_010_039_000204	太祖平渤海，俘兴州盛吉县民来居，因置县。
HCH_010_039_000205	宜州，崇义军，上，节度。
HCH_010_039_000206	本辽西累县地。
HCH_010_039_000207	东丹王每秋畋于此。
HCH_010_039_000208	兴宗以定州俘户建州。
HCH_010_039_000209	有坟山，松柏连亘百余里，禁樵采，浚河，累石为堤。
HCH_010_039_000210	隶积庆宫。
HCH_010_039_000211	统县二：弘政县。
HCH_010_039_000212	世宗以定州俘户置。
HCH_010_039_000213	民工织纴，多技巧。
HCH_010_039_000214	闻义县。
HCH_010_039_000215	世宗置。
HCH_010_039_000216	初隶海北州，后来属。
HCH_010_039_000217	锦州，临海军，中，节度。
HCH_010_039_000218	本汉辽东无虑县。
HCH_010_039_000219	慕容皝置西乐县。
HCH_010_039_000220	太祖以汉俘建州。
HCH_010_039_000221	有大胡僧山、小胡僧山、大查牙山、小查牙山、淘河岛。
HCH_010_039_000222	隶弘义宫。
HCH_010_039_000223	统州一、县二：永乐县。
HCH_010_039_000224	安昌县。
HCH_010_039_000225	岩州，保肃军，下，刺史。
HCH_010_039_000226	本汉海阳县地。
HCH_010_039_000227	太祖平渤海，迁汉户杂居兴州境，圣宗于此建城焉。
HCH_010_039_000228	隶弘义宫，来属。
HCH_010_039_000229	统县一：兴城县。
HCH_010_039_000230	川州，长宁军，中，节度。
HCH_010_039_000231	本唐青山州地。
HCH_010_039_000232	太祖弟明王安端置。
HCH_010_039_000233	会同三年，诏为白川州。
HCH_010_039_000234	安端子察割以大逆诛，没入，省曰川州。
HCH_010_039_000235	初隶崇德宫，统和中属文忠王府。
HCH_010_039_000236	统县三：弘理县。
HCH_010_039_000237	统和八年以诸宫提辖司户置。
HCH_010_039_000238	咸康县。
HCH_010_039_000239	宜民县。
HCH_010_039_000240	统和中置。
HCH_010_039_000241	建州，保静军，上，节度。
HCH_010_039_000242	唐武德中，置昌乐县。
HCH_010_039_000243	太祖完葺故垒，置州。
HCH_010_039_000244	汉乾祐元年，故石晋太后诣世宗，求于汉城侧耕垦自赡。
HCH_010_039_000245	许于建州南四十里给地五十顷，营构房室，创立宗庙。
HCH_010_039_000246	州在灵河之南，屡遭水害，圣宗迁于河北康崇州故城。
HCH_010_039_000247	初名武宁军，隶永兴宫，后属敦睦宫。
HCH_010_039_000248	统县二：永霸县。
HCH_010_039_000249	永康县。
HCH_010_039_000250	本唐昌黎县地。
HCH_010_039_000251	来州，归德军，下，节度。
HCH_010_039_000252	圣宗以女直五部岁饥来归，置州居之。
HCH_010_039_000253	初刺史，后升。
HCH_010_039_000254	隶永兴宫。
HCH_010_039_000255	有三州山、六州山、五脂山。
HCH_010_039_000256	统州二、县一：来宾县。
HCH_010_039_000257	本唐来远县地。
HCH_010_039_000258	隰州，平海军，下，刺史。
HCH_010_039_000259	慕容皝置集宁县。
HCH_010_039_000260	圣宗括帐户迁信州，大雪不能进，建城于此，置焉。
HCH_010_039_000261	隶兴圣宫，来属。
HCH_010_039_000262	统县一：海浜县。
HCH_010_039_000263	本汉县。
HCH_010_039_000264	濒海，地多碱卤，置盐场于此。
HCH_010_039_000265	迁州，兴善军，下，刺史。
HCH_010_039_000266	本汉阳乐县地。
HCH_010_039_000267	圣宗平大延琳，迁归州民置，来属。
HCH_010_039_000268	有箭笴山。
HCH_010_039_000269	统县一：迁民县。
HCH_010_039_000270	润州，海阳军，下，刺史。
HCH_010_039_000271	圣宗平大延琳，迁宁州之民居此，置州。
HCH_010_039_000272	统县一：海阳县。
HCH_010_039_000273	本汉阳乐县地，迁润州，本东京城内渤海民户，因叛，移于此。
HCH_010_039_000274	本元朝作品在全世界都属于公有领域，因为作者逝世已经遠遠超过100年。
