HCH_012_212_000725	明年，元勛進剿。
HCH_012_212_000726	斬馘六百有奇，亞六等授首，余黨悉平。
HCH_012_212_000727	肇慶恩平十三村賊陳金鶯等，與鄰邑苔村三巢賊羅紹清、林翠蘭、譚權伯，藤峒、九逕十寨賊黃飛鶯、丘勝富、黃高暉、諸可行、黃朝富等，相煽為亂。
HCH_012_212_000728	故事：兩粵惟大征得敘功，雕剿不敘，故諸將不樂雕剿。
HCH_012_212_000729	總督殷正茂與元勛計，令雕剿得論功，諸軍爭奮。
HCH_012_212_000730	正茂又密遣副將梁守愚、游擊王瑞等屯恩平，若常戍者，掩不備，斬翠蘭等，生擒紹清、權伯以獻。
HCH_012_212_000731	其諸路雕剿者，效首功二千四百有奇，還被掠子女千三百餘人，生得金鶯，惟高暉等亡去。
HCH_012_212_000732	元勛逐北至藤峒，又生獲勝富、可行、朝富等八十人。
HCH_012_212_000733	部將鄧子龍等亦獲高暉、飛鶯。
HCH_012_212_000734	三巢、十寨、十三村諸賊盡平，余悉就撫。
HCH_012_212_000735	惠、潮地相接，山險木深。
HCH_012_212_000736	賊首藍一清、賴元爵與其黨馬祖冒、黃民太、曾廷鳳、黃鳴時、曾萬璋、李仲山、卓子望、葉景清、曾仕龍等各據險結砦，連地八百餘里，黨數萬人。
HCH_012_212_000737	正茂議大征。
HCH_012_212_000738	會金鶯等已滅，諸賊頗懼。
HCH_012_212_000739	廷鳳、萬璋並遣子入學，祖昌、景清亦佯乞降。
HCH_012_212_000740	正茂知其詐，征兵四萬，令參將李誠立、沈思學、王詔，游擊王瑞等分將之，元勛居中節制，監司陳奎、唐九德、顧養謙、吳一介監其軍，數道併進。
HCH_012_212_000741	賊敗，乃憑險自守。
HCH_012_212_000742	官軍遍搜深箐邃谷間。
HCH_012_212_000743	而元勛偕九德，追亡至南嶺。
HCH_012_212_000744	一日夜馳至養謙所，擊破李坑，生得子望等。
HCH_012_212_000745	明年破烏禽嶂。
HCH_012_212_000746	仕龍阻高山，元勛佯飲酒高會，忽進兵擊擒之。
HCH_012_212_000747	先後獲大賊首六十一人，次賊首六百餘人，破大小巢七百餘所，擒斬一萬二千有奇。
HCH_012_212_000748	帝為宣捷，告郊廟，進元勛署都督同知，世廕百戶。
HCH_012_212_000749	元勛復討斬余賊千三百有奇，撫定降者。
HCH_012_212_000750	巨寇皆靖。
HCH_012_212_000751	潮州賊林道乾之黨諸良寶既撫復叛，襲殺官軍，掠六百人入海。
HCH_012_212_000752	再犯陽江，敗走。
HCH_012_212_000753	乃據潮故巢，居高山巔，不出戰。
HCH_012_212_000754	官軍營淤泥中。
HCH_012_212_000755	副將李誠立挑戰，墜馬傷足，死者二百人。
HCH_012_212_000756	賊出掠而敗，走巢固守。
HCH_012_212_000757	元勛積草土與賊壘平，用火攻之，斬首千一百餘級。
HCH_012_212_000758	時萬曆二年三月也。
HCH_012_212_000759	捷聞，進世廕一級。
HCH_012_212_000760	遺孽魏朝義等四巢亦降。
HCH_012_212_000761	尋與胡宗仁共平良寶黨林鳳。
HCH_012_212_000762	惠、潮遂無賊。
HCH_012_212_000763	其冬，倭陷銅鼓石、雙魚城。
HCH_012_212_000764	元勛大破之儒峒，俘斬八百餘級。
HCH_012_212_000765	進秩為真。
HCH_012_212_000766	五年，從總督凌雲翼大征羅旁賊，斬首萬六千餘級。
HCH_012_212_000767	進都督，改廕錦衣。
HCH_012_212_000768	尋以疾致仕，卒於家。
HCH_012_212_000769	元勛起小校。
HCH_012_212_000770	大小百十戰，威名震嶺南。
HCH_012_212_000771	與廣西李錫並稱良將。
HCH_012_212_000772	贊曰：世宗朝，老成宿將以俞大猷為稱首，而數奇屢躓。
HCH_012_212_000773	以內外諸臣攘敓，而掩遏其功者眾也。
HCH_012_212_000774	戚繼光用兵，威名震寰宇。
HCH_012_212_000775	然當張居正、譚綸任國事則成，厥後張鼎思、張希皋等居言路則廢。
HCH_012_212_000776	任將之道，亦可知矣。
HCH_012_212_000777	劉顯平蠻引疾，而以有司阻撓為辭，有以夫！
HCH_012_212_000778	李錫、張元勛首功甚盛，而不蒙殊賞，武功所由不競也。
