HCH_009_054_000190	其十曰：「內外官所薦人材，即依所舉試之，委提刑司採訪虛實，若果能稱職，更加遷擢，如或碌碌，即送常調。古者進賢受上賞，進不肖有罰，其立定賞罰條格，庶使人不敢徇私也。」
HCH_009_054_000191	省臣議，隨款各欲舉人，則一人內所舉不下五七人。
HCH_009_054_000192	自古知人為難，人材亦自難得，限數多則猥避責罰、務苟簡，不副聖主求賢之意。
HCH_009_054_000193	擬以前項各款，隨色能舉一人，即充歲舉之數。
HCH_009_054_000194	如此則不濫，而實材得矣。
HCH_009_054_000195	每歲貢人數，尚書省覆察相同，則置簿籍之，如有闕則當隨材奏擬。
HCH_009_054_000196	明昌元年，敕齊民之中有德行才能者，司縣舉之，特賜同四舉五舉人下。
HCH_009_054_000197	明昌元年，制如所舉碌碌無過人跡者，元舉官依例治罪。
HCH_009_054_000198	宣宗興定元年，令隨朝七品、外路六品以上職事官，舉正七品以下職事官年未六十、不犯贓，堪任使者一人。
HCH_009_054_000199	三年，定辟舉縣令制。
HCH_009_054_000200	稱職，則元舉官減一資歷。
HCH_009_054_000201	中平，約量升除。
HCH_009_054_000202	不稱，罰俸一月。
HCH_009_054_000203	犯免官，免所居官。
HCH_009_054_000204	及官當私罪解任、杖罪、贓汙者，約量降除。
HCH_009_054_000205	汙贓至徒以上及除名者，一任不理資考。
HCH_009_054_000206	三品以上舉縣令，稱職者約量升除，不稱奪俸一月。
HCH_009_054_000207	若被舉者犯免官等罪，奪俸兩月。
HCH_009_054_000208	贓汙至徒以上及除名者，奪俸三月，獄成，而會赦原者，亦原之。
HCH_009_054_000209	五年，制辟舉縣令考平者，元舉者不得複舉，他人舉之者聽。
HCH_009_054_000210	又舊制，保舉縣令秩滿之後，以六事論升降，三事以下減一資歷，四事減兩資歷，六事皆備則升職一等。
HCH_009_054_000211	既而御史張升卿言：「進士中下甲及第人、及監官至明威當入縣丞主簿，而三事以下減一資歷注下令，四事減注中令，令皆七品也，若複八品矣。輕重相戾，宜更定之。」
HCH_009_054_000212	遂定制，自今四事以下如前條，六事完者，進士中下甲及第、監官當入縣丞主簿人，減三資歷，注上令。
HCH_009_054_000213	餘出身者亦同此。
HCH_009_054_000214	任二十月以上，雖未秩滿，若以理去官，六事之跡已經覆察，論升如秩滿例。
HCH_009_054_000215	五年，以舉官或私其親，或徇於請求，或謬於鑒裁而妄舉，數歲之間以濫去者九十餘人，乃罷辟舉縣令之制。
HCH_009_054_000216	至哀宗正大元年，乃立法，命監察御史、司農司官，先訪察隨朝七品、外路六品以上官，清慎明潔可為舉主者，然後移文使舉所知，仍以六事課殿最，而升黜舉主。
HCH_009_054_000217	故舉主既為之盡心，而被舉者亦為之盡力。
HCH_009_054_000218	是時雖迫危亡，而縣令號為得人，由作法有足取雲。
HCH_009_054_000219	功酬虧永之制。
HCH_009_054_000220	凡諸提點院務官，三十月遷一官，周歲為滿，止取無虧月日用之。
HCH_009_054_000221	大定四年，定制，一任內虧一分以上降五人，二分以上降十人，三分以上降十五人，若有增羨則依此升遷，其升降不盡之數，于後任充折。
HCH_009_054_000222	二十一年，以舊制監當官並責決，而不顧廉恥之人，以謂已決即得赴調，不以刑罰為畏。
HCH_009_054_000223	擬自今，若虧永及一酬以上，依格追官殿一年外，虧永不及酬者，亦殿一年。
HCH_009_054_000224	章宗大定二十九年，罷年遷之法，更定制，比永課增及一酬遷一官，兩酬遷兩官，如虧課則削亦如之，各兩官止。
HCH_009_054_000225	又罷使司小都監與使副一體論增虧者，及罷餘前升降不盡之數後任充折之制。
HCH_009_054_000226	泰和元年，制犯選及虧永者，右職漢人至宣武將軍從五品、女直至廣威將軍正五品，方注縣令。
HCH_009_054_000227	又吏格，曾犯選及虧永者，女直至武義從六，漢人及諸色人至武略從六，皆注諸司，亦兩除一差，至明威方注丞簿。
HCH_009_054_000228	貞祐三年，制曾虧永、犯選者，遷至宣武，注諸司，至懷遠從四下，方注丞簿，至安遠從四上，注下令。
HCH_009_054_000229	正大元年，制曾犯選、曾虧永者，至廣威與諸司、兩除一差，至安遠注丞簿，三任，其至鎮國從三品下，方注下令。
HCH_009_054_000230	群牧官三周歲為滿，所牧之畜以十為率，駝增二頭，馬增二匹，牛亦如之，羊增四口，而大馬百死十五匹者，及能征前官所虧，三分為率，能盡征及征二分半以上，為上等，升一品級。
HCH_009_054_000231	駝增一，馬牛增二，羊增三，大馬百死二十五，征前官所虧二分以上，為中等，約量升除。
HCH_009_054_000232	駝不增，馬牛增一，羊增二，大馬百死三十，征虧一分以上，為下等，依本等除。
HCH_009_054_000233	餘畜皆依元數，而大馬百死四十，征虧不及一分者，降一等。
HCH_009_054_000234	此明昌四年制也。
HCH_009_054_000235	五年，制馬牛羊虧元數十之一，騬馬百死四十，征虧不及一分者，降一等，決四十。
HCH_009_054_000236	若駝馬牛羊虧元數一分、馬百死四十，征虧不得者，杖八十，降同前。
