HCH_011_026_000000	范岫字懋賓，濟陽考城人也。
HCH_011_026_000001	高祖宣，晉徵士。
HCH_011_026_000002	父羲，宋兗州別駕。
HCH_011_026_000003	岫早孤，事母以孝聞，與吳興沈約俱爲蔡興宗所禮。
HCH_011_026_000004	泰始中，起家奉朝請。
HCH_011_026_000005	興宗爲安西將軍，引爲主簿。
HCH_011_026_000006	累遷臨海、長城二縣令，驃騎參軍，尚書刪定郎，護軍司馬，齊司徒竟陵王子良記室參軍。
HCH_011_026_000007	累遷太子家令。
HCH_011_026_000008	文惠太子之在東宮，沈約之徒以文才見引，岫亦預焉。
HCH_011_026_000009	岫文雖不逮約，而名行爲時輩所與，博涉多通，尤悉魏晉以來吉凶故事。
HCH_011_026_000010	約常稱曰：「范公好事該博，胡廣無以加。」
HCH_011_026_000011	南鄉范雲謂人曰：「諸君進止威儀，當問范長頭。」
HCH_011_026_000012	以岫多識前代舊事也。
HCH_011_026_000013	遷國子博士。
HCH_011_026_000014	永明中，魏使至，有詔妙選朝士有詞辯者，接使於界首，以岫兼淮陰長史迎焉。
HCH_011_026_000015	還遷尚書左丞，母憂去官，尋起攝職。
HCH_011_026_000016	出爲寧朔將軍、南蠻長史、南義陽太守，未赴職，遷右軍諮議參軍，郡如故。
HCH_011_026_000017	除撫軍司馬。
HCH_011_026_000018	出爲建威將軍、安成內史。
HCH_011_026_000019	入爲給事黃門侍郎，遷御史中丞、領前軍將軍、南北兗二州大中正。
HCH_011_026_000020	永元末，出爲輔國將軍、冠軍晉安王長史，行南徐州事。
HCH_011_026_000021	義師平京邑，承制徵爲尚書吏部郎，參大選。
HCH_011_026_000022	梁臺建，爲度支尚書。
HCH_011_026_000023	天監五年，遷散騎常侍、光祿大夫，侍皇太子，給扶。
HCH_011_026_000024	六年，領太子左衛率。
HCH_011_026_000025	七年，徙通直散騎常侍、右衛將軍，中正如故。
HCH_011_026_000026	其年表致事，詔不許。
HCH_011_026_000027	八年，出爲晉陵太守，秩中二千石。
HCH_011_026_000028	九年，入爲祠部尚書，領右驍騎將軍，其年遷金紫光祿大夫，加親信二十人。
HCH_011_026_000029	十三年，卒官，時年七十五。
HCH_011_026_000030	賻錢五萬，布百匹。
HCH_011_026_000031	岫身長七尺八寸，恭敬儼恪，進止以禮。
HCH_011_026_000032	自親喪之後，蔬食布衣以終身。
HCH_011_026_000033	每所居官，恒以廉潔著稱。
HCH_011_026_000034	爲長城令時，有梓材巾箱，至數十年，經貴遂不改易。
HCH_011_026_000035	在晉陵，惟作牙管筆一雙，猶以爲費。
HCH_011_026_000036	所著文集、《禮論》、《雜儀》、《字訓》行於世。
HCH_011_026_000037	二子褒，偉。
HCH_011_026_000038	傅昭，字茂遠，北地靈州人，晉司隸校尉咸七世孫也。
HCH_011_026_000039	祖和之，父淡，善《三禮》，知名宋世。
HCH_011_026_000040	淡事宋竟陵王劉誕，誕反，淡坐誅。
HCH_011_026_000041	昭六歲而孤，哀毀如成人者，宗黨咸異之。
HCH_011_026_000042	十一，隨外祖於朱雀航賣曆日。
HCH_011_026_000043	爲雍州刺史袁顗客，顗嘗來昭所，昭讀書自若，神色不改。
HCH_011_026_000044	顗歎曰：「此兒神情不凡，必成佳器。」
HCH_011_026_000045	司徒建安王休仁聞而悅之，因欲致昭，昭以宋氏多故，遂不往。
HCH_011_026_000046	或有稱昭於廷尉虞愿，愿乃遣車迎昭。
HCH_011_026_000047	時愿宗人通之在坐，並當世名流，通之贈昭詩曰：「英妙擅山東，才子傾洛陽。清塵誰能嗣，及爾遘遺芳。」
HCH_011_026_000048	太原王延秀薦昭於丹陽尹袁粲，深爲所禮，辟爲郡主簿，使諸子從昭受學。
HCH_011_026_000049	會明帝崩，粲造哀策文，乃引昭定其所制。
HCH_011_026_000050	每經昭戶，輒歎曰：「經其戶，寂若無人，披其帷，其人斯在，豈非名賢！」
HCH_011_026_000051	尋爲總明學士、奉朝請。
HCH_011_026_000052	齊永明中，累遷員外郎、司徒竟陵王子良參軍、尚書儀曹郎。
HCH_011_026_000053	先是御史中丞劉休薦昭於武帝，永明初，以昭爲南郡王侍讀。
HCH_011_026_000054	王嗣帝位，故時臣隸爭求權寵，惟昭及南陽宗夬，保身守正，無所參入，竟不罹其禍。
HCH_011_026_000055	明帝踐阼，引昭爲中書通事舍人。
HCH_011_026_000056	時居此職者，皆勢傾天下，昭獨廉靜，無所干豫。
HCH_011_026_000057	器服率陋，身安粗糲。
HCH_011_026_000058	常插燭於板床，明帝聞之，賜漆合燭盤等，敕曰：「卿有古人之風，故賜卿古人之物。」
HCH_011_026_000059	累遷車騎臨海王記室參軍，長水校尉，太子家令，驃騎晉安王諮議參軍。
HCH_011_026_000060	尋除尚書左丞、本州大中正。
HCH_011_026_000061	高祖素悉昭能，建康城平，引爲驃騎錄事參軍。
HCH_011_026_000062	梁臺建，遷給事黃門侍郎，領著作郎，頃之，兼御史中丞，黃門、著作、中正並如故。
HCH_011_026_000063	天監三年，兼五兵尚書，參選事，四年，卽真。
HCH_011_026_000064	六年，徙爲左民尚書，未拜，出爲建威將軍、平南安成王長史、尋陽太守。
HCH_011_026_000065	七年，入爲振遠將軍、中權長史。
HCH_011_026_000066	八年，遷通直散騎常侍，領步兵校尉，復領本州大中正。
HCH_011_026_000067	十年，復爲左民尚書。
HCH_011_026_000068	十一年，出爲信武將軍、安成內史。
HCH_011_026_000069	安成自宋已來兵亂，郡舍號凶。
HCH_011_026_000070	及昭爲郡，郡內人夜夢見兵馬鎧甲甚盛，又聞有人云「當避善人」，軍衆相與騰虛而逝。
HCH_011_026_000071	夢者驚起。
HCH_011_026_000072	俄而疾風暴雨，倏忽便至，數間屋俱倒，卽夢者所見軍馬踐蹈之所也。
HCH_011_026_000073	自後郡舍遂安，咸以昭正直所致。
HCH_011_026_000074	郡溪無魚，或有暑月薦昭魚者，昭旣不納，又不欲拒，遂餧于門側。
HCH_011_026_000075	十二年，入爲秘書監，領後軍將軍。
HCH_011_026_000076	十四年，遷太常卿。
HCH_011_026_000077	十七年，出爲智武將軍、臨海太守。
HCH_011_026_000078	郡有蜜巖，前後太守皆自封固，專收其利。
HCH_011_026_000079	昭以周文之囿，與百姓共之，大可喻小，乃教勿封。
HCH_011_026_000080	縣令常餉栗，置絹于薄下，昭笑而還之。
HCH_011_026_000081	普通二年，入爲通直散騎常侍、光祿大夫，領本州大中正，尋領秘書監。
HCH_011_026_000082	五年，遷散騎常侍、金紫光祿大夫，中正如故。
HCH_011_026_000083	昭所蒞官，常以清靜爲政，不尚嚴肅。
HCH_011_026_000084	居朝廷，無所請謁，不畜私門生，不交私利。
HCH_011_026_000085	終日端居，以書記爲樂，雖老不衰。
HCH_011_026_000086	博極古今，尤善人物，魏晉以來，官宦簿伐，姻通內外，舉而論之，無所遺失。
HCH_011_026_000087	性尤篤慎。
HCH_011_026_000088	子婦嘗得家餉牛肉以進，昭召其子曰：「食之則犯法，告之則不可，取而埋之。」
HCH_011_026_000089	其居身行己，不負闇室，類皆如此。
HCH_011_026_000090	京師後進，宗其學，重其道，人人自以爲不逮。
HCH_011_026_000091	大通二年九月，卒，時年七十五。
HCH_011_026_000092	詔賻錢三萬，布五十匹，卽日舉哀，諡曰貞子。
HCH_011_026_000093	長子諝，尚書郎，臨安令。
HCH_011_026_000094	次子肱。
HCH_011_026_000095	映字徽遠，昭弟也。
HCH_011_026_000096	三歲而孤。
HCH_011_026_000097	兄弟友睦，修身厲行，非禮不行。
HCH_011_026_000098	始昭之守臨海，陸倕餞之，賓主俱歡，日昏不反，映以昭年高，不可連夜極樂，乃自往迎候，同乘而歸，兄弟並已斑白，時人美而服焉。
HCH_011_026_000099	及昭卒，映喪之如父，年逾七十，哀戚過禮，服制雖除，每言輒感慟。
HCH_011_026_000100	映泛涉記傳，有文才，而不以篇什自命。
HCH_011_026_000101	少時與劉繪、蕭琛相友善，繪之爲南康相，映時爲府丞，文教多令具草。
HCH_011_026_000102	褚彥回聞而悅之，乃屈與子賁等遊處。
HCH_011_026_000103	年未弱冠，彥回欲令仕，映以昭未解褐，固辭，須昭仕乃官。
HCH_011_026_000104	永元元年，參鎮軍江夏王軍事，出爲武康令。
HCH_011_026_000105	及高祖師次建康，吳興太守袁昂自謂門世忠貞，固守誠節，乃訪於映曰：「卿謂時事云何？」
HCH_011_026_000106	映答曰：「元嘉之末，開闢未有，故太尉殺身以明節，司徒當寄託之重，理無苟全，所以不顧夷險，以殉名義。今嗣主昏虐，狎近羣小，親賢誅戮，君子道消，外難屢作，曾無悛改。今荊、雍協舉，乘據上流，背昏向明，勢無不濟。百姓思治，天人之意可知；旣明且哲，忠孝之途無爽。願明府更當雅慮，無祇悔也。」
HCH_011_026_000107	尋以公事免。
HCH_011_026_000108	天監初，除征虜鄱陽王參軍，建安王中權錄事參軍，領軍長史，烏程令。
HCH_011_026_000109	所受俸祿，悉歸于兄。
HCH_011_026_000110	復爲臨川王錄事參軍，南臺治書，安成王錄事，太子翊軍校尉，累遷中散大夫、光祿卿，太中大夫。
HCH_011_026_000111	大同五年，卒，年八十三。
HCH_011_026_000112	子弘。
HCH_011_026_000113	蕭琛字彥瑜，蘭陵人。
HCH_011_026_000114	祖僧珍，宋廷尉卿。
HCH_011_026_000115	父惠訓，太中大夫。
HCH_011_026_000116	琛年數歲，從伯惠開撫其背曰：「必興吾宗。」
HCH_011_026_000117	琛少而朗悟，有縱橫才辯。
HCH_011_026_000118	起家齊太學博士。
HCH_011_026_000119	時王儉當朝，琛年少，未爲儉所識，負其才氣，欲候儉。
HCH_011_026_000120	時儉宴于樂游苑，琛乃著虎皮靴，策桃枝杖，直造儉坐，儉與語，大悅。
HCH_011_026_000121	儉爲丹陽尹，辟爲主簿，舉爲南徐州秀才，累遷司徒記室。
HCH_011_026_000122	永明九年，魏始通好，琛再銜命到桑乾，還爲通直散騎侍郎。
HCH_011_026_000123	時魏遣李道固來使，齊帝宴之。
HCH_011_026_000124	琛於御筵舉酒勸道固，道固不受，曰：「公庭無私禮，不容受勸。」
HCH_011_026_000125	琛徐答曰：「《詩》所謂『雨我公田，遂及我私』。」
HCH_011_026_000126	座者皆服，道固乃受琛酒。
HCH_011_026_000127	遷司徒右長史。
HCH_011_026_000128	出爲晉熙王長史、行南徐州事。
HCH_011_026_000129	還兼少府卿、尚書左丞。
HCH_011_026_000130	東昏初嗣立，時議以無廟見之典，琛議據《周頌烈文》、《閔予》皆爲卽位朝廟之典，於是從之。
HCH_011_026_000131	高祖定京邑，引爲驃騎諮議，領錄事，遷給事黃門侍郎。
HCH_011_026_000132	梁臺建，爲御史中丞。
HCH_011_026_000133	天監元年，遷庶子，出爲宣城太守。
HCH_011_026_000134	徵爲衛尉卿，俄遷員外散騎常侍。
HCH_011_026_000135	三年，除太子中庶子、散騎常侍。
HCH_011_026_000136	九年，出爲寧遠將軍、平西長史、江夏太守。
HCH_011_026_000137	始琛在宣城，有北僧南度，惟賚一葫蘆，中有《漢書序傳》。
HCH_011_026_000138	僧曰：「三輔舊老相傳，以爲班固真本。」
HCH_011_026_000139	琛固求得之，其書多有異今者，而紙墨亦古，文字多如龍舉之例，非隸非篆，琛甚秘之。
HCH_011_026_000140	及是行也，以書饟鄱陽王範，範乃獻于東宮。
HCH_011_026_000141	琛尋遷安西長史、南郡太守，母憂去官，又丁父艱。
HCH_011_026_000142	起爲信武將軍、護軍長史，俄爲貞毅將軍、太尉長史。
HCH_011_026_000143	出爲信威將軍、東陽太守，遷吳興太守。
HCH_011_026_000144	郡有項羽廟，土民名爲憤王，甚有靈驗，遂於郡廳事安施床幕爲神座，公私請禱，前後二千石皆於廳拜祠，而避居他室。
HCH_011_026_000145	琛至，徙神還廟，處之不疑。
HCH_011_026_000146	又禁殺牛解祀，以脯代肉。
HCH_011_026_000147	琛頻蒞大郡，不治產業，有闕則取，不以爲嫌。
HCH_011_026_000148	普通元年，徵爲宗正卿，遷左民尚書，領南徐州大中正，太子右衛率。
HCH_011_026_000149	徙度支尚書，左驍騎將軍，領軍將軍，轉秘書監、後軍將軍，遷侍中。
HCH_011_026_000150	高祖在西邸，早與琛狎，每朝宴，接以舊恩，呼爲宗老。
HCH_011_026_000151	琛亦奉陳昔恩，以「早簉中陽，夙忝同閈，雖迷興運，猶荷洪慈。」
HCH_011_026_000152	上答曰：「雖云早契闊，乃自非同志；勿談興運初，且道狂奴異。」
HCH_011_026_000153	琛常言：「少壯三好，音律、書、酒。年長以來，二事都廢，惟書籍不衰。」
HCH_011_026_000154	而琛性通脫，常自解竈，事畢餕餘，必陶然致醉。
HCH_011_026_000155	大通二年，爲金紫光祿大夫，加特進，給親信三十人。
HCH_011_026_000156	中大通元年，爲雲麾將軍、晉陵太守，秩中二千石。
HCH_011_026_000157	以疾自解，改授侍中、特進、金紫光祿大夫。
HCH_011_026_000158	卒，年五十二。
HCH_011_026_000159	遺令諸子，與妻同墳異藏，祭以蔬菜，葬日止車十乘，事存率素。
HCH_011_026_000160	乘輿臨哭甚哀。
HCH_011_026_000161	詔贈本官，加雲麾將軍，給東園秘器，朝服一具，衣一襲，賻錢二十萬，布百匹。
HCH_011_026_000162	諡曰平子。
HCH_011_026_000163	陸杲字明霞，吳郡吳人。
HCH_011_026_000164	祖徽，宋輔國將軍、益州刺史。
HCH_011_026_000165	父叡，揚州治中。
HCH_011_026_000166	杲少好學，工書畫，舅張融有高名，杲風韻舉動，頗類於融，時稱之曰：「無對日下，惟舅與甥。」
HCH_011_026_000167	起家齊中軍法曹行參軍，太子舍人，衛軍王儉主簿。
HCH_011_026_000168	遷尚書殿中曹郎，拜日，八座丞郎並到上省交禮，而杲至晚，不及時刻，坐免官。
HCH_011_026_000169	久之，以爲司徒竟陵王外兵參軍，遷征虜宜都王功曹史，驃騎晉安王諮議參軍，司徒從事中郎。
HCH_011_026_000170	梁臺建，以爲驃騎記室參軍，遷相國西曹掾。
HCH_011_026_000171	天監元年，除撫軍長史，母憂去職。
HCH_011_026_000172	服闋，拜建威將軍、中軍臨川王諮議參軍，尋遷黃門侍郎，右軍安成王長史。
HCH_011_026_000173	五年，遷御史中丞。
HCH_011_026_000174	杲性婞直，無所顧望。
HCH_011_026_000175	山陰令虞肩在任，贓污數百萬，杲奏收治。
HCH_011_026_000176	中書舍人黃睦之以肩事託杲，杲不答。
HCH_011_026_000177	高祖聞之，以問杲，杲答曰「有之」。
HCH_011_026_000178	高祖曰：「卿識睦之不？」
HCH_011_026_000179	杲答曰：「臣不識其人。」
HCH_011_026_000180	時睦之在御側，上指示杲曰：「此人是也。」
HCH_011_026_000181	杲謂睦之曰：「君小人，何敢以罪人屬南司？」
HCH_011_026_000182	睦之失色。
HCH_011_026_000183	領軍將軍張稷，是杲從舅，杲嘗以公事彈稷，稷因侍宴訴高祖曰：「陸杲是臣通親，小事彈臣不貸。」
HCH_011_026_000184	高祖曰：「杲職司其事，卿何得爲嫌！」
HCH_011_026_000185	杲在臺，號稱不畏強禦。
HCH_011_026_000186	六年，遷秘書監，頃之爲太子中庶子、光祿卿。
HCH_011_026_000187	八年，出爲義興太守，在郡寬惠，爲民下所稱。
HCH_011_026_000188	還爲司空臨川王長史、領揚州大中正。
HCH_011_026_000189	十四年，遷通直散騎侍郎，俄遷散騎常侍，中正如故。
HCH_011_026_000190	十五年，遷司徒左長史。
HCH_011_026_000191	十六年，入爲左民尚書，遷太常卿。
HCH_011_026_000192	普通二年，出爲仁威將軍、臨川內史。
HCH_011_026_000193	五年，入爲金紫光祿大夫，又領揚州大中正。
HCH_011_026_000194	中大通元年，加特進，中正如故。
HCH_011_026_000195	四年，卒，時年七十四。
HCH_011_026_000196	諡曰質子。
HCH_011_026_000197	杲素信佛法，持戒甚精，著《沙門傳》三十卷。
HCH_011_026_000198	弟煦，學涉有思理。
HCH_011_026_000199	天監初，歷中書侍郎，尚書左丞，太子家令，卒。
HCH_011_026_000200	撰《晉書》未就。
HCH_011_026_000201	又著《陸史》十五卷，《陸氏驪泉志》一卷，並行於世。
HCH_011_026_000202	子罩，少篤學，有文才，仕至太子中庶子、光祿卿。
HCH_011_026_000203	史臣曰：范岫、傅昭，並篤行清慎，善始令終，斯石建、石慶之徒矣。
HCH_011_026_000204	蕭琛、陸杲俱以才學著名。
HCH_011_026_000205	琛朗悟辯捷，加諳究朝典，高祖在田，與琛遊舊，及踐天曆，任遇甚隆，美矣。
HCH_011_026_000206	杲性婞直，無所忌憚，旣而執法憲臺，糾繩不避權幸，可謂允茲正色。
HCH_011_026_000207	《詩》云：「彼己之子，邦之司直。」
HCH_011_026_000208	杲其有焉。
HCH_011_026_000209	本唐朝作品在全世界都属于公有领域，因为作者逝世已经遠遠超过100年。
