HCH_012_262_000001	傅宗龍，字仲綸，昆明人。
HCH_012_262_000002	萬歷三十八年進士。
HCH_012_262_000003	除銅梁知縣，調巴縣，行取，入為戶部主事。
HCH_012_262_000004	久之，授御史。
HCH_012_262_000005	天啟元年，遼陽破，帝下募兵之令，宗龍請行。
HCH_012_262_000006	一月餘，得精卒五千。
HCH_012_262_000007	明年，安邦彥反，圍貴陽，土寇蜂起。
HCH_012_262_000008	請發帑金濟滇將士，開建昌，通由蜀入滇之路，別設偏沅巡撫，罷湖廣退怯總兵薛來允。
HCH_012_262_000009	帝多采納之。
HCH_012_262_000010	又上疏自請討賊，言：「為武定、尋甸患者，東川土酋祿千鐘。為沾益、羅平患者，賊婦設科及其黨李賢輩。攻圍普安，為滇、黔門戶患者，龍文治妻及其黨尹二。困安南，據關索嶺者，沙國珍及羅應魁輩。困烏撒者，安效良。臣皆悉其生平，非臣敵。臣願以四川巡按兼貴州監軍，滅此群醜。」
HCH_012_262_000011	帝大喜，下所司議。
HCH_012_262_000012	會宗龍以疾歸，不果行。
HCH_012_262_000013	四年正月，貴州巡撫王三善為降賊陳其愚所紿，敗歿。
HCH_012_262_000014	其夏即家起宗龍巡按其地，兼監軍。
HCH_012_262_000015	初，部檄滇撫閔洪學援黔，以不能過盤江而止。
HCH_012_262_000016	宗龍既被命，洪學令參政謝存仁、參將袁善及土官普名聲、沙如玉等以兵五千送之。
HCH_012_262_000017	宗龍直渡盤江，戰且行，寇悉破。
HCH_012_262_000018	乃謝遣存仁、善，以名聲等土兵七百人入貴陽，擒斬其愚，軍民大快。
HCH_012_262_000019	宗龍盡知黔中要害及土酋逆順，將士勇怯。
HCH_012_262_000020	巡撫蔡復一倚信之，請敕宗龍專理軍務，設中軍旗鼓，裨將以下聽賞罰，可之。
HCH_012_262_000021	宗龍乃條上方略，又備陳黔中艱苦，請大發餉金，亦報可。
HCH_012_262_000022	初，三善令監軍道臣節制諸將，文武不和，進退牽制。
HCH_012_262_000023	宗龍反其所為，令監軍給芻糧，核功罪，不得專進止。
HCH_012_262_000024	由是諸將用命，連破賊汪家沖、蔣義寨，直抵織金。
HCH_012_262_000025	五年正月，總理魯欽敗績於陸廣河。
HCH_012_262_000026	宗龍上言：「不合滇、蜀，則黔不能平賊；不專總督任，則不能合滇、蜀兵。請召還朱燮元，以復一兼督四川，開府遵義，而移蜀撫駐永寧，滇撫駐沾益，黔撫駐陸廣，沅撫駐偏橋，四面並進，發餉二百萬金給之。更設黔、蜀巡撫。」
HCH_012_262_000027	帝以復一新敗，令解官，即以燮元代，而命尹同臯撫蜀，王瑊撫黔，沅撫閔夢得移鎮，一如宗龍議。
HCH_012_262_000028	陸廣敗後，諸苗復蠢動。
HCH_012_262_000029	復一、宗龍謀，討破烏粟、螺螄、長田諸叛苗，大破平越賊，毀其砦百七十，賊黨漸孤。
HCH_012_262_000030	宗龍乃條上屯守策，言：蜀以屯為守，黔則當以守為屯。
HCH_012_262_000031	蓋安酋土地半在水外，仡佬、龍仲、蔡苗諸雜種，緩急與相助。
HCH_012_262_000032	賊有外藩，我無邊蔽，黔兵所以分力愈詘。
HCH_012_262_000033	臣謂以守為屯者，先發兵據河，奪賊所恃。
HCH_012_262_000034	然後撫剿諸種，隨渡口大小，置大小寨，深溝高壘，置烽墩炮臺。
HCH_012_262_000035	小渡則塞以木石，使一粟不入水內，一賊不出水外，賊無如我何。
HCH_012_262_000036	又令沿河兵習水戰，當賊耕耨時，頻出奇兵，渡河擾之。
HCH_012_262_000037	賊不敢附河而居，而後我可以議屯也。
HCH_012_262_000038	屯之策有二：一曰清衛所原田，一曰割逆賊故壤，而以衛所之法行之。
HCH_012_262_000039	蓋黔不患無田，患無人。
HCH_012_262_000040	客兵聚散無常，不能久駐，莫若仿祖制，盡舉屯田以授有功，因功大小，為官高下，自指揮至總、小旗，畀以應得田為世業，而禁其私賣買。
HCH_012_262_000041	不待招徠，戶口自實。
HCH_012_262_000042	臣所謂以守為屯者如此。
HCH_012_262_000043	然兵當用四萬八千人，餉當歲八十餘萬，時當閱三年，如此而後賊可盡滅也。
HCH_012_262_000044	部議從之。
HCH_012_262_000045	復一卒，王瑊代，事悉倚辦。
HCH_012_262_000046	宗龍乃漸剪水外逆黨，將大興屯田。
HCH_012_262_000047	邦彥懼，謀沮之，六年三月，大舉渡河入寇。
HCH_012_262_000048	宗龍擊破邦彥趙官屯，斬老蟲添，威名大著。
HCH_012_262_000049	當是時，大帥新亡，全黔震動，燮元遠在蜀，瑊擁虛位，非宗龍，黔幾殆。
HCH_012_262_000050	詔加太僕少卿。
HCH_012_262_000051	憂歸。
HCH_012_262_000052	崇禎三年起故官。
HCH_012_262_000053	用孫承宗薦，擢右僉都御史，巡撫順天。
HCH_012_262_000054	未幾，拜兵部右侍郎兼僉都御史，總督薊、遼、保定軍務。
HCH_012_262_000055	用小故奪官矣。
HCH_012_262_000056	居久之，十年十月流寇大入蜀，陷蜀三十餘州縣，帝拊髀而思宗龍曰：「使宗龍撫蜀，賊安至是哉！」
HCH_012_262_000057	趣即家起宗龍。
HCH_012_262_000058	宗龍至蜀，代王維章與總兵羅尚文禦卻賊。
HCH_012_262_000059	十二年五月，以楊嗣昌薦，召為兵部尚書，去蜀。
HCH_012_262_000060	宗龍自定黔亂後，凡十有四年，輒起用，用不久輒遷去。
HCH_012_262_000061	八月至京，入見帝。
HCH_012_262_000062	宗龍為人伉直任氣，不能從諛承意。
HCH_012_262_000063	帝憤中樞失職，嗣昌以權詭得主知。
HCH_012_262_000064	宗龍樸忠，初入見，即言民窮財盡。
HCH_012_262_000065	帝頗然之，顧豤言不已，遂怫然曰：「卿當整理兵事爾。」
HCH_012_262_000066	既退，語嗣昌曰：「何哉？宗龍善策黔，而所言卑卑，皆他人唾余，何也？」
HCH_012_262_000067	自是所奏請，多中格。
HCH_012_262_000068	熊文粲既罷，宗龍乃言：「向者賊流突東西，嗣昌故建分剿之策。今則流突者各止其所，臣請收勢險節短之效。總理止轄楚、豫，秦督兼轄四川，鳳督兼轄安慶，各率所轄撫鎮，期十二月成功。」
HCH_012_262_000069	因薦湖廣巡撫方孔炤堪代文燦。
HCH_012_262_000070	帝不用，用嗣昌督師。
HCH_012_262_000071	嗣昌既督師，上章請兵食，不悉應，劾中樞不任。
HCH_012_262_000072	宗龍亦劾嗣昌徒耗敝國家，不能報效，以氣淩廷臣。
HCH_012_262_000073	會薊遼總督洪承疇請用劉肇基為團練總兵官，中官高起潛又揭肇基恇怯，宗龍不即覆。
HCH_012_262_000074	帝遂發怒，責以抗旨，令對狀。
HCH_012_262_000075	奏上，復以戲視封疆下吏。
HCH_012_262_000076	法司擬戍邊，不許，欲置之死。
HCH_012_262_000077	在獄二年矣，十四年春，嗣昌死，尚書陳新甲薦其才，帝未有以應也，良久曰：「樸忠，吾以夙負用之，宜盡死力。」
HCH_012_262_000078	遂釋之出獄，以兵部右侍郎兼右僉都御史代丁啟睿，總督陜西三邊軍務。
HCH_012_262_000079	當是之時，李自成有眾五十萬，自陷河、洛，犯開封，羅汝才復自南陽趨鄧、淅，與合兵。
HCH_012_262_000080	帝命宗龍專辦自成。
HCH_012_262_000081	議盡括關中兵餉以出，然屬郡旱蝗，已不能應。
HCH_012_262_000082	九月四日，以川、陜兵二萬出關，次新蔡，與保督楊文嶽兵會。
HCH_012_262_000083	賀人龍、李國奇將秦兵，虎大威將保兵，共結浮橋，東渡汝，合兵趨項城。
HCH_012_262_000084	五日，兩軍畢渡，走龍口。
HCH_012_262_000085	自成、汝才亦結浮橋於上流，將趨汝寧。
HCH_012_262_000086	覘兩督兵至，盡伏精銳於林中，陽驅諸賊自浮橋西渡。
HCH_012_262_000087	人龍使後騎覘賊，還報曰：「賊向汝矣，結浮橋將渡矣。」
HCH_012_262_000088	宗龍、文嶽夜會諸將於龍口，詰朝將戰。
HCH_012_262_000089	六日，兩軍並進，中道一騎馳而告曰：「賊畢渡矣。」
HCH_012_262_000090	復進，一騎馳而告曰：「賊半渡矣，三分渡其二矣。」
HCH_012_262_000091	宗龍、文嶽曰：「驅之。」
HCH_012_262_000092	走三十里，至於孟家莊，日卓午。
HCH_012_262_000093	人龍、大威曰：「馬力乏矣，詰朝而戰，止兵為營。」
HCH_012_262_000094	諸軍弛馬甲，植戈錞，散行墟落求芻牧。
HCH_012_262_000095	賊覘之，塵起於林中，伏甲並出搏我兵。
HCH_012_262_000096	人龍有馬千騎不戰，國奇以麾下兵迎擊之，不勝。
HCH_012_262_000097	秦兵、保兵俱潰，人龍、大威奔沈丘，國奇從之，三帥師潰。
HCH_012_262_000098	宗龍、文嶽合兵屯火燒店，賊以步兵攻其營。
HCH_012_262_000099	諸軍鳴大炮，震死賊百餘。
HCH_012_262_000100	日暮，賊引去。
HCH_012_262_000101	宗龍軍西北，文嶽軍東南，畫塹而守。
HCH_012_262_000102	保兵宵潰，保督副將挾文嶽騎而馳，夜奔於項城。
HCH_012_262_000103	宗龍復分秦兵立營於東南，諸將分壁當賊壘。
HCH_012_262_000104	九日，檄人龍、國奇還兵救，二帥不應。
HCH_012_262_000105	宗龍曰：「彼避死，宜不來，吾豈避死哉！」
HCH_012_262_000106	語其麾下曰：「宗龍老矣，今日陷賊中，當與諸軍決一死戰，不能效他人卷甲走也。」
HCH_012_262_000107	召裨校李本實，即文嶽壁穿塹築壘以拒賊。
HCH_012_262_000108	賊亦穿壕二重以圍之。
HCH_012_262_000109	十一日，秦師食盡，宗龍殺馬騾以享軍。
HCH_012_262_000110	明日，營中馬騾盡，殺賊取其屍分啖之。
HCH_012_262_000111	十八日，營中火藥、鉛子、矢並盡。
HCH_012_262_000112	宗龍簡士卒，夷傷死喪之余，有眾六千。
HCH_012_262_000113	夜半，潛勒諸軍突賊營，殺千餘人，潰圍出。
HCH_012_262_000114	諸軍星散，宗龍徒步率諸軍且戰且走。
HCH_012_262_000115	十九日，日卓午，未至項城八里，賊追及之，執宗龍，呼於門曰：「秦督圍隨官丁也，請啟門納秦督。」
HCH_012_262_000116	宗龍大呼曰：「我秦督也，不幸墮賊手，左右皆賊耳。」
HCH_012_262_000117	賊唾宗龍。
HCH_012_262_000118	宗龍罵賊曰：「我大臣也，殺則殺耳，豈能為賊賺城以緩死哉！」
HCH_012_262_000119	賊抽刀擊宗龍，中其腦而仆，檆其耳鼻死城下。
HCH_012_262_000120	事聞，帝曰：「若此，可謂樸忠矣。」
HCH_012_262_000121	復官兵部尚書，加太子少保，謚忠壯，蔭子錦衣世百戶，予祭葬。
HCH_012_262_000122	人龍、國奇兵潰歸陜，賊遂屠項城。
HCH_012_262_000123	分兵屠商水、扶溝，遂攻葉縣。
HCH_012_262_000124	汪喬年，字歲星，遂安人。
HCH_012_262_000125	天啟二年進士。
HCH_012_262_000126	授刑部主事，歷郎中。
HCH_012_262_000127	母憂歸。
HCH_012_262_000128	崇禎二年起工部，遷青州知府。
HCH_012_262_000129	以治行卓異，遷登萊兵備副使，乞終養歸。
HCH_012_262_000130	父喪除，起官平陽，遷陜西右參政，提督學校。
HCH_012_262_000131	再以卓異，就遷按察使。
HCH_012_262_000132	喬年清若自勵，惡衣菲食，之官，攜二仆，不以家自隨。
HCH_012_262_000133	為青州，行廊置土銼十餘，訟者自炊候鞫，吏無敢索一錢。
HCH_012_262_000134	自負才武，休沐輒馳騎，習弓刀擊刺，寢處風露中。
HCH_012_262_000135	十四年，擢右僉都御史，巡撫陜西。
HCH_012_262_000136	時李自成已破河南，聲言入關。
HCH_012_262_000137	喬年疾驅至商、洛，不見賊。
HCH_012_262_000138	賊圍開封，而三邊總督傅宗龍亦至陜，議抽兵括餉，則關中兵食已盡，無以應。
HCH_012_262_000139	宗龍、喬年握手欷歔而別。
HCH_012_262_000140	未幾，宗龍敗歿於項城，喬年流涕嘆曰：「傅公死，討賊無人矣。」
HCH_012_262_000141	已，又聞詔擢喬年兵部右侍郎，總督三邊軍務，代宗龍。
HCH_012_262_000142	部檄踵至，趣出關。
HCH_012_262_000143	是時，關中精銳盡沒於項城。
HCH_012_262_000144	喬年曰：「兵疲餉乏，當方張之寇。我出，如以肉餵虎耳。然不可不一出，以持中原心。」
HCH_012_262_000145	乃收散亡，調邊卒，得馬步三萬人。
HCH_012_262_000146	十五年正月，率總兵賀人龍、鄭嘉棟、牛成虎出潼關。
HCH_012_262_000147	先是，臨潁為賊守，左良玉破而屠之，盡獲賊所擄。
HCH_012_262_000148	自成聞之怒，舍開封而攻良玉，良玉退保郾城，賊圍之急。
HCH_012_262_000149	喬年諸將議曰：「郾城危在旦夕。吾趨郾，賊方銳，難與爭鋒。吾聞襄城距郾四舍，賊老砦鹹在。吾舍郾而以精銳攻其必應，賊必還兵救，則郾城解矣。郾城解，我擊其前，良玉乘其背，賊可大破也。」
HCH_012_262_000150	諸將皆曰：「善。」
HCH_012_262_000151	乃留步兵火器於洛陽，簡精騎萬人兼程進。
HCH_012_262_000152	次郟縣，襄城人張永祺等迎喬年。
HCH_012_262_000153	二月二日，喬年入襄城，分人龍、嘉棟、成虎軍三路，駐城東四十里，逼郾城而軍，而自勒兵駐城外。
HCH_012_262_000154	賊果解郾城而救襄城。
HCH_012_262_000155	賊至，三帥奔，良玉救不至，軍大潰。
HCH_012_262_000156	喬年嘆曰：「此吾死所也。」
HCH_012_262_000157	率步卒千餘入城守。
HCH_012_262_000158	賊穴地實火藥攻城，喬年亦穿阱，視所鑿，長矛刺之。
HCH_012_262_000159	賊炮擊喬年坐纛，雉堞盡碎，左右環泣請避之，喬年怒，以足蹴其首曰：「汝畏死，我不畏死也。」
HCH_012_262_000160	十七日，城陷，巷戰，殺三賊，自剄不殊，為賊所執，大罵。
HCH_012_262_000161	賊割其舌，磔殺之。
HCH_012_262_000162	襄城人建祠而祀之。
HCH_012_262_000163	時張國欽、張一貫、黨威、李萬慶及監紀西安同知孫兆祿、材官李可從、襄城知縣曹思正從喬年，皆死之。
HCH_012_262_000164	萬慶者，降將射塌天也。
HCH_012_262_000165	又有馬帥某者，逸其名。
HCH_012_262_000166	兆祿，鹽山人。
HCH_012_262_000167	可從，盩厔人。
HCH_012_262_000168	黨威，神木人。
HCH_012_262_000169	余莫考。
HCH_012_262_000170	黨威則嘗擊賊於西雒峪，擒賊首竇阿婆者也。
HCH_012_262_000171	自成購永祺不得，屠其族，劓刖諸生劉漢臣等百九十人。
HCH_012_262_000172	自成數月之間再敗秦師，獲馬二萬，降秦兵又數萬，威震河雒。
HCH_012_262_000173	初，喬年之撫陜西也，奉詔發自成先冢。
HCH_012_262_000174	米脂令邊大受，河間靜海舉人，健令也，诇得其族人為縣吏者，掠之。
HCH_012_262_000175	言：「去縣二百里曰李氏村，亂山中，十六冢環而葬，中其始祖也。相傳，穴，仙人所定，壙中鐵燈檠，鐵燈不滅，李氏興。」
HCH_012_262_000176	如其言發之螻蟻數石，火光熒熒然。
HCH_012_262_000177	檆棺，骨青黑，被體黃毛，腦後穴大如錢，赤蛇盤，三四寸，角而飛，高丈許，咋咋吞日光者六七，反而伏。
HCH_012_262_000178	喬年函其顱骨、臘蛇以聞，焚其餘，雜以穢，棄之。
HCH_012_262_000179	自成聞之，嚙齒大恨曰：「吾必致死於喬年。」
HCH_012_262_000180	既殺喬年，由西華攻陳州。
HCH_012_262_000181	楊文嶽，字鬥望，南充人。
HCH_012_262_000182	萬歷四十七年進士。
HCH_012_262_000183	授行人。
HCH_012_262_000184	天啟五年，擢兵科給事中，屢遷禮科都給事中。
HCH_012_262_000185	崇禎二年，出為江西右參政，歷湖廣、廣西按察使，雲南、山西左右布政使，以右副都御史巡撫登、萊。
HCH_012_262_000186	十二年擢兵部右侍郎，總督保定、山東、河北軍務，代孫傳庭。
HCH_012_262_000187	十四年正月，李自成陷洛陽，犯開封，文嶽率總兵虎大威以眾二萬赴救。
HCH_012_262_000188	渡河，賊先遁，追擊於鳴臯。
HCH_012_262_000189	還，駐兵開封。
HCH_012_262_000190	疫作，乃頓兵於汝寧，出屯西平、新蔡間。
HCH_012_262_000191	七月，自成走內鄉、淅川，與羅汝才合。
HCH_012_262_000192	文嶽趨鄧州，自成還攻之。
HCH_012_262_000193	文嶽戰三捷，斬其魁一條龍、一只龍，賊遁去。
HCH_012_262_000194	九月，會陜西總督傅宗龍於新蔡，與賊遇，大潰於孟家莊，再潰於火燒店。
HCH_012_262_000195	部將挾文嶽夜入於項城。
HCH_012_262_000196	明日奔陳州，宗龍遂覆沒。
HCH_012_262_000197	事聞，文嶽革職，充為事官，戴罪自贖。
HCH_012_262_000198	乃收集散亡，率所部就巡撫高名衡防杞。
HCH_012_262_000199	賊遂破葉縣，拔泌陽，乘勝陷南陽，殺唐王，下鄧州等十四城，再圍開封。
HCH_012_262_000200	明年正月，文嶽馳救開封，論功復官。
HCH_012_262_000201	臨潁為賊守，左良玉破而屠之，退保郾城。
HCH_012_262_000202	自成圍郾城。
HCH_012_262_000203	二月，督師丁啟睿及文嶽、大威救郾城。
HCH_012_262_000204	賊潰，距官軍數里而營。
HCH_012_262_000205	文嶽、啟睿相掎角，持十一晝夜。
HCH_012_262_000206	總督汪喬年出關，賊引去，再攻開封。
HCH_012_262_000207	六月，詔起侯恂兵部右侍郎，總督保定、山東、河南、湖北軍務，代文嶽。
HCH_012_262_000208	命所司察文嶽罪狀。
HCH_012_262_000209	七月朔，文嶽、啟睿合良玉、大威及楊德政、方國安四總兵之師，次朱仙鎮。
HCH_012_262_000210	諸軍盡潰，啟睿、文嶽奔汝寧。
HCH_012_262_000211	賊渡河，追奔四百里，官軍失亡數萬。
HCH_012_262_000212	詔褫官候勘。
HCH_012_262_000213	九月，文嶽在汝寧，夜襲賊營有功。
HCH_012_262_000214	賊既灌開封，旋敗孫傳庭兵，以閏十一月悉眾薄汝寧，老回回、革裏眼、左金王等畢會。
HCH_012_262_000215	文嶽遣都司康世德以輕騎偵賊，世德走還汝，將其步騎五百，夜縱火噪而奔。
HCH_012_262_000216	十三日，群賊並至，壓汝寧五里而軍。
HCH_012_262_000217	監軍僉事孔貞會以川兵屯城東，文嶽以保兵屯城西。
HCH_012_262_000218	賊兵進攻，相持一晝夜。
HCH_012_262_000219	川兵潰，殺傷數百。
HCH_012_262_000220	賊奪其馬騾，悉眾攻保兵，漸不支。
HCH_012_262_000221	僉事王世琮、知府傅汝為、通判朱國寶縋將士入城，副將賈悌、參將馮名聖亦掖文嶽、貞會登城。
HCH_012_262_000222	明日，賊四面環攻，戴扉以陣，矢石雲梯堵墻而立。
HCH_012_262_000223	城頭矢炮擂石雨集，賊死傷山積，而攻不休。
HCH_012_262_000224	一鼓百道並登，執文嶽及世琮、國寶、悌、名聖於城頭，殺汝陽知縣文師頤於城上。
HCH_012_262_000225	汝為聞變，赴水死。
HCH_012_262_000226	賊擁文嶽等見自成，大罵，賊怒，縛之城南三里鋪，以大炮擊之，洞胸糜骨而死。
HCH_012_262_000227	士民屠戮數萬，焚公私廨舍殆盡。
HCH_012_262_000228	貞會執去，不知所終。
HCH_012_262_000229	自成以文嶽死忠，備禮斂之。
HCH_012_262_000230	遂拔營走確山、信陽、泌陽，向襄陽，虜崇王由樻、崇世子、諸王妃及河南懷安諸王以行。
HCH_012_262_000231	汝為，字於宣，江陵人。
HCH_012_262_000232	崇禎七年進士。
HCH_012_262_000233	世琮，字仲發，達州人。
HCH_012_262_000234	國寶，成都人。
HCH_012_262_000235	師頤，全州人。
HCH_012_262_000236	皆舉人。
HCH_012_262_000237	世琮嘗為汝寧推官，討土寇，流矢貫耳不為動，時號王鐵耳者也。
HCH_012_262_000238	師頤蒞任甫三日。
HCH_012_262_000239	孫傳庭，字百雅，代州振武衛人。
HCH_012_262_000240	自父以上，四世舉於鄉。
HCH_012_262_000241	傳庭儀表頎碩，沈毅多籌略。
HCH_012_262_000242	萬歷四十七年成進士，授永城知縣，以才調商丘。
HCH_012_262_000243	天啟初，擢吏部驗封主事，屢遷稽勛郎中，請告歸。
HCH_012_262_000244	家居久不出。
HCH_012_262_000245	崇禎八年秋，始遷驗封郎中，超遷順天府丞。
HCH_012_262_000246	陜西巡撫甘學闊不能討賊，秦之士大夫嘩於朝，乃推邊才用傳庭，以九年三月受代。
HCH_012_262_000247	傳庭蒞秦，嚴征發期會，一從軍興法。
HCH_012_262_000248	秦人愛之不如總督洪承疇，然其才自足辦賊。
HCH_012_262_000249	賊首整齊王據商、雒，諸將不敢攻，檄副將羅尚文擊斬之。
HCH_012_262_000250	當是時，賊亂關中，有名字者以十數，高迎祥最強，拓養坤黨最眾，所謂闖王、蠍子塊者也。
HCH_012_262_000251	傳庭設方略，親擊迎祥於盩厔之黑水峪，擒之，及其偽領哨黃龍、總管劉哲，獻俘闕下。
HCH_012_262_000252	錄功，增秩一等。
HCH_012_262_000253	而賊黨自是乃共推李自成為闖王矣。
HCH_012_262_000254	明年，養坤及其黨張耀文來降。
HCH_012_262_000255	已而養坤叛去，諭其下追斬之。
HCH_012_262_000256	擊賊惠登相於涇陽、三原，登相西走。
HCH_012_262_000257	河南賊馬進忠、劉國能等十七部入渭南，追之出關，復合河南兵夾擊之，先後斬首千餘級。
HCH_012_262_000258	進忠等復擾商、雒、藍田，叛卒與之合，將犯西安。
HCH_012_262_000259	遣左光先、曹變蛟追走之渭南，降其渠一條龍，招還脅從。
HCH_012_262_000260	募健兒擊余賊，斬聖世王、瓦背、一翅飛，降鎮天王、上山虎，又殲白捍賊渠魁數人。
HCH_012_262_000261	關南稍靖。
HCH_012_262_000262	遣副將盛略等敗賊大天王於寶雞，賊走入山谷，傳庭追之鳳翔。
HCH_012_262_000263	他賊出棧道，謀越關犯河南，還軍擊，賊走伏斜谷，復大敗之，降其餘眾。
HCH_012_262_000264	西安四衛，舊有屯軍二萬四千，田二萬餘頃，其後田歸豪右，軍盡虛籍。
HCH_012_262_000265	傳庭厘得軍萬一千有奇，歲收屯課銀十四萬五千餘兩，米麥萬三千五百餘石。
HCH_012_262_000266	帝大喜，增秩，賚銀幣。
HCH_012_262_000267	會楊嗣昌入為本兵，條上方略。
HCH_012_262_000268	洪承疇以秦督兼剿務，而用廣撫熊文燦為總理。
HCH_012_262_000269	分四正六隅，馬三步七，計兵十二萬，加派至二百八十萬，期百日平賊。
HCH_012_262_000270	傳庭移書爭之，曰：「無益，且非特此也。部卒屢經潰蹶，民力竭矣，恐不堪命。必欲行之，賊不必盡，而害中於國家。」
HCH_012_262_000271	累數千言，嗣昌大忤。
HCH_012_262_000272	部議，秦撫當一正面，募土著萬人，給餉銀二十三萬，以商、雒等處為汛守。
HCH_012_262_000273	傳庭知其不可用也，乃核帑藏，蠲贖鍰，得銀四萬八千，市馬募兵，自辦滅賊具，不用部議。
HCH_012_262_000274	會諸撫報募兵及額，傳庭疏獨不至。
HCH_012_262_000275	嗣昌言軍法不行於秦，自請白衣領職，以激帝怒。
HCH_012_262_000276	傳庭奏曰：「使臣如他撫，籍郡縣民兵上之，遂謂及額，則臣先所報屯兵已及額矣。況更有募練馬步軍，數且逾萬，何嘗不遵部議。至百日之期，商、雒之汛守，臣皆不敢委。然使賊入商、雒，而臣不能禦，則治臣罪。若臣扼商、雒，而逾期不能滅賊，誤剿事者必非臣。」
HCH_012_262_000277	嗣昌無以難，然銜之彌甚。
HCH_012_262_000278	傳庭兩奉詔進秩，當加部銜，嗣昌抑弗奏。
HCH_012_262_000279	十一年春，賊破漢陰、石泉，則坐傳庭失援，削其所加秩。
HCH_012_262_000280	傳庭出扼商、雒。
HCH_012_262_000281	大天王等犯慶陽、寶雞，還軍戰合水，破走之，獲其二子，追擊之延安。
HCH_012_262_000282	過天星、混天星等從徽、秦趨鳳翔，逼澄城。
HCH_012_262_000283	傳庭分兵五道擊之楊家嶺、黃龍山，大破之，斬首二千餘級。
HCH_012_262_000284	大天王知二子不殺，遂降。
HCH_012_262_000285	賊引而北，犯延安。
HCH_012_262_000286	傳庭策鄜州西、合水東三四百里，荒山邃谷，賊入當自斃，乃率標兵中部遏其東，檄變蛟、慶陽拒其西，伏兵三水、淳化間。
HCH_012_262_000287	賊饑，出掠食，則大張旗幟，鳴鼓角以邀之，一日夜馳二百五十里。
HCH_012_262_000288	賊大驚，西奔，至職田莊，遇伏而敗；復走寶雞，取棧道，再中伏大敗；折而走隴州關山道，又為伏兵所挫。
HCH_012_262_000289	三敗，賊死者無算，過天星、混天星並降。
HCH_012_262_000290	又逐賊邠、寧間，陷陣，獲其渠。
HCH_012_262_000291	河南賊馬進忠、馬光玉驅宛、洛之眾，箕張而西。
HCH_012_262_000292	傳庭擊之，賊還走。
HCH_012_262_000293	又設伏於潼關原，變蛟逐賊入伏。
HCH_012_262_000294	而闖王李自成者，為洪承疇所逐，盡亡其卒，以十八騎潰圍遁。
HCH_012_262_000295	關中群盜悉平，是為崇禎之十一年春也。
HCH_012_262_000296	捷聞，大喜，先敘澄城之捷，命加傳庭部銜。
HCH_012_262_000297	嗣昌仍格不奏。
HCH_012_262_000298	當是時，總理熊文燦主撫。
HCH_012_262_000299	湖廣賊張獻忠已降，惟河南賊如故。
HCH_012_262_000300	羅汝才、馬進忠、賀一龍、左金王等十三部西窺潼關，聯營數十里。
HCH_012_262_000301	傳庭計曰：「天下大寇盡在此矣。我出擊其西，總理擊其東，賊不降則滅。此賊平，天下無賊矣。獻忠即狙伏，無能為也。」
