HCH_012_046_000820	東北距布政司六十六程。
HCH_012_046_000821	孟定御夷府元孟定路，至元三十一年四月置。
HCH_012_046_000822	洪武十五年三月爲府。
HCH_012_046_000823	東北有無量山，又有喳哩江，與麓川江合。
HCH_012_046_000824	東南有謀粘路，元泰定三年七月置。
HCH_012_046_000825	有木連路，元至正二十六年置。
HCH_012_046_000826	洪武十五年三月俱因之，後俱廢。
HCH_012_046_000827	領安撫司一。
HCH_012_046_000828	東北距布政司十八程。
HCH_012_046_000829	耿馬安撫司萬曆十三年析孟定地置。
HCH_012_046_000830	西有三尖山。
HCH_012_046_000831	南有喳哩江，與孟定分界。
HCH_012_046_000832	北距府百里。
HCH_012_046_000833	孟艮御夷府永樂三年七月置，直隸都司，後直隸布政司。
HCH_012_046_000834	東有木朵路，又有孟隆路，俱元泰定三年九月置。
HCH_012_046_000835	東北有孟愛等甸軍民府，元至元二十六年置。
HCH_012_046_000836	洪武十五年三月俱爲府，後俱廢。
HCH_012_046_000837	北距布政司三十八程。
HCH_012_046_000838	威遠御夷州元威遠州，屬威楚路，後改威遠蠻柵府。
HCH_012_046_000839	洪武十五年三月仍爲威遠州，屬楚雄府。
HCH_012_046_000840	十七年升爲府，後廢。
HCH_012_046_000841	三十五年十二月復置州，直隸布政司。
HCH_012_046_000842	北有蒙樂山，接景東府界。
HCH_012_046_000843	西北有威遠江，一名谷寶江，下流合瀾滄江。
HCH_012_046_000844	東北距布政司十九程。
HCH_012_046_000845	灣甸御夷州本灣甸長官司。
HCH_012_046_000846	永樂元年正月析麓川平緬地置，直隸都司。
HCH_012_046_000847	三年四月升爲州，直隸布政司。
HCH_012_046_000848	西北有高黎共山。
HCH_012_046_000849	北有姚關，與順寧府界。
HCH_012_046_000850	東北距布政司二十程。
HCH_012_046_000851	鎮康御夷州元鎮康路。
HCH_012_046_000852	洪武十五年三月爲府。
HCH_012_046_000853	十七年降爲州，後廢，以其地屬灣甸州。
HCH_012_046_000854	永樂七年七月復置，直隸布政司。
HCH_012_046_000855	西有喳哩江，接潞江安撫司界。
HCH_012_046_000856	南有昔剌寨。
HCH_012_046_000857	西南有控尾寨。
HCH_012_046_000858	東北距布政司二十三程。
HCH_012_046_000859	孟密宣撫司本孟密安撫司。
HCH_012_046_000860	成化二十年六月析木邦地置。
HCH_012_046_000861	萬曆十三年升爲宣撫司。
HCH_012_046_000862	東北有南牙山，與南甸分界。
HCH_012_046_000863	西南有摩勒江，有大金沙江，俱與緬甸分界。
HCH_012_046_000864	又有寶井。
HCH_012_046_000865	北有猛乃、猛哈，東北有孟廣等部。
HCH_012_046_000866	東北距布政司三十三程。
HCH_012_046_000867	蠻莫安撫司萬曆十三年析孟密地置。
HCH_012_046_000868	東北有等練山。
HCH_012_046_000869	西南有那莫江，下流入大金沙江。
HCH_012_046_000870	又西有孟木寨。
HCH_012_046_000871	東北距布政司三十一程。
HCH_012_046_000872	者樂甸長官司永樂元年正月析麓川平緬地置，直隸都司，後改隸布政司。
HCH_012_046_000873	南有瀾滄江。
HCH_012_046_000874	又東有景來河，自景東府流入，下流入馬龍江。
HCH_012_046_000875	東北距布政司千一百七十里。
HCH_012_046_000876	鈕兀御夷長官司宣德八年十月以和泥之鈕兀、五隆二寨置，北距布政司十六程。
HCH_012_046_000877	芒市御夷長官司元芒施路。
HCH_012_046_000878	洪武十五年三月爲府，後廢。
HCH_012_046_000879	正統八年四月改置，屬金齒軍民指揮司，後直隸布政司。
HCH_012_046_000880	西南有永昌幹山，又有孟契山。
HCH_012_046_000881	又有大盈江，西南經青石山下，又西有麓川江來合焉。
HCH_012_046_000882	東北距布政司二十三程孟璉長官司舊爲麓川平緬司地，後爲孟定府。
HCH_012_046_000883	永樂四年四月置，直隸都司。
HCH_012_046_000884	東南有木來府，元置，洪武十五年三月因之，後廢。
HCH_012_046_000885	東北距布政司二十三程。
HCH_012_046_000886	大古剌軍民宣慰使司在孟養西南。
HCH_012_046_000887	亦曰擺古，濱南海，與暹羅鄰、底馬撒軍民宣慰使司在大古剌東南、小古剌長官司、茶山長官司、底板長官司、孟倫長官司、八家塔長官司皆在西南極邊俱永樂四年六月置。
HCH_012_046_000888	刺和莊長官司永樂四年十月置，直隸都司。
HCH_012_046_000889	散金長官司舊俱爲麓川平緬司地。
HCH_012_046_000890	永樂六年四月置。
HCH_012_046_000891	裏麻長官司永樂六年七月析孟養地置，直隸都司。
HCH_012_046_000892	八寨長官司永樂十二年九月置，直隸都司。
HCH_012_046_000893	底兀刺宣慰使司永樂二十二年三月置。
HCH_012_046_000894	地舊爲大古剌所據，上諭還之，故置司。
HCH_012_046_000895	廣邑州本金齒軍民司之廣邑寨。
HCH_012_046_000896	宣德五年五月升爲州。
HCH_012_046_000897	八年十一月直隸布政司。
HCH_012_046_000898	正統元年三月徙於順寧府之右甸。
HCH_012_046_000899	貴州《禹貢》荊、樑二州徼外。
HCH_012_046_000900	元爲湖廣、四川、雲南三行中書省地。
HCH_012_046_000901	洪武十五年正月置貴州都指揮使司，治貴州宣慰司。
HCH_012_046_000902	其民職有司則仍屬湖廣、四川、雲南三布政司。
HCH_012_046_000903	永樂十一年置貴州等處承宣布政使司。
HCH_012_046_000904	與都指揮司同治。
HCH_012_046_000905	領府八，州一，縣一，宣慰司一，長官司三十九。
HCH_012_046_000906	後領府十，州九，縣十四，宣慰司一，長官司七十六。
HCH_012_046_000907	北至銅仁，與湖廣、四川界。
HCH_012_046_000908	南至鎮寧，與廣西、雲南界。
HCH_012_046_000909	東至黎平，與湖廣、廣西界。
HCH_012_046_000910	西至普安，與雲南、四川界。
HCH_012_046_000911	距南京四千二百五十里，京師七千六百七十里。
HCH_012_046_000912	弘治四年，編戶四萬三千三百六十七，口二十五萬八千六百九十三。
HCH_012_046_000913	萬曆六年，戶四萬三千四百五，口二十九萬九百七十二。
HCH_012_046_000914	貴陽軍民府本程番府。
HCH_012_046_000915	成化十二年七月分貴州宣慰司地置，治程番長官司。
HCH_012_046_000916	隆慶二年六月移入布政司城，與宣慰司同治。
HCH_012_046_000917	三年三月改府名貴陽。
HCH_012_046_000918	萬曆二十九年四月升爲軍民府。
HCH_012_046_000919	領州三，縣二，長官司十六：新貴倚。
HCH_012_046_000920	本貴竹長官司，洪武五年正月置，屬宣慰司。
HCH_012_046_000921	萬曆十四年二月改置縣，來屬。
HCH_012_046_000922	西有獅子山。
HCH_012_046_000923	西北有木閣箐山，在水西境內。
HCH_012_046_000924	北有貴人峯。
HCH_012_046_000925	又西有白龍洞。
HCH_012_046_000926	北有烏江，源出水西，與四川遵義府分界，北流至四川彭水縣，入涪陵江。
HCH_012_046_000927	西北有陸廣河，下流入於烏江，有陸廣河巡檢司。
HCH_012_046_000928	又西有宅溪。
HCH_012_046_000929	又西北有蔡家關，一名響水關，又有闊水關。
HCH_012_046_000930	貴定倚。
HCH_012_046_000931	萬曆三十六年析新貴縣及定番州地置。
HCH_012_046_000932	東有銅鼓山，有石門山。
HCH_012_046_000933	南有高連山，有南門河。
HCH_012_046_000934	又東有龍洞河，下流俱入陸廣河。
HCH_012_046_000935	開州崇禎四年十一月以副宣慰洪邊舊地置。
HCH_012_046_000936	西南距府一百二十里。
HCH_012_046_000937	廣順州本金築長官司。
HCH_012_046_000938	洪武五年三月置，屬四川行省。
HCH_012_046_000939	十年正月改安撫司。
HCH_012_046_000940	十九年十二月屬廣西。
HCH_012_046_000941	二十七年仍屬四川。
HCH_012_046_000942	二十九年屬貴州衛。
HCH_012_046_000943	正統三年八月直隸貴州布政司。
HCH_012_046_000944	成化十二年七月屬程番府。
HCH_012_046_000945	隆慶二年六月屬貴陽府。
HCH_012_046_000946	萬曆四十年置州。
HCH_012_046_000947	東南有天台山。
HCH_012_046_000948	北有天生橋。
HCH_012_046_000949	南距府一百一十里。
HCH_012_046_000950	定番州元程番武勝軍安撫司。
HCH_012_046_000951	洪武五年罷。
HCH_012_046_000952	成化十二年七月置程番府，領金築安撫司，上馬橋、大龍番、小龍番、程番、方番、韋番、臥龍番、洪番、小程番、盧番、羅番、金石番、盧山、木瓜、大華、麻響十六長官司。
HCH_012_046_000953	隆慶二年六月移府入布政司城。
HCH_012_046_000954	萬曆十四年三月置州。
HCH_012_046_000955	距府八十五里，領長官司十六：程番長官司倚。
HCH_012_046_000956	洪武五年三月置，屬貴州衛。
HCH_012_046_000957	正統三年八月屬貴州宣慰司。
HCH_012_046_000958	成化十二年七月屬程番府。
HCH_012_046_000959	萬曆十四年三月屬州。
HCH_012_046_000960	北有青巖。
HCH_012_046_000961	南有都泥江，源出州西北亂山中，曰濛潭，經司南，州境之水皆流合焉，入廣西南丹州界。
HCH_012_046_000962	下十二司所屬倣此。
HCH_012_046_000963	小程番長官司州西北。
HCH_012_046_000964	元小程番安撫司。
HCH_012_046_000965	洪武六年正月改置。
HCH_012_046_000966	上馬橋長官司州西北。
HCH_012_046_000967	洪武十五年六月置。
HCH_012_046_000968	盧番長官司州北。
HCH_012_046_000969	元盧番靜海軍安撫司。
HCH_012_046_000970	洪武六年正月改置，省元盧番蠻夷軍民長官司入焉。
HCH_012_046_000971	韋番長官司州南。
HCH_012_046_000972	元韋番蠻夷長官司。
HCH_012_046_000973	洪武十五年六月改置。
HCH_012_046_000974	方番長官司州南。
HCH_012_046_000975	元方番河中府安撫司。
HCH_012_046_000976	洪武五年改置。
HCH_012_046_000977	洪番長官司州西。
HCH_012_046_000978	元洪番永盛軍安撫司。
HCH_012_046_000979	洪武六年正月改置。
HCH_012_046_000980	臥龍番長官司州南。
HCH_012_046_000981	元臥龍番南寧州安撫司。
HCH_012_046_000982	洪武五年改置。
HCH_012_046_000983	小龍番長官司州東南。
HCH_012_046_000984	元小龍番靜蠻軍安撫司。
HCH_012_046_000985	洪武六年正月改置。
HCH_012_046_000986	大龍番長官司州東南。
HCH_012_046_000987	元大龍番應天府安撫司。
HCH_012_046_000988	洪武五年改置。
HCH_012_046_000989	金石番長官司州東。
HCH_012_046_000990	元金石番太平軍安撫司。
HCH_012_046_000991	洪武五年改置。
HCH_012_046_000992	羅番長官司州南。
HCH_012_046_000993	元羅番大龍遏蠻軍安撫司。
HCH_012_046_000994	洪武五年改置。
HCH_012_046_000995	盧山長官司州南。
HCH_012_046_000996	元盧山等處蠻夷軍安撫司。
HCH_012_046_000997	洪武六年正月改置。
HCH_012_046_000998	木瓜長官司元木瓜等處蠻夷軍民長官司。
HCH_012_046_000999	洪武五年改置，屬貴州衛。
HCH_012_046_001000	正統三年八月屬金築安撫司。
HCH_012_046_001001	成化十二年七月，屬程番府。
HCH_012_046_001002	萬曆十四年三月屬州。
HCH_012_046_001003	下二司仿此。
HCH_012_046_001004	麻響長官司洪武七年六月置。
HCH_012_046_001005	大華長官司洪武七年六月置。
HCH_012_046_001006	貴州宣慰使司元改順元路軍民安撫司置，屬湖廣行省。
HCH_012_046_001007	洪武五年正月屬四川行省。
HCH_012_046_001008	九年六月屬四川布政司。
HCH_012_046_001009	永樂十一年二月來屬。
HCH_012_046_001010	有沙溪、的澄河二巡檢司。
HCH_012_046_001011	又有黃沙渡、龍谷二土巡檢司。
HCH_012_046_001012	領長官司七：水東長官司宣慰司北。
HCH_012_046_001013	元水東寨長官司。
HCH_012_046_001014	洪武五年改置，後廢。
HCH_012_046_001015	永樂元年六月置，屬都司，後來屬。
HCH_012_046_001016	中曹蠻夷長官司宣慰司東南。
HCH_012_046_001017	元中曹白納等處長官司，屬管番民總管。
HCH_012_046_001018	洪武五年改置，來屬。
HCH_012_046_001019	龍裏長官司宣慰司東南。
HCH_012_046_001020	元龍裏等寨長官司，屬管番民總管。
HCH_012_046_001021	洪武五年改置，來屬。
HCH_012_046_001022	白納長官司宣慰司東南。
HCH_012_046_001023	元茶山白納等處長官司。
HCH_012_046_001024	洪武五年併入中曹司。
HCH_012_046_001025	永樂四年五月置，來屬。
HCH_012_046_001026	底寨長官司宣慰司北。
HCH_012_046_001027	元底寨等處長官司。
HCH_012_046_001028	洪武五年改置。
HCH_012_046_001029	乖西蠻夷長官司宣慰司東北。
HCH_012_046_001030	元乖西軍民府，屬管番民總管。
HCH_012_046_001031	洪武五年改置，後廢。
HCH_012_046_001032	永樂元年六月復置，屬都司，後來屬。
HCH_012_046_001033	養龍坑長官司宣慰司北。
HCH_012_046_001034	元養龍坑宿徵等處長官司。
HCH_012_046_001035	洪武五年改置。
HCH_012_046_001036	安順軍民府元安順州，屬普定路。
HCH_012_046_001037	洪武十五年三月屬普定府。
HCH_012_046_001038	十八年直隸雲南布政司。
HCH_012_046_001039	二十五年八月屬四川普定衛。
HCH_012_046_001040	正統三年八月直隸貴州布政司。
HCH_012_046_001041	成化中，徙州治普定衛城。
HCH_012_046_001042	萬曆三十年九月升安順軍民府。
HCH_012_046_001043	普定衛舊在州西北，洪武十五年正月置，屬四川都司。
HCH_012_046_001044	三月升軍民指揮使司，正統三年改屬貴州都司。
HCH_012_046_001045	成化中，州自衛東南來同治。
HCH_012_046_001046	西北有舊坡山，兩峯相對，中有石關。
HCH_012_046_001047	東有巖孔山。
HCH_012_046_001048	北有歡喜嶺，又有思臘河，接水西界。
HCH_012_046_001049	西南有北盤江，自雲南沾益州流入。
HCH_012_046_001050	東南有九溪河。
HCH_012_046_001051	又東有元普定路，屬雲南行省，洪武十五年三月爲府，屬雲南布政司，尋並軍民府，改屬四川布政司，十八年七月廢。
HCH_012_046_001052	領州三，長官司六。
HCH_012_046_001053	東距布政司百五十里。
HCH_012_046_001054	寧谷寨長官司府西南。
HCH_012_046_001055	洪武十九年置，屬安順州。
HCH_012_046_001056	二十五年八月屬普定衛。
HCH_012_046_001057	正統三年八月仍來屬。
HCH_012_046_001058	下仿此。
HCH_012_046_001059	東南有乾海子。
HCH_012_046_001060	西堡長官司府西北。
HCH_012_046_001061	建置所屬同上。
HCH_012_046_001062	北有浪伏山，元置習安州於山下，屬普定路，洪武十五年三月屬普定府，後廢。
HCH_012_046_001063	又北有白石巖。
HCH_012_046_001064	東南有楚油洞山。
HCH_012_046_001065	北有谷龍河，下流合烏江。
HCH_012_046_001066	鎮寧州元至正十一年四月以火烘夷地置，屬普定路。
HCH_012_046_001067	洪武十五年三月屬普定府。
HCH_012_046_001068	二十五年八月屬普定衛，後僑治衛城。
HCH_012_046_001069	正統三年八月直隸貴州布政司。
HCH_012_046_001070	嘉靖十一年六月徙州治安莊衛城。
HCH_012_046_001071	萬曆三十年九月屬府。
HCH_012_046_001072	安莊衛舊在州西，洪武二十三年五月置，屬貴州都司。
HCH_012_046_001073	萬曆三十五年九月，州自衛東來同治。
HCH_012_046_001074	南有白水河，又有烏泥江，即都泥江，源出山箐中，東南流，入金築安撫司境。
HCH_012_046_001075	東距府五十五里。
HCH_012_046_001076	領長官司二：十二營長官司州北。
HCH_012_046_001077	洪武十九年置，屬安順州。
HCH_012_046_001078	二十五年八月屬普定衛。
HCH_012_046_001079	正統三年八月來屬。
HCH_012_046_001080	下仿此。
HCH_012_046_001081	東北有天生橋，又有公具河。
HCH_012_046_001082	北有阿破河。
HCH_012_046_001083	康佐長官司州東。
HCH_012_046_001084	建置所屬同上。
HCH_012_046_001085	永寧州元以打罕夷地置，屬普定路。
HCH_012_046_001086	洪武十五年三月屬普定府。
HCH_012_046_001087	二十五年八月屬普定衛，後僑治衛城。
HCH_012_046_001088	正統三年八月直隸貴州布政司。
HCH_012_046_001089	嘉靖十一年三月徙州治關索嶺守禦千戶所城。
HCH_012_046_001090	萬曆三十年九月屬府。
HCH_012_046_001091	關索所舊在州西南，洪武二十五年置，屬安莊衛。
HCH_012_046_001092	萬曆三十年九月，州自所東北來同治。
HCH_012_046_001093	西北有紅崖山。
HCH_012_046_001094	西有北盤江，自普安州流入，有盤江河巡檢司。
HCH_012_046_001095	東北距府一百二十里。
HCH_012_046_001096	領長官司二：慕役長官司州西。
HCH_012_046_001097	洪武十九年置，屬安順州。
HCH_012_046_001098	二十五年八月屬普定衛。
HCH_012_046_001099	正統三年八月來屬。
HCH_012_046_001100	下仿此。
HCH_012_046_001101	北有安籠箐山。
HCH_012_046_001102	西北有象鼻嶺。
HCH_012_046_001103	東有北盤江，與永寧州分界，東南流，南盤江自雲南羅平州來合焉，又南入廣西泗城州界。
HCH_012_046_001104	頂營長官司州北。
HCH_012_046_001105	洪武四年置，所屬同上。
HCH_012_046_001106	東有關索嶺。
HCH_012_046_001107	西有盤江。
HCH_012_046_001108	普安州本貢寧安撫司。
HCH_012_046_001109	建文中置，屬普安軍民府。
HCH_012_046_001110	永樂元年正月改普安安撫司，屬四川布政司。
HCH_012_046_001111	十三年十二月改爲州，直隸貴州布政司。
HCH_012_046_001112	萬曆十四年二月徙治普安衛城。
HCH_012_046_001113	三十年九月屬府。
HCH_012_046_001114	普安衛舊在州南，洪武十五年正月置，屬雲南都司，後改屬貴州都司。
HCH_012_046_001115	二十二年三月升軍民指揮使司。
HCH_012_046_001116	萬曆十四年二月，州自衛北來同治。
HCH_012_046_001117	東有八部山，元普安路治山下，屬雲南行省，洪武十五年三月爲府，屬雲南布政司，尋升軍民府，二十七年四月改屬四川，永樂後廢。
HCH_012_046_001118	東北有格孤山。
HCH_012_046_001119	又西北有番納牟山，一名雲南坡。
HCH_012_046_001120	又東南有得都山，一名白崖，產雄黃水銀。
HCH_012_046_001121	又東有盤江。
HCH_012_046_001122	東南有者卜河，下流入於盤江。
HCH_012_046_001123	東有芭蕉關。
HCH_012_046_001124	西有分水嶺關。
HCH_012_046_001125	東南有安籠箐關。
HCH_012_046_001126	又西南有樂民守禦千戶所，西有平夷守禦千戶所，俱洪武二十二年置，又東南有安南守禦千戶所，又有安籠守禦千戶所，俱洪武二十三年置，皆屬普安衛。
HCH_012_046_001127	正統十年四月徙安南所於羅渭江。
HCH_012_046_001128	東北距府三百三十五里。
HCH_012_046_001129	都勻府本都勻安撫司。
HCH_012_046_001130	洪武十九年十二月置。
HCH_012_046_001131	二十三年十月改都勻衛，屬貴州都司。
HCH_012_046_001132	二十九年四月升軍民指揮使司，屬四川布政司。
HCH_012_046_001133	永樂十七年仍屬貴州都司。
HCH_012_046_001134	弘治七年五月置都勻府於衛城。
HCH_012_046_001135	西有龍山。
HCH_012_046_001136	南有獨山鎮巡檢司。
HCH_012_046_001137	北有平定關，西有威鎮關，俱洪武二十四年置。
HCH_012_046_001138	領州二，縣一，長官司八。
HCH_012_046_001139	西北距布政司二百六十里。
HCH_012_046_001140	都勻長官司府南。
HCH_012_046_001141	元上都勻等處軍民長官司。
HCH_012_046_001142	洪武十六年更名。
HCH_012_046_001143	南有都勻河，亦名馬尾河。
HCH_012_046_001144	邦水長官司府西。
HCH_012_046_001145	元中都雲板水等處軍民長官司，屬管番民總管。
HCH_012_046_001146	洪武十六年更名。
HCH_012_046_001147	邦水河在東南，本名扳河，即都勻河上源。
HCH_012_046_001148	平浪長官司府西。
HCH_012_046_001149	洪武十六年置。
HCH_012_046_001150	西南有凱陽山，上有滅苗鎮，即故凱口囤。
HCH_012_046_001151	東南有麥衝河。
HCH_012_046_001152	平洲六洞長官司府西南。
HCH_012_046_001153	洪武十六年置。
HCH_012_046_001154	西南有六洞山。
HCH_012_046_001155	南有平洲河，中有沙洲。
HCH_012_046_001156	麻哈州本麻哈長官司。
HCH_012_046_001157	洪武十六年置，屬平越衛。
HCH_012_046_001158	弘治七年五月升爲州，來屬。
HCH_012_046_001159	南有麻哈江，即邦水河之上源。
HCH_012_046_001160	南距府六十里。
HCH_012_046_001161	領長官司二。
HCH_012_046_001162	樂平長官司州西北。
HCH_012_046_001163	洪武二十四年五月置，屬雲南，後屬平越衛。
HCH_012_046_001164	弘治七年五月來屬。
HCH_012_046_001165	東北有馬場山。
HCH_012_046_001166	南有樂平溪。
HCH_012_046_001167	平定長官司州西北。
HCH_012_046_001168	洪武二十二年置，屬平越衛。
HCH_012_046_001169	三十年屬清平衛。
HCH_012_046_001170	弘治七年五月來屬。
HCH_012_046_001171	東有山江河。
HCH_012_046_001172	獨山州本九名九姓獨山州長官司。
HCH_012_046_001173	洪武十六年置，屬都勻衛。
HCH_012_046_001174	弘治七年五月升爲獨山州，屬府。
HCH_012_046_001175	南有獨山，有獨山江，即都勻河下流，南入廣西天河縣界，爲龍江。
HCH_012_046_001176	北距府百五十里。
HCH_012_046_001177	領縣一，長官司二：清平府北。
HCH_012_046_001178	本清平長官司，洪武二十二年置，屬平越衛。
HCH_012_046_001179	三十年屬清平衛。
HCH_012_046_001180	弘治七年五月改爲縣，屬麻哈州，後來屬。
HCH_012_046_001181	東有香爐山，嘉靖十二年四月徙清平衛中左所於此。
HCH_012_046_001182	北有云溪洞。
HCH_012_046_001183	南有木級坡。
HCH_012_046_001184	又東有山江河，源出香爐山，有舟溪江流合焉，亦都勻河上源。
HCH_012_046_001185	又南有雞場關，北有羅衝關，俱洪武二十五年置。
HCH_012_046_001186	又東北有黎樹等寨。
HCH_012_046_001187	合江洲陳蒙爛土長官司州東。
HCH_012_046_001188	洪武十六年置，屬都勻衛。
HCH_012_046_001189	弘治七年五月屬州。
HCH_012_046_001190	東南有梅花洞。
HCH_012_046_001191	豐寧長官司州西南。
HCH_012_046_001192	洪武二十三年置，屬都勻衛。
HCH_012_046_001193	弘治七年五月屬州。
HCH_012_046_001194	西南有行郎山。
HCH_012_046_001195	平越軍民府元平月長官司。
HCH_012_046_001196	洪武十四年置平越守禦千戶所。
HCH_012_046_001197	十五年閏二月改爲平越衛。
HCH_012_046_001198	十七年二月升軍民指揮使司。
HCH_012_046_001199	領長官司五，屬四川布政司，尋屬貴州都司。
HCH_012_046_001200	萬曆二十九年四月置平越軍民府於衛城，以播州地益之，屬貴州布政司。
HCH_012_046_001201	東有峨黎山，又有七盤坡。
HCH_012_046_001202	東南有麻哈江，其上源即黃平州之兩岔江。
HCH_012_046_001203	南有馬場江，又有羊場河，俱東入於麻哈江。
HCH_012_046_001204	南有武勝關。
HCH_012_046_001205	西南有通津關。
HCH_012_046_001206	東南有羊場關。
HCH_012_046_001207	領衛二，州一，縣三，長官司二。
HCH_012_046_001208	西距布政司百八十里。
HCH_012_046_001209	清平衛洪武二十三年六月置，屬貴州都司。
HCH_012_046_001210	萬曆二十九年來屬。
HCH_012_046_001211	衛治在清平縣北一里。
HCH_012_046_001212	西南距府六十里。
HCH_012_046_001213	興隆衛洪武二十二年六月置，屬貴州都司。
HCH_012_046_001214	萬曆二十九年來屬。
HCH_012_046_001215	北有龍巖山，亦名龍洞山。
HCH_012_046_001216	又有截洞，其深險。
HCH_012_046_001217	東有飛雲巖。
HCH_012_046_001218	西南距府百二十里。
HCH_012_046_001219	黃平州本黃平安撫司。
HCH_012_046_001220	洪武七年十一月置，屬播州宣慰司。
HCH_012_046_001221	萬曆二十九年四月改爲州，來屬。
HCH_012_046_001222	東有七里谷。
HCH_012_046_001223	西南有兩岔江，以兩源合流而名。
HCH_012_046_001224	又東有冷水河。
HCH_012_046_001225	西北有黃平守禦千戶所，洪武十一年正月置，十五年正月改爲衛，閏二月仍爲千戶所。
HCH_012_046_001226	南距府三十里。
HCH_012_046_001227	餘慶州西。
HCH_012_046_001228	本餘慶長官司，洪武十七年置，屬播州宣慰司。
HCH_012_046_001229	萬曆二十九年六月改爲縣，來屬。
HCH_012_046_001230	東有白泥長官司，亦洪武十七年置，屬播州宣衛司，萬曆二十九年四月省入餘慶縣。
HCH_012_046_001231	南有小烏江，下流入於烏江。
HCH_012_046_001232	東南有白泥河，下流合於思南河。
HCH_012_046_001233	又有走馬坪寨，嘉靖三十四年置。
HCH_012_046_001234	甕安州西北。
HCH_012_046_001235	本甕水安撫司，洪武初置。
HCH_012_046_001236	萬曆二十九年四月改爲縣，來屬。
HCH_012_046_001237	東有草塘安撫司，洪武十七年六月置，又有重安長官司，永樂四年九月置，俱屬播州宣慰司，萬曆二十九年四月俱省入甕安縣。
HCH_012_046_001238	東南有萬丈山。
HCH_012_046_001239	西有烏江，縣境諸山溪之水皆流合焉。
HCH_012_046_001240	又有黃灘關。
HCH_012_046_001241	東北有飛練堡，有天邦囤，西有西坪等寨。
HCH_012_046_001242	湄潭州北。
HCH_012_046_001243	萬曆二十九年四月以播州湄潭地置。
