HCH_012_046_000000	雲南《禹貢》梁州徼外。
HCH_012_046_000001	元置雲南等處行中書省。
HCH_012_046_000002	治中慶路。
HCH_012_046_000003	洪武十五年二月癸丑平雲南，置雲南都指揮使司。
HCH_012_046_000004	乙卯置雲南等處承宣布政使司。
HCH_012_046_000005	同治雲南府。
HCH_012_046_000006	領府五十八，州七十五，縣五十五，蠻部六。
HCH_012_046_000007	後領府十九，御夷府二，州四十，御夷州三，縣三十，宣慰司八，宣撫司四，安撫司五，長官司三十三，御夷長官司二。
HCH_012_046_000008	北至永寧，與四川界。
HCH_012_046_000009	東至福州，與廣西界。
HCH_012_046_000010	西至幹崖，與西番界。
HCH_012_046_000011	南至木邦，與交址界。
HCH_012_046_000012	距南京七千二百里，京師一萬六百四十五里。
HCH_012_046_000013	洪武二十六年編戶五萬九千五百七十六，口二十五萬九千二百七十。
HCH_012_046_000014	弘治四年，戶一萬五千九百五十，口一十二萬五千九百五十五。
HCH_012_046_000015	萬曆六年，戶一十三萬五千五百六十，口一百四十七萬六千六百九十二。
HCH_012_046_000016	雲南府元中慶路。
HCH_012_046_000017	洪武十五年正月改爲雲南府。
HCH_012_046_000018	領州四，縣九：昆明倚。
HCH_012_046_000019	洪武二十六年，岷王府自陝西岷州遷於此。
HCH_012_046_000020	永樂二十二年遷岷王府於湖廣武岡州，建滕王府於此，宣德元年除。
HCH_012_046_000021	東有金馬山，與西南碧雞山相對，俱有關，山下即滇池。
HCH_012_046_000022	池在城南，週五百里，其西南爲海口，至武定府北，注於金沙江。
HCH_012_046_000023	又東有盤龍江，西注滇池。
HCH_012_046_000024	東有赤水鵬、清水江二巡檢司。
HCH_012_046_000025	富民府西北。
HCH_012_046_000026	東有螳良川，源自滇池，下流入金沙江。
HCH_012_046_000027	東南有安寧河。
HCH_012_046_000028	宜良府東少南。
HCH_012_046_000029	東有大池江，一名大河，亦曰巴盤江。
HCH_012_046_000030	西有湯池巡檢司。
HCH_012_046_000031	羅次府西北。
HCH_012_046_000032	舊屬安寧州，弘治十三年八月改屬府。
HCH_012_046_000033	西有星宿河，自武定府流入。
HCH_012_046_000034	又有沙摩溪，即安寧河。
HCH_012_046_000035	南有鍊象關巡檢司。
HCH_012_046_000036	晉寧州西有大堡河，下流入滇池。
HCH_012_046_000037	北距府百里。
HCH_012_046_000038	領縣二：歸化東北有交七浦，滇池下流。
HCH_012_046_000039	呈貢州北。
HCH_012_046_000040	西有滇池，北有落龍河，南流入焉。
HCH_012_046_000041	安寧州西有呀嵕山，有煎鹽水，設鹽課提舉司，轄鹽井四。
HCH_012_046_000042	天啓三年改設於琅井，此司遂廢。
HCH_012_046_000043	又南有螳良川。
HCH_012_046_000044	西有安寧河。
HCH_012_046_000045	又有祿脿、貼琉二巡檢司。
HCH_012_046_000046	東距府八十里。
HCH_012_046_000047	領縣一：祿豐州西。
HCH_012_046_000048	西有南平山，上有關。
HCH_012_046_000049	東有大溪，即安寧河。
HCH_012_046_000050	西有星宿河，河東有老鴉關巡檢司。
HCH_012_046_000051	又西有蘭谷關。
HCH_012_046_000052	昆陽州東南有渠濫川，東北入於滇池。
HCH_012_046_000053	北距府百五十里。
HCH_012_046_000054	領縣二：三泊州西北。
HCH_012_046_000055	西有三泊溪，流入滇池。
HCH_012_046_000056	易門州西。
HCH_012_046_000057	南有易門守禦千戶所，洪武二十四年置，舊縣治在焉。
HCH_012_046_000058	萬曆三年復還縣治於此。
HCH_012_046_000059	又南有黎崖山，產異馬，一名馬頭山。
HCH_012_046_000060	西有九渡河，即祿豐縣大溪，下流入元江府界。
HCH_012_046_000061	嵩明州洪武十五年三月改曰嵩盟。
HCH_012_046_000062	成化十八年復故。
HCH_012_046_000063	東北有羅錦山。
HCH_012_046_000064	東有秀嵩山。
HCH_012_046_000065	西北有東葛勒山。
HCH_012_046_000066	東南有烏納山，牧漾水出焉，西南入滇池。
HCH_012_046_000067	又東南有嘉利澤，亦曰楊林澤。
HCH_012_046_000068	又西有邵甸河，匯九十九泉，至昆明爲備龍江。
HCH_012_046_000069	西有邵甸縣，洪武十五年三月屬州，尋廢。
HCH_012_046_000070	東南有楊林縣，成化十七年十月廢。
HCH_012_046_000071	又東有楊林守禦千戶所，洪武二十五年置。
HCH_012_046_000072	又西有兔兒關巡檢司。
HCH_012_046_000073	西南距府百二十里。
HCH_012_046_000074	曲靖府元曲靖路。
HCH_012_046_000075	洪武十五年三月爲府。
HCH_012_046_000076	二十七年四月升爲軍民府。
HCH_012_046_000077	領州四，縣二。
HCH_012_046_000078	西距布政司二百九十里。
HCH_012_046_000079	南寧倚。
HCH_012_046_000080	東南有石堡山，山西有元越州治，洪武二十八年正月廢。
HCH_012_046_000081	北有白石江，流合城南之瀟湘江，又東南合左小江，亦謂之南盤江，下流環雲南、澂江、廣西三府之境，至羅平州入貴州界。
HCH_012_046_000082	東北有白水關巡檢司。
HCH_012_046_000083	亦佐府東。
HCH_012_046_000084	元屬羅雄州。
HCH_012_046_000085	永樂初，改屬府。
HCH_012_046_000086	西南有塊澤江。
HCH_012_046_000087	沾益州東南有堆涌山。
HCH_012_046_000088	北有北盤江，其上流即貴州畢節衛之可渡河，流入州境，又東南入貴州安南衛。
HCH_012_046_000089	其西南又有南盤江，即南寧縣之東山河。
HCH_012_046_000090	南有交水縣，東南有羅山縣，東北有石樑縣，元皆屬州，洪武十五年皆廢。
HCH_012_046_000091	南有平夷衛，本平夷千戶所，洪武二十一年十一月置，二十三年四月改爲衛，後廢，永樂元年復置衛。
HCH_012_046_000092	衛當貴州西入之衝，東有巒岡，西有定南嶺，北有豫順關、宣威關。
HCH_012_046_000093	州東南又有越州衛，洪武二十三年七月置，二十四年十二月徙於陸涼州，二十八年與州同廢，永樂元年九月復置。
HCH_012_046_000094	又州南有鬆韶鋪、阿幢橋二巡檢司。
HCH_012_046_000095	又南有炎方城，西南有鬆株城，俱天啓五年築。
HCH_012_046_000096	西南距府二百十三里。
HCH_012_046_000097	陸涼州東有丘雄山，下有中涎澤，即南盤江所匯也。
HCH_012_046_000098	西北有木容山，有關。
HCH_012_046_000099	又西有部封山。
HCH_012_046_000100	又西有芳華縣，南有河納縣，元皆屬州，永樂初皆廢。
HCH_012_046_000101	西南有陸涼衛，洪武二十三年三月以古魯昌地置，西南有喬甸，萬曆二年立營置戍於此。
HCH_012_046_000102	四十八年復設法古甸、龍峒等營，協守其地。
HCH_012_046_000103	北距府百二十里。
HCH_012_046_000104	馬龍州東南有木容箐山，洪武二十四年十二月置甯越堡於此。
HCH_012_046_000105	山下有木容溪，下流即瀟湘江。
HCH_012_046_000106	又西有楊磨山，一名關索嶺，上有關。
HCH_012_046_000107	西南有通泉縣，元屬州，永樂初廢。
HCH_012_046_000108	北有馬隆守禦千戶所，本馬隆衛，洪武二十三年七月置，二十八年十月改爲所。
HCH_012_046_000109	南有魯婆伽嶺巡檢司。
HCH_012_046_000110	又有馬龍縣，元屬州，洪武十五年廢。
HCH_012_046_000111	西南有分水嶺關。
HCH_012_046_000112	東有三叉口關。
HCH_012_046_000113	東距府七十里。
HCH_012_046_000114	羅平州元羅雄州。
HCH_012_046_000115	萬曆十五年四月更名。
HCH_012_046_000116	北有祿布山。
HCH_012_046_000117	東南有盤江，下流入貴州慕役長官司界。
HCH_012_046_000118	南有定雄守禦千戶所，萬曆十四年九月置。
HCH_012_046_000119	西北距府二百七十里。
HCH_012_046_000120	尋甸府元仁德府。
HCH_012_046_000121	洪武十六年十月辛未升爲仁德軍民府。
HCH_012_046_000122	丁丑改尋甸軍民府。
HCH_012_046_000123	成化十二年改爲尋甸府。
HCH_012_046_000124	舊治在東。
HCH_012_046_000125	今治在鳳梧山下，嘉靖七年十月徙。
HCH_012_046_000126	西南有落隴雄山，又有哇山。
HCH_012_046_000127	西有果馬山，其泉流爲龍巨江，下流入滇池。
HCH_012_046_000128	又西南有三棱山，上有九十九泉，即盤龍江之上源。
HCH_012_046_000129	又東有阿交合溪。
HCH_012_046_000130	又北有爲美縣，西有歸厚縣，元屬府，洪武十五年三月因之，尋廢。
HCH_012_046_000131	東南有木密關，一名易龍堡，洪武二十三年四月置木密關守禦千戶所於此。
HCH_012_046_000132	西南距布政司二百六十里。
HCH_012_046_000133	臨安府元臨安路。
HCH_012_046_000134	洪武十五年正月爲府。
HCH_012_046_000135	領州六，縣五，長官司九。
HCH_012_046_000136	北距布政司四百二十里。
HCH_012_046_000137	建水州倚。
HCH_012_046_000138	元時府在州北，洪武中移府治此。
HCH_012_046_000139	西南有寶山。
HCH_012_046_000140	西北右有火焰山。
HCH_012_046_000141	東有石巖山，瀘江水自石屏州流經此，伏流入巖洞中，東出爲樂蒙河。
HCH_012_046_000142	又東北有曲江，東入於盤江，有曲江巡檢司。
HCH_012_046_000143	又西有禮社江，源出趙州，流經此。
HCH_012_046_000144	又有寧遠州，萬曆十四年析建水州置，四十八年廢。
HCH_012_046_000145	東南有納更山土巡檢司。
HCH_012_046_000146	石屏州元曰石坪。
HCH_012_046_000147	洪武十五年三月改曰石平，後改今名。
HCH_012_046_000148	南有鍾秀山。
HCH_012_046_000149	東有菜玉山，產石似玉。
HCH_012_046_000150	有曲江。
HCH_012_046_000151	又有異龍湖，周百五十里，中有大、小、中三島，其大島、中島上皆有城，其水引流爲瀘江。
HCH_012_046_000152	西有寶秀關巡檢司。
HCH_012_046_000153	東距府七十里。
HCH_012_046_000154	阿迷州元阿甯萬戶。
HCH_012_046_000155	洪武十五年三月置州。
HCH_012_046_000156	東南有買吾山，萬曆初，改名雷公山。
HCH_012_046_000157	又南有盤江，東有樂蒙河流入焉。
HCH_012_046_000158	又東有火井，有東山口土巡檢司。
HCH_012_046_000159	又有部舊村巡檢司，後廢。
HCH_012_046_000160	又有阿迷守禦城，萬曆二年築。
HCH_012_046_000161	西距府百二十里。
HCH_012_046_000162	寧州東南有登樓山。
HCH_012_046_000163	東有水角甸山，產蘆甘石。
HCH_012_046_000164	又東有婆兮江，源出澂江府撫仙湖，下流入盤江，又西南有浣江，流合焉。
HCH_012_046_000165	又東有西沙縣，元屬州，後省，洪武十五年三月復置，仍屬州，尋復省。
HCH_012_046_000166	西北有甸直巡檢司。
HCH_012_046_000167	西南距府百八十里。
HCH_012_046_000168	通海府西北。
HCH_012_046_000169	元屬寧州，洪武十五年三月改屬府。
HCH_012_046_000170	南有秀山。
HCH_012_046_000171	北有通海湖。
HCH_012_046_000172	東有守禦通海前前、右右二千戶所，本元臨安路治。
HCH_012_046_000173	洪武初，徙府治建水州。
HCH_012_046_000174	十五年置守禦千戶所於此。
HCH_012_046_000175	河西府西北。
HCH_012_046_000176	東有曲江。
HCH_012_046_000177	又西有祿卑江，自新興州流入，合於曲江。
HCH_012_046_000178	又東北有綠溪河，其下流即通海湖。
HCH_012_046_000179	又北有曲陀關巡檢司，後廢。
HCH_012_046_000180	嶍峨府西北。
HCH_012_046_000181	元屬寧州。
HCH_012_046_000182	洪武十五年二月改屬府。
HCH_012_046_000183	東有曲江，自新興州流入，又南有合流江，西北有丁癸江，俱流合焉。
HCH_012_046_000184	又西南有伽羅關、西有興衣鄉二巡檢司。
HCH_012_046_000185	蒙自府東南。
HCH_012_046_000186	西有目則山。
HCH_012_046_000187	東有云龍山，又有羨裒山。
HCH_012_046_000188	又東南有黎花江，即禮社江也，東南注於交址清水江。
HCH_012_046_000189	有黎花舊市柵，宣德五年五月置臨安衛右千戶所於此。
HCH_012_046_000190	又西南有西溪二，出銀礦。
HCH_012_046_000191	又南有蓮花灘，即瀾滄江下流，交址洮江上流。
HCH_012_046_000192	西南有箐口關巡檢司，又有大窩關、楊柳河關。
HCH_012_046_000193	東南有廢果寨，又有賀謎寨，俱道通交址。
HCH_012_046_000194	新平府西北。
HCH_012_046_000195	萬曆十九年置。
HCH_012_046_000196	東南有魯奎山。
HCH_012_046_000197	東有平甸河。
HCH_012_046_000198	南有南峒巡檢司。
HCH_012_046_000199	新化州本馬龍他郎甸長官司。
HCH_012_046_000200	洪武十七年四月置，直隸布政司。
HCH_012_046_000201	弘治八年改爲新化州。
HCH_012_046_000202	萬曆十九年來屬。
HCH_012_046_000203	北有徹崇山。
HCH_012_046_000204	西有馬籠山，蠻酋結寨處，元置馬籠部千戶於此，屬元江路，洪武十五年廢。
HCH_012_046_000205	又北有法龍山，亦蠻酋結寨處。
HCH_012_046_000206	又東南有馬籠江，即禮社江，亦曰摩沙勒江，有摩沙勒巡檢司。
HCH_012_046_000207	東北有阿怒甸。
HCH_012_046_000208	東南距府五百三十里。
HCH_012_046_000209	寧遠州元至治三年二月置，直隸雲南行省。
HCH_012_046_000210	洪武十五年來屬。
HCH_012_046_000211	宣德元年與安南。
HCH_012_046_000212	納樓茶甸長官司府西南。
HCH_012_046_000213	本納樓千戶所，洪武十五年置，屬和泥府。
HCH_012_046_000214	十七年四月改置。
HCH_012_046_000215	北有羚羊洞，產銀礦。
HCH_012_046_000216	又有祿豐江，即禮社江下流。
HCH_012_046_000217	又東有倘甸。
HCH_012_046_000218	教化三部長官司府東南。
HCH_012_046_000219	元強現三部，洪武中改置。
HCH_012_046_000220	西南有魯部河，源出禮社江，下流合蒙自縣梨花江。
HCH_012_046_000221	王弄山長官司府東南。
HCH_012_046_000222	元王弄山大小二部，洪武中改置。
HCH_012_046_000223	虧容甸長官司府西南。
HCH_012_046_000224	元鐵容甸，屬元江路。
HCH_012_046_000225	洪武中改置，來屬。
HCH_012_046_000226	西有虧容江，源出沅江府，東經車人寨，出寧遠州境。
HCH_012_046_000227	溪處甸長官司府西南。
HCH_012_046_000228	元溪處甸軍民副萬戶，屬元江路。
HCH_012_046_000229	洪武中改置，來屬。
HCH_012_046_000230	思佗甸長官司府西南。
HCH_012_046_000231	元和泥路。
HCH_012_046_000232	洪武十五年三月爲府，領納樓千戶所伴溪、七溪、阿撒三蠻部，十七年廢，後改置。
HCH_012_046_000233	左能寨長官司府西南。
HCH_012_046_000234	本思佗甸寨，洪武中改置。
HCH_012_046_000235	落恐甸長官司府西南。
HCH_012_046_000236	元伴溪落恐部軍民萬戶。
HCH_012_046_000237	洪武中改置。
HCH_012_046_000238	安南長官司府東南。
HCH_012_046_000239	元舍資千戶，後改安南道防送軍千戶。
HCH_012_046_000240	洪武十五年三月仍曰舍資千戶所，尋改置長官司。
HCH_012_046_000241	正德六年省入蒙自縣。
HCH_012_046_000242	天啓二年復置。
HCH_012_046_000243	澂江府元澂江路。
HCH_012_046_000244	洪武十五年三月府。
HCH_012_046_000245	領州二，縣三。
HCH_012_046_000246	西北距布政司八十里。
HCH_012_046_000247	河陽倚。
HCH_012_046_000248	舊治在西。
HCH_012_046_000249	洪武中，遷繡球山上。
HCH_012_046_000250	弘治中，又遷縣東金蓮山。
HCH_012_046_000251	正德十三年又遷縣東暘溥山麓。
HCH_012_046_000252	嘉靖二十年又遷金蓮山南。
HCH_012_046_000253	隆慶四年又遷舞鳳山下，即今治。
HCH_012_046_000254	北有羅藏山。
HCH_012_046_000255	南有撫仙湖，一名羅伽湖，下流東會於盤江。
HCH_012_046_000256	又東有鐵池河，源出陸涼州，流至此，會撫仙湖，復引流爲鐵赤河，入於盤江。
HCH_012_046_000257	江川府西南。
HCH_012_046_000258	南有故城，崇禎七年圮於水，遷於舊江川驛，即今治。
HCH_012_046_000259	又南有星雲湖，東南入撫仙湖。
HCH_012_046_000260	北有關索嶺巡檢司。
HCH_012_046_000261	陽宗府東北。
HCH_012_046_000262	北有明湖，一名陽宗湖，源出羅藏山，流入於盤江。
HCH_012_046_000263	新興州東北有羅麼山，一名石崖山。
HCH_012_046_000264	西北有大棋山。
HCH_012_046_000265	又有蒙習山，山與晉寧州交界。
HCH_012_046_000266	又有大溪，下流至嶍峨縣，入於曲江。
HCH_012_046_000267	有羅麼溪，源出羅麼山，入於大溪。
HCH_012_046_000268	又北有普舍縣，南有研和縣，元俱屬州，洪武十五年三月因之，尋廢。
HCH_012_046_000269	又北有鐵爐關巡檢司。
HCH_012_046_000270	東距府二百里。
HCH_012_046_000271	路南州西南有竹子山。
HCH_012_046_000272	東有劄龍山，石可鍊銅。
HCH_012_046_000273	西有巴盤江，源自陸涼州。
HCH_012_046_000274	又有鐵赤河合焉。
HCH_012_046_000275	東南有邑市縣，元屬州，弘治三年九月廢。
HCH_012_046_000276	東北有革泥巡檢司。
HCH_012_046_000277	西距府百三十里。
HCH_012_046_000278	廣西府元廣西路。
HCH_012_046_000279	洪武十五年三月爲府。
HCH_012_046_000280	西有阿盧山。
HCH_012_046_000281	西北有巴盤江。
HCH_012_046_000282	又西有南盤江。
HCH_012_046_000283	又南有矣邦池，一名龍甸海，跨彌勒州界，南入盤江。
HCH_012_046_000284	領州三。
HCH_012_046_000285	西北距布政司三百十里。
HCH_012_046_000286	師宗州西有龜山，萬曆四十八年築督捕城於此。
HCH_012_046_000287	東有英武山。
HCH_012_046_000288	西有盤江，又西北有巴盤江合焉，東北入羅平州界。
HCH_012_046_000289	西南距府八十里。
HCH_012_046_000290	彌勒州南有卜龍山。
HCH_012_046_000291	西有阿欲山。
HCH_012_046_000292	東南有盤江山，南盤江經其下。
HCH_012_046_000293	又東有八甸溪，南合南盤江。
HCH_012_046_000294	又西有十八寨山，嘉靖元年二月置十八寨守禦千戶所於此，直隸雲南都司。
HCH_012_046_000295	又南有捏招巡檢司。
HCH_012_046_000296	東北距府九十里。
HCH_012_046_000297	維摩州元大德四年二月置。
HCH_012_046_000298	東北有小維摩山。
HCH_012_046_000299	東南有大維摩山，又有阿母山。
HCH_012_046_000300	又東北有寶寧溪，下流經廣南府界，合西洋江。
HCH_012_046_000301	西有三鄉城，萬曆二十二年築。
HCH_012_046_000302	西北距府二百二十里。
HCH_012_046_000303	廣南府元廣南西路宣撫司。
HCH_012_046_000304	洪武十五年十一月改置廣南府。
HCH_012_046_000305	西北有牌頭山，土人築砦其上。
HCH_012_046_000306	南有西洋江，東南至廣西田州府，入於左江。
HCH_012_046_000307	領州一。
HCH_012_046_000308	西北距布政司七百九十里。
HCH_012_046_000309	富州元至元十三年置，屬廣南西路。
HCH_012_046_000310	洪武十五年改屬府。
HCH_012_046_000311	東南有者鷂山。
HCH_012_046_000312	東北有西寧山。
HCH_012_046_000313	又東有楠木溪，至州南與南汪溪合，伏流十五里，東出於西洋江。
HCH_012_046_000314	西南有安寧州，東北有羅佐州，俱元至元十三年置，屬廣南西路。
HCH_012_046_000315	洪武十五年因之，後俱廢。
HCH_012_046_000316	西距府二百里。
HCH_012_046_000317	元江軍民府元元江路。
HCH_012_046_000318	洪武十五年三月爲府。
HCH_012_046_000319	永樂初，升軍民府。
HCH_012_046_000320	領州二。
HCH_012_046_000321	東北距布政司七百九十里。
HCH_012_046_000322	奉化州倚。
HCH_012_046_000323	本因遠羅必甸長官司，洪武十八年四月置。
HCH_012_046_000324	嘉靖中，改州。
HCH_012_046_000325	東有羅盤山，亦名玉臺山。
HCH_012_046_000326	又有路通山。
HCH_012_046_000327	東南有元江，亦曰禮社江，東南入納樓茶甸長官司界。
HCH_012_046_000328	西南有瀾滄江，與車裏宣慰司分界。
HCH_012_046_000329	又西有步日部，洪武中廢。
HCH_012_046_000330	又東有禾摩村巡檢司。
HCH_012_046_000331	恭順州本他郎寨長官司，嘉靖中改州。
HCH_012_046_000332	楚雄府元威楚開南路。
HCH_012_046_000333	洪武十五年三月改爲楚雄府。
HCH_012_046_000334	領州二，縣五。
HCH_012_046_000335	東距布政司六百里。
HCH_012_046_000336	楚雄倚。
HCH_012_046_000337	元曰威楚。
HCH_012_046_000338	洪武十五年二月更名。
HCH_012_046_000339	西有薇溪山，又有龍川江，經城北青峯下，曰峨錄江，下流入武定府，合金沙江。
HCH_012_046_000340	西有波羅澗，其麓有滷水，元設鹽課司於此，明廢。
HCH_012_046_000341	西北有呂合巡檢司。
HCH_012_046_000342	廣通府東。
HCH_012_046_000343	元屬南安州。
HCH_012_046_000344	洪武十五年因之，後改屬府。
HCH_012_046_000345	東北有盤龍山，亦曰九盤山。
HCH_012_046_000346	西有羅苴甸山。
HCH_012_046_000347	東有鹽倉山，舊產鹽。
HCH_012_046_000348	又有臥象山，東南有臥獅山，俱產銀礦。
HCH_012_046_000349	又東北有阿陋雄山，有阿陋井、猴井，俱產鹽。
HCH_012_046_000350	又東有舍資河，自武定府流入，下流入於元江。
HCH_012_046_000351	又北有大河，西北入定遠縣之龍川江。
HCH_012_046_000352	東有舍資巡檢司，東北有沙矣舊，西有回蹬關二土巡檢司。
HCH_012_046_000353	定遠府西北。
HCH_012_046_000354	西有赤石山。
HCH_012_046_000355	東有龍川江。
HCH_012_046_000356	又有黑鹽井，設提舉於此。
HCH_012_046_000357	又有琅井提舉司，本置於安寧州，天啓三年移此，有黑井、琅井二巡檢司。
HCH_012_046_000358	又西南有羅平關、南有會基關二巡檢司。
HCH_012_046_000359	定邊府西。
HCH_012_046_000360	元至元十二年置，屬鎮南州。
HCH_012_046_000361	洪武中，改屬。
HCH_012_046_000362	北有螺盤山，上有自普關。
HCH_012_046_000363	又有無量山。
HCH_012_046_000364	南有定邊河，又有陽江，自蒙化府流合焉。
HCH_012_046_000365	柷嘉府南。
HCH_012_046_000366	元置。
HCH_012_046_000367	西有黑初山。
HCH_012_046_000368	東北有卜門河，在卜門山下，又東北合馬龍江，流入新化州。
HCH_012_046_000369	又西有上江河，接南安州界。
HCH_012_046_000370	南安州東有健林蒼山。
HCH_012_046_000371	又西南有表羅山，產銀。
HCH_012_046_000372	北有舍資河。
HCH_012_046_000373	西北距府五十里。
HCH_012_046_000374	鎮南州東北有石吠山。
HCH_012_046_000375	東有五樓山。
HCH_012_046_000376	西南有馬龍江，其上流爲定邊河，又東南入柷嘉縣界。
HCH_012_046_000377	又西有平夷川，龍川江之上流。
HCH_012_046_000378	又有沙橋巡檢司。
HCH_012_046_000379	又有鎮南關、英武關、阿雄關三土巡檢司。
HCH_012_046_000380	東南距府五十里。
HCH_012_046_000381	姚安軍民府元姚安路。
HCH_012_046_000382	洪武十五年三月爲府。
HCH_012_046_000383	二十七年四月升軍民府。
HCH_012_046_000384	領州一，縣一。
HCH_012_046_000385	東南距布政司七百里。
HCH_012_046_000386	姚州倚。
HCH_012_046_000387	元屬大理路。
HCH_012_046_000388	洪武十五年三月來屬。
HCH_012_046_000389	東有東山，一名飽煙蘿山。
HCH_012_046_000390	東北有金沙江。
HCH_012_046_000391	南有青蛉河，源出三窠山，下流合大姚河。
HCH_012_046_000392	北有守禦姚安千戶所，洪武二十八年置。
HCH_012_046_000393	東有箭場、西有普昌、南有三窠、西南有普淜四巡檢司。
HCH_012_046_000394	大姚府北。
HCH_012_046_000395	元屬姚州。
HCH_012_046_000396	洪武十五年三月因之，後改屬府。
HCH_012_046_000397	西北有赤石崖。
HCH_012_046_000398	北有大姚河，源出書案山。
HCH_012_046_000399	西北有龍蛟江，源出鐵索箐，一名苴泡江，產金。
HCH_012_046_000400	俱東北流入金沙江。
HCH_012_046_000401	南有白鹽井提舉司，轄鹽井九。
HCH_012_046_000402	又有白鹽井巡檢司。
HCH_012_046_000403	東有姚安中屯千戶所，洪武二十八年置。
HCH_012_046_000404	武定府元武定路。
HCH_012_046_000405	洪武十五年三月爲府，尋升軍民府。
HCH_012_046_000406	隆慶三年閏六月徙治獅子山。
HCH_012_046_000407	萬曆中，罷稱軍民。
HCH_012_046_000408	領州二，縣一。
HCH_012_046_000409	東南距布政司百五十里。
HCH_012_046_000410	和曲州倚。
HCH_012_046_000411	舊城在南，元州治於此。
HCH_012_046_000412	隆慶三年十二月徙州爲府附郭，令吏目領兵守焉。
HCH_012_046_000413	西北有三臺山。
HCH_012_046_000414	北有金沙江，源出吐蕃共龍川犁牛石，下流經麗江、鶴慶二府，至本府北界，東流入黎溪州，又東入四川會川衛界。
HCH_012_046_000415	有金沙江土巡檢司。
HCH_012_046_000416	又有烏龍河，流入金沙江。
HCH_012_046_000417	又西北有西溪河，即楚雄府龍川江下流。
HCH_012_046_000418	又有隻舊、草起二鹽井。
HCH_012_046_000419	東有南甸縣，元路治，洪武十五年三月改屬州，成化二十年仍屬府，正德元年七月省。
HCH_012_046_000420	西北有乾海子、又有羅摩洱、又南有小甸關三巡檢司。
HCH_012_046_000421	西北有龍街關土巡檢司。
HCH_012_046_000422	元謀府西北。
HCH_012_046_000423	西北有住雄山，又有竹沙雄山。
HCH_012_046_000424	北有金沙江，西有西溪河流入焉。
HCH_012_046_000425	祿勸州北有法塊山，又有哇匿歪山。
