HCH_012_155_000001	宋晟薛祿劉榮朱榮費瓛譚廣陳懷蔣貴任禮趙安趙輔劉聚宋晟，字景陽，定遠人。
HCH_012_155_000002	父朝用，兄國興，並從渡江，皆積功至元帥。
HCH_012_155_000003	攻集慶，國興戰歿，晟嗣其職。
HCH_012_155_000004	既而朝用請老，晟方從鄧愈克徽州，召還，襲父官。
HCH_012_155_000005	累進都指揮同知，歷鎮江西、大同、陜西。
HCH_012_155_000006	洪武十二年坐法降涼州衛指揮使。
HCH_012_155_000007	十七年五月討西番叛酋，至亦集乃路，擒元海道千戶也先帖木兒、國公吳把都剌赤等，俘獲萬八千人，送酋長京師，簡其精銳千人補卒伍，余悉放遣。
HCH_012_155_000008	召還，復為都指揮，進右軍都督僉事，仍鎮涼州。
HCH_012_155_000009	二十四年充總兵官，與都督劉真討哈梅裏。
HCH_012_155_000010	其地去肅州千餘里。
HCH_012_155_000011	晟令軍中多具糧糗，倍道疾馳，乘夜至城下。
HCH_012_155_000012	質明，金鼓聲震地，闔城股栗，遂克之。
HCH_012_155_000013	擒其王子別兒怯帖木兒，及偽國公以下三十餘人，收其部落輜重以歸。
HCH_012_155_000014	自是番戎慴服，兵威極於西域。
HCH_012_155_000015	明年五月從藍玉征罕東，徇阿真川，土酋哈昝等遁去。
HCH_012_155_000016	師還，調中軍都督僉事。
HCH_012_155_000017	二十八年六月，從總兵官周興出開原，至忽剌江。
HCH_012_155_000018	部長西陽哈遁，追至甫答迷城，俘人畜而還。
HCH_012_155_000019	明年拜征南右副將軍，討廣西帡幪諸寨苗，擒斬七千餘人。
HCH_012_155_000020	又明年，總羽林八衛兵討平五開、龍裏苗。
HCH_012_155_000021	三十一年出鎮開平，從燕王出塞，還城萬全諸衛。
HCH_012_155_000022	建文改元，仍鎮甘肅。
HCH_012_155_000023	成祖即位，入朝，進後軍左都督，拜平羌將軍，遣還鎮。
HCH_012_155_000024	永樂三年招降把都帖木兒、倫都兒灰等部落五千人，獲馬駝牛羊萬六千。
HCH_012_155_000025	封西寧侯，祿千一百石，世指揮使。
HCH_012_155_000026	晟凡四鎮涼州，前後二十餘年，威信著絕域。
HCH_012_155_000027	帝以晟舊臣，有大將材，專任以邊事，所奏請輒報可。
HCH_012_155_000028	御史劾晟自專。
HCH_012_155_000029	帝曰：「任人不專則不能成功，況大將統制一邊，寧能盡拘文法。」
HCH_012_155_000030	即敕晟以便宜從事。
HCH_012_155_000031	晟嘗請入朝。
HCH_012_155_000032	報曰：「西北邊務，一以委卿，非召命，毋輒來。」
HCH_012_155_000033	尋命營河西牧地，及圖出塞方略。
HCH_012_155_000034	會病卒，五年七月也。
HCH_012_155_000035	晟三子。
HCH_012_155_000036	長瑄，建文中為府軍右衛指揮使，戰靈璧，先登，斬數級，力鬥死。
HCH_012_155_000037	瑄弟琥，尚成祖女安成公主，得嗣侯，予世券。
HCH_012_155_000038	八年佩前將軍印，鎮甘肅。
HCH_012_155_000039	十年與李彬捕叛酋老的罕，俘斬甚眾。
HCH_012_155_000040	召還。
HCH_012_155_000041	洪熙元年坐不敬奪爵，並削駙馬都尉官。
HCH_012_155_000042	宣德中復都尉。
HCH_012_155_000043	琥既廢，弟瑛嗣。
HCH_012_155_000044	瑛尚鹹寧公主。
HCH_012_155_000045	正統中，歷掌左軍前府事。
HCH_012_155_000046	瓦剌也先入寇，瑛充總兵官，督大同守將朱冕、石亨等戰陽和，全軍敗沒，瑛及冕皆戰死。
HCH_012_155_000047	贈鄆國公，謚忠順。
HCH_012_155_000048	子傑嗣。
HCH_012_155_000049	景泰中典禁兵宿衛，以謹慎稱。
HCH_012_155_000050	卒，子誠嗣。
HCH_012_155_000051	署右府事，復佩平羌將軍印，鎮甘肅。
HCH_012_155_000052	誠有材武，嘗出獵至涼州，遇寇掠牛馬北去。
HCH_012_155_000053	誠三矢殪三人，寇驚散，盡驅所掠還。
HCH_012_155_000054	九傳至孫裕德，死流寇難。
HCH_012_155_000055	薛祿，膠人。
HCH_012_155_000056	行六，軍中呼曰「薛六」。
HCH_012_155_000057	既貴，乃更名「祿」。
HCH_012_155_000058	祿以卒伍從燕起兵，首奪九門。
HCH_012_155_000059	真定之戰，左副將軍李堅迎鬥。
HCH_012_155_000060	鋒始交，祿持槊刺堅墜馬，擒之。
HCH_012_155_000061	擢指揮僉事。
HCH_012_155_000062	從援永平，下大寧、富峪、會州、寬河。
HCH_012_155_000063	還救北平，先驅敗南軍遊騎。
HCH_012_155_000064	進指揮同知。
HCH_012_155_000065	攻大同，為先鋒。
HCH_012_155_000066	戰白溝河，追奔至濟南，遷指揮使。
HCH_012_155_000067	戰東昌，以五十騎敗南兵數百。
HCH_012_155_000068	時成祖為盛庸所敗，還走北平。
HCH_012_155_000069	庸檄真定諸將屯威縣、深州，邀燕歸路。
HCH_012_155_000070	祿皆擊走之。
HCH_012_155_000071	戰滹沱河，右軍卻。
HCH_012_155_000072	祿馳赴陣，出入數十戰，破之。
HCH_012_155_000073	追奔至夾河，斬馘無算。
HCH_012_155_000074	戰單家橋，為平安所執。
HCH_012_155_000075	奮脫縛，拔刀殺守卒，馳還復戰，大敗安軍。
HCH_012_155_000076	掠順德、大名、彰德。
HCH_012_155_000077	攻西水寨，生擒都指揮花英。
HCH_012_155_000078	乘勝下東阿、東平、汶上，連戰淝河、小河、靈璧，功最。
HCH_012_155_000079	入京師，擢都督僉事。
HCH_012_155_000080	永樂六年進同知。
HCH_012_155_000081	八年充驃騎將軍，從北征，進右都督。
HCH_012_155_000082	十年上言：「自古用人，必資豫教。今武臣子弟閑暇不教，恐緩急無可使者。」
HCH_012_155_000083	帝韙其言。
HCH_012_155_000084	會四方送幼軍數萬至，悉隸祿操習之。
HCH_012_155_000085	十五年以行在後軍都督董營造。
HCH_012_155_000086	十八年十二月定都北京，授奉天靖難推誠宣力武臣，封陽武侯，祿千一百石。
HCH_012_155_000087	二十一年將右哨從北征。
HCH_012_155_000088	還，討平長興盜。
HCH_012_155_000089	二十二年再領右哨從北征。
HCH_012_155_000090	仁宗即位，命掌左府，加太子太保，予世券。
HCH_012_155_000091	洪熙元年充總兵官，備禦塞外。
HCH_012_155_000092	尋以獲寇功，益祿五百石。
HCH_012_155_000093	是年頒諸將軍印於各邊鎮，祿佩鎮朔大將軍印，巡開平，至大同邊。
HCH_012_155_000094	宣宗即位，召還，陳備邊五事。
HCH_012_155_000095	尋復遣巡邊。
HCH_012_155_000096	宣德元年從征樂安，為前鋒。
HCH_012_155_000097	高煦就擒，留祿與尚書張本鎮撫之。
HCH_012_155_000098	明年春，奉詔巡視畿南諸府城池，嚴戒軍士毋擾民，違者以軍法論。
HCH_012_155_000099	是夏復佩大將軍印，北巡開平，還駐宣府。
HCH_012_155_000100	敵犯開平，無所得而退，去城三百餘里。
HCH_012_155_000101	祿帥精兵晝伏夜行，三夕至。
HCH_012_155_000102	縱輕騎蹂敵營，破之，大獲人畜。
HCH_012_155_000103	師還，敵躡其後，復奮擊敗之，敵由是遠遁。
HCH_012_155_000104	召還。
HCH_012_155_000105	三年從北征，破敵於寬河，留鎮薊州、永平。
HCH_012_155_000106	復數佩鎮朔印，巡邊護餉，出開平、宣府間。
HCH_012_155_000107	五年遇敵於鳳凰嶺，斬獲多，加太保。
HCH_012_155_000108	上言永寧衛團山及雕鶚、赤城、雲州、獨石宜築城堡，便守禦。
HCH_012_155_000109	詔發軍民三萬六千赴工，精騎一千五百護之，皆聽祿節制。
HCH_012_155_000110	臨行賜詩，以山甫、南仲為比。
HCH_012_155_000111	祿武人不知書，以問楊士奇。
HCH_012_155_000112	士奇曰：「上以古賢人待君也。」
HCH_012_155_000113	祿拊心曰：「祿安敢望前賢，然敢不勉圖報上恩萬一。」
HCH_012_155_000114	其年六月有疾，召還。
HCH_012_155_000115	逾月卒。
HCH_012_155_000116	贈鄞國公，謚忠武。
HCH_012_155_000117	祿有勇而好謀，謀定後戰，戰必勝。
HCH_012_155_000118	紀律嚴明，秋毫無犯。
HCH_012_155_000119	善撫士卒，同甘苦，人樂為用。
HCH_012_155_000120	「靖難」諸功臣，張玉、朱能及祿三人為最，而祿逮事三朝，巋然為時宿將。
HCH_012_155_000121	孫詵嗣。
HCH_012_155_000122	至曾孫翰卒，無子，族人爭襲，久之不得請，田宅並入官，世絕者三十餘年。
HCH_012_155_000123	萬歷五年乃復封翰族子鋹為侯。
HCH_012_155_000124	再傳至濂。
HCH_012_155_000125	崇禎末，京師陷，被害。
HCH_012_155_000126	永樂中從起兵北平，後積功至大將，封侯伯不以「靖難」功者，薛祿及郭義、金玉、劉榮、朱榮凡五人，而義、玉與祿同日封雲。
HCH_012_155_000127	郭義，濟寧人。
HCH_012_155_000128	洪武時，累功為燕山千戶。
HCH_012_155_000129	從成祖入京師，累遷左都督。
HCH_012_155_000130	永樂九年坐曠職謫交阯，立功，已而宥之。
HCH_012_155_000131	數從出塞，有功，封安陽侯，祿千一百石，亦授奉天靖難武臣號。
HCH_012_155_000132	時義在南京，疾革，聞命而卒。
HCH_012_155_000133	金玉，江浦人。
HCH_012_155_000134	襲父官為羽林衛百戶，調燕山護衛。
HCH_012_155_000135	從起兵有功，累遷河南都指揮使。
HCH_012_155_000136	永樂三年進都督僉事。
HCH_012_155_000137	八年充鷹揚將軍從北征。
HCH_012_155_000138	師旋，為殿。
HCH_012_155_000139	至長秀川，收敵所棄牛羊雜畜亙數十里。
HCH_012_155_000140	十四年討平山西妖賊劉子進。
HCH_012_155_000141	論前後功，封惠安伯，祿九百石。
HCH_012_155_000142	十九年卒。
HCH_012_155_000143	妾田氏自經以殉，贈淑人。
HCH_012_155_000144	劉榮，宿遷人。
HCH_012_155_000145	初冒父名江。
HCH_012_155_000146	從魏國公徐達戰灰山、黑松林。
HCH_012_155_000147	為總旗，給事燕邸。
HCH_012_155_000148	雄偉多智略，成祖深器之，授密雲衛百戶。
HCH_012_155_000149	從起兵為前鋒，屢立戰功。
HCH_012_155_000150	徇山東，與朱榮帥精騎三千，夜襲南軍於滑口，斬數千人，獲馬三千，擒都指揮唐禮等。
HCH_012_155_000151	累授都指揮僉事。
HCH_012_155_000152	戰滹沱河，奪浮橋，掠館陶、曹州，大獲。
HCH_012_155_000153	還軍救北平，敗平安軍於平村。
HCH_012_155_000154	楊文以遼東兵圍永平，江往援，文引卻。
HCH_012_155_000155	江聲言還北平，行二十餘里，卷甲夜入永平。
HCH_012_155_000156	文聞江去，復來攻。
HCH_012_155_000157	江突出掩擊，大敗之。
HCH_012_155_000158	斬首數千，擒指揮王雄等七十一人。
HCH_012_155_000159	遷都指揮使。
HCH_012_155_000160	從至淝河，與白義、王真以輕騎誘致平安，敗之。
HCH_012_155_000161	時南軍駐宿州，積糧為持久計。
HCH_012_155_000162	成祖患之，議絕其餉道。
HCH_012_155_000163	命江將三千人往，趑趄不行。
HCH_012_155_000164	成祖大怒，欲斬之。
HCH_012_155_000165	諸將叩首請，乃免。
HCH_012_155_000166	渡江策功，以前罪不封，止授都督僉事。
HCH_012_155_000167	遷中府右都督。
HCH_012_155_000168	永樂八年從北征，以遊擊將軍督前哨。
HCH_012_155_000169	乘夜據清水源，敗敵斡難河，復敗阿魯臺於靖虜鎮。
HCH_012_155_000170	師還為殿，即軍中進左都督，遣鎮遼東。
HCH_012_155_000171	敵闌入殺官軍。
HCH_012_155_000172	帝怒，命斬江，既而宥之。
HCH_012_155_000173	九年復鎮遼東。
HCH_012_155_000174	十二年再從北征，仍為前鋒，將勁騎偵敵於飲馬河。
HCH_012_155_000175	見敵騎東走，追至康哈裏孩，擊斬數十人。
HCH_012_155_000176	復與大軍合擊馬哈木於忽失溫，下馬持短兵突陣，斬獲多，受上賞。
HCH_012_155_000177	復充總兵官，鎮遼東。
HCH_012_155_000178	倭數寇海上，北抵遼，南訖浙、閩，瀕海郡邑多被害。
HCH_012_155_000179	江度形勢，請於金線島西北望海堝築城堡，設烽堠，嚴兵以待。
HCH_012_155_000180	十七年六月，瞭者言東南海島中舉火。
HCH_012_155_000181	江急引兵赴堝上。
HCH_012_155_000182	倭三十餘舟至，泊馬雄島，登岸奔望海堝。
HCH_012_155_000183	江依山設伏，別遣將斷其歸路，以步卒迎戰，佯卻。
HCH_012_155_000184	賊入伏中，炮舉伏起，自辰至酉，大破賊。
HCH_012_155_000185	賊走櫻桃園空堡中，江開西壁縱之走。
HCH_012_155_000186	復分兩路夾擊，盡覆之，斬首千餘級，生擒百三十人。
HCH_012_155_000187	自是倭大創，不敢復入遼東。
HCH_012_155_000188	詔封廣寧伯，祿千二百石，予世券，始更名榮。
HCH_012_155_000189	尋遣還鎮。
HCH_012_155_000190	明年四月卒。
HCH_012_155_000191	榮為將，常為軍鋒，所向無堅陣。
HCH_012_155_000192	馭士卒有紀律，恩信嚴明。
HCH_012_155_000193	諸款塞者，撫輯備至。
HCH_012_155_000194	既卒，人鹹思之。
HCH_012_155_000195	贈侯，謚忠武。
HCH_012_155_000196	子湍嗣。
HCH_012_155_000197	卒，無子，弟安嗣。
HCH_012_155_000198	正統十四年與郭登鎮大同。
HCH_012_155_000199	也先擁英宗至城下，邀登出見，登不可。
HCH_012_155_000200	安出見，伏哭帝前。
HCH_012_155_000201	景帝降敕切責。
HCH_012_155_000202	安馳至京師，言奉上皇命來告敵情，且言進己為侯。
HCH_012_155_000203	群臣交劾，下獄論死。
HCH_012_155_000204	會京師戒嚴，釋安充總兵官，陣東直門。
HCH_012_155_000205	寇退，進都督同知，守備白羊口，復伯爵。
HCH_012_155_000206	英宗復位，予世侯，再益祿三百石。
HCH_012_155_000207	曹欽反，安被創，加太子少傅。
HCH_012_155_000208	成化中卒。
HCH_012_155_000209	贈嶧國公，謚忠僖。
HCH_012_155_000210	傳爵至明亡。
HCH_012_155_000211	朱榮，字仲華，沂人。
HCH_012_155_000212	洪武十四年，以總旗從西平侯沐英征雲南。
HCH_012_155_000213	累官副千戶。
HCH_012_155_000214	守大寧，降於成祖。
HCH_012_155_000215	襲孫霖於滑口，圍定州，斷南軍餉道，大小二十餘戰，論功授都督僉事。
HCH_012_155_000216	永樂四年從新城侯張輔征交阯，破雞陵關，會沐晟於白鶴。
HCH_012_155_000217	輔等議於嘉林江上流濟師，遣榮陣下流十八里，日增其數以惑賊。
HCH_012_155_000218	又作舟筏為欲濟狀，以牽制之。
HCH_012_155_000219	賊果分兵渡江登岸。
HCH_012_155_000220	榮等奮擊，大破之。
HCH_012_155_000221	大軍進克多邦城，榮功為多。
HCH_012_155_000222	帝以榮嘗怠事，師還論功，僅擢右都督，賜白金鈔幣。
HCH_012_155_000223	七年復從輔討賊余黨，平之。
HCH_012_155_000224	明年督右掖，從征阿魯臺，與劉榮並進左都督。
HCH_012_155_000225	十二年復從北征，與榮俱為前鋒。
HCH_012_155_000226	其冬充總兵官，鎮大同。
HCH_012_155_000227	修忙牛嶺、兔毛河、赤山、榆楊口、來勝諸城，寇不敢近。
HCH_012_155_000228	居三年，召還。
HCH_012_155_000229	十八年，代劉榮鎮遼東。
HCH_012_155_000230	二十年復從北征，為前鋒。
HCH_012_155_000231	駐雕鶚诇寇，以五千騎視敵所向。
HCH_012_155_000232	大軍次玉沙泉。
HCH_012_155_000233	榮帥銳士三百人，人三馬，賫二十日糧深入。
HCH_012_155_000234	敵已棄牛羊馬駝北走，悉收之，焚其輜重，移師破兀良哈。
HCH_012_155_000235	師還，封武進伯，祿千二百石，仍鎮遼東。
HCH_012_155_000236	二十二年復從北征。
HCH_012_155_000237	已，還鎮。
HCH_012_155_000238	洪熙元年，佩征虜前將軍印，鎮如故。
HCH_012_155_000239	其年七月卒於鎮。
HCH_012_155_000240	贈侯，謚忠靖。
HCH_012_155_000241	子冕嗣。
HCH_012_155_000242	以晉王濟熿新廢，命鎮山西，尋召還。
HCH_012_155_000243	六年命輸餉獨石，因巡其地。
HCH_012_155_000244	正統四年，佩征西將軍印，鎮大同。
HCH_012_155_000245	十四年從北征，戰於陽和，死之。
HCH_012_155_000246	謚忠愨。
HCH_012_155_000247	子瑛嗣。
HCH_012_155_000248	傳爵至明亡。
HCH_012_155_000249	費瓛，定遠人。
HCH_012_155_000250	祖愚，洪武時為燕府左相，改授燕山中護衛指揮使。
HCH_012_155_000251	傳子肅。
HCH_012_155_000252	至瓛從成祖起兵有功，累進後軍都督僉事。
HCH_012_155_000253	永樂八年春，涼州衛千戶虎保、永昌衛千戶亦令真巴等叛，眾數千，屯據驛路。
HCH_012_155_000254	新附伯顏帖木兒等應之。
HCH_012_155_000255	西鄙震動。
HCH_012_155_000256	都指揮李智擊之不勝。
HCH_012_155_000257	賊聲言攻永昌、涼州城。
HCH_012_155_000258	皇太子命瓛往討。
HCH_012_155_000259	至涼州，智及都指揮陳懷以師會，遂進兵鎮番。
HCH_012_155_000260	遇賊於雙城。
HCH_012_155_000261	瓛擊其左，懷等擊其右。
HCH_012_155_000262	賊大敗走，斬首三百餘級。
HCH_012_155_000263	追奔至黑魚海，獲賊千餘，馬駝牛羊十二萬。
HCH_012_155_000264	虎保等遠遁。
HCH_012_155_000265	乃班師。
HCH_012_155_000266	十二年充總兵官，鎮甘肅。
HCH_012_155_000267	瓛以肅州兵多糧少，脫有調發，猝難措置，請以臨鞏稅糧付近邊軍丁轉運。
HCH_012_155_000268	又以涼州多閑田，請給軍屯墾。
HCH_012_155_000269	從之。
HCH_012_155_000270	洪熙元年予平羌將軍印。
HCH_012_155_000271	永樂時，諸邊率用宦官協鎮，恣睢專軍務，瓛亦為所制。
HCH_012_155_000272	仁宗知之，賜璽書責之曰：「爾以名臣後，受國重寄，乃俯首受制於人，豈大丈夫所為！其痛自懲艾，圖後效。」
HCH_012_155_000273	瓛得書陳謝。
HCH_012_155_000274	宣宗嗣位，進右府左都督。
HCH_012_155_000275	元年七月入朝，封崇信伯，祿千一百石。
HCH_012_155_000276	從征高煦，次流河驛。
HCH_012_155_000277	帝念前鋒薛祿軍少，命瓛帥兵益之。
HCH_012_155_000278	還，予世券，復鎮甘肅。
HCH_012_155_000279	二年，沙州衛賊屢劫撒馬兒罕及亦力把裏貢使，瓛討破之。
HCH_012_155_000280	明年卒於鎮。
HCH_012_155_000281	瓛為人和易，善撫士。
HCH_012_155_000282	在鎮十五年，境內寧謐。
HCH_012_155_000283	子釗嗣。
HCH_012_155_000284	從征鄧茂七，還掌都督府。
HCH_012_155_000285	天順中，受武定侯郭英次孫昭賂，誣嫡孫昌不孝，欲奪其爵。
HCH_012_155_000286	法司請逮治，詔解府事。
HCH_012_155_000287	卒，子淮嗣爵。
HCH_012_155_000288	傳至明亡乃絕。
HCH_012_155_000289	譚廣，字仲宏，丹徒人。
HCH_012_155_000290	洪武初，起卒伍，從征金山，為燕山護衛百戶。
HCH_012_155_000291	從成祖起兵，以百騎掠涿州，生得將校三十人。
HCH_012_155_000292	戰白溝、真定、夾河鹹有功，屢遷指揮使，留守保定。
HCH_012_155_000293	都督韓觀帥師十二萬來攻。
HCH_012_155_000294	廣以孤軍力拒四十餘日，伺間破走之。
HCH_012_155_000295	永樂九年進大寧都指揮僉事。
HCH_012_155_000296	董建北京。
HCH_012_155_000297	既而領神機營，從北征，充驍騎將軍。
HCH_012_155_000298	十一年練軍山西。
HCH_012_155_000299	明年從征九龍口，為前鋒。
HCH_012_155_000300	賊數萬憑岸，廣命挽強士射之。
HCH_012_155_000301	萬矢齊發，死者無算。
HCH_012_155_000302	乘勝夾擊，賊大敗。
HCH_012_155_000303	論功，進都督僉事。
HCH_012_155_000304	仁宗嗣位，擢左都督，佩鎮朔將軍印，鎮宣府。
HCH_012_155_000305	宣德三年，請軍衛如郡縣例，立風雲雷雨山川社稷壇。
HCH_012_155_000306	六年以宣府糧少，請如開平、獨石召商中鹽納粟，以足兵食。
HCH_012_155_000307	俱從之。
HCH_012_155_000308	明年，帝從戶部議，令他衛軍戍宣府者，悉遣還屯種。
HCH_012_155_000309	廣上言：「臣所守邊一千四百餘里，敵人窺伺，竊發無時。脫有警，征兵數百里外，勢豈能及？屯種之議，臣愚未見其可。」
HCH_012_155_000310	帝以邊卒戍守有餘，但命永樂中調戍者勿遣。
HCH_012_155_000311	正統初，朝議以脫歡雖款塞，狡謀未可測，命廣及他鎮總兵官陳懷、李謙、王彧圖上方略。
HCH_012_155_000312	廣等各上議，大要謂：「邊寇出沒不常，惟守禦為上策。宜分兵扼要害，而間遣精稅巡塞外，遇敵則量力戰守，間諜以偵之，輕兵以躡之。寇來無所得，去有所懼，則邊患可少弭。」
HCH_012_155_000313	帝納其言。
HCH_012_155_000314	六年十一月以禦敵功，封永寧伯，祿千二百石，仍鎮宣府。
HCH_012_155_000315	八年乞致仕。
HCH_012_155_000316	優詔不許。
HCH_012_155_000317	明年十月召還陛見。
HCH_012_155_000318	帝憫其老，免常朝。
HCH_012_155_000319	是月卒，年八十二。
HCH_012_155_000320	謚襄毅。
HCH_012_155_000321	廣長身多力，奮跡行伍至大將，大小百餘戰，未嘗挫衄。
HCH_012_155_000322	在宣府二十年，修屯堡，嚴守備，增驛傳，又請頒給火器於各邊。
HCH_012_155_000323	將校失律，即奏請置罪，而撫士卒有恩。
HCH_012_155_000324	邊僥帖然，稱名將。
HCH_012_155_000325	嘗逞憤杖殺都司經歷，又以私憾杖百戶，並為言官所劾。
HCH_012_155_000326	置不問，既卒，吏部言非世券，授其子序指揮使。
HCH_012_155_000327	陳懷，合肥人。
HCH_012_155_000328	襲父職為真定副千戶。
HCH_012_155_000329	永樂初，積功至都指揮僉事。
HCH_012_155_000330	從平安南，進都指揮使，蒞山西都司事。
HCH_012_155_000331	再從張輔擒安南賊簡定，從都督費瓛征涼州叛人虎保，皆有功。
HCH_012_155_000332	仁宗立，進都督同知。
HCH_012_155_000333	宣德元年，代梁銘為總兵官，鎮寧夏。
HCH_012_155_000334	時官軍征交阯者屢敗，詔發松潘軍援之，將士憚行。
HCH_012_155_000335	千戶錢宏與眾謀，詐言番叛，帥兵掠麥匝諸族。
HCH_012_155_000336	番人震恐，遂反。
HCH_012_155_000337	殺指揮陳傑等，陷松潘、疊溪，圍威、茂諸州。
HCH_012_155_000338	指揮吳玉、韓整、高隆相繼敗績，西鄙騷然。
HCH_012_155_000339	詔遣鴻臚丞何敏、指揮吳瑋往招之，而命懷統劉昭、趙安、蔣貴帥師數萬隨其後。
HCH_012_155_000340	瑋等至，賊不順命。
HCH_012_155_000341	瑋與龍州知州薛繼賢擊賊，復松潘。
HCH_012_155_000342	比懷至，仍用瑋前鋒，遂復疊溪，降二十餘寨。
HCH_012_155_000343	招撫復業者萬二千二百餘戶，歸所掠軍民二千二百餘人，事遂定。
HCH_012_155_000344	進左都督，厚賚金幣，而絀瑋功不錄。
HCH_012_155_000345	懷留鎮四川。
HCH_012_155_000346	在鎮驕縱不法，干預民事，受賕庇罪人，侵奪屯田，笞辱僉事柴震等，數為言官所劾。
HCH_012_155_000347	帝降敕責讓，復以御史王禮彈章示之。
HCH_012_155_000348	懷引罪。
HCH_012_155_000349	置不問。
HCH_012_155_000350	六年，松潘勒都、北定諸族暨空郎、龍溪諸寨番復叛。
HCH_012_155_000351	懷遣兵戰敗，指揮安寧等死者三百餘人。
HCH_012_155_000352	懷乃親督兵深入，破革兒骨寨，進攻空郎乞兒洞。
HCH_012_155_000353	賊敗，斬首墜崖死者無算。
HCH_012_155_000354	革兒骨賊復聚生苗邀戰。
HCH_012_155_000355	擊破之，剿戮殆盡。
HCH_012_155_000356	於是任昌、牛心諸寨番聞風乞降，群寇悉平。
HCH_012_155_000357	久之，巡按御史及按察使復奏：「懷僭侈逾分。每旦，令三司官分班立，有事跪白。懷中坐，稱旨行遣。且日荒於酒，不飭邊備，致城寨失陷。」
HCH_012_155_000358	宣宗怒，召懷還，命文武大臣鞫之，罪當斬。
HCH_012_155_000359	下都察院獄，宥死落職。
HCH_012_155_000360	正統二年以原官鎮大同。
HCH_012_155_000361	時北人來貢者日給廩餼，為軍民累。
HCH_012_155_000362	懷言於朝，得減省。
HCH_012_155_000363	居二年，以老召還，命理中府事。
HCH_012_155_000364	九年春，與中官但住出古北口，征兀良哈。
HCH_012_155_000365	還與馬亮等同封，而懷得平鄉伯。
HCH_012_155_000366	十四年扈駕北征，死土木。
HCH_012_155_000367	贈侯，謚忠毅。
HCH_012_155_000368	子輔乞襲爵，吏部言非世券，執不許。
HCH_012_155_000369	景帝以懷死事，許之。
HCH_012_155_000370	輔卒，子政請襲，吏部執如初，中旨許嗣。
HCH_012_155_000371	政鎮兩廣久，自陳軍功，乞世券，吏部復執不可，詔予之。
HCH_012_155_000372	政卒，子信嗣。
HCH_012_155_000373	弘治中卒，無子，弟俊嗣指揮使。
HCH_012_155_000374	馬亮，淇人。
HCH_012_155_000375	以燕山衛卒從成祖起兵，累功至都指揮僉事。
HCH_012_155_000376	宣宗時官至左都督。
HCH_012_155_000377	兀良哈之役，偕中官劉永誠出劉家口，至黑山、大松林、流沙河諸處，遇賊勝之。
HCH_012_155_000378	還封招遠伯。
HCH_012_155_000379	是役也，王振主之，故諸將功少率得封。
HCH_012_155_000380	亮善騎射，每戰身先士卒，所向克捷，時稱驍將。
HCH_012_155_000381	為伯三年卒。
HCH_012_155_000382	謚榮毅。
HCH_012_155_000383	蔣貴，字大富，江都人。
HCH_012_155_000384	以燕山衛卒從成祖起兵。
HCH_012_155_000385	雄偉多力，善騎射，積功至昌國衛指揮同知。
HCH_012_155_000386	從大軍征交阯及沙漠，遷都指揮僉事，掌彭城衛事。
HCH_012_155_000387	宣德二年，四川松潘諸番叛，充右參將，從總兵官陳懷討之。
HCH_012_155_000388	募鄉導，絕險而進，薄其巢。
