HCH_012_213_000001	徐階，字子升，松江華亭人。
HCH_012_213_000002	生甫周歲，墮眢井，出三日而蘇。
HCH_012_213_000003	五歲從父道括蒼，墮高嶺，衣掛於樹不死。
HCH_012_213_000004	人咸異之。
HCH_012_213_000005	嘉靖二年進士第三人。
HCH_012_213_000006	授翰林院編修，予歸娶。
HCH_012_213_000007	丁父憂，服除，補故官。
HCH_012_213_000008	階為人短小白皙，善容止。
HCH_012_213_000009	性穎敏，有權略，而陰重不泄。
HCH_012_213_000010	讀書為古文辭，從王守仁門人游，有聲士大夫間。
HCH_012_213_000011	帝用張孚敬議，欲去孔子王號，易像為木主，籩豆禮樂皆有所損抑。
HCH_012_213_000012	下儒臣議，階獨持不可。
HCH_012_213_000013	孚敬召階盛氣詰之，階抗辯不屈。
HCH_012_213_000014	孚敬怒曰：「若叛我。」
HCH_012_213_000015	階正色曰：「叛生於附。階未嘗附公，何得言叛？」
HCH_012_213_000016	長揖出。
HCH_012_213_000017	斥為延平府推官。
HCH_012_213_000018	連攝郡事。
HCH_012_213_000019	出繫囚三百，毀淫祠，創鄉社學，捕劇盜百二十人。
HCH_012_213_000020	遷黃州府同知，擢浙江按察僉事，進江西按察副使，俱視學政。
HCH_012_213_000021	皇太子出閣，召拜司經局洗馬兼翰林院侍講。
HCH_012_213_000022	丁母憂歸。
HCH_012_213_000023	服除，擢國子祭酒，遷禮部右侍郎，尋改吏部。
HCH_012_213_000024	故事，吏部率鐍門，所接見庶官不數語。
HCH_012_213_000025	階折節下之。
HCH_012_213_000026	見必深坐，咨邊腹要害，吏治民瘼。
HCH_012_213_000027	皆自喜得階意，願為用。
HCH_012_213_000028	尚書熊浹、唐龍、周用皆重階。
HCH_012_213_000029	階數署部事，所引用宋景、張岳、王道、歐陽德、范鏓皆長者。
HCH_012_213_000030	用卒，聞淵代，自處前輩，取立斷。
HCH_012_213_000031	階意不樂，求出避之。
HCH_012_213_000032	命兼翰林院學士，教習庶吉士。
HCH_012_213_000033	尋掌院事，進禮部尚書。
HCH_012_213_000034	帝察階勤，又所撰青詞獨稱旨，召直無逸殿。
HCH_012_213_000035	與大學士張治、李本俱賜飛魚服及上方珍饌、上尊無虛日。
HCH_012_213_000036	廷推吏部尚書，不聽，不欲階去左右也。
HCH_012_213_000037	階遂請立皇太子，不報。
HCH_012_213_000038	復連請之，皆不報。
HCH_012_213_000039	後當冠婚，復請先裕王，後景王，帝不懌。
HCH_012_213_000040	尋以推恩加太子太保。
HCH_012_213_000041	俺答犯京，階請釋周尚文及戴綸、歐陽安等自效，報可。
HCH_012_213_000042	已，請帝還大內，召群臣計兵事，從之。
HCH_012_213_000043	中官陷寇歸，以俺答求貢書進。
HCH_012_213_000044	帝以示嚴嵩及階，召對便殿。
HCH_012_213_000045	嵩曰：「飢賊耳，不足患。」
HCH_012_213_000046	階曰：「傅城而軍，殺人若刈菅，何謂飢賊？」
HCH_012_213_000047	帝然之，問求貢書安在。
HCH_012_213_000048	嵩出諸袖曰：「禮部事也。」
HCH_012_213_000049	帝復問階。
HCH_012_213_000050	階曰：「寇深矣，不許恐激之怒，許則彼厚要我。請遣譯者紿緩之，我得益為備。援兵集，寇且走。」
HCH_012_213_000051	帝稱善者再。
HCH_012_213_000052	嵩、階因請帝出視朝。
HCH_012_213_000053	寇尋飽去，乃下階疏，弗許貢。
HCH_012_213_000054	嵩怙寵弄權，猜害同列。
HCH_012_213_000055	既仇夏言置之死，而言嘗薦階，嵩以是忌之。
HCH_012_213_000056	初，孝烈皇后崩，帝欲祔之廟，念壓於先孝潔皇后，又睿宗入廟非公議，恐後世議祧，遂欲當己世預祧仁宗，以孝烈先祔廟，自為一世，下禮部議。
HCH_012_213_000057	階抗言女後無先入廟者，請祀之奉先殿。
HCH_012_213_000058	禮科都給事中楊思忠亦以為然。
HCH_012_213_000059	疏上，帝大怒。
HCH_012_213_000060	階皇恐謝罪，不能守前議。
HCH_012_213_000061	帝又使階往邯鄲落成呂仙祠。
HCH_012_213_000062	階不欲行，乃以議祔廟解，得緩期。
HCH_012_213_000063	至寇逼城，帝益懈，乃使尚書顧可學行，而內銜階。
HCH_012_213_000064	摘思忠元旦賀表誤，廷杖之百，斥為民，以怵階。
HCH_012_213_000065	嵩因謂階可間也，中傷之百方。
HCH_012_213_000066	一日獨召對，語及階，嵩徐曰：「階所乏非才，但多二心耳。」
HCH_012_213_000067	蓋以其嘗請立太子也。
HCH_012_213_000068	階危甚，度未可與爭，乃謹事嵩，而益精治齋詞迎帝意，左右亦多為地者。
HCH_012_213_000069	帝怒漸解。
HCH_012_213_000070	未幾，加少保，尋進兼文淵閣大學士，參預機務。
HCH_012_213_000071	密疏發咸寧侯仇鸞罪狀。
HCH_012_213_000072	嵩以階與鸞嘗同直，欲因鸞以傾階。
HCH_012_213_000073	及聞鸞罪發自階，乃愕然止，而忌階益甚。
HCH_012_213_000074	帝既誅鸞，益重階，數與謀邊事。
HCH_012_213_000075	時議減鸞所益衛卒，階言：「不可減。又京營積弱之故，卒不在乏而在冗，宜精汰之，取其廩以資賞費。」
HCH_012_213_000076	又請罷提督侍郎孫禬。
HCH_012_213_000077	帝始格於嵩，久而皆用之。
HCH_012_213_000078	一品滿三載，進勛，為柱國，再進兼太子太傅、武英殿大學士。
HCH_012_213_000079	滿六載，兼食大學士俸，再錄子為中書舍人，加少傅。
HCH_012_213_000080	九載，改兼吏部尚書。
HCH_012_213_000081	賜宴禮部，璽書褒諭有加。
HCH_012_213_000082	帝雖重階，稍示形跡。
HCH_012_213_000083	嘗以五色芝授嵩，使練藥，謂階政本所關，不以相及。
HCH_012_213_000084	階皇恐請，乃得之。
HCH_012_213_000085	帝亦漸委任階，亞於嵩。
HCH_012_213_000086	楊繼盛諭嵩罪，以二王為徵，下錦衣獄。
HCH_012_213_000087	嵩屬陸炳究主使者。
HCH_012_213_000088	階戒炳曰：「即不慎，一及皇子，如宗社何！」
HCH_012_213_000089	又為危語動嵩曰：「上惟二子，必不忍以謝公，所罪左右耳。公奈何顯結宮邸怨也。」
HCH_012_213_000090	嵩𢥠懼，乃寢。
HCH_012_213_000091	倭躪東南，帝數以問階，階力主發兵。
HCH_012_213_000092	階又念邊卒苦飢，請收畿內麥數十萬石，自居庸輸宣府，紫荊輸大同。
HCH_012_213_000093	帝悅，密傳諭行之。
HCH_012_213_000094	楊繼盛之劾嵩也，嵩固疑階。
HCH_012_213_000095	趙錦、王宗茂劾嵩，階又議薄其罰。
HCH_012_213_000096	及是給事中吳時來、主事董傳策、張翀劾嵩不勝，皆下獄。
HCH_012_213_000097	傳策，階裡人；時來、翀，階門生也。
HCH_012_213_000098	嵩遂疏辨，顯謂階主使，帝不聽。
HCH_012_213_000099	有所密詢，皆舍嵩而之階。
HCH_012_213_000100	尋加太子太師。
HCH_012_213_000101	帝所居永壽宮災，徙居玉熙殿，隘甚，欲有所營建，以問嵩。
HCH_012_213_000102	嵩請還大內，帝不懌。
HCH_012_213_000103	問階，階請以三殿所余材，責尚書雷禮營之，可計月而就。
HCH_012_213_000104	帝悅，如階議。
HCH_012_213_000105	命階子尚寶丞璠兼工部主事，董其役，十旬而功成。
HCH_012_213_000106	帝即日徙居之，命曰萬壽宮。
HCH_012_213_000107	以階忠，進少師，兼支尚書俸，予一子中書舍人。
HCH_012_213_000108	子璠亦超擢太常少卿。
HCH_012_213_000109	嵩乃日屈。
HCH_012_213_000110	嵩子世蕃貪橫淫縱狀亦漸聞，階乃令御史鄒應龍劾之。
HCH_012_213_000111	帝勒嵩致仕，擢應龍通政司參議。
HCH_012_213_000112	階遂代嵩為首輔。
HCH_012_213_000113	已而帝念嵩供奉勞，憐之。
HCH_012_213_000114	又以調去，忽忽不樂，乃降諭，欲退而修真且傳嗣，復責階等奈何以官與邪物，謂應龍也。
HCH_012_213_000115	階言：「退而傳嗣，臣等不敢奉命。應龍之轉，乃二部奉旨行之。」
HCH_012_213_000116	帝乃已。
HCH_012_213_000117	帝以嵩在直久，而世蕃顧為奸於外，因命階無久直。
HCH_012_213_000118	階窺帝意，言苟為奸，在外猶在內，固請入直。
HCH_012_213_000119	帝以嵩直廬賜階。
HCH_012_213_000120	階榜三語其中曰：「以威福還主上，以政務還諸司，以用舍刑賞還公論。」
HCH_012_213_000121	於是朝士侃侃，得行其意。
HCH_012_213_000122	袁煒數出直，階請召與共擬旨。
HCH_012_213_000123	因言：「事同眾則公，公則百美基；專則私，私則百弊生。」
HCH_012_213_000124	帝頷之。
HCH_012_213_000125	階以張孚敬及嵩導帝猜刻，力反之，務以寬大開帝意。
HCH_012_213_000126	帝惡給事御史抨擊過當，欲有所行遣。
HCH_012_213_000127	階委曲調劑，得輕論。
HCH_012_213_000128	會問階知人之難，階對曰：「大奸似忠，大詐似信。惟廣聽納，則窮凶極惡，人為我攖之；深情隱慝，人為我發之。故聖帝明王，有言必察。即不實，小者置之，大則薄責而容之，以鼓來者。」
HCH_012_213_000129	帝稱善。
HCH_012_213_000130	言路益發舒。
HCH_012_213_000131	寇由牆子嶺入，直趨通州。
HCH_012_213_000132	帝方祠釐，兵部尚書楊博不敢奏，謀之階，檄宣府總兵官馬芳、宣大總督江東入援。
HCH_012_213_000133	芳兵先至，階請亟賞之，又請重東權，俾統諸道兵。
HCH_012_213_000134	寇從通掠香河，階請亟備順義，而以奇兵邀之古北口。
HCH_012_213_000135	寇趨順義，不得入，乃走古北口。
HCH_012_213_000136	其後軍遇參將郭琥伏而敗，頗得其所掠人畜輜重。
HCH_012_213_000137	始帝怒博不早聞與總督楊選之任寇入也，欲罪之未發。
HCH_012_213_000138	階言：「博雖以祠釐禁不敢聞，而二鎮兵皆其所先檄。若選則非尾寇，乃送之出境耳。」
HCH_012_213_000139	帝竟誅選，不罪博。
HCH_012_213_000140	進階建極殿大學士。
HCH_012_213_000141	袁煒以疾歸，道卒，階獨當國。
HCH_012_213_000142	屢請增閣臣，且乞骸骨。
HCH_012_213_000143	乃命嚴訥、李春芳入閣，而待階益隆。
HCH_012_213_000144	以一品十五載考，恩禮特厚，復賜玉帶、繡蟒、珍藥。
HCH_012_213_000145	帝手書問階疾，諄懇如家人，階益恭謹。
HCH_012_213_000146	帝或有所委，通夕不假寐，應制之文，未嘗逾頃刻期。
HCH_012_213_000147	帝日益愛階。
HCH_012_213_000148	階採輿論利便者，白而行之。
HCH_012_213_000149	嘉靖中葉，南北用兵。
HCH_012_213_000150	邊鎮大臣小不當帝指，輒逮下獄誅竄，閣臣復竊顏色為威福。
HCH_012_213_000151	階當國後，緹騎省減，詔獄漸虛，任事者亦得以功名終。
HCH_012_213_000152	於是論者翕然推階為名相。
HCH_012_213_000153	嚴訥請告歸，命郭樸、高拱入閣，與春芳同輔政，事仍決於階。
HCH_012_213_000154	階數請立太子，不報。
HCH_012_213_000155	已而景王之籓，病薨，階奏奪景府所占陂田數萬頃還之民，楚人大悅。
HCH_012_213_000156	帝欲建雩壇及興都宮殿，階力止之。
HCH_012_213_000157	鄢懋卿驟增鹽課四十萬金，階風御史請復故額。
HCH_012_213_000158	方士胡大順等勸帝餌金丹，階力陳其矯誣狀，大順等尋伏法。
HCH_012_213_000159	帝服餌病躁，戶部主事海瑞極陳帝失，帝恚甚，欲即殺之，階力救得系。
HCH_012_213_000160	帝病甚，忽欲幸興都，階力爭乃止。
HCH_012_213_000161	未幾，帝崩。
HCH_012_213_000162	階草遺詔，凡齋醮、土木、珠寶、織作悉罷，「大禮」大獄、言事得罪諸臣悉牽復之。
HCH_012_213_000163	詔下，朝野號慟感激，比之楊廷和所擬登極詔書，為世宗始終盛事雲。
HCH_012_213_000164	同列高拱、郭樸以階不與共謀，不樂。
HCH_012_213_000165	樸曰：「徐公謗先帝，可斬也。」
HCH_012_213_000166	拱初侍穆宗裕邸，階引之輔政，然階獨柄國，拱心不平。
HCH_012_213_000167	世宗不豫時，給事中胡應嘉嘗劾拱，拱疑階嗾之。
HCH_012_213_000168	隆慶元年，應嘉以救考察被黜者削籍去，言者謂拱修舊郤，脅階，斥應嘉。
HCH_012_213_000169	階復請薄應嘉罰，言者又劾拱。
HCH_012_213_000170	拱欲階擬杖，階從容譬解，拱益不悅。
HCH_012_213_000171	令御史齊康劾階，言其二子多干請及家人橫里中狀。
HCH_012_213_000172	階疏辯，乞休。
HCH_012_213_000173	九卿以下交章劾拱譽階，拱遂引疾歸。
HCH_012_213_000174	康竟斥，樸亦以言者攻之，乞身去。
HCH_012_213_000175	給事、御史多起廢籍，恃階而強，言多過激。
HCH_012_213_000176	帝不能堪，諭階等處之。
HCH_012_213_000177	同列欲擬譴，階曰：「上欲譴，我曹當力爭，乃可導之譴乎。」
HCH_012_213_000178	請傳諭令省改。
HCH_012_213_000179	帝亦勿之罪。
HCH_012_213_000180	是年，詔翰林撰中秋宴致語，階言：「先帝未撤几筵，不可宴樂。」
HCH_012_213_000181	帝為罷宴。
HCH_012_213_000182	帝命中官分督團營，階力陳不可而止。
HCH_012_213_000183	南京振武營兵屢嘩，階欲汰之。
HCH_012_213_000184	慮其據孝陵不可攻也，先令操江都御史唐繼錄督江防兵駐陵傍，而徐下兵部分散之。
HCH_012_213_000185	事遂定。
HCH_012_213_000186	群小璫毆御史於午門，都御史王廷將糾之，階曰：「不得主名，劾何益？且慮彼先誣我。」
HCH_012_213_000187	乃使人以好語誘大璫，先錄其主名。
HCH_012_213_000188	廷疏上，乃分別逮治有差。
HCH_012_213_000189	階之持正應變，多此類也。
HCH_012_213_000190	階所持諍，多宮禁事，行者十八九，中官多側目。
HCH_012_213_000191	會帝幸南海子，階諫，不從。
HCH_012_213_000192	方乞休，而給事中張齊以私怨劾階，階因請歸。
HCH_012_213_000193	帝意亦漸移，許之。
HCH_012_213_000194	賜馳驛。
HCH_012_213_000195	以春芳請，給夫廩，璽書褒美，行人導行，如故事。
HCH_012_213_000196	陛辭，賜白金、寶鈔、彩幣、襲衣。
HCH_012_213_000197	舉朝皆疏留，報聞而已。
HCH_012_213_000198	王廷後刺得張齊納賄事，劾戍之邊。
HCH_012_213_000199	階既行，春芳為首輔，未幾亦歸。
HCH_012_213_000200	拱再出，扼階不遺餘力。
HCH_012_213_000201	郡邑有司希拱指，爭齮晷階，盡奪其田，戍其二子。
HCH_012_213_000202	會拱復為居正所傾而罷，事乃解。
HCH_012_213_000203	萬曆十年，階年八十，詔遣行人存問，賜璽書、金幣。
HCH_012_213_000204	明年卒。
HCH_012_213_000205	贈太師，諡文貞。
HCH_012_213_000206	階立朝有相度，保全善類。
HCH_012_213_000207	嘉、隆之政，多所匡救。
HCH_012_213_000208	間有委蛇，亦不失大節。
HCH_012_213_000209	階弟陟，嘉靖二十六年進士。
HCH_012_213_000210	累官南京刑部侍郎。
HCH_012_213_000211	子璠，以廕官太常卿；琨、瑛，尚寶卿。
HCH_012_213_000212	孫元春，進士，亦官太常卿。
HCH_012_213_000213	元春孫本高，官錦衣千戶，天啟中拒魏忠賢建祠奪職。
HCH_012_213_000214	崇禎改元，以薦起，累官左都督。
HCH_012_213_000215	諸生念祖，國變城破，與妻張，二妾陸、李，皆自縊。
HCH_012_213_000216	高拱，字肅卿，新鄭人。
HCH_012_213_000217	嘉靖二十年進士。
HCH_012_213_000218	選庶吉士。
HCH_012_213_000219	逾年，授編修。
HCH_012_213_000220	穆宗居裕邸，出閣請讀，拱與檢討陳以勤併為侍講。
HCH_012_213_000221	世宗諱言立太子，而景王未之國，中外危疑。
HCH_012_213_000222	拱侍裕邸九年，啟王益敦孝謹，敷陳剴切。
HCH_012_213_000223	王甚重之，手書「懷賢忠貞」字賜焉。
HCH_012_213_000224	累遷侍講學士。
HCH_012_213_000225	嚴嵩、徐階遞當國，以拱他日當得重，薦之世宗。
HCH_012_213_000226	拜太常卿，掌國子監祭酒事。
HCH_012_213_000227	四十一年，擢禮部左侍郎。
HCH_012_213_000228	尋改吏部，兼學士，掌詹事府事。
HCH_012_213_000229	進禮部尚書，召入直廬。
HCH_012_213_000230	撰齋詞，賜飛魚服。
HCH_012_213_000231	四十五年，拜文淵閣大學士，與郭樸同入閣。
HCH_012_213_000232	拱與樸皆階所薦也。
HCH_012_213_000233	世宗居西苑，閣臣直廬在苑中。
HCH_012_213_000234	拱未有子，移家近直廬，時竊出。
HCH_012_213_000235	一日，帝不豫，誤傳非常，拱遽移具出。
HCH_012_213_000236	始階甚親拱，引入直。
HCH_012_213_000237	拱驟貴，負氣頗忤階。
HCH_012_213_000238	給事中胡應嘉，階鄉人也，以劾拱姻親自危。
HCH_012_213_000239	且瞷階方與拱郤，遂劾拱不守直廬，移器用於外。
HCH_012_213_000240	世宗病，勿省也。
HCH_012_213_000241	拱疑應嘉受階指，大憾之。
HCH_012_213_000242	穆宗即位，進少保兼太子太保。
HCH_012_213_000243	階雖為首輔，而拱自以帝舊臣，數與之抗，樸復助之，階漸不能堪。
HCH_012_213_000244	而是時以勤與張居正皆入閣，居正亦侍裕邸講。
HCH_012_213_000245	階草遺詔，獨與居正計，拱心彌不平。
HCH_012_213_000246	會議登極賞軍及請上裁去留大臣事，階悉不從拱議，嫌益深。
HCH_012_213_000247	應嘉掌吏科，佐部院考察，事將竣，忽有所論救。
HCH_012_213_000248	帝責其牴牾，下閣臣議罰。
HCH_012_213_000249	樸奮然曰：「應嘉無人臣禮，當編氓。」
HCH_012_213_000250	階旁睨拱，見拱方怒，勉從之。
HCH_012_213_000251	言路謂拱以私怨逐應嘉，交章劾之。
HCH_012_213_000252	給事中歐陽一敬劾拱尤力。
HCH_012_213_000253	階於拱辯疏，擬旨慰留，而不甚譴言者。
HCH_012_213_000254	拱益怒，相與忿詆閣中。
HCH_012_213_000255	御史齊康為拱劾階，康坐黜。
HCH_012_213_000256	於是言路論拱者無虛日，南京科道至拾遺及之。
HCH_012_213_000257	拱不自安，乞歸，遂以少傅兼太子太傅、尚書、大學士養病去。
HCH_012_213_000258	隆慶元年五月也。
HCH_012_213_000259	拱以舊學蒙眷注，性強直自遂，頗快恩怨，卒不安其位去。
HCH_012_213_000260	既而階亦乞歸。
HCH_012_213_000261	三年冬，帝召拱以大學士兼掌吏部事。
HCH_012_213_000262	拱乃盡反階所為，凡先朝得罪諸臣以遺詔錄用贈恤者，一切報罷。
HCH_012_213_000263	且上疏極論之曰：「《明倫大典》頒示已久。今議事之臣假托詔旨，凡議禮得罪者悉從褒顯，將使獻皇在廟之靈何以為享？先帝在天之靈何以為心？而陛下歲時入廟，亦何以對越二聖？臣以為未可。」
HCH_012_213_000264	帝深然之。
HCH_012_213_000265	法司坐方士王金等子弒父律。
HCH_012_213_000266	拱覆上疏曰：「人君隕於非命，不得正終，其名至不美。先帝臨御四十五載，得歲六十有餘。末年抱病，經歲上賓，壽考令終，曾無暴遽。今謂先帝為王金所害，誣以不得正終，天下後世視先帝為何如主？乞下法司改議。」
HCH_012_213_000267	帝復然拱言，命減戍。
HCH_012_213_000268	拱之再出，專與階修郤，所論皆欲以中階重其罪。
HCH_012_213_000269	賴帝仁柔，弗之竟也。
HCH_012_213_000270	階子弟頗橫鄉里。
HCH_012_213_000271	拱以前知府蔡國熙為監司，簿錄其諸子，皆編戍。
HCH_012_213_000272	所以扼階者，無不至。
HCH_012_213_000273	逮拱去位，乃得解。
HCH_012_213_000274	拱練習政體，負經濟才，所建白皆可行。
HCH_012_213_000275	其在吏部，欲遍識人才，授諸司以籍，使署賢否，志里姓氏，月要而歲會之。
HCH_012_213_000276	倉卒舉用，皆得其人。
HCH_012_213_000277	又以時方憂邊事，請增置兵部侍郎，以儲總督之選。
HCH_012_213_000278	由侍郎而總督，由總督而本兵，中外更番，邊材自裕。
HCH_012_213_000279	又以兵者專門之學，非素習不可應卒。
HCH_012_213_000280	儲養本兵，當自兵部司屬始。
HCH_012_213_000281	宜慎選司屬，多得智謀才力曉暢軍旅者，久而任之，勿遷他曹。
HCH_012_213_000282	他日邊方兵備督撫之選，皆於是取之。
HCH_012_213_000283	更各取邊地之人以備司屬，如銓司分省故事，則題覆情形可無扞格，並重其賞罰以鼓勵之。
HCH_012_213_000284	凡邊地有司，其責頗重，不宜付雜流及遷謫者。
HCH_012_213_000285	皆報可，著為令。
HCH_012_213_000286	拱又奏請科貢與進士並用，勿循資格。
HCH_012_213_000287	其在部考察，多所參伍，不盡憑文書為黜陟，亦不拘人數多寡，黜者必告以故，使眾咸服。
HCH_012_213_000288	古田瑤賊亂，用殷正茂總督兩廣。
HCH_012_213_000289	曰：「是雖貪，可以集事。」
HCH_012_213_000290	貴州撫臣奏土司安國亨將叛，命阮文中代為巡撫。
HCH_012_213_000291	臨行語之曰：「國亨必不叛，若往，無激變也。」
HCH_012_213_000292	即而如其言。
HCH_012_213_000293	以廣東有司多貪黷，特請旌廉能知府侯必登，以歷其餘。
HCH_012_213_000294	又言馬政、鹽政之官，名為卿、為使，而實以閒局視之，失人廢事，漸不可訓。
HCH_012_213_000295	惟教官驛遞諸司，職卑錄薄，遠道為難，宜銓注近地，以恤其私。
HCH_012_213_000296	詔皆從之。
HCH_012_213_000297	拱所經畫，皆此類也。
HCH_012_213_000298	俺答孫把漢那吉來降，總督王崇古受之，請於朝，乞授以官。
HCH_012_213_000299	朝議多以為不可，拱與居正力主之。
HCH_012_213_000300	遂排眾議請於上，而封貢以成。
HCH_012_213_000301	事具崇古傳。
HCH_012_213_000302	進拱少師兼太子太師、尚書、大學士，改建極殿。
HCH_012_213_000303	拱以邊境稍寧，恐將士惰玩，復請敕邊臣及時閒暇，嚴為整頓，仍時遣大臣閱視。
HCH_012_213_000304	帝皆從之。
HCH_012_213_000305	遼東奏捷，進柱國、中極殿大學士。
HCH_012_213_000306	尋考察科道，拱請與都察院同事。
HCH_012_213_000307	時大學士趙貞吉掌都察院，持議稍異同。
HCH_012_213_000308	給事中韓楫劾貞吉有所私庇。
HCH_012_213_000309	貞吉疑拱嗾之，遂抗章劾拱，拱亦疏辨。
HCH_012_213_000310	帝不直貞吉，令致仕去。
HCH_012_213_000311	拱既逐貞吉，專橫益著。
HCH_012_213_000312	尚寶卿劉奮庸上疏陰斥之，給事中曹大埜疏劾其不忠十事，皆謫外任。
HCH_012_213_000313	拱初持清操，後其門生、親串頗以賄聞，致物議。
HCH_012_213_000314	帝終眷拱不衰也。
HCH_012_213_000315	始拱為祭酒，居正為司業，相友善，拱亟稱居正才。
HCH_012_213_000316	及是李春芳、陳以勤皆去，拱為首輔，居正肩隨之。
HCH_012_213_000317	拱性直而傲，同官殷士儋輩不能堪，居正獨退然下之，拱不之察也。
HCH_012_213_000318	馮保者，中人，性黠，次當掌司禮監，拱薦陳洪及孟沖，帝從之，保以是怨拱。
HCH_012_213_000319	而居正與保深相結。
HCH_012_213_000320	六年春，帝得疾，大漸，召拱與居正、高儀受顧命而崩。
HCH_012_213_000321	初，帝意專屬閣臣，而中官矯遺詔命與馮保共事。
HCH_012_213_000322	神宗即位，拱以主上幼沖，懲中官專政，條奏請詘司禮權，還之內閣。
HCH_012_213_000323	又命給事中雒遒、程文合疏攻保，而己從中擬旨逐之。
HCH_012_213_000324	拱使人報居正，居正陽諾之，而私以語保。
HCH_012_213_000325	保訴於太后，謂拱擅權，不可容。
HCH_012_213_000326	太后頷之。
HCH_012_213_000327	明日，召群臣入，宣兩宮及帝詔。
HCH_012_213_000328	拱意必逐保也，急趨入。
HCH_012_213_000329	比宣詔，則數拱罪而逐之。
HCH_012_213_000330	拱伏地不能起，居正掖之出，僦騾車出宣武門。
HCH_012_213_000331	居正乃與儀請留拱，弗許。
HCH_012_213_000332	請得乘傳，許之。
HCH_012_213_000333	拱既去，保憾未釋。
HCH_012_213_000334	復構王大臣獄，欲連及拱，已而得寢。
HCH_012_213_000335	居家數年，卒。
HCH_012_213_000336	居正請復其官，與祭葬如例。
HCH_012_213_000337	中旨給半葬，祭文仍寓貶詞雲。
HCH_012_213_000338	久之，廷議論拱功，贈太師，諡文襄，廕嗣子務觀為尚寶丞。
HCH_012_213_000339	郭樸，字質夫，安陽人。
HCH_012_213_000340	嘉靖十四年進士。
HCH_012_213_000341	選庶吉士。
HCH_012_213_000342	累官禮部右侍郎，入直西苑。
HCH_012_213_000343	歷吏部左、右侍郎兼太子賓客。
HCH_012_213_000344	南京禮部缺尚書，帝憐樸久次，特加太子少保擢任之。
HCH_012_213_000345	樸辭曰：「幸與撰述，不欲遠離闕下。」
HCH_012_213_000346	帝大喜，命即以太子少保、禮部尚書、詹事府侍直如故。
HCH_012_213_000347	頃之，吏部尚書歐陽必進罷，即以樸代之。
HCH_012_213_000348	越二年，以父喪去。
HCH_012_213_000349	及嚴訥由吏部入閣，帝謀代者。
HCH_012_213_000350	時董份以工部尚書行吏部左侍郎事，方受帝眷，而為人貪狡無行。
HCH_012_213_000351	徐階慮其代訥，急言於帝，起樸故官。
HCH_012_213_000352	樸固請終制，不許。
HCH_012_213_000353	尋以考績，加太子太保。
HCH_012_213_000354	四十五年，兼武英殿大學士，入預機務，與高拱並命。
HCH_012_213_000355	階早貴，權重，春芳、訥事之謹，至不敢講鈞禮。
HCH_012_213_000356	而樸與拱鄉里相得，事階稍倨，拱尤負才自恣。
HCH_012_213_000357	及世宗崩，階草遺詔，盡反時政之不便者。
