HCH_012_078_000233	驛夫無所得食，至相率從流賊為亂云。
HCH_012_078_000234	凡軍、匠、竈戶，役皆永充。
HCH_012_078_000235	軍戶死若逃者，於原籍勾補。
HCH_012_078_000236	匠戶二等：曰住坐，曰輪班。
HCH_012_078_000237	住坐之匠，月上工十日。
HCH_012_078_000238	不赴班者，輸罰班銀月六錢，故謂之輸班。
HCH_012_078_000239	監局中官，多佔匠役，又括充幼匠，動以千計，死若逃者，勾補如軍。
HCH_012_078_000240	竈戶有上、中、下三等。
HCH_012_078_000241	每一正丁，貼以餘丁。
HCH_012_078_000242	上、中戶丁力多，或貼二三丁，下戶概予優免。
HCH_012_078_000243	他如陵戶、園戶、海戶、廟戶、幡夫、庫役，瑣末不可勝計。
HCH_012_078_000244	明初，工役之繁，自營建兩京宗廟、宮殿、闕門、王邸，採木、陶甓，工匠造作，以萬萬計。
HCH_012_078_000245	所在築城、浚陂，百役具舉。
HCH_012_078_000246	迄於洪、宣，郊壇、倉庾猶未迄工。
HCH_012_078_000247	正統、天順之際，三殿、兩宮、南內、離宮，次第興建。
HCH_012_078_000248	弘治時，大學士劉吉言：「近年工役，俱摘發京營軍士，內外軍官禁不得估工用大小多寡。本用五千人，奏請至一二萬，無所稽覈。」
HCH_012_078_000249	禮部尚書倪嶽言：「諸役費動以數十萬計，水旱相仍，乞少停止。」
HCH_012_078_000250	南京禮部尚書童軒復陳工役之苦。
HCH_012_078_000251	吏部尚書林瀚亦言：「兩畿頻年兇災，困於百役，窮愁怨歎。山、陝供億軍興，雲南、廣東西徵發剿叛。山東、河南、湖廣、四川、江西興造王邸，財力不贍。浙江、福建辦物料，視舊日增多。庫藏空匱，不可不慮。」
HCH_012_078_000252	帝皆納其言，然不能盡從也。
HCH_012_078_000253	武宗時，乾清宮役尤大。
HCH_012_078_000254	乙太素殿初制樸儉，改作雕峻，用銀至二千萬餘兩，役工匠三千餘人，歲支工食米萬三千餘石。
HCH_012_078_000255	又修凝翠、昭和、崇智、光霽諸殿，御馬臨、鐘鼓司、南城豹房新房、火藥庫皆鼎新之。
HCH_012_078_000256	權幸閹宦莊園祠墓香火寺觀，工部復竊官銀以媚焉。
HCH_012_078_000257	給事中張原言：「工匠養父母妻子，尺籍之兵禦外侮，京營之軍衛王室，今奈何令民無所賴，兵不麗伍，利歸私門，怨叢公室乎？」
HCH_012_078_000258	疏入，謫貴州新添驛丞。
HCH_012_078_000259	世宗營建最繁，十五年以前，名為汰省，而經費已六七百萬。
HCH_012_078_000260	其後增十數倍，齋宮、祕殿並時而興。
HCH_012_078_000261	工廠二三十處，役匠數萬人，軍稱之，歲費二三百萬。
HCH_012_078_000262	其時宗廟、萬壽宮災，帝不之省，營繕益急。
HCH_012_078_000263	經費不敷，乃令臣民獻助；獻助不已，復行開納。
HCH_012_078_000264	勞民耗財，視武宗過之。
HCH_012_078_000265	萬曆以後，營建織造，溢經制數倍，加以徵調、開採，民不得少休。
HCH_012_078_000266	迨閹人亂政，建第營墳，僭越亡等，功德私祠遍天下。
HCH_012_078_000267	蓋二百餘年，民力殫殘久矣。
HCH_012_078_000268	其以職役優免者，少者一二丁，多者至十六丁。
HCH_012_078_000269	萬歷時，免田有至二三千者。
HCH_012_078_000270	至若賦稅蠲免，有恩蠲，有災蠲。
HCH_012_078_000271	太祖之訓，凡四方水旱輒免稅，豐歲無災傷，亦擇地瘠民貧者優免之。
HCH_012_078_000272	凡歲災，盡蠲二稅，且貸以米，甚者賜米布若鈔。
HCH_012_078_000273	又設預備倉，令老人運鈔易米以儲粟。
HCH_012_078_000274	荊、蘄水災，命戶部主事趙乾往振，遷延半載，怒而誅之。
HCH_012_078_000275	青州旱蝗，有司不以聞，逮治其官吏。
HCH_012_078_000276	旱傷州縣，有司不奏，許耆民申訴，處以極刑。
HCH_012_078_000277	孝感饑，其令請以預備倉振貸，帝命行人馳驛往，且諭戶部：自今凡歲饑，先發倉庾以貸，然後聞，著為令。
HCH_012_078_000278	在位三十餘年，賜予布鈔數百萬，米百餘萬，所蠲租稅無數。
HCH_012_078_000279	成祖聞河南饑，有司匿不以聞，逮沼之。
HCH_012_078_000280	因命都御史陳瑛榜諭天下，有司水旱災傷不以聞者，罪不宥。
HCH_012_078_000281	又敕朝廷歲遣巡視官，目擊民艱不言者，悉逮下獄。
HCH_012_078_000282	仁宗監國時，有以發振請者，遣人馳諭之，言：「軍民睏乏，待哺嗷嗷，尚從容啟請待報，不能效漢汲黯耶？」
HCH_012_078_000283	宣宗時，戶部請核饑民。
HCH_012_078_000284	帝曰：「民饑無食，濟之當如拯溺救焚，奚待勘。」
HCH_012_078_000285	蓋二祖、仁、宣時，仁政亟行。
HCH_012_078_000286	預備倉之外，又時時截起運，賜內帑。
HCH_012_078_000287	被災處無儲粟者，發旁縣米振之。
HCH_012_078_000288	蝗蝻始生，必遣人捕枌。
HCH_012_078_000289	鬻子女者，官為收贖。
HCH_012_078_000290	且令富人蠲佃戶租。
HCH_012_078_000291	大戶貸貧民粟，免其雜役為息，豐年償之。
HCH_012_078_000292	皇莊、湖泊皆馳禁，聽民採取。
HCH_012_078_000293	饑民還籍，給以口糧。
HCH_012_078_000294	京、通倉米，平價出糶。
HCH_012_078_000295	兼預給俸糧以殺米價，建官舍以處流民，給糧以收棄嬰，養濟院窮民各注籍，無籍者收養蠟燭、幡竿二寺。
HCH_012_078_000296	其恤民如此。
HCH_012_078_000297	世宗、神宗於民事略矣，而災荒疏至，必賜蠲振，不敢違祖制也。
HCH_012_078_000298	振米之法，明初，大口六斗，小口三斗，五歲以下不與。
HCH_012_078_000299	永樂以後，減其數。
HCH_012_078_000300	納米振濟贖罪者，景帝時，雜犯死罪六十石，流徒減三之一，餘遞減有差。
HCH_012_078_000301	捐納事例，自憲宗始。
HCH_012_078_000302	生員納米百石以上，人國子監；軍民納二百五十石，為正九品散官，加五十石，增二級，至正七品止。
HCH_012_078_000303	武宗時，富民納粟振濟，千石以上者表其門，九百石至二三百石者，授散官，得至從六品。
HCH_012_078_000304	世宗令義民出谷二十石者，給冠帶，多者授官正七品，至五百石者，有司為立坊。
HCH_012_078_000305	振粥之法，自世宗始。
HCH_012_078_000306	報災之法，洪武時不拘時限。
HCH_012_078_000307	弘治中，始限夏災不得過五月終，秋災不得過九月終。
HCH_012_078_000308	萬歷時，又分近地五月、七月，邊地七月、九月。
HCH_012_078_000309	洪武時，勘災既實，盡與蠲免。
HCH_012_078_000310	弘治中，始定全災免七分，自九分災以下遞減。
HCH_012_078_000311	又止免存留，不及起運，後遂為永制云。
