HCH_009_128_000303	武都，字文伯、東勝州人。
HCH_009_128_000304	大定二十二年進士，調陽穀主簿，遷商水令。
HCH_009_128_000305	縣素多盜，凡奸民嘗縱火行劫、椎埋發塚者，都皆廉得姓名，榜之通衢，約毋再犯，悉奔他境。
HCH_009_128_000306	察廉，遷南京路轉運支度判官，累遷中都路都轉運副使。
HCH_009_128_000307	以親老，與弟監察御史鬱俱乞侍。
HCH_009_128_000308	尋丁憂。
HCH_009_128_000309	服除，調太原治中，複為都轉運副使，遷灤州刺史。
HCH_009_128_000310	充宣差北京路規措官，都拘括散逸官錢百萬。
HCH_009_128_000311	入為戶部郎中，權右司郎中，奏事稱旨。
HCH_009_128_000312	被詔由海道漕遼東粟賑山東，都高其價直募人入粟，招海賈船致之。
HCH_009_128_000313	三遷中都、西京按察副使。
HCH_009_128_000314	大安三年，充宣差行六部侍郎，以勞遷本路按察使，行西南路六部尚書，佐元帥抹撚盡忠備禦西京，有勞，召為戶部尚書，賞銀二百兩、絹一百匹。
HCH_009_128_000315	宣宗即位，議衛紹王降封，語在《衛紹王紀》。
HCH_009_128_000316	頃之，中都戒嚴，都知大興府，佩虎符便宜行事，彈壓中外軍民。
HCH_009_128_000317	都醉酒以褻衣見詔使，坐是解職。
HCH_009_128_000318	起為刑部尚書。
HCH_009_128_000319	中都解圍，為河東路宣撫使，俄以參知政事胥鼎代之。
HCH_009_128_000320	興定元年，以疾卒。
HCH_009_128_000321	紇石烈德，字廣之，真定路山春猛安人。
HCH_009_128_000322	明昌二年進士，調南京教授。
HCH_009_128_000323	察廉能，遷厭次令，補尚書省令史，除同知泗州防禦事、監察御史、大名治中、安、曹、裕三州刺史，曆同知臨潢，大興府事。
HCH_009_128_000324	貞祐二年，遷肇州防禦使。
HCH_009_128_000325	是歲，肇州升為武興軍節度，德為節度使宣撫司署都提控。
HCH_009_128_000326	肇州圍急，食且盡，有糧三百船在鴨子河，去州五裏不能至。
HCH_009_128_000327	德乃浚濠增陴，築甬道導濠水屬之河。
HCH_009_128_000328	鑿陷馬阱，伏甲其傍以拒守，一日兵數接，士殊死戰。
HCH_009_128_000329	渠成，船至城下，兵食足，圍乃解。
HCH_009_128_000330	改遼東路轉運使，軍民遮道挽留，乘夜乃得去。
HCH_009_128_000331	蒲鮮萬奴逼上京，德與部將劉子元戰卻之。
HCH_009_128_000332	遷東京留守，曆保靜、武勝軍節度使。
HCH_009_128_000333	興定二年，以本官行六部事。
HCH_009_128_000334	三年，以節度權元帥右都監，與左都監單州經略使完顏仲元俱行元帥府于宿州。
HCH_009_128_000335	四年，遷工部尚書。
HCH_009_128_000336	明年，召還中都。
HCH_009_128_000337	是歲，卒。
HCH_009_128_000338	張特立，字文舉，曹州東明人。
HCH_009_128_000339	泰和三年中進士第，調宣德州司候。
HCH_009_128_000340	郡多皇族巨室，特立律之以法，闔境肅然。
HCH_009_128_000341	調萊州節度判官，不赴，躬耕杞之圉城，以經學自樂。
HCH_009_128_000342	正大初，左丞侯摯、參政師安石薦其才，授洛陽令。
HCH_009_128_000343	四年，拜監察御史。
HCH_009_128_000344	拜章言：「鎬厲二宅，久加禁錮，棘圍柝警，如防寇盜。近降赦恩。謀反大逆，皆蒙湔雪，彼獨何罪，幽囚若是。世宗神靈在天，得無傷其心乎！聖嗣未立，未必不由是也。」
HCH_009_128_000345	又言：「方今三面受敵，百姓凋敝，宰執非才，臣恐中興之功未可以歲月期也。」
HCH_009_128_000346	又言：「尚書右丞顏盞世魯遣其奴與小民爭田，失大臣體。參知政事徒單兀典諂事近習，得居其位。皆宜罷之。」
HCH_009_128_000347	當路者忌其直，陰有以擠之。
HCH_009_128_000348	因劾省掾高楨輩受請托，飲娼家。
HCH_009_128_000349	時平章政事白撒犒軍陝西歸，楨等泣訴於道，以當時同席並有省掾王賓，張為其進士，故不劾。
HCH_009_128_000350	白撒以其私且不實，並治特立及賓。
HCH_009_128_000351	特立左遷邳州軍事判官，杖五十，賓亦勒停。
HCH_009_128_000352	士論皆惜特立之去。
HCH_009_128_000353	後卒癸丑歲，年七十五。
HCH_009_128_000354	王浩，由吏起身，初辟涇陽令，廉白為關輔第一。
HCH_009_128_000355	時西台檄州縣增植棗果，督責嚴急，民甚被擾，浩獨無所問，主司將坐之，浩曰：「是縣所植已滿其數，若欲增植，必盜他人所有，取彼置此，未見其利。」
HCH_009_128_000356	其愛民多此類。
HCH_009_128_000357	所在有善政，民絲毫無所犯，秦人為立生祠，歲時思之。
HCH_009_128_000358	南遷後，為扶溝令。
HCH_009_128_000359	開興元年正月，民錢大亨等執縣官送款于北，大亨以浩有恩於民，不忍加刃，日遣所知勸之降，浩終不聽，於是殺之，無血。
HCH_009_128_000360	主簿劉坦、尉宋乙並見害。
HCH_009_128_000361	棄屍道路，自春徂夏，獨浩屍儼然如生，目且不瞑，烏犬莫敢近，殆若有神護者。
HCH_009_128_000362	初，辟舉法行，縣官甚多得人。
HCH_009_128_000363	如咸甯令張天綱、長安令李獻甫、洛陽令張特立三人有傳。
HCH_009_128_000364	余如興平師夔、臨潼武天禎、氾水黨君玉、偃師王登庸、高陵宋九嘉、登封薛居中、長社李天翼、河津孫鼎臣、郟城李無党、滎陽李過庭、尉氏張瑜、長葛張子玉、猗氏安德璋、三原蕭邦傑、藍田張德直、葉縣劉從益皆清慎才敏，極一時之選，而能扶持百年將傾之祚者，亦曰吏得其人故也。
