HCH_009_128_000001	循吏盧克忠牛德昌范承吉王政張奕李瞻劉敏行傅慎微劉煥高昌福孫德淵趙鑒蒲察鄭留女奚烈守愚石抹元張彀趙重福武都紇石烈德張特立王浩金自穆宗號令諸部不得稱都孛堇，於是諸部始列於統屬。
HCH_009_128_000002	太祖命三百戶為謀克，十謀克為猛安，一如郡縣置吏之法。
HCH_009_128_000003	太宗既有中原，申畫封疆，分建守令。
HCH_009_128_000004	熙宗遣廉察之使循行四方。
HCH_009_128_000005	世宗承海陵凋镨之餘，休養生息，迄於明昌、承安之間，民物滋殖，循吏迭出焉。
HCH_009_128_000006	泰和用兵，郡縣多故，吏治衰矣。
HCH_009_128_000007	宣宗尚刀筆之習，嚴考核之法，能吏不乏，而豈弟之政罕見稱述焉。
HCH_009_128_000008	金百餘年吏治，始終可考，於是作《循吏傳》。
HCH_009_128_000009	盧克忠，貴德州奉集人。
HCH_009_128_000010	高永昌據遼陽，克忠走詣金源郡王斡魯營降，遂以撒屋出為鄉導。
HCH_009_128_000011	斡魯克東京，永昌走長松島，克忠與渤海人撻不也追獲之。
HCH_009_128_000012	收國二年，授世襲謀克。
HCH_009_128_000013	其後，定燕伐宋皆與有功，除登州刺史，改刺澶州。
HCH_009_128_000014	天德間，同知保大軍節度使。
HCH_009_128_000015	綏德州軍卒數人道過鄜城，求宿民家，是夜有賊剽主人財而去。
HCH_009_128_000016	有司執假宿之卒，繫獄榜掠誣服。
HCH_009_128_000017	克忠察其冤，獨不肯署，未幾果得賊，假宿之卒遂釋。
HCH_009_128_000018	大定二年，除北京副留守。
HCH_009_128_000019	會民艱食，克忠下令凡民有蓄積者計留一歲，悉平其價糴之，由是無捐瘠之患。
HCH_009_128_000020	轉陳州防禦使，後以靜難軍節度使致仕，卒。
HCH_009_128_000021	牛德昌，字彥欽，蔚州定安人。
HCH_009_128_000022	父鐸，遼將作大監。
HCH_009_128_000023	德昌少孤，其母教之學，有勸以就廕者，其母曰：「大監遺命不使作承奉也。」
HCH_009_128_000024	中皇統二年進士第，調礬山簿。
HCH_009_128_000025	遷萬泉令。
HCH_009_128_000026	屬蒲、陝薦饑，群盜充斥，州縣城門晝閉。
HCH_009_128_000027	德昌到官，即日開城門縱百姓出入，榜曰：「民苦饑寒，剽掠鄉聚以偷旦夕之命，甚可憐也。能自新者一不問。」
HCH_009_128_000028	賊皆感激解散，縣境以安。
HCH_009_128_000029	府尹王伯龍嘉之，禮待甚厚。
HCH_009_128_000030	累官刑部、吏部侍郎，中都路都轉運使，廣甯、太原尹。
HCH_009_128_000031	卒，贈中奉大夫。
HCH_009_128_000032	范承吉，字寵之。
HCH_009_128_000033	好學問，屬遼季盜賊起，雖避地未嘗廢書。
HCH_009_128_000034	天慶八年中進士丙科，授秘書省校書郎，至大定府金源令。
HCH_009_128_000035	歸朝為御前承應文字。
HCH_009_128_000036	天會初，遷殿中少監。
HCH_009_128_000037	四年，從攻太原，遷少府監。
HCH_009_128_000038	五年，宗翰克宋，所得金珠承吉司其出入，無毫髮欺，及還，犢車載書史而已，尋遷昭文館直學士，知絳州。
HCH_009_128_000039	先是，軍興，民有為將士所掠而逃歸者，承吉使吏遍諭，俾其自實，凡數千人，具白元帥府，許自贖為良，或貧無貲者以公廚代輸。
HCH_009_128_000040	六年，改河東北路轉運使。
HCH_009_128_000041	時承宋季之弊，民賦繁重失當，承吉乃為經畫，立法簡便，所入增十數萬斛，官既足而民有餘。
HCH_009_128_000042	曆同知平陽尹、西京副留守，遷河東南路轉運使，改同簽燕京留守事、順天軍節度使，屬地震壞民廬舍，有欲爭先營葺者，工匠過取其直，承吉命官屬董其役，先後以次，不間貧富，民賴以省費。
HCH_009_128_000043	曆鎮西軍節度使、行台禮部尚書、泰甯軍節度使，複鎮順天。
HCH_009_128_000044	奚卒散居境內，率數千人為盜，承吉繩以法不少貸，懼而不敢犯。
HCH_009_128_000045	貞元二年，以光祿大夫致仕，卒年六十六。
HCH_009_128_000046	王政，辰州熊嶽人也。
HCH_009_128_000047	其先仕渤海及遼，皆有顯者。
HCH_009_128_000048	政當遼季亂，浮沈州裏。
HCH_009_128_000049	高永昌據遼東，知政材略，欲用之。
HCH_009_128_000050	政度其無成，辭謝不就。
HCH_009_128_000051	永昌敗，渤海人爭縛永昌以為功，政獨逡巡引退。
HCH_009_128_000052	吳王闍母聞而異之，言于太祖，授盧州渤海軍謀克。
HCH_009_128_000053	從破白嵆，下燕雲。
HCH_009_128_000054	及金兵伐宋，滑州降，留政為安撫使。
HCH_009_128_000055	前此數州既降，複殺守將反為宋守，及是人以為政憂。
HCH_009_128_000056	政曰：「苟利國家，雖死何避。」
HCH_009_128_000057	宋王宗望壯之，曰：「身沒王事，利及子孫，汝言是也。」
HCH_009_128_000058	政從數騎入州。
HCH_009_128_000059	是時，民多以饑為盜，坐系。
HCH_009_128_000060	政皆釋之，發倉廩以賑貧乏，於是州民皆悅，不復叛。
HCH_009_128_000061	傍郡聞之，亦多降者。
HCH_009_128_000062	宋王召政至轅門，撫其背曰：「吾以汝為死矣，乃複成功耶。」
HCH_009_128_000063	慰諭者久之。
HCH_009_128_000064	天會四年，為燕京都曲院同監。
HCH_009_128_000065	未幾，除同知金勝軍節度使事。
HCH_009_128_000066	改權侍衛親軍都指揮使、兼掌軍資。
HCH_009_128_000067	是時，軍旅始定，管庫紀綱未立，掌吏皆因緣為奸。
HCH_009_128_000068	政獨明會計，嚴局鐍，金帛山積而出納無錙銖之失。
HCH_009_128_000069	吳王闍母戲之曰：「汝為官久矣，而貧不加富何也？」
HCH_009_128_000070	對曰：「政以楊震四知自守，安得不貧。」
HCH_009_128_000071	吳王笑曰：「前言戲之耳。」
HCH_009_128_000072	以黃金百兩、銀五百兩及所乘馬遺之。
HCH_009_128_000073	六年，授左監門將軍，曆安州刺史、檀州軍州事、戶吏房主事。
HCH_009_128_000074	天眷元年，遷保靜軍節度使，致仕卒，年六十六。
HCH_009_128_000075	政本名南撒裏，嘗使高麗，因改名政。
HCH_009_128_000076	子遵仕、遵義、遵古。
HCH_009_128_000077	遵古子庭筠有傳。
HCH_009_128_000078	張奕，字彥微，其先澤州高平人。
HCH_009_128_000079	以廕補官，仕齊為歸德府通判。
HCH_009_128_000080	齊國廢，齊兵之在郡者二萬人謀為亂，約夜半舉燎相應。
HCH_009_128_000081	奕知之，選市人丁壯授以兵，結陣扼其要巷，開小南門以示生路，亂不得作，比明亡匿略盡，擒其首惡誅之。
HCH_009_128_000082	後五日，都統完顏阿魯補以軍至歸德，欲根株餘黨，奕以闔門保郡人無他，遂止。
HCH_009_128_000083	行台承制除同知歸德尹。
HCH_009_128_000084	天眷元年，以河南與宋，改同知沂州防禦使事。
HCH_009_128_000085	三年，宗弼複取河南，征奕赴行省，既定汴京，授汴京副留守。
HCH_009_128_000086	曆陳、秦州防禦使，同知太原尹。
HCH_009_128_000087	晉甯軍報夏人侵界，詔奕往征之。
HCH_009_128_000088	奕至境上，按籍各歸所侵土，還奏曰：「折氏世守麟府，以抗夏人。本朝有其地遂以與夏。夏人夷折氏墳壟而戮其屍，折氏怨入骨髓而不得報也。今複使守晉寧，故激怒夏人使為鼠侵，而條上其罪，苟欲開邊釁以雪私仇耳。獨可徙折氏他郡，則夏人自安。」
HCH_009_128_000089	朝廷從之，遂移折氏守青州。
HCH_009_128_000090	正隆間，同知西京留守事，遷河東北路轉運使。
HCH_009_128_000091	大定二年，征為戶部尚書，甫視事，得疾卒。
HCH_009_128_000092	李瞻，薊州玉田人。
HCH_009_128_000093	遼天慶二年進士，為平州望雲令。
HCH_009_128_000094	張覺據平州叛，以瞻從事。
HCH_009_128_000095	宗望複平州，覺亡去，城中複叛，瞻逾城出降，其子不能出，為賊所害。
HCH_009_128_000096	宋王宗望嘉之。
HCH_009_128_000097	承制以為興平府判官。
HCH_009_128_000098	天會三年，遷大理少卿，從宗望南伐，為漢軍糧料使。
HCH_009_128_000099	四年，金兵圍汴，宋人請割河北三鎮，瞻與禮部侍郎李天翼安撫河北東、西兩路，略定懷、浚、衛等州，衛、湯陰等縣。
HCH_009_128_000100	七年，知寧州，累遷德州防禦使。
HCH_009_128_000101	為政寬平，民懷其惠，相率詣京師請留者數百千人。
HCH_009_128_000102	貞元三年，遷濟州路轉運使，改忠順軍節度使。
HCH_009_128_000103	正隆末，盜賊蜂起，瞻增築城壘為備，蔚人賴之以安。
HCH_009_128_000104	大定初，卒於官。
HCH_009_128_000105	劉敏行，平州人。
HCH_009_128_000106	登天會三年進士。
HCH_009_128_000107	除太子校書郎，累遷肥鄉令。
HCH_009_128_000108	歲大饑，盜賊掠人為食。
HCH_009_128_000109	諸縣老弱入保郡城，不敢耕種，農事廢，畎畝荒蕪。
HCH_009_128_000110	敏行白州，借軍士三十護縣民出耕，多張旗幟為疑兵，敏行率軍巡邏，日暮則閱民入城，由是盜不敢犯而耕稼滋殖。
HCH_009_128_000111	轉高平令。
HCH_009_128_000112	縣城圮壞久不修，大盜橫恣，掠縣鎮不能禦。
HCH_009_128_000113	敏行出己俸，率僚吏出錢顧役繕治，百姓欣然從之，凡用二千人，版築遂完。
HCH_009_128_000114	鄉村百姓入保，賊至不能犯。
HCH_009_128_000115	凡九遷，為河北東路轉運使。
HCH_009_128_000116	致仕。
HCH_009_128_000117	卒。
HCH_009_128_000118	傅慎微，字幾先。
HCH_009_128_000119	其先秦州沙溪人，後徙建昌。
HCH_009_128_000120	慎微遷居長安。
HCH_009_128_000121	宋末登進士，累官河東路經制使。
HCH_009_128_000122	宗翰已克汴京，使婁室定陝西，慎微率眾迎戰，兵敗被獲，送至元帥府。
HCH_009_128_000123	元帥宗翰愛其才學，弗殺，羈置歸化州，希尹收置門下。
HCH_009_128_000124	宗弼複取河南地，起為陝西經略使，尋權同州節度使事。
HCH_009_128_000125	明年，陝西大旱，饑死者十七八，以慎微為京兆、鄜延、環慶三路經濟使，許以便宜。
HCH_009_128_000126	慎微募民入粟，得二十余萬石，立養濟院飼餓者，全活甚眾。
HCH_009_128_000127	改同知京兆尹，權陝西諸路轉運使。
HCH_009_128_000128	複修三白、龍首等渠以溉田，募民屯種，貸牛及種子以濟之，民賴其利。
HCH_009_128_000129	轉中京副留守，用廉，改忻州刺史，累遷太常卿，除定武軍節度使，移靜難軍，忤用事者，蘇保衡救之得免。
HCH_009_128_000130	大定初，複為太常卿，遷禮部尚書，與翰林侍講學士徒單子溫、翰林待制移剌熙載俱兼同修國史。
HCH_009_128_000131	卒官，年七十六。
HCH_009_128_000132	慎微博學喜著書，嘗奏《興亡金鏡錄》一百卷。
HCH_009_128_000133	性純質，篤古喜談兵，時人以為迂闊雲。
HCH_009_128_000134	劉煥，字德文，中山人。
HCH_009_128_000135	宋末起兵，城中久乏食，煥尚幼，煮糠核而食之，自飲其清者，以醲厚者供其母，鄉里異之。
HCH_009_128_000136	稍長就學，天寒擁糞火讀書不怠。
HCH_009_128_000137	登天德元年進士。
HCH_009_128_000138	調任丘尉。
HCH_009_128_000139	縣令貪污，煥每規正之，秩滿，令持杯酒謝曰：「尉廉慎，使我獲考。」
HCH_009_128_000140	調中都市令。
HCH_009_128_000141	樞密使僕散忽土家有絛結工，牟利於市，不肯從市籍役，煥系之。
HCH_009_128_000142	忽土召煥，煥不往，暴工罪而笞之。
HCH_009_128_000143	煥初除市令，過謝鄉人吏部侍郎石琚，琚不悅曰：「京師浩穰，不與外郡同，棄簡就煩，吾所不曉也。」
HCH_009_128_000144	至是，始重之。
HCH_009_128_000145	以廉升京兆推官，再遷北京警巡使。
HCH_009_128_000146	捕二惡少杖于庭中，戒之曰：「孝弟敬慎，則為君子。暴戾隱賊，則為小人。自今以往，毋狃于故習，國有明罰，吾不得私也。」
HCH_009_128_000147	自是，眾皆畏憚，毋敢犯者。
HCH_009_128_000148	召為監察禦使，父老數百人或臥車下，或挽其靴鐙，曰：「我欲複留使君期年，不可得也。」
HCH_009_128_000149	以本官攝戶部員外郎，代州錢監雜青銅鑄錢，錢色惡，類鐵錢。
HCH_009_128_000150	民間盜鑄，抵罪者眾，朝廷患之，下尚書省議。
HCH_009_128_000151	煥奏曰：「錢寶純用黃銅精治之，中濡以錫，若青銅可鑄，歷代無緣不用。自代州取二分與四六分，青黃雜糅，務省銅而功易就。由是，民間盜鑄，陷罪者眾，非朝廷意也。必欲為天下利，宜純用黃銅，得數少而利遠。其新錢已流行者，宜驗數輸納准換。」
HCH_009_128_000152	從之。
HCH_009_128_000153	再遷管州刺史，耆老數百人疏其著跡十一事，詣節鎮請留煥，曰：「刺史守職奉法，乞留之。」
HCH_009_128_000154	以廉升鄭州防禦使，遷官一階，轉同知北京留守事。
HCH_009_128_000155	世宗幸上京，所過州郡大發民夫治橋樑馳道，以希恩賞，煥所部惟平治端好而已。
HCH_009_128_000156	上嘉其意，遷遼東路轉運使，卒。
HCH_009_128_000157	高昌福，中都宛平人。
HCH_009_128_000158	父履，遼御史中丞致仕，太宗聞其名召之，未及入見而卒，特詔昌福釋服應舉。
HCH_009_128_000159	登天會十年進士第，補樞密院令史。
HCH_009_128_000160	明年，辟元帥府令史。
HCH_009_128_000161	皇統初，宗弼複河南，元帥府治汴，人有疑似被獲，皆目為宋諜者，即殺之。
HCH_009_128_000162	昌福讞得其實，釋去者甚眾。
HCH_009_128_000163	許州都統韓常用法嚴，好殺人，遣介送囚於汴，或道亡，監吏自度失囚恐得罪，欲盡殺諸囚以滅口。
HCH_009_128_000164	昌福識監吏意，窮竟其狀，免死者十七八，而諸吏遂怨昌福，欲構害之。
HCH_009_128_000165	是時方用兵，梁、楚間夜多陰雨，元帥府選人偵宋兵動靜，諸吏遣昌福。
HCH_009_128_000166	昌福不辭即行，盡得敵軍虛實報元帥府。
HCH_009_128_000167	師還，除震武軍節度副使，轉行台禮部員外郎。
HCH_009_128_000168	天德間，行台罷，改絳陽軍節度副使，入為兵部員外郎，改河間少尹。
HCH_009_128_000169	世宗即位，上書陳便宜事，上披閱再三，因謂侍臣曰：「內外官皆上書言事，可以知人材優劣，不然，朕何由知之。」
HCH_009_128_000170	三除同知東京留守事，治最，遷山東西路轉運使、工部尚書，改彰德軍節度使。
HCH_009_128_000171	上書言賦稅太重，上問翰林學士張景仁曰：「稅法比近代為輕，而以為重何也？」
HCH_009_128_000172	景仁曰：「今之稅殊輕，若複輕之，國用且不足。」
HCH_009_128_000173	事遂寢。
HCH_009_128_000174	累遷河中尹，致仕，卒。
HCH_009_128_000175	孫德淵，字資深，興中府人也。
HCH_009_128_000176	大定十六年進士，調石州軍事判官、淶水丞，察廉遷沙河令。
HCH_009_128_000177	有盜秋桑者，主逐捕之，盜以叉自刺其足面，曰：「秋桑例不禁采，汝何得刺我？」
HCH_009_128_000178	主懼，賂而求免，盜不從，訴之縣。
HCH_009_128_000179	德淵曰：「若逐捕而傷，瘡必在後，今在前，乃自刺也。」
HCH_009_128_000180	盜遂引服。
HCH_009_128_000181	選尚書省令史，不就。
HCH_009_128_000182	丁父憂去官，民為刻石祠之。
HCH_009_128_000183	察廉，起複北京轉運司都勾判官，以累薦遷中都左警巡使、監察御史、山東東路轉運副使，累官大理丞、兼左拾遺。
HCH_009_128_000184	審官院奏德淵剛正幹能，可任繁劇，遂再任。
HCH_009_128_000185	丁母憂，服除特遷恩州刺史，入為右司郎中，滕州刺史，遷同知河間府事，曆大興治中、同知府事。
HCH_009_128_000186	大安初，遷盤安軍節度使，改河北西路按察轉運使，改昭義軍節度使。
HCH_009_128_000187	潞州破被執，俄有拜於前者，皆沙河舊民也，密護德淵，由是得脫。
HCH_009_128_000188	貞祐二年，拜工部尚書，攝御史中丞。
HCH_009_128_000189	是時，山東乏兵食，有司請鬻恩例舉人，居喪者亦許納錢就試。
HCH_009_128_000190	德淵奏，此大傷名教，事遂寢。
HCH_009_128_000191	尋致仕。
HCH_009_128_000192	監察御史許古論德淵「忠亮明敏，可以大用，近許告老，士大夫竊歎，望朝廷起複，必能建明以利國家。」
HCH_009_128_000193	宣宗嘉納。
HCH_009_128_000194	未及用而卒。
HCH_009_128_000195	趙鑒，字擇善，濟南章丘人。
HCH_009_128_000196	宋建炎二年進士，調廬州司理參軍。
HCH_009_128_000197	是時江、淮方用兵，鑒棄官還鄉里。
HCH_009_128_000198	齊國建，除曆城丞，轉長清令，皆劇邑難治，鑒政甚著。
HCH_009_128_000199	劉豫召見，遷直秘閣、提舉涇原路弓箭手、兼提點本路刑獄公事，誡之曰：「邊將多不法，可痛繩之。」
HCH_009_128_000200	原州守將武悍自用，以鑒年少易之，鑒發其奸，守將坐免，郡縣聞風無敢犯者。
HCH_009_128_000201	齊廢，除知城陽軍，改山東東路轉運副使，攝行台左司郎中。
HCH_009_128_000202	行台宰相欲以故宋宦者權都水監，鑒曰：「誤國閹豎，汴人視為寇仇，付以美官，將失人望。」
HCH_009_128_000203	遂不用。
HCH_009_128_000204	以母憂解職，天德初，起為濟州刺史，移涿州。
HCH_009_128_000205	海陵召鑒入朝，應對失旨，遣還郡，俄除知火山軍，以病免。
HCH_009_128_000206	大定初，起知甯海軍。
HCH_009_128_000207	秋禾方熟，子方蟲生，鑒出城行視，蟲乃自死。
HCH_009_128_000208	再遷鎮西軍節度使，改河北西路轉運使，致仕，卒。
HCH_009_128_000209	蒲察鄭留，字文叔，東京路斡底必剌猛安人。
HCH_009_128_000210	大定二十二年進士，調高苑主薄、浚州司候，補尚書省令史，除鑒察御史，累遷北京、臨潢按察副使、戶部侍郎。
HCH_009_128_000211	御史台奏鄭留前任北京稱職，遷陝西路按察使，改順義軍節度使。
HCH_009_128_000212	西京人李安兄弟爭財，府縣不能決，按察司移鄭留平理。
HCH_009_128_000213	月餘不問，會釋奠孔子廟，鄭留乃引安兄弟與諸生敘齒，列坐會酒，陳說古之友悌數事。
HCH_009_128_000214	安兄弟感悟，謝曰：「節使父母也，誓不復爭。」
HCH_009_128_000215	乃相讓而歸。
HCH_009_128_000216	朔州多盜，鄭留禁絕遊食，多蓄兵器，因行春撫諭之，盜乃衰息，獄空。
HCH_009_128_000217	賜錫宴錢以褒之。
HCH_009_128_000218	改利涉軍節度使。
HCH_009_128_000219	詔括馬，鄭留使百姓飼養以須，御史劾之。
HCH_009_128_000220	既而伐宋，諸語括馬皆瘦，惟隆州馬肥，乃釋鄭留。
HCH_009_128_000221	大安初，徙安國軍。
HCH_009_128_000222	二年，知慶陽府事。
HCH_009_128_000223	三年，夏人犯邊，鄭留擊走之。
HCH_009_128_000224	至甯元年，改知平涼府。
HCH_009_128_000225	是時，平涼新被兵，夏人複來攻，鄭留招潰卒為禦守計，夏兵退，遷官四階。
HCH_009_128_000226	貞祐二年，改東京留守，致仕。
HCH_009_128_000227	貞祐四年，卒。
HCH_009_128_000228	鄭留重厚寡言笑，人不見其喜慍，臨終取奏稿盡焚之。
HCH_009_128_000229	女奚烈守愚，字仲晦，本名胡裏改門，真定府路吾直克猛安人也。
HCH_009_128_000230	六歲知讀書。
HCH_009_128_000231	既齔，或謂食肉昏神識，乃戒而不食。
HCH_009_128_000232	性至孝，父沒時年十五，營葬如禮，治家有法，鄉人稱之。
HCH_009_128_000233	中明昌二年進士。
HCH_009_128_000234	調深澤主簿，治有聲。
HCH_009_128_000235	遷懷仁令，改弘文校理，秩滿為臨沂令。
HCH_009_128_000236	有不逞輩五百人，結為黨社，大擾境內，守愚下車，其黨散去。
HCH_009_128_000237	蝗起莒、密間，獨不入臨沂境。
HCH_009_128_000238	先是，朝廷括河朔、山東地，隱匿者沒入宮。
HCH_009_128_000239	告者給賞。
HCH_009_128_000240	莒州刺史教其奴告臨沂人冒地，積賞錢三百萬，先給官鏹乃征於民，民甚苦之。
HCH_009_128_000241	守愚列其冤狀白州，州不為理，即聞於戶部而征還之，流民歸業，縣人勒其事于石。
HCH_009_128_000242	改秘書郎。
HCH_009_128_000243	母喪，勺飲不入口三日，終喪未嘗至內寢。
HCH_009_128_000244	太常寺、勸農司交辟守愚，皆不聽，服除，除同知登聞檢院，改著作郎、永定軍節度副使。
HCH_009_128_000245	泰和伐宋，守愚為山東行六部員外郎，改大興都總管判官。
HCH_009_128_000246	大安元年，除修起居注，轉刑部員外郎、戶部郎中、太子左諭德。
HCH_009_128_000247	貞祐初，除戶部侍郎，數月拜諫議大夫、提點近侍局。
HCH_009_128_000248	二年，除保大軍節度使，改翰林學士、參議陝西路安撫司事。
HCH_009_128_000249	安撫完顏弼重其為人，每事咨而後行。
HCH_009_128_000250	未幾，有疾，詔賜禦藥。
HCH_009_128_000251	三年，卒。
HCH_009_128_000252	守愚為人忠實無華，孜孜于公，蓋天性然也。
HCH_009_128_000253	石抹元，字希明，懿州路胡土虎猛安人。
HCH_009_128_000254	七歲喪父，號泣不食者數日。
HCH_009_128_000255	十三居母喪如成人。
HCH_009_128_000256	嘗為擊鞠戲，馬踣，歎曰：「生無兄弟，而數乘此險，設有不測，奈何？」
HCH_009_128_000257	由是終身不復為之。
HCH_009_128_000258	補樞密院尚書省譯史，調同知恩州軍州事，遷監察御史，為同知淄州軍州事。
HCH_009_128_000259	劇盜劉奇久為民患，一日捕獲，方訊鞫，聞赦將至，亟命杖殺之，闔郡稱快。
HCH_009_128_000260	改大興府判官，沂王府司馬、沁南軍節度副使。
HCH_009_128_000261	河內民家有多美橙者，歲獲厚利。
HCH_009_128_000262	仇家夜入殘毀之，主人捕得，乃以劫財誣其人，仇家引服，贓不可得。
HCH_009_128_000263	元攝州事，究得其情。
HCH_009_128_000264	尋改河北西路轉運副使，累遷山東西路按察轉運使。
HCH_009_128_000265	貞祐初，黃摑吾典徵兵東平，擁眾不進，大括民財，眾皆忿怨。
HCH_009_128_000266	副統僕散掃合殺吾典於坐，取其符佩之，縱恣尤甚。
HCH_009_128_000267	元密疏劾掃合擅殺近臣，無上不道，掃合坐誅。
HCH_009_128_000268	移知濟南府，到官六月卒。
HCH_009_128_000269	元生平寡言笑，尚節儉，居官自守，不交權要，人以是稱之。
HCH_009_128_000270	張彀，字伯英，許州臨潁人。
HCH_009_128_000271	大定二十八年進士，調甯陵縣主簿。
HCH_009_128_000272	改泰定軍節度判官。
HCH_009_128_000273	率儒士行鄉飲酒禮。
HCH_009_128_000274	改同州觀察判官。
HCH_009_128_000275	是時，出兵備邊，州征箭十萬，限以雕雁羽為之，其價翔躍不可得。
HCH_009_128_000276	彀曰：「矢去物也，何羽不可。」
HCH_009_128_000277	節度使曰：「當須省報。」
HCH_009_128_000278	彀曰：「州距京師二千里，如民急何。萬一有責，下官身任其咎。」
HCH_009_128_000279	一日之間，價減數倍。
HCH_009_128_000280	尚書省竟如所請。
HCH_009_128_000281	補尚書省令史，除同知鄭州防禦使事，改北京鹽使。
HCH_009_128_000282	丁父憂，服除，再遷監察御史。
HCH_009_128_000283	從伐宋，遷武寧軍節度副使。
HCH_009_128_000284	居母憂。
HCH_009_128_000285	貞祐二年，改惠民司令，曆河南治中、顯州刺史、刑部郎中、同知河南府事，遷河東南路轉運使、權行六部尚書，安撫使。
HCH_009_128_000286	興定元年，以疾卒。
HCH_009_128_000287	彀天性孝友，任子悉先諸弟，俸入所得亦委其弟掌之，未嘗問有無雲。
HCH_009_128_000288	趙重福，字履祥，豐州人。
HCH_009_128_000289	通女直大小字，試補女直誥院令史。
HCH_009_128_000290	轉兵部譯史、陝西提刑知法，遷陝西東路都勾判官、右藏庫副使、同知陳州防禦事。
HCH_009_128_000291	宋諜人蘇泉入河南，重福跡之，至魚台將渡河，見前一舟且渡，令從者大呼泉姓名，前舟中忽有蒼惶失措者，執之果泉也。
HCH_009_128_000292	改滄州鹽副使。
HCH_009_128_000293	歲饑，民煮鹵為鹽賣以給食，鹽官往往杖殺之。
HCH_009_128_000294	重福曰：「寧使課殿，不忍殺人。」
HCH_009_128_000295	歲滿，課殿當降，尚書右丞完顏匡、三司使按出虎知其事，乃以歲荒薄其罰，除織染署令。
HCH_009_128_000296	大安三年，佐戶部尚書張煒調兵食于古北口，遷都水少監，行西北路六部郎中，治密雲縣，俄兼戶部員外郎。
HCH_009_128_000297	貞祐二年，以守密雲功遷同知河間府事，行六部侍郎，權清州防禦使，攝河北東路兵馬都總管。
HCH_009_128_000298	三年，河間被圍，有劉中者嘗與重福密雲聯事，勸重福出降，重福不聽。
HCH_009_128_000299	是時，河間兵少，多羸疾不任戰，欲亡去。
HCH_009_128_000300	重福勸其父老率其子弟，強者戰、弱者守，會久雨圍乃解去。
HCH_009_128_000301	遷河東北路轉運使，致仕。
HCH_009_128_000302	元光二年，卒。
