HCH_012_150_000001	郁新趙羾金忠李慶師逵古樸陳壽劉季篪劉辰楊砥虞謙湯宗郁新，字敦本，臨淮人。
HCH_012_150_000002	洪武中，以人才征，授戶部度支主事。
HCH_012_150_000003	遷郎中。
HCH_012_150_000004	逾年，擢本部右侍郎。
HCH_012_150_000005	嘗問天下戶口田賦，地理險易，應答無遺，帝稱其才。
HCH_012_150_000006	尋進尚書。
HCH_012_150_000007	時親王歲祿米五萬石，新定議減五之四，並定郡王以下祿有差。
HCH_012_150_000008	又以邊餉不繼，定召商開中法，令商輸粟塞下，按引支鹽，邊儲以足。
HCH_012_150_000009	夏原吉為戶部主事，新重之，諸曹事悉委任焉。
HCH_012_150_000010	建文二年引疾歸。
HCH_012_150_000011	成祖即位，召掌戶部事，以古樸為侍郎佐之。
HCH_012_150_000012	永樂元年，河南蝗，有司不以聞，新劾治之。
HCH_012_150_000013	初，轉漕北京，新言：「自淮抵河，多淺灘跌坡，運舟艱阻。請別用淺船載三百石者，自淮河、沙河運至陳州潁溪口跌坡下，復用淺船載二百石者運至跌坡上，別用大船運入黃河。至八柳樹諸處，令河南車夫陸運入衛河，轉輸北京。」
HCH_012_150_000014	從之。
HCH_012_150_000015	又言：「湖廣屯田所產不一，請皆得輸官。粟谷、縻黍、大麥、蕎穄二石，準米一石。稻谷、秫二石五鬥，穇稗三石，各準米一石。豆、麥、芝麻與米等。」
HCH_012_150_000016	著為令。
HCH_012_150_000017	二年，議公、侯、伯、駙馬、儀賓祿，二百石以上者，請如文武官例，米鈔兼給。
HCH_012_150_000018	三年，以士卒勞困，議減屯田歲收不如額者十之四五，又議改納米北京贖罪者於南京倉。
HCH_012_150_000019	皆允行。
HCH_012_150_000020	是年八月卒於官。
HCH_012_150_000021	帝嘆曰：「新理邦賦十三年，量計出入，今誰可代者？」
HCH_012_150_000022	輟朝一日，賜葬祭，而召夏原吉還理部事。
HCH_012_150_000023	新長於綜理，密而不繁。
HCH_012_150_000024	其所規畫，後不能易。
HCH_012_150_000025	趙羾，字雲翰，夏人，徙祥符。
HCH_012_150_000026	洪武中，由鄉舉入太學，授兵部職方司主事。
HCH_012_150_000027	圖天下要害厄塞，並屯戍所宜以進。
HCH_012_150_000028	帝以為才，遷員外郎。
HCH_012_150_000029	建文初，遷浙江參政，建策捕海寇，有功。
HCH_012_150_000030	永樂二年，使交阯，還奏稱旨。
HCH_012_150_000031	擢刑部侍郎，改工部，再改禮部。
HCH_012_150_000032	五年進尚書，賜宴華蓋殿，撤膳羞遺其母。
HCH_012_150_000033	初，羾每以事為言者所劾，帝不問。
HCH_012_150_000034	九年秋，朝鮮使臣將歸，例有賜賚，羾不以奏。
HCH_012_150_000035	帝怒曰：「是且使朕失遠人心。」
HCH_012_150_000036	遂下之獄。
HCH_012_150_000037	尋得釋，使督建隆慶、保安、永寧諸州縣，撫綏新集，民安其業。
HCH_012_150_000038	十五年丁母艱。
HCH_012_150_000039	起復，改兵部尚書，專理塞外兵事。
HCH_012_150_000040	帝北征，轉餉有方。
HCH_012_150_000041	仁宗嗣位，改南京刑部。
HCH_012_150_000042	宣德五年，御史張楷劾羾及侍郎俞士吉怠縱。
HCH_012_150_000043	召至，命致仕。
HCH_012_150_000044	羾性精敏，歷事五朝，位列卿，自奉如寒素。
HCH_012_150_000045	正統元年卒，年七十三。
HCH_012_150_000046	金忠，鄞人。
HCH_012_150_000047	少讀書，善《易》卜。
HCH_012_150_000048	兄戍通州亡，忠補戍。
HCH_012_150_000049	貧不能行，相者袁珙資之。
HCH_012_150_000050	既至，編卒伍。
HCH_012_150_000051	賣卜北平市，多中。
HCH_012_150_000052	市人傳以為神。
HCH_012_150_000053	僧道衍稱於成祖。
HCH_012_150_000054	成祖將起兵，托疾召忠卜，得鑄印乘軒之卦。
HCH_012_150_000055	曰：「此象貴不可言。」
HCH_012_150_000056	自是出入燕府中，常以所占勸舉大事。
HCH_012_150_000057	成祖深信之。
HCH_012_150_000058	燕兵起，自署官屬，授忠王府紀善，守通州。
HCH_012_150_000059	南兵數攻城不克。
HCH_012_150_000060	已，召置左右，有疑輒問，術益驗，且時進謀畫。
HCH_012_150_000061	遂拜右長史，贊戎務，為謀臣矣。
HCH_012_150_000062	成祖稱帝，論佐命功，擢工部右侍郎，贊世子守北京。
HCH_012_150_000063	尋召還，進兵部尚書。
HCH_012_150_000064	帝起兵時，次子高煦從戰有功，許以為太子。
HCH_012_150_000065	至是，淇國公邱福等黨高煦，勸帝立之。
HCH_012_150_000066	獨忠以為不可，在帝前歷數古嫡孽事。
HCH_012_150_000067	帝不能奪，密以告解縉、黃淮、尹昌隆。
HCH_012_150_000068	縉等皆以忠言為是。
HCH_012_150_000069	於是立世子為皇太子，而忠為東宮輔導官，以兵部尚書兼詹事府詹事。
HCH_012_150_000070	六年命兼輔皇太孫。
HCH_012_150_000071	帝北征，留忠與蹇義、黃淮、楊士奇輔太子監國。
HCH_012_150_000072	是時高煦奪嫡謀愈急，蜚語譖太子。
HCH_012_150_000073	十二年北征還，悉征東宮官屬下獄。
HCH_012_150_000074	以忠勛舊不問，而密令審察太子事。
HCH_012_150_000075	忠言無有。
HCH_012_150_000076	帝怒。
HCH_012_150_000077	忠免冠頓首流涕，願連坐以保之。
HCH_012_150_000078	以故太子得無廢，而宮僚黃淮、楊溥等亦以是獲全。
HCH_012_150_000079	忠起卒伍至大位，甚見親倚，每承顧問，知無不言，然慎密不泄。
HCH_012_150_000080	處僚友不持兩端，退恒推讓之。
HCH_012_150_000081	明年四月卒。
HCH_012_150_000082	給驛歸葬，命有司治祠墓，復其家。
HCH_012_150_000083	洪熙元年，追贈榮祿大夫少師，謚忠襄。
HCH_012_150_000084	官子達翰林檢討。
HCH_012_150_000085	達剛直敢言，仕至長蘆都轉運使。
HCH_012_150_000086	忠有兄華，負誌節。
HCH_012_150_000087	忠守通州有功，欲推恩官之，辭不就。
HCH_012_150_000088	嘗召賜金綺，亦不受。
HCH_012_150_000089	成祖目為迂叟，放還。
HCH_012_150_000090	一日，讀《宋史》至王倫附秦檜事，放聲長嘆而逝。
HCH_012_150_000091	里中稱為「白雲先生」。
HCH_012_150_000092	李慶，字德孚，順義人。
HCH_012_150_000093	洪武中，以國子生署右僉都御史，後授刑部員外郎，遷紹興知府。
HCH_012_150_000094	永樂元年召為刑部侍郎。
HCH_012_150_000095	性剛果，有幹局，馭下甚嚴。
HCH_012_150_000096	帝以為才，數命治他事，不得時至部。
HCH_012_150_000097	然屬吏與罪人交通私饋餉，慶輒知之，繩以重法。
HCH_012_150_000098	五年，改左副都御史。
HCH_012_150_000099	兩遭親喪，並起復。
HCH_012_150_000100	時勛貴武臣多令子弟家人行商中鹽，為官民害。
HCH_012_150_000101	慶言：「舊制，四品以上官員家不得與民爭利。今都督蔡福等既行罰，公侯有犯，亦乞按問。」
HCH_012_150_000102	帝命嚴禁如制。
HCH_012_150_000103	忻成伯趙彜擅殺運夫，盜賣軍餉。
HCH_012_150_000104	都督譚青、朱崇貪縱。
HCH_012_150_000105	慶劾之，皆下吏。
HCH_012_150_000106	已，劾都督費瓛欺罔、梁銘貪暴、鎮守德州都督曹得黷貨。
HCH_012_150_000107	皆被責。
HCH_012_150_000108	中外凜其風采。
HCH_012_150_000109	十八年進工部尚書，尋兼領兵部事。
HCH_012_150_000110	仁宗立，改兵部，加太子少保。
HCH_012_150_000111	弋謙以言事忤旨，呂震等交口詆之，惟慶與夏原吉無所言。
HCH_012_150_000112	帝尋悟，降敕自責，並責震等，震等甚愧此兩人。
HCH_012_150_000113	山陵事多，趣辦中官有求，執不與，人多嚴憚之，號為「生李」。
HCH_012_150_000114	奉命侍皇太子謁孝陵，在途約束將士，秋毫無所擾。
HCH_012_150_000115	太子欲獵，慶諫止。
HCH_012_150_000116	及太子還北京，遂留慶南京兵部。
HCH_012_150_000117	宣德二年，安遠侯柳升討黎利，命慶參贊軍務，許擇部曹賢能者自隨。
HCH_012_150_000118	師至鎮夷關，升意輕賊，不為備。
HCH_012_150_000119	郎中史安、主事陳鏞言於慶。
HCH_012_150_000120	時慶已病甚，強起告升。
HCH_012_150_000121	升不聽，直前，中伏敗死。
HCH_012_150_000122	慶病遂篤，明日亦死，一軍盡沒。
HCH_012_150_000123	師逵，字九達，東阿人。
HCH_012_150_000124	少孤，事母至孝。
HCH_012_150_000125	年十三，母疾，思藤花菜。
HCH_012_150_000126	逵出城南二十餘里求得之。
HCH_012_150_000127	及歸，夜二鼓，遇虎。
HCH_012_150_000128	逵驚呼天，虎舍之去。
HCH_012_150_000129	母疾尋愈。
HCH_012_150_000130	洪武中，以國子生從御史出按事，為御史所劾，逮至。
HCH_012_150_000131	帝偉其貌，釋之，謫御史臺書案牘。
HCH_012_150_000132	久之，擢御史，遷陜西按察使。
HCH_012_150_000133	獄囚淹系千人，浹旬盡決遣，悉當其罪。
HCH_012_150_000134	母憂去官，廬墓側，不飲酒食肉者三年。
HCH_012_150_000135	成祖即位，召為兵部侍郎，改吏部。
HCH_012_150_000136	永樂四年建北京宮殿，分遣大臣出采木。
HCH_012_150_000137	逵往湖、湘，以十萬眾入山辟道路，召商賈，軍役得貿易，事以辦。
HCH_012_150_000138	然頗嚴刻，民不堪，多從李法良為亂。
HCH_012_150_000139	左中允周幹劾之。
HCH_012_150_000140	時仁宗監國，以帝所特遣，置不問。
HCH_012_150_000141	八年，帝北征，命總督饋餉，逵請量程置頓堡，更遞轉輸。
HCH_012_150_000142	從之。
HCH_012_150_000143	逵佐蹇義在吏部二十年，人不敢幹以私。
HCH_012_150_000144	仁宗嗣位，與趙羾、古樸皆改官南京，而逵進戶部尚書，兼掌吏部。
HCH_012_150_000145	宣德二年正月卒官，年六十二。
HCH_012_150_000146	逵廉，不殖生產，祿賜皆分宗黨。
HCH_012_150_000147	有子八人，至無以自贍。
HCH_012_150_000148	成祖在北京嘗語左右曰：「六部扈從臣，不貪者惟逵而已。」
HCH_012_150_000149	古樸，字文質，陳州人。
HCH_012_150_000150	洪武中以太學生清理郡縣田賦圖籍，還隸五軍斷事理刑。
HCH_012_150_000151	自陳家貧，願得祿養母。
HCH_012_150_000152	帝嘉之，除工部主事。
HCH_012_150_000153	母歿，官給舟歸葬。
HCH_012_150_000154	服闋，改兵部，累遷郎中。
HCH_012_150_000155	建文三年擢兵部侍郎。
HCH_012_150_000156	成祖即位，改戶部。
HCH_012_150_000157	永樂二年，樸奏：「先奉詔令江西、湖廣及蘇、松諸府輸糧北京，今聞並患水潦，轉運艱難，而北京諸郡歲幸豐。宜發鈔命有司增價收糴，減南方運。」
HCH_012_150_000158	從之。
HCH_012_150_000159	營建北京，命采木江西，以恤民見褒。
HCH_012_150_000160	七年，帝北巡，皇太子監國。
HCH_012_150_000161	召還，佐夏原吉理戶部。
HCH_012_150_000162	仁宗即位，改南京通政使。
HCH_012_150_000163	明年就拜戶部尚書，出督畿內田賦。
HCH_012_150_000164	師逵病，命樸代之。
HCH_012_150_000165	宣德三年二月卒於官。
HCH_012_150_000166	初，戶部主事劉良不檢，乞中貴人求上考。
HCH_012_150_000167	樸不可。
HCH_012_150_000168	良遂誣奏樸罪，樸就逮。
HCH_012_150_000169	成祖察其誣，得釋。
HCH_012_150_000170	他日，吏部奏予良誥。
HCH_012_150_000171	仁宗曰：「此人素無行，且嘗誣大臣，不可與。」
HCH_012_150_000172	良後果以贓敗。
HCH_012_150_000173	樸在朝三十餘年，自郎署至尚書，確然有守，不通幹請，與右都御史向寶，俱以清介稱。
HCH_012_150_000174	寶，字克忠，進賢人。
HCH_012_150_000175	洪武中，以進士授兵部員外郎。
HCH_012_150_000176	九年無過，擢通政使，以不善奏對力辭，改應天府尹。
HCH_012_150_000177	建文時，坐事謫廣西。
HCH_012_150_000178	成祖即位，召復職。
HCH_012_150_000179	已，復坐事下獄，降兩浙鹽運判官。
HCH_012_150_000180	仁宗在東宮，知其廉。
HCH_012_150_000181	及即位，召為右都御史兼詹事，並給兩俸。
HCH_012_150_000182	尋應詔陳八事，多可采者。
HCH_012_150_000183	宣德初，改南京。
HCH_012_150_000184	三年入覲，帝憫其老，命致仕。
HCH_012_150_000185	歸，卒於途。
HCH_012_150_000186	寶有文學，寬厚愛民，而持身廉直，屢遭困厄不稍易，平居言不及利。
HCH_012_150_000187	歷仕四十餘年，卒之日，家具蕭然。
HCH_012_150_000188	陳壽，隨人。
HCH_012_150_000189	洪武中，由國子生授戶部主事。
HCH_012_150_000190	永樂元年遷員外郎。
HCH_012_150_000191	出為山東參政，所至以愛民為務。
HCH_012_150_000192	用夏原吉薦，召為工部左侍郎。
HCH_012_150_000193	皇太子監國南京，壽日陳兵民困，又乘間言左右幹恩澤者多，恐累明德。
HCH_012_150_000194	太子深納之。
HCH_012_150_000195	嘗目送之出，顧侍臣曰：「侍郎中第一人也。」
HCH_012_150_000196	九年以漢王高煦譖，下獄，貧不能給朝夕。
HCH_012_150_000197	官屬有饋之者，拒不受，竟死獄中。
HCH_012_150_000198	逾年，啟殯如生。
HCH_012_150_000199	仁宗即位，贈工部尚書，謚敏肅，官其子常中書舍人，後亦至工部侍郎。
HCH_012_150_000200	與壽同下獄死者，有馬京、許思溫。
HCH_012_150_000201	京，武功人。
HCH_012_150_000202	洪武中，以進士授翰林編修，歷左通政、大理卿。
HCH_012_150_000203	永樂元年為行部左侍郎。
HCH_012_150_000204	皇太子守北京，命兼輔導，盡誠翊贊，太子甚重之。
HCH_012_150_000205	數為高煦所譖，謫戍廣西，仍坐前事，逮下獄。
HCH_012_150_000206	思溫，字叔雍，吳人。
HCH_012_150_000207	以國子生署刑部主事，累官北平按察副使。
HCH_012_150_000208	燕師起，思溫佐城守有勞，擢刑部侍郎，改吏部，兼贊善。
HCH_012_150_000209	亦以讒下獄。
HCH_012_150_000210	皆瘐死。
HCH_012_150_000211	仁宗立，贈京少傅，謚文簡；思溫吏部尚書，官其子俊贊禮郎，進學翰林。
HCH_012_150_000212	劉季篪，名韶，以字行，余姚人。
HCH_012_150_000213	洪武中進士。
HCH_012_150_000214	除行人。
HCH_012_150_000215	使朝鮮，卻其饋贐。
HCH_012_150_000216	帝聞，賜衣鈔，擢陜西參政。
HCH_012_150_000217	陜有逋賦，有司峻刑督，民不能輸。
HCH_012_150_000218	季篪至，與其僚分行郡縣，悉縱械者，緩為期。
HCH_012_150_000219	民感其德，悉完納。
HCH_012_150_000220	陜不產碙砂，而歲有課。
HCH_012_150_000221	季篪言於朝，罷之。
HCH_012_150_000222	洪渠水溢，為治堰蓄泄，遂為永利。
HCH_012_150_000223	建文中，召為刑部侍郎。
HCH_012_150_000224	民有為盜所引者，逮至，盜已死，乃召盜妻子使識之。
HCH_012_150_000225	聽其辭，誣也，釋之。
HCH_012_150_000226	吏虧官錢，誣千餘人，悉為辨免。
HCH_012_150_000227	河陽逆旅朱、趙二人異室寢。
HCH_012_150_000228	趙被殺，有司疑朱殺之，考掠誣服。
HCH_012_150_000229	季篪獨曰：「是非夙仇，且其裝無可利。」
HCH_012_150_000230	緩其獄，竟得殺趙者。
HCH_012_150_000231	揚州民家，盜夜入殺人，遺刀屍傍，刀有記識，其鄰家也。
HCH_012_150_000232	官捕鞫之。
HCH_012_150_000233	鄰曰：「失此刀久矣。」
HCH_012_150_000234	不勝掠，誣服。
HCH_012_150_000235	季篪使人懷刀就其裏潛察之。
HCH_012_150_000236	一童子識曰：「此吾家物。」
HCH_012_150_000237	盜乃得。
HCH_012_150_000238	永樂初，纂修《大典》，命姚廣孝、解縉及季篪總其事。
HCH_012_150_000239	八年坐失出下獄，謫外任。
HCH_012_150_000240	逡巡未行，復下獄。
HCH_012_150_000241	久之始釋。
HCH_012_150_000242	命以儒服隸翰林院編纂。
HCH_012_150_000243	尋授工部主事，卒於官。
HCH_012_150_000244	劉辰，字伯靜，金華人。
HCH_012_150_000245	國初，以署典簽使方國珍。
HCH_012_150_000246	國珍飾二姬以進，叱卻之。
HCH_012_150_000247	李文忠駐師嚴州，辟置幕下。
HCH_012_150_000248	元帥葛俊守廣信，盛冬發民浚城濠。
HCH_012_150_000249	文忠止之。
HCH_012_150_000250	不聽。
HCH_012_150_000251	文忠怒，欲臨以兵。
HCH_012_150_000252	辰請往諭之。
HCH_012_150_000253	俊悔謝，事遂已。
HCH_012_150_000254	以親老辭歸。
HCH_012_150_000255	建文中，用薦擢監察御史，出知鎮江府，勤於職事。
HCH_012_150_000256	瀕江田八十餘頃，久淪於水，賦如故，以辰言得除。
HCH_012_150_000257	京口閘廢，轉漕者道新河出江，舟數敗。
HCH_012_150_000258	辰修故閘，公私皆便。
HCH_012_150_000259	漕河易涸，仰練湖益水，三鬥門久廢。
HCH_012_150_000260	辰修築之，運舟既通，湖下田益稔。
HCH_012_150_000261	永樂初，李景隆言辰知國初事，召至，預修《太祖實錄》。
HCH_012_150_000262	遷江西布政司參政，奏蠲九郡荒田糧。
HCH_012_150_000263	歲饑，勸富民貸饑者，蠲其徭役以為之息。
HCH_012_150_000264	官為立券，期年而償。
HCH_012_150_000265	辰居官廉勤尚氣，與都司、按察使不相得，數爭，坐免官。
HCH_012_150_000266	十四年起行部左侍郎，復留南京者三年。
HCH_012_150_000267	帝念其老，賜敕及鈔幣，今致仕。
HCH_012_150_000268	卒於途，年七十八。
HCH_012_150_000269	楊砥，字大用，澤州人。
HCH_012_150_000270	洪武末，由進士授行人司右司副。
HCH_012_150_000271	上疏言：「揚雄為莽大夫，貽譏萬世。董仲舒《天人三策》及正誼明道之言，足以扶翼世教。今孔廟從祀有雄無仲舒，非是。」
HCH_012_150_000272	帝從之。
HCH_012_150_000273	歷官湖廣布政司參議。
HCH_012_150_000274	建文中，言：「帝堯之德始於親九族。今宜惇睦諸藩，無自剪枝葉。」
HCH_012_150_000275	不報。
HCH_012_150_000276	父喪歸。
HCH_012_150_000277	成祖即位，起鴻臚寺卿，乞終制。
HCH_012_150_000278	服闋，擢禮部侍郎，坐視河渠失職，降工部主事，改禮部。
HCH_012_150_000279	永樂十年遷北京行太僕寺卿。
HCH_012_150_000280	時吳橋至天津大水決堤傷稼。
HCH_012_150_000281	砥請開德州東南黃河故道及土河，以殺水勢。
HCH_012_150_000282	帝命工部侍郎藺芳經理之。
HCH_012_150_000283	定牧馬法，請令民五丁養種馬一匹，十馬立群頭一人，五十馬立群長一人，養馬家歲蠲租糧之半。
HCH_012_150_000284	而薊州以東至山海諸衛，土地寬廣，水草豐美，其屯軍人養種馬一匹，租亦免半。
HCH_012_150_000285	帝命軍租盡蠲之，余悉從其議。
HCH_012_150_000286	於是馬大蕃息。
HCH_012_150_000287	砥剛介有守，尤篤孝行。
HCH_012_150_000288	十六年，母喪哀毀，未至家，卒。
HCH_012_150_000289	虞謙，字伯益，金壇人。
HCH_012_150_000290	洪武中，由國子生擢刑部郎中，出知杭州府。
HCH_012_150_000291	建文中請限僧道田，人無過十畝，余以均給貧民。
HCH_012_150_000292	從之。
HCH_012_150_000293	永樂初召為大理寺少卿。
HCH_012_150_000294	時有詔。
HCH_012_150_000295	建文中，上言改舊制者悉面陳。
HCH_012_150_000296	謙乃言前事請罪。
HCH_012_150_000297	帝見謙怖，笑曰：「此秀才辟老、佛耳。」
HCH_012_150_000298	釋弗問。
HCH_012_150_000299	而僧道限田制竟罷。
HCH_012_150_000300	都察院論誆騙罪，準洪武榜例梟首以徇。
HCH_012_150_000301	謙奏：「比奉詔準律斷罪，誆騙當杖流，梟首非詔書意。」
HCH_012_150_000302	帝從之。
HCH_012_150_000303	天津衛倉災，焚糧數十萬石。
HCH_012_150_000304	御史言主者盜用多，縱火自蓋。
HCH_012_150_000305	逮幾八百人，應死者百。
HCH_012_150_000306	謙白其濫，得論減。
HCH_012_150_000307	七年，帝北巡，皇太子奏謙為右副都御史。
HCH_012_150_000308	明年，偕給事中杜欽巡視淮、鳳抵陳州災傷，免田租，贖民所鬻子女。
HCH_012_150_000309	明年，謙請振，太子諭之曰：「軍民困極，而卿等從容請啟，彼汲黯何如人也。」
HCH_012_150_000310	尋命督兩浙、蘇、松諸府糧，輸南、北京及徐州、淮安。
HCH_012_150_000311	富民賂有司，率得近地，而貧民多遠運。
HCH_012_150_000312	謙建議分四等：丁多糧最少者運北京，次少者運徐州，丁糧等者運南京、淮安，丁少糧多者存留本土。
HCH_012_150_000313	民利賴之。
HCH_012_150_000314	又言：徐州、呂梁二洪，行舟多阻。
HCH_012_150_000315	請每洪增挽夫二百，月給廩；官牛一百，暇時聽民耕，大舟至，用以挽。
HCH_012_150_000316	人以為便。
HCH_012_150_000317	嘗督運木，役者大疫。
HCH_012_150_000318	謙令散處之，疫遂息。
HCH_012_150_000319	未幾，偕給事中許能巡撫浙江。
HCH_012_150_000320	仁宗即位，召還，改大理寺卿。
HCH_012_150_000321	時呂升為少卿，仰瞻為丞，而謙又薦嚴本為寺正。
HCH_012_150_000322	帝方矜慎刑獄，謙等亦悉心奏當。
HCH_012_150_000323	凡法司及四方所上獄，謙等再四參復，必求其平。
HCH_012_150_000324	嘗語人曰：「彼無憾，斯我無憾矣。」
HCH_012_150_000325	嘗應詔上言七事，皆切中時務。
HCH_012_150_000326	有言其奏事不密，市恩於外者。
HCH_012_150_000327	帝怒，降少卿。
HCH_012_150_000328	一日，楊士奇奏事畢，不退。
HCH_012_150_000329	帝問：「欲何言，得非為虞謙乎？」
HCH_012_150_000330	士奇因具白其誣，且言謙歷事三朝，得大臣體。
HCH_012_150_000331	帝曰：「吾亦悔之。」
HCH_012_150_000332	遂命復職。
HCH_012_150_000333	宣宗立，謙言：「舊制，犯死罪者，罰役終身。今所犯不等，宜依輕重分年限。」
HCH_012_150_000334	報可。
HCH_012_150_000335	宣德二年三月卒於官。
HCH_012_150_000336	謙美儀觀，風采凝重。
HCH_012_150_000337	工詩畫，自負才望。
HCH_012_150_000338	工部侍郎蘇瓚以鄙猥班謙上，恒怏怏，人以是隘其量雲。
HCH_012_150_000339	呂升，山陰人。
HCH_012_150_000340	永樂初為溧陽教諭，歷官江西、福建按察僉事，所至有清慎聲。
HCH_012_150_000341	入為大理寺少卿。
HCH_012_150_000342	宣德八年致仕卒。
HCH_012_150_000343	仰瞻，長洲人。
HCH_012_150_000344	永樂中由虎賁衛經歷遷大理寺丞。
HCH_012_150_000345	正統間，宦官王振用事，百官多奔走其門，惟瞻與大理卿薛瑄不往。
HCH_012_150_000346	會與瑄辨殺夫冤獄，益忤振，下獄，謫戍大同。
HCH_012_150_000347	景泰初，召為右寺丞，執法愈堅，在位者多不悅。
HCH_012_150_000348	移疾歸，加大理少卿。
HCH_012_150_000349	嚴本，字誌道，江陰人。
HCH_012_150_000350	少通群籍，習法律，以傅霖《刑統賦》辭約義博，註者非一，乃著《輯義》四卷。
HCH_012_150_000351	永樂十一年以薦征，試以疑律，敷析明暢。
HCH_012_150_000352	授刑部主事。
HCH_012_150_000353	侍郎張本掌部事，官吏少當意者，獨重本，疑獄輒俾訊之。
HCH_012_150_000354	奉命使徽州，時督辦後期，例罰工，本不忍迫民。
HCH_012_150_000355	或以為言，本曰：「吾辦矣。」
HCH_012_150_000356	蓋已寓書其子，鬻田為工作償也。
HCH_012_150_000357	仁宗立，以刑部尚書金純及虞謙薦，改大理寺正。
HCH_012_150_000358	斷獄者多以「知情故縱」及「大不敬」論罪。
HCH_012_150_000359	本爭之曰：「律自叛逆數條外，無『故縱』之文。即『不敬』，情有重輕，豈可概入重比？」
HCH_012_150_000360	謙韙之，悉為駁正。
HCH_012_150_000361	良鄉民失馬，疑其鄰，告於丞，拷死。
HCH_012_150_000362	丞坐決罰不如法，當徒，而告者坐絞。
HCH_012_150_000363	本曰：「丞罪當。告者因疑而訴，律以誣告致死，是丞與告者各殺一人，可乎？」
HCH_012_150_000364	駁正之。
HCH_012_150_000365	莒縣屯卒奪民田，民訟於官，卒被笞。
HCH_012_150_000366	夜盜民驢，民搜得之。
HCH_012_150_000367	卒反以為誣，擒送千戶，民被禁死。
HCH_012_150_000368	法司坐千戶徒。
HCH_012_150_000369	本曰：「千戶生，則死者冤矣。」
HCH_012_150_000370	遂正其故勘罪。
HCH_012_150_000371	蘇州衛卒十餘人夜劫客舟於河西務，一卒死。
HCH_012_150_000372	懼事覺，誣鄰舟解囚人為盜，其侶往救見殺。
HCH_012_150_000373	皆誣服。
HCH_012_150_000374	本疑之曰：「解人與囚同舟。為盜，囚必知之。」
HCH_012_150_000375	按驗，果得實，遂抵卒罪。
HCH_012_150_000376	本立身方嚴，非禮弗履。
HCH_012_150_000377	其使徽也，知府饋酒肴亦不受。
HCH_012_150_000378	年七十八卒。
HCH_012_150_000379	湯宗，字正傳，浙江平陽人。
HCH_012_150_000380	洪武末，由太學生擢河南按察僉事，改北平。
HCH_012_150_000381	建文時上變，言按察使陳瑛受燕邸金錢，有異謀。
HCH_012_150_000382	詔逮瑛，安置廣西，而遷宗山東按察使。
HCH_012_150_000383	坐事，左遷刑部郎中，出知蘇州府。
HCH_012_150_000384	蘇連歲水，民流，逋租百餘萬石。
HCH_012_150_000385	宗諭富民出米代輸。
HCH_012_150_000386	富民知其愛民，不三月悉完納。
HCH_012_150_000387	永樂元年，有言其坐視水患者，逮下獄，謫判祿州。
