HCH_012_150_000388	以黃淮薦，召為大理寺丞。
HCH_012_150_000389	或言宗曾發潛邸事。
HCH_012_150_000390	帝曰：「帝王惟才是使，何論舊嫌。」
HCH_012_150_000391	時外國貢使病死，從人謂醫殺之。
HCH_012_150_000392	獄具，宗閱牘嘆曰：「醫與使者何仇，而故殺之乎？」
HCH_012_150_000393	卒辨出之。
HCH_012_150_000394	尋命振饑河南，還署戶部事。
HCH_012_150_000395	解縉下獄，詞連宗，坐系十餘年。
HCH_012_150_000396	仁宗立，復官，再遷南京大理卿。
HCH_012_150_000397	宣宗初，清軍山東。
HCH_012_150_000398	會天久不雨，極陳民間饑困狀。
HCH_012_150_000399	帝為蠲租免役，罷不急之務。
HCH_012_150_000400	宣德二年卒。
HCH_012_150_000401	贊曰：永、宣之際，嚴飭吏治，職事修舉。
HCH_012_150_000402	若郁新之理賦，楊砥之馬政，劉季篪、虞謙之治獄，可謂能其官矣。
HCH_012_150_000403	李慶、師逵諸人，清介有執，皆列卿之良也。
HCH_012_150_000404	陳壽、馬京遭讒早廢，惜乎未竟其用。
HCH_012_150_000405	金忠奮身卒伍，進自藝術末流，而有士君子之行。
HCH_012_150_000406	當其侃侃持論於文皇父子間，忠直不撓，卒以誠信悟主，豈不偉哉。
