HCH_012_108_000000	古恩澤封有三，曰外戚，曰中官，曰嬖倖。
HCH_012_108_000001	明興，追崇外氏，廟貌之隆，爵超五等，而苗裔無攷，未及授官。
HCH_012_108_000002	高后外家不奉朝請，家法之嚴有自來矣。
HCH_012_108_000003	自文皇后而外，率由儒族單門，入儷宸極。
HCH_012_108_000004	后父初秩不過指揮，侯伯保傅以漸而進。
HCH_012_108_000005	優者厚田宅，列僮奴。
HCH_012_108_000006	雖擁侈富之資，曾無憑藉之勢，制防之微意寓焉。
HCH_012_108_000007	肅宗申明功令，裁抑世封，戚畹周親不得與汗馬餘勳為齒。
HCH_012_108_000008	雖稱肺腑，事劣封君。
HCH_012_108_000009	上視漢、唐，殆相懸絕。
HCH_012_108_000010	茲考實錄所載封襲歲月，備列為表，以別於元功之次。
HCH_012_108_000011	他若宦官子弟濫列金貂，方士義兒均從班爵，騁文成之丕誕，踵養子之傾輈，亂政亟行，若循一軌，各依年次，備著於篇，亦班固表外戚，譜張釋、欒大之例也。
