HCH_012_201_000001	陶琰王縝李充嗣吳廷舉方良永王爌王軏徐問張邦奇韓邦奇周金吳嶽陶琰，字廷信，絳州人。
HCH_012_201_000002	父銓，進士，陜西右參議。
HCH_012_201_000003	琰舉成化七年鄉試第一，十七年成進士，授刑部主事。
HCH_012_201_000004	弘治初，進員外郎。
HCH_012_201_000005	歷固原兵備副使。
HCH_012_201_000006	練士卒，廣芻粟。
HCH_012_201_000007	歷九年，部內晏如。
HCH_012_201_000008	遷福建按察使，浙江左布政使。
HCH_012_201_000009	正德初，以右副都御史巡撫河南，遷刑部右侍郎。
HCH_012_201_000010	陜西遊擊徐謙訐御史李高。
HCH_012_201_000011	謙故劉瑾黨，行厚賂，欲中高危法。
HCH_012_201_000012	琰往按，直高。
HCH_012_201_000013	瑾怒，假他事下琰詔獄，褫其職，又罰米四百石輸邊。
HCH_012_201_000014	瑾誅，起左副都御史，總督漕運兼巡撫準、揚諸府。
HCH_012_201_000015	六年，轉南京刑部侍郎。
HCH_012_201_000016	明年，賊劉七等將犯江南，王浩八又入衢州。
HCH_012_201_000017	進琰右都御史，巡視浙江。
HCH_012_201_000018	至則七等已滅，浩八聽撫。
HCH_012_201_000019	會寧、紹瀕海地颶風大作，居民漂沒萬數。
HCH_012_201_000020	琰出帑金振救，而大築蕭山至會稽堤五萬餘丈。
HCH_012_201_000021	奏設兵備道守要害，防浩八黨出沒，遣將擊斬其渠魁。
HCH_012_201_000022	遂城開化、常山、遂安、蘭溪，境內以靖。
HCH_012_201_000023	復命總督漕運，七疏乞歸。
HCH_012_201_000024	世宗嗣位，起故官。
HCH_012_201_000025	凡三督漕，軍民習其政，不嚴而肅。
HCH_012_201_000026	琰性清儉，飯惟一疏。
HCH_012_201_000027	每到官及罷去，行李止三竹笥。
HCH_012_201_000028	尋加戶部尚書。
HCH_012_201_000029	嘉靖元年召拜工部尚書。
HCH_012_201_000030	其冬，改南京兵部，加太子少保。
HCH_012_201_000031	未浹歲，屢引年乞體。
HCH_012_201_000032	加太子太保，乘傳歸，有司歲時存問。
HCH_012_201_000033	又九年卒，年八十有四。
HCH_012_201_000034	贈少保，謚恭介。
HCH_012_201_000035	子滋，以進士授行人。
HCH_012_201_000036	諫武宗南巡，杖闕下，謫國子學正。
HCH_012_201_000037	嘉靖初，歷兵部郎中。
HCH_012_201_000038	率同官伏闕爭「大禮」，再受杖，謫戍榆林。
HCH_012_201_000039	兵部尚書王時中等言，琰老病呻吟，冀父子一相見，乞改調近衛。
HCH_012_201_000040	不許。
HCH_012_201_000041	十五年赦還，卒。
HCH_012_201_000042	王縝，字文哲，東莞人。
HCH_012_201_000043	父恪，寶慶知府。
HCH_012_201_000044	縝登弘治六年進士，選庶吉士，授兵科給事中。
HCH_012_201_000045	劾三邊總制王越附汪直、李廣，不可復玷節鉞。
HCH_012_201_000046	出理南畿屯田。
HCH_012_201_000047	有司征松江白絺六千匹，縝言絺非正供。
HCH_012_201_000048	且請停上清宮役。
HCH_012_201_000049	詔皆罷之。
HCH_012_201_000050	累遷工科都給事中。
HCH_012_201_000051	武宗初立，內府工匠以營造加恩。
HCH_012_201_000052	縝率同官言：「陛下初登大寶，工匠末技已有以微勞進者，誠不可示後世。宜散遣先朝諸畫士，革工匠所授官。」
HCH_012_201_000053	帝不能用。
HCH_012_201_000054	中官張永請改築通州新城，縝言泰陵工作方興，不當復興無益之役。
HCH_012_201_000055	帝乃止。
HCH_012_201_000056	正德元年出為山西右參政。
HCH_012_201_000057	歷福建布政使，遷右副都御史，巡撫蘇、松諸府。
HCH_012_201_000058	協平江西賊王浩八。
HCH_012_201_000059	乾清宮災，疏請養宗室子宮中，定根本；去南京新增內官，召還建言被黜諸臣。
HCH_012_201_000060	不報。
HCH_012_201_000061	已，調鄖陽巡撫，遷南京刑部右侍郎。
HCH_012_201_000062	世宗即位，陳正本十事。
HCH_012_201_000063	嘉靖二年就擢戶部尚書。
HCH_012_201_000064	卒官。
HCH_012_201_000065	李充嗣，字士修，內江人。
HCH_012_201_000066	給事中蕃孫也。
HCH_012_201_000067	登成化二十三年進士，改庶吉士。
HCH_012_201_000068	弘治初，授戶部主事。
HCH_012_201_000069	以從父臨安為郎中，改刑部。
HCH_012_201_000070	坐累，謫岳州通判。
HCH_012_201_000071	久之，移隨州知州，擢陜西僉事，歷雲南按察使。
HCH_012_201_000072	正德九年，舉治行卓異，累遷右副都御史，巡撫河南。
HCH_012_201_000073	歲大祲。
HCH_012_201_000074	請發帑金移粟振之，不足，則勸貸富室。
HCH_012_201_000075	時流民多聚開封，煮糜哺之。
HCH_012_201_000076	逾月，資遣還鄉。
HCH_012_201_000077	初，鎮守中官廖堂黨於劉瑾，假進貢名，要求百端，繼者以為常。
HCH_012_201_000078	充嗣言：「近中官進貢，有古銅器、窯變盆、黃鷹、角鷹、錦雞、走狗諸物，皆借名科斂。外又有拜見銀、須知銀及侵扣驛傳快手月錢、河夫歇役之屬，無慮十餘事，苛派動數十萬。其左右用事者，又私於境內抑買雜物，擅榷商賈貨利。乞嚴行禁絕。」
HCH_012_201_000079	詔但禁下人科取而已。
HCH_012_201_000080	十二年移撫應天諸府。
HCH_012_201_000081	寧王宸濠反，充嗣謂尚書喬宇曰：「都城守禦屬於公，畿輔則充嗣任之。」
HCH_012_201_000082	乃自將精兵萬人，西屯采石。
HCH_012_201_000083	遣使入安慶城中，令指揮楊銳等堅守。
HCH_012_201_000084	傳檄部內，聲言京邊兵十萬旦夕至，趣供餉，以紿賊。
HCH_012_201_000085	賊果疑懼。
HCH_012_201_000086	事定，兵部及巡按御史胡潔言其功。
HCH_012_201_000087	時已就進戶部右侍郎，乃賜敕嘉勞。
HCH_012_201_000088	有建議修蘇、松水利者，進充嗣工部尚書兼領水利事。
HCH_012_201_000089	未幾，世宗嗣位，遣工部郎林文霈、顏如翙佐之。
HCH_012_201_000090	開白茅港，疏吳淞江，六閱月而訖工。
HCH_012_201_000091	語詳《河渠志》。
HCH_012_201_000092	嘉靖元年論平宸濠功，加太子少保。
HCH_012_201_000093	蘇、松白糧輸內府。
HCH_012_201_000094	正德時驟增內使五千人，糧亦加十三萬石。
HCH_012_201_000095	帝用充嗣言，減從故額。
HCH_012_201_000096	又請常賦外盡蠲歲辦之浮額者，內府征收，監以科道官，毋縱內臣苛索。
HCH_012_201_000097	帝俱從之。
HCH_012_201_000098	尋改南京兵部尚書。
HCH_012_201_000099	七年致仕，卒。
HCH_012_201_000100	久之，詔贈太子太保，謚康和。
HCH_012_201_000101	吳廷舉，字獻臣，其先嘉魚人，祖戍梧州，遂家焉。
HCH_012_201_000102	成化二十三年登進士，除順德知縣。
HCH_012_201_000103	上官屬修中貴人先祠，廷舉不可。
HCH_012_201_000104	市舶中官市葛，以二葛與之，曰：「非產也。」
HCH_012_201_000105	中官大怒。
HCH_012_201_000106	御史汪宗器亦惡廷舉，曰：「彼專抗上官，市名耳。」
HCH_012_201_000107	會廷舉毀淫祠二百五十所，撤其材作堤，葺學宮、書院。
HCH_012_201_000108	宗器謂有所侵盜，執下獄。
HCH_012_201_000109	按之不得間，慚而止。
HCH_012_201_000110	為縣十年，稍遷成都同知。
HCH_012_201_000111	憂歸，補松江。
HCH_012_201_000112	用尚書馬文升、劉大夏薦，擢廣東僉事。
HCH_012_201_000113	從總督潘蕃討平南海、清遠諸盜。
HCH_012_201_000114	正德初，歷副使。
HCH_012_201_000115	發總鎮中官潘忠二十罪。
HCH_012_201_000116	忠亦訐廷舉他事，逮系詔獄。
HCH_012_201_000117	劉瑾矯詔，枷之十餘日，幾死。
HCH_012_201_000118	戍雁門，旋赦免。
HCH_012_201_000119	楊一清薦其才，擢江西右參政。
HCH_012_201_000120	敗華林賊於連河。
HCH_012_201_000121	從陳金大破姚源賊。
HCH_012_201_000122	其黨走裴源，復從俞諫破之。
HCH_012_201_000123	賊首胡浩三既撫復叛，廷舉往諭，為所執。
HCH_012_201_000124	居三月，盡得其要領，誘使攜。
HCH_012_201_000125	及得還，浩三果殺其兄浩二，內亂。
HCH_012_201_000126	官兵乘之，遂擒浩三。
HCH_012_201_000127	與副使李夢陽不協，奏夢陽侵官，因乞休。
HCH_012_201_000128	不俟命竟去，坐停一歲俸。
HCH_012_201_000129	起廣東右布政使，復佐陳金平府江賊。
HCH_012_201_000130	擢右副都御史，振湖廣饑。
HCH_012_201_000131	已，復出湖南定諸夷疆地。
HCH_012_201_000132	寧王宸濠有逆謀，疏陳江西軍政六事，為豫防計。
HCH_012_201_000133	世宗立，召為工部右侍郎，旋改兵部。
HCH_012_201_000134	上疏詆陸完、王瓊、梁儲及少傅蔣冕，而自以為己昔居憲職無一言，乞罷黜以儆幸位。
HCH_012_201_000135	時完早得罪，瓊及儲已罷去，廷舉借以傾冕。
HCH_012_201_000136	冕遂求罷。
HCH_012_201_000137	帝頗不直廷舉，調南京工部，而慰諭冕。
HCH_012_201_000138	冕固請留之，不聽。
HCH_012_201_000139	嘉靖元年，廷舉乞休。
HCH_012_201_000140	尋以災異復自劾求罷，勸帝修德應天，因奏行其部興革十二事。
HCH_012_201_000141	尋就改戶部，遷右都御史，巡撫應天諸府。
HCH_012_201_000142	長洲知縣郭波以事挫織造中官張誌聰。
HCH_012_201_000143	誌聰伺波出，倒曳之車後。
HCH_012_201_000144	典史蕭景腆操兵教場，急率兵救。
HCH_012_201_000145	百姓登屋，飛瓦擊誌聰。
HCH_012_201_000146	誌聰奏逮波、景腆，廷舉具白誌聰貪黷狀。
HCH_012_201_000147	帝乃降波五級，調景腆遠方，誌聰亦召還。
HCH_012_201_000148	三年，以「大禮」議未定，請如洪武中修《孝慈錄》故事，令兩京部、寺、臺、省及天下督、撫各條所見，並詢家居老臣，采而行之，匯為一書，以詔後世。
HCH_012_201_000149	時已定稱本生考，廷舉窺帝意不慊，故為此奏。
HCH_012_201_000150	給事中張原、劉祺交劾之，不報。
HCH_012_201_000151	尋改南京工部尚書，辭不拜，稱疾乞休。
HCH_012_201_000152	帝慰留。
HCH_012_201_000153	已，復辭，且引白居易、張詠詩，語多詼諧，中復用嗚呼字。
HCH_012_201_000154	帝怒，以廷舉怨望無人臣禮，勒致仕。
HCH_012_201_000155	廷舉面如削瓜。
HCH_012_201_000156	衣敝帶穿，不事藻飾。
HCH_012_201_000157	言行必自信，人莫能奪。
HCH_012_201_000158	其在太學時，兄事羅玘。
HCH_012_201_000159	玘病痢，仆死，自煮藥飲之。
HCH_012_201_000160	負以如廁，一晝夜數十反。
HCH_012_201_000161	玘嘗語人曰：「獻臣生我。」
HCH_012_201_000162	廷舉好薛瑄、胡居仁學，尊事陳獻章。
HCH_012_201_000163	居湫隘，亡郭外田，有書萬卷。
HCH_012_201_000164	及卒，總督姚鏌庀其喪。
HCH_012_201_000165	隆慶中，追謚清惠。
HCH_012_201_000166	弟廷弼，舉於鄉。
HCH_012_201_000167	廷舉枷吏部前，廷弼臥其械下。
HCH_012_201_000168	刑部主事宿進為奏記張糸采，乃得釋。
HCH_012_201_000169	方良永，字壽卿，莆田人。
HCH_012_201_000170	弘治三年進士。
HCH_012_201_000171	督逋兩廣，峻卻饋遺，為布政使劉大夏所器。
HCH_012_201_000172	還授刑部主事。
HCH_012_201_000173	進員外郎，擢廣東僉事。
HCH_012_201_000174	瓊州賊符南蛇為亂，大夏時為總督，檄攝海南兵備，會師討平之。
HCH_012_201_000175	御史坐良永失利。
HCH_012_201_000176	大夏已入為本兵，為白於朝，賚銀幣。
HCH_012_201_000177	正德初，父喪除，待銓闕下。
HCH_012_201_000178	外官朝見畢，必謁劉瑾。
HCH_012_201_000179	鴻臚導良永詣左順門叩頭畢，令東向揖瑾，良永竟出。
HCH_012_201_000180	或勸詣瑾家，良永不可。
HCH_012_201_000181	及吏部除良永河南撫民僉事，中旨勒致仕。
HCH_012_201_000182	既去，瑾怒未已，欲假海南殺人事中之。
HCH_012_201_000183	刑部郎中周敏力持，乃不坐。
HCH_012_201_000184	瑾誅，起湖廣副使。
HCH_012_201_000185	尋擢廣西按察使。
HCH_012_201_000186	發巡按御史朱誌榮罪至謫戍。
HCH_012_201_000187	遷山東右布政使。
HCH_012_201_000188	旋調浙江，改左。
HCH_012_201_000189	錢寧以鈔二萬鬻於浙，良永上疏曰：「四方盜甫息，瘡痍未瘳，浙東西雨雹。寧廝養賤流，假義子名，躋公侯之列。賜予無算，納賄不貲，乃敢攫民財，戕邦本。有司奉行急於詔旨，胥吏緣為奸，椎膚剝髓，民不堪命。鎮守太監王堂、劉璟畏寧威，受役使。臣何敢愛一死，不以聞。乞陛下下寧詔獄，明正典刑，並治其黨，以謝百姓。」
HCH_012_201_000190	寧懼，留疏不下。
HCH_012_201_000191	謀遣校尉捕假勢鬻鈔者，以自飾於帝，而請以鈔直還之民，陰召還前所遣使。
HCH_012_201_000192	寧初欲散鈔遍天下，先行之浙江、山東，山東為巡撫趙璜所格，而良永白髮其奸，寧自是不敢鬻鈔矣。
HCH_012_201_000193	寧方得誌，公卿、臺諫無敢出一語。
HCH_012_201_000194	良永以外僚訟言誅之，聞者震悚。
HCH_012_201_000195	良永念母老，恐中禍，三疏乞休去。
HCH_012_201_000196	世宗即位，中外交薦。
HCH_012_201_000197	拜右副都御史，撫治鄖陽。
HCH_012_201_000198	以母老，再疏乞終養。
HCH_012_201_000199	都御史姚鏌請破格褒寵。
HCH_012_201_000200	尚書喬宇、孫交言，良永家無贏貲，宜用侍郎潘禮、御史陳茂烈故事，賜廩米。
HCH_012_201_000201	詔月給三石。
HCH_012_201_000202	久之，母卒，詔賜祭葬。
HCH_012_201_000203	皆異數也。
HCH_012_201_000204	服除，以故官巡撫應天，即家賜敕。
HCH_012_201_000205	至衢州疾作，連疏乞致仕，未報遽歸，卒。
HCH_012_201_000206	卒後有南京刑部尚書之命。
HCH_012_201_000207	暨訃聞，賜恤如制，謚簡肅。
HCH_012_201_000208	良永侍父疾，衣不解帶者三月。
HCH_012_201_000209	母病，良永年六十餘矣，手進湯藥無少怠。
HCH_012_201_000210	居倚廬哀毀，稱純孝焉。
HCH_012_201_000211	素善王守仁，而論學與之異。
HCH_012_201_000212	嘗語人曰：「近世專言心學，自謂超悟獨到，推其說以自附於象山，而上達於孔子。目賢聖教人次第為小子無用之學，程、朱而下無不受擯，而不知其入於妄。」
HCH_012_201_000213	弟良節，官廣東左布政使，亦有治行。
HCH_012_201_000214	子重傑，舉於鄉，以孝聞。
HCH_012_201_000215	王爌，字存納，黃巖人。
HCH_012_201_000216	弘治十五年進士。
HCH_012_201_000217	除太常博士。
HCH_012_201_000218	正德時，屢遷刑科都給事中。
HCH_012_201_000219	武定侯郭勛鎮兩廣，行事乖謬。
HCH_012_201_000220	詔自陳，勛強辨，爌等駁之。
HCH_012_201_000221	都察院覆奏，不錄爌言，爌並劾都御史彭澤。
HCH_012_201_000222	帝責澤，置勛不問。
HCH_012_201_000223	御史林有年直言下獄，浙江僉事韓邦奇忤中官被逮，爌皆救之。
HCH_012_201_000224	帝幸大同久不反，爌力請回鸞。
HCH_012_201_000225	又與工科石天柱救彭澤，忤王瓊。
HCH_012_201_000226	中旨調兩人於外，爌得惠州推官。
HCH_012_201_000227	世宗立，召復都給事中。
HCH_012_201_000228	旋擢太僕少卿，改太常。
HCH_012_201_000229	嘉靖三年遷應天府尹。
HCH_012_201_000230	歲大祲，奏免其賦。
HCH_012_201_000231	居四年，遷南京刑部右侍郎，以母老歸養。
HCH_012_201_000232	家居十年，起故官。
HCH_012_201_000233	尋擢南京右都御史。
HCH_012_201_000234	守備中官進表，率以兩御史監禮。
HCH_012_201_000235	爌曰：「中官安得役御史？」
HCH_012_201_000236	止之。
HCH_012_201_000237	舉賀入朝，謁內閣夏言。
HCH_012_201_000238	言倨甚，大臣多隅坐，爌獨引坐正之。
HCH_012_201_000239	言不悅，爌遂謝病歸。
HCH_012_201_000240	爌與御史潘壯不相能。
HCH_012_201_000241	壯坐大獄，詔爌提問。
HCH_012_201_000242	爌力白壯罪，至忤旨。
HCH_012_201_000243	人以此稱爌長者。
HCH_012_201_000244	卒，贈工部尚書。
HCH_012_201_000245	王軏，開平衛人，弘治十二年進士。
HCH_012_201_000246	正德初，歷工部員外郎，屢遷山東左布政使。
HCH_012_201_000247	嘉靖初，入為順天府尹。
HCH_012_201_000248	房山地震，軏言召災有由，語多指斥。
HCH_012_201_000249	忤旨切責。
HCH_012_201_000250	尋遷副都御史，巡撫四川。
HCH_012_201_000251	芒部土官知府隴慰死，庶子政與嫡子壽爭立，朝議立壽。
HCH_012_201_000252	政倚烏撒，數構兵，使人誘殺壽，奪其印。
HCH_012_201_000253	軏請討之。
HCH_012_201_000254	乃會貴州兵分道進，擒政於水西，招降四十九寨。
HCH_012_201_000255	璽書獎勞。
HCH_012_201_000256	時將營仁壽宮，就拜軏工部右侍郎，督采大木。
HCH_012_201_000257	工罷，召還，改戶部。
HCH_012_201_000258	核九門苜蓿地，以余地歸之民。
HCH_012_201_000259	勘禦馬監草場，厘地二萬餘頃，募民以佃。
HCH_012_201_000260	房山民以牧馬地獻中官韋恒，軏厘歸之官。
HCH_012_201_000261	奸人馮賢等復獻中官李秀，秀為請於帝，軏抗疏劾之。
HCH_012_201_000262	帝雖宥秀，竟治賢等如律。
HCH_012_201_000263	出核勛戚莊田，請如周制，計品秩，別親疏，以定多寡，非詔賜而隱占者俱追斷。
HCH_012_201_000264	戶部尚書梁材采其言，兼並者悉歸官。
HCH_012_201_000265	稍進左侍郎。
HCH_012_201_000266	初，軏之平隴政也，以隴氏無後，請改設流官，兵部尚書李鉞等然之。
HCH_012_201_000267	遂改芒部為鎮雄府，分置四長官司，授隴氏疏屬阿濟等為長官，而擢重慶通判程洸為試知府。
HCH_012_201_000268	隴氏舊部沙保等攻執洸，奪其印，欲復立隴氏後。
HCH_012_201_000269	巡撫王廷相等破保，洸得還。
HCH_012_201_000270	保子普奴復連烏撒、水西苗攻剽畢節諸衛。
HCH_012_201_000271	帝命伍文定圖之。
HCH_012_201_000272	以朝議不合，召還。
HCH_012_201_000273	御史戴金因言：「芒部改流之議，諸司鹹執不可。軏徇洸邪說，違眾獨行，致疆場不靖。」
HCH_012_201_000274	遂罷軏官。
HCH_012_201_000275	以兵部尚書李承勛薦，起故官，總督倉場。
HCH_012_201_000276	再遷南京戶部尚書。
HCH_012_201_000277	御史龔湜劾軏老悖；吏部言軏居官儉素，搢紳儀表。
HCH_012_201_000278	帝乃責湜妄言。
HCH_012_201_000279	久之，就改兵部，參贊機務。
HCH_012_201_000280	詔舉將材，薦鄭卿、沈希儀等二十一人，皆擢用。
HCH_012_201_000281	居四年，以老乞罷。
HCH_012_201_000282	疏中言享年若干，帝以為非告君體，勒為民。
HCH_012_201_000283	久之卒。
HCH_012_201_000284	徐問，字用中，武進人。
HCH_012_201_000285	弘治十五年進士。
HCH_012_201_000286	授廣平推官。
HCH_012_201_000287	遷刑部主事，歷兵部，出為登州知府。
HCH_012_201_000288	地濱海多盜，問盡捕之。
HCH_012_201_000289	調臨江。
HCH_012_201_000290	修築壞堤七十二。
HCH_012_201_000291	轉長蘆鹽運使。
HCH_012_201_000292	運司故利藪，自好者不樂居。
HCH_012_201_000293	問曰：「吾欲清是官也。」
HCH_012_201_000294	終任不取一錢。
HCH_012_201_000295	累遷廣東左布政使。
HCH_012_201_000296	嘉靖十一年以治行卓異，拜右副都御史，巡撫貴州。
HCH_012_201_000297	獨山州賊蒙鉞弒父為亂。
HCH_012_201_000298	問聞南丹、泗城欲助逆，檄廣西撫按伐其謀。
HCH_012_201_000299	又檄鉞弟釗復父仇，事平得承襲。
HCH_012_201_000300	鉞援絕。
HCH_012_201_000301	問督大兵分道入，誅之。
HCH_012_201_000302	捷聞，賜金綺，召為兵部右侍郎。
HCH_012_201_000303	疏陳武備八事。
HCH_012_201_000304	又言：「兩廣、雲、貴半土司，深山密菁，瑤、僮、羅、僰所窟穴。邊將喜功召釁，好為掃穴之舉。王師每入，巨憝潛蹤，所誅戮率無辜赤子。興大兵，費厚餉，以易無辜命，非陛下好生意。宜敕邊臣布威信，嚴厄塞，謹哨探，使各安邊境，以絕禍萌。」
HCH_012_201_000305	帝深納其言。
HCH_012_201_000306	尋引疾歸。
HCH_012_201_000307	二十一年，召為南京禮部侍郎。
HCH_012_201_000308	久之，就遷戶部尚書。
HCH_012_201_000309	復引疾去，卒於家。
HCH_012_201_000310	問清節自勵。
HCH_012_201_000311	居官四十年，敝廬蕭然，田不滿百畝。
HCH_012_201_000312	好學不倦，粹然深造，為士類所宗。
HCH_012_201_000313	隆慶初，謚莊裕。
HCH_012_201_000314	張邦奇，字常甫，鄞人。
HCH_012_201_000315	年十五作《易解》及《釋國語》。
HCH_012_201_000316	登弘治末年進士，改庶吉士，授檢討。
HCH_012_201_000317	出為湖廣提學副使。
HCH_012_201_000318	下教曰：「學不孔、顏，行不曾、閔，雖文如雄、褒，吾且斥之。」
HCH_012_201_000319	在任三四年，諸生競勸。
HCH_012_201_000320	時世宗方為興世子，獻皇遣就試。
HCH_012_201_000321	乃特設兩案，己居北而使世子居南。
HCH_012_201_000322	文成，送入學。
HCH_012_201_000323	世宗由此知邦奇。
HCH_012_201_000324	嘉靖初，提學四川，以親孝乞歸。
HCH_012_201_000325	久之，桂萼掌銓，去留天下提學官，起邦奇福建。
HCH_012_201_000326	未幾，選外僚入坊局，改右庶子，遷南京祭酒。
HCH_012_201_000327	以身為教，學規整肅。
HCH_012_201_000328	就遷吏部侍郎。
HCH_012_201_000329	丁外艱歸。
HCH_012_201_000330	帝嘗奉太后謁天壽諸陵，語及擇相。
HCH_012_201_000331	太后曰：「先皇嘗言提學張邦奇器識，他日可為宰相，其人安在？」
HCH_012_201_000332	帝憬然曰：「尚未用也。」
HCH_012_201_000333	服闋，即召為吏部右侍郎，掌部事。
HCH_012_201_000334	推轂善類，人不可幹以私。
HCH_012_201_000335	銓部升除，多受教政府，邦奇獨否，大學士李時銜之。
HCH_012_201_000336	郭勛家人犯法，舁重賄請寬，邦奇不從。
HCH_012_201_000337	帝欲即授邦奇尚書，為兩人沮止。
HCH_012_201_000338	尋改掌翰林院事，充日講官，加太子賓客，改掌詹事府。
HCH_012_201_000339	九載考績，晉禮部尚書。
HCH_012_201_000340	以母老欲便養，乃改南京吏部。
HCH_012_201_000341	復改兵部，參贊機務。
HCH_012_201_000342	帝猶念邦奇，時與嚴嵩語及之。
HCH_012_201_000343	嵩曰：「邦奇性至孝，母老，不樂北來。」
HCH_012_201_000344	帝信其言，遂不召。
HCH_012_201_000345	二十三年卒，年六十一。
HCH_012_201_000346	贈太子太保，謚文定。
HCH_012_201_000347	邦奇之學以程、朱為宗。
HCH_012_201_000348	宗王守仁友善，而語每不合。
HCH_012_201_000349	躬修力踐，跬步必謹。
HCH_012_201_000350	晝之所為，夕必書於冊。
HCH_012_201_000351	性篤孝，以養親故，屢起輒退。
HCH_012_201_000352	其母後邦奇卒，壽至百歲。
HCH_012_201_000353	邦奇事寡嫂如事母。
HCH_012_201_000354	所著《學庸傳》、《五經說》及文集，粹然一出於正。
HCH_012_201_000355	族父時徹，少邦奇二十歲，受業於邦奇。
HCH_012_201_000356	仕至南京兵部尚書。
HCH_012_201_000357	有文名。
HCH_012_201_000358	韓邦奇，字汝節，朝邑人。
HCH_012_201_000359	父紹宗，福建副使。
HCH_012_201_000360	邦奇登正德三年進士，除吏部主事，進員外郎。
HCH_012_201_000361	六年冬，京師地震，上疏陳時政闕失。
HCH_012_201_000362	忤旨，不報。
HCH_012_201_000363	會給事中孫禎等劾臣僚不職者，並及邦奇。
HCH_012_201_000364	吏部已議留，帝竟以前疏故，黜為平陽通判。
HCH_012_201_000365	遷浙江僉事，轄杭、嚴二府。
HCH_012_201_000366	宸濠令內豎假飯僧，聚千人於杭州天竺寺，邦奇立散遣之。
HCH_012_201_000367	其儀賓托進貢假道衢州，邦奇詰之曰：「入貢當沿江下，奚自假道？歸語王，韓僉事不可誑也。」
HCH_012_201_000368	時中官在浙者凡四人，王堂為鎮守，晁進督織造，崔泬主市舶，張玉管營造。
HCH_012_201_000369	爪牙四出，民不聊生。
HCH_012_201_000370	邦奇疏請禁止，又數裁抑堂。
HCH_012_201_000371	邦奇閔中官采富陽茶魚為民害，作歌哀之。
HCH_012_201_000372	堂遂奏邦奇沮格上供，作歌怨謗。
HCH_012_201_000373	帝怒，逮至京，下詔獄。
HCH_012_201_000374	廷臣論救，皆不聽，斥為民。
HCH_012_201_000375	嘉靖初，起山東參議。
HCH_012_201_000376	乞休去。
HCH_012_201_000377	尋用薦，以故官蒞山西。
HCH_012_201_000378	再乞休去。
HCH_012_201_000379	起四川提學副使，入為春坊右庶子。
HCH_012_201_000380	七年偕同官方鵬主應天鄉試，坐試錄謬誤，謫南京太僕丞。
HCH_012_201_000381	復乞歸。
HCH_012_201_000382	起山東副使，遷大理丞，進少卿，以右僉都御史巡撫宣府。
HCH_012_201_000383	入佐院事，進右副都御史，巡撫遼東。
HCH_012_201_000384	時遼陽兵變，侍郎黃宗明言邦奇素有威望，請假以便宜，速往定亂。
HCH_012_201_000385	帝方事姑息，不從，命與山西巡撫任洛換官。
HCH_012_201_000386	至山西，為政嚴肅，有司供具悉不納，間日出俸米易肉一斤。
HCH_012_201_000387	居四年，引疾歸。
HCH_012_201_000388	中外交薦，以故官起督河道。
HCH_012_201_000389	遷刑部右侍郎，改吏部。
