HCH_010_026_000001	壽隆元年春正月己亥，如混同江。
HCH_010_026_000002	庚戌，西南面招討司奏拔思母來侵，蕭阿魯帶等擊破之。
HCH_010_026_000003	乙卯，振奉聖州貧民。
HCH_010_026_000004	二月戊辰，賜左、右二皮室貧民錢。
HCH_010_026_000005	癸酉，高麗遣使來貢。
HCH_010_026_000006	乙亥，駐蹕魚兒濼。
HCH_010_026_000007	三月丙午，賜東北路貧民絹。
HCH_010_026_000008	夏四月丁卯，斡特剌奏討耶睹刮捷。
HCH_010_026_000009	乙亥，女直遣使來貢。
HCH_010_026_000010	庚寅，錄西北路有功將士。
HCH_010_026_000011	五月乙未朔，左夷離畢耶律吐朵為惕隱，南京宣徽使耶律特末為北院大王。
HCH_010_026_000012	癸卯，贈陣亡者官。
HCH_010_026_000013	丁巳，駐蹕特禮嶺。
HCH_010_026_000014	六月己巳，以知奚六部大王事回裏不為本部大王，權參知政事趙孝嚴為漢人行宮都部署，圍場都管撒八以討阻卜功，加鎮國大將軍。
HCH_010_026_000015	癸巳，阻卜長禿裏底及圖木葛來貢。
HCH_010_026_000016	秋七月庚子，阻卜長猛達斯等來貢。
HCH_010_026_000017	癸卯，獵沙嶺。
HCH_010_026_000018	癸丑，頗里八部來附，進方物。
HCH_010_026_000019	甲寅，斡特剌奏磨古斯捷。
HCH_010_026_000020	九月甲寅，祠木葉山。
HCH_010_026_000021	丙辰，詔西京炮人、弩人教西北路漢軍。
HCH_010_026_000022	冬十月甲子，駐蹕藕絲淀。
HCH_010_026_000023	甲戌，以北面林牙耶律大悲奴為右夷離畢。
HCH_010_026_000024	癸未，以參知政事王師儒為樞密副使，漢人行宮都部署趙孝嚴參知政事。
HCH_010_026_000025	壬辰，錄討阻卜有功將士。
HCH_010_026_000026	十一月丙申，女直遣使進馬。
HCH_010_026_000027	己亥，以都統斡特剌為西北路招討使，封漆水郡王。
HCH_010_026_000028	甲辰，夏國進貝多葉佛經。
HCH_010_026_000029	庚申，高麗王昱疾，命其叔颙權知國事。
HCH_010_026_000030	十二月癸亥朔，以知北院樞密使事耶律阿思為北院樞密使。
HCH_010_026_000031	是年，放進士陳衡甫等百三十人。
HCH_010_026_000032	二年春正月甲午，如春水。
HCH_010_026_000033	癸卯，西南面招討司討拔思母，破之。
HCH_010_026_000034	乙卯，駐蹕瑟尼思。
HCH_010_026_000035	辛酉，市牛給烏古、敵烈、隈烏古部貧民。
HCH_010_026_000036	二月癸亥，振達麻裏別古部。
HCH_010_026_000037	夏四月己卯，振西北邊軍。
HCH_010_026_000038	六月辛酉，駐蹕撒裏乃。
HCH_010_026_000039	秋七月甲午，阻卜來貢。
HCH_010_026_000040	丙午，獵赤山。
HCH_010_026_000041	八月乙丑，頗裏八部進馬。
HCH_010_026_000042	九月丙午，徙烏古敵烈部於烏納水，以扼北邊之沖。
HCH_010_026_000043	冬十月戊辰，駐蹕藕絲淀。
HCH_010_026_000044	庚辰，高麗遣使來貢。
HCH_010_026_000045	十二月己未，斡特剌討梅裏急，破之。
HCH_010_026_000046	壬戌，南府宰相耶律鐸魯斡致仕。
HCH_010_026_000047	癸亥，蕭撻不也為北府宰相，耶律大悲奴殿前都點檢。
HCH_010_026_000048	乙亥，夏國獻宋俘。
HCH_010_026_000049	三年春正月丁亥，如春水。
HCH_010_026_000050	壬寅，烏古部節度使耶律陳家奴以功加尚書右僕射。
HCH_010_026_000051	癸卯，駐蹕雙山。
HCH_010_026_000052	二月丙辰朔，南京水，遣使振之。
HCH_010_026_000053	閏月丙午，阻卜長猛撒葛、粘八葛長禿骨撒、梅裏急長忽魯八等請復舊地，貢方物，從之。
HCH_010_026_000054	三月辛酉，燕國王延禧生子。
HCH_010_026_000055	癸亥，賜名撻魯。
HCH_010_026_000056	妃之父長哥遷左監門衛上將軍，仍賜官屬錢。
HCH_010_026_000057	是春，高麗王昱薨。
HCH_010_026_000058	夏四月，南府宰相趙廷睦出知興中府事，參知政事牛溫舒兼同知樞密院事。
HCH_010_026_000059	五月癸亥，斡特剌討阻卜，破之。
HCH_010_026_000060	己巳，駐蹕撒裏乃。
HCH_010_026_000061	六月甲申，詔罷諸路馳驲貢新。
HCH_010_026_000062	丙戌，詔每冬駐蹕之所，宰相以下構宅，毋役其民。
HCH_010_026_000063	辛丑丑，夏人來告宋城要地，遣使之宋，諭與夏和。
HCH_010_026_000064	庚戌，以契丹行宮都部署耶律吾也為南院大王。
HCH_010_026_000065	秋七月壬子朔，獵黑嶺。
HCH_010_026_000066	八月己亥，蒲盧毛朵部長率其民來歸。
HCH_010_026_000067	乙巳，彗星見西方。
HCH_010_026_000068	九月壬申，駐蹕藕絲淀。
HCH_010_026_000069	丁丑，以武定軍節度使梁援為漢人行宮都部署。
HCH_010_026_000070	戊寅，斡特剌奏討梅裏急捷。
HCH_010_026_000071	己卯，五國部長來貢。
HCH_010_026_000072	冬十月庚戌，以西北路招討使斡特剌為南府宰相。
HCH_010_026_000073	十一月乙卯，蒲盧毛朵部來貢。
HCH_010_026_000074	戊午，以安車召醫巫閭山僧誌達。
HCH_010_026_000075	己未，以中京留守韓資讓知樞密院事，同知南院樞密使事蕭藥師奴知右夷離畢。
HCH_010_026_000076	丁丑，西北路統軍司奏討梅裏急捷。
HCH_010_026_000077	四年春正月壬子，如魚兒濼。
HCH_010_026_000078	己巳，徙阻卜等貧民於山前。
HCH_010_026_000079	辛未，宋遣使來饋錦綺。
HCH_010_026_000080	三月庚午，幸春州。
HCH_010_026_000081	丙子，有司奏黃河清。
HCH_010_026_000082	夏四月辛丑，以雨，罷獵。
HCH_010_026_000083	五月癸酉，那也奏北邊捷。
HCH_010_026_000084	甲戌，駐蹕撒裏乃。
HCH_010_026_000085	六月戊寅朔，夏國為宋所攻，遣使求援。
HCH_010_026_000086	丁亥，以遼興軍節度使涅裏為惕隱，前知惕隱事耶律郭三為南京統軍使。
HCH_010_026_000087	甲午，以參知政事牛溫舒兼知中京留守事。
HCH_010_026_000088	秋七月戊午，如黑嶺。
HCH_010_026_000089	冬十月乙亥朔，駐蹕藕絲淀。
HCH_010_026_000090	己卯，以南府宰相斡特剌兼契丹行宮都部署，以傅導燕國王延禧。
HCH_010_026_000091	十一月乙巳朔，知右夷離畢事蕭藥師奴、樞密直學士耶律儼使宋，諷與夏和。
HCH_010_026_000092	辛酉，夏復遣使求援。
HCH_010_026_000093	十二月壬辰，為燕國王延禧行再生禮，曲赦三百里內囚。
HCH_010_026_000094	五年春正月乙巳，如魚兒濼。
HCH_010_026_000095	己酉，詔夏國王李乾順伐拔思母等部。
HCH_010_026_000096	夏五月壬戌，藥師奴等使宋回，奏宋罷兵。
HCH_010_026_000097	癸亥，謁乾陵。
HCH_010_026_000098	戊辰，以南府宰相斡特剌兼西北路招討使，禁軍都統。
HCH_010_026_000099	己巳，駐蹕沿柳湖。
HCH_010_026_000100	六月甲申，以奚六部大王回離保為契丹行宮都部署，知右夷離畢事蕭藥師奴南面林牙，兼知契丹行宮都部署事。
HCH_010_026_000101	乙未，五國部長來朝。
HCH_010_026_000102	戊戌，阻卜來貢。
HCH_010_026_000103	己亥，以興聖宮使耶律郝家奴為右夷離畢。
HCH_010_026_000104	秋七月壬寅朔，惕德長禿的等來貢。
HCH_010_026_000105	辛亥，如大牢古山。
HCH_010_026_000106	閏九月丙子，駐蹕獨盧金。
HCH_010_026_000107	冬十月己亥朔，高麗王颙遣使乞封冊。
HCH_010_026_000108	丁巳，斡特剌奏討耶睹刮捷。
HCH_010_026_000109	丙寅，以同知南京留守事蕭得裏底知北院樞密使事。
HCH_010_026_000110	丁卯，宋遣郭知章、曹平來聘。
HCH_010_026_000111	戌辰，振遼州饑，仍免租賦一年。
HCH_010_026_000112	十一月甲戌，振南、北二糺。
HCH_010_026_000113	乙酉，夏國以宋罷兵，遣使來謝。
HCH_010_026_000114	十二月甲子，以參知政事趙孝嚴為漢人行宮都部署，漢人行宮都部署梁援為遼興軍節度使。
HCH_010_026_000115	六年春正月癸酉，南院大王耶律吾也薨。
HCH_010_026_000116	壬午，以太師致仕禿開起為奚六部大王。
HCH_010_026_000117	丁亥，如春水。
HCH_010_026_000118	辛卯，斡特剌執磨古斯來獻。
HCH_010_026_000119	丙申，詔問民疾苦。
HCH_010_026_000120	二月丁未，以烏古部節度使陳家奴為南院大王。
HCH_010_026_000121	己酉，磔磨古斯於市。
HCH_010_026_000122	癸丑，出絹賜五院貧民。
HCH_010_026_000123	辛酉，宋遣使告宋主煦殂，弟佶嗣位，即日遣使吊祭。
HCH_010_026_000124	三月甲申，馳朔州山林之禁。
HCH_010_026_000125	夏四月丁酉朔，日有食之。
HCH_010_026_000126	癸卯，如炭山。
HCH_010_026_000127	五月壬午，烏古部討茶紥剌，破之。
HCH_010_026_000128	乙酉，漢人行宮都部署趙孝嚴薨。
HCH_010_026_000129	丙戌，駐蹕納葛濼。
HCH_010_026_000130	辛卯，宋遣使饋先帝遺物。
HCH_010_026_000131	乙未，以東京留守何魯掃古為惕隱，南院宣徽使蕭常哥為漢人行宮都部署。
HCH_010_026_000132	六月庚子，遣使賀宋主。
HCH_010_026_000133	辛丑，以有司案牘書宋帝「嗣位」為「登寶位」，詔奪宰相鄭顓以下官，出顓知興中府事，韓資讓為崇義軍節度使，御史中丞韓君義為廣順軍節度使。
HCH_010_026_000134	癸丑，阻卜長來貢。
HCH_010_026_000135	戊午，遣使決五京滯獄。
HCH_010_026_000136	己未，以遼興軍節度使梁援為樞密副使。
HCH_010_026_000137	秋七月庚午，如沙嶺。
HCH_010_026_000138	壬申，耶睹刮諸部寇西北路。
HCH_010_026_000139	八月，斡特剌以兵擊敗之，使來獻捷。
HCH_010_026_000140	九月癸未，望祠木葉山。
HCH_010_026_000141	戊子，駐蹕藕絲淀。
HCH_010_026_000142	冬十月壬寅，以樞密副使王師儒監修國史。
HCH_010_026_000143	癸卯，五國諸部長來貢。
HCH_010_026_000144	甲寅，以平州饑，復其租賦一年。
HCH_010_026_000145	十一月壬申，以天德軍民田世榮三世同居，詔官之，令一子三班院祗候。
HCH_010_026_000146	丙子，詔醫巫閭山僧誌達設壇於內殿。
HCH_010_026_000147	戊子，夏國王李乾順遣使請尚公主。
HCH_010_026_000148	十二月乙未，女直遣使來貢。
HCH_010_026_000149	己亥，以知右夷離畢事郝家奴為北面林牙。
HCH_010_026_000150	辛亥，詔燕國王延禧擬註大將軍以下官。
HCH_010_026_000151	庚申，鐵驪來貢。
HCH_010_026_000152	宋遣使來謝。
HCH_010_026_000153	帝不豫。
HCH_010_026_000154	是歲，封高麗王颙長子俁為三韓國公。
HCH_010_026_000155	放進士康秉儉等八十七人。
HCH_010_026_000156	七年春正月壬戌朔，力疾禦清風殿受百官及諸國使賀。
HCH_010_026_000157	是夜，白氣如練，自天而降。
HCH_010_026_000158	黑雲起於西北，疾飛有聲。
HCH_010_026_000159	北有青赤黑白氣，相雜而落。
HCH_010_026_000160	癸亥，如混同江。
HCH_010_026_000161	甲戌，上崩於行宮，年七十。
HCH_010_026_000162	遺詔燕國王延禧嗣位。
HCH_010_026_000163	六月庚子，上尊謚仁聖大孝文皇帝，廟號道宗。
HCH_010_026_000164	贊曰：道宗初即位，求直言，訪治道，勸農興學，救災恤患，粲然可觀。
HCH_010_026_000165	及夫謗訕之令既行，告訐之賞日重。
HCH_010_026_000166	群邪並興，讒巧競進。
HCH_010_026_000167	賊及骨肉，皇基浸危。
HCH_010_026_000168	眾正淪胥，諸部反側，甲兵之用，無寧歲矣。
HCH_010_026_000169	一歲而飯僧三十六萬，一日而祝髮三千。
HCH_010_026_000170	徒勤小惠，蔑計大本，尚足與論治哉？
HCH_010_026_000171	本元朝作品在全世界都属于公有领域，因为作者逝世已经遠遠超过100年。
