HCH_012_043_001347	西有毛竹山，接寧州界，雙溪水出焉，下流入於馮水。
HCH_012_043_001348	北有桃源山，桃源水所出，流與雙溪水合。
HCH_012_043_001349	又西北有長溪，源出名山，下流入於修水。
HCH_012_043_001350	武寧府西北。
HCH_012_043_001351	西有太平山。
HCH_012_043_001352	西北有九宮山。
HCH_012_043_001353	南有修水。
HCH_012_043_001354	寧州府西。
HCH_012_043_001355	元分寧縣，爲寧州治。
HCH_012_043_001356	洪武初，改縣爲寧縣，省州入焉。
HCH_012_043_001357	弘治十六年，升縣爲州。
HCH_012_043_001358	西有幕阜山，修水發源於此，下流入鄱陽湖。
HCH_012_043_001359	又東有鶴源水，源發九宮山，下流合修水。
HCH_012_043_001360	西有杉市巡檢司，後遷於崇鄉北村。
HCH_012_043_001361	南有定江、又有八疊嶺二巡檢司，廢。
HCH_012_043_001362	東南距府三百六十里。
HCH_012_043_001363	瑞州府元瑞州路，屬江西行省。
HCH_012_043_001364	洪武二年爲府。
HCH_012_043_001365	領縣三。
HCH_012_043_001366	東北距布政司二百里。
HCH_012_043_001367	高安倚。
HCH_012_043_001368	北有米山。
HCH_012_043_001369	西北有華林山。
HCH_012_043_001370	又北有蜀江，自上高縣流入，東流匯於南昌之象牙潭而入章江，一名錦水。
HCH_012_043_001371	此別一蜀江，非出岷山之大江也。
HCH_012_043_001372	又南有曲水，亦東入章江。
HCH_012_043_001373	南有陰岡嶺、又有洪城二巡檢司，廢。
HCH_012_043_001374	上高府西南。
HCH_012_043_001375	南有蒙山，舊產銀鉛。
HCH_012_043_001376	西有天嶺。
HCH_012_043_001377	又西有蜀江，自萬載縣流入，至縣西北凌江口合新昌縣之鹽溪水。
HCH_012_043_001378	又有斜口水，源出蒙山，至縣西亦流入焉。
HCH_012_043_001379	西有離婁橋、又有麻塘二巡檢司。
HCH_012_043_001380	新昌府西。
HCH_012_043_001381	元新昌州。
HCH_012_043_001382	洪武初，降爲縣。
HCH_012_043_001383	西有鹽溪水，一名若耶溪，南流至上高縣入於蜀江。
HCH_012_043_001384	又北有藤江，下流與鹽溪水合。
HCH_012_043_001385	西有黃岡洞、北有大姑嶺二巡檢司。
HCH_012_043_001386	九江府元江州路，屬江西行省。
HCH_012_043_001387	太祖辛丑年爲九江府。
HCH_012_043_001388	領縣五。
HCH_012_043_001389	南距布政司三百里。
HCH_012_043_001390	德化倚。
HCH_012_043_001391	南有廬山，亦曰匡廬。
HCH_012_043_001392	東南有鄱陽湖，湖中有大孤山。
HCH_012_043_001393	縣北濱大江，亦曰潯陽江，北岸爲湖廣黃梅縣，南岸經湖口、彭澤二縣，而入南直東流縣境。
HCH_012_043_001394	江中有桑落州，與南直宿松縣界。
HCH_012_043_001395	又西有湓浦，自瑞昌縣流入，經城西，注於大江，所謂湓口也。
HCH_012_043_001396	又東南有女兒浦，源出廬山，東北入鄱陽湖。
HCH_012_043_001397	西有城子鎮巡檢司。
HCH_012_043_001398	又東有南湖觜、西有龍開河二巡檢司，後廢。
HCH_012_043_001399	德安府西南。
HCH_012_043_001400	南有博陽山，古文以爲敷淺原，博陽川出焉，東南流入於鄱陽湖。
HCH_012_043_001401	東北有谷簾水，源出廬山，下流亦入鄱陽湖。
HCH_012_043_001402	瑞昌府西。
HCH_012_043_001403	西有清湓山，湓水出焉。
HCH_012_043_001404	北有大江，北岸與湖廣廣濟縣分界。
HCH_012_043_001405	湖口府東。
HCH_012_043_001406	北濱大江。
HCH_012_043_001407	南有上石鐘山。
HCH_012_043_001408	北有下石鐘山。
HCH_012_043_001409	又南有青山，在鄱陽湖中。
HCH_012_043_001410	西南即鄱陽湖，匯章、貢羣川之水，由此入江。
HCH_012_043_001411	南有湖口鎮巡檢司，後遷上石鐘山。
HCH_012_043_001412	西北有茭石磯鎮巡檢司，後遷於黃茅潭。
HCH_012_043_001413	彭澤府東少北。
HCH_012_043_001414	濱大江。
HCH_012_043_001415	北有小孤山在江中，江濱有彭浪磯，與小孤對。
HCH_012_043_001416	東北有馬當山，橫枕大江。
HCH_012_043_001417	有馬當鎮巡檢司。
HCH_012_043_001418	西南有峯山、磯鎮二巡檢司。
HCH_012_043_001419	南唐府元南唐路，屬江西行省。
HCH_012_043_001420	太祖辛丑年八月爲西寧府。
HCH_012_043_001421	壬寅年四月改曰南康府。
HCH_012_043_001422	領縣四。
HCH_012_043_001423	南距布政司三百里。
HCH_012_043_001424	星子倚。
HCH_012_043_001425	西北有廬山。
HCH_012_043_001426	北有鞋山，在鄱陽湖中。
HCH_012_043_001427	湖東爲宮亭湖，西北爲落星湖。
HCH_012_043_001428	又西有谷簾水，下流入鄱陽湖。
HCH_012_043_001429	東有長嶺巡檢司，後遷縣南渚溪鎮，又遷縣東北青山鎮，仍故名。
HCH_012_043_001430	都昌府東。
HCH_012_043_001431	西南有石壁山，臨章江，東南爲鄱陽湖，北有後港河，合諸水入焉。
HCH_012_043_001432	西北有左蠡巡檢司，濱湖。
HCH_012_043_001433	東南有柴棚巡檢司，在湖中。
HCH_012_043_001434	建昌府西南。
HCH_012_043_001435	元建昌州。
HCH_012_043_001436	洪武初，降爲縣。
HCH_012_043_001437	西南有長山，南有修水，自寧州流入，亦謂之西河。
HCH_012_043_001438	東有蘆潭巡檢司。
HCH_012_043_001439	安義府西南。
HCH_012_043_001440	正德十三年二月析建昌縣安義等五鄉置。
HCH_012_043_001441	東有東陽新逕水，南有龍江水，俱流合於修水。
HCH_012_043_001442	饒州府元饒州路，屬江浙行省。
HCH_012_043_001443	太祖辛丑年八月爲鄱陽府，隸江南行省。
HCH_012_043_001444	尋曰饒州府，來隸。
HCH_012_043_001445	領縣七。
HCH_012_043_001446	西南距布政司二百四十里。
HCH_012_043_001447	鄱陽倚。
HCH_012_043_001448	正統元年，淮王府自廣東韶州府遷此。
HCH_012_043_001449	西北有鄱陽山，在鄱陽湖中。
HCH_012_043_001450	湖長三百里，闊四十里，亙南康、饒州、南昌、九江四府之境。
HCH_012_043_001451	南有鄱江，源出南直婺源縣及祁門縣，下流會於城東。
HCH_012_043_001452	又南則廣信上饒江來合焉，環城西北出，復分爲二，俱入鄱陽湖，亦名雙港水。
HCH_012_043_001453	又東有東湖，一名督軍湖，流入鄱江。
HCH_012_043_001454	西北有棠陰巡檢司，遷於雙港口。
HCH_012_043_001455	北有石門鎮巡檢司。
HCH_012_043_001456	又東北有大陽埠。
HCH_012_043_001457	西有八字腦。
HCH_012_043_001458	餘干府南。
HCH_012_043_001459	元饒干州。
HCH_012_043_001460	洪武初，降爲縣。
HCH_012_043_001461	西北有康郎山，濱鄱陽湖南涯，因名其水曰康朗湖。
HCH_012_043_001462	又西有族亭湖。
HCH_012_043_001463	又南有餘水，亦曰三餘水。
HCH_012_043_001464	又南有龍窟河，合於餘水，下入鄱江。
HCH_012_043_001465	有康山巡檢司，舊在康郎山上，後遷黃埠。
HCH_012_043_001466	西有瑞虹鎮，在鄱陽湖濱。
HCH_012_043_001467	樂平府東。
HCH_012_043_001468	元樂平州。
HCH_012_043_001469	洪武初，降爲縣。
HCH_012_043_001470	東北有鳳遊山。
HCH_012_043_001471	南有樂安江，即鄱江之上流也。
HCH_012_043_001472	北有八澗鎮巡檢司。
HCH_012_043_001473	南有仙鶴鎮巡檢司，後遷萬年縣之苛溪鎮。
HCH_012_043_001474	浮梁府東。
HCH_012_043_001475	元浮梁州，洪武初降爲縣。
HCH_012_043_001476	南有昌江，南直祁門縣之水俱流匯焉，鄱江之別源也。
HCH_012_043_001477	西北有桃樹鎮巡檢司，後遷縣東北勒上市。
HCH_012_043_001478	西南有景德鎮，宣德初，置御器廠於此。
HCH_012_043_001479	德興府東。
HCH_012_043_001480	東有銀山，舊產銀。
HCH_012_043_001481	北有銅山，山麓有膽泉，浸鐵可以成銅。
HCH_012_043_001482	西南有建節水，自弋陽縣流入。
HCH_012_043_001483	北有大溪，自南直婺源縣流入。
HCH_012_043_001484	下流俱合於樂安江。
HCH_012_043_001485	東有白沙巡檢司。
HCH_012_043_001486	西南有永泰巡檢司，廢。
HCH_012_043_001487	安仁府南少東。
HCH_012_043_001488	南有錦江，亦名安仁港，自貴溪縣流入，西北入餘干境，爲龍窟河。
HCH_012_043_001489	又東有白塔河，流合於錦江。
HCH_012_043_001490	南有白塔、東有田南二巡檢司，後廢。
HCH_012_043_001491	萬年府東南。
HCH_012_043_001492	正德七年以餘干縣之萬春鄉置，析鄱陽、樂平及貴溪三縣地益之。
HCH_012_043_001493	北有萬年山。
HCH_012_043_001494	東有桃源洞，桃源水出焉，經縣西南，下流爲餘水。
HCH_012_043_001495	東北有荷溪鎮、北有石頭街二巡檢司，後俱廢。
HCH_012_043_001496	廣信府元信州路，屬江浙行省。
HCH_012_043_001497	太祖庚子年五月爲廣信府。
HCH_012_043_001498	領縣七。
HCH_012_043_001499	西北距布政司六百三十里。
HCH_012_043_001500	上饒倚。
HCH_012_043_001501	西北有靈山，舊產水晶。
HCH_012_043_001502	南有丁溪山，產鐵。
HCH_012_043_001503	又南有銅山。
HCH_012_043_001504	北有上饒江，自玉山縣流入，經城北，下流至鄱陽縣合於鄱江。
HCH_012_043_001505	又西有櫧溪，源出靈山，亦曰靈溪，流入上饒江。
HCH_012_043_001506	南有八坊場、東北有鄭家坊二巡檢司。
HCH_012_043_001507	玉山府東。
HCH_012_043_001508	有三清山。
HCH_012_043_001509	又有懷玉山，玉溪出焉，分二流，東入浙，西爲上饒江。
HCH_012_043_001510	東南有柳都寨巡檢司。
HCH_012_043_001511	弋陽府西。
HCH_012_043_001512	南有軍陽山，舊產銀。
HCH_012_043_001513	東有弋陽江，即上饒江下流也，又有弋溪流合焉。
HCH_012_043_001514	又有葛溪，源出上饒縣靈山，下流入鄱江。
HCH_012_043_001515	又有信義港，自福建邵武流入，合於葛溪。
HCH_012_043_001516	貴溪府西。
HCH_012_043_001517	西南有象山，又有龍虎山，上清宮在焉。
HCH_012_043_001518	其南爲仙嚴。
HCH_012_043_001519	又南有薌溪，亦名貴溪，上流即上饒江也。
HCH_012_043_001520	又有須溪，自福建光澤縣流入，來合焉。
HCH_012_043_001521	南有管界寨巡檢司。
HCH_012_043_001522	西有神前街巡檢司，本神峯寨，在縣北，後遷潭溪，更名。
HCH_012_043_001523	鉛山府南。
HCH_012_043_001524	元鉛山州，直隸江浙行省，治在八樹嶺之南。
HCH_012_043_001525	洪武初，降爲縣，遷於今治。
HCH_012_043_001526	西南有銅寶山，涌泉浸鐵可以爲銅。
HCH_012_043_001527	又有鉛山，產鉛銅及青綠。
HCH_012_043_001528	北有鵝湖山。
HCH_012_043_001529	南有分水嶺，與福建崇安縣界，上有分水關巡檢司。
HCH_012_043_001530	又有紫溪嶺，紫溪水出焉。
HCH_012_043_001531	北有上饒江，至汭口，與紫溪、桐木、黃櫱諸水合流，入弋陽縣界，謂之鉛山河口。
HCH_012_043_001532	又東北有石溪，亦流合上饒江。
HCH_012_043_001533	西南有石佛寨巡檢司，後遷善政鄉湖坊街。
HCH_012_043_001534	又西有駐泊巡檢司，治汭口鎮，廢。
HCH_012_043_001535	永豐府南。
HCH_012_043_001536	東南有平洋山，舊產銀礦。
HCH_012_043_001537	南有永豐溪，源出福建浦城縣界，下流至上饒縣界合玉溪。
HCH_012_043_001538	又東有永平溪，西會杉溪及諸溪谷之水，注於永豐溪。
HCH_012_043_001539	東有柘陽寨巡檢司。
HCH_012_043_001540	又有杉溪寨巡檢司，廢。
HCH_012_043_001541	興安府西。
HCH_012_043_001542	嘉靖三十九年八月以弋陽縣之橫峯寨置，析上饒、貴溪二縣地益之。
HCH_012_043_001543	縣南有宋溪，源並出靈山，下流入上饒江。
HCH_012_043_001544	東有丫嚴寨巡檢司，後廢。
HCH_012_043_001545	建昌府元建昌路，屬江西行省。
HCH_012_043_001546	太祖壬寅年正月爲肇昌府，尋曰建昌府。
HCH_012_043_001547	領縣五。
HCH_012_043_001548	西北距布政司四百里。
HCH_012_043_001549	南城倚。
HCH_012_043_001550	永樂二十二年建荊王府。
HCH_012_043_001551	正統十年遷於湖廣蘄州。
HCH_012_043_001552	成化二十三年建益王府。
HCH_012_043_001553	西南有麻姑山。
HCH_012_043_001554	東有旴江，一名建昌江，自南豐縣流入，下流入金溪縣。
HCH_012_043_001555	東有藍田、北有伏牛二巡檢司。
HCH_012_043_001556	又南有曾潭、北有嶽口二巡檢司，廢。
HCH_012_043_001557	又東南有杉關，接福建光澤縣界。
HCH_012_043_001558	南豐府南少西。
HCH_012_043_001559	元南豐州，直隸江西行省。
HCH_012_043_001560	洪武初，降爲縣，南有軍山。
HCH_012_043_001561	又東南有百丈嶺，與福建建寧縣分界。
HCH_012_043_001562	又有旴水。
HCH_012_043_001563	東南有龍池巡檢司，本黃沙源坪，在縣西南，後遷縣南雙港口，又遷縣東南百丈嶺，又遷刊都，尋又遷於此，更名。
HCH_012_043_001564	又南有太平、北有仙君二巡檢司，廢。
HCH_012_043_001565	新城府東南。
HCH_012_043_001566	西有福山，黎水出焉，經縣西，下流會於旴江。
HCH_012_043_001567	又東有飛猿嶺，飛猿水出焉，下流至南城縣入於日於江。
HCH_012_043_001568	又有五福港，源出杉關，流與飛猿水合。
HCH_012_043_001569	東南有極高巡檢司，遷水口村，後遷縣南德勝關，又遷縣東洵口，仍故名。
HCH_012_043_001570	西南有同安巡檢司，後遷縣西樟村，尋復。
HCH_012_043_001571	廣昌府西南。
HCH_012_043_001572	西北有金嶂山。
HCH_012_043_001573	西南有梅嶺。
HCH_012_043_001574	又南有血木嶺，旴水出焉，經城南，流入南豐縣。
HCH_012_043_001575	西南有秀嶺、南有泉鎮二巡檢司。
HCH_012_043_001576	瀘溪府東南。
HCH_012_043_001577	本南城縣瀘溪巡檢司，萬曆六年十二月改爲縣。
HCH_012_043_001578	東有瀘溪，源出福建崇安縣之五鳳山，流至縣，又北入於安仁港。
HCH_012_043_001579	撫州府元撫州路，屬江西行省。
HCH_012_043_001580	太祖壬寅年正月爲臨川府，尋曰撫州府。
HCH_012_043_001581	領縣六。
HCH_012_043_001582	北距布政司二百四十里。
HCH_012_043_001583	臨川倚。
HCH_012_043_001584	南有靈谷山。
HCH_012_043_001585	西有銅山，舊產銅。
HCH_012_043_001586	城東有汝水，上源接旴江，自金谿縣流入，東合於章江。
HCH_012_043_001587	又西有臨水，源出崇仁縣，流合汝水。
HCH_012_043_001588	北有溫家圳、南有青泥、西有清遠三巡檢司。
HCH_012_043_001589	又有白竿巡檢司，後廢。
HCH_012_043_001590	崇仁府西。
HCH_012_043_001591	南有巴山，一名臨川山，臨水出焉，亦曰巴水。
HCH_012_043_001592	又南有華蓋山，西寧水出焉，下流俱合於汝水。
HCH_012_043_001593	又西南有寶唐山，寶唐水出其下，北合縣境諸溪，入於臨水。
HCH_012_043_001594	東有周坊巡檢司。
HCH_012_043_001595	又西北有丁坊、南有河亭二巡檢司，廢。
HCH_012_043_001596	金谿府東南。
HCH_012_043_001597	東有金窟山，舊產金。
HCH_012_043_001598	又有云林山，跨撫、信、建昌三府境。
HCH_012_043_001599	又有崖山，接貴溪縣界。
HCH_012_043_001600	南有福水，即旴水下流也，自南城縣流入，北合清江水，又北合石門港水。
HCH_012_043_001601	又北流爲苦竹水，又西流爲臨川縣之汝水。
HCH_012_043_001602	宜黃府西南。
HCH_012_043_001603	東有宜黃水，下流入汝。
HCH_012_043_001604	南有止馬寺巡檢司。
HCH_012_043_001605	又有上勝巡檢司，廢。
HCH_012_043_001606	樂安府西南。
HCH_012_043_001607	西北有大盤山，與新淦、永豐二縣界，寶唐水出焉，下流合於臨水。
HCH_012_043_001608	東有芙蓉山，鰲溪水出焉，下流合於贛水。
HCH_012_043_001609	北有龍義、又有望仙二巡檢司。
HCH_012_043_001610	又西北有南平巡檢司，後廢。
HCH_012_043_001611	東鄉府東。
HCH_012_043_001612	正德七年八月以臨川縣之孝岡置，析金溪、進賢、餘干、安仁四縣地益之。
HCH_012_043_001613	西南有汝水。
HCH_012_043_001614	東北有橫山、西北有古熂二巡檢司，後廢。
HCH_012_043_001615	吉安府元吉安路，屬江西行省。
HCH_012_043_001616	太祖壬寅年爲府。
HCH_012_043_001617	領縣九。
HCH_012_043_001618	東北距布政司五百九十里。
HCH_012_043_001619	廬陵倚。
HCH_012_043_001620	北有螺山，南有神岡山，兩山相望，贛江經其下。
HCH_012_043_001621	又北經城東，又北經虎口石，流入峽江縣，爲清江。
HCH_012_043_001622	南有富田、西有井岡、西南有敖城三巡檢司。
HCH_012_043_001623	泰和府南少西。
HCH_012_043_001624	元太和州。
HCH_012_043_001625	洪武二年正月改爲泰和縣。
HCH_012_043_001626	東有王山，亦名匡山。
HCH_012_043_001627	贛江在城南，自萬安縣流入，經縣西之牛吼石，而東北入廬陵縣界。
HCH_012_043_001628	又南有云亭江，一名繒水，源出興國縣，北流至珠林口注於贛江。
HCH_012_043_001629	西有旱禾市、東北有花石潭、東南有三顧山三巡檢司。
HCH_012_043_001630	吉水府東北。
HCH_012_043_001631	元吉水州。
HCH_012_043_001632	洪武二年正月降爲縣。
HCH_012_043_001633	東有東山。
HCH_012_043_001634	北有王嶺。
HCH_012_043_001635	又東北有吉文水，贛水之支流。
HCH_012_043_001636	北有白沙巡檢司，遷縣西北三曲灘上，仍故名。
HCH_012_043_001637	永豐府東。
HCH_012_043_001638	東有郭山。
HCH_012_043_001639	南有石空嶺，又有恩江，下流入於贛江。
HCH_012_043_001640	東南有層山、南有沙溪、又有表湖三巡檢司。
HCH_012_043_001641	又東北有視田巡檢司，後廢。
HCH_012_043_001642	安福府西少北。
HCH_012_043_001643	元安福州。
HCH_012_043_001644	洪武二年正月降爲縣。
HCH_012_043_001645	西有盧蕭山，盧水出焉，經城北，東流與王江合，又東合禾水，至廬陵縣神岡山下入於贛江。
HCH_012_043_001646	南有黃茆巡檢司，治黃陂寨，後遷縣西時礱鎮，西有羅塘巡檢司，治洋澤，後遷江背，俱仍故名。
HCH_012_043_001647	龍泉府西南。
HCH_012_043_001648	東南有錢塘山。
HCH_012_043_001649	西有石含山。
HCH_012_043_001650	南有遂水，東流入於贛江。
HCH_012_043_001651	西北有北鄉巡檢司。
HCH_012_043_001652	西南有禾源巡檢司，後遷縣西左安司，仍故名。
HCH_012_043_001653	西有秀洲巡檢司，本金田，在縣北，後遷治，更名。
HCH_012_043_001654	萬安府南。
HCH_012_043_001655	東有蕉源山，產鐵。
HCH_012_043_001656	城西有贛江，江之灘三百里，在縣境者十八灘，皇恐爲最險。
HCH_012_043_001657	又南有皁口江，自贛縣北注於贛江。
HCH_012_043_001658	有造口巡檢司，在縣西南。
HCH_012_043_001659	又東北有灘頭巡檢司，又東南有西平山巡檢司，廢。
HCH_012_043_001660	永新府西南。
HCH_012_043_001661	元永新州。
HCH_012_043_001662	洪武二年正月降爲縣。
HCH_012_043_001663	東南有義山。
HCH_012_043_001664	西有秋山，一名禾山，禾水出焉，一名永新江，下流至泰和縣入於贛江。
HCH_012_043_001665	東南有上坪寨、西北有慄傳寨、又有禾山寨、又有新安寨四巡檢司。
HCH_012_043_001666	永寧府西南。
HCH_012_043_001667	北有七溪嶺。
HCH_012_043_001668	西有漿山水，源自湖廣茶陵州界，流經縣南，合於永新縣之禾江。
HCH_012_043_001669	西有升鄉寨巡檢司。
HCH_012_043_001670	西南有礱頭寨巡檢司，尋廢。
HCH_012_043_001671	臨江府元臨江路，屬江西行省。
HCH_012_043_001672	太祖癸卯年爲府。
HCH_012_043_001673	領縣四。
HCH_012_043_001674	東北距布政司二百七十里。
HCH_012_043_001675	清江倚。
HCH_012_043_001676	東有閣皁山，亙二百餘里。
HCH_012_043_001677	南有贛江，一名清江，有清江鎮巡檢司。
HCH_012_043_001678	又有袁江，自新喻縣流入，至縣南合焉。
HCH_012_043_001679	西有蕭水，南有淦水，至縣東清江鎮，亦俱合於贛江。
HCH_012_043_001680	西南有太平市巡檢司，廢。
HCH_012_043_001681	新淦府南。
HCH_012_043_001682	元新淦州。
HCH_012_043_001683	洪武初降爲縣。
HCH_012_043_001684	西北有離嶺，淦水出焉。
HCH_012_043_001685	又西有清江。
HCH_012_043_001686	又南有象江，有泥江，俱流入於清江。
HCH_012_043_001687	東有枉山巡檢司，後遷藍橋，尋復。
HCH_012_043_001688	新喻府西。
HCH_012_043_001689	元新喻州，洪武初，降爲縣。
HCH_012_043_001690	西有銅山，舊產銅。
HCH_012_043_001691	北有蒙山。
HCH_012_043_001692	南有渝水，即袁江，潁江水北流入焉。
HCH_012_043_001693	北有水北墟巡檢司。
HCH_012_043_001694	峽江府南。
HCH_012_043_001695	本新淦縣之峽江巡檢司，嘉靖五年四月改爲縣，析新淦縣六鄉地益之。
HCH_012_043_001696	南有玉笥山，又有贛江，亦名峽江，有黃金水流合焉。
HCH_012_043_001697	袁州府元袁州路，屬江西行省。
HCH_012_043_001698	太祖庚子年爲府。
HCH_012_043_001699	領縣四。
HCH_012_043_001700	東北距布政司三百九十里。
HCH_012_043_001701	宜春倚。
HCH_012_043_001702	南有蟠龍山，又有仰山。
HCH_012_043_001703	又秀江在城北，源出萍鄉縣，流經府西，亦曰稠江，即袁江之上源也。
HCH_012_043_001704	西有黃圃、南有澗富嶺二巡檢司。
HCH_012_043_001705	分宜府東。
HCH_012_043_001706	東有鐘山峽。
HCH_012_043_001707	西有昌山峽。
HCH_012_043_001708	秀江經兩峽中，入新喻縣境，爲渝水。
HCH_012_043_001709	萍鄉府西。
HCH_012_043_001710	元萍鄉州，洪武初降爲縣。
HCH_012_043_001711	東有羅霄山，羅霄水出焉，分二派。
HCH_012_043_001712	東流者爲盧溪水，下流爲秀江，入宜春縣界。
HCH_012_043_001713	西流者入湖廣醴陵縣界，合淥水。
HCH_012_043_001714	又西有萍川水，亦曰楊岐水，西流經縣南，下流合淥水。
HCH_012_043_001715	北有安樂鎮、東南有大安裏二巡檢司。
HCH_012_043_001716	又西有草市巡檢司，後遷於插嶺關，仍故名。
HCH_012_043_001717	又西有湘東市。
HCH_012_043_001718	東有盧溪鎮。
HCH_012_043_001719	萬載府北。
HCH_012_043_001720	北有龍江，下流即瑞州府之蜀江。
HCH_012_043_001721	東北有康樂水入焉。
HCH_012_043_001722	西有鐵山界巡檢司。
HCH_012_043_001723	又有高村鎮巡檢司，尋廢。
HCH_012_043_001724	贛州府元贛州路，屬江西行省。
HCH_012_043_001725	太祖乙巳年爲府。
HCH_012_043_001726	領縣十二。
HCH_012_043_001727	西北距布政司一千一百八十里。
HCH_012_043_001728	贛倚。
HCH_012_043_001729	南有崆峒山，章、貢二水夾山左右，經城之東西。
HCH_012_043_001730	貢水一名東江，自福建長汀縣流入府界。
HCH_012_043_001731	章水一名西江，自湖廣宜章縣流入府界。
HCH_012_043_001732	至城北，合流爲贛江。
HCH_012_043_001733	北有桂源巡檢司，後遷攸鎮。
HCH_012_043_001734	東北有磨刀寨巡檢司，後遷石院鋪。
HCH_012_043_001735	南有長洛巡檢司，後遷縣西黃金鎮。
HCH_012_043_001736	俱仍故名。
HCH_012_043_001737	雩都府東。
HCH_012_043_001738	東北有高沙寶山。
HCH_012_043_001739	又北有雩山，雩水出焉，合寧都、會昌諸水，繞城而西，至贛縣，合於貢水。
HCH_012_043_001740	東北有平頭寨巡檢司。
HCH_012_043_001741	又有印山、又有青塘二巡檢司，後廢。
HCH_012_043_001742	信豐府東南。
HCH_012_043_001743	東有桃江，自龍南縣流入，經縣北，爲信豐江，下流入於貢水。
HCH_012_043_001744	東南有新田巡檢司。
HCH_012_043_001745	西有桃枝墟，又有黃田、覃塘，又東有新設四巡檢司，後廢。
HCH_012_043_001746	興國府東北。
HCH_012_043_001747	北有覆笥山。
HCH_012_043_001748	東北有瀲江，西南流，合雩水入貢江。
HCH_012_043_001749	東有衣錦鄉、東北有回龍寨二巡檢司。
HCH_012_043_001750	會昌府東少南。
HCH_012_043_001751	元會昌州，洪武初降爲縣。
HCH_012_043_001752	南有四望山，下有羊角水隘。
HCH_012_043_001753	北有湘洪水，即貢水，西北流，會雩水。
HCH_012_043_001754	南有湘鄉寨、北有承鄉鎮二巡檢司。
HCH_012_043_001755	又西有河口巡檢司，後廢。
HCH_012_043_001756	安遠府南。
HCH_012_043_001757	元屬寧都州，洪武初改屬府。
HCH_012_043_001758	西有安遠水，亦曰廉水，流入會昌縣之貢水。
HCH_012_043_001759	又南有三百坑水，下流入廣東龍川縣。
HCH_012_043_001760	西北有板口巡檢司。
HCH_012_043_001761	寧都府東北。
HCH_012_043_001762	元寧都州，洪武初降爲縣。
HCH_012_043_001763	西北有金精山。
HCH_012_043_001764	北有梅嶺。
HCH_012_043_001765	南有寧都水，與散水、篔簹、曲陽、黃沙、長樂五水合，又東北有虔化水，下流俱入於雩水。
HCH_012_043_001766	又有梅川水，出梅嶺，下流亦經雩都縣入貢水。
HCH_012_043_001767	東南有下河寨巡檢司。
HCH_012_043_001768	瑞金府東。
HCH_012_043_001769	元屬會昌州，洪武初改屬府。
HCH_012_043_001770	東北有陳石山，綿江出焉，流至縣南入貢水，又西入會昌縣，爲湘洪水。
HCH_012_043_001771	西北有瑞林、東北有湖陂二巡檢司。
HCH_012_043_001772	東南有古城鎮，路出福建長汀縣。
HCH_012_043_001773	龍南府南。
HCH_012_043_001774	元屬寧都州，洪武初改屬府。
