HCH_012_043_000477	又南有南坪關。
HCH_012_043_000478	江津府西南。
HCH_012_043_000479	北濱大江。
HCH_012_043_000480	東南有僰溪口，僰溪入江處，有清平巡檢司。
HCH_012_043_000481	壁山成化十九年三月析巴縣地置。
HCH_012_043_000482	大江在南。
HCH_012_043_000483	涪江在北。
HCH_012_043_000484	又北有壁山巡檢司。
HCH_012_043_000485	永川府西少南。
HCH_012_043_000486	洪武六年十二月置。
HCH_012_043_000487	榮昌府西少南。
HCH_012_043_000488	洪武六年十二月置。
HCH_012_043_000489	西有雒江，即中水。
HCH_012_043_000490	西北有昌寧縣，明玉珍置，洪武七年省。
HCH_012_043_000491	大足明玉珍置，屬合州。
HCH_012_043_000492	洪武四年改屬府。
HCH_012_043_000493	東有米糧關。
HCH_012_043_000494	北有化龍關。
HCH_012_043_000495	安居成化十七年九月析銅梁、遂寧二縣地置。
HCH_012_043_000496	東有安居溪，一名瓊江，下流入涪江。
HCH_012_043_000497	綦江府南少東。
HCH_012_043_000498	元綦江長官司，屬播州。
HCH_012_043_000499	明玉珍改爲縣。
HCH_012_043_000500	洪武中來屬。
HCH_012_043_000501	南有綦江，即僰溪之上流，一名東溪，有東溪巡檢司，後徙縣南之趕水鎮。
HCH_012_043_000502	又南有三溪渡，有綦市關。
HCH_012_043_000503	南川府東南。
HCH_012_043_000504	洪武十年五月省入綦江縣。
HCH_012_043_000505	十三年十一月復置。
HCH_012_043_000506	南有南江，北流爲綦江，中有龍牀灘，在縣北。
HCH_012_043_000507	又東有四十八渡水，流入南江。
HCH_012_043_000508	又南有馬勁關、雀子崗關。
HCH_012_043_000509	北有冷水關。
HCH_012_043_000510	長壽府東少北。
HCH_012_043_000511	洪武六年九月置，屬涪州，尋改屬府。
HCH_012_043_000512	北濱大江。
HCH_012_043_000513	南有樂溫山，下有樂溫灘，大江所經。
HCH_012_043_000514	又東有桃花溪。
HCH_012_043_000515	黔江府東。
HCH_012_043_000516	元屬紹慶府。
HCH_012_043_000517	洪武五年十二月省入彭水縣。
HCH_012_043_000518	十一年九月置黔江守禦千戶所。
HCH_012_043_000519	十四年九月復置縣，來屬。
HCH_012_043_000520	南有黔江，源出貴州思州府界，正流自涪江合大江，支流經此，下流爲湖廣施州衛之清江。
HCH_012_043_000521	又東有石勝關，又有石牙關。
HCH_012_043_000522	西有白巖關。
HCH_012_043_000523	東南有老鷹關，與湖廣施州界。
HCH_012_043_000524	合州府北。
HCH_012_043_000525	元治石照縣。
HCH_012_043_000526	明玉珍省縣入焉。
HCH_012_043_000527	東有釣魚山，嘉陵江經其北，涪江經其南。
HCH_012_043_000528	又東北有嘉渠口，嘉陵江與渠江合流處，經城東南，涪江自西流合焉，亦曰三江口，並流而南，入於大江。
HCH_012_043_000529	南距府百五十里。
HCH_012_043_000530	領縣二：銅梁州南。
HCH_012_043_000531	北有涪江。
HCH_012_043_000532	定遠州北。
HCH_012_043_000533	有舊城。
HCH_012_043_000534	今城本廟兒壩，嘉靖三十年徙此。
HCH_012_043_000535	東有武勝山。
HCH_012_043_000536	西南有涪江。
HCH_012_043_000537	東有嘉陵江。
HCH_012_043_000538	忠州府東。
HCH_012_043_000539	元治臨江縣。
HCH_012_043_000540	洪武中，以縣省入。
HCH_012_043_000541	南濱大江，江中有倒須灘，西北有鳴玉溪流入江。
HCH_012_043_000542	西有臨江巡檢司。
HCH_012_043_000543	西距府八百里。
HCH_012_043_000544	領縣二：酆都州西南。
HCH_012_043_000545	元曰豐都。
HCH_012_043_000546	洪武十年五月省入涪州。
HCH_012_043_000547	十三年十一月復置，曰酆都。
HCH_012_043_000548	南濱大江，有葫蘆溪自西南流入焉。
HCH_012_043_000549	東南有南賓縣，洪武中省。
HCH_012_043_000550	又有沙子關巡檢司。
HCH_012_043_000551	墊江州西少北。
HCH_012_043_000552	明玉珍置，屬州。
HCH_012_043_000553	南有高灘溪，西南入長壽界，爲桃花溪。
HCH_012_043_000554	涪州大江自長壽縣流入，東逕黃草峽，又東逕鐵櫃山，又東逕州城北，繞城而東，又南有涪陵江流合焉，江口有銅柱灘。
HCH_012_043_000555	又東南有清溪關。
HCH_012_043_000556	西南有白雲關。
HCH_012_043_000557	又西有陽關。
HCH_012_043_000558	西距府四百三十里。
HCH_012_043_000559	領縣二：武隆州南。
HCH_012_043_000560	元曰武龍。
HCH_012_043_000561	洪武十年五月省入彭水縣。
HCH_012_043_000562	十三年十一月復置，曰武隆。
HCH_012_043_000563	西南有涪陵江，亦曰黔江，亦曰巴江。
HCH_012_043_000564	彭水州南。
HCH_012_043_000565	元紹慶府治此，屬四川南道宣慰司。
HCH_012_043_000566	洪武四年，府廢，改屬重慶府。
HCH_012_043_000567	洪武十年五月來屬。
HCH_012_043_000568	東有伏牛山，山左右有鹽井。
HCH_012_043_000569	城西有涪陵江。
HCH_012_043_000570	又東南有水德江，源自貴州思南流入涪陵江。
HCH_012_043_000571	東南有天池關。
HCH_012_043_000572	東北有亭子關。
HCH_012_043_000573	遵義軍民府元播州宣慰司，屬湖廣行省。
HCH_012_043_000574	洪武五年正月改屬四川。
HCH_012_043_000575	十五年二月改屬貴州都司。
HCH_012_043_000576	二十七年四月改屬四川布政司。
HCH_012_043_000577	萬曆二十九年四月改置遵義軍民府。
HCH_012_043_000578	領州一，縣四。
HCH_012_043_000579	西北距布政司千七百里。
HCH_012_043_000580	遵義倚。
HCH_012_043_000581	元播州總管。
HCH_012_043_000582	洪武五年正月改爲播州長官司。
HCH_012_043_000583	萬曆二十九年四月改縣，與府同徙治白田壩，在故司城之西。
HCH_012_043_000584	北有龍巖山。
HCH_012_043_000585	其東爲定軍山，又有大樓山，上有太平關，亦曰樓山關。
HCH_012_043_000586	又東有烏江，源自貴州水西，即涪陵江上源，中有九接灘，其南有烏江關。
HCH_012_043_000587	又東南有仁江，東有湘江、洪江，皆流合於烏江。
HCH_012_043_000588	又西南有落閩水，東有樂安水，亦俱流入焉。
HCH_012_043_000589	又東南有河度關。
HCH_012_043_000590	西南有老君關。
HCH_012_043_000591	又東有三度關。
HCH_012_043_000592	西有落濛關。
HCH_012_043_000593	西北有崖門關、黑水關。
HCH_012_043_000594	北有海龍囤，有白石口隘。
HCH_012_043_000595	桐梓府東。
HCH_012_043_000596	萬曆二十九年四月以舊夜郎縣望草地置。
HCH_012_043_000597	北有僰溪，源出山箐，綦江之上流。
HCH_012_043_000598	真安州元珍州思寧長官司。
HCH_012_043_000599	明玉珍改真州。
HCH_012_043_000600	洪武十七年置真州長官司。
HCH_012_043_000601	萬曆二十九年四月改置。
HCH_012_043_000602	南有芙蓉江，自烏江分流，東北入於黔江。
HCH_012_043_000603	又有三江，東南流合於虎溪，亦注於黔江。
HCH_012_043_000604	西南距府二百里。
HCH_012_043_000605	領縣二：綏陽府東北。
HCH_012_043_000606	萬曆二十九年四月以舊綏陽縣地置。
HCH_012_043_000607	東有水德江，亦曰涪江，亦曰小烏江，流入彭水縣界。
HCH_012_043_000608	仁懷州西。
HCH_012_043_000609	萬曆二十九年四月以舊懷陽縣地置。
HCH_012_043_000610	東南有芙蓉江，西南有仁水，其下流俱注於烏江。
HCH_012_043_000611	敘州府元敘州路，屬敘南等處蠻夷宣撫司。
HCH_012_043_000612	至元二十三年正月降爲縣。
HCH_012_043_000613	洪武六年六月置府。
HCH_012_043_000614	領州一，縣九。
HCH_012_043_000615	北距布政司千二百里。
HCH_012_043_000616	宜賓倚。
HCH_012_043_000617	弘治四年八月建申王府，未之國，除。
HCH_012_043_000618	西有失提山，舊產銀。
HCH_012_043_000619	西南有石城山。
HCH_012_043_000620	又西北有朝陽崖，大江經其下，又東經城東南，馬湖江來合焉。
HCH_012_043_000621	又西南有石門江，俗呼橫江，北入馬湖江。
HCH_012_043_000622	又東南有黑水，一名南廣溪，北入江。
HCH_012_043_000623	又西北有宣化縣，洪武中省，有宣化巡檢司。
HCH_012_043_000624	又西南有橫江鎮巡檢司。
HCH_012_043_000625	又南有摸索關。
HCH_012_043_000626	南溪府東。
HCH_012_043_000627	東濱大江，中有石筍灘，在縣西。
HCH_012_043_000628	又有銅鼓灘，在縣東。
HCH_012_043_000629	又南有青衣水，流入大江。
HCH_012_043_000630	慶符府南。
HCH_012_043_000631	洪武十年五月省入宜賓縣。
HCH_012_043_000632	十三年十一月復置。
HCH_012_043_000633	南有石門山，石門江經其下。
HCH_012_043_000634	又西北有馬鳴溪，流入馬湖江。
HCH_012_043_000635	富順府東北。
HCH_012_043_000636	元富順州。
HCH_012_043_000637	洪武中降爲縣。
HCH_012_043_000638	西南有虎頭山。
HCH_012_043_000639	東有金川，亦曰中水，即雒江也。
HCH_012_043_000640	又西有榮溪，東有鰲溪，俱流合焉。
HCH_012_043_000641	又西有鹽井。
HCH_012_043_000642	東有趙化鎮巡檢司。
HCH_012_043_000643	長寧府東南。
HCH_012_043_000644	元長寧軍，屬馬湖路。
HCH_012_043_000645	泰定二年十月改爲州。
HCH_012_043_000646	洪武五年降爲縣。
HCH_012_043_000647	治東西有二溪，並冷水溪，三溪合流入大江，曰三江口。
HCH_012_043_000648	又東出虞公峽，曰淯溪，亦曰武寧溪，其下流入於大江。
HCH_012_043_000649	又治北有淯井，產鹽。
HCH_012_043_000650	東有梅洞堡巡檢司。
HCH_012_043_000651	興文府東南。
HCH_012_043_000652	元戎州，屬馬湖路。
HCH_012_043_000653	洪武四年降爲縣，來屬。
HCH_012_043_000654	萬曆二年二月改曰興文。
HCH_012_043_000655	南有南壽山，又有思早江，又東有水車河，俱流入淯溪。
HCH_012_043_000656	西有武寧城，萬曆二年二月築，置建武守禦千戶所於此。
HCH_012_043_000657	所南有九絲城，所東南有李子關。
HCH_012_043_000658	縣東北有板橋巡檢司，後遷兩河口，仍故名。
HCH_012_043_000659	隆昌府東北。
HCH_012_043_000660	本富順縣隆橋馬驛。
HCH_012_043_000661	隆慶元年置縣，析榮昌、富順二縣及瀘州地屬之。
HCH_012_043_000662	西南有雒江。
HCH_012_043_000663	高州元屬敘南宣撫司。
HCH_012_043_000664	洪武五年降爲縣，屬府。
HCH_012_043_000665	正德十三年四月復爲州。
HCH_012_043_000666	舊治懷遠寨。
HCH_012_043_000667	正德十三年遷治中壩。
HCH_012_043_000668	東有復寧溪，即黑水之上流。
HCH_012_043_000669	南有江口巡檢司。
HCH_012_043_000670	北距府百五十里。
HCH_012_043_000671	領縣二：筠連州西。
HCH_012_043_000672	元筠連州，治騰川縣，屬永寧路，尋廢縣存州。
HCH_012_043_000673	洪武四年降州爲縣，屬敘州府。
HCH_012_043_000674	六年十二月改屬綿州，尋仍屬敘州府。
HCH_012_043_000675	十年五月省入高縣。
HCH_012_043_000676	十三年十一月復置，仍屬敘州府。
HCH_012_043_000677	正德十三年四月來屬。
HCH_012_043_000678	西有定川溪，下流與淯溪合。
HCH_012_043_000679	東南有三岔巡檢司。
HCH_012_043_000680	珙州東。
HCH_012_043_000681	元下羅計長官司，屬敘南宣撫司。
HCH_012_043_000682	明玉珍改爲珙州。
HCH_012_043_000683	洪武四年降爲縣。
HCH_012_043_000684	十年五月省入高縣。
HCH_012_043_000685	十三年十一月復置，屬府。
HCH_012_043_000686	正德十三年四月來屬。
HCH_012_043_000687	西南有珙溪，下流入淯溪。
HCH_012_043_000688	南有鹽水壩巡檢司，後遷歇馬堡，仍故名。
HCH_012_043_000689	龍安府元龍州，屬廣元路。
HCH_012_043_000690	明玉珍置龍州宣慰司。
HCH_012_043_000691	洪武六年十二月復置龍州。
HCH_012_043_000692	十四年正月改松潘等處安撫司。
HCH_012_043_000693	二十年正月仍改爲龍州。
HCH_012_043_000694	二十二年九月改龍州軍民千戶所。
HCH_012_043_000695	二十八年十月升龍州軍民指揮使司，後復曰龍州。
HCH_012_043_000696	宣德七年改龍州宣撫司，直隸布政司。
HCH_012_043_000697	嘉靖四十五年十二月改曰龍安府。
HCH_012_043_000698	領縣三。
HCH_012_043_000699	南距布政司四百八十里。
HCH_012_043_000700	平武倚。
HCH_012_043_000701	本名寧武，萬曆十八年四月置，後更名。
HCH_012_043_000702	州舊治在江油縣界之雍村。
HCH_012_043_000703	洪武六年徙於青州所。
HCH_012_043_000704	二十二年又徙於盤龍壩箭樓山之麓，即今治也。
HCH_012_043_000705	東南有馬盤山，又有石門山。
HCH_012_043_000706	東有涪江，有青川溪，下流合白水，入嘉陵江。
HCH_012_043_000707	西北有胡空關，又有黃陽關。
HCH_012_043_000708	東有鐵蛇關，西有大魚關，羊昌關、和平關，俱永樂中置。
HCH_012_043_000709	又東有棧閣，道出陝西文縣。
HCH_012_043_000710	又西有永濟橋，鐵索爲之，達松潘衛。
HCH_012_043_000711	又東有青川守禦千戶所，洪武四年十月以舊青川縣置，屬四川都司。
HCH_012_043_000712	嘉靖四十五年十二月來屬。
HCH_012_043_000713	所東有白水江。
HCH_012_043_000714	東北有明月關巡檢司。
HCH_012_043_000715	南有杲陽關。
HCH_012_043_000716	北有北雄關，接陝西文縣界。
HCH_012_043_000717	又有控夷關，萬曆中置。
HCH_012_043_000718	江油府東南。
HCH_012_043_000719	元省。
HCH_012_043_000720	明玉珍復置。
HCH_012_043_000721	洪武十年五月省入梓潼縣。
HCH_012_043_000722	十三年十一月復置，屬劍州。
HCH_012_043_000723	嘉靖四十五年十二月來屬。
HCH_012_043_000724	西有大匡山，與彰明縣界。
HCH_012_043_000725	東北有竇圌山。
HCH_012_043_000726	北有涪水，水上有涪水關。
HCH_012_043_000727	石泉府西南。
HCH_012_043_000728	元屬安州。
HCH_012_043_000729	洪武中，州廢，改屬成都府。
HCH_012_043_000730	嘉靖四十五年十二月來屬。
HCH_012_043_000731	北有三面山，龍安水出焉。
HCH_012_043_000732	又東有湔水，東至江陽入江，有馬坪口巡檢司。
HCH_012_043_000733	北有松嶺關。
HCH_012_043_000734	西有石板關。
HCH_012_043_000735	東有奠邊關。
HCH_012_043_000736	東北有大方關。
HCH_012_043_000737	西北有上雄關。
HCH_012_043_000738	馬湖府元馬湖路，屬敘南宣撫司。
HCH_012_043_000739	洪武四年十二月爲府。
HCH_012_043_000740	領縣一，長官司四。
HCH_012_043_000741	東北距布政司千一百里。
HCH_012_043_000742	屏山倚。
HCH_012_043_000743	本泥溪長官司，洪武四年十二月置。
HCH_012_043_000744	萬曆十七年三月改縣。
HCH_012_043_000745	西有雷番山。
HCH_012_043_000746	南有馬湖江，其上源自黎州西徼外流入界，至此合金沙江，經府城東入宜賓縣界。
HCH_012_043_000747	中有結髮灘、鐵鎖灘、雞肝石灘，俱在府西。
HCH_012_043_000748	又有馬湖，湖在山頂，亦曰龍湖。
HCH_012_043_000749	東有悔泥溪巡檢司。
HCH_012_043_000750	又東有龍關。
HCH_012_043_000751	西有鳳關。
HCH_012_043_000752	又北有新鄉鎮，萬曆十七年三月建城，置戍焉。
HCH_012_043_000753	平夷長官司府西。
HCH_012_043_000754	洪武四年十二月置。
HCH_012_043_000755	舊治在司東。
HCH_012_043_000756	萬曆中，移於今治。
HCH_012_043_000757	南有馬湖江，又南有大汶溪，東有小汶溪，俱流合焉。
HCH_012_043_000758	蠻夷長官司府西少南。
HCH_012_043_000759	洪武四年十二月置。
HCH_012_043_000760	南濱馬湖江，西有什葛溪，東有大鹿溪，俱流合焉。
HCH_012_043_000761	南有戎寧巡檢司。
HCH_012_043_000762	沐川長官司府西少北。
HCH_012_043_000763	元置。
HCH_012_043_000764	洪武四年十二月改爲州，尋復。
HCH_012_043_000765	北有沐川，下流入大江。
HCH_012_043_000766	東有芭蕉溪，下流入馬湖江。
HCH_012_043_000767	雷坡長官司府西南。
HCH_012_043_000768	洪武四年十二月置。
HCH_012_043_000769	二十六年省。
HCH_012_043_000770	鎮雄府元芒部路，屬雲南行省。
HCH_012_043_000771	洪武十五年正月爲府。
HCH_012_043_000772	十六年正月改屬四川布政司。
HCH_012_043_000773	十七年五月升爲軍民府。
HCH_012_043_000774	嘉靖五年四月改府名。
HCH_012_043_000775	萬曆三十七年五月罷稱軍民府。
HCH_012_043_000776	北有樂安山，與敘州府界。
HCH_012_043_000777	又西有白水，亦曰八匡河，源出烏撒界，流經此，境內諸川俱流入焉，下流至敘州府入大江。
HCH_012_043_000778	又南有苴鬥河，下流入烏撒之七星關河。
HCH_012_043_000779	又北有鹼泉二，俱產鹽。
HCH_012_043_000780	有益良州、強州，元俱屬芒部路，洪武十七年後廢。
HCH_012_043_000781	又有阿頭、易溪、易娘三蠻部，元屬烏撒路，洪武十五年三月屬芒部府。
HCH_012_043_000782	十七年又改阿頭部爲阿都府，屬四川布政司。
HCH_012_043_000783	後俱廢。
HCH_012_043_000784	南有阿赫關，與烏撒界。
HCH_012_043_000785	領長官司五。
HCH_012_043_000786	北距布政司千五百八十里。
HCH_012_043_000787	白水江肸酬長官司正德十六年十一月置。
HCH_012_043_000788	懷德長官司府西。
HCH_012_043_000789	本卻佐寨。
HCH_012_043_000790	威信長官司府南。
HCH_012_043_000791	本母響寨。
HCH_012_043_000792	歸化長官司府西南。
HCH_012_043_000793	本夷良寨。
HCH_012_043_000794	安靜長官司府西北。
HCH_012_043_000795	本落角寨。
HCH_012_043_000796	四司，俱嘉靖五年四月改置。
HCH_012_043_000797	烏蒙軍民府元烏蒙路，後至元元年九月屬四川行省。
HCH_012_043_000798	洪武十五年正月爲府，屬雲南布政司。
HCH_012_043_000799	十六年正月改屬四川布政司。
HCH_012_043_000800	十七年五月升爲軍民府。
HCH_012_043_000801	西有涼山。
HCH_012_043_000802	北有界堆山，與敘州府界。
HCH_012_043_000803	西南有金沙江，下流合於馬湖江。
HCH_012_043_000804	南有索橋，金沙江渡處。
HCH_012_043_000805	北有羅佐關。
HCH_012_043_000806	有歸化州，洪武十五年三月置，屬府，尋廢。
HCH_012_043_000807	東北距布政司千三百里。
HCH_012_043_000808	烏撒軍民府元烏撒路，後至元元年九月屬四川行省。
HCH_012_043_000809	洪武十五年正月爲府，屬雲南布政司。
HCH_012_043_000810	十六年正月改屬四川布政司。
HCH_012_043_000811	十七年五月升爲軍民府。
HCH_012_043_000812	西有盤江，出府西亂山中，經府南爲可渡河，入貴州畢節衛界。
HCH_012_043_000813	有可渡河巡檢司。
HCH_012_043_000814	又西有趙班巡檢司。
HCH_012_043_000815	又有阿赫關、鄔撒二巡檢司。
HCH_012_043_000816	東南有七星關。
HCH_012_043_000817	東有老鴉關，又有善欲關，皆與貴州畢節衛界。
HCH_012_043_000818	又南有倘唐驛，路出雲南沾益州。
HCH_012_043_000819	東北距布政司千八百五十里。
HCH_012_043_000820	東川軍民府元東川路，屬雲南行省。
HCH_012_043_000821	洪武十五年正月爲府。
HCH_012_043_000822	十七年五月升爲軍民府，改屬四川布政司。
HCH_012_043_000823	二十一年六月廢。
HCH_012_043_000824	二十六年五月復置。
HCH_012_043_000825	西南有馬鞍山，府舊治在焉。
HCH_012_043_000826	尋移治萬額山之南。
HCH_012_043_000827	又西南有絳雲弄山，接雲南祿勸州界，下臨金沙江。
HCH_012_043_000828	又東南有牛欄江，自雲南尋甸府流入，至府北合金沙江。
HCH_012_043_000829	有藤索橋，在東北牛欄江上。
HCH_012_043_000830	東北距布政司千四百里。
HCH_012_043_000831	潼川州元潼川府，直隸四川行省。
HCH_012_043_000832	洪武九年四月降爲州，以州治郪縣省入，直隸布政司。
HCH_012_043_000833	北有涪江，南有中江流合焉。
HCH_012_043_000834	又西南有郪江，有鹽井。
HCH_012_043_000835	西南距布政司三百里。
HCH_012_043_000836	領縣七：射洪州南。
HCH_012_043_000837	洪武十年五月省入鹽亭縣。
HCH_012_043_000838	十三年十一月復置。
HCH_012_043_000839	東有涪江。
HCH_012_043_000840	又東南有射江，亦曰瀰江，亦曰梓潼水，自鹽亭縣流入，經縣東南之獨坐山，合於涪江。
HCH_012_043_000841	又東南有瀋水，亦入涪江。
HCH_012_043_000842	有鹽井。
HCH_012_043_000843	中江州西。
HCH_012_043_000844	洪武十年五月省入州。
HCH_012_043_000845	十三年十一月復置。
HCH_012_043_000846	西南有可蒙山、銅官山，南有賴應山、私熔山，俱產銅。
HCH_012_043_000847	東南有中江，南有郪江，有鹽井。
HCH_012_043_000848	鹽亭州東少北。
HCH_012_043_000849	北有紫金山。
HCH_012_043_000850	南有梓潼水。
HCH_012_043_000851	東有鹽亭水，自劍州南境流入，亦謂之瀰江。
HCH_012_043_000852	城東有鹽井。
HCH_012_043_000853	遂寧州東南。
HCH_012_043_000854	元遂寧州。
HCH_012_043_000855	明玉珍省州治小溪縣入焉。
HCH_012_043_000856	洪武九年四月降州爲縣。
HCH_012_043_000857	東有銅盤山，又有涪江，北有郪江流入焉，謂之郪口。
HCH_012_043_000858	西有倒流溪，有鹽井。
HCH_012_043_000859	蓬溪州東南。
HCH_012_043_000860	元屬遂寧州。
HCH_012_043_000861	洪武十年五月省入遂寧縣。
HCH_012_043_000862	十三年十一月復置，徙治故城之西南。
HCH_012_043_000863	西有明月山，下爲明月池。
HCH_012_043_000864	又有伏龍山，下有火井。
HCH_012_043_000865	北有蓬溪，下流合於涪江，有鹽井。
HCH_012_043_000866	安岳州南。
HCH_012_043_000867	洪武四年於縣置普州。
HCH_012_043_000868	九年，州廢。
HCH_012_043_000869	西有岳陽溪，下流合於涪江，有鹽井。
HCH_012_043_000870	樂至州南少西。
HCH_012_043_000871	成化元年七月置，屬州。
HCH_012_043_000872	正德九年改屬簡州。
HCH_012_043_000873	嘉靖元年四月還屬。
HCH_012_043_000874	有鹽井。
HCH_012_043_000875	眉州元屬嘉定府路。
HCH_012_043_000876	洪武九年四月降爲縣，仍屬嘉定州。
HCH_012_043_000877	十三年十一月復爲州，直隸布政司。
HCH_012_043_000878	東有蟆頤山，西面臨江，下爲蟆頤津。
HCH_012_043_000879	南有峨眉山。
HCH_012_043_000880	東有玻璃江，即大江也。
HCH_012_043_000881	南有思濛江，西南有金流江，一名難江，下流俱入大江。
HCH_012_043_000882	東南有魚耶鎮巡檢司。
HCH_012_043_000883	北距布政司百八十里。
HCH_012_043_000884	領縣三：彭山州北。
HCH_012_043_000885	洪武十年五月省入眉縣。
HCH_012_043_000886	十三年十一月復置。
HCH_012_043_000887	東有彭亡山，亦曰平無山，俗呼爲平模山。
HCH_012_043_000888	北有天社山。
HCH_012_043_000889	南有打鼻山。
HCH_012_043_000890	東北濱大江，內江自雙流縣流入焉，即牧馬川也，合流而南，亦曰武陽江，江中有鼓樓灘。
HCH_012_043_000891	又有赤水，亦自東北流入大江。
HCH_012_043_000892	丹棱州西。
HCH_012_043_000893	洪武六年十二月置，屬嘉定府。
HCH_012_043_000894	十年五月省入眉縣。
HCH_012_043_000895	十三年十一月復置，來屬。
HCH_012_043_000896	東南有青衣水，源出盧山縣，流經此，下流至嘉定州入大江。
HCH_012_043_000897	青神州南。
HCH_012_043_000898	洪武十年五月省入嘉定州。
HCH_012_043_000899	十三年十一月復還屬。
HCH_012_043_000900	西有熊耳山，青衣水經其下。
HCH_012_043_000901	又東有大江。
HCH_012_043_000902	東南有松柏灘。
HCH_012_043_000903	東有犁頭灣巡檢司。
HCH_012_043_000904	邛州元屬嘉定府路。
HCH_012_043_000905	洪武九年四月降爲縣，仍屬嘉定州。
HCH_012_043_000906	成化十九年二月復爲州，直隸布政司。
HCH_012_043_000907	西有古城山，產鐵。
HCH_012_043_000908	又東南有銅官山，產銅。
HCH_012_043_000909	西有相臺山，下有火井，又有鹽井。
HCH_012_043_000910	南有邛水，自雅州流入，至新津縣入大江。
HCH_012_043_000911	南有夾門關巡檢司。
HCH_012_043_000912	西有火井壩巡檢司。
HCH_012_043_000913	後移於州南二十五里。
HCH_012_043_000914	東北距布政司三百里。
HCH_012_043_000915	領縣二：大邑州北少東。
HCH_012_043_000916	洪武十年五月省入邛縣。
HCH_012_043_000917	十三年十一月復置，屬嘉定州。
HCH_012_043_000918	成化十九年二月還屬。
HCH_012_043_000919	西北有鶴鳴山，與崇慶州界。
HCH_012_043_000920	東有牙江，下流入邛水。
HCH_012_043_000921	蒲江州東南。
HCH_012_043_000922	元省入州。
HCH_012_043_000923	洪武六年十二月復置，屬嘉定府。
HCH_012_043_000924	成化十九年二月還屬。
HCH_012_043_000925	南有蒲水，源出名山縣，流經此，東入邛州界。
HCH_012_043_000926	西有雙路巡檢司。
HCH_012_043_000927	嘉定州元嘉定府路。
HCH_012_043_000928	洪武四年爲府。
HCH_012_043_000929	九年四月降爲州，以州治龍遊縣省入，直隸布政司。
HCH_012_043_000930	東有三龜山。
HCH_012_043_000931	又有九頂山。
HCH_012_043_000932	大江在城東，亦曰通江。
HCH_012_043_000933	又西有陽江，即大渡河，自峨眉縣流入，經城東烏尤山下，合於大江。
HCH_012_043_000934	又西南有青衣水，至城西雙湖，與陽江合。
HCH_012_043_000935	東南有金石井巡檢司，後廢。
HCH_012_043_000936	北距布政司二百六十里。
HCH_012_043_000937	領縣六：峨眉州西。
