HCH_012_043_000001	四川《禹貢》樑、荊二州之域。
HCH_012_043_000002	元置四川等處行中書省。
HCH_012_043_000003	治成都路。
HCH_012_043_000004	又置羅羅蒙慶等處宣慰司，治建昌路。
HCH_012_043_000005	屬雲南行中書省。
HCH_012_043_000006	洪武四年六月平明升。
HCH_012_043_000007	七月置四川等處行中書省。
HCH_012_043_000008	九月置成都都衛。
HCH_012_043_000009	與行中書省同治。
HCH_012_043_000010	八年十月改都衛爲四川都指揮使司。
HCH_012_043_000011	領招討司一，宣慰司二，安撫司五，長官司二十二及諸衛所。
HCH_012_043_000012	九年六月改行中書省爲承宣布政使司。
HCH_012_043_000013	領府十三，直隸州六，宣撫司一，安撫司一，屬州十五，縣百十一，長官司十六。
HCH_012_043_000014	爲裏千一百五十有奇。
HCH_012_043_000015	北至廣元，與陝西界。
HCH_012_043_000016	東至巫山，與湖廣界。
HCH_012_043_000017	南至烏撒、東川，與貴州、雲南界。
HCH_012_043_000018	西至威茂，與西番界。
HCH_012_043_000019	距南京七千二百六十里，京師一萬七百一十里。
HCH_012_043_000020	洪武二十六年編戶二十一萬五千七百一十九，口一百四十六萬六千七百七十八。
HCH_012_043_000021	弘治四年，戶二十五萬三千八百三，口二百五十九萬八千四百六十。
HCH_012_043_000022	萬曆六年，戶二十六萬二千六百九十四，口三百一十萬二千七十三。
HCH_012_043_000023	成都府元成都路。
HCH_012_043_000024	洪武四年爲府。
HCH_012_043_000025	領州六，縣二十五：成都倚。
HCH_012_043_000026	洪武十一年建蜀王府。
HCH_012_043_000027	華陽倚。
HCH_012_043_000028	北有武擔山。
HCH_012_043_000029	又有外江，自灌縣分流經城北，繞城而南，一名清遠江。
HCH_012_043_000030	又有內江，亦自灌縣分流經城南，繞城而東，亦名石犀渠。
HCH_012_043_000031	合流南注於大江。
HCH_012_043_000032	此府城之內、外江也。
HCH_012_043_000033	東有寧州衛，洪武十一年四月置。
HCH_012_043_000034	東南有馬軍寨巡檢司。
HCH_012_043_000035	雙流府西南。
HCH_012_043_000036	洪武十年五月省入華陽縣。
HCH_012_043_000037	十三年十一月復置。
HCH_012_043_000038	東南有牧馬川，即府在內、外江下流也。
HCH_012_043_000039	郫府西。
HCH_012_043_000040	有內江，一名郫江，即府城內江之上流也。
HCH_012_043_000041	溫江府西少南。
HCH_012_043_000042	西南有皁江，亦曰內江。
HCH_012_043_000043	新繁府西北。
HCH_012_043_000044	洪武十年五月省入成都縣。
HCH_012_043_000045	十三年十一月復置。
HCH_012_043_000046	西北有沱江。
HCH_012_043_000047	又西有湔㳛口。
HCH_012_043_000048	新都府北。
HCH_012_043_000049	東有雒水，自什邡縣流經此，下流至瀘州入大江，亦曰中水。
HCH_012_043_000050	北有湔水，即大江別流，自灌縣東北出，流經此，至漢州入雒水。
HCH_012_043_000051	東北有綿水，自漢州流至此入雒江。
HCH_012_043_000052	三水同流，亦曰郫江也。
HCH_012_043_000053	彭府北。
HCH_012_043_000054	元彭州。
HCH_012_043_000055	洪武十年五月降爲縣。
HCH_012_043_000056	北有九隴山，有葛王貴山，又有大隋山、中隋山。
HCH_012_043_000057	南有沱江，又北有濛水流合焉。
HCH_012_043_000058	又東有濛陽縣，元屬彭州。
HCH_012_043_000059	洪武十年五月省。
HCH_012_043_000060	又北有白石溝巡檢司。
HCH_012_043_000061	崇寧府西北。
HCH_012_043_000062	元屬彭州。
HCH_012_043_000063	洪武四年屬府。
HCH_012_043_000064	十年五月省入灌縣。
HCH_012_043_000065	十三年十一月復置。
HCH_012_043_000066	南有沱江。
HCH_012_043_000067	灌府西少北。
HCH_012_043_000068	元灌州。
HCH_012_043_000069	洪武中，降爲縣。
HCH_012_043_000070	西北有灌口山。
HCH_012_043_000071	又有玉壘山，下有玉壘關，一名七盤關。
HCH_012_043_000072	又西南有青城山。
HCH_012_043_000073	又西有湔江，亦曰都江，亦曰湔堋江，古離堆也。
HCH_012_043_000074	岷江經此，正流引而南，支流分三道，繞成都境。
HCH_012_043_000075	有石渠水口。
HCH_012_043_000076	又有白沙水，下流入都江。
HCH_012_043_000077	又南有沱江，即郫江上源也。
HCH_012_043_000078	又西有蠶崖關巡檢司。
HCH_012_043_000079	西南有獠澤關。
HCH_012_043_000080	金堂府東。
HCH_012_043_000081	洪武十年五月省入新都縣。
HCH_012_043_000082	十三年十一月復置。
HCH_012_043_000083	東北有三學山。
HCH_012_043_000084	南有云頂山。
HCH_012_043_000085	有金堂峽，雒水經此，曰金堂河。
HCH_012_043_000086	東南又有懷口巡檢司。
HCH_012_043_000087	仁壽府南少東。
HCH_012_043_000088	東有麗甘山，下有鹽井。
HCH_012_043_000089	東有三嵎山，又有蟠溪，下流入資江。
HCH_012_043_000090	又南有陵井，產鹽，亦曰仙井。
HCH_012_043_000091	井研府南少東。
HCH_012_043_000092	洪武六年十二月置。
HCH_012_043_000093	十年五月省入仁壽縣。
HCH_012_043_000094	十三年十一月復置。
HCH_012_043_000095	東北有鐵山，舊產鐵。
HCH_012_043_000096	南有鹽井。
HCH_012_043_000097	資府東。
HCH_012_043_000098	明玉珍置資州。
HCH_012_043_000099	洪武初，降爲縣。
HCH_012_043_000100	南有珠江，即雒江也，東流爲資江。
HCH_012_043_000101	東有銀山鎮巡檢司。
HCH_012_043_000102	內江府東南。
HCH_012_043_000103	洪武中置。
HCH_012_043_000104	西有中江，即雒之異名。
HCH_012_043_000105	南有椑木鎮巡檢司。
HCH_012_043_000106	安府北少東。
HCH_012_043_000107	元安州，治在西北。
HCH_012_043_000108	洪武中，降爲縣，移於今治。
HCH_012_043_000109	南有浮山，黑水出焉，南流入羅江縣界。
HCH_012_043_000110	北有曲山關。
HCH_012_043_000111	東有小東壩關。
HCH_012_043_000112	又東南有睢水關，關西有綿堰堡，綿水發源處也。
HCH_012_043_000113	簡州洪武六年降爲縣。
HCH_012_043_000114	正德八年又升爲州。
HCH_012_043_000115	舊治在絳河北。
HCH_012_043_000116	正德八年徙治河南。
HCH_012_043_000117	東北有石鼓山。
HCH_012_043_000118	西有分棟山。
HCH_012_043_000119	東有雁水，即雒水也，絳水自北來合焉，一名赤水，亦曰牛鞞水。
HCH_012_043_000120	又城內有牛皮井，產鹽。
HCH_012_043_000121	西有龍泉鎮巡檢司。
HCH_012_043_000122	西南有陽安關。
HCH_012_043_000123	西北距府百五十里。
HCH_012_043_000124	領縣一：資陽州東。
HCH_012_043_000125	洪武六年十二月置，屬府。
HCH_012_043_000126	十年五月省入簡縣。
HCH_012_043_000127	成化元年七月復置，仍屬府。
HCH_012_043_000128	正德中，改屬州。
HCH_012_043_000129	西有資溪，流入雁水。
HCH_012_043_000130	東有資陽鎮巡檢司，後移治濛溪河。
HCH_012_043_000131	崇慶州元治晉原縣。
HCH_012_043_000132	洪武中省縣入州。
HCH_012_043_000133	西有鶴鳴山。
HCH_012_043_000134	西北有鄩江，東流入新津界。
HCH_012_043_000135	又北有味江，東北有白馬江，皆岷江南出之別名也。
HCH_012_043_000136	西北有永康縣。
HCH_012_043_000137	東南有江源縣，明玉珍復置，洪武初省。
HCH_012_043_000138	西有清溪口巡檢司。
HCH_012_043_000139	東北距府百十里。
HCH_012_043_000140	領縣一：新津州東。
HCH_012_043_000141	南有天社山。
HCH_012_043_000142	南枕大江，一名皁江。
HCH_012_043_000143	東有北江，亦曰新穿水，自府城南流經此合大江。
HCH_012_043_000144	漢州明玉珍復置雒縣，爲州治。
HCH_012_043_000145	洪武四年省縣入州。
HCH_012_043_000146	東有雒水，有綿水。
HCH_012_043_000147	又西南有湔水，流入雒。
HCH_012_043_000148	又北有雁水，亦流入雒，故雒水亦兼雁水之名。
HCH_012_043_000149	又東北有石亭水，流合綿水。
HCH_012_043_000150	東南有三水關巡檢司。
HCH_012_043_000151	西南距府百十里。
HCH_012_043_000152	領縣三：什邡州西。
HCH_012_043_000153	洪武十年五月省入綿竹縣。
HCH_012_043_000154	十三年十一月復置。
HCH_012_043_000155	西北有章山，雒水出此，亦名雒通山。
HCH_012_043_000156	南有高鏡關，雒水經其南。
HCH_012_043_000157	又西有大逢山。
HCH_012_043_000158	綿竹州西北。
HCH_012_043_000159	西北有紫巖山，綿水出焉。
HCH_012_043_000160	又有紫溪河，一名射水河。
HCH_012_043_000161	又北有睢水關。
HCH_012_043_000162	德陽州東北。
HCH_012_043_000163	洪武十年五月省入漢州。
HCH_012_043_000164	十三年十一月復置。
HCH_012_043_000165	北有鹿頭山，上有鹿頭關。
HCH_012_043_000166	東有綿水。
HCH_012_043_000167	西南有石亭水。
HCH_012_043_000168	南有白馬關巡檢司。
HCH_012_043_000169	綿州元屬潼川府。
HCH_012_043_000170	洪武三年來屬。
HCH_012_043_000171	十年五月降爲縣。
HCH_012_043_000172	十三年十一月復爲州。
HCH_012_043_000173	東有富樂山。
HCH_012_043_000174	西有涪水，源出松潘衛，泫經此，亦曰綿江，下流至合州，合於嘉陵江。
HCH_012_043_000175	又西北有安昌水，一名龍安水，東南流合涪水。
HCH_012_043_000176	又東有潺水，亦合於涪水。
HCH_012_043_000177	東有魏城巡檢司。
HCH_012_043_000178	西南距府三百六十里。
HCH_012_043_000179	領縣二：羅江州南。
HCH_012_043_000180	洪武六年十二月省入綿州。
HCH_012_043_000181	十三年十一月復置。
HCH_012_043_000182	東北有羅江，涪水與安昌水會流處也。
HCH_012_043_000183	又西有黑水，自安縣流入界。
HCH_012_043_000184	又西南有白馬關巡檢司，關與德陽縣鹿頭關相對。
HCH_012_043_000185	彰明州北。
HCH_012_043_000186	洪武十年五月省入綿縣。
HCH_012_043_000187	十三年十一月復置。
HCH_012_043_000188	東北有太華山。
HCH_012_043_000189	西有涪江，北有廉水，西有讓水，俱流入焉。
HCH_012_043_000190	茂州元治汶山縣，屬陝西行省吐番宣慰司。
HCH_012_043_000191	洪武中省縣入州。
HCH_012_043_000192	十六年復置縣，後復省。
HCH_012_043_000193	南有岷山，即隴山之南首也。
HCH_012_043_000194	汶江自松潘衛流入，經山下，又東經州城西，東南流，迴環於四川、湖廣、江西三布政司及南直隸之地，入於海，幾七千餘里。
HCH_012_043_000195	南有雞宗關、東有積水關、北有魏磨關三巡檢司。
HCH_012_043_000196	又南有七星關，又有雁門關。
HCH_012_043_000197	東有桃坪關。
HCH_012_043_000198	北有實大關。
HCH_012_043_000199	西北有黃崖關，有汶山長官司，又南有靜川長官司，東南有隴木頭長官司，西南有嶽希蓬長官司，俱洪武七年五月置，屬重慶衛。
HCH_012_043_000200	又北有長寧堡，本長寧安撫司，宣德中，平歷日諸蠻置，屬松潘衛。
HCH_012_043_000201	正統元年二月改屬壘溪所。
HCH_012_043_000202	八年六月改屬茂州衛。
HCH_012_043_000203	後廢爲堡。
HCH_012_043_000204	東南距府五百五十里。
HCH_012_043_000205	領縣一：汶川州西南。
HCH_012_043_000206	北有七盤山。
HCH_012_043_000207	西有玉輪江，即汶江也，有汶川長官司，洪武七年五月置。
HCH_012_043_000208	西有寒水關巡檢司。
HCH_012_043_000209	又南有徹底關。
HCH_012_043_000210	威州元以州治保寧縣省入。
HCH_012_043_000211	明玉珍復置縣。
HCH_012_043_000212	洪武二十年五月復省縣入州。
HCH_012_043_000213	舊治在西北鳳坪裏，宣德三年六月遷於保子岡河西。
HCH_012_043_000214	十年六月又遷於保子岡河東千戶所城內。
HCH_012_043_000215	東南有定廉山，鹽溪出焉。
HCH_012_043_000216	又西南有雪山，亦曰西山。
HCH_012_043_000217	北有汶江，西北有赤水，北有平谷水，俱流入焉。
HCH_012_043_000218	東有通化縣，洪武三年省。
HCH_012_043_000219	西北有保子關、徹底關。
HCH_012_043_000220	西南有鎮夷關。
HCH_012_043_000221	東南距府四百五十里。
HCH_012_043_000222	領縣一：保州西北。
HCH_012_043_000223	洪武六年分保寧縣地置。
HCH_012_043_000224	東有汶江。
HCH_012_043_000225	西北有鎮安關。
HCH_012_043_000226	保寧府元屬廣元路。
HCH_012_043_000227	洪武四年直隸行省。
HCH_012_043_000228	領州二，縣八。
HCH_012_043_000229	西南距布政司七百里。
HCH_012_043_000230	閬中倚。
HCH_012_043_000231	成化二十三年建雍王府。
HCH_012_043_000232	弘治三年遷於湖廣衡州府。
HCH_012_043_000233	四年八月建壽王府。
HCH_012_043_000234	正德元年遷於湖廣德安府。
HCH_012_043_000235	舊治在縣東，明玉珍徙於此。
HCH_012_043_000236	東有蟠龍山，其北有鋸山關。
HCH_012_043_000237	又有靈山，其麓爲梁山關。
HCH_012_043_000238	南有嘉陵江，即西漢水，自陝西寧羌州流入，至巴縣合大江，亦曰閬水，又曰巴水，其下流曰渝水。
HCH_012_043_000239	有南津關在城南，臨嘉陵江。
HCH_012_043_000240	又有滴水關，在城北玉臺山下。
HCH_012_043_000241	又東南有和溪關。
HCH_012_043_000242	蒼溪府西北。
HCH_012_043_000243	洪武十年五月省入閬中縣。
HCH_012_043_000244	十三年十一月復置。
HCH_012_043_000245	大獲山在東，宋江環其下。
HCH_012_043_000246	東南有云台山。
HCH_012_043_000247	西南有嘉陵江，宋江自西流入焉。
HCH_012_043_000248	北有八字堡巡檢司。
HCH_012_043_000249	南部府南少東。
HCH_012_043_000250	洪武十年五月省入閬中縣。
HCH_012_043_000251	十三年十一月復置。
HCH_012_043_000252	南有南山，一名跨鰲山。
HCH_012_043_000253	東南有離堆山。
HCH_012_043_000254	東北有嘉陵江。
HCH_012_043_000255	廣元府北少西。
HCH_012_043_000256	元廣元路，治綿谷縣。
HCH_012_043_000257	洪武四年改爲府。
HCH_012_043_000258	九年四月降爲州，來屬，以綿谷縣省入。
HCH_012_043_000259	十三年十一月復置綿谷縣。
HCH_012_043_000260	二十二年六月降州爲縣，復省綿谷縣入焉。
HCH_012_043_000261	北有潭毒山，上有潭毒關，下臨大江。
HCH_012_043_000262	又有朝天嶺，上有朝天關。
HCH_012_043_000263	又有七盤嶺，上有七盤關，爲陝西、四川分界處。
HCH_012_043_000264	又東北有大漫天嶺，其北有小漫天嶺。
HCH_012_043_000265	西有嘉陵江。
HCH_012_043_000266	北有渡口，在大、小二漫間。
HCH_012_043_000267	東有百丈關，北有望雲關，有龍門閣，北達陝西寧羌州。
HCH_012_043_000268	昭化府西北。
HCH_012_043_000269	元屬廣元路。
HCH_012_043_000270	洪武十年五月省入廣元州。
HCH_012_043_000271	十三年十一月復置，屬府。
HCH_012_043_000272	西南有長寧山，有白衛嶺。
HCH_012_043_000273	又西有九曲山。
HCH_012_043_000274	東有嘉陵江，其津口曰桔柏津，渡口關在焉。
HCH_012_043_000275	北有白水，自陝西文縣流入，亦曰葭萌水，合於嘉陵江。
HCH_012_043_000276	又北有馬鳴閣，又有石櫃閣。
HCH_012_043_000277	劍州元屬廣元路。
HCH_012_043_000278	洪武六年以州治普安縣省入，來屬。
HCH_012_043_000279	九年省。
HCH_012_043_000280	十三年十一月復置。
HCH_012_043_000281	北有大劍山，亦曰梁山，西北接小劍山，飛閣通衢，謂之劍閣，有大、小劍門關在其上。
HCH_012_043_000282	又有漢陽山。
HCH_012_043_000283	東有嘉陵江。
HCH_012_043_000284	西南有涪江。
HCH_012_043_000285	北有大劍溪、小劍溪，又有泥溪。
HCH_012_043_000286	東南距府三百二十里。
HCH_012_043_000287	領縣一：梓潼州西南。
HCH_012_043_000288	西有梓潼水，亦日潼江水，下流入於涪江。
HCH_012_043_000289	又北有揚帆水，流合潼江水。
HCH_012_043_000290	又東有小潼水，下流入嘉陵江。
HCH_012_043_000291	巴州元屬廣元路。
HCH_012_043_000292	洪武九年四月以州治化城縣省入，又改州爲縣，來屬。
HCH_012_043_000293	正德九年復爲州。
HCH_012_043_000294	東北有小巴山，與漢中大巴山接，巴江水出焉，經州東南，分爲三，下流至合州入嘉陵江。
HCH_012_043_000295	南有清水江，流合巴江。
HCH_012_043_000296	東有曾口縣，元屬州，後廢。
HCH_012_043_000297	又北有米倉關巡檢司。
HCH_012_043_000298	本治小巴山之巔，尋徙大巴山下，後廢。
HCH_012_043_000299	東北距府三百五十里。
HCH_012_043_000300	領縣二：通江州東少北。
HCH_012_043_000301	元至正四年置，屬府。
HCH_012_043_000302	正德九年改屬州。
HCH_012_043_000303	舊治在趙口坪，洪武中，徙於今治。
HCH_012_043_000304	東有得漢山。
HCH_012_043_000305	南有巴江。
HCH_012_043_000306	又有宕水，在縣西壁山下，亦曰諾水，流入巴江。
HCH_012_043_000307	東北有濛壩、北有羊圈山二巡檢司。
HCH_012_043_000308	又東北有桐柏關，相對樗林關。
HCH_012_043_000309	南江州北。
HCH_012_043_000310	正德十一年置。
HCH_012_043_000311	北有兩角山。
HCH_012_043_000312	南有難江，源出南鄭縣米倉山，下流入巴江。
HCH_012_043_000313	西北有大壩巡檢司。
HCH_012_043_000314	順慶府元順慶路。
HCH_012_043_000315	洪武中，爲府。
HCH_012_043_000316	領州二，縣八。
HCH_012_043_000317	西南距布政司六百里。
HCH_012_043_000318	南充倚。
HCH_012_043_000319	北有北津渡，縣舊治也。
HCH_012_043_000320	洪武中，徙今治。
HCH_012_043_000321	南有清居山。
HCH_012_043_000322	西有大、小方山。
HCH_012_043_000323	東有嘉陵江。
HCH_012_043_000324	西有曲水，又有流溪水，東有清水溪，又有大斗溪，俱流注於嘉陵江。
HCH_012_043_000325	又西有昆井，產鹽。
HCH_012_043_000326	府境州縣多鹽井。
HCH_012_043_000327	北有北津渡巡檢司。
HCH_012_043_000328	西充府西北。
HCH_012_043_000329	洪武十年五月省入南充縣。
HCH_012_043_000330	十三年十一月復置。
HCH_012_043_000331	南有南岷山，上有九井、十三峯。
HCH_012_043_000332	西有西溪，即流溪也。
HCH_012_043_000333	蓬州元屬順慶路。
HCH_012_043_000334	洪武中，以州治相如縣省入。
HCH_012_043_000335	東南有云山。
HCH_012_043_000336	西有嘉陵江。
HCH_012_043_000337	東北有巴江。
HCH_012_043_000338	西南距府百四十里。
HCH_012_043_000339	領縣二：營山州東少北。
HCH_012_043_000340	洪武十年五月省入蓬州。
HCH_012_043_000341	十三年十一月復置。
HCH_012_043_000342	東北有大、小蓬山。
HCH_012_043_000343	東有巴江。
HCH_012_043_000344	儀隴州北少東。
HCH_012_043_000345	洪武十年五月省入蓬州。
HCH_012_043_000346	十三年十一月復置。
HCH_012_043_000347	西有伏虞山。
HCH_012_043_000348	北有金城山，一名金粟山。
HCH_012_043_000349	東有巴江。
HCH_012_043_000350	北有鰲水，流入嘉陵江。
HCH_012_043_000351	廣安州元廣安府，屬順慶路。
HCH_012_043_000352	洪武四年降爲州，來屬。
HCH_012_043_000353	十年五月以州治渠江縣省入。
HCH_012_043_000354	東北有篆江，即巴江，合渠江之下流也。
HCH_012_043_000355	江中有三十六灘，亦名洄水。
HCH_012_043_000356	又北有濃水，南流合於環水，至州南合洄水，並注合州之嘉陵江。
HCH_012_043_000357	西北距府二百十里。
HCH_012_043_000358	領縣四：嶽池州西北。
HCH_012_043_000359	東有嶽池水。
HCH_012_043_000360	渠州東北。
HCH_012_043_000361	元渠州，屬順慶路。
HCH_012_043_000362	至元二十六年五月省州治流江縣入焉。
HCH_012_043_000363	洪武九年四月降爲縣。
HCH_012_043_000364	東北有八濛山。
HCH_012_043_000365	東有宕渠山，有渠江，下流合巴江。
HCH_012_043_000366	又北有衛渠關，正德中置。
HCH_012_043_000367	鄰水州東少南。
HCH_012_043_000368	成化元年七月置。
HCH_012_043_000369	東南有鄰山，產鐵。
HCH_012_043_000370	有鄰水，下流入大江，縣以此名。
HCH_012_043_000371	大竹州東少北。
HCH_012_043_000372	元屬渠州。
HCH_012_043_000373	洪武九年來屬。
HCH_012_043_000374	西有九盤山。
HCH_012_043_000375	東有東流溪，下流合於渠江。
HCH_012_043_000376	夔州府元夔州路，屬四川南道宣慰司。
HCH_012_043_000377	洪武四年爲府。
HCH_012_043_000378	九年四月降爲州，屬重慶府。
HCH_012_043_000379	十年五月直隸布政司。
HCH_012_043_000380	十三年十一月復爲府。
HCH_012_043_000381	領州一，縣十二。
HCH_012_043_000382	西距布政司千九百里。
HCH_012_043_000383	奉節倚。
HCH_012_043_000384	洪武九年四月省。
HCH_012_043_000385	十三年十一月復置。
HCH_012_043_000386	東北有赤甲山。
HCH_012_043_000387	東有白帝山，又有白鹽山。
HCH_012_043_000388	南濱江。
HCH_012_043_000389	東出爲瞿唐峽，峽口曰灩澦堆。
HCH_012_043_000390	又西有南鄉峽、虎鬚灘，東有龍脊灘，皆江流至險處。
HCH_012_043_000391	又東有大瀼水、東瀼水，俱流入江。
HCH_012_043_000392	南有尖山、又有金子山二巡檢司。
HCH_012_043_000393	又東有瞿唐關。
HCH_012_043_000394	東南有江關。
HCH_012_043_000395	南有八陣磧，磧旁有鹽泉。
HCH_012_043_000396	巫山府東。
HCH_012_043_000397	東有巫山，亦曰巫峽，大江經其中，東入湖廣巴東縣界。
HCH_012_043_000398	東有大寧河，又有萬流溪，皆流入大江。
HCH_012_043_000399	大昌府東。
HCH_012_043_000400	洪武十三年十一月置。
HCH_012_043_000401	西有千頃池。
HCH_012_043_000402	又有當陽鎮巡檢司。
HCH_012_043_000403	大寧府東北。
HCH_012_043_000404	元大寧州。
HCH_012_043_000405	洪武九年降爲縣。
HCH_012_043_000406	北有寶源山，有石穴，鹽泉出焉。
HCH_012_043_000407	又有馬連溪，亦曰昌溪。
HCH_012_043_000408	東北有袁溪巡檢司。
HCH_012_043_000409	北有青崖關。
HCH_012_043_000410	雲陽府西。
HCH_012_043_000411	元雲陽州。
HCH_012_043_000412	洪武六年十二月降爲縣。
HCH_012_043_000413	南濱江。
HCH_012_043_000414	東有湯溪，源自湖廣竹山，流經此，至奉節湯口入江。
HCH_012_043_000415	西有檀溪，上承巴渠水，入於湯水。
HCH_012_043_000416	北有鹽井。
HCH_012_043_000417	又西北有五溪、北有鐵檠二巡檢司。
HCH_012_043_000418	萬府西少南。
HCH_012_043_000419	元萬州。
HCH_012_043_000420	洪武六年十二月降爲縣。
HCH_012_043_000421	南濱江。
HCH_012_043_000422	西有苧溪。
HCH_012_043_000423	東有彭溪。
HCH_012_043_000424	又西有武寧縣，洪武四年省，有武寧巡檢司。
HCH_012_043_000425	又西南有銅羅關巡檢司。
HCH_012_043_000426	又西北有西柳關。
HCH_012_043_000427	開府西少北。
HCH_012_043_000428	元開州。
HCH_012_043_000429	洪武六年八月置，九月降爲縣。
HCH_012_043_000430	南有開江，彭溪之上流，有清江自縣東流合焉，亦曰疊江。
HCH_012_043_000431	又南有墊江，一名濁水，亦合流於開江。
HCH_012_043_000432	梁山府西。
HCH_012_043_000433	元梁山州，治梁山縣。
HCH_012_043_000434	洪武六年十二月省州，存縣。
HCH_012_043_000435	十年五月改屬忠州，後來屬。
HCH_012_043_000436	北有高梁山，又有高都山。
HCH_012_043_000437	西南有桂溪，南有蟠龍溪，下流俱入於江。
HCH_012_043_000438	新寧元屬達州。
HCH_012_043_000439	洪武三年改屬重慶府。
HCH_012_043_000440	十年五月省入梁山縣。
HCH_012_043_000441	十三年十一月復置，來屬。
HCH_012_043_000442	東有霧山，開江出焉。
HCH_012_043_000443	又東有豆山關。
HCH_012_043_000444	建始府東南。
HCH_012_043_000445	元屬施州。
HCH_012_043_000446	洪武中來屬。
HCH_012_043_000447	西有石乳山，產麩金，上有石乳關，與湖廣施州衛界。
HCH_012_043_000448	南有清江，自施州衛流入，又東入湖廣巴東縣界。
HCH_012_043_000449	達州元治通川縣。
HCH_012_043_000450	洪武九年四月降爲縣，省通川縣入焉。
HCH_012_043_000451	正德九年復升爲州。
HCH_012_043_000452	西有石城山。
HCH_012_043_000453	東有渠江，通川江之下流，西南入渠縣界，合於巴江，中有南昌灘，有土副巡檢司。
HCH_012_043_000454	又西有鐵山關。
HCH_012_043_000455	東北有深溪關。
HCH_012_043_000456	東南距府八百里。
HCH_012_043_000457	領縣二：東鄉州東少北。
HCH_012_043_000458	成化元年七月置。
HCH_012_043_000459	通川江在城東。
HCH_012_043_000460	太平州東北。
HCH_012_043_000461	正德十年析東鄉縣地置。
HCH_012_043_000462	東北有萬頃池，渠江、通川江出焉，下流爲渠江。
HCH_012_043_000463	北有北江，又北入陝西紫陽縣界，名任河，入於漢江，東北有明通巡檢司。
HCH_012_043_000464	重慶府元重慶路，屬四川南道宣慰司。
HCH_012_043_000465	洪武中，爲府。
HCH_012_043_000466	領州三，縣十七。
HCH_012_043_000467	西北距布政司五百五十里。
HCH_012_043_000468	巴倚。
HCH_012_043_000469	東有塗山。
HCH_012_043_000470	大江經城南，又東經明月峽，至城東，與涪江合。
HCH_012_043_000471	西北有魚鹿峽，涪江所經。
HCH_012_043_000472	東南有丹溪，東北有交龍溪，俱流入大江。
HCH_012_043_000473	東有大紅江巡檢司。
HCH_012_043_000474	西有佛圖關。
HCH_012_043_000475	西南有二郎關。
HCH_012_043_000476	東有銅鑼關。
