HCH_012_043_000938	西南有峨眉山，有大峨、中峨、小峨，羅目江出焉。
HCH_012_043_000939	陽江在縣南，自黎州所夷界流入，與羅目江合。
HCH_012_043_000940	又西南有中鎮巡檢司，後徙治大圍山。
HCH_012_043_000941	又有土地關，接蠻界。
HCH_012_043_000942	夾江州西北。
HCH_012_043_000943	西有青衣水，又有洪雅川，合焉。
HCH_012_043_000944	洪雅州西北。
HCH_012_043_000945	元省入夾江。
HCH_012_043_000946	成化十八年五月復置。
HCH_012_043_000947	西北有青衣水。
HCH_012_043_000948	西有洪雅川。
HCH_012_043_000949	又有竹箐山巡檢司。
HCH_012_043_000950	犍爲州東南。
HCH_012_043_000951	舊治玉津鎮。
HCH_012_043_000952	今治懲非鎮，洪武中徙此。
HCH_012_043_000953	東有大江。
HCH_012_043_000954	東北有四望溪流入焉。
HCH_012_043_000955	有四望溪口巡檢司。
HCH_012_043_000956	又北有石馬關巡檢司。
HCH_012_043_000957	榮州東。
HCH_012_043_000958	本榮州。
HCH_012_043_000959	洪武六年十二月置。
HCH_012_043_000960	九年四月降爲縣。
HCH_012_043_000961	東有榮川水，有甕溪關、飛水關，俱洪武間置。
HCH_012_043_000962	又有大坪隘口，成化十二年八月置。
HCH_012_043_000963	威遠州東。
HCH_012_043_000964	洪武六年十二月置，屬嘉定府。
HCH_012_043_000965	十年五月省入榮縣。
HCH_012_043_000966	十三年十一月復置。
HCH_012_043_000967	瀘州元屬重慶路。
HCH_012_043_000968	洪武六年直隸四川行省。
HCH_012_043_000969	九年直隸布政司。
HCH_012_043_000970	舊治在州東茜草壩。
HCH_012_043_000971	洪武中徙此。
HCH_012_043_000972	城西有寶山。
HCH_012_043_000973	西南有方山。
HCH_012_043_000974	大江在東，一名瀘江，又名汶江，資水自州北來合焉，亦曰中江。
HCH_012_043_000975	又有瀘州衛，洪武二十一年十月置於州城，成化四年四月徙於州西南之渡船鋪。
HCH_012_043_000976	南有石棚鎮、北有李市鎮二巡檢司。
HCH_012_043_000977	又有江門、水流崖、洞掃等關堡，俱成化四年四月置。
HCH_012_043_000978	又南有龍透關，崇禎間修築。
HCH_012_043_000979	西北距布政司千五百五十里。
HCH_012_043_000980	領縣三：納溪州西南。
HCH_012_043_000981	北濱大江，城西有納溪水，自蕃部西南流合焉。
HCH_012_043_000982	有納溪口巡檢司。
HCH_012_043_000983	南有倒馬關、石虎關，俱通雲南、交址路。
HCH_012_043_000984	江安州西少南。
HCH_012_043_000985	北濱大江，有綿水西南流入之，謂之綿水口。
HCH_012_043_000986	又南有淯溪，又有涇灘，俱流合於綿水。
HCH_012_043_000987	有板橋巡檢司。
HCH_012_043_000988	合江州東少北。
HCH_012_043_000989	舊治在神臂山南。
HCH_012_043_000990	洪武初徙安樂山之麓，即今治也。
HCH_012_043_000991	又南有榕山，俗名容子山。
HCH_012_043_000992	北濱大江，西有之溪、北溪入焉，因謂之合江。
HCH_012_043_000993	又南有安樂溪，西北流入江安縣。
HCH_012_043_000994	雅州元屬陝西行省吐蕃宣慰司。
HCH_012_043_000995	洪武四年以州治嚴道縣省入，直隸布政司。
HCH_012_043_000996	東有蔡山，一名周公山，其下有經水，一名周公水。
HCH_012_043_000997	又東南有榮水，一名長濆河，又有小溪，一名百丈河，至州界，俱合流於青衣江。
HCH_012_043_000998	北有金雞關。
HCH_012_043_000999	東北有金沙關。
HCH_012_043_001000	東北距布政司四百五十里。
HCH_012_043_001001	領縣三：名山州東北。
HCH_012_043_001002	洪武十年省入州。
HCH_012_043_001003	十三年十一月復置。
HCH_012_043_001004	東北有百丈山，旁有百丈縣，元屬州，洪武中省。
HCH_012_043_001005	西有蒙山。
HCH_012_043_001006	南有青衣江。
HCH_012_043_001007	榮經州西南。
HCH_012_043_001008	明玉珍省入嚴道縣。
HCH_012_043_001009	洪武中復置。
HCH_012_043_001010	東北有銅山。
HCH_012_043_001011	東有邛崍山，與黎州所界，上有九折阪。
HCH_012_043_001012	西有大關山，邛崍關在焉。
HCH_012_043_001013	北有長濆河，南有周公水，並流入州界。
HCH_012_043_001014	西北有紫眼關，地接西番。
HCH_012_043_001015	又有碉門砦，亦曰和川鎮，元置碉門安撫司。
HCH_012_043_001016	洪武五年設碉門百戶所於此，其地興天全界。
HCH_012_043_001017	蘆山州西北。
HCH_012_043_001018	元曰瀘山，後省。
HCH_012_043_001019	洪武六年十二月復置，改爲蘆山。
HCH_012_043_001020	東有盧山，青衣水出焉。
HCH_012_043_001021	南有三江渡，其水經多功峽，下流入平羌江。
HCH_012_043_001022	西北有臨關，舊曰靈關，正統初更名。
HCH_012_043_001023	有臨關巡檢司。
HCH_012_043_001024	又南有飛仙關。
HCH_012_043_001025	永寧宣撫司元永寧路。
HCH_012_043_001026	洪武七年爲永寧長官司。
HCH_012_043_001027	八年正月升宣撫司。
HCH_012_043_001028	天啓三年廢，地屬敘州府。
HCH_012_043_001029	故城在西。
HCH_012_043_001030	洪武十五年遷於今治。
HCH_012_043_001031	東南有獅子山。
HCH_012_043_001032	西北有青山。
HCH_012_043_001033	南有永寧河，東北流經瀘州境，入於大江。
HCH_012_043_001034	又東南有赤水河。
HCH_012_043_001035	東有魚浮關，洪武四年置。
HCH_012_043_001036	領長官司二。
HCH_012_043_001037	距布政司千八百里。
HCH_012_043_001038	九姓長官司司城西南。
HCH_012_043_001039	元九姓羅氏黨蠻夷長官千戶。
HCH_012_043_001040	洪武六年十二月改置。
HCH_012_043_001041	天啓六年改屬瀘州。
HCH_012_043_001042	南有通江溪，東北會於納溪之江門峽。
HCH_012_043_001043	西南有金鵝池。
HCH_012_043_001044	太平長官司元大壩軍民府，洪武中廢。
HCH_012_043_001045	成化四年四月改置。
HCH_012_043_001046	天全六番招討司元六番招討司。
HCH_012_043_001047	洪武六年十二月改置，直隸四川布政司。
HCH_012_043_001048	二十一年二月改隸都司。
HCH_012_043_001049	東有多功山。
HCH_012_043_001050	南有和水，一名始陽河，亦名多功河，流入雅州青衣江。
HCH_012_043_001051	又西番境內有可跋海，其下流合雲南樣備水，流入交址。
HCH_012_043_001052	又禁門關、紫石關亦俱在司西。
HCH_012_043_001053	又東有善所、張所、泥山、天全、思經、樂藹、始陽、樂屋、在城、靈關凡十百戶所。
HCH_012_043_001054	東距布政司五百五十里。
HCH_012_043_001055	松潘衛元鬆州，屬雲南行省。
HCH_012_043_001056	洪武初因之。
HCH_012_043_001057	十二年四月兼置鬆州衛。
HCH_012_043_001058	十三年八月罷衛。
HCH_012_043_001059	未幾，復置衛。
HCH_012_043_001060	二十年正月罷州，改衛爲松潘等處軍民指揮使司，屬四川都司。
HCH_012_043_001061	嘉靖四十二年罷軍民司，止爲衛。
HCH_012_043_001062	東有雪欄山，上有關。
HCH_012_043_001063	南有紅花山。
HCH_012_043_001064	西北有甘松嶺。
HCH_012_043_001065	又北有大、小分水嶺。
HCH_012_043_001066	西有岷江，自陝西洮州衛流經此，亦曰潘州河。
HCH_012_043_001067	又東有涪江，出小分水嶺，東南流，入小河所界。
HCH_012_043_001068	北有潘州衛，洪武中，以故潘州置。
HCH_012_043_001069	二十年省入。
HCH_012_043_001070	又西有鎮夷關，永樂四年七月置。
HCH_012_043_001071	又西北有流沙關。
HCH_012_043_001072	又東有望山、雪欄、風洞、黑松林、三舍、小關子關。
HCH_012_043_001073	南有西寧、歸化、安化、新塘、北定、浦江六關。
HCH_012_043_001074	又有平夷關，萬曆十四年置。
HCH_012_043_001075	又南爲鎮平關。
HCH_012_043_001076	又西北有漳臘堡，洪武十一年置。
HCH_012_043_001077	領千戶所一，長官司十六，官撫司五。
HCH_012_043_001078	東南距布政司七百六十里。
HCH_012_043_001079	小河守禦千戶所宣德四年正月置。
HCH_012_043_001080	北有師家山，一名文山，山麓有文山關。
HCH_012_043_001081	南有小河，即涪水也，東流入龍安府界，有鐵索橋跨其上。
HCH_012_043_001082	佔藏先結簇長官司、蠟匝簇長官司、白馬路簇長官司、山洞簇長官司、阿昔洞簇長官司、北定簇長官司、麥匝簇長官司、者多簇長官司、牟力結簇長官司、班班簇長官司、祈命簇長官司、勒都簇長官司、包藏先結簇長官司以上十三司，俱洪武十四年正月置。
HCH_012_043_001083	，阿用簇長官司宣德十年五月置。
HCH_012_043_001084	，潘斡寨長官司正統五年七月置。
HCH_012_043_001085	，別思寨長官司宣德十年五月置。
HCH_012_043_001086	，八郎安撫司永樂十五年二月置。
HCH_012_043_001087	，麻兒匝安撫司宣德二年三月，以阿樂地置。
HCH_012_043_001088	，阿角寨安撫司、芒兒者安撫司二司俱正統五年七月置。
HCH_012_043_001089	，思曩日安撫司正統十一年七月置。
HCH_012_043_001090	疊溪守禦軍民千戶所本疊溪右千戶所，洪武十一年以古翼州置，屬茂州衛。
HCH_012_043_001091	二十五年改置。
HCH_012_043_001092	直隸都司。
HCH_012_043_001093	南有排柵山。
HCH_012_043_001094	西有汶江，南有黑水流合焉，謂之翼水。
HCH_012_043_001095	又南有南橋、中橋、徹底三關，北有永鎮橋關、鎮平關，西有疊溪橋關，東有小關，俱洪武十一年置。
HCH_012_043_001096	領長官司二。
HCH_012_043_001097	東南距布政司五百八十里。
HCH_012_043_001098	疊溪長官司所城北。
HCH_012_043_001099	、鬱即長官司所城西。
HCH_012_043_001100	俱永樂元年正月置。
HCH_012_043_001101	黎州守禦軍民千戶所本黎州長官司，洪武九年七月置。
HCH_012_043_001102	十一年六月升安撫司，直隸布政司。
HCH_012_043_001103	萬曆二十四年降爲千戶所，直隸都司。
HCH_012_043_001104	東北有聖鐘山，下有黎州，元屬陝西行省吐蕃宣慰司。
HCH_012_043_001105	洪武五年省州治漢源縣入州。
HCH_012_043_001106	永樂後廢。
HCH_012_043_001107	西北有飛越山，兩面皆接生羌界。
HCH_012_043_001108	西南有大田山，東麓爲大田壩，萬曆二十四年立黎州土千戶所於此。
HCH_012_043_001109	又東有沖天山。
HCH_012_043_001110	南有避瘴山。
HCH_012_043_001111	西北又有筍筤山。
HCH_012_043_001112	南有大渡河，即古若水。
HCH_012_043_001113	洪武十五年六月置大渡河守禦千戶所，後徙司城西北隅。
HCH_012_043_001114	又西南有漢水，源出飛越山之仙人洞，亦曰流沙河，下流至試劍山，入大渡河。
HCH_012_043_001115	河南即清溪關，與建昌行都司界。
HCH_012_043_001116	西有黑崖關，洪武十六年置。
HCH_012_043_001117	又有椒子關，路通長河西等處。
HCH_012_043_001118	東北距布政司六百九十里。
HCH_012_043_001119	平茶洞長官司元溶江、芝子、平茶等處長官司。
HCH_012_043_001120	洪武八年正月置，屬酉陽宣撫司。
HCH_012_043_001121	十七年直隸布政司。
HCH_012_043_001122	西有百歲山。
HCH_012_043_001123	哨溪出於其東，滿溪出於其西，合流入買賽河。
HCH_012_043_001124	北距布政司千六百七十里。
HCH_012_043_001125	溶溪芝麻子坪長官司元溶江、芝子、平茶等處長官司。
HCH_012_043_001126	洪武八年改置，屬湖廣思南宣慰司。
HCH_012_043_001127	十七年五月直隸四川布政司。
HCH_012_043_001128	安寧宣撫司成化十三年二月置，領長官司二：懷遠長官司、宣化長官司俱成化十三年二月，與宣撫司同置。
HCH_012_043_001129	酉陽宣慰司元酉陽州，屬懷德府。
HCH_012_043_001130	明玉珍改沿邊溪洞軍民宣慰司。
HCH_012_043_001131	洪武五年四月仍置酉陽州，兼置酉陽宣慰司，州尋廢。
HCH_012_043_001132	八年正月改宣慰司爲宣撫司，屬四川都司。
HCH_012_043_001133	永樂十六年改屬重慶衛。
HCH_012_043_001134	天啓元年升爲宣慰司。
HCH_012_043_001135	東南有酉水，流合平茶水，至湖廣辰州府合流於江，有寧俊江巡檢司。
HCH_012_043_001136	西北距重慶府四百九十里。
HCH_012_043_001137	領長官司三：石耶洞長官司司東南。
HCH_012_043_001138	元石耶軍民府。
HCH_012_043_001139	洪武八年正月改爲長官司。
HCH_012_043_001140	邑梅洞長官司司南。
HCH_012_043_001141	元佛鄉洞長官司。
HCH_012_043_001142	明玉珍改邑梅沿邊溪洞軍民府。
HCH_012_043_001143	洪武八年正月改置。
HCH_012_043_001144	北有凱歌河，一名買賽河，自貴州平頭著可司流入，東入酉陽司界。
HCH_012_043_001145	麻兔洞長官司洪武八年正月置。
HCH_012_043_001146	石砫宣慰司元石砫軍民宣撫司。
HCH_012_043_001147	明玉珍改安撫司。
HCH_012_043_001148	洪武八年正月爲宣撫司，屬重慶衛。
HCH_012_043_001149	嘉靖四十二年改屬夔州衛。
HCH_012_043_001150	天啓元年升爲宣慰司。
HCH_012_043_001151	東有石砫山。
HCH_012_043_001152	又有三江溪，即葫蘆溪之上流也。
HCH_012_043_001153	西南距夔州府七百五十里。
HCH_012_043_001154	四川行都指揮使司元羅羅、蒙慶等處宣慰司，治建昌路，屬雲南行省。
HCH_012_043_001155	洪武十五年罷宣慰司。
HCH_012_043_001156	二十七年九月置四川行都指揮使司。
HCH_012_043_001157	治建昌衛。
HCH_012_043_001158	領衛五、所八、長官司四。
HCH_012_043_001159	東北距布政司千四百八十里。
HCH_012_043_001160	建昌衛軍民指揮使司元建昌路，屬羅羅蒙慶宣慰司。
HCH_012_043_001161	洪武十五年正月爲府，屬雲南布政司，兼置衛，屬雲南都司。
HCH_012_043_001162	十月，衛府俱改屬四川。
HCH_012_043_001163	二十五年六月，府廢，升衛爲軍民指揮使司。
HCH_012_043_001164	二十七年九月來屬。
HCH_012_043_001165	領守禦千戶所四、長官司三。
HCH_012_043_001166	南有瀘水，流入金沙江。
HCH_012_043_001167	又北有長河，南有懷遠河，西南有寧遠河，下流俱合於瀘水。
HCH_012_043_001168	又東有建安州、永寧州，又東有裏州，東南有闊州，西南有瀘州、隆州，元俱屬建昌路，洪武十五年三月俱屬建昌府。
HCH_012_043_001169	東有北社縣，元屬永寧州，洪武十五年三月因之，尋改爲碧舍縣。
HCH_012_043_001170	又西有德州，元屬德昌路，洪武十五年三月屬德昌府。
HCH_012_043_001171	二十七年後，府州縣俱廢。
HCH_012_043_001172	又有建昌前衛指揮使司，洪武二十七年六月置，與建昌軍民衛同城，九月屬四川行都司，萬曆三年省。
HCH_012_043_001173	又東有建昌土衛，洪武十五年置，萬曆後廢。
HCH_012_043_001174	北有瀘沽巡檢司，即故瀘沽縣也。
HCH_012_043_001175	又南有麻刺巡檢司。
HCH_012_043_001176	又西南有打衝河、東南有白水、東有龍溪三巡檢司，後廢。
HCH_012_043_001177	又東北有老君關，有太平關。
HCH_012_043_001178	東南有甸沙關。
HCH_012_043_001179	又有金川堡。
HCH_012_043_001180	守禦禮州中中千戶所衛北。
HCH_012_043_001181	元禮州，屬建昌路。
HCH_012_043_001182	洪武十五年三月屬建昌府，兼置二守禦所，屬衛。
HCH_012_043_001183	二十七年後，州廢。
HCH_012_043_001184	北有瀘沽縣，元屬禮州，洪武十五年三月因之，亦二十七年後廢。
HCH_012_043_001185	守禦打衝河中前千戶所衛西。
HCH_012_043_001186	洪武二十七年二月置。
HCH_012_043_001187	西有打衝河，蠻名黑惠江，一名納夷江，源出吐蕃，下流入金沙江。
HCH_012_043_001188	東北有水砦關。
HCH_012_043_001189	南有天星砦。
HCH_012_043_001190	守禦德昌千戶所衛南。
HCH_012_043_001191	洪武十五年置。
HCH_012_043_001192	南有德昌路，元屬羅羅蒙慶宣慰司，洪武十五年三月爲府，屬雲南布政司，十月改屬四川布政司，二十七年後廢。
HCH_012_043_001193	昌州長官司衛南。
HCH_012_043_001194	元屬德昌路。
HCH_012_043_001195	洪武十五年三月屬德昌府。
HCH_012_043_001196	永樂二年七月改置。
HCH_012_043_001197	威龍長官司衛東南。
HCH_012_043_001198	元威龍州，屬德昌路。
HCH_012_043_001199	洪武十五年三月以「龍。」
HCH_012_043_001200	爲「隆」，屬德昌府。
HCH_012_043_001201	永樂二年七月改置。
HCH_012_043_001202	普濟長官司衛西南。
HCH_012_043_001203	元普濟州，屬德昌路。
HCH_012_043_001204	洪武十五年三月屬德昌府。
HCH_012_043_001205	永樂二年七月改置。
HCH_012_043_001206	寧番衛軍民指揮使司元蘇州，屬建昌路。
HCH_012_043_001207	洪武十五年三月屬建昌府。
HCH_012_043_001208	二十一年十月兼置蘇州衛，屬四川都司。
HCH_012_043_001209	二十五年六月，州廢，升衛爲軍民指揮使司。
HCH_012_043_001210	二十六年三月更名，屬四川都司。
HCH_012_043_001211	二十七年九月來屬。
HCH_012_043_001212	南有南山，產銅。
HCH_012_043_001213	東有長河，亦名白沙江，南流會於瀘水。
HCH_012_043_001214	又有中縣，元屬建昌路。
HCH_012_043_001215	洪武十五年三月改屬永寧州。
HCH_012_043_001216	十七年改屬蘇州，後廢。
HCH_012_043_001217	又有沙陀關、羅羅關、九盤關。
HCH_012_043_001218	南有烏角關。
HCH_012_043_001219	北有北山關。
HCH_012_043_001220	又西有定番堡，萬曆十五年置。
HCH_012_043_001221	南距行都司百九十里。
HCH_012_043_001222	領千戶所一：守禦冕山橋後千戶所衛東。
HCH_012_043_001223	正統七年以冕山堡置。
HCH_012_043_001224	東有東河，與瀘沽河合，下流入金沙江。
HCH_012_043_001225	北有冕山關。
HCH_012_043_001226	越巂衛軍民指揮使司洪武二十五年七月置，屬四川都司。
HCH_012_043_001227	二十七年九月來屬。
HCH_012_043_001228	西有阿露山，亦曰大雪山。
HCH_012_043_001229	北有大渡河，與黎州界。
HCH_012_043_001230	又有魚洞河，南有羅羅河，合流入大渡河。
HCH_012_043_001231	又北有青岡關，有海棠關，有曬經關。
HCH_012_043_001232	南有小相公嶺關。
HCH_012_043_001233	西北有刺伯關。
HCH_012_043_001234	南距行都司百九十里。
HCH_012_043_001235	領千戶所一、長官司一：鎮西后千戶所衛北。
HCH_012_043_001236	弘治中置。
HCH_012_043_001237	邛部長官司衛東。
HCH_012_043_001238	元邛部州，屬建昌路。
HCH_012_043_001239	洪武十五年三月屬建昌府，二十七年四月升軍民府，後仍爲州，屬越巂衛。
HCH_012_043_001240	永樂元年五月改爲長官司。
HCH_012_043_001241	東有平夷、歸化二堡，萬曆十五年開部夷地增置。
HCH_012_043_001242	鹽井衛軍民指揮使司元柏興府，治閏鹽縣，屬羅羅蒙慶宣慰司。
HCH_012_043_001243	洪武十五年三月屬雲南布政司。
HCH_012_043_001244	二十四年二月降爲州，省閏鹽縣入焉。
HCH_012_043_001245	二十六年六月，州廢，置衛，屬四川都司。
HCH_012_043_001246	二十七年九月來屬。
HCH_012_043_001247	南有柏林山。
HCH_012_043_001248	西有斛僰和山，產金。
HCH_012_043_001249	又西有鐵石山，出砮石。
HCH_012_043_001250	東北有打衝河，上有索橋。
HCH_012_043_001251	西有雙橋河，東有越溪河，俱流入打衝河。
HCH_012_043_001252	又治東有鹽井。
HCH_012_043_001253	北有金縣，元屬柏興府，洪武十五年三月因之，十七年後廢。
HCH_012_043_001254	又東有雙橋關。
HCH_012_043_001255	西有古德關。
HCH_012_043_001256	東南距行都司三百里。
HCH_012_043_001257	領千戶所一、長官司一：打衝河守禦中左千戶所衛東北。
HCH_012_043_001258	洪武二十五年置。
HCH_012_043_001259	馬刺長官司衛南。
HCH_012_043_001260	永樂初置。
HCH_012_043_001261	會川衛軍民指揮使司本會川守禦千戶所，洪武十五年置，屬建昌衛。
HCH_012_043_001262	二十五年六月升軍民千戶所。
HCH_012_043_001263	十一月升會川衛軍民指揮使司，屬四川都司。
HCH_012_043_001264	二十七年九月來屬。
HCH_012_043_001265	東南有土田山，產石碌，有葛砧山，產石青，東有密勒山，產銀礦。
HCH_012_043_001266	西南有金沙江，自雲南武定府流入界。
HCH_012_043_001267	又西有瀘水，南入焉，南有瀘沽河，亦流入焉。
HCH_012_043_001268	又南有搭甲渡巡檢司。
HCH_012_043_001269	東南有瀘津關。
HCH_012_043_001270	南有迷郎關，又有鬆坪關。
HCH_012_043_001271	西有永昌關，有大龍關。
HCH_012_043_001272	北有甸沙關，接建昌衛界。
HCH_012_043_001273	有會川路，元屬羅羅蒙慶宣慰司。
HCH_012_043_001274	洪武十五年三月爲府，屬雲南布政司。
HCH_012_043_001275	十月改屬四川布政司。
HCH_012_043_001276	二十六年四月，府廢。
HCH_012_043_001277	墮其城。
HCH_012_043_001278	二十七年四月復置府，後復廢。
HCH_012_043_001279	又西有永昌州，南有武安州，又有黎漢州，元俱屬會川路，洪武十五年三月俱屬會川府，十月俱改爲縣，二十四年二月復俱爲州。
HCH_012_043_001280	東南有姜州，元屬建昌路，又有會理州，元屬會川路，洪武十五年三月俱改屬東川府。
HCH_012_043_001281	北有麻龍州，元屬會川路，洪武十五年三月改屬東川府。
HCH_012_043_001282	又有麻龍縣，洪武十七年改屬麻龍州。
HCH_012_043_001283	二十七年後，府州縣俱廢。
HCH_012_043_001284	西北距行都司五百里。
HCH_012_043_001285	領千戶所一：守禦迷易千戶所衛西北。
HCH_012_043_001286	洪武二十五年閏十一月置。
HCH_012_043_001287	江西《禹貢》揚州之域。
HCH_012_043_001288	元置江西等處行中書省。
HCH_012_043_001289	治龍興路。
HCH_012_043_001290	太祖壬寅年正月因之。
HCH_012_043_001291	正月治吉安府。
HCH_012_043_001292	二月還治洪都。
HCH_012_043_001293	洪武三年十二月置江西都衛。
HCH_012_043_001294	與行中書省同治。
HCH_012_043_001295	八年十月改都衛爲都指揮使司。
HCH_012_043_001296	九年六月改行中書省爲承宣布政使司。
HCH_012_043_001297	領府十三，州一，縣七十七。
HCH_012_043_001298	爲裏九千九百五十六有奇。
HCH_012_043_001299	北至九江，與江南、湖廣界。
HCH_012_043_001300	東至玉山，與浙江界。
HCH_012_043_001301	南至安遠，與福建、廣東界。
HCH_012_043_001302	西至永寧，與湖廣界。
HCH_012_043_001303	距南京一千五百二十里，京師四千一百七十五里。
HCH_012_043_001304	洪武二十六年編戶一百五十五萬三千九百二十三，口八百九十八萬二千四百八十二。
HCH_012_043_001305	弘治四年，戶一百三十六萬三千六百二十九，口六百五十四萬九千八百。
HCH_012_043_001306	萬曆六年，戶一百三十四萬一千五，口五百八十五萬九千二十六。
HCH_012_043_001307	南昌府元龍興路，屬江西行省。
HCH_012_043_001308	太祖壬寅年正月爲洪都府。
HCH_012_043_001309	癸卯年八月改南昌府。
HCH_012_043_001310	領州一、縣七：南昌倚。
HCH_012_043_001311	洪武十一年建豫王府。
HCH_012_043_001312	二十五年改爲代王，遷山西大同。
HCH_012_043_001313	永樂初，寧王府自大寧衛遷此，正德十四年除。
HCH_012_043_001314	故城在東。
HCH_012_043_001315	今城，明太祖壬寅年改築。
HCH_012_043_001316	東湖在城東南隅。
HCH_012_043_001317	西有贛江，自豐城縣流入，東北入鄱陽湖，出湖口縣，入大江，亦曰章江。
HCH_012_043_001318	又東南有武陽水，上源自南豐縣汙江，北流經此，又東北入宮亭湖。
HCH_012_043_001319	南有市汊巡檢司。
HCH_012_043_001320	新建倚。
HCH_012_043_001321	西有西山，跨南昌、新建、奉新、建昌四縣之境。
HCH_012_043_001322	北有吳城山，臨贛江。
HCH_012_043_001323	東有鄱陽湖，即彭蠡也，俗謂之東鄱湖；其西與宮亭湖相接，謂之西鄱湖西南有筠水，一名蜀江，自高安縣流入，合於章江。
HCH_012_043_001324	東北有趙家圍、西有烏山、北有吳城、西北有昌邑四巡檢司。
HCH_012_043_001325	豐城府南少西。
HCH_012_043_001326	元富州。
HCH_012_043_001327	洪武九年十二月改爲豐城縣。
HCH_012_043_001328	南有羅山，富水所出。
HCH_012_043_001329	又有柸山，豐水所出。
HCH_012_043_001330	西南有章江，豐水自南，富水自東南，俱流入焉。
HCH_012_043_001331	又東有云韶水，自撫州流入，亦入於章江。
HCH_012_043_001332	南有沛源、西南有江滸口二巡檢司。
HCH_012_043_001333	又有河湖巡檢司，廢。
HCH_012_043_001334	又北有港口巡檢司，治大江口，後遷縣東北小江口，廢。
HCH_012_043_001335	進賢府東南。
HCH_012_043_001336	西南有金山，產金。
HCH_012_043_001337	北有三揚水，又有軍山湖，又北有日月湖，下流俱入於鄱陽湖。
HCH_012_043_001338	東有潤陂、東北有鄔子寨、北有龍山、東南有花園四巡檢司。
HCH_012_043_001339	奉新府西。
HCH_012_043_001340	西有百丈山，馮水所出，下流入於章江。
HCH_012_043_001341	又西有華林山，華林水出焉。
HCH_012_043_001342	又西北有藥王山，龍溪水出焉。
HCH_012_043_001343	二水合流，注於馮水。
HCH_012_043_001344	西有羅坊巡檢司。
HCH_012_043_001345	又有白沙巡檢司，廢。
HCH_012_043_001346	靖安府西北。
