HCH_011_019_000001	宗夬字明敭，南陽涅陽人也，世居江陵。
HCH_011_019_000002	祖炳，宋時徵太子庶子不就，有高名。
HCH_011_019_000003	父繁，西中郎諮議參軍。
HCH_011_019_000004	夬少勤學，有局幹。
HCH_011_019_000005	弱冠，舉郢州秀才，歷臨川王常侍、驃騎行參軍。
HCH_011_019_000006	齊司徒竟陵王集學士于西邸，並見圖畫，夬亦預焉。
HCH_011_019_000007	永明中，與魏和親，敕夬與尚書殿中郎任昉同接魏使，皆時選也。
HCH_011_019_000008	武帝嫡孫南郡王居西州，以夬管書記，夬旣以筆札被知，亦以貞正見許，故任焉。
HCH_011_019_000009	俄而文惠太子薨，王爲皇太孫，夬仍管書記。
HCH_011_019_000010	及太孫卽位，多失德，夬頗自疏，得爲秣陵令，遷尚書都官郎。
HCH_011_019_000011	隆昌末，少帝見誅，寵舊多罹其禍，惟夬及傅昭以清正免。
HCH_011_019_000012	明帝卽位，以夬爲郢州治中，有名稱職，以父老去官還鄉里。
HCH_011_019_000013	南康王爲荊州刺史，引爲別駕。
HCH_011_019_000014	義師起，遷西中郎諮議參軍，別駕如故。
HCH_011_019_000015	時西土位望，惟夬與同郡樂藹、劉坦爲州人所推信，故領軍將軍蕭穎胄深相委仗，每事諮焉。
HCH_011_019_000016	高祖師發雍州，穎胄遣夬出自楊口，面稟經略，並護送軍資，高祖甚禮之。
HCH_011_019_000017	中興初，遷御史中丞，以父憂去職。
HCH_011_019_000018	起爲冠軍將軍、衛軍長史。
HCH_011_019_000019	天監元年，遷征虜長史、東海太守，將軍如故。
HCH_011_019_000020	二年，徵爲太子右衛率。
HCH_011_019_000021	是冬，遷五兵尚書，參掌大選。
HCH_011_019_000022	三年，卒，時年四十九。
HCH_011_019_000023	子曜卿嗣。
HCH_011_019_000024	夬從弟岳，有名行，州裏稱之，出於夬右。
HCH_011_019_000025	仕歷尚書庫部郎，郢州治中，北中郎錄事參軍事。
HCH_011_019_000026	劉坦，字德度，南陽安衆人也，晉鎮東將軍喬之七世孫。
HCH_011_019_000027	坦少爲從兄虯所知。
HCH_011_019_000028	齊建元初，爲南郡王國常侍，尋補孱陵令，遷南中郎錄事參軍，所居以幹濟稱。
HCH_011_019_000029	南康王爲荊州刺史，坦爲西中郎中兵參軍，領長流。
HCH_011_019_000030	義師起，遷諮議參軍。
HCH_011_019_000031	時輔國將軍楊公則爲湘州刺史，帥師赴夏口，西朝議行州事者，坦謂衆曰：「湘境人情，易擾難信。若專用武士，則百姓畏侵漁；若遣文人，則威略不振。必欲鎮靜一州城，軍民足食，則無逾老臣。先零之役，竊以自許。」
HCH_011_019_000032	遂從之。
HCH_011_019_000033	乃除輔國長史、長沙太守，行湘州事。
HCH_011_019_000034	坦嘗在湘州，多舊恩，道迎者甚衆。
HCH_011_019_000035	下車簡選堪事吏，分詣十郡，悉發人丁，運租米三十餘萬斛，致之義師，資糧用給。
HCH_011_019_000036	時東昏遣安成太守劉希祖破西臺所選太守范僧簡於平都，希祖移檄湘部，於是始興內史王僧粲應之。
HCH_011_019_000037	邵陵人逐其內史褚洊，永陽人周暉起兵攻始安郡，並應僧粲。
HCH_011_019_000038	桂陽人邵曇弄、鄧道介報復私仇，因合黨亦同焉。
HCH_011_019_000039	僧粲自號平西將軍、湘州刺史，以永陽人周舒爲謀主，師于建寧。
HCH_011_019_000040	自是湘部諸郡，悉皆蜂起；惟臨湘、湘陰、瀏陽、羅四縣猶全。
HCH_011_019_000041	州人咸欲泛舟逃走，坦悉聚船焚之，遣將尹法略距僧粲，相持未決。
HCH_011_019_000042	前湘州鎮軍鐘玄紹潛謀應僧粲，要結士庶數百人，皆連名定計，刻日反州城。
HCH_011_019_000043	坦聞其謀，偽爲不知，因理訟至夜，而城門遂不閉，以疑之。
HCH_011_019_000044	玄紹未及發，明旦詣坦問其故。
HCH_011_019_000045	坦久留與語，密遣親兵收其家書。
HCH_011_019_000046	玄紹在坐未起，而收兵已報具得其文書本末，玄紹卽首伏，於坐斬之。
HCH_011_019_000047	焚其文書，其餘黨悉無所問，衆愧且服，州部遂安。
HCH_011_019_000048	法略與僧粲相持累月，建康城平，公則還州，羣賊始散。
HCH_011_019_000049	天監初，論功封荔浦縣子，邑三百戶。
HCH_011_019_000050	遷平西司馬、新興太守。
HCH_011_019_000051	天監三年，遷西中郎長史，卒，時年六十二。
HCH_011_019_000052	子泉嗣。
HCH_011_019_000053	樂藹字蔚遠，南陽淯陽人，晉尚書令廣之六世孫，世居江陵。
HCH_011_019_000054	其舅雍州刺史宗愨，嘗陳器物，試諸甥侄。
HCH_011_019_000055	藹時尚幼，而所取惟書，愨由此奇之。
HCH_011_019_000056	又取史傳各一卷授藹等，使讀畢，言所記。
HCH_011_019_000057	藹略讀具舉，愨益善之。
HCH_011_019_000058	宋建平王景素爲荊州刺史，辟爲主簿。
HCH_011_019_000059	景素爲南徐州，復爲征北刑獄參軍，遷龍陽相。
HCH_011_019_000060	以父憂去職，吏民詣州請之，葬訖起焉。
HCH_011_019_000061	時齊豫章王嶷爲武陵太守，雅善藹爲政，及嶷爲荊州刺史，以藹爲驃騎行參軍、領州主簿，參知州事。
HCH_011_019_000062	嶷嘗問藹風土舊俗，城隍基啉寺，山川險易，藹隨問立對，若按圖牒，嶷益重焉。
HCH_011_019_000063	州人嫉之，或譖藹廨門如市，嶷遣覘之，方見藹閉閣讀書。
HCH_011_019_000064	嶷還都，以藹爲太尉刑獄參軍，典書記，遷枝江令。
HCH_011_019_000065	還爲大司馬中兵參軍，轉署記室。
HCH_011_019_000066	永明八年，荊州刺史巴東王子響稱兵反，旣敗，焚燒府舍，官曹文書，一時蕩盡。
HCH_011_019_000067	武帝引見藹，問以西事，藹上對詳敏，帝悅焉。
HCH_011_019_000068	用爲荊州治中，敕付以修復府州事。
HCH_011_019_000069	藹還州，繕脩廨署數百區，頃之咸畢，而役不及民。
HCH_011_019_000070	荊部以爲自晉王悅移鎮以來，府舍未之有也。
HCH_011_019_000071	九年，豫章王嶷薨，藹解官赴喪，率荊、湘二州故吏，建碑墓所。
HCH_011_019_000072	累遷車騎平西錄事參軍、步兵校尉，求助戍西歸。
HCH_011_019_000073	南康王爲西中郎，以藹爲諮議參軍。
HCH_011_019_000074	義師起，蕭穎胄引藹及宗夬、劉坦，任以經略。
HCH_011_019_000075	梁台建，遷鎮軍司馬、中書侍郎、尚書左丞。
HCH_011_019_000076	時營造器甲，舟艦軍糧，及朝廷儀憲，悉資藹焉。
HCH_011_019_000077	尋遷給事黃門侍郎，左丞如故。
HCH_011_019_000078	和帝東下，道兼衛尉卿。
HCH_011_019_000079	天監初，遷驍騎將軍、領少府卿；俄遷御史中丞，領本州大中正。
HCH_011_019_000080	初，藹發江陵，無故於船得八車輻，如中丞健步避道者，至是果遷焉。
HCH_011_019_000081	藹性公強，居憲臺甚稱職。
HCH_011_019_000082	時長沙宣武王將葬，而車府忽於庫火油絡，欲推主者。
HCH_011_019_000083	藹曰：「昔晉武庫火，張華以爲積油萬石必然。今庫若有灰，非吏罪也。」
HCH_011_019_000084	旣而檢之，果有積灰。
HCH_011_019_000085	時稱其博物弘恕焉。
HCH_011_019_000086	二年，出爲持節、督廣交越三州諸軍、冠軍將軍、平越中郎將、廣州刺史。
HCH_011_019_000087	前刺史徐元瑜罷歸，道遇始興人士反，逐內史崔睦舒，因掠元瑜財產。
HCH_011_019_000088	元瑜走歸廣州，借兵於藹，托欲討賊，而實謀襲藹。
HCH_011_019_000089	藹覺之，誅元瑜。
HCH_011_019_000090	尋進號征虜將軍，卒官。
HCH_011_019_000091	藹姊適徵士同郡劉虯，亦明識有禮訓。
HCH_011_019_000092	藹爲州，迎姊居官舍，參分祿秩，西土稱之。
HCH_011_019_000093	子法才，字元備，幼與弟法藏俱有美名。
HCH_011_019_000094	少游京師，造沈約，約見而稱之。
HCH_011_019_000095	齊和帝爲相國，召爲府參軍，鎮軍蕭穎胄辟主簿。
HCH_011_019_000096	梁臺建，除起部郎。
HCH_011_019_000097	天監二年，藹出鎮嶺表，法才留任京邑，遷金部郎，父憂去官。
HCH_011_019_000098	服闋，除中書通事舍人，出爲本州別駕。
HCH_011_019_000099	入爲通直散騎侍郎，復掌通事，遷尚書右丞。
HCH_011_019_000100	晉安王爲荊州，重除別駕從事史。
HCH_011_019_000101	復徵爲尚書右丞，出爲招遠將軍、建康令。
HCH_011_019_000102	不受俸秩，比去任，將至百金，縣曹啟輸臺庫。
HCH_011_019_000103	高祖嘉其清節，曰：「居職若斯，可以爲百城表矣。」
HCH_011_019_000104	卽日遷太府卿。
HCH_011_019_000105	尋除南康內史，恥以讓俸受名，辭不拜。
HCH_011_019_000106	俄轉雲騎將軍、少府卿。
HCH_011_019_000107	出爲信武長史、江夏太守。
HCH_011_019_000108	因被代，表便道還鄉。
HCH_011_019_000109	至家，割宅爲寺，棲心物表。
HCH_011_019_000110	皇太子以法才舊臣，累有優令，召使東下，未及發而卒，時年六十三。
HCH_011_019_000111	陳吏部尚書姚察曰：蕭穎胄起大州之衆以會義，當其時，人心未之能悟。
HCH_011_019_000112	此三人者，楚之鎮也。
HCH_011_019_000113	經營締構，蓋有力焉。
HCH_011_019_000114	方面之功，坦爲多矣；當官任事，藹則兼之。
HCH_011_019_000115	咸登寵秩，宜乎！
HCH_011_019_000116	本唐朝作品在全世界都属于公有领域，因为作者逝世已经遠遠超过100年。
