HCH_010_038_000001	東京遼陽府，本朝鮮之地。
HCH_010_038_000002	周武王釋箕子囚，去之朝鮮，因以封之。
HCH_010_038_000003	作八條之教，尚禮義，富農桑，外戶不閉，人不爲盜。
HCH_010_038_000004	傳四十餘世。
HCH_010_038_000005	燕屬真番、朝鮮，始置吏、築障。
HCH_010_038_000006	秦屬遼東外徼。
HCH_010_038_000007	漢初，燕人滿王故空地。
HCH_010_038_000008	武帝元封三年，定朝鮮爲真番、臨屯、樂浪、玄菟四郡。
HCH_010_038_000009	後漢出入青、幽二州，遼東、玄菟二郡，沿革不常。
HCH_010_038_000010	漢末爲公孫度所據，傳子康；孫淵，自稱燕王，建元紹漢，魏滅之。
HCH_010_038_000011	晉陷高麗，後歸慕容垂；子寶，以勾麗王安爲平州牧居之。
HCH_010_038_000012	元魏太武遣使至其所居平壤城，遼東京本此。
HCH_010_038_000013	唐高宗平高麗，於此置安東都護府；後爲渤海大氏所有。
HCH_010_038_000014	大氏始保挹婁之東牟山。
HCH_010_038_000015	武后萬歲通天中，爲契丹盡忠所逼，有乞乞仲象者，度遼水自固，武后封爲震國公。
HCH_010_038_000016	傳子祚榮，建都邑，自稱震王，併吞海北，地方五千里，兵數十萬。
HCH_010_038_000017	中宗賜所都曰忽汗州，封渤海郡王。
HCH_010_038_000018	十有二世至彝震，僭號改元，擬建宮闕，有五京、十五府、六十二州，爲遼東盛國。
HCH_010_038_000019	忽汗州即故平壤城也，號中京顯德府。
HCH_010_038_000020	<一>太祖建國，攻渤海，撥忽汗城，俘其王大諲譔，以爲東丹王國，立太子圖欲爲人皇王以主之。
HCH_010_038_000021	神冊四年，葺遼陽故城，以渤海、漢戶建東平郡，爲防禦州。
HCH_010_038_000022	<二>天顯三年，遷東丹國民居之，升爲南京。
HCH_010_038_000023	城名天福，<三>高三丈，有樓櫓，幅員三十里。
HCH_010_038_000024	八門：東曰迎陽，東南曰韶陽，南曰龍原，西南曰顯德，西曰大順，西北曰大遼，北曰懷遠，東北曰安遠。
HCH_010_038_000025	宮城在東北隅，高三丈，具敵樓，南爲三門，壯以樓觀，四隅有角樓，相去各二里。
HCH_010_038_000026	宮牆北有讓國皇帝御容殿。
HCH_010_038_000027	大內建二殿，不置宮嬪，唯以內省使副、判官守之。
HCH_010_038_000028	大東丹國新建南京碑銘，在宮門之南。
HCH_010_038_000029	外城謂之漢城，分南北市，中爲看樓；晨集南市，夕集北市。
HCH_010_038_000030	街西有金德寺；大悲寺；駙馬寺，鐵幡竿在焉；趙頭陀寺；留守衙；戶部司；軍巡院，歸化營軍千餘人，河、朔亡命，皆籍於此。
HCH_010_038_000031	東至北烏魯虎克四百里，南至海邊鐵山八百六十里，西至望平縣海口三百六十里，北至挹婁縣、範河二百七十里。
HCH_010_038_000032	東、西、南三面抱海。
HCH_010_038_000033	遼河出東北山口爲範河，西南流爲大口，入於海；東梁河自東山西流，與渾河合爲小口，會遼河入於海，又名太子河，亦曰大梁水；渾河在東梁、範河之間；沙河出東南山西北流，徑蓋州入於海。
HCH_010_038_000034	有蒲河；清河；水，亦曰泥河，又曰芋濼，水多芋之草；駐蹕山，唐太宗征高麗，駐蹕其巔數日，勒石紀功焉，俗稱手山，山巔平石之上有掌指之狀，泉出其中，取之不竭。
HCH_010_038_000035	又有明王山、白石山亦曰橫山。
HCH_010_038_000036	天顯十三年，改南京爲東京，府曰遼陽。
HCH_010_038_000037	戶四萬六百四。
HCH_010_038_000038	轄州、府、軍、城八十七。
HCH_010_038_000039	<四>統縣九：遼陽縣。
HCH_010_038_000040	本渤海國金德縣地。
HCH_010_038_000041	漢水縣，高麗改爲勾麗縣，渤海爲常樂縣。
HCH_010_038_000042	戶一千五百。
HCH_010_038_000043	仙鄉縣。
HCH_010_038_000044	本漢遼隊縣，渤海爲永豐縣。
HCH_010_038_000045	神仙傳云：「仙人白仲理能煉神丹，點黃金，以救百姓。」
HCH_010_038_000046	戶一千五百。
HCH_010_038_000047	鶴野縣。
HCH_010_038_000048	本漢居就縣地，渤海爲雞山縣。
HCH_010_038_000049	昔丁令威家此，去家千年，化鶴來歸，集於華表柱，以畫表云：「有鳥有鳥丁令威，去家千年今來歸；城郭雖是人民非，何不學仙塚累累。」
HCH_010_038_000050	戶一千二百。
HCH_010_038_000051	析木縣。
HCH_010_038_000052	本漢望平縣地，渤海爲花山縣。
HCH_010_038_000053	戶一千。
HCH_010_038_000054	紫蒙縣。
HCH_010_038_000055	本漢鏤芳縣地。
HCH_010_038_000056	<五>後拂涅國置東平府，領蒙州紫蒙縣。
HCH_010_038_000057	後徙遼城，併入黃嶺縣。
HCH_010_038_000058	渤海復爲紫蒙縣。
HCH_010_038_000059	戶一千。
HCH_010_038_000060	興遼縣。
HCH_010_038_000061	本漢平郭縣地，渤海改爲長寧縣。
HCH_010_038_000062	唐元和中，渤海王大仁秀南定新羅，北略諸部，開置郡邑，遂定今名。
HCH_010_038_000063	戶一千。
HCH_010_038_000064	肅慎縣。
HCH_010_038_000065	以渤海戶置。
HCH_010_038_000066	歸仁縣。
HCH_010_038_000067	順化縣。
HCH_010_038_000068	開州，鎮國軍，節度。
HCH_010_038_000069	本貊地，高麗爲慶州，渤海爲東京龍原府。
HCH_010_038_000070	有宮殿。
HCH_010_038_000071	都督慶、鹽、穆、賀四州事。
HCH_010_038_000072	故縣六：曰龍原、永安、烏山、壁谷、熊山、白楊，皆廢。
HCH_010_038_000073	疊石爲城，周圍二十里。
HCH_010_038_000074	唐薛仁貴征高麗，與其大將溫沙門戰熊山，擒善射者於石城，即此。
HCH_010_038_000075	太祖平渤海，徙其民於大部落，城遂廢。
HCH_010_038_000076	聖宗伐高麗還，<六>周覽城基，復加完葺。
HCH_010_038_000077	開泰三年，遷雙、韓二州千餘戶實之，號開封府開遠軍，節度；更名鎮國軍。
HCH_010_038_000078	隸東京留守，兵事屬東京統軍司。
HCH_010_038_000079	統州三、縣一。
HCH_010_038_000080	開遠縣。
HCH_010_038_000081	本柵城地，高麗爲龍原縣，渤海因之，遼初廢。
HCH_010_038_000082	聖宗東討，復置以軍額。
HCH_010_038_000083	民戶一千。
HCH_010_038_000084	鹽州。
HCH_010_038_000085	本渤海龍河郡，故縣四：海陽、接海、格川、龍河，皆廢。
HCH_010_038_000086	戶三百。
HCH_010_038_000087	隸開州。
HCH_010_038_000088	相去一百四十里。
HCH_010_038_000089	穆州，保和軍，刺史。
HCH_010_038_000090	本渤海會農郡，故縣四：會農、水歧、順化、美縣，皆廢。
HCH_010_038_000091	戶三百。
HCH_010_038_000092	隸開州。
HCH_010_038_000093	東北至開州一百二十里。
HCH_010_038_000094	統縣一：會農縣。
HCH_010_038_000095	賀州，刺史。
HCH_010_038_000096	本渤海吉理郡，故縣四：洪賀、送誠、吉理、石山，皆廢。
HCH_010_038_000097	戶三百。
HCH_010_038_000098	隸開州。
HCH_010_038_000099	定州，保寧軍。
HCH_010_038_000100	高麗置州，故縣一，曰定東。
HCH_010_038_000101	聖宗統和十三年升軍，遷遼西民實之。
HCH_010_038_000102	隸東京留守司。
HCH_010_038_000103	統縣一：定東縣。
HCH_010_038_000104	高麗所置，遼徙遼西民居之。
HCH_010_038_000105	戶八百。
HCH_010_038_000106	保州，宣義軍，節度。
HCH_010_038_000107	高麗置州，故縣一，曰來遠。
HCH_010_038_000108	聖宗以高麗王詢擅立，問罪不服，統和末，高麗降，<七>開泰三年取其保、定二州，於此置榷場。
HCH_010_038_000109	隸東京統軍司。
HCH_010_038_000110	統州、軍二，縣一：來遠縣。
HCH_010_038_000111	初徙遼西諸縣民實之，又徙奚、漢兵七百防戍焉。
HCH_010_038_000112	戶一千。
HCH_010_038_000113	宣州，定遠軍，刺史。
HCH_010_038_000114	開泰三年徙漢戶置。
HCH_010_038_000115	隸保州。
HCH_010_038_000116	懷化軍，下，刺史。
HCH_010_038_000117	開泰三年置。
HCH_010_038_000118	隸保州。
HCH_010_038_000119	辰州，奉國軍，節度。
HCH_010_038_000120	本高麗蓋牟城。
HCH_010_038_000121	唐太宗會李世攻破蓋牟城，即此。
HCH_010_038_000122	渤海改爲蓋州，又改辰州，以辰韓得名。
HCH_010_038_000123	井邑駢列，最爲沖會。
HCH_010_038_000124	遼徙其民於祖州。
HCH_010_038_000125	初曰長平軍。
HCH_010_038_000126	戶二千。
HCH_010_038_000127	隸東京留守司。
HCH_010_038_000128	統縣一：建安縣。
HCH_010_038_000129	盧州，玄德軍，刺史。
HCH_010_038_000130	本渤海杉盧郡，故縣五：山陽、杉盧、漢陽、白岩、霜岩，皆廢。
HCH_010_038_000131	戶三百。
HCH_010_038_000132	在京東一百三十里。
HCH_010_038_000133	兵事屬南女直湯河司。
HCH_010_038_000134	統縣一：熊嶽縣。
HCH_010_038_000135	西至海一十五里，傍海有熊嶽山。
HCH_010_038_000136	來遠城。
HCH_010_038_000137	本熟女直地。
HCH_010_038_000138	統和中伐高麗，以燕軍驍猛，置兩指揮，建城防戍。
HCH_010_038_000139	兵事屬東京統軍司。
HCH_010_038_000140	鐵州，建武軍，刺史。
HCH_010_038_000141	本漢安市縣，高麗爲安市城。
HCH_010_038_000142	唐太宗攻之不下，薛仁貴白衣登城，即此。
HCH_010_038_000143	渤海置州，故縣四：位城、河端、蒼山、龍珍，<八>皆廢。
HCH_010_038_000144	戶一千。
HCH_010_038_000145	在京西南六十里。
HCH_010_038_000146	統縣一：湯池縣。
HCH_010_038_000147	興州，中興軍，節度。
HCH_010_038_000148	本漢海冥縣地。
HCH_010_038_000149	渤海置州，故縣三：盛吉、蒜山、鐵山，皆廢。
HCH_010_038_000150	戶二百。
HCH_010_038_000151	在京西南三百里。
HCH_010_038_000152	湯州。
HCH_010_038_000153	本漢襄平縣地。
HCH_010_038_000154	渤海置州，<九>故縣五：靈峰、常豐、白石、均穀、嘉利，皆廢。
HCH_010_038_000155	戶五百。
HCH_010_038_000156	在京西北一百里。
HCH_010_038_000157	崇州，隆安軍，刺史。
HCH_010_038_000158	本漢長岑縣地。
HCH_010_038_000159	渤海置州，故縣三：崇山、溈水、綠城，皆廢。
HCH_010_038_000160	戶五百。
HCH_010_038_000161	在京東北一百五十里。
HCH_010_038_000162	統縣一：崇信縣。
HCH_010_038_000163	海州，南海軍，節度。
HCH_010_038_000164	本沃沮國地。
HCH_010_038_000165	高麗爲沙卑城，唐李世嘗攻焉。
HCH_010_038_000166	渤海號南京南海府。
HCH_010_038_000167	疊石爲城，幅員九里，都督沃、晴、椒三州。
HCH_010_038_000168	故縣六：沃沮、鷲岩、龍山、濱海、升平、靈泉，皆廢。
HCH_010_038_000169	太平中，大延琳叛，南海城堅守，經歲不下，別部酋長皆被擒，乃降。
HCH_010_038_000170	因盡徙其人於上京，置遷遼縣，移澤州民來實之。
HCH_010_038_000171	戶一千五百。
HCH_010_038_000172	統州二、縣一：臨溟縣。
HCH_010_038_000173	耀州，刺史。
HCH_010_038_000174	本渤海椒州，故縣五，椒山，貂嶺、澌泉、尖山、岩淵，皆廢。
HCH_010_038_000175	戶七百。
HCH_010_038_000176	隸海州。
HCH_010_038_000177	東北至海州二百里。
HCH_010_038_000178	統縣一：岩淵縣。
HCH_010_038_000179	東界新羅，故平壤城在縣西南。
HCH_010_038_000180	東北至海州一百二十里。
HCH_010_038_000181	嬪州，柔遠軍，刺史。
HCH_010_038_000182	本渤海晴州，故縣五：天晴、神陽、蓮池、狼山、仙岩，皆廢。
HCH_010_038_000183	戶五百。
HCH_010_038_000184	隸海州。
HCH_010_038_000185	東南至海州一百二十里。
HCH_010_038_000186	淥州，鴨淥軍，節度。
HCH_010_038_000187	本高麗故國，渤海號西京鴨淥府。
HCH_010_038_000188	城高三丈，廣輪二十里，都督神、桓、豐、正四州事。
HCH_010_038_000189	故縣三：神鹿、神化、劍門，皆廢。
HCH_010_038_000190	大延琳叛，遷餘黨於上京，置易俗縣居之。
HCH_010_038_000191	在者戶二千。
HCH_010_038_000192	隸東京留守司。
HCH_010_038_000193	統州四、縣二：弘聞縣。
HCH_010_038_000194	神鄉縣。
HCH_010_038_000195	桓州。
HCH_010_038_000196	高麗中都城，故縣三：桓都、神鄉、淇水，<一○>皆廢。
HCH_010_038_000197	高麗王於此創立宮闕，國人謂之新國。
HCH_010_038_000198	五世孫釗，晉康帝建元初爲慕容所敗，宮室焚蕩。
HCH_010_038_000199	戶七百。
HCH_010_038_000200	隸淥州。
HCH_010_038_000201	在西南二百里。
HCH_010_038_000202	豐州。
HCH_010_038_000203	渤海置盤安郡，故縣四：安豐、渤恪、隰壤、硤石，皆廢。
HCH_010_038_000204	戶三百。
HCH_010_038_000205	隸淥州。
HCH_010_038_000206	在東北二百一十里。
HCH_010_038_000207	正州。
HCH_010_038_000208	本沸流王故地，國爲公孫康所並。
HCH_010_038_000209	渤海置沸流郡。
HCH_010_038_000210	有沸流水。
HCH_010_038_000211	戶五百。
HCH_010_038_000212	隸淥州。
HCH_010_038_000213	在西北三百八十里。
HCH_010_038_000214	統縣一：東那縣。
HCH_010_038_000215	本漢東耐縣地。
HCH_010_038_000216	<一一>在州西七十里。
HCH_010_038_000217	慕州。
HCH_010_038_000218	本渤海安遠府地，故縣二：慕化、崇平，久廢。
HCH_010_038_000219	戶二百。
HCH_010_038_000220	隸淥州。
HCH_010_038_000221	在西北二百里。
HCH_010_038_000222	顯州，奉先軍，上，節度。
HCH_010_038_000223	本渤海顯德府地。
HCH_010_038_000224	世宗置，以奉顯陵。
HCH_010_038_000225	顯陵者，東丹人皇王墓也。
HCH_010_038_000226	人皇王性好讀書，不喜射獵，購書數萬卷，置醫巫閭山絕頂，築堂曰望海。
HCH_010_038_000227	山南去海一百三十里。
HCH_010_038_000228	大同元年，世宗親護人皇王靈駕歸自汴京。
HCH_010_038_000229	以人皇王愛醫巫閭山水奇秀，因葬焉。
HCH_010_038_000230	山形掩抱六重，於其中作影殿，制度宏麗。
HCH_010_038_000231	州在山東南，遷東京三百餘戶以實之。
HCH_010_038_000232	應曆元年，穆宗葬世宗於顯陵西山，仍禁樵采。
HCH_010_038_000233	有十三山，有沙河。
HCH_010_038_000234	隸長寧、積慶二宮，兵事屬東京都部署司。
HCH_010_038_000235	統州三、縣三：奉先縣。
HCH_010_038_000236	本漢無慮縣，即醫巫閭，幽州鎮山。
HCH_010_038_000237	世宗析遼東長樂縣民以爲陵戶，隸長寧宮。
HCH_010_038_000238	山東縣。
HCH_010_038_000239	本漢望平縣。
HCH_010_038_000240	穆宗割渤海永豐縣民爲陵戶，隸積慶宮。
HCH_010_038_000241	歸義縣。
HCH_010_038_000242	初置顯州，渤海民自來助役，世宗嘉憫，因籍其人戶置縣，隸長寧宮。
HCH_010_038_000243	嘉州，嘉平軍，下，刺史。
HCH_010_038_000244	隸顯州。
HCH_010_038_000245	遼西州，阜成軍，中，刺史。
HCH_010_038_000246	本漢遼西郡地，世宗置州，隸長寧宮，屬顯州。
HCH_010_038_000247	統縣一：長慶縣。
HCH_010_038_000248	統和八年，以諸宮提轄司人戶置。
HCH_010_038_000249	康州，下，刺史。
HCH_010_038_000250	世宗遷渤海率賓府人戶置，屬顯州。
HCH_010_038_000251	初隸長寧宮，後屬積慶宮。
HCH_010_038_000252	統縣一：率賓縣。
HCH_010_038_000253	本渤海率賓府地。
HCH_010_038_000254	<一二>宗州，下，刺史。
HCH_010_038_000255	在遼東石熊山，耶律隆運以所俘漢民置。
HCH_010_038_000256	聖宗立爲州，隸文忠王府。
HCH_010_038_000257	王薨，屬提轄司。
HCH_010_038_000258	統縣一：熊山縣。
HCH_010_038_000259	本渤海縣地。
HCH_010_038_000260	乾州，廣德軍，上，節度。
HCH_010_038_000261	本漢無慮縣地。
HCH_010_038_000262	聖宗統和三年置<一三>，以奉景宗乾陵。
HCH_010_038_000263	有凝神殿。
HCH_010_038_000264	隸崇德宮，兵事屬東京都部署司。
HCH_010_038_000265	統州一、縣四：奉陵縣。
HCH_010_038_000266	本漢無慮縣地。
HCH_010_038_000267	括諸落帳戶，助營山陵。
HCH_010_038_000268	延昌縣。
HCH_010_038_000269	析延昌宮戶置。
HCH_010_038_000270	靈山縣。
HCH_010_038_000271	本渤海靈峰縣地。
HCH_010_038_000272	司農縣。
HCH_010_038_000273	本渤海麓郡縣，並麓波、雲川二縣入焉。
HCH_010_038_000274	海北州，廣化軍，中，刺史。
HCH_010_038_000275	世宗以所俘漢戶置。
HCH_010_038_000276	地在閭山之西，南海之北。
HCH_010_038_000277	初隸宣州，<一四>後屬乾州。
HCH_010_038_000278	統縣一：開義縣。
HCH_010_038_000279	貴德州，寧遠軍，下，節度。
HCH_010_038_000280	本漢襄平縣地，漢公孫度所據<一五>。
HCH_010_038_000281	太宗時察割以所俘漢民置。
HCH_010_038_000282	後以弑逆誅，沒入焉。
HCH_010_038_000283	聖宗建貴德軍，後更名。
HCH_010_038_000284	有陀河、大寶山。
HCH_010_038_000285	隸崇德宮，兵事屬東京都部署司。
HCH_010_038_000286	統縣二：貴德縣。
HCH_010_038_000287	本漢襄平縣，渤海爲崇山縣。
HCH_010_038_000288	奉德縣。
HCH_010_038_000289	本渤海緣城縣地，<一六>嘗置奉德州。
HCH_010_038_000290	瀋州，昭德軍，中，節度。
HCH_010_038_000291	本挹婁國地。
HCH_010_038_000292	渤海建瀋州，故縣九，皆廢。
HCH_010_038_000293	<一七>太宗置興遼軍，後更名。
HCH_010_038_000294	初隸永興宮，<一八>後屬敦睦宮，兵事隸東京都部署司。
HCH_010_038_000295	統州一、縣二：樂郊縣。
HCH_010_038_000296	太祖俘薊州三河民，建三河縣，後更名。
HCH_010_038_000297	靈源縣。
HCH_010_038_000298	太祖俘薊州吏民，建漁陽縣，後更名。
HCH_010_038_000299	岩州，白岩軍，下，刺史。
HCH_010_038_000300	本渤海白岩城，太宗撥屬瀋州。
HCH_010_038_000301	初隸長寧宮，後屬敦睦宮。
HCH_010_038_000302	統縣一：白岩縣。
HCH_010_038_000303	渤海置。
HCH_010_038_000304	集州，懷衆軍，下，刺史。
HCH_010_038_000305	古陴離郡地，漢屬險瀆縣，高麗爲霜岩縣，渤海置州。
HCH_010_038_000306	統縣一：奉集縣。
HCH_010_038_000307	渤海置。
HCH_010_038_000308	廣州，防禦，漢屬襄平縣，高麗爲當山縣，渤海爲鐵利郡。
HCH_010_038_000309	太祖遷渤海人居之，建鐵利州。
HCH_010_038_000310	統和八年省。
HCH_010_038_000311	開泰七年以漢戶置。
HCH_010_038_000312	統縣一：昌義縣。
HCH_010_038_000313	遼州，始平軍，下，節度。
HCH_010_038_000314	本拂涅國城，渤海爲東平府。
HCH_010_038_000315	唐太宗親征高麗，李世撥遼城；高宗詔程振、蘇定方討高麗，至新城，大破之；皆此地也。
HCH_010_038_000316	太祖伐渤海，先破東平府，遷民實之。
HCH_010_038_000317	故東平府都督伊、蒙、陀、黑、北五州，<一九>共領縣十八，皆廢。
HCH_010_038_000318	太祖改爲州，軍曰東平，太宗更爲始平軍。
HCH_010_038_000319	有遼河、羊腸河、錐子河、蛇山、狼山、黑山、巾子山。
HCH_010_038_000320	隸長寧宮，兵事屬北女直兵馬司。
HCH_010_038_000321	統州一、縣二：遼濱縣。
HCH_010_038_000322	安定縣。
HCH_010_038_000323	祺州，<二○>聖軍，下，刺史。
HCH_010_038_000324	本渤海蒙州地。
HCH_010_038_000325	太祖以檀州俘於此建檀州，後更名。
HCH_010_038_000326	隸弘義宮，兵事屬北女直兵馬司。
HCH_010_038_000327	統縣一：慶雲縣。
HCH_010_038_000328	太祖俘密雲民，於此建密雲縣，後更名。
HCH_010_038_000329	遂州，刺史。
HCH_010_038_000330	本渤海美州地，採訪使耶律頗德以部下漢民置。
HCH_010_038_000331	穆宗時，頗德嗣絕，沒入焉。
HCH_010_038_000332	隸延昌宮。
HCH_010_038_000333	統縣一：山河縣。
HCH_010_038_000334	本渤海縣，並黑川、麓川二縣置。
HCH_010_038_000335	通州，安遠軍，節度。
HCH_010_038_000336	本扶餘國王城，渤海號扶餘城。
HCH_010_038_000337	太祖改龍州，聖宗更今名。
HCH_010_038_000338	保寧七年，以黃龍府叛人燕頗餘黨千餘戶置，升節度。
HCH_010_038_000339	<二一>統縣四：通遠縣。
HCH_010_038_000340	本渤海扶餘縣，並布多縣置。
HCH_010_038_000341	安遠縣。
HCH_010_038_000342	本渤海顯義縣，並鵲川縣置。
HCH_010_038_000343	歸仁縣，本渤海強帥縣，<二二>並新安縣置。
HCH_010_038_000344	漁穀縣。
HCH_010_038_000345	本渤海縣。
HCH_010_038_000346	韓州，東平軍，下，刺史。
HCH_010_038_000347	本稿離國舊治柳河縣。
HCH_010_038_000348	高麗置頡府，都督、頡二州。
HCH_010_038_000349	<二三>渤海因之。
HCH_010_038_000350	今廢。
HCH_010_038_000351	太宗置三河、榆河二州。
HCH_010_038_000352	聖宗並二州置。
HCH_010_038_000353	隸延昌宮，兵事屬北女直兵馬司。
HCH_010_038_000354	統縣一：柳河縣。
HCH_010_038_000355	本渤海粵喜縣地，並萬安縣置。
HCH_010_038_000356	雙州，保安軍，下，節度。
HCH_010_038_000357	本挹婁故地。
HCH_010_038_000358	渤海置安定郡，久廢。
HCH_010_038_000359	漚里僧王從太宗南征，以俘鎮、定二州之民建城置州。
HCH_010_038_000360	察割弑逆誅，沒入焉。
HCH_010_038_000361	故隸延昌宮，後屬崇德宮，兵事隸北女直兵馬司。
HCH_010_038_000362	統縣一：雙城縣。
HCH_010_038_000363	本渤海安夷縣地。
HCH_010_038_000364	銀州，富國軍，下，刺史。
HCH_010_038_000365	本渤海富州，太祖以銀冶更名。
HCH_010_038_000366	隸弘義宮，兵事屬北女直兵馬司。
HCH_010_038_000367	統縣三：延津縣。
HCH_010_038_000368	本渤海富壽縣，境有延津故城，更名。
HCH_010_038_000369	新興縣。
HCH_010_038_000370	本故越喜國地，渤海置銀冶，嘗置銀州。
HCH_010_038_000371	永平縣。
HCH_010_038_000372	本渤海優富縣地，太祖以俘戶置。
HCH_010_038_000373	舊有永平寨。
HCH_010_038_000374	同州，鎮安軍，下，節度。
HCH_010_038_000375	本漢襄平縣地，渤海爲東平寨。
HCH_010_038_000376	太祖置州，軍曰鎮東，後更名。
HCH_010_038_000377	隸彰湣宮，兵事屬北女直兵馬司。
HCH_010_038_000378	統州一，未詳；縣二：東平縣。
HCH_010_038_000379	本漢襄平縣地。
HCH_010_038_000380	產鐵，撥戶三百采煉，隨征賦輸。
HCH_010_038_000381	永昌縣。
HCH_010_038_000382	本高麗永寧縣地。
HCH_010_038_000383	咸州，安東軍，下，節度。
HCH_010_038_000384	本高麗銅山縣地，渤海置銅山郡。
HCH_010_038_000385	地在漢候城縣北，渤海龍泉府南。
HCH_010_038_000386	地多山險，寇盜以爲淵藪，乃招平、營等州客戶數百，建城居之。
HCH_010_038_000387	初號郝里太保城，<二四>開泰八年置州。
HCH_010_038_000388	兵事屬北女直兵馬司。
HCH_010_038_000389	統縣一：咸平縣。
HCH_010_038_000390	唐安東都護，天寶中治營、平二州間，即此。
HCH_010_038_000391	太祖滅渤海，復置安東軍。
HCH_010_038_000392	開泰中置縣。
HCH_010_038_000393	信州，彰聖軍，下，節度。
HCH_010_038_000394	<二五>本越喜故城。
HCH_010_038_000395	渤海置懷遠府，今廢。
HCH_010_038_000396	聖宗以地鄰高麗，開泰初置州，以所俘漢民實之。
HCH_010_038_000397	兵事屬黃龍府都部署司。
HCH_010_038_000398	統州三，未詳；縣二：武昌縣。
HCH_010_038_000399	本渤海懷福縣地，析平州提轄司及豹山縣一千戶隸之。
HCH_010_038_000400	定武縣。
HCH_010_038_000401	本渤海豹山縣地，析平州提轄司並乳水縣人戶置。
HCH_010_038_000402	初名定功縣。
HCH_010_038_000403	賓州，懷化軍，節度。
HCH_010_038_000404	本渤海城。
HCH_010_038_000405	統和十七年，遷兀惹戶，置刺史于鴨子、混同二水之間，<二六>後升。
HCH_010_038_000406	兵事隸黃龍府都部署司。
HCH_010_038_000407	<二七>龍州，黃龍府。
HCH_010_038_000408	本渤海扶餘府。
HCH_010_038_000409	太祖平渤海還，至此崩，有黃龍見，更名。
HCH_010_038_000410	保寧七年，軍將燕頗叛，府廢。
HCH_010_038_000411	開泰九年，遷城于東北，以宗州、檀州漢戶一千復置。
HCH_010_038_000412	統州五、縣三：黃龍縣。
HCH_010_038_000413	本渤海長平縣，並富利、佐慕、肅慎置。
HCH_010_038_000414	遷民縣。
HCH_010_038_000415	本渤海永寧縣，並豐水、扶羅置。
HCH_010_038_000416	永平縣。
HCH_010_038_000417	渤海置。
HCH_010_038_000418	益州，觀察。
HCH_010_038_000419	屬黃龍府。
HCH_010_038_000420	統縣一：靜遠縣。
HCH_010_038_000421	安遠州，懷義軍，刺史。
HCH_010_038_000422	屬黃龍府。
HCH_010_038_000423	威州，武寧軍，刺史。
HCH_010_038_000424	屬黃龍府。
HCH_010_038_000425	清州，建寧軍，刺史。
HCH_010_038_000426	屬黃龍府。
HCH_010_038_000427	雍州，刺史。
HCH_010_038_000428	屬黃龍府。
HCH_010_038_000429	湖州，興利軍，刺史。
HCH_010_038_000430	渤海置。
HCH_010_038_000431	兵事隸東京統軍司。
HCH_010_038_000432	統縣一：長慶縣。
HCH_010_038_000433	渤州，清化軍，刺史。
HCH_010_038_000434	渤海置。
HCH_010_038_000435	兵事隸東京統軍司。
HCH_010_038_000436	統縣一：貢珍縣。
HCH_010_038_000437	渤海置。
HCH_010_038_000438	郢州，彰聖軍，刺史。
HCH_010_038_000439	渤海置。
HCH_010_038_000440	兵事隸北女直兵馬司。
HCH_010_038_000441	統縣一：延慶縣。
HCH_010_038_000442	銅州，廣利軍，刺史。
HCH_010_038_000443	渤海置。
HCH_010_038_000444	兵事隸北兵馬司。
HCH_010_038_000445	統縣一：析木縣。
