HCH_009_002_000000	太祖應乾興運昭德定功仁明莊孝大聖武元皇帝，諱旻，本諱阿骨打，世祖第二子也。
HCH_009_002_000001	母曰翼簡皇后拏懶氏。
HCH_009_002_000002	遼道宗時有五色雲氣屢出東方，大若二千斛囷倉之狀，司天孔致和竊謂人曰：「其下當生異人，建非常之事。天以象告，非人力所能爲也。」
HCH_009_002_000003	咸雍四年戊申七月一日，太祖生。
HCH_009_002_000004	幼時與群兒戲，力兼數輩，舉止端重，世祖尤愛之。
HCH_009_002_000005	世祖與臘碚、麻產戰于野鵲水，世祖被四創，疾困，坐太祖于膝，循其發而撫之，曰：「此兒長大，吾復何憂？」
HCH_009_002_000006	十歲，好弓矢。
HCH_009_002_000007	甫成童，即善射。
HCH_009_002_000008	一日，遼使坐府中，顧見太祖手持弓矢，使射群烏，連三發皆中。
HCH_009_002_000009	遼使矍然曰：「奇男子也！」
HCH_009_002_000010	太祖嘗宴紇石烈部活離罕家，散步門外，南望高阜，使衆射之，皆不能至。
HCH_009_002_000011	太祖一發過之，度所至逾三百二十步。
HCH_009_002_000012	宗室謾都訶最善射遠，其不及者猶百步也。
HCH_009_002_000013	天德三年，立射碑以識焉。
HCH_009_002_000014	世祖伐卜灰，太祖因辭不失請從行，世祖不許而心異之。
HCH_009_002_000015	烏春既死，窩謀罕請和。
HCH_009_002_000016	既請和，復來攻，遂圍其城。
HCH_009_002_000017	太祖年二十三，被短甲，免胄，不介馬，行圍號令諸軍。
HCH_009_002_000018	城中望而識之。
HCH_009_002_000019	壯士太峪乘駿馬持槍出城，馳刺太祖。
HCH_009_002_000020	太祖不及備，舅氏活臘胡馳出其間，擊太峪，槍折，刺中其馬，太峪僅得免。
HCH_009_002_000021	嘗與沙忽帶出營殺略，不令世祖知之。
HCH_009_002_000022	且還，敵以重兵追之。
HCH_009_002_000023	獨行隘巷中，失道，追者益急。
HCH_009_002_000024	值高岸與人等，馬一躍而過，追者乃還。
HCH_009_002_000025	世祖寢疾，太祖以事如遼統軍司。
HCH_009_002_000026	將行，世祖戒之曰：「汝速了此事，五月未半而歸，則我猶及見汝也。」
HCH_009_002_000027	太祖往見曷魯騷古統軍，既畢事，前世祖沒一日還至家。
HCH_009_002_000028	世祖見太祖來，所請事皆如志，喜甚，執太祖手，抱其頸而撫之，謂穆宗曰：「烏雅束柔善，惟此子足了契丹事。」
HCH_009_002_000029	穆宗亦雅重太祖，出入必俱。
HCH_009_002_000030	太祖遠出而歸，穆宗必親迓之。
HCH_009_002_000031	世祖已擒臘醅，麻產尚據直屋鎧水。
HCH_009_002_000032	肅宗使太祖先取麻產家屬，康宗至直屋鎧水圍之。
HCH_009_002_000033	太祖會軍，親獲麻產，獻馘于遼。
HCH_009_002_000034	遼命太祖爲詳穩，仍命穆宗、辭不失、歡都皆爲詳穩。
HCH_009_002_000035	久之。
HCH_009_002_000036	以偏師伐泥厖古部跋黑、播立開等，乃以達塗阿爲鄉導，沿帥水夜行襲之，鹵其妻子。
HCH_009_002_000037	初，溫都部跋忒殺唐括部跋葛，穆宗命太祖伐之。
HCH_009_002_000038	太祖入辭，謂穆宗曰：「昨夕見赤祥，此行必克敵。」
HCH_009_002_000039	遂行。
HCH_009_002_000040	是歲大雪，寒甚。
HCH_009_002_000041	與烏古論部兵沿土溫水過末鄰鄉，追及跋忒于阿斯溫山北濼之間，殺之。
HCH_009_002_000042	軍還，穆宗親迓太祖于靄建村。
HCH_009_002_000043	撒改以都統伐留可，謾都訶合石土門伐敵庫德。
HCH_009_002_000044	撒改與將佐議，或欲先平邊地部落城堡，或欲徑攻留可城，議不能決，願得太祖至軍中。
HCH_009_002_000045	穆宗使太祖往，曰：「事必有可疑。軍之未發者止有甲士七十，盡以畀汝。」
HCH_009_002_000046	謾都訶在米里迷石罕城下，石土門未到，土人欲執謾都訶以與敵，使來告急，遇太祖于斜堆甸。
HCH_009_002_000047	太祖曰：「國兵盡在此矣。使敵先得志于謾都訶，後雖種誅之，何益也。」
HCH_009_002_000048	乃分甲士四十與之。
HCH_009_002_000049	太祖以三十人指撒改軍。
HCH_009_002_000050	道遇人曰：「敵已據盆搦嶺南路矣。」
HCH_009_002_000051	衆欲由沙偏嶺往，太祖曰：「汝等畏敵耶？」
HCH_009_002_000052	既度盆搦嶺，不見敵，已而聞敵乃守沙偏嶺以拒我。
HCH_009_002_000053	及至撒改軍，夜急攻之，遲明破其衆。
HCH_009_002_000054	是時，留可、塢塔皆在遼。
HCH_009_002_000055	既破留可，還攻塢塔城，城中人以城降。
HCH_009_002_000056	初，太祖過盆搦嶺，經塢塔城下，從騎有後者，塢塔城人攻而奪之釜。
HCH_009_002_000057	太祖駐馬呼謂之曰：「毋取我炊食器。」
HCH_009_002_000058	其人謾言曰：「公能來此，何憂不得食。」
HCH_009_002_000059	太祖以鞭指之曰：「吾破留可，即于汝乎取之。」
HCH_009_002_000060	至是，其人持釜而前曰：「奴輩誰敢毀祥穩之器也。」
HCH_009_002_000061	遣蒲家奴招詐都，詐都乃降，釋之。
HCH_009_002_000062	穆宗將伐蕭海里，募兵得千餘人。
HCH_009_002_000063	女直兵未嘗滿千，至是，太祖勇氣自倍，曰：「有此甲兵，何事不可圖也！」
HCH_009_002_000064	海里來戰，與遼兵合，因止遼人，自爲戰。
HCH_009_002_000065	勃海留守以甲贈太祖，太祖亦不受。
HCH_009_002_000066	穆宗問何爲不受？
HCH_009_002_000067	曰：「被彼甲而戰，戰勝則是因彼成功也。」
HCH_009_002_000068	穆宗末年，令諸部不得擅置信牌馳驛訊事，號令自此始一，皆自太祖啟之。
HCH_009_002_000069	康宗七年，歲不登，民多流莩，強者轉而爲盜。
HCH_009_002_000070	歡都等欲重其法，爲盜者皆殺之。
HCH_009_002_000071	太祖曰：「以財殺人，不可！財者，人所致也。」
HCH_009_002_000072	遂減盜賊征償法爲征三倍。
HCH_009_002_000073	民間多逋負，賣妻子不能償，康宗與官屬會議，太祖在外庭以帛系杖端，麾其衆，令曰：「今貧者不能自活，賣妻子以償債。骨肉之愛，人心所同。自今三年勿征，過三年徐圖之。」
HCH_009_002_000074	衆皆聽令，聞者感泣，自是遠近歸心焉。
HCH_009_002_000075	歲癸巳十月，康宗夢逐狼，屢發不能中，太祖前射中之。
HCH_009_002_000076	旦日，以所夢問僚佐，衆曰：「吉。兄不能得而弟得之之兆也。」
HCH_009_002_000077	是月，康宗即世，太祖襲位爲都勃極烈。
HCH_009_002_000078	遼使阿息保來，曰：「何以不告喪？」
HCH_009_002_000079	太祖曰：「有喪不能吊，而乃以爲罪乎？」
HCH_009_002_000080	他日，阿息保復來，徑騎至康宗殯所，閱賵馬，欲取之。
HCH_009_002_000081	太祖怒，將殺之，宗雄諫而止。
HCH_009_002_000082	既而遼命久不至。
HCH_009_002_000083	遼主好畋獵、淫酗，怠于政事，四方奏事，往往不見省。
HCH_009_002_000084	紇石烈阿疏既奔遼，穆宗取其城及其部衆，不能歸。
HCH_009_002_000085	遂與族弟銀朮可、辭里罕陰結南江居人渾都僕速，欲與俱亡入高麗。
HCH_009_002_000086	事覺，太祖使夾古撒喝捕之，而銀朮可、辭里罕先爲遼戍所獲，渾都僕速已亡去，撒喝取其妻子而還。
HCH_009_002_000087	二年甲午六月，太祖至江西，遼使使來致襲節度之命。
HCH_009_002_000088	初，遼每歲遣使市名鷹海東青于海上，道出境內，使者貪縱，征索無藝，公私厭苦之。
HCH_009_002_000089	康宗嘗以不遣阿疏爲言，稍拒其使者。
HCH_009_002_000090	太祖嗣節度，亦遣蒲家奴往索阿疏，故常以此二者爲言，終至于滅遼然後已。
HCH_009_002_000091	至是，復遣宗室習古乃、完顏銀朮可往索阿疏。
HCH_009_002_000092	習古乃等還，具言遼主驕肆廢弛之狀。
HCH_009_002_000093	于是召官僚耆舊，以伐遼告之，使備沖要，建城堡，修戎器，以聽後命。
HCH_009_002_000094	遼統軍司聞之，使節度使捏哥來問狀，曰：「汝等有異志乎？修戰具，傷守備，將以誰禦？」
HCH_009_002_000095	太祖答之曰：「設險自守，又何問哉！」
HCH_009_002_000096	遼復遣阿息保來詰之。
HCH_009_002_000097	太祖謂之曰：「我小國也，事大國不敢廢禮。大國德澤不施，而逋逃是主，以此字小，能無望乎？若以阿疏與我，請事朝貢。苟不獲已，豈能束手受制也。」
HCH_009_002_000098	阿息保還，遼人始爲備，命統軍蕭撻不野調諸軍于甯江州。
HCH_009_002_000099	太祖聞之，使僕聒剌復索阿疏，實觀其形勢。
HCH_009_002_000100	僕聒剌還言：「遼兵多，不知其數。」
HCH_009_002_000101	太祖曰：「彼初調兵，豈能遽集如此。」
HCH_009_002_000102	復遣胡沙保往，還言：「惟四院統軍司與甯江州軍及渤海八百人耳。」
HCH_009_002_000103	太祖曰：「果如吾言。」
HCH_009_002_000104	謂諸將佐曰：「遼人知我將舉兵，集諸路軍備我，我必先發制之，無爲人制。」
HCH_009_002_000105	衆皆曰：「善。」
HCH_009_002_000106	乃入見宣靖皇后，告以伐遼事。
HCH_009_002_000107	后曰：「汝嗣父兄立邦家，見可則行。吾老矣，無貽我憂，汝必不至是也。」
HCH_009_002_000108	太祖感泣，奉觴爲壽。
HCH_009_002_000109	即奉后率諸將出門，舉觴東向，以遼人荒肆，不歸阿疏，並己用兵之意，禱于皇天后土。
HCH_009_002_000110	酹畢，后命太祖正坐，與僚屬會酒，號令諸部。
HCH_009_002_000111	使婆盧火征移懶路迪古乃兵，斡魯古、阿魯撫諭斡忽、急賽兩路系遼籍女直，實不迭往完睹路執遼障鷹官達魯古部副使辭列、甯江州渤海大家奴。
HCH_009_002_000112	于是達魯古部實里館來告曰：「聞舉兵伐遼，我部誰從？」
HCH_009_002_000113	太祖曰：「吾兵雖少，舊國也，與汝鄰境，固當從我。若畏遼人，自往就之。」
HCH_009_002_000114	九月，太祖進軍甯江州，次寥晦城。
HCH_009_002_000115	婆盧火徵兵後期，杖之，復遣督軍。
HCH_009_002_000116	諸路兵皆會于來流水，得二千五百人。
HCH_009_002_000117	致遼之罪，申告于天地曰：「世事遼國，恪修職貢，定烏春、窩謀罕之亂，破蕭海里之衆，有功不省，而侵侮是加。罪人阿疏，屢請不遣。今將問罪于遼，天地其鑒佑之。」
HCH_009_002_000118	遂命諸將傳挺而誓曰：「汝等同心盡力，有功者，奴婢部曲爲良，庶人官之，先有官者敘進，輕重視功。苟違誓言，身死梃下，家屬無赦。」
HCH_009_002_000119	師次唐括帶斡甲之地，諸軍禳射，介而立，有光如烈火，起于人足及戈矛之上，人以爲兵祥。
HCH_009_002_000120	明日，次紮只水，光見如初。
HCH_009_002_000121	將至遼界，先使宗幹督士卒夷塹。
HCH_009_002_000122	既度遇渤海軍攻我左翼七謀克，衆少卻，敵兵直犯中軍。
HCH_009_002_000123	斜也出戰，哲垤先驅。
HCH_009_002_000124	太祖曰：「戰不可易也。」
HCH_009_002_000125	遣宗幹止之。
HCH_009_002_000126	宗幹馳出斜也前，控止哲垤馬，斜也遂與俱還。
HCH_009_002_000127	敵人從之，耶律謝十墜馬，遼人前救。
HCH_009_002_000128	太祖射救者斃。
HCH_009_002_000129	並射謝十中之。
HCH_009_002_000130	有騎突前，又射之，徹紮洞胸。
HCH_009_002_000131	謝十拔箭走，追射之，中其背，飲矢之半，僨而死，獲所乘馬。
HCH_009_002_000132	宗幹與數騎陷遼軍中，太祖救之，免胄戰。
HCH_009_002_000133	或自傍射之，矢拂于顙。
HCH_009_002_000134	太祖顧見射者，一矢而斃。
HCH_009_002_000135	謂將士曰：「盡敵而止。」
HCH_009_002_000136	衆從之，勇氣自倍。
HCH_009_002_000137	敵大奔，相蹂踐死者十七八。
HCH_009_002_000138	撒改在別路，不及會戰，使人以戰勝告之，而以謝十馬賜之。
HCH_009_002_000139	撒改使其子宗翰、完顏希尹來賀，且稱帝，因勸進。
HCH_009_002_000140	太祖曰：「一戰而勝，遂稱大號，何示人淺也。」
HCH_009_002_000141	進軍甯江州，諸軍填塹攻城。
HCH_009_002_000142	甯江人自東門出，溫蒂痕、阿徒罕邀擊，盡殪之。
HCH_009_002_000143	十月朔，克其城，獲防禦使大藥師奴，陰縱之，使招諭遼人。
HCH_009_002_000144	鐵驪部來送款。
HCH_009_002_000145	次來流城，以俘獲賜將士。
HCH_009_002_000146	召渤海梁福、斡答剌使之偽亡去，招諭其鄉人曰：「女直、渤海本同一家，我興師伐罪，不濫及無辜也。」
HCH_009_002_000147	使完顏婁室招諭系遼籍女直。
HCH_009_002_000148	師還，謁宣靖皇后，以所獲頒宗室耆老，以實里館貲產給將士。
HCH_009_002_000149	初命諸路以三百戶爲謀克，十謀克爲猛安。
HCH_009_002_000150	酬斡等撫定讒謀水女直。
HCH_009_002_000151	鱉古酋長胡蘇魯以城降。
HCH_009_002_000152	十一月，遼都統蕭糺里、副都統撻不野將步騎十萬會于鴨子河北。
HCH_009_002_000153	太祖自將擊之。
HCH_009_002_000154	未至鴨子河，既夜，太祖方就枕，若有扶其首者三，寤而起，曰：「神明警我也！」
HCH_009_002_000155	即鳴鼓舉燧而行。
HCH_009_002_000156	黎明及河，遼兵方壞淩道，選壯士十輩擊走之。
HCH_009_002_000157	大軍繼進，遂登岸。
HCH_009_002_000158	甲士三千七百，至者才三之一。
HCH_009_002_000159	俄與敵遇于出河店，會大風起，塵埃蔽天，乘風勢擊之，遼兵潰。
HCH_009_002_000160	逐至斡論濼，殺獲首虜及車馬甲兵珍玩不可勝計，遍賜官屬將士，燕犒彌日。
HCH_009_002_000161	遼人嘗言女直兵若滿萬則不可敵，至是始滿萬雲。
HCH_009_002_000162	斡魯古敗遼兵，斬其節度使撻不野。
HCH_009_002_000163	僕虺等攻賓州，拔之。
HCH_009_002_000164	兀惹雛鶻室來降。
HCH_009_002_000165	遼將赤狗兒戰于賓州，僕虺、渾黜敗之。
HCH_009_002_000166	鐵驪王回離保以所部降。
HCH_009_002_000167	吾睹補、蒲察復敗赤狗兒、蕭乙薛軍于祥州東。
HCH_009_002_000168	斡忽、急塞兩路降。
HCH_009_002_000169	斡魯古敗遼軍于鹹州西，斬統軍實婁于陣。
HCH_009_002_000170	完顏婁室克鹹州。
HCH_009_002_000171	是月，吳乞買、撒改、辭不失率宮屬諸將勸進，願以新歲元日恭上尊號，太祖不許。
HCH_009_002_000172	阿離合懣、蒲家奴、宗翰等進曰：「今大功已建，若不稱號，無以系天下心。」
HCH_009_002_000173	太祖曰：「吾將思之。」
HCH_009_002_000174	收國元年正月壬申朔，群臣奉上尊號。
HCH_009_002_000175	是日，即皇帝位。
HCH_009_002_000176	上曰：「遼以賓鐵爲號，取其堅也。賓鐵雖堅，終亦變壞，惟金不變不壞。金之色白，完顏部色尚白。」
HCH_009_002_000177	于是國號大金，改元收國。
HCH_009_002_000178	丙子，上自將攻黃龍府，進臨益州。
HCH_009_002_000179	州人走保黃龍，取其餘民以歸。
HCH_009_002_000180	遼遣都統耶律訛里朵、左副統蕭乙薛、右副統耶律張奴、都監蕭謝佛留，騎二十萬、步卒七萬戍邊。
HCH_009_002_000181	留婁室、銀朮可守黃龍，上率兵趨達魯古城，次甯江州西。
HCH_009_002_000182	遼使僧家奴來議和，國書斥上名，且使爲屬國。
HCH_009_002_000183	庚子，進師，有火光正圓，自空而墜。
HCH_009_002_000184	上曰：「此祥征，殆天助也！」
HCH_009_002_000185	酹白水而拜，將士莫不喜躍，進逼達魯古城。
HCH_009_002_000186	上登高望遼兵若連雲灌木狀，顧謂左右曰：「遼兵心貳而情怯。雖多不足畏！」
HCH_009_002_000187	遂趨高阜爲陣。
HCH_009_002_000188	宗雄以右翼先馳遼左軍，左軍卻。
HCH_009_002_000189	左翼出其陣後，遼右軍皆力戰。
HCH_009_002_000190	婁室、銀朮可沖其中堅。
HCH_009_002_000191	凡九陷陣，皆力戰而出。
HCH_009_002_000192	宗翰請以中軍助之。
HCH_009_002_000193	上使宗幹往爲疑兵。
HCH_009_002_000194	宗雄已得利，擊遼右軍，遼兵遂敗。
HCH_009_002_000195	乘勝追躡，至其營，會日已暮，圍之。
HCH_009_002_000196	黎明，遼軍潰圍出，逐北至阿婁岡。
HCH_009_002_000197	遼步卒盡殪，得其耕具數千以給諸軍。
HCH_009_002_000198	是役也，遼人本欲屯田，且戰且守，故並其耕具獲之。
HCH_009_002_000199	二月，師還。
HCH_009_002_000200	三月辛未朔，獵于寥晦城。
HCH_009_002_000201	四月，遼耶律張奴以國書來。
HCH_009_002_000202	上以書辭慢侮，留其五人，獨遣張奴回報，書亦如之。
HCH_009_002_000203	五月庚午朔，避暑于近郊。
HCH_009_002_000204	甲戌，拜天射柳。
HCH_009_002_000205	故事，五月五日、七月十五日、九月九日拜天射柳，歲以爲常。
HCH_009_002_000206	六月己亥朔，遼耶律張奴復以國書來，猶斥上名。
HCH_009_002_000207	上亦斥遼主名以復之，且諭之使降。
HCH_009_002_000208	七月戊辰，以弟吳乞買爲諳班勃極烈，國相撒改爲國論勃極烈。
HCH_009_002_000209	辭不失爲阿買勃極烈，弟斜也爲國論昊勃極烈，甲戌，遼使辭剌以書來，留之不遣。
HCH_009_002_000210	九百奚營來降。
HCH_009_002_000211	八月戊戌，上親征黃龍府。
HCH_009_002_000212	次混同江，無舟，上使一人道前，乘赭白馬徑涉，曰：「視吾鞭所指而行。」
HCH_009_002_000213	諸軍隨之，水及馬腹。
HCH_009_002_000214	後使舟人測其渡處，深不得其底。
HCH_009_002_000215	熙宗天眷二年，以黃龍府爲濟州，軍曰利涉，蓋以太祖涉濟故也。
HCH_009_002_000216	九月，克黃龍府，遣辭剌還，遂班師。
HCH_009_002_000217	至江，徑渡如前。
HCH_009_002_000218	丁丑，至自黃龍府。
HCH_009_002_000219	己卯，黃龍見空中。
HCH_009_002_000220	癸巳，以國論勃極烈撒改爲國論忽魯勃極烈，阿離合懣爲國論乙室勃極烈。
HCH_009_002_000221	十一月，遼主聞取黃龍府，大懼，自將七十萬至駝門。
HCH_009_002_000222	附馬蕭特末、林牙蕭查剌等騎五萬、步四十萬至斡鄰濼。
HCH_009_002_000223	上自將御之。
HCH_009_002_000224	十二月己亥，行次爻剌，會諸將議。
HCH_009_002_000225	皆曰：「遼兵號七十萬，其鋒未易當。吾軍遠來。人馬疲乏，宜駐于此，深溝高壘以待。」
HCH_009_002_000226	上從之。
HCH_009_002_000227	遣迪古乃、銀朮可鎮達魯古。
HCH_009_002_000228	丁未，上以騎兵親候遼軍，獲督餉者，知遼主以張奴叛，西還二日矣。
HCH_009_002_000229	是日，上還至熟結濼，有光見于予端。
HCH_009_002_000230	戊申，諸將曰：「今遼主既還，可乘怠追擊之。」
HCH_009_002_000231	上曰「敵來不迎戰，去而追之，欲以此爲勇邪？」
HCH_009_002_000232	衆皆悚愧，願自效。
HCH_009_002_000233	上復曰：「誠欲追敵，約齎以往，無事餫饋。若破敵，何求不得。」
HCH_009_002_000234	衆皆奮躍，追及遼主于護步答岡。
HCH_009_002_000235	是役也，兵止二萬。
HCH_009_002_000236	上曰：「彼衆我寡，兵不可分。視其中軍最堅，遼主必在焉。敗其中軍，可以得志。」
HCH_009_002_000237	使右翼先戰。
HCH_009_002_000238	兵數交，左翼合而攻之。
HCH_009_002_000239	遼兵大潰，我師馳之，橫出其中。
HCH_009_002_000240	遼師敗績，死者相屬百餘里。
HCH_009_002_000241	獲輿輦帟幄兵械軍資，他寶物馬牛不可勝計。
HCH_009_002_000242	是戰，斜也援矛殺數十人，阿離本被圍，溫蒂罕迪忽迭以四謀克兵出之，完顏蒙刮身被數創，力戰不已，功皆論最。
HCH_009_002_000243	蕭特末等焚營遁去，遂班師。
HCH_009_002_000244	來穀撒喝取開州，婆盧火下特鄰城，辭里罕降。
HCH_009_002_000245	二年正月戊子，詔曰：「自破遼兵，四方來降者衆，宜加優恤。自今契丹、奚、漢、渤海、系遼籍女直、室韋、達魯古、兀惹、鐵驪諸部官民，己降或爲軍所俘獲，逃遁而還者，勿以爲罪。其酋長仍官之，且使從宜居處。」
HCH_009_002_000246	閏月，高永昌據東京，使撻不野來求援。
HCH_009_002_000247	高麗遣使來賀捷，且求保州。
HCH_009_002_000248	詔許自取之。
HCH_009_002_000249	二月己巳，詔曰：「比以歲凶，庶民艱食，多依附豪族，因爲奴隸，及有犯法，征償莫辦，折身爲奴者，或私約立限，以人對贖，過期則爲奴者，並聽以兩人贖一爲良。若元約以一人贖者，即從元約。」
HCH_009_002_000250	四月乙丑，以斡魯統內外諸軍，與蒲察、迪古乃會咸州路都統斡魯古討高永昌。
HCH_009_002_000251	胡沙補等被害。
HCH_009_002_000252	五月，斡魯等敗永昌，撻不野擒永昌以獻，戮之于軍。
HCH_009_002_000253	東京州縣及南路系遼女直皆降。
HCH_009_002_000254	詔除遼法，省稅賦，置猛安謀克一如本朝之制。
HCH_009_002_000255	以斡魯爲南路都統。
HCH_009_002_000256	迭勃極烈阿徒罕破遼兵六萬于照散城。
HCH_009_002_000257	九月己亥，上獵近郊。
HCH_009_002_000258	乙巳，南路都統斡魯來見于婆盧買水。
HCH_009_002_000259	始制金牌。
HCH_009_002_000260	十二月庚申朔，諳班勃極烈吳乞買及群臣上尊號曰大聖皇帝，改明年爲天輔元年。
HCH_009_002_000261	天輔元年正月，開州叛，加古撒喝等討平之。
HCH_009_002_000262	國論昊勃極烈斜也以兵一萬取泰州。
HCH_009_002_000263	四月，遼秦晉國王耶律捏里來伐，迪古乃、婁室、婆盧火將兵二萬。
HCH_009_002_000264	會咸州路都統斡魯古擊之。
HCH_009_002_000265	五月丁巳，詔自收甯江州已後同姓爲婚者，杖而離之。
HCH_009_002_000266	七月戊申，以完顏斡論知東京事。
HCH_009_002_000267	八月癸亥，高麗遣使來請保州。
HCH_009_002_000268	十二月甲子，斡魯古等敗耶律捍里兵于蒺藜山，拔顯州，乾、懿、豪、徽、成、川、惠等州皆降。
HCH_009_002_000269	是月，宋使登州防禦使馬政以國書來，其略曰：「日出之分，實生聖人。竊聞征遼，屢破勍敵。若克遼之後，五代時陷入契丹漢地，願畀下邑。」
HCH_009_002_000270	二年正月庚寅，遼雙州節度使張崇降。
HCH_009_002_000271	使散睹如宋報聘，書曰：「所請之地，今當與宋夾攻，得者有之。」
HCH_009_002_000272	二月癸丑朔，遼使耶律奴哥等來議和。
HCH_009_002_000273	辛酉，孛堇迪古乃、婁室來見。
HCH_009_002_000274	上以遼主近在中京，而敢輒來，皆杖之。
HCH_009_002_000275	劾里保、雙古等言，鹹州都統斡魯古知遼主在中京而不進討，芻糧豐足而不以實聞，攻顯州時所獲生口財畜多自取。
HCH_009_002_000276	三月癸未朔，命闍哥代爲都統而鞫治之，斡魯古坐降謀克。
HCH_009_002_000277	壬辰，遼使耶律奴哥以國書來。
HCH_009_002_000278	庚子，以婁室言黃龍府地僻且遠，宜重戍守，乃命合諸路謀克，以婁室爲萬戶鎮之。
HCH_009_002_000279	四月辛巳，遼使以國書來。
HCH_009_002_000280	五月丙申，命胡突袞如遼。
HCH_009_002_000281	六月甲寅，詔有司禁民淩虐典雇良人，及倍取贖直者。
HCH_009_002_000282	甲戌，遼通、祺、雙、遼等州八百餘戶來歸，命分置諸部，擇膏腴之地處之。
HCH_009_002_000283	七月癸未，詔曰：「匹里水路完顏朮里古、渤海大家奴等六謀克貧乏之民，昔嘗給以官糧，置之漁獵之地。今曆日已久，不知登耗，可具其數以聞。」
HCH_009_002_000284	胡突袞還自遼，耶律奴哥復以國書來。
HCH_009_002_000285	丙申，胡突袞如遼。
HCH_009_002_000286	遼戶二百來歸，處之泰州。
HCH_009_002_000287	詔遣阿里骨、李家奴、特里底招諭未降者。
HCH_009_002_000288	仍詔達魯古部勃堇辭列：「凡降附新民，善爲存撫。來者各令從便安居，給以官糧，毋輒動擾。」
HCH_009_002_000289	八月，胡突袞還自遼，耶律奴哥、突迭復以國書來。
HCH_009_002_000290	九月戊子，詔曰：「國書詔令，宜選善屬文者爲之。其令所在訪求博學雄才之士。敦遣赴闕。」
HCH_009_002_000291	閏月庚戌朔，以降將霍石、韓慶和爲千戶。
HCH_009_002_000292	九百奚部蕭寶、乙辛，北部訛里野，漢人王六兒、王伯龍，契丹特末、高從佑等，各率衆來降。
HCH_009_002_000293	遼耶律奴哥以國書來。
HCH_009_002_000294	十月癸未，以龍化州降者張應古、劉仲良爲千戶。
HCH_009_002_000295	乙未，鹹州都統司言，漢人李孝功、渤海二哥率衆來降。
HCH_009_002_000296	命各以所部爲千戶。
HCH_009_002_000297	十二月甲辰，遣孛堇朮孛以定遼地諭高麗。
HCH_009_002_000298	耶律奴哥以國書來。
HCH_009_002_000299	遼懿州節度使劉宏以戶三千並執遼候人來降，以爲千戶。
HCH_009_002_000300	川州寇二萬已降復叛，紇古烈照里擊破之。
HCH_009_002_000301	三年正月甲寅，東京人爲質者永吉等五人結衆叛。
HCH_009_002_000302	事覺，誅其首惡，余皆杖百，沒入在行家屬資產之半。
HCH_009_002_000303	詔知東京事斡論，繼有犯者並如之。
HCH_009_002_000304	丙辰，詔鱉古孛堇酬斡曰：「胡魯古、迭八合二部來送款，若等先時不無交惡，自今毋相侵擾。」
