HCH_010_077_000001	耶律屋質，字敵輦，系出孟父房。
HCH_010_077_000002	姿簡靜，有器識，重然諾。
HCH_010_077_000003	遇事造次，處之從容，人莫能測。
HCH_010_077_000004	博學，知天文。
HCH_010_077_000005	會同間，為惕隱。
HCH_010_077_000006	太宗崩，諸大臣立世宗，太后聞之，怒甚，遣皇子李胡以兵逆擊，遇安端、劉哥等於泰德泉，敗歸。
HCH_010_077_000007	李胡盡執世宗臣僚家屬，謂守者曰：「我戰不克，先殪此曹！」
HCH_010_077_000008	人皆恟渙相謂曰：「若果戰，則是父子兄弟相夷矣！」
HCH_010_077_000009	軍次潢河橫渡，隔岸相拒。
HCH_010_077_000010	時屋質從太后，世宗以屋質善籌，欲行間，乃設事奉書，以試太后。
HCH_010_077_000011	太后得書，以示屋質。
HCH_010_077_000012	屋質讀竟，言曰：「太后佐太祖定天下，故臣願竭死力。若太后見疑，臣雖欲盡忠，得乎？為今之計，莫若以言和解，事必有成；否即宜速戰，以決勝負。然人心一搖，國禍不淺，惟太后裁察。」
HCH_010_077_000013	太后曰：「我若疑卿，安肯以書示汝？」
HCH_010_077_000014	屋質對曰：「李胡、永康王皆太祖子孫，神器非移他族，何不可之有？太后宜思長策，與永康王和議。」
HCH_010_077_000015	太后曰：「誰可遣者？」
HCH_010_077_000016	對曰：「太后不疑臣，臣請往。萬一永康王見聽，廟社之福。」
HCH_010_077_000017	太后乃遣屋質授書於帝。
HCH_010_077_000018	帝遣宣徽使耶律海思復書，辭多不遜。
HCH_010_077_000019	屋質諫曰：「書意如此，國家之憂未艾也。能釋怨以安社稷，則臣以為莫若和好。」
HCH_010_077_000020	帝曰：「彼眾烏合，安能敵我？」
HCH_010_077_000021	屋質曰：「即不敵，奈骨肉何！況未知孰勝。借曰幸勝，諸臣之族執於李胡者，無噍類矣。以此計之，惟和為善。」
HCH_010_077_000022	左右聞者失色。
HCH_010_077_000023	帝良久，問曰：「若何而和？」
HCH_010_077_000024	屋質對曰：「與太后相見，各紓忿恚，和之不難；不然，決戰非晚。」
HCH_010_077_000025	帝然之，遂遣海思詣太后約和。
HCH_010_077_000026	往返數日，議乃定。
HCH_010_077_000027	始相見，怨言交讓，殊無和意。
HCH_010_077_000028	太后謂屋質曰：「汝當為我畫之。」
HCH_010_077_000029	屋質進曰：「太后與大王若能釋怨，臣乃敢進說。」
HCH_010_077_000030	太后曰：「汝第言之。」
HCH_010_077_000031	屋質借謁者籌執之，謂太后曰：「昔人皇王在，何故立嗣聖？」
HCH_010_077_000032	太后曰：「立嗣聖者，太祖遺旨。」
HCH_010_077_000033	又曰：「大王何故擅立，不稟尊親？」
HCH_010_077_000034	帝曰：「人皇王當立而不立，所以去之。」
HCH_010_077_000035	屋質正色曰：「人皇王舍父母之國而奔唐，子道當如是耶？大王見太后，不少遜謝，惟怨是尋。太后牽於偏愛，托先帝遺命，妄授神器。如此何敢望和，當速交戰！」
HCH_010_077_000036	擲籌而退。
HCH_010_077_000037	太后泣曰：「向太祖遭諸弟亂，天下荼毒，瘡痍未復，庸可再乎！」
HCH_010_077_000038	乃索籌一。
HCH_010_077_000039	帝曰：「父不為而子為，又誰咎也！」
HCH_010_077_000040	亦取籌而執。
HCH_010_077_000041	左右感激，大慟。
HCH_010_077_000042	太后復謂屋質曰：「議既定，神器竟誰歸？」
HCH_010_077_000043	屋質曰：「太后若授永康王，順天合人，復何疑？」
HCH_010_077_000044	李胡厲聲曰：「我在，兀欲安得立！」
HCH_010_077_000045	屋質曰：「禮有世嫡，不傳諸弟。昔嗣聖之立，尚以為非，況公暴戾殘忍，人多怨讟。萬口一辭，願立永康王，不可奪也。」
HCH_010_077_000046	太后顧李胡曰：「汝亦聞此言乎？汝實自為之！」
HCH_010_077_000047	乃許立永康。
HCH_010_077_000048	帝謂屋質曰：「汝與朕屬尤近，何反助太后？」
HCH_010_077_000049	屋質對曰：「臣以社稷至重，不可輕付，故如是耳。」
HCH_010_077_000050	上喜其忠。
HCH_010_077_000051	天祿二年，耶律天德、蕭翰謀反下獄，惕隱劉哥及其弟盆都結天德等為亂。
HCH_010_077_000052	耶律石剌潛告屋質，屋質遽引入見，白其事。
HCH_010_077_000053	劉哥等不服，事遂寢。
HCH_010_077_000054	未幾，劉哥邀駕觀樗蒲，捧觴上壽，袖刃而進。
HCH_010_077_000055	帝覺，命執之，親詰其事。
HCH_010_077_000056	劉哥自誓，帝復不問。
HCH_010_077_000057	屋質奏曰：「當使劉哥與石剌對狀，不可輒恕。」
HCH_010_077_000058	帝曰：「卿為朕鞫之。」
HCH_010_077_000059	屋質率劍士往訊之，天德等伏罪。
HCH_010_077_000060	誅天德，杖翰，遷劉哥，以盆都使轄戛斯國。
HCH_010_077_000061	三年，表列泰寧王察割陰謀事，上不聽。
HCH_010_077_000062	五年，為右皮室詳穩。
HCH_010_077_000063	秋，上祭讓國皇帝於行宮，與群臣皆醉，察割弒帝。
HCH_010_077_000064	屋質聞有言「衣紫者不可失」，乃易衣而出，亟遣人召諸王，乃喻禁衛長皮室等同力討賊。
HCH_010_077_000065	時壽安王歸帳，屋質遣弟沖迎之。
HCH_010_077_000066	王至，尚猶豫。
HCH_010_077_000067	屋質曰：「大王嗣聖子，賊若得之，必不容。群臣將誰事，社稷將誰賴？萬一落賊手，悔將何及？」
HCH_010_077_000068	王始悟。
HCH_010_077_000069	諸將聞屋質出，相繼而至。
HCH_010_077_000070	遲明整兵，出賊不意，圍之，遂誅察割。
HCH_010_077_000071	亂既平，穆宗即位，謂屋質曰：「朕之性命，實出卿手。」
HCH_010_077_000072	命知國事，以逆黨財產盡賜之，屋質固辭。
HCH_010_077_000073	應歷五年，為北院大王，總山西事。
HCH_010_077_000074	保寧初，宋圍太原，以屋質率兵往援，至白馬嶺，遣勁卒夜出間道，疾馳駐太原西，鳴鼓舉火。
HCH_010_077_000075	宋兵以為大軍至，懼而宵遁。
HCH_010_077_000076	以功加於越。
HCH_010_077_000077	四年，漢劉繼元遣使來貢，致幣於屋質，屋質以聞，帝命受之。
HCH_010_077_000078	五年五月薨，年五十七。
HCH_010_077_000079	帝痛悼，輟朝三日。
HCH_010_077_000080	後道宗詔上京立祠祭享，樹碑以紀其功雲。
HCH_010_077_000081	耶律吼，字曷魯，六院部夷離堇蒲古只之後。
HCH_010_077_000082	端愨好施，不事生產。
HCH_010_077_000083	太宗特加倚任。
HCH_010_077_000084	會同六年，為南院大王，蒞事清簡，人不敢以年少易之。
HCH_010_077_000085	時晉主石重貴表不稱臣，辭多踞慢，吼言晉罪不可不伐。
HCH_010_077_000086	及帝親征，以所部兵從。
HCH_010_077_000087	既入汴，諸將皆取內帑珍異，吼獨取馬鎧，帝嘉之。
HCH_010_077_000088	及帝崩於欒城，無遺詔，軍中憂懼不知所為。
HCH_010_077_000089	吼詣北院大王耶律窪議曰：「天位不可一日曠。若請於太后，則必屬李胡。李胡暴戾殘忍，詎能子民。必欲厭人望。則當立永康王。」
HCH_010_077_000090	窪然之。
HCH_010_077_000091	會耶律安摶來，意與吼合，遂定議立永康王，是為世宗。
HCH_010_077_000092	頃之，以功加采訪使，賜以寶貨。
HCH_010_077_000093	吼辭曰：「臣位已高，敢復求富！臣從弟的錄諸子坐事籍沒，陛下哀而出之，則臣受賜多矣。」
HCH_010_077_000094	上曰：「吼舍重賞，以族人為請，其賢遠甚。」
HCH_010_077_000095	許之，仍賜宮戶五十。
HCH_010_077_000096	時有取當世名流作《七賢傳》者，吼與其一。
HCH_010_077_000097	天祿三年卒，年三十九。
HCH_010_077_000098	子何魯不。
HCH_010_077_000099	何魯不，字斜寧，嘗與耶律屋質平察割亂。
HCH_010_077_000100	穆宗以其父吼首議立世宗，故不顯用。
HCH_010_077_000101	晚年為本族敞史。
HCH_010_077_000102	及景宗即位，以平察割功，授昭德軍節度使，為北院大王。
HCH_010_077_000103	時黃龍府軍將燕頗殺守臣以叛，何魯不討之，破於鴨淥江。
HCH_010_077_000104	坐不親追擊，以至失賊，杖之。
HCH_010_077_000105	乾亨間卒。
HCH_010_077_000106	耶律安摶，曾祖巖木，玄祖之長子。
HCH_010_077_000107	祖楚不魯，為本部夷離堇。
HCH_010_077_000108	父叠裏，幼多疾，時太祖為撻馬狘沙裏，常加撫育。
HCH_010_077_000109	神冊六年，為惕隱，從太祖將龍軍討阻卜、党項有功。
HCH_010_077_000110	天贊三年，為南院夷離堇，征渤海，攻忽汗城，俘斬甚眾。
HCH_010_077_000111	太祖崩，淳欽皇后稱制，欲以大元帥嗣位。
HCH_010_077_000112	叠裏建言，帝位宣先嫡長；今東丹王赴朝，當立。
HCH_010_077_000113	由是忤旨。
HCH_010_077_000114	以黨附東丹王，詔下獄，訊鞫，加以炮烙。
HCH_010_077_000115	不伏，殺之，籍其家。
HCH_010_077_000116	安摶自幼若成人，居父喪，哀毀過禮，見者傷之。
HCH_010_077_000117	太宗屢加慰諭，嘗曰：「此兒必為令器。」
HCH_010_077_000118	既長，寡言笑，重然諾，動遵繩矩，事母至孝。
HCH_010_077_000119	以父死非罪，未葬，不預宴樂。
HCH_010_077_000120	世宗在藩邸，尤加憐恤，安摶密自結納。
HCH_010_077_000121	太宗伐晉還，至欒城崩，諸將欲立世宗，以李胡及壽安王在朝，猶豫未決。
HCH_010_077_000122	時安摶直宿衛，世宗密召問計。
HCH_010_077_000123	安摶曰：「大王聰安寬恕，人皇王之嫡長；先帝雖有壽安，天下屬意多在大王。今若不斷，後悔無及。」
HCH_010_077_000124	會有自京師來者，安摶詐以李胡死傳報軍中，皆以為信。
HCH_010_077_000125	於是安摶詣北、南二大王計之。
HCH_010_077_000126	北院大王窪聞而遽起曰：「吾二人方議此事。先帝嘗欲以永康王為儲貳，今日之事，有我輩在，孰敢不從！但恐不白太后而立，為國家啟釁。」
HCH_010_077_000127	安摶對曰：「大王既知先帝欲以永康王為儲副，況永康王賢明，人心樂附。今天下甫定，稍緩則大事去矣。若白太后，必立李胡。且李胡殘暴，行路共知，果嗣位，如社稷何？」
HCH_010_077_000128	南院大王吼曰：「此言是也。吾計決矣！」
HCH_010_077_000129	乃整軍，召諸將奉世宗即位於太宗柩前。
HCH_010_077_000130	帝立，以安摶為腹心，總知宿衛。
HCH_010_077_000131	是歲，約和於潢河橫渡。
HCH_010_077_000132	太后問安摶曰：「吾與汝有何隙？」
HCH_010_077_000133	安摶以父死為對，太后默然。
HCH_010_077_000134	及置北院樞密使，上命安摶為之，賜奴婢百口，寵任無比，事皆取決焉。
HCH_010_077_000135	然性太寬，事循茍簡，豪猾縱恣不能制。
HCH_010_077_000136	天祿末，察割兵犯禦幄，又不能討，由是中外短之。
HCH_010_077_000137	穆宗即位，以立世宗之故，不復委用。
HCH_010_077_000138	應歷三年，或誣安摶與齊王罨撒葛謀亂，系獄死。
HCH_010_077_000139	侄撒給，左皮室詳穩。
HCH_010_077_000140	耶律窪，字敵輦，隋國王釋魯孫，南院夷離堇綰思子。
HCH_010_077_000141	少有器識，人以公輔期之。
HCH_010_077_000142	太祖時，雖未官，常任以事。
HCH_010_077_000143	太宗即位，為惕隱。
HCH_010_077_000144	天顯末，帝援河東，窪為先鋒，敗張敬達軍於太原北。
HCH_010_077_000145	會同中，遷北院大王。
HCH_010_077_000146	及伐晉，復為先鋒，與梁漢璋戰於瀛州，敗之。
HCH_010_077_000147	太宗崩於欒城，南方州郡多叛，士馬困乏，軍中不知所為。
HCH_010_077_000148	窪與耶律吼定策立世宗，乃令諸將曰：「大行上賓，神器無主，永康王人皇王之嫡長，天人所屬，當立；有不從者，以軍法從事。」
HCH_010_077_000149	諸將皆曰：「諾。」
HCH_010_077_000150	世宗即位，賜宮戶五十，拜於越。
HCH_010_077_000151	卒，年五十四。
HCH_010_077_000152	耶律頹昱，字團寧，孟父楚國王之後。
HCH_010_077_000153	父末掇，嘗為夷離堇。
HCH_010_077_000154	頹昱性端直。
HCH_010_077_000155	會同中，領九石烈部，政濟寬猛。
HCH_010_077_000156	世宗即位，為惕隱。
HCH_010_077_000157	天祿三年，兼政事令，封漆水郡王。
HCH_010_077_000158	及穆宗立，以匡贊功，嘗許以本部大王。
HCH_010_077_000159	後將葬世宗，頹昱懇言於帝曰：「臣蒙先帝厚恩，未能報；幸及大葬，臣請陪位。」
HCH_010_077_000160	帝由是不悅，寢其議。
HCH_010_077_000161	薨。
HCH_010_077_000162	耶律撻烈，字涅魯袞，六院部郎君甗古直之後。
HCH_010_077_000163	沈厚多智，有任重才。
HCH_010_077_000164	年四十未仕。
HCH_010_077_000165	會同間，為邊部令穩。
HCH_010_077_000166	應歷初，升南院大王，均賦役，勸耕稼，部人化之，戶口豐殖。
HCH_010_077_000167	時周人侵漢，以撻烈都統西南道軍援之。
HCH_010_077_000168	周已下太原數城，漢人不敢戰。
HCH_010_077_000169	及聞撻烈兵至，周主遣郭從義、尚鈞等率精騎拒於忻口。
HCH_010_077_000170	撻烈擊敗之，獲其將史彥超，周軍遁歸，復所陷城邑，漢主詣撻烈謝。
HCH_010_077_000171	及漢主殂，宋師來伐，上命撻烈為行軍都統，發諸道兵救之。
HCH_010_077_000172	既出雁門，宋諜知而退。
HCH_010_077_000173	保寧元年，加兼政事令，致政。
HCH_010_077_000174	乾亨初，召之。
HCH_010_077_000175	上見鬚髮皓然，精力猶健，問以政事，厚禮之。
HCH_010_077_000176	以疾薨，年七十九。
HCH_010_077_000177	撻烈凡用兵，賞罰信明，得士卒心。
HCH_010_077_000178	河東單弱，不為周、宋所並者，撻烈有力焉。
HCH_010_077_000179	在治所不修邊幅，百姓無稱，年穀屢稔。
HCH_010_077_000180	時耶律屋質居北院，撻烈居南院，俱有政跡，朝議以為「富民大王」云。
HCH_010_077_000181	贊曰：立嗣以嫡，禮也。
HCH_010_077_000182	太宗崩，非安摶、吼、窪謀而克斷，策立世宗，非屋質直而能諫，杜太后之私，折李胡之暴，以成橫渡之約，則亂將誰定？
HCH_010_077_000183	四臣者，庶幾《春秋》首止之功哉。
HCH_010_077_000184	本元朝作品在全世界都属于公有领域，因为作者逝世已经遠遠超过100年。
