HCH_009_116_000254	三年，大元兵圍中都，詔以慶山奴為宣差便宜都提控，率所募兵往援。
HCH_009_116_000255	俄為元帥右都監，行帥府事，兼前職。
HCH_009_116_000256	四年，知慶陽府事，兼慶原路兵馬都總管，以所獲馬駝進，詔諭曰：「此皆軍士所得，即以與之可也，朕安用哉。後勿複進。」
HCH_009_116_000257	因令遍諭諸道帥府焉。
HCH_009_116_000258	興定元年正月，大元兵及夏人回經甯州，慶山奴以兵邀擊敗之，以功進元帥左都監，兼保大軍節度使，行帥府事於鄜州。
HCH_009_116_000259	二年五月，夏人率步騎三千由葭州入寇，慶山奴以兵逆之，戰于馬吉峰，殺百餘人，斬酋首二級，生擒數十人，獲馬三十餘疋。
HCH_009_116_000260	三年四月，夏人據通秦寨，慶山奴遣提控納合買住討之。
HCH_009_116_000261	夏人以步騎二萬逆戰，買住擊敗之，夏人由葭盧川遁去，凡斬首八百級。
HCH_009_116_000262	俄而複攻寨據之，慶山奴率兵與戰，斬首千級，複其寨。
HCH_009_116_000263	詔賜慶山奴金帶一，將士賞賚有差。
HCH_009_116_000264	四年四月，破夏兵於宥州，斬首千餘級，遂圍神堆府。
HCH_009_116_000265	慶山奴四面攻之，士卒方登陴，援兵大至，複擊走之。
HCH_009_116_000266	正大四年，李全據楚州，詔以慶山奴為元帥，同總帥完顏訛可將兵守盱眙，且令城守勿出戰。
HCH_009_116_000267	已而全軍盱眙界，二帥迎敵大敗，死者萬余人，委棄資杖甚眾，時軍無見糧，轉輸不繼，民疲奔命，愁歎盈路。
HCH_009_116_000268	諸相不肯正言，樞密判官白華拜章乞斬之以謝天下，不報。
HCH_009_116_000269	降為定國軍節度使，又以受賂奪一官。
HCH_009_116_000270	八年正月，鳳翔破，兩行省徙京兆居民于河南，令慶山奴以行省守之。
HCH_009_116_000271	時京兆行省止有病卒八百、瘦馬二百，承立懼不能守，屢上奏請還。
HCH_009_116_000272	每奏一帖，附其兄白撒一書，令為地，朝廷不許。
HCH_009_116_000273	十月，慶山奴棄京兆還朝，留同知乾州軍州事、保義軍提控苟琪守之。
HCH_009_116_000274	慶山奴行至閿鄉，哀宗遣近侍裴滿七斤授以黃陵岡從宜，不聽入見。
HCH_009_116_000275	未幾，代徒單兀典行省事於徐州。
HCH_009_116_000276	九年正月，自徐引兵入援，選精銳一萬五千，與徐帥完顏兀論統之，將趨歸德。
HCH_009_116_000277	義勝軍總領侯進、杜政、張興等率所部三千人降大兵。
HCH_009_116_000278	慶山奴留睢州三日不敢進，聞大兵且至，懼此州不可守，退保歸德。
HCH_009_116_000279	二月，行次楊驛店，遇小乃泬軍。
HCH_009_116_000280	遂潰。
HCH_009_116_000281	兀論戰死，慶山奴馬躓被擒，惟元帥郭恩、都尉烏林答阿督率三百餘人走歸德。
HCH_009_116_000282	大兵以一馬載慶山奴，擁迫而行，道中見真定史帥，承立問曰：「君為誰？」
HCH_009_116_000283	史帥言：「我真定五路史萬戶也。」
HCH_009_116_000284	承立曰：「是天澤乎？」
HCH_009_116_000285	曰：「然。」
HCH_009_116_000286	曰：「吾國已殘破，公其以生靈為念。」
HCH_009_116_000287	及見大帥忒木泬，誘之使招京城，不從，又偃蹇不屈。
HCH_009_116_000288	左右以刀斫其足折，亦不降，即殺之。
HCH_009_116_000289	議者以承立累敗不能解其軍職，死有餘責，而能以死報國，亦足稱雲。
HCH_009_116_000290	初，睢州刺史張文壽聞大兵將至，遷旁縣居民入城，大聚芻粟，然無固守意，日夜謀走以自便。
HCH_009_116_000291	既而，聞承立人援，即以州事付其僚佐，托以應援徐兵，夜啟關契家走歸德，慶山奴以為行部郎中，死楊驛。
HCH_009_116_000292	俄大兵圍睢州，以無主將，故殘破之甚也。
HCH_009_116_000293	兀論，丞相賽不之侄，元光間例以諸帥為總領，兀論以丞相故獨不罷。
HCH_009_116_000294	金朝防近族而用疏屬，故白撒、承立、兀論輩皆腹心倚之。
HCH_009_116_000295	贊曰：官奴素行反側，倏南倏北，若龍斷然。
HCH_009_116_000296	哀宗一旦倚為腹心，終為所制，照碧之處，何異幽囚，其事與梁武、侯景大同而小異。
HCH_009_116_000297	徒單兀典、慶山奴為將皆貪，宜數取敗。
HCH_009_116_000298	女魯歡無大失行，而死於官奴，哀宗猶暴其罪，冤哉。
