HCH_011_049_000000	昔司馬遷、班固書，並爲《司馬相如傳》，相如不預漢廷大事，蓋取其文章尤著也。
HCH_011_049_000001	固又爲《賈鄒枚路傳》，亦取其能文傳焉。
HCH_011_049_000002	范氏《後漢書》有《文苑傳》，所載之人，其詳已甚。
HCH_011_049_000003	然經禮樂而緯國家，通古今而述美惡，非文莫可也。
HCH_011_049_000004	是以君臨天下者，莫不敦悅其義，縉紳之學，咸貴尚其道，古往今來，未之能易。
HCH_011_049_000005	高祖聰明文思，光宅區宇，旁求儒雅，詔采異人，文章之盛，煥乎俱集。
HCH_011_049_000006	每所御幸，輒命羣臣賦詩，其文善者，賜以金帛，詣闕庭而獻賦頌者，或引見焉。
HCH_011_049_000007	其在位者，則沈約、江淹、任昉，並以文采，妙絕當時。
HCH_011_049_000008	至若彭城到沆、吳興丘遲、東海王僧孺、吳郡張率等，或入直文德，通讌壽光，皆後來之選也。
HCH_011_049_000009	約、淹、昉、僧孺，率別以功跡論。
HCH_011_049_000010	今綴到沆等文兼學者，至太清中人，爲《文學傳》云。
HCH_011_049_000011	到沆字茂瀣，彭城武原人也。
HCH_011_049_000012	曾祖彥之，宋將軍。
HCH_011_049_000013	父撝，齊五兵尚書。
HCH_011_049_000014	沆幼聰敏，五歲時，撝於屏風抄古詩，沆請教讀一遍，便能諷誦，無所遺失。
HCH_011_049_000015	旣長勤學，善屬文，工篆隸。
HCH_011_049_000016	美風神，容止可悅。
HCH_011_049_000017	齊建武中，起家後軍法曹參軍。
HCH_011_049_000018	天監初，遷征虜主簿。
HCH_011_049_000019	高祖初臨天下，收拔賢俊，甚愛其才。
HCH_011_049_000020	東宮建，以爲太子洗馬。
HCH_011_049_000021	時文德殿置學士省，召高才碩學者待詔其中，使校定墳史，詔沆通籍焉。
HCH_011_049_000022	時高祖讌華光殿，命羣臣賦詩，獨詔沆爲二百字，三刻使成。
HCH_011_049_000023	沆於坐立奏，其文甚美。
HCH_011_049_000024	俄以洗馬管東宮書記、散騎省優策文。
HCH_011_049_000025	三年，詔尚書郎在職清能或人才高妙者爲侍郎，以沆爲殿中曹侍郎。
HCH_011_049_000026	沆從父兄溉、洽，並有才名，時皆相代爲殿中，當世榮之。
HCH_011_049_000027	四年，遷太子中舍人。
HCH_011_049_000028	沆爲人不自伐，不論人長短，樂安任昉、南鄉范雲皆與友善。
HCH_011_049_000029	其年，遷丹陽尹丞，以疾不能處職事，遷北中郎諮議參軍。
HCH_011_049_000030	五年，卒官，年三十。
HCH_011_049_000031	高祖甚傷惜焉，詔賜錢二萬，布三十匹。
HCH_011_049_000032	所著詩賦百餘篇。
HCH_011_049_000033	丘遲字希範，吳興烏程人也。
HCH_011_049_000034	父靈鞠，有才名，仕齊官至太中大夫。
HCH_011_049_000035	遲八歲便屬文，靈鞠常謂氣骨似我。
HCH_011_049_000036	黃門郎謝超宗、徵士何點並見而異之。
HCH_011_049_000037	及長，州辟從事，舉秀才，除太學博士。
HCH_011_049_000038	遷大司馬行參軍，遭父憂去職。
HCH_011_049_000039	服闋，除西中郎參軍。
HCH_011_049_000040	累遷殿中郎，以母憂去職。
HCH_011_049_000041	服除，復爲殿中郎，遷車騎錄事參軍。
HCH_011_049_000042	高祖平京邑，霸府開，引爲驃騎主簿，甚被禮遇。
HCH_011_049_000043	時勸進梁王及殊禮，皆遲文也。
HCH_011_049_000044	高祖踐阼，拜散騎侍郎，俄遷中書侍郎，領吳興邑中正，待詔文德殿。
HCH_011_049_000045	時高祖著《連珠》，詔羣臣繼作者數十人，遲文最美。
HCH_011_049_000046	天監三年，出爲永嘉太守，在郡不稱職，爲有司所糾，高祖愛其才，寢其奏。
HCH_011_049_000047	四年，中軍將軍臨川王宏北伐，遲爲諮議參軍，領記室。
HCH_011_049_000048	時陳伯之在北，與魏軍來距，遲以書喻之，伯之遂降。
HCH_011_049_000049	還拜中書郎，遷司徒從事中郎。
HCH_011_049_000050	七年，卒官，時年四十五。
HCH_011_049_000051	所著詩賦行於世。
HCH_011_049_000052	劉苞字孝嘗，彭城人也。
HCH_011_049_000053	祖勔，宋司空。
HCH_011_049_000054	父愃，齊太子中庶子。
HCH_011_049_000055	苞四歲而父終，及年六七歲，見諸父常泣。
HCH_011_049_000056	時伯、叔父悛、繪等並顯貴，苞母謂其畏憚，怒之。
HCH_011_049_000057	苞對曰：「早孤不及有識，聞諸父多相似，故心中欲悲，無有佗意。」
HCH_011_049_000058	因而歔欷，母亦慟甚。
HCH_011_049_000059	初，苞父母及兩兄相繼亡沒，悉假瘞焉。
HCH_011_049_000060	苞年十六，始移墓所，經營改葬，不資諸父，未幾皆畢，繪常嘆服之。
HCH_011_049_000061	少好學，能屬文。
HCH_011_049_000062	起家爲司徒法曹行參軍，不就。
HCH_011_049_000063	天監初，以臨川王妃弟故，自征虜主簿仍遷王中軍功曹，累遷尚書庫部侍郎、丹陽尹丞、太子太傅丞、尚書殿中侍郎、南徐州治中，以公事免。
HCH_011_049_000064	久之，爲太子洗馬，掌書記，侍講壽光殿。
HCH_011_049_000065	自高祖卽位，引後進文學之士，苞及從兄孝綽、從弟孺、同郡到溉、溉弟洽、從弟沆、吳郡陸倕、張率並以文藻見知，多預讌坐，雖仕進有前後，其賞賜不殊。
HCH_011_049_000066	天監十年，卒，時年三十。
HCH_011_049_000067	臨終，呼友人南陽劉之遴託以喪事，務從儉率。
HCH_011_049_000068	苞居官有能名，性和而直，與人交，面折其非，退稱其美，情無所隱，士友咸以此嘆惜之。
HCH_011_049_000069	袁峻字孝高，陳郡陽夏人，魏郎中令渙之八世孫也。
HCH_011_049_000070	峻早孤，篤志好學，家貧無書，每從人假借，必皆抄寫，自課日五十紙，紙數不登，則不休息。
HCH_011_049_000071	訥言語，工文辭。
HCH_011_049_000072	義師剋京邑，鄱陽王恢東鎮破岡，峻隨王知管記事。
HCH_011_049_000073	天監初，鄱陽國建，以峻爲侍郎，從鎮京口。
HCH_011_049_000074	王遷郢州，兼都曹參軍。
HCH_011_049_000075	高祖雅好辭賦，時獻文於南闕者相望焉，其藻麗可觀，或見賞擢。
HCH_011_049_000076	六年，峻乃擬揚雄《官箴》奏之。
HCH_011_049_000077	高祖嘉焉，賜束帛。
HCH_011_049_000078	除員外散騎侍郎，直文德學士省，抄《史記》、《漢書》各爲二十卷。
HCH_011_049_000079	又奉敕與陸倕各制《新闕銘》，辭多不載。
HCH_011_049_000080	庾於陵字子介，散騎常侍黔婁之弟也。
HCH_011_049_000081	七歲能言玄理。
HCH_011_049_000082	旣長，清警博學有才思。
HCH_011_049_000083	齊隨王子隆爲荊州，召爲主簿，使與謝朓、宗夬抄撰羣書。
HCH_011_049_000084	子隆代還，又以爲送故主簿。
HCH_011_049_000085	子隆尋爲明帝所害，僚吏畏避，莫有至者，唯於陵與夬獨留，經理喪事。
HCH_011_049_000086	始安王遙光爲撫軍，引爲行參軍，兼記室。
HCH_011_049_000087	永元末，除東陽遂安令，爲民吏所稱。
HCH_011_049_000088	天監初，爲建康獄平，遷尚書工部郎，待詔文德殿。
HCH_011_049_000089	出爲湘州別駕，遷驃騎錄事參軍，兼中書通事舍人。
HCH_011_049_000090	俄領南郡邑中正，拜太子洗馬，舍人如故。
HCH_011_049_000091	舊事，東宮官屬，通爲清選，洗馬掌文翰，尤其清者。
HCH_011_049_000092	近世用人，皆取甲族有才望，時於陵與周捨並擢充職，高祖曰：「官以人而清，豈限以甲族。」
HCH_011_049_000093	時論以爲美。
HCH_011_049_000094	俄遷散騎侍郎，改領荊州大中正。
HCH_011_049_000095	累遷中書黃門侍郎，舍人、中正並如故。
HCH_011_049_000096	出爲宣毅晉安王長史、廣陵太守，行府州事，以公事免。
HCH_011_049_000097	復起爲通直郎，尋除鴻臚卿，復領荊州大中正。
HCH_011_049_000098	卒官，時年四十八。
HCH_011_049_000099	文集十卷。
HCH_011_049_000100	弟肩吾。
HCH_011_049_000101	肩吾字子慎。
HCH_011_049_000102	八歲能賦詩，特爲兄於陵所友愛。
HCH_011_049_000103	初爲晉安王國常侍，仍遷王宣惠府行參軍。
HCH_011_049_000104	自是每王徙鎮，肩吾常隨府。
HCH_011_049_000105	歷王府中郎、雲麾參軍，並兼記室參軍。
HCH_011_049_000106	中大通三年，王爲皇太子，兼東宮通事舍人，除安西湘東王錄事參軍，俄以本官領荊州大中正。
HCH_011_049_000107	累遷中錄事諮議參軍、太子率更令、中庶子。
HCH_011_049_000108	初，太宗在籓，雅好文章士，時肩吾與東海徐摛、吳郡陸杲、彭城劉遵、劉孝儀、儀弟孝威，同被賞接。
HCH_011_049_000109	及居東宮，又開文德省，置學士，肩吾子信、摛子陵、吳郡張長公、北地傅弘、東海鮑至等充其選。
HCH_011_049_000110	齊永明中，文士王融、謝朓、沈約文章始用四聲，以爲新變，至是轉拘聲韻，彌尚麗靡，復逾於往時。
HCH_011_049_000111	時太子與湘東王書論之曰：太清中，侯景寇陷京都；及太宗卽位，以肩吾爲度支尚書。
HCH_011_049_000112	時上流諸蕃，並據州拒景，景矯詔遣肩吾使江州，喻當陽公大心，大心尋舉州降賊。
HCH_011_049_000113	肩吾因逃入建昌界，久之，方得赴江陵，未幾卒。
HCH_011_049_000114	文集行於世。
HCH_011_049_000115	劉昭字宣卿，平原高唐人，晉太尉實九世孫也。
HCH_011_049_000116	祖伯龍，居父憂以孝聞，宋武帝敕皇太子諸王並往吊慰，官至少府卿。
HCH_011_049_000117	父彪，齊征虜晉安王記室。
HCH_011_049_000118	昭幼清警，七歲通《老》、《莊》義。
HCH_011_049_000119	旣長，勤學善屬文，外兄江淹早相稱賞。
HCH_011_049_000120	天監初，起家奉朝請，累遷征北行參軍、尚書倉部郎，尋除無錫令。
HCH_011_049_000121	曆爲宣惠豫章王、中軍臨川王記室。
HCH_011_049_000122	初，昭伯父肜集衆家《晉書》注干寶《晉紀》爲四十卷，至昭又集《後漢》同異以注范曄書，世稱博悉。
HCH_011_049_000123	遷通直郎，出爲剡令，卒官。
HCH_011_049_000124	《集注後漢》一百八十卷，《幼童傳》十卷，文集十卷。
HCH_011_049_000125	子縚，字言明。
HCH_011_049_000126	亦好學，通《三禮》。
HCH_011_049_000127	大同中，爲尚書祠部郎，尋去職，不復仕。
HCH_011_049_000128	縚弟緩，字含度，少知名。
HCH_011_049_000129	歷官安西湘東王記室，時西府盛集文學，緩居其首。
HCH_011_049_000130	除通直郎，俄遷鎮南湘東王中錄事，復隨府江州，卒。
HCH_011_049_000131	何遜字仲言，東海郯人也。
HCH_011_049_000132	曾祖承天，宋御史中丞。
HCH_011_049_000133	祖翼，員外郎。
HCH_011_049_000134	父詢，齊太尉中兵參軍。
HCH_011_049_000135	遜八歲能賦詩，弱冠，州舉秀才。
HCH_011_049_000136	南鄉范雲見其對策，大相稱賞，因結忘年交好。
HCH_011_049_000137	自是一文一詠，雲輒嗟賞，謂所親曰：「頃觀文人，質則過儒，麗則傷俗；其能含清濁，中今古，見之何生矣。」
HCH_011_049_000138	沈約亦愛其文，嘗謂遜曰：「吾每讀卿詩，一日三復，猶不能已。」
HCH_011_049_000139	其爲名流所稱如此。
HCH_011_049_000140	天監中，起家奉朝請，遷中衛建安王水曹行參軍，兼記室。
HCH_011_049_000141	王愛文學之士，日與遊讌，及遷江州，遜猶掌書記。
HCH_011_049_000142	還爲安西安成王參軍事，兼尚書水部郎，母憂去職。
HCH_011_049_000143	服闋，除仁威廬陵王記室，復隨府江州，未幾卒。
HCH_011_049_000144	東海王僧孺集其文爲八卷。
HCH_011_049_000145	初，遜文章與劉孝綽並見重於世，世謂之「何劉」。
HCH_011_049_000146	世祖著論論之云：「詩多而能者沈約，少而能者謝朓、何遜。」
HCH_011_049_000147	時有會稽虞騫，工爲五言詩，名與遜相埒，官至王國侍郎。
HCH_011_049_000148	其後又有會稽孔翁歸、濟陽江避，並爲南平王大司馬府記室。
HCH_011_049_000149	翁歸亦工爲詩，避博學有思理，更注《論語》《孝經》。
HCH_011_049_000150	二人並有文集。
HCH_011_049_000151	鍾嶸字仲偉，潁川長社人，晉侍中雅七世孫也。
HCH_011_049_000152	父蹈，齊中軍參軍。
HCH_011_049_000153	嶸與兄岏、弟嶼並好學，有思理。
HCH_011_049_000154	嶸，齊永明中爲國子生，明《周易》，衛軍王儉領祭酒，頗賞接之。
HCH_011_049_000155	舉本州秀才。
HCH_011_049_000156	起家王國侍郎，遷撫軍行參軍，出爲安國令。
HCH_011_049_000157	永元末，除司徒行參軍。
HCH_011_049_000158	天監初，制度雖革，而日不暇給，嶸乃言曰：「永元肇亂，坐弄天爵，勳非卽戎，官以賄就。揮一金而取九列，寄片札以招六校；騎都塞市，郎將填街。服旣纓組，尚爲臧獲之事；職唯黃散，猶躬胥徒之役。名實淆紊，茲焉莫甚。臣愚謂軍官是素族士人，自有清貫，而因斯受爵，一宜削除，以懲僥競。若吏姓寒人，聽極其門品，不當因軍，遂濫清級。若僑雜傖楚，應在綏撫，正宜嚴斷祿力，絕其妨正，直乞虛號而已。謹竭愚忠，不恤衆口。」
HCH_011_049_000159	敕付尚書行之。
HCH_011_049_000160	遷中軍臨川王行參軍。
HCH_011_049_000161	衡陽王元簡出守會稽，引爲寧朔記室，專掌文翰。
HCH_011_049_000162	時居士何胤築室若邪山，山發洪水，漂拔樹石，此室獨存。
HCH_011_049_000163	元簡命嶸作《瑞室頌》以旌表之，辭甚典麗，選西中郎晉安王記室。
HCH_011_049_000164	嶸嘗品古今五言詩，論其優劣，名爲《詩評》。
HCH_011_049_000165	其序曰：頃之，卒官。
HCH_011_049_000166	岏，字長岳，官至府參軍、建康平。
HCH_011_049_000167	著《良吏傳》十卷。
HCH_011_049_000168	嶼字季望，永嘉郡丞。
HCH_011_049_000169	天監十五年，敕學士撰《徧略》，嶼亦預焉。
HCH_011_049_000170	兄弟並有文集。
HCH_011_049_000171	周興嗣字思纂，陳郡項人，漢太子太傅堪後也。
HCH_011_049_000172	高祖凝，晉征西府參軍、宜都太守。
HCH_011_049_000173	興嗣世居姑孰。
HCH_011_049_000174	年十三，遊學京師，積十餘載，遂博通記傳，善屬文。
HCH_011_049_000175	嘗步自姑孰，投宿逆旅，夜有人謂之曰：「子才學邁世，初當見識貴臣，卒被知英主。」
HCH_011_049_000176	言終，不測所之。
HCH_011_049_000177	齊隆昌中，侍中謝朏爲吳興太守，唯與興嗣談文史而已。
HCH_011_049_000178	及罷郡還，因大相稱薦。
HCH_011_049_000179	本州舉秀才，除桂陽郡丞，太守王嶸素相賞好，禮之甚厚。
HCH_011_049_000180	高祖革命，興嗣奏《休平賦》，其文甚美，高祖嘉之。
HCH_011_049_000181	拜安成王國侍郎，直華林省。
HCH_011_049_000182	其年，河南獻儛馬，詔興嗣與待詔到沆、張率爲賦，高祖以興嗣爲工。
HCH_011_049_000183	擢員外散騎侍郎，進直文德、壽光省。
HCH_011_049_000184	是時，高祖以三橋舊宅爲光宅寺，敕興嗣與陸倕各制寺碑。
HCH_011_049_000185	及成俱奏，高祖用興嗣所制者。
HCH_011_049_000186	自是《銅表銘》、《柵塘碣》、《北伐檄》、《次韻王羲之書千字》，並使興嗣爲文；每奏，高祖輒稱善，加賜金帛。
HCH_011_049_000187	九年，除新安郡丞，秩滿，復爲員外散騎侍郎，佐撰國史。
HCH_011_049_000188	十二年，遷給事中，撰文如故。
HCH_011_049_000189	興嗣兩手先患風疽，是年又染癘疾，左目盲，高祖撫其手，嗟曰：「斯人也而有斯疾也！」
HCH_011_049_000190	手疏治疽方以賜之。
HCH_011_049_000191	其見惜如此。
HCH_011_049_000192	任昉又愛其才，常言曰：「周興嗣若無疾，旬日當至御史中丞。」
HCH_011_049_000193	十四年，除臨川郡丞。
HCH_011_049_000194	十七年，復爲給事中，直西省。
HCH_011_049_000195	左衛率周捨奉敕注高祖所制歷代賦，啓興嗣助焉。
HCH_011_049_000196	普通二年，卒。
HCH_011_049_000197	所撰《皇帝實錄》、《皇德記》、《起居注》、《職儀》等百餘卷，文集十卷。
HCH_011_049_000198	吳均字叔庠，吳興故鄣人也。
HCH_011_049_000199	家世寒賤，至均好學有俊才。
HCH_011_049_000200	沈約嘗見均文，頗相稱賞。
HCH_011_049_000201	天監初，柳惲爲吳興，召補主簿，日引與賦詩。
HCH_011_049_000202	均文體清拔有古氣，好事者或斅之，謂爲「吳均體」。
HCH_011_049_000203	建安王偉爲揚州，引兼記室，掌文翰。
HCH_011_049_000204	王遷江州，補國侍郎，兼府城局。
HCH_011_049_000205	還除奉朝請。
HCH_011_049_000206	先是，均表求撰《齊春秋》。
HCH_011_049_000207	書成奏之，高祖以其書不實，使中書舍人劉之遴詰問數條，竟支離無對，敕付省焚之，坐免職。
HCH_011_049_000208	尋有敕召見，使撰《通史》，起三皇，訖齊代，均草本紀、世家功已畢，唯列傳未就。
HCH_011_049_000209	普通元年，卒，時年五十二。
HCH_011_049_000210	均注范曄《後漢書》九十卷，著《齊春秋》三十卷、《廟記》十卷、《十二州記》十六卷、《錢唐先賢傳》五卷、《續文釋》五卷，文集二十卷。
HCH_011_049_000211	先是，有廣陵高爽、濟陽江洪、會稽虞騫，並工屬文。
HCH_011_049_000212	爽，齊永明中贈衛軍王儉詩，爲儉所賞，及領丹陽尹，舉爽郡孝廉。
HCH_011_049_000213	天監初，歷官中軍臨川王參軍。
HCH_011_049_000214	出爲晉陵令，坐事繫冶，作《鑊魚賦》以自況，其文甚工。
HCH_011_049_000215	後遇赦獲免，頃之，卒。
HCH_011_049_000216	洪爲建陽令，坐事死。
HCH_011_049_000217	騫官至王國侍郎。
HCH_011_049_000218	並有文集。
HCH_011_049_000219	本唐朝作品在全世界都属于公有领域，因为作者逝世已经遠遠超过100年。
