HCH_011_013_000001	范雲字彥龍，南鄉舞陰人，晉平北將軍汪六世孫也。
HCH_011_013_000002	年八歲，遇宋豫州刺史殷琰於塗，琰異之，要就席，雲風姿應對，傍若無人。
HCH_011_013_000003	琰令賦詩，操筆便就，坐者歎焉。
HCH_011_013_000004	嘗就親人袁照學，晝夜不怠。
HCH_011_013_000005	照撫其背曰：「卿精神秀朗而勤於學，卿相才也。」
HCH_011_013_000006	少機警，有識具，善屬文，便尺牘，下筆輒成，未嘗定藁，時人每疑其宿構。
HCH_011_013_000007	父抗，爲郢府參軍，雲隨父在府，時吳興沈約、新野庾杲之與抗同府，見而友之。
HCH_011_013_000008	起家郢州西曹書佐，轉法曹行參軍。
HCH_011_013_000009	俄而沈攸之舉兵圍郢城，抗時爲府長流，入城固守，留家屬居外。
HCH_011_013_000010	雲爲軍人所得，攸之召與語，聲色甚厲，雲容貌不變，徐自陳說。
HCH_011_013_000011	攸之乃笑曰：「卿定可兒，且出就舍。」
HCH_011_013_000012	明旦，又召令送書入城。
HCH_011_013_000013	城內或欲誅之，雲曰：「老母弱弟，懸命沈氏，若違其命，禍必及親，今日就戮，甘心如薺。」
HCH_011_013_000014	長史柳世隆素與雲善，乃免之。
HCH_011_013_000015	齊建元初，竟陵王子良爲會稽太守，雲始隨王，王未之知也。
HCH_011_013_000016	會游秦望，使人視刻石文，時莫能識，雲獨誦之，王悅，自是寵冠府朝。
HCH_011_013_000017	王爲丹陽尹，召爲主簿，深相親任。
HCH_011_013_000018	時進見齊高帝，值有獻白烏者，帝問此爲何瑞？
HCH_011_013_000019	雲位卑，最後答曰：「臣聞王者敬宗廟，則白烏至。」
HCH_011_013_000020	時謁廟始畢。
HCH_011_013_000021	帝曰：「卿言是也。感應之理，一至此乎！」
HCH_011_013_000022	轉補征北南郡王刑獄參軍事，領主簿如故，遷尚書殿中郎。
HCH_011_013_000023	子良爲司徒，又補記室參軍事，尋授通直散騎侍郎、領本州大中正。
HCH_011_013_000024	出爲零陵內史，在任潔己，省煩苛，去游費，百姓安之。
HCH_011_013_000025	明帝召還都，及至，拜散騎侍郎。
HCH_011_013_000026	復出爲始興內史。
HCH_011_013_000027	郡多豪猾大姓，二千石有不善者，謀共殺害，不則逐去之。
HCH_011_013_000028	邊帶蠻俚，尤多盜賊，前內史皆以兵刃自衛。
HCH_011_013_000029	雲入境，撫以恩德，罷亭候，商賈露宿，郡中稱爲神明。
HCH_011_013_000030	仍遷假節、建武將軍、平越中郎將、廣州刺史。
HCH_011_013_000031	初，雲與尚書僕射江祏善，祏姨弟徐藝爲曲江令，深以託雲。
HCH_011_013_000032	有譚儼者，縣之豪族，藝鞭之，儼以爲恥，詣京訴雲，雲坐徵還下獄，會赦免。
HCH_011_013_000033	永元二年，起爲國子博士。
HCH_011_013_000034	初，雲與高祖遇於齊竟陵王子良邸，又嘗接里閈，高祖深器之。
HCH_011_013_000035	及義兵至京邑，雲時在城內。
HCH_011_013_000036	東昏旣誅，侍中張稷使雲銜命出城，高祖因留之，便參帷幄，仍拜黃門侍郎，與沈約同心翊贊。
HCH_011_013_000037	俄遷大司馬諮議參軍、領錄事。
HCH_011_013_000038	梁臺建，遷侍中。
HCH_011_013_000039	時高祖納齊東昏余妃，頗妨政事，雲嘗以爲言，未之納也。
HCH_011_013_000040	後與王茂同入臥內，雲又諫曰：「昔漢祖居山東，貪財好色，及入關定秦，財帛無所取，婦女無所幸，范增以爲其志大故也。今明公始定天下，海內想望風聲，奈何襲昏亂之蹤，以女德爲累。」
HCH_011_013_000041	王茂因起拜曰：「范雲言是，公必以天下爲念，無宜留惜。」
HCH_011_013_000042	高祖默然。
HCH_011_013_000043	雲便疏令以余氏賚茂，高祖賢其意而許之。
HCH_011_013_000044	明日，賜雲、茂錢各百萬。
HCH_011_013_000045	天監元年，高祖受禪，柴燎於南郊，雲以侍中參乘。
HCH_011_013_000046	禮畢，高祖升輦，謂雲曰：「朕之今日，所謂懍乎若朽索之馭六馬。」
HCH_011_013_000047	雲對曰：「亦願陛下日慎一日。」
HCH_011_013_000048	高祖善之。
HCH_011_013_000049	是日，遷散騎常侍、吏部尚書；以佐命功封霄城縣侯，邑千戶。
HCH_011_013_000050	雲以舊恩見拔，超居佐命，盡誠翊亮，知無不爲。
HCH_011_013_000051	高祖亦推心任之，所奏多允。
HCH_011_013_000052	嘗侍宴，高祖謂臨川王宏、鄱陽王恢曰：「我與范尚書少親善，申四海之敬；今爲天下主，此禮旣革，汝宜代我呼范爲兄。」
HCH_011_013_000053	二王下席拜，與雲同車還尚書下省，時人榮之。
HCH_011_013_000054	其年，東宮建，雲以本官領太子中庶子，尋遷尚書右僕射，猶領吏部。
HCH_011_013_000055	頃之，坐違詔用人，免吏部，猶爲僕射。
HCH_011_013_000056	雲性篤睦，事寡嫂盡禮，家事必先諮而後行。
HCH_011_013_000057	好節尚奇，專趣人之急。
HCH_011_013_000058	少時與領軍長史王畡善，畡亡於官舍，貧無居宅，雲乃迎喪還家。
HCH_011_013_000059	躬營含殯。
HCH_011_013_000060	事竟陵王子良恩禮甚隆，雲每獻損益，未嘗阿意。
HCH_011_013_000061	子良嘗啓齊武帝論雲爲郡。
HCH_011_013_000062	帝曰：「庸人，聞其恒相賣弄，不復窮法，當宥之以遠。」
HCH_011_013_000063	子良曰：「不然。雲動相規誨，諫書具存，請取以奏。」
HCH_011_013_000064	旣至，有百餘紙，辭皆切直。
HCH_011_013_000065	帝歎息，因謂子良曰：「不謂雲能爾。方使弼汝，何宜出守。」
HCH_011_013_000066	齊文惠太子嘗出東田觀獲，顧謂衆賓曰：「刈此亦殊可觀。」
HCH_011_013_000067	衆皆唯唯。
HCH_011_013_000068	雲獨曰：「夫三時之務，實爲長勤。伏願殿下知稼穡之艱難，無徇一朝之宴逸。」
HCH_011_013_000069	旣出，侍中蕭緬先不相識，因就車握雲手曰：「不圖今日復聞讜言。」
HCH_011_013_000070	及居選官，任守隆重，書牘盈案，賓客滿門，雲應對如流，無所壅滯，官曹文墨，發擿若神，時人咸服其明贍。
HCH_011_013_000071	性頗激厲，少威重，有所是非，形於造次，士或以此少之。
HCH_011_013_000072	初，雲爲郡號稱廉潔，及居貴重，頗通饋餉；然家無蓄積，隨散之親友。
HCH_011_013_000073	二年，卒，時年五十三。
HCH_011_013_000074	高祖爲之流涕，卽日輿駕臨殯。
HCH_011_013_000075	詔曰：「追遠興悼，常情所篤；況問望斯在，事深朝寄者乎！故散騎常侍、尚書右僕射、霄城侯雲，器範貞正，思懷經遠，爰初立志，素履有聞。脫巾來仕，清績仍著。燮務登朝，具瞻惟允。綢繆翊贊，義簡朕心，雖勤非負靮，而舊同論講。方騁遠塗，永毗庶政；奄致喪殞，傷悼於懷。宜加命秩，式備徽典。可追贈侍中、衛將軍，僕射、侯如故。並給鼓吹一部。」
HCH_011_013_000076	禮官請諡曰宣，勑賜諡文。
HCH_011_013_000077	有集三十卷。
HCH_011_013_000078	子孝才嗣，官至太子中舍人。
HCH_011_013_000079	沈約，字休文，吳興武康人也。
HCH_011_013_000080	祖林子，宋征虜將軍。
HCH_011_013_000081	父璞，淮南太守。
HCH_011_013_000082	璞元嘉末被誅，約幼潛竄，會赦免。
HCH_011_013_000083	旣而流寓孤貧，篤志好學，晝夜不倦。
HCH_011_013_000084	母恐其以勞生疾，常遣減油滅火。
HCH_011_013_000085	而晝之所讀，夜輒誦之，遂博通羣籍，能屬文。
HCH_011_013_000086	起家奉朝請。
HCH_011_013_000087	濟陽蔡興宗聞其才而善之；興宗爲郢州刺史，引爲安西外兵參軍，兼記室。
HCH_011_013_000088	興宗嘗謂其諸子曰：「沈記室人倫師表，宜善事之。」
HCH_011_013_000089	及爲荊州，又爲征西記室參軍，帶厥西令。
HCH_011_013_000090	興宗卒，始爲安西晉安王法曹參軍，轉外兵，並兼記室。
HCH_011_013_000091	入爲尚書度支郎。
HCH_011_013_000092	齊初爲征虜記室，帶襄陽令，所奉之王，齊文惠太子也。
HCH_011_013_000093	太子入居東宮，爲步兵校尉，管書記，直永壽省，校四部圖書。
HCH_011_013_000094	時東宮多士，約特被親遇，每直入見，影斜方出。
HCH_011_013_000095	當時王侯到宮，或不得進，約每以爲言。
HCH_011_013_000096	太子曰：「吾生平懶起，是卿所悉，得卿談論，然後忘寢。卿欲我夙興，可恒早入。」
HCH_011_013_000097	遷太子家令，後以本官兼著作郎，遷中書郎，本邑中正，司徒右長史，黃門侍郎。
HCH_011_013_000098	時竟陵王亦招士，約與蘭陵蕭琛、琅邪王融、陳郡謝朓、南鄉范雲、樂安任昉等皆遊焉，當世號爲得人。
HCH_011_013_000099	俄兼尚書左丞，尋爲御史中丞，轉車騎長史。
HCH_011_013_000100	隆昌元年，除吏部郎，出爲寧朔將軍、東陽太守。
HCH_011_013_000101	明帝卽位，進號輔國將軍，徵爲五兵尚書，遷國子祭酒。
HCH_011_013_000102	明帝崩，政歸塚宰，尚書令徐孝嗣使約撰定遺詔。
HCH_011_013_000103	遷左衛將軍，尋加通直散騎常侍。
HCH_011_013_000104	永元二年，以母老表求解職，改授冠軍將軍、司徒左長史，征虜將軍、南清河太守。
HCH_011_013_000105	高祖在西邸，與約遊舊，建康城平，引爲驃騎司馬，將軍如故。
HCH_011_013_000106	時高祖勳業旣就，天人允屬，約嘗扣其端，高祖默而不應。
HCH_011_013_000107	佗日又進曰：「今與古異，不可以淳風期萬物。士大夫攀龍附鳳者，皆望有尺寸之功，以保其福祿。今童兒牧豎，悉知齊祚已終，莫不云明公其人也。天文人事，表革運之徵，永元以來，尤爲彰著。讖云『行中水，作天子』，此又歷然在記。天心不可違，人情不可失，苟是曆數所至，雖欲謙光，亦不可得已。」
HCH_011_013_000108	高祖曰：「吾方思之。」
HCH_011_013_000109	對曰：「公初杖兵樊、沔，此時應思，今王業已就，何所復思。昔武王伐紂，始入，民便曰吾君，武王不違民意，亦無所思。公自至京邑，已移氣序，比于周武，遲速不同。若不早定大業，稽天人之望，脫有一人立異，便損威德。且人非金石，時事難保。豈可以建安之封，遺之子孫？若天子還都，公卿在位，則君臣分定，無復異心。君明於上，臣忠於下，豈復有人方更同公作賊。」
HCH_011_013_000110	高祖然之。
HCH_011_013_000111	約出，高祖召范雲告之，雲對略同約旨。
HCH_011_013_000112	高祖曰：「智者乃爾暗同，卿明早將休文更來。」
HCH_011_013_000113	雲出語約，約曰：「卿必待我。」
HCH_011_013_000114	雲許諾，而約先期入，高祖命草其事。
HCH_011_013_000115	約乃出懷中詔書並諸選置，高祖初無所改。
HCH_011_013_000116	俄而雲自外來，至殿門不得入，徘徊壽光閣外，但云「咄咄」。
HCH_011_013_000117	約出，問曰：「何以見處？」
HCH_011_013_000118	約舉手向左，雲笑曰：「不乖所望。」
HCH_011_013_000119	有頃，高祖召范雲謂曰：「生平與沈休文羣居，不覺有異人處；今日才智縱橫，可謂明識。」
HCH_011_013_000120	雲曰：「公今知約，不異約今知公。」
HCH_011_013_000121	高祖曰：「我起兵於今三年矣，功臣諸將，實有其勞，然成帝業者，乃卿二人也。」
HCH_011_013_000122	梁臺建，爲散騎常侍、吏部尚書，兼右僕射。
HCH_011_013_000123	高祖受禪，爲尚書僕射，封建昌縣侯，邑千戶，常侍如故。
HCH_011_013_000124	又拜約母謝爲建昌國太夫人。
HCH_011_013_000125	奉策之日，右僕射范雲等二十餘人咸來致拜，朝野以爲榮。
HCH_011_013_000126	俄遷尚書左僕射，常侍如故。
HCH_011_013_000127	尋兼領軍，加侍中。
HCH_011_013_000128	天監二年，遭母憂，輿駕親出臨弔，以約年衰，不宜致毀，遣中書舍人斷客節哭。
HCH_011_013_000129	起爲鎮軍將軍、丹陽尹，置佐史。
HCH_011_013_000130	服闋，遷侍中、右光祿大夫，領太子詹事，揚州大中正，關尚書八條事，遷尚書令，侍中、詹事、中正如故。
HCH_011_013_000131	累表陳讓，改授尚書左僕射、領中書令、前將軍，置佐史，侍中如故。
HCH_011_013_000132	尋遷尚書令，領太子少傅。
HCH_011_013_000133	九年，轉左光祿大夫，侍中、少傅如故，給鼓吹一部。
HCH_011_013_000134	初，約久處端揆，有志台司，論者咸謂爲宜，而帝終不用，乃求外出，又不見許。
HCH_011_013_000135	與徐勉素善，遂以書陳情於勉曰：「吾弱年孤苦，傍無朞屬，往者將墜於地，契闊屯邅，困於朝夕，崎嶇薄宦，事非爲己，望得小祿，傍此東歸。歲逾十稔，方忝襄陽縣，公私情計，非所了具，以身資物，不得不任人事。永明末，出守東陽，意在止足；而建武肇運，人世膠加，一去不返，行之未易。及昏猜之始，王政多門，因此謀退，庶幾可果，託卿布懷於徐令，想記未忘。聖道聿興，謬逢嘉運，往志宿心，復成乖爽。今歲開元，禮年云至，懸車之請，事由恩奪。誠不能弘宣風政，光闡朝猷，尚欲討尋文簿，時議同異。而開年以來，病增慮切，當由生靈有限，勞役過差，總此凋竭，歸之暮年，牽策行止，努力祗事。外觀傍覽，尚似全人，而形骸力用，不相綜攝，常須過自束持，方可僶勉。解衣一臥，支體不復相關。上熱下冷，月增日篤，取暖則煩，加寒必利，後差不及前差，後劇必甚前劇。百日數旬，革帶常應移孔；以手握臂，率計月小半分。以此推算，豈能支久？若此不休，日復一日，將貽聖主不追之恨。冒欲表聞，乞歸老之秩。若天假其年，還是平健，才力所堪，惟思是策。」
HCH_011_013_000136	勉爲言於高祖，請三司之儀，弗許，但加鼓吹而已。
HCH_011_013_000137	約性不飲酒，少嗜欲，雖時遇隆重，而居處儉素。
HCH_011_013_000138	立宅東田，矚望郊阜。
HCH_011_013_000139	嘗爲《郊居賦》，其辭曰：尋加特進，光祿、侍中、少傅如故。
HCH_011_013_000140	十二年，卒官，時年七十三。
HCH_011_013_000141	詔贈本官，賻錢五萬，布百匹，諡曰隱。
HCH_011_013_000142	約左目重瞳子，腰有紫志，聰明過人。
HCH_011_013_000143	好墳籍，聚書至二萬卷，京師莫比。
HCH_011_013_000144	少時孤貧，丐于宗黨，得米數百斛，爲宗人所侮，覆米而去。
HCH_011_013_000145	及貴，不以爲憾，用爲郡部傳。
HCH_011_013_000146	嘗侍讌，有妓師是齊文惠宮人。
HCH_011_013_000147	帝問識座中客不？
HCH_011_013_000148	曰：「惟識沈家令。」
HCH_011_013_000149	約伏座流涕，帝亦悲焉，爲之罷酒。
HCH_011_013_000150	約歷仕三代，該悉舊章，博物洽聞，當世取則。
HCH_011_013_000151	謝玄暉善爲詩，任彥昇工於文章，約兼而有之，然不能過也。
HCH_011_013_000152	自負高才，昧於榮利，乘時藉勢，頗累清談。
HCH_011_013_000153	及居端揆，稍弘止足。
HCH_011_013_000154	每進一官，輒殷勤請退，而終不能去，論者方之山濤。
HCH_011_013_000155	用事十餘年，未嘗有所薦達，政之得失，唯唯而已。
HCH_011_013_000156	初，高祖有憾於張稷，及稷卒，因與約言之。
HCH_011_013_000157	約曰：「尚書左僕射出作邊州刺史，已往之事，何足復論。」
HCH_011_013_000158	帝以爲婚家相爲，大怒曰：「卿言如此，是忠臣邪！」
HCH_011_013_000159	乃輦歸內殿。
HCH_011_013_000160	約懼，不覺高祖起，猶坐如初。
HCH_011_013_000161	及還，未至床，而憑空頓於戶下。
HCH_011_013_000162	因病，夢齊和帝以劍斷其舌。
HCH_011_013_000163	召巫視之，巫言如夢。
HCH_011_013_000164	乃呼道士奏赤章於天，稱禪代之事，不由己出。
HCH_011_013_000165	高祖遣上省醫徐奘視約疾，還具以狀聞。
HCH_011_013_000166	先此，約嘗侍讌，值豫州獻栗，徑寸半，帝奇之，問曰：「栗事多少？」
HCH_011_013_000167	與約各疏所憶，少帝三事。
HCH_011_013_000168	出謂人曰：「此公護前，不讓卽羞死。」
HCH_011_013_000169	帝以其言不遜，欲抵其罪，徐勉固諫乃止。
HCH_011_013_000170	及聞赤章事，大怒，中使譴責者數焉，約懼遂卒。
HCH_011_013_000171	有司諡曰文，帝曰：「懷情不盡曰隱。」
HCH_011_013_000172	故改爲隱云。
HCH_011_013_000173	所著《晉書》百一十卷，《宋書》百卷，《齊紀》二十卷，《高祖紀》十四卷，《邇言》十卷，《諡例》十卷，《宋文章志》三十卷，文集一百卷：皆行於世。
HCH_011_013_000174	又撰《四聲譜》，以爲在昔詞人，累千載而不寤，而獨得胸衿，窮其妙旨，自謂入神之作，高祖雅不好焉。
HCH_011_013_000175	帝問周捨曰：「何謂四聲？」
HCH_011_013_000176	舍曰：「天子聖哲」是也，然帝竟不遵用。
HCH_011_013_000177	子旋，及約時已歷中書侍郎，永嘉太守，司徒從事中郎，司徒右長史。
HCH_011_013_000178	免約喪，爲太子僕，復以母憂去官，而蔬食辟穀。
HCH_011_013_000179	服除，猶絕粳粱。
HCH_011_013_000180	爲給事黃門侍郎、中撫軍長史。
HCH_011_013_000181	出爲招遠將軍、南康內史，在部以清治稱。
HCH_011_013_000182	卒官，諡曰恭侯。
HCH_011_013_000183	子𢉴嗣。
HCH_011_013_000184	陳吏部尚書姚察曰：昔木德將謝，昏嗣流虐，惵惵黔黎，命懸晷漏。
HCH_011_013_000185	高祖義拯橫潰，志寧區夏，謀謨帷幄，實寄良、平。
HCH_011_013_000186	至於范雲、沈約，參預締構，贊成帝業；加雲以機警明贍，濟務益時，約高才博洽，名亞遷、董，俱屬興運，蓋一代之英偉焉。
HCH_011_013_000187	本唐朝作品在全世界都属于公有领域，因为作者逝世已经遠遠超过100年。
