HCH_011_052_000001	《易》曰：「亢之爲言也，知進而不知退，知存而不知亡。知進退存亡而不失其正者，其唯聖人乎！」
HCH_011_052_000002	《傳》曰：「知足不辱，知止不殆。」
HCH_011_052_000003	然則不知夫進退，不達乎止足，殆辱之累，期月而至矣。
HCH_011_052_000004	古人之進也，以康世濟務也，以弘道厲俗也。
HCH_011_052_000005	然其進也，光寵夷易，故愚夫之所乾沒；其退也，苦節艱貞，故庸曹之所忌憚。
HCH_011_052_000006	雖禍敗危亡，陳乎耳目，而輕舉高蹈，寡乎前史。
HCH_011_052_000007	漢世張良功成身退，病臥卻粒，比於樂毅、范蠡至乎顛狽，斯爲優矣。
HCH_011_052_000008	其後薛廣德及二疏等，去就以禮，有可稱焉。
HCH_011_052_000009	魚豢《魏略·知足傳》，方田、徐於管、胡，則其道本異。
HCH_011_052_000010	謝靈運《晉書·止足傳》，先論晉世文士之避亂者，殆非其人；唯阮思曠遺榮好遁，遠殆辱矣。
HCH_011_052_000011	《宋書·止足傳》有羊欣、王微，咸其流亞。
HCH_011_052_000012	齊時沛國劉瓛，字子珪，辭祿懷道，棲遲養志，不戚戚於貧賤，不耽耽於富貴，儒行之高者也。
HCH_011_052_000013	梁有天下，小人道消，賢士大夫相招在位，其量力守志，則當世罔聞，時或有致事告老，或有寡志少欲，國史書之，亦以爲《止足傳》云。
HCH_011_052_000014	顧憲之字士思，吳郡吳人也。
HCH_011_052_000015	祖抃之，宋鎮軍將軍、湘州刺史。
HCH_011_052_000016	憲之未弱冠，州辟議曹從事，舉秀才，累遷太子舍人、尚書比部郎、撫軍主簿。
HCH_011_052_000017	元徽中，爲建康令。
HCH_011_052_000018	時有盜牛者，被主所認，盜者亦稱己牛，二家辭證等，前後令莫能決。
HCH_011_052_000019	憲之至，覆其狀，謂二家曰：「無爲多言，吾得之矣。」
HCH_011_052_000020	乃令解牛，任其所去，牛徑還本主宅，盜者始伏其辜。
HCH_011_052_000021	發姦擿伏，多如此類，時人號曰神明。
HCH_011_052_000022	至於權要請託，長吏貪殘，據法直繩，無所阿縱。
HCH_011_052_000023	性又清儉，強力爲政，甚得民和。
HCH_011_052_000024	故京師飲酒者得醇旨，輒號爲「顧建康」，言醑清且美焉。
HCH_011_052_000025	遷車騎功曹、晉熙王友。
HCH_011_052_000026	齊高帝執政，以爲驃騎錄事參軍，遷太尉西曹掾。
HCH_011_052_000027	齊臺建，爲中書侍郎。
HCH_011_052_000028	齊高帝卽位，除衡陽內史。
HCH_011_052_000029	先是，郡境連歲疾疫，死者太半，棺木尤貴，悉裹以葦席，棄之路傍。
HCH_011_052_000030	憲之下車，分告屬縣，求其親黨，悉令殯葬。
HCH_011_052_000031	其家人絕滅者，憲之爲出公祿，使綱紀營護之。
HCH_011_052_000032	又土俗，山民有病，輒云先人爲禍，皆開塚剖棺，水洗枯骨，名爲除祟。
HCH_011_052_000033	憲之曉喻，爲陳生死之別，事不相由，風俗遂改。
HCH_011_052_000034	時刺史王奐新至，唯衡陽獨無訟者，乃歎曰：「顧衡陽之化至矣。若九郡率然，吾將何事！」
HCH_011_052_000035	還爲太尉從事中郎。
HCH_011_052_000036	出爲東中郎長史、行會稽郡事。
HCH_011_052_000037	山陰人呂文度有寵於齊武帝，於餘姚立邸，頗縱橫。
HCH_011_052_000038	憲之至郡，卽表除之。
HCH_011_052_000039	文度後還葬母，郡縣爭赴弔，憲之不與相聞。
HCH_011_052_000040	文度深銜之，卒不能傷也。
HCH_011_052_000041	遷南中郎巴陵王長史，加建威將軍、行婺州事。
HCH_011_052_000042	時司徒、竟陵王於宣城、臨成、定陵三縣界立屯，封山澤數百里，禁民樵采，憲之固陳不可，言甚切直。
HCH_011_052_000043	王答之曰：「非君無以聞此德音。」
HCH_011_052_000044	卽命無禁。
HCH_011_052_000045	遷給事黃門侍郎，兼尚書吏部郎中。
HCH_011_052_000046	宋世，其祖覬之嘗爲吏部，於庭植嘉樹，謂人曰：「吾爲憲之種耳。」
HCH_011_052_000047	至是，憲之果爲此職。
HCH_011_052_000048	出爲征虜長史、行南兗州事，遭母憂。
HCH_011_052_000049	服闋，建武中，復除給事黃門侍郎，領步兵校尉。
HCH_011_052_000050	未拜，仍遷太子中庶子，領吳邑中正。
HCH_011_052_000051	出爲寧朔將軍、臨川內史；未赴，改授輔國將軍、晉陵太守。
HCH_011_052_000052	頃之遇疾，陳解還鄉里。
HCH_011_052_000053	永元初，徵爲廷尉，不拜，除豫章太守。
HCH_011_052_000054	有貞婦萬晞者，少孀居無子，事舅姑尤孝，父母欲奪而嫁之，誓死不許，憲之賜以束帛，表其節義。
HCH_011_052_000055	中興二年，義師平建康，高祖爲揚州牧，徵憲之爲別駕從事史。
HCH_011_052_000056	比至，高祖已受禪，憲之風疾漸篤，固求還吳。
HCH_011_052_000057	天監二年，就家授太中大夫。
HCH_011_052_000058	憲之雖累經宰郡，資無擔石。
HCH_011_052_000059	及歸，環堵，不免饑寒。
HCH_011_052_000060	八年，卒於家，年七十四。
HCH_011_052_000061	臨終爲制，以敕其子曰：所著詩、賦、銘、贊幷《衡陽郡記》數十篇。
HCH_011_052_000062	陶季直，丹陽秣陵人也。
HCH_011_052_000063	祖愍祖，宋廣州刺史。
HCH_011_052_000064	父景仁，中散大夫。
HCH_011_052_000065	季直早慧，愍祖甚愛異之。
HCH_011_052_000066	愍祖嘗以四函銀列置於前，令諸孫各取，季直時甫四歲，獨不取。
HCH_011_052_000067	人問其故，季直曰：「若有賜，當先父伯，不應度及諸孫，是故不取。」
HCH_011_052_000068	愍祖益奇之。
HCH_011_052_000069	五歲喪母，哀若成人。
HCH_011_052_000070	初，母未病，令於外染衣；卒後，家人始贖，季直抱之號慟，聞者莫不酸感。
HCH_011_052_000071	及長，好學，淡於榮利。
HCH_011_052_000072	起家桂陽王國侍郎、北中郎鎮西行參軍，並不起，時人號曰「聘君」。
HCH_011_052_000073	父憂服闋，尚書令劉秉領丹陽尹，引爲後軍主簿、領郡功曹。
HCH_011_052_000074	出爲望蔡令，頃之以病免。
HCH_011_052_000075	時劉秉、袁粲以齊高帝權勢日盛，將圖之，秉素重季直，欲與之定策。
HCH_011_052_000076	季直以袁、劉儒者，必致顛殞，固辭不赴。
HCH_011_052_000077	俄而秉等伏誅。
HCH_011_052_000078	齊初，爲尚書比部郎，時褚淵爲尚書令，與季直素善，頻以爲司空司徒主簿，委以府事。
HCH_011_052_000079	淵卒，尚書令王儉以淵有至行，欲諡爲文孝公，季直請曰：「文孝是司馬道子諡，恐其人非具美，不如文簡。」
HCH_011_052_000080	儉從之。
HCH_011_052_000081	季直又請儉爲淵立碑，終始營護，甚有吏節，時人美之。
HCH_011_052_000082	遷太尉記室參軍。
HCH_011_052_000083	出爲冠軍司馬、東莞太守，在郡號爲清和。
HCH_011_052_000084	還除散騎侍郎，領左衛司馬，轉鎮西諮議參軍。
HCH_011_052_000085	齊武帝崩，明帝作相，誅鋤異己，季直不能阿意，明帝頗忌之，乃出爲輔國長史、北海太守。
HCH_011_052_000086	邊職上佐，素士罕爲之者。
HCH_011_052_000087	或勸季直造門致謝，明帝旣見，便留之，以爲驃騎諮議參軍，兼尚書左丞。
HCH_011_052_000088	仍遷建安太守，政尚清靜，百姓便之。
HCH_011_052_000089	還爲中書侍郎，遷遊擊將軍、兼廷尉。
HCH_011_052_000090	梁臺建，遷給事黃門侍郎。
HCH_011_052_000091	常稱仕至二千石，始願畢矣，無爲務人間之事，乃辭疾還鄉里。
HCH_011_052_000092	天監初，就家拜太中大夫。
HCH_011_052_000093	高祖曰：「梁有天下，遂不見此人。」
HCH_011_052_000094	十年，卒於家，時年七十五。
HCH_011_052_000095	季直素清苦絕倫，又屏居十餘載，及死，家徒四壁，子孫無以殯斂，聞者莫不傷其志焉。
HCH_011_052_000096	蕭眎素，蘭陵人也。
HCH_011_052_000097	祖思話，宋征西儀同三司；父惠明，吳興太守；皆有盛名。
HCH_011_052_000098	眎素早孤貧，爲叔父惠休所收卹。
HCH_011_052_000099	起家爲齊司徒法曹行參軍，遷著作佐郎、太子舍人、尚書三公郎。
HCH_011_052_000100	永元末，爲太子洗馬。
HCH_011_052_000101	梁臺建，高祖引爲中尉驃騎記室參軍。
HCH_011_052_000102	天監初，爲臨川王友，復爲太子中舍人、丹陽尹丞。
HCH_011_052_000103	初拜，高祖賜錢八萬，眎素一朝散之親友。
HCH_011_052_000104	又遷司徒左西屬、南徐州治中。
HCH_011_052_000105	性靜退，少嗜欲，好學，能清言，榮利不關於口，喜怒不形於色。
HCH_011_052_000106	在人間及居職，並任情通率，不自矜高，天然簡素，士人以此咸敬之。
HCH_011_052_000107	及在京口，便有終焉之志，乃於攝山築室。
HCH_011_052_000108	會徵爲中書侍郎，遂辭不就，因還山宅，獨居屏事，非親戚不得至其籬門。
HCH_011_052_000109	妻，太尉王儉女，久與別居，遂無子。
HCH_011_052_000110	八年，卒。
HCH_011_052_000111	親故迹其事行，諡曰貞文先生。
HCH_011_052_000112	史臣曰：顧憲之、陶季直，引年者也，蕭眎素則宦情鮮焉。
HCH_011_052_000113	比夫懷祿耽寵，婆娑人世，則殊間矣。
HCH_011_052_000114	本唐朝作品在全世界都属于公有领域，因为作者逝世已经遠遠超过100年。
