HCH_012_189_000000	李文祥，字天瑞，麻城人。
HCH_012_189_000001	祖正芳，山西布政使。
HCH_012_189_000002	父，陝西參政。
HCH_012_189_000003	文祥自幼俊異。
HCH_012_189_000004	弱冠舉于鄉，成化末登進士。
HCH_012_189_000005	萬安當國，重其才。
HCH_012_189_000006	以孫弘璧與同榜，款于家，文祥意弗慊也。
HCH_012_189_000007	屬題畫鳩，語含刺，安深銜之。
HCH_012_189_000008	未幾，孝宗嗣位，即上封事，略曰：祖宗設內閣、六部，贊萬幾，理庶務，職至重也。
HCH_012_189_000009	頃者，在位多匪人，權移內侍。
HCH_012_189_000010	賞罰任其喜怒，禍福聽其轉移。
HCH_012_189_000011	仇視言官，公行賄賂。
HCH_012_189_000012	阿之則交引驟遷，忤之則巧讒遠竄。
HCH_012_189_000013	朝野寒心，道路側目。
HCH_012_189_000014	望陛下密察渠魁，明彰國憲，擇謹厚者供使令。
HCH_012_189_000015	更博選大臣，諮諏治理，推心委任，不復嫌疑，然後體統正而近習不得肆也。
HCH_012_189_000016	祖宗定律，輕重適宜。
HCH_012_189_000017	頃法司專徇己私，不恤國典。
HCH_012_189_000018	豪強者雖重必寬，貧弱者雖輕必罪。
HCH_012_189_000019	惠及奸宄，養成玩俗。
HCH_012_189_000020	兼之風尚奢麗，禮制蕩然。
HCH_012_189_000021	豪民僭王者之居，富室擬公侯之服。
HCH_012_189_000022	奇技淫巧，上下同流。
HCH_012_189_000023	望陛下申明舊章，俾法曹遵律令，臣庶各守等威，然後禮法明而人心不敢玩也。
HCH_012_189_000024	然國無其人，誰與共理？
HCH_012_189_000025	致仕尚書王恕、王竑，孤忠自許，齒力未衰；南京主事林俊、思南通判王純，剛方植躬，才品兼茂。
HCH_012_189_000026	望陛下起列朝端，資其議論，必有裨益，可翊明時。
HCH_012_189_000027	且賢才難得，自古為然。
HCH_012_189_000028	習俗移人，豪傑不免。
HCH_012_189_000029	惟茲臣庶，不盡庸愚。
HCH_012_189_000030	能知自愧，即屬名流；樂其危災，乃為猥品。
HCH_012_189_000031	願陛下明察群倫，罷其罔上營私違天蠹物者，餘則勉以自新。
HCH_012_189_000032	既開改過之路，必多遷善之人。
HCH_012_189_000033	臣見登極詔書，不許風聞言事。
HCH_012_189_000034	古聖王懸鼓設木，自求誹謗。
HCH_012_189_000035	言之縱非其情，聽者亦足為戒，何害于國，遽欲罪之？
HCH_012_189_000036	昔李林甫持此以禍唐，王安石持此以禍宋。
HCH_012_189_000037	遠近驟聞，莫不驚駭。
HCH_012_189_000038	願陛下再頒明詔，廣求直言，庶不墮奸謀，足彰聖德。
HCH_012_189_000039	大率君子之言決非小人之利，諮問倘及，必肆中傷。
HCH_012_189_000040	如有所疑，請試面對。
HCH_012_189_000041	疏奏，宦官及執政萬安、劉吉、尹直等鹹惡之，數日不下。
HCH_012_189_000042	忽詔詣左順門，以疏內有「中興再造」語，傳旨詰責。
HCH_012_189_000043	文祥從容辨析而出。
HCH_012_189_000044	謫授陝西咸寧丞。
HCH_012_189_000045	南京主事夏崇文論救，不納。
HCH_012_189_000046	工部主事莆田林沂復請召文祥及湯鼐，納崇文言，且召陳獻章、謝鐸等。
HCH_012_189_000047	時安已去，吉、直激帝怒，嚴旨切責之。
HCH_012_189_000048	廷臣多薦文祥，率為吉、直所沮。
HCH_012_189_000049	弘治二年以王恕薦召為兵部主事，監司以下饋贐皆不納。
HCH_012_189_000050	到官未逾月，復以吉人事下獄，貶貴州興隆衛經歷。
HCH_012_189_000051	都御史鄧廷瓚征苗，咨以兵事，大奇之，欲薦為監司。
HCH_012_189_000052	文祥曰：「昔以言事出，今以軍功進，不可。」
HCH_012_189_000053	固辭不得，乃請齎表入都，固乞告歸。
HCH_012_189_000054	疏再上，不許。
HCH_012_189_000055	還經商城，渡冰陷，死焉，年僅三十。
HCH_012_189_000056	孫磐，遼陽人。
HCH_012_189_000057	弘治九年進士。
HCH_012_189_000058	觀政在部時，刑部典吏徐珪以滿倉兒事劾中官楊鵬得罪，磐上疏曰：「近諫官以言為諱，而排寵倖觸權奸者乃在胥吏，臣竊羞之。請定建言者為四等。最上不避患害，抗彈權貴者。其次揚清激濁，能補闕拾遺。又其次，建白時政，有裨軍國。皆分別擢敘。而粉飾文具、循默不言者，則罷黜之。庶言官知警，不至曠鳷。」
HCH_012_189_000059	時不見用。
HCH_012_189_000060	徐珪者，應城人。
HCH_012_189_000061	先是，千戶吳能以女滿倉兒付媒者鬻于樂婦張，紿曰：「周皇親家也。」
HCH_012_189_000062	後轉鬻樂工袁璘所。
HCH_012_189_000063	能歿，妻聶訪得之。
HCH_012_189_000064	女怨母鬻己，詭言非己母。
HCH_012_189_000065	聶與子劫女歸。
HCH_012_189_000066	璘訟于刑部，郎中丁哲、員外郎王爵訊得情。
HCH_012_189_000067	璘語不遜，哲笞璘，數日死。
HCH_012_189_000068	御史陳玉、主事孔琦驗璘屍，瘞之。
HCH_012_189_000069	東廠中官楊鵬從子嘗與女淫，教璘妻訴冤于鵬而令張指女為妹，又令賈校尉屬女亦如張言。
HCH_012_189_000070	媒者遂言聶女前鬻周皇親矣。
HCH_012_189_000071	奏下鎮撫司，坐哲、爵等罪。
HCH_012_189_000072	復下法司、錦衣衛讞，索女皇親周彧家，無有。
HCH_012_189_000073	復命府部大臣及給事、御史廷訊，張與女始吐實。
HCH_012_189_000074	都察院奏，哲因公杖人死，罪當徒。
HCH_012_189_000075	爵、玉、琦及聶母女當杖。
HCH_012_189_000076	獄上，珪憤懣，抗疏曰：「聶女之獄，哲斷之審矣。鵬拷聶使誣服，鎮撫司共相蔽欺。陛下令法司、錦衣會問，懼東廠莫敢明，至鞫之朝堂乃不能隱。夫女誣母僅擬杖，哲等無罪反加以徒。輕重倒置如此，皆東廠威劫所致也。臣在刑部三年，見鞫問盜賊，多東廠鎮撫司緝獲，有稱校尉誣陷者，有稱校尉為人報仇者，有稱校尉受首惡贓而以為從、令傍人抵罪者。刑官洞見其情，無敢擅更一字。上幹天和，災異迭見。臣願陛下革去東廠，戮鵬叔侄並賈校尉及此女於市，謫戍鎮撫司官極邊，進哲、爵、琦、玉各一階，以洗其冤，則天意可回，太平可致。如不罷東廠，亦當推選謹厚中官如陳寬、韋泰者居之，仍簡一大臣與共理。鎮撫司理刑亦不宜專用錦衣官。乞推選在京各衛一二人及刑部主事一人，共蒞其事。或三年、六年一更，則巡捕官校，當有作奸擅刑，誣及無辜者矣。臣一介微軀，左右前後皆東廠鎮撫司之人，禍必不免。顧與其死於此輩，孰若死於朝廷。願斬臣頭，以行臣言。給臣妻子送骸骨歸，臣雖死無恨。」
HCH_012_189_000077	帝怒，下都察院考訊。
HCH_012_189_000078	都御史閔珪等抵以奏事不實，贖徒還役。
HCH_012_189_000079	帝責具狀，皆上疏引罪，奪俸有差。
HCH_012_189_000080	珪贖徒畢，發為民。
HCH_012_189_000081	既而給事中龐泮等言：「哲等獄詞覆奏已餘三月，繫獄者凡三十八人，乞早為省釋。」
HCH_012_189_000082	乃杖滿倉兒，送浣衣局。
HCH_012_189_000083	哲給璘理葬資，發為民。
HCH_012_189_000084	爵及琦、玉俱贖杖還職。
HCH_012_189_000085	時弘治九年十二月也。
HCH_012_189_000086	磐尋擢吏部主事。
HCH_012_189_000087	正德元年，宦官漸用事，磐復上疏曰：「今日弊政，莫甚於內臣典民。夫臣以內稱，外事皆不當預，矧可使握兵柄哉。前代盛時，未嘗有此。唐、宋季世始置監軍，而其國遂以不永。今九邊鎮守、監槍諸內臣，恃勢專恣，侵克百端。有警則擁精卒自衛，克敵則縱部下攘功。武弁藉以夤緣，憲司莫敢訐問。所攜家人頭目，率惡少無賴。吞噬爭攫，勢同狼虎，致三軍喪氣，百職灰心。乞盡撤還京，專以邊務責將帥，此今日修攘要務也。」
HCH_012_189_000088	不從。
HCH_012_189_000089	及劉瑾得志，斥磐為奸黨，勒之歸。
HCH_012_189_000090	瑾誅，起河南僉事，坐累罷。
HCH_012_189_000091	珪以刑部主事陳鳳梧薦，授桐鄉丞。
HCH_012_189_000092	正德中，曆贛州通判。
HCH_012_189_000093	招降盜魁何積玉。
HCH_012_189_000094	已，復叛，下珪獄，尋釋之。
HCH_012_189_000095	後以平盜功擢知州。
HCH_012_189_000096	胡爟，字仲光，蕪湖人。
HCH_012_189_000097	弘治六年進士。
HCH_012_189_000098	改庶起士，授戶部主事。
HCH_012_189_000099	十年三月，災異求言。
HCH_012_189_000100	爟應詔，疏言：「中官李廣、楊鵬引左道劉良輔輩惑亂聖聰，濫設齋醮，耗蠹國儲。而不肖士大夫方昏暮乞憐於其門，交通請托。陰盛陽微，災何由弭？」
HCH_012_189_000101	因極陳戚畹、方士、傳奉冗員之害。
HCH_012_189_000102	疏留中。
HCH_012_189_000103	未幾，廣死，故爟得無罪。
HCH_012_189_000104	當成化時，宦官用事。
HCH_012_189_000105	孝宗嗣位，雖間有罷黜，而勢積重不能驟返。
HCH_012_189_000106	忤之者必結黨排陷，不勝不止。
HCH_012_189_000107	前後庶僚以忤璫被陷者，如弘治元年戶部員外郎周時從疏請置先朝遺奸汪直、錢能、蔡用輩於重典，而察核兩京及四方鎮守中官。
HCH_012_189_000108	諸宦官摘其奏中「宗社」字不越格，命法司逮治。
HCH_012_189_000109	已而釋之。
HCH_012_189_000110	十三年秋，大同有警，命保國公硃暉禦之。
HCH_012_189_000111	行人永清王雄極言暉不足任，且請罷中官監督，以重將權。
HCH_012_189_000112	苗逵方督暉軍，謂雄阻軍，乃下詔獄，謫雲南浪穹丞。
HCH_012_189_000113	羅僑，字維升，吉水人。
HCH_012_189_000114	性純靜，寡嗜欲。
HCH_012_189_000115	受業張元禎，講學里中。
HCH_012_189_000116	舉弘治十二年進士，除新會知縣，有惠愛。
HCH_012_189_000117	正德初，入為大理右評事。
HCH_012_189_000118	五年四月，京師旱霾，上疏曰：「臣聞人道理則陰陽和，政事失則災沴作。頃因京師久旱，陛下特沛德音，釋逋戍之囚，弛株連之禁，而齋禱經旬，雨澤尚滯。臣竊以為天心仁愛未已也。陛下視朝，或至日昃，狎侮群小，號呶達旦，其何以承天心基大業乎！文網日密，誅求峻急。盜賊白晝殺人，百姓流移載道，元氣索然。科道知之而不敢言，內閣言之而不敢盡，此壅蔽之大患也。古者進退大臣，必有體貌，黥劓之罪不上大夫。邇來公卿去不以禮。先朝忠藎如劉大夏者，謫戍窮邊，已及三載，陛下置之不問，非所以待耆舊、敬大臣也。本朝律例，參酌古今，足以懲奸而蔽罪。近者法司承望風旨，巧中善類。傳曰：「賞僭則及淫人，刑濫則及善人。不幸而過，寧僭無濫。』今之刑罰，濫孰甚焉。願陛下慎逸游，屏玩好，放棄小人，召還舊德，與在廷臣工，宵旰圖治，並敕法司慎守成律。即有律輕情重者，亦必奏請裁決，毋擅有輕重。庶可上弭天變，下收人心。」時朝士久以言為諱。僑疏上，自揣必死，輿櫬待命。劉瑾大怒，矯中旨詰責數百言，令廷臣議罪。大學士李東陽力救，得改原籍教職。其秋，瑾敗，僑尋召復官，引病去。宸濠反，王守仁起兵吉安，僑首赴義。世宗即位，即家授台州知府。建忠節祠，祀方孝孺。延布衣張尺，
HCH_012_189_000119	詢民間疾苦。
HCH_012_189_000120	歲時循行阡陌，課農桑，講明冠婚喪祭禮，境內大治。
HCH_012_189_000121	嘉靖二年舉行卓異。
HCH_012_189_000122	都御史姚鏌上書訟僑曰：「人臣犯顏進諫，自古為難。曩『八黨』弄權，逆瑾亂政，廷臣結舌，全軀自保。而給事中劉掞、評事羅僑殉國忘身，發摘時弊，倖存餘息。遭遇聖朝，謂宜顯加獎擢，用厲具臣。乃僑知台州，掞知長沙，使懷忠竭節之士淹于常調，臣竊為朝廷惜之。」
HCH_012_189_000123	帝納其言，擢僑廣東左參政，僑辭。
HCH_012_189_000124	部牒敦趣，不得已之官。
HCH_012_189_000125	逾年，遂謝病歸。
HCH_012_189_000126	僑敦行誼，動則古人。
HCH_012_189_000127	羅洪先居喪，不廢講學，僑以為非禮，遺書責之。
HCH_012_189_000128	其峭直如此。
HCH_012_189_000129	葉釗，字時勉，豐城人。
HCH_012_189_000130	弘治十五年進士。
HCH_012_189_000131	除南京刑部主事。
HCH_012_189_000132	獄囚久淹，悉按法出之。
HCH_012_189_000133	守備中官侵蘆洲，判歸之民。
HCH_012_189_000134	應天諸府災，上荒政四事。
HCH_012_189_000135	尋進員外郎。
HCH_012_189_000136	武宗立，應詔陳八事，中言：「宣、大被寇，殺卒幾千人。監督中官苗逵妄報首功，宜召還候勘。宦官典兵，于古未見。唐始用之，而宗社丘墟；我正統朝用之，而鑾輿北狩。自今軍務勿遣監督，鎮守者亦宜撤還。且國初宦官悉隸禮部，秩不過四品，職不過掃除。今請仍隸之部，易置司禮，俾供雜役。罷革東廠，移為他署。斯左右不得擅權，而後天下可安也。」
HCH_012_189_000137	又乞召還劉大夏，宥諫官戴銑等。
HCH_012_189_000138	劉瑾怒，坐斷獄詿誤，逮下詔獄，削籍歸。
HCH_012_189_000139	講學西江。
HCH_012_189_000140	瑾誅，起禮部員外郎，未聞命卒。
HCH_012_189_000141	學者祀之石鼓書院。
HCH_012_189_000142	時又有工部主事劉天麒者，臨桂人，釗同年進士。
HCH_012_189_000143	分司呂梁。
HCH_012_189_000144	奄人過者不為禮，訴之瑾，逮下詔獄，謫貴州安莊驛丞卒。
HCH_012_189_000145	嘉靖初，復官予祭。
HCH_012_189_000146	戴冠，信陽人。
HCH_012_189_000147	正德三年進士。
HCH_012_189_000148	為戶部主事。
HCH_012_189_000149	見寵倖日多，廩祿多耗，乃上疏極諫，略曰：「古人理財，務去冗食。近京師勢要家子弟僮奴苟竊爵賞，錦衣官屬數至萬餘，次者系籍勇士，投充監局匠役，不可數計，皆國家蠹也。歲漕四百萬，宿有嬴餘。近絀水旱，所入不及前，而歲支反過之，計為此輩耗三之一。陛下何忍以赤子膏血，養無用之蠹乎！兵貴精，不貴多。邊軍生長邊士，習戰陣，足以守禦。今遇警輒發京軍，而宣府調入京操之軍，累經臣下論列，堅不遣還。不知陛下何樂於邊軍，而不為關塞慮也。天子藏富天下，務鳩聚為帑藏，是匹夫商賈計也。逆瑾既敗，所籍財產不歸有司，而貯之豹房，遂創新庫。夫供禦之物，內有監局，外有部司，此庫何所用之。」
HCH_012_189_000150	疏入，帝大怒，貶廣東烏石驛丞。
HCH_012_189_000151	嘉靖初，起官，曆山東提學副使，以清介聞。
HCH_012_189_000152	黃鞏，字仲固，莆田人。
HCH_012_189_000153	弘治十八年進士。
HCH_012_189_000154	正德中，由德安推官入為刑部主事，掌諸司奏牘。
HCH_012_189_000155	曆職方武選郎中。
HCH_012_189_000156	十四年三月，有詔南巡，鞏上疏曰：陛下臨禦以來，祖宗之綱紀法度一壞於逆瑾，再壞於佞幸，又再壞于邊帥，蓋蕩然無餘矣。
HCH_012_189_000157	天下知有權臣，不知有天子，亂本已成，禍變將起。
HCH_012_189_000158	試舉當今最急者陳之。
HCH_012_189_000159	一，崇正學。
HCH_012_189_000160	臣聞聖人主靜，君子慎動。
HCH_012_189_000161	陛下盤游無度，流連忘返，動亦過矣。
HCH_012_189_000162	臣願陛下高拱九重，凝神定慮，屏紛華，斥異端，遠佞人，延故老，訪忠良。
HCH_012_189_000163	可以涵養氣質，薰陶德性，而聖學維新，聖政自舉。
HCH_012_189_000164	二，通言路。
HCH_012_189_000165	言路者，國家之命脈也。
HCH_012_189_000166	古者明王導人以言，用其言而顯其身。
HCH_012_189_000167	今則不然。
HCH_012_189_000168	臣僚言及時政者，左右匿不以聞。
HCH_012_189_000169	或事關權臣，則留中不出，而中傷以他事。
HCH_012_189_000170	使其不以言獲罪，而以他事獲罪。
HCH_012_189_000171	由是，雖有安民長策，謀國至計，無因自達。
HCH_012_189_000172	雖必亂之事，不軌之臣，陛下亦何由知？
HCH_012_189_000173	臣願廣開言路，勿罪其出位，勿責其沽名，將忠言日進，聰明日廣，亂臣賊子亦有所畏而不敢肆矣。
HCH_012_189_000174	三，正名號。
HCH_012_189_000175	陛下無故降稱大將軍、太師、鎮國公，遠近傳聞，莫不驚歎。
HCH_012_189_000176	如此，則誰為天子者？
HCH_012_189_000177	天下不以天子事陛下，而以將軍事陛下，天下皆為將軍之臣矣。
HCH_012_189_000178	今不削去諸名號，昭上下之分，則體統不正，朝廷不尊。
HCH_012_189_000179	古之天子亦有號稱「獨夫」，求為匹夫而不得者，竊為陛下懼焉。
HCH_012_189_000180	四，戒遊幸。
HCH_012_189_000181	陛下始時遊戲，不出大庭，馳逐止于南內，論者猶謂不可。
HCH_012_189_000182	既而幸宣府矣，幸大同矣，幸太原、榆林矣。
HCH_012_189_000183	所至費財動眾，郡縣騷然，至使民間夫婦不相保。
HCH_012_189_000184	陛下為民父母，何忍使至此極也？
HCH_012_189_000185	近復有南巡之命。
HCH_012_189_000186	南方之民爭先挈妻子避去，流離奔踣，怨讟煩興。
HCH_012_189_000187	今江、淮大饑，父子兄弟相食。
HCH_012_189_000188	天時人事如此，陛下又重蹙之，幾何不流為盜賊也。
HCH_012_189_000189	奸雄窺伺，侍時而發。
HCH_012_189_000190	變生在內，則欲歸無路；變生在外，則望救無及。
HCH_012_189_000191	陛下斯時，悔之晚矣。
HCH_012_189_000192	彼居位大臣，用事中官，親昵群小，夫豈有毫髮愛陛下之心哉？
HCH_012_189_000193	皆欲陛下遠出，而後得以擅權自恣，乘機為利也。
HCH_012_189_000194	其不然，則亦袖手旁觀，如秦、越人不相休戚也。
HCH_012_189_000195	陛下宜翻然悔悟，下哀痛罪己之詔。
HCH_012_189_000196	罷南巡，撤宣府離宮，示不復出。
HCH_012_189_000197	發內帑以振江、淮，散邊軍以歸卒伍。
HCH_012_189_000198	雪已往之謬舉，收既失之人心。
HCH_012_189_000199	如是，則尚可為也。
HCH_012_189_000200	五，去小人。
HCH_012_189_000201	自古未有小人用事不亡國喪身者也。
HCH_012_189_000202	今之小人簸弄威權、貪溺富貴者，實繁有徒。
HCH_012_189_000203	至於首開邊事，以兵為戲，使陛下勞天下之力，竭四海之財，傷百姓之心者，則江彬之為也。
HCH_012_189_000204	彬，行伍庸流，兇狠傲誕，無人臣禮。
HCH_012_189_000205	臣但見其有可誅之罪，不聞其有可賞之功。
HCH_012_189_000206	今乃賜以國姓，封以伯爵，托以心腹，付以京營重寄。
HCH_012_189_000207	使其外持兵柄，內蓄逆謀，以成騎虎之勢，此必亂之道也。
HCH_012_189_000208	天下切齒怒駡，皆欲食彬之肉。
HCH_012_189_000209	陛下亦何惜一彬，不以謝天下哉！
HCH_012_189_000210	六，建儲貳。
HCH_012_189_000211	陛下春秋漸高，前星未耀，祖宗社稷之托搖搖無所寄。
HCH_012_189_000212	方且遠事觀遊，屢犯不測；收養義子，佈滿左右。
HCH_012_189_000213	獨不能豫建親賢以承大業，臣以為陛下殆倒置也。
HCH_012_189_000214	伏望上告宗廟，請命太后，旁諏大臣，擇宗室親賢者一人養于宮中，以系四海之望。
HCH_012_189_000215	他日誕生皇子，仍俾出籓，實宗社無疆之福也。
HCH_012_189_000216	員外郎陸震草疏將諫，見鞏疏稱歎，因毀己稿，與鞏連署以進。
HCH_012_189_000217	帝怒甚，下二人詔獄，復跪午門。
HCH_012_189_000218	眾謂天子且出，鞏曰：「天子出，吾當牽裾死之。」
HCH_012_189_000219	跪五日，期滿，仍繫獄。
HCH_012_189_000220	越二十餘日，廷杖五十，斥為民。
HCH_012_189_000221	彬使人沿途刺鞏，有治洪主事知而匿之，間行得脫。
HCH_012_189_000222	既歸，潛心著述。
HCH_012_189_000223	或米盡，日中未爨，晏如也。
HCH_012_189_000224	嘗歎曰：「人生至公卿富貴矣，然不過三四十年。惟立身行道，千載不朽。世人顧往往以此易彼，何也？」
HCH_012_189_000225	世宗立，召為南京大理丞。
HCH_012_189_000226	疏請稽古正學，敬天勤民，取則堯、舜，保全君子，辯別小人。
HCH_012_189_000227	明年入賀，卒于京師。
HCH_012_189_000228	行人張岳訟其直節，贈大理少卿，賜祭葬。
HCH_012_189_000229	天啟初，追諡忠裕。
HCH_012_189_000230	陸震，字汝亭，蘭溪人。
HCH_012_189_000231	受業同縣章懋，以學行知名。
HCH_012_189_000232	正德三年進士。
HCH_012_189_000233	除泰和知縣。
HCH_012_189_000234	時劉瑾擅政。
HCH_012_189_000235	以逋鹽課責縣民償者連數百人，震力白之上官，得免。
HCH_012_189_000236	鎮守中官歲征貢絺，為減其額。
HCH_012_189_000237	增築學舍居諸生，毀淫祠祀忠節。
HCH_012_189_000238	浮糧累民，稽賦籍，得詭寄隱匿者萬五千石以補之。
HCH_012_189_000239	建倉縣左，儲穀待振。
HCH_012_189_000240	親行鄉落，勸課農桑。
HCH_012_189_000241	立保伍法，使民備盜。
HCH_012_189_000242	甓城七里，外為土城十里周之。
HCH_012_189_000243	時發狼兵討賊，所至擾民。
HCH_012_189_000244	震言于總督，令毋聽檥舟，官具糧糗，以次續食，兵行肅然。
HCH_012_189_000245	督捕永豐、新淦賊，以功受賞。
HCH_012_189_000246	撫按交薦，征為兵部主事。
HCH_012_189_000247	泰和人生祠之。
HCH_012_189_000248	在部，主諸司章奏，與中人忤，改巡紫荊諸關。
HCH_012_189_000249	又以論都御史彭澤、副使胡世寧無罪，忤尚書王瓊、陸完。
HCH_012_189_000250	孝貞皇后崩，武宗至自宣府。
HCH_012_189_000251	既發喪數日，復欲北出。
HCH_012_189_000252	震抗疏曰：「日者，昊天不吊，威降大戚。車駕在狩，群情惶惶。陛下單騎沖雪還宮，百官有司莫不感愴，以為陛下前蔽而今明也。乃者梓宮在殯，遽擬遊巡，臣知陛下之心必有蹙然不安者。且陛下即位十有二年矣，十者幹之終，十有二者支之終。當氣運周會，正修德更新時，顧乃營宣府以為居，縱騎射以為樂，此臣所深懼也。古人君車馬遊畋之好，雖或有之，至若以外為主，以家為客，挈天下大器、賞罰大柄付之於人，漠然不關意念，此古今所絕無者。伏望勉終喪制，深戒盤遊。」
HCH_012_189_000253	不報。
HCH_012_189_000254	進武選員外郎。
HCH_012_189_000255	已，偕黃鞏諫南巡，遂下詔獄。
HCH_012_189_000256	獄中與鞏講《易》九卦，明憂患之道。
HCH_012_189_000257	同系者率處分後事，震獨無一言。
HCH_012_189_000258	既杖，創甚，作書與諸子，「吾雖死，汝等當勉為忠孝。吾筆亂，神不亂也」，遂卒。
HCH_012_189_000259	世宗立，贈太常少卿。
HCH_012_189_000260	予祭。
HCH_012_189_000261	方震等繫獄，江彬必欲致之死，絕其飲食。
HCH_012_189_000262	震季子體仁，年十五，變服為他囚親屬，職納橐饘焉。
HCH_012_189_000263	後有詔錄一子官，諸兄讓體仁，為漳州通判，有政聲。
HCH_012_189_000264	孫可教，由進士曆南京禮部侍郎。
HCH_012_189_000265	夏良勝，字於中，南城人。
HCH_012_189_000266	少為督學副使蔡清所知，曰「子異日必為良臣，當無有勝子者」，遂名良勝。
HCH_012_189_000267	正德二年舉鄉試第一。
HCH_012_189_000268	明年，成進士，授刑部主事，調吏部，進考功員外郎。
HCH_012_189_000269	南巡詔下，良勝具疏，與禮部主事萬潮、太常博士陳九川連署以進，言：「方今東南之禍，不獨江、淮；西北之憂，近在輦轂。廟祀之鬯位，不可以久虛；聖母之孝養，不可以恒曠。宮壺之孕祥，尚可以早圖；機務之繁重，未可以盡委。『鎮國』之號，傳聞海內，恐生覬覦之階；邊將之屬，納於禁近，詎忘肘腋之患。巡遊不已，臣等將不知死所矣。」
HCH_012_189_000270	時舒芬、黃鞏、陸震疏已前入。
HCH_012_189_000271	吏部郎中張衍瑞等十四人、刑部郎中陸俸等五十三人繼之，禮部郎中姜龍等十六人、兵部郎中孫鳳等十六人又繼之。
HCH_012_189_000272	而醫士徐鏊亦以其術諫，略言：「養身之道，猶置燭然，室閉之則堅，風暴之則淚。陛下輕萬乘，習嬉娛，躍馬操弓，捕魚玩獸。邇復不憚遠遊，冒寒暑，涉關河，饍飲不調，餚蔌無擇，誠非養生道也。況南方卑濕，尤易致病。乞念宗廟社稷之重，勿事鞍馬，勿過醉飽，喜無傷心，怒無傷肝，欲無傷腎，勞無傷脾，就密室之安，違暴風之禍。臣不勝至願。」
HCH_012_189_000273	諸疏既入，帝與諸幸臣皆大怒，遂下良勝、潮、九川、鞏、震、鏊詔獄，芬及衍瑞等百有七人罰跪午門外五日。
HCH_012_189_000274	而大理寺正周敘等十人，行人司副余廷瓚等二十人，工部主事林大輅、何遵、蔣山卿連名疏相繼上。
HCH_012_189_000275	帝益怒，並下詔獄。
HCH_012_189_000276	俄令敘、廷瓚、大輅等，與良勝等六人，俱跪闕下五日，加梏鋋焉。
HCH_012_189_000277	至晚，仍繫獄。
