HCH_009_090_000271	父筠，以吏補州縣，所至有治聲，其後致仕，杜門不出，鄉里有鬥訟者，不之官而就筠質焉。
HCH_009_090_000272	暐仁沖澹寡欲，讀書之外，無他好，遼季避難，雖間關道途，未嘗釋卷。
HCH_009_090_000273	皇統二年，登進士第，調武清縣丞。
HCH_009_090_000274	縣經兵革後，無學校，暐仁召邑中俊秀子弟教之學，百姓欣然從之。
HCH_009_090_000275	調磁州軍事判官。
HCH_009_090_000276	是時，詔使廉察官吏，暐仁以廉攝守事。
HCH_009_090_000277	遷和川令。
HCH_009_090_000278	前令罷耎不事事，群小越法幹禁無所憚，暐仁申明法禁，皆屏息，或走入他縣以避之。
HCH_009_090_000279	有董佑者最強悍，畏服暐仁，以刀斷指，誓終身不復犯法。
HCH_009_090_000280	凡租賦與百姓前為期率，比他邑先辦。
HCH_009_090_000281	曆北京推官，再遷大理司直，以憂去官，尋起複。
HCH_009_090_000282	大定三年，除定武軍節度副使，而節度使、同知皆闕，暐仁為政無留訟。
HCH_009_090_000283	改大理丞，吏部員外郎，轉戶部郎中。
HCH_009_090_000284	於是，賈少沖為刑部郎中，上謂左丞相紇石烈良弼曰：「少沖為人柔緩，不稱刑部之職，其議易之。」
HCH_009_090_000285	乃以暐仁為刑部郎中。
HCH_009_090_000286	坐尚廄局官私用官芻，違格付大興府鞫問，解職。
HCH_009_090_000287	改祁州刺史。
HCH_009_090_000288	祁州為定武支郡，士民聞暐仁之官，相率歡迎界上，相屬不絕。
HCH_009_090_000289	改同知西京留守事，首興學校，以明養士之法。
HCH_009_090_000290	遷陝西西路轉運使。
HCH_009_090_000291	大定二十一年，卒官。
HCH_009_090_000292	贊曰：吏之興，其秦之季邪？
HCH_009_090_000293	吏有選試，其遼、金之際邪？
HCH_009_090_000294	其文從一從史，守法不貳之謂邪？
HCH_009_090_000295	守法不貳，斯真吏矣。
HCH_009_090_000296	巧者舞文以亂法，窒者執一而弗通，此皆吏道之自失者也。
HCH_009_090_000297	高衎、高德基、張九思之徒，皆詭法以自失者矣。
