HCH_012_027_000001	恒星洪武十九年七月癸亥，二十年五月丁丑，七月壬寅，二十一年十二月丁卯，俱三辰昼见。
HCH_012_027_000002	弘治十八年九月甲午申刻，河鼓、北斗见。
HCH_012_027_000003	庚子，星昼见。
HCH_012_027_000004	正德元年二月癸酉，星斗昼见。
HCH_012_027_000005	天启二年五月壬寅，有星随日昼见。
HCH_012_027_000006	崇祯十六年十二月辛酉朔，星昼见。
HCH_012_027_000007	岁星景泰二年九月甲辰，昼见。
HCH_012_027_000008	三年六月壬戌，四年五月丁丑，六月甲辰，五年七月庚戌、壬子、癸亥，六年七月丁酉，天顺元年五月丙子，五年七月乙卯，六年八月庚午，七年三月乙巳，成化十四年六月庚子，八月丁酉，十六年七月丙申，十八年九月癸亥，二十年八月壬申，弘治元年六月甲寅，二年五月癸亥，六月甲午，五年十月己酉，六年九月癸卯，七年十一月癸卯，九年二月辛亥至甲寅，四月壬午，十年正月甲寅至丙辰，十一年八月甲申，十三年四月庚子至乙巳，十四年六月壬辰至乙未，并如之。
HCH_012_027_000009	十五年六月，连日昼见。
HCH_012_027_000010	十六年七月辛卯，十七年七月壬子，十八年五月乙未，八月辛巳至九月癸未，正德元年十一月乙酉，二年十一月辛酉至丁卯，六年三月壬寅至四月壬申，九年八月乙巳至甲寅，十二年十月甲子至乙巳，并如之。
HCH_012_027_000011	嘉靖二年三月辛未，二十九年八月戊寅，昼见守井。
HCH_012_027_000012	崇祯十一年四月壬子，昼见。
HCH_012_027_000013	荧惑景泰三年八月甲子，昼见于未位。
HCH_012_027_000014	太白洪武四年二月戊午，昼见。
HCH_012_027_000015	四月戊申，六月壬午朔，五年六月甲申至丁亥，十二月甲申，八年八月丁巳，九年二月乙巳至己酉，三月壬申，十二年闰五月戊戌，十三年七月甲午，十五年四月丁亥，七月戊申、辛酉，九月丁未朔，十六年十月壬辰至乙未，十八年四月己亥至辛丑，六月丙申至辛丑、辛亥，并如之。
HCH_012_027_000016	九月戊寅，经天与荧惑同度。
HCH_012_027_000017	乙酉，昼见。
HCH_012_027_000018	丁亥，又见，犯荧惑。
HCH_012_027_000019	十月癸巳至丙申，昼见。
HCH_012_027_000020	戊戌至辛丑，十九年十月甲申朔至庚寅，并如之。
HCH_012_027_000021	二十年六月戊戌，经天。
HCH_012_027_000022	七月壬寅至甲辰，昼见。
HCH_012_027_000023	二十一年四月己巳，七月丙申，二十三年三月丁亥，二十四年八月辛巳，二十五年二月辛酉，二十六年四月甲辰，并如之。
HCH_012_027_000024	八月庚子，与太阴同昼见。
HCH_012_027_000025	建文四年七月庚子，经天。
HCH_012_027_000026	永乐元年五月癸未、癸卯，俱与太阴同昼见。
HCH_012_027_000027	六月壬申，与太阴昼见。
HCH_012_027_000028	四年七月壬寅，昼见。
HCH_012_027_000029	五年八月丙申，六年二月甲辰，八年十月庚戌，十二年九月癸未，十五年七月己酉，八月庚戌，洪熙元年六月戊戌，七月乙巳，八月癸巳，宣德六年十月乙巳，八年九月戊戌至甲寅，九年十二月甲子，十年七月丁亥，正统四年七月壬子，十月丙申，六年五月庚戌，并如之。
HCH_012_027_000030	十一年七月甲申，经天。
HCH_012_027_000031	十三年二月辛酉，昼见。
HCH_012_027_000032	十四年正月辛亥，八月丙子，景泰元年十月乙酉，二年五月庚子、辛亥，并如之。
HCH_012_027_000033	壬子，经天。
HCH_012_027_000034	三年五月丁巳，昼见。
HCH_012_027_000035	十一月壬戌，五年正月甲戌，二月丙戌，六月癸卯，七年正月戊戌，天顺元年四月甲午，八月壬子，二年十月己未，三年四月癸亥、癸酉，四年十一月庚寅，十二月丙戌，五年正月丁未，十二月癸巳，六年六月己丑，八月庚午，七年闰七月辛酉、癸未，八年正月庚申，成化元年二月癸未，三年四月癸丑，四年六月丙申，六年六月丙戌，七年八月癸卯，并如之。
HCH_012_027_000036	八年正月乙卯，经天，与日争明。
HCH_012_027_000037	十一年五月己未，昼见。
HCH_012_027_000038	十二年十月丙戌，十三年十二月甲午，并如之。
HCH_012_027_000039	十四年六月庚子，与岁星俱昼见。
HCH_012_027_000040	八月甲午，昼见。
HCH_012_027_000041	十五年十二月丙子，十七年三月癸未，八月癸亥，十八年九月庚戌，十九年四月癸亥朔，并如之。
HCH_012_027_000042	二十年八月壬申，与岁星俱昼见。
HCH_012_027_000043	二十一年十一月丙辰，昼见。
HCH_012_027_000044	二十二年六月己丑，二十三年九月丙午，弘治元年五月庚午，二年正月壬戌，三月庚申，五月丙戌，八月癸巳、庚子，四年四月辛未，五年五月乙亥，十月辛酉，六年十二月乙丑，七年五月庚戌，八年七月戊子，九年二月己酉朔，十年正月甲子至丁卯，并如之。
HCH_012_027_000045	六月丙子未刻，经天。
HCH_012_027_000046	八月癸未及十一年十月辛巳，昼见。
HCH_012_027_000047	十二年三月戊辰至壬申，八月庚寅，并如之。
HCH_012_027_000048	十三年四月庚子至乙巳，与岁星同昼见。
HCH_012_027_000049	十月丁未、己酉，十四年十二月庚戌，十五年五月庚寅至癸巳，十六年七月壬辰，十七年二月戊戌及六月癸亥，十八年二月壬戌，并昼见。
HCH_012_027_000050	五月辛亥，经天。
HCH_012_027_000051	八月癸亥至戊辰，昼见。
HCH_012_027_000052	正德元年十月己未，如之。
HCH_012_027_000053	二年正月庚辰，经天。
HCH_012_027_000054	三月戊辰，昼见。
HCH_012_027_000055	三年五月乙巳至丁未，十月己卯、庚辰，四年十月戊戌至乙巳，五年五月丙子，六年七月壬申至八月癸未，八年正月丙戌至己丑，四月壬戌、癸亥，八月庚戌至乙卯，九年十一月甲申至十二月壬辰，十一年六月甲寅至己未，十四年八月丙寅至庚辰，十五年正月己未至二月辛酉，十六年八月丁亥，嘉靖元年九月辛未，并如之。
HCH_012_027_000056	二年三月辛未，与岁星俱昼见。
HCH_012_027_000057	三年四月庚戌，昼见。
HCH_012_027_000058	五年五月庚子，十一年四月癸巳，十月辛巳、戊子，十一月甲寅，十三年闰二月庚申，并如之。
HCH_012_027_000059	五月癸巳，与月同昼见。
HCH_012_027_000060	十七年九月辛卯，昼见。
HCH_012_027_000061	十八年四月癸亥，十一月壬寅，二十年十一月乙巳至丁未，二十二年七月丙午，二十三年二月辛巳，二十四年闰正月戊寅，二十五年十月辛卯，二十六年四月丙申，二十七年四月丁巳，十一月丙戌至乙未，二十八年十一月乙酉至己丑，二十九年六月戊申、甲寅，三十年六月丙子至辛巳，三十一年正月丙戌至丙申，三十二年二月辛未至甲戌，七月戊辰至辛未，三十五年五月壬午，十月癸卯至丙午，三十六年十二月庚辰朔，三十八年七月癸酉，三十九年正月庚寅至壬辰，并如之。
HCH_012_027_000062	四十年三月丙子，昼见，历二十四日。
HCH_012_027_000063	八月辛未，昼见。
HCH_012_027_000064	四十一年九月乙未，四十二年四月己巳至壬申，四十三年五月甲寅，并如之。
HCH_012_027_000065	十月戊子，昼见，历二十二日。
HCH_012_027_000066	四十五年正月己亥，昼见。
HCH_012_027_000067	隆庆元年七月辛酉，二年正月甲寅，并如之。
HCH_012_027_000068	三年三月甲子，昼见，历二十二日，四年十一月乙丑至丁卯，昼见。
HCH_012_027_000069	万历十一年七月辛丑，十二年七月癸巳，十六年九月丁丑，二十一年八月甲午，二十四年十月丙寅，并如之。
HCH_012_027_000070	二十七年九月辛卯，经天。
HCH_012_027_000071	三十七年三月辛丑，昼见。
HCH_012_027_000072	三十八年十月辛巳，四十年五月壬寅，天启二年二月丙戌，三年三月丁巳，十二月乙丑，五年四月癸未，并如之。
HCH_012_027_000073	七月癸酉，经天。
HCH_012_027_000074	崇祯元年七月壬戌，昼见。
HCH_012_027_000075	三年四月己卯，十二月丙辰，并如之。
HCH_012_027_000076	《史记·天官书》有客星之名，而不详其形状。
HCH_012_027_000077	叙国皇、昭明诸异星甚悉，而无瑞星、妖星之名。
HCH_012_027_000078	然则客星者，言其非常有之星，殆诸异星之总名，而非有专属也。
HCH_012_027_000079	李淳风志晉、隋天文，始分景星、含誉之属为瑞星，彗、孛、国皇之类为妖星，又以周伯老子等为客星，自谓本之汉末刘睿《荆州占》。
HCH_012_027_000080	夫含誉，所谓瑞星也，而光芒则似彗；国皇，所谓妖星也，而形色又类南极老人。
HCH_012_027_000081	瑞与妖果有定哉？
HCH_012_027_000082	且周伯一星也，既属之瑞星，而云其国大昌。
HCH_012_027_000083	又属之客星，而云其国兵起有丧。
HCH_012_027_000084	其说如此，果可为法乎？
HCH_012_027_000085	马迁不复区别，良有以也。
HCH_012_027_000086	今按《实录》，彗、孛变见特甚，皆别书。
HCH_012_027_000087	老人星则江以南常见，而燕京必无见理，故不书。
HCH_012_027_000088	余悉属客星而编次之。
HCH_012_027_000089	洪武三年七月，太史奏文星见。
HCH_012_027_000090	九年六月戊子，有星大如弹丸，白色。
HCH_012_027_000091	止天仓，经外屏、卷舌，入紫微垣，扫文昌，指内厨，入于张。
HCH_012_027_000092	七月乙亥灭。
HCH_012_027_000093	十一年九月甲戌，有星见于五车东北，发芒丈余。
HCH_012_027_000094	扫内阶，入紫微宫，扫北极五星，犯东垣少宰，入天市垣，犯天市。
HCH_012_027_000095	至十月己未，阴云不见。
HCH_012_027_000096	十八年九月戊寅，有星见太微垣，犯右执法，出端门。
HCH_012_027_000097	乙酉，入翼，彗长丈余。
HCH_012_027_000098	至十月庚寅，犯军门，彗扫天庙。
HCH_012_027_000099	二十一年二月丙寅，有星出东壁，占曰「文士效用」。
HCH_012_027_000100	帝大喜，以为将策进士兆也。
HCH_012_027_000101	永乐二年十月庚辰，辇道东南有星如盏，黄色，光润而不行。
HCH_012_027_000102	二十二年九月戊戌，有星见斗宿，大如碗，色黄白，光烛地，有声，如撒沙石。
HCH_012_027_000103	宣德五年八月庚寅，有星见南河旁，如弹丸大，色青黑，凡二十六日灭。
HCH_012_027_000104	十月丙申，蓬星见外屏南，东南行，经天仓、天庾，八日而灭。
HCH_012_027_000105	十二月丁亥，有星如弹丸，见九斿旁，黄白光润，旬有五日而隐。
HCH_012_027_000106	六年三月壬午，又见。
HCH_012_027_000107	八年闰八月戊午，景星三，见西北方天门，青赤黄各一，大如碗，明朗清润，良久聚半月形。
HCH_012_027_000108	丁丑，有黄赤色见东南方，如星非星，如云非云，盖归邪星也。
HCH_012_027_000109	景泰三年十一月癸未，有星见鬼宿积尸气旁，徐徐西行。
HCH_012_027_000110	天顺二年十一月癸卯，有星见于星宿，色白，西行，至丙午，其体微，状如粉絮，在轩辕旁。
HCH_012_027_000111	庚戌，生芒五寸，犯爟位西北星，至十二月壬戌，没于东井。
HCH_012_027_000112	五年六月壬辰，天市垣宗正旁，有星粉白，至乙未，化为白气而消。
HCH_012_027_000113	六年六月丙寅，有星见策星旁，色苍白，入紫微垣，犯天牢，至癸未，居中台下，形渐微。
HCH_012_027_000114	弘治三年十二月丁巳，有星见天市垣，东南行。
HCH_012_027_000115	戊辰，见天仓下，渐向壁。
HCH_012_027_000116	七年十二月丙寅，有星见天江旁，徐行近斗，至八年正月庚戌，入危。
HCH_012_027_000117	十二年七月戊辰，有星见天市垣宗星旁，入紫微垣东籓，经少宰、尚书，抵太子后宫，出西籓少辅旁，至八月己丑灭。
HCH_012_027_000118	十五年十月戊辰，有星见天庙旁，自张抵翼，复退至张，戊寅灭。
HCH_012_027_000119	正德十六年正月甲寅朔，东南有星如火，变白，长可六七尺，横亘东西，复变勾屈状，良久乃散。
HCH_012_027_000120	嘉靖八年正月立春日，长星亘天。
HCH_012_027_000121	七月又如之。
HCH_012_027_000122	十一年二月壬午，有星见东南，色苍白，有芒，积十九日灭。
HCH_012_027_000123	十三年五月丁卯朔，有星见螣蛇，历天厩入阁道，二十四日灭。
HCH_012_027_000124	十五年三月戊午，有星见天棓旁，东行历天厨，西入天汉，至四月壬辰没。
HCH_012_027_000125	二十四年十一月壬午，有星出天棓，入箕，转东北行，逾月没。
HCH_012_027_000126	万历六年正月戊辰，有大星如日，出自西方，众星皆西环。
HCH_012_027_000127	十二年六月己酉，有星出房。
HCH_012_027_000128	三十二年九月乙丑，尾分有星如弹丸，色赤黄，见西南方，至十月而隐。
HCH_012_027_000129	十二月辛酉，转出东南方，仍尾分。
HCH_012_027_000130	明年二月渐暗，八月丁卯始灭。
HCH_012_027_000131	三十七年，有大星见西南，芒刺四射。
HCH_012_027_000132	四十六年九月乙卯，东南有白气一道，阔尺余，长二丈余，东至轸，西入翼，十九日而灭。
HCH_012_027_000133	十一月丙寅，旦有花白星见东方。
HCH_012_027_000134	天启元年四月癸酉，赤星见于东方。
HCH_012_027_000135	崇祯九年冬，天狗见豫分。
HCH_012_027_000136	彗之光芒傅日而生，故夕见者必东指，晨见者必西指。
HCH_012_027_000137	孛亦彗类，其芒气四出，天文家言其灾更甚于彗。
HCH_012_027_000138	洪武元年正月庚寅，彗星见于昴、毕。
HCH_012_027_000139	三月辛卯，彗星出昴北大陵、天船间，长八尺余，指文昌，近五车，四月己酉，没于五车北。
HCH_012_027_000140	六年四月，彗星三入紫微垣。
HCH_012_027_000141	二十四年四月丙子，彗星二，一入紫微垣阊阖门，犯天床；一犯六甲，扫五帝内座。
HCH_012_027_000142	永乐五年十一月丙寅，彗星见。
HCH_012_027_000143	宣德六年四月戊戌，有星孛于东井，长五尺余。
HCH_012_027_000144	七年正月壬戌，彗星出东方，长丈余，尾扫天津，东南行，十月始灭。
HCH_012_027_000145	是月戊子，又出西方，十有七日而灭。
HCH_012_027_000146	八年闰八月壬子，彗星出天仓旁，长丈许。
HCH_012_027_000147	己巳，入贯索，扫七公。
HCH_012_027_000148	己卯，复入天市垣，扫晉星，二十有四日而灭。
HCH_012_027_000149	正统四年闰二月己丑，彗星见张宿旁，大如弹。
HCH_012_027_000150	丁酉，长五丈余，西行，扫酒旗，迤北，犯鬼宿。
HCH_012_027_000151	六月戊寅，彗星见毕宿旁，长丈余，指西南，计五十有五日乃灭。
HCH_012_027_000152	九年七月庚午，彗星见太微东垣，长丈许，累日渐长，至闰七月己卯，入角没。
HCH_012_027_000153	十四年十二月壬子，彗星见天市垣市楼旁，历尾度，长二尺余，至乙亥没。
HCH_012_027_000154	景泰元年正月壬午，彗星出天市垣外，扫天纪星。
HCH_012_027_000155	三年三月甲午朔，有星孛于毕。
HCH_012_027_000156	七年四月壬戌，彗星东北见于胃，长二尺，指西南。
HCH_012_027_000157	五月癸酉，渐长丈余。
HCH_012_027_000158	戊子，西北见于柳，长九尺余，扫犯轩辕星。
HCH_012_027_000159	甲午，见于张，长七尺余，扫太微北，西南行。
HCH_012_027_000160	六月壬寅，入太微垣，长尺余。
HCH_012_027_000161	十二月甲寅，彗星复见于毕，长五寸，东南行，渐长，至癸亥而没。
HCH_012_027_000162	天顺元年五月丙戌，彗星见于危，若动摇者，东行一度，芒长五寸，指西南。
HCH_012_027_000163	六月癸巳朔，见室，长丈余，由尾至东壁，犯天大将军、卷舌第三星，井宿水位南第二星。
HCH_012_027_000164	十月己亥，彗星见于角，长五寸余，指北，犯角北星及平道东星。
HCH_012_027_000165	五年六月戊戌，彗见东方，指西南，入井度。
HCH_012_027_000166	七月丙寅始灭。
HCH_012_027_000167	成化元年二月，彗星见。
HCH_012_027_000168	三月，又见西北，长三丈余，三阅月而没。
HCH_012_027_000169	四年九月己未，有星见星五度，东北行，越五日，芒长三丈余，尾指西南，变为彗星。
HCH_012_027_000170	其后晨见东方，昏见室，南犯三公、北斗、瑶光、七公，转入天市垣。
HCH_012_027_000171	出垣渐小，犯天屏西第一星。
HCH_012_027_000172	十一月庚辰，始灭。
HCH_012_027_000173	七年十二月甲戌，彗星见天田，西指，寻北行，犯右摄提，扫太微垣上将及幸臣、太子、从官，尾指正西，横扫太微垣郎位。
HCH_012_027_000174	己卯，光芒长大，东西竟天。
HCH_012_027_000175	北行二十八度余，犯天枪，扫北斗、三公、太阳，入紫微垣内，正昼犹见。
HCH_012_027_000176	自帝星、北斗、魁、庶子、后宫、勾陈、天枢、三师、天牢、中台、天皇大帝、上卫、阁道、文昌、上台，无所不犯。
HCH_012_027_000177	乙酉，南行犯娄、天河、天阴、外屏、天囷。
HCH_012_027_000178	八年正月丙午，行奎宿外屏，渐微，久之始灭。
HCH_012_027_000179	弘治三年十一月戊戌，彗星见天津南，尾指东北。
HCH_012_027_000180	犯人星，历杵臼。
HCH_012_027_000181	十二月戊申朔，入营室。
HCH_012_027_000182	庚申，犯天仓。
HCH_012_027_000183	十三年四月甲午，彗星见垒壁阵上，入室壁间，渐长三尺余。
HCH_012_027_000184	指离宫，扫造父，过太微垣，渐微。
HCH_012_027_000185	入紫微垣，近女史，犯尚书，六月丁酉没。
HCH_012_027_000186	正德元年七月己丑，有星见紫微西籓外，如弹丸，色苍白。
HCH_012_027_000187	越数日，有微芒见参、井间，渐长二尺，如帚，西北至文昌。
HCH_012_027_000188	庚子，彗星见，有光，流东南，长三尺。
HCH_012_027_000189	越三日，长五尺许，扫下台上星，入太微垣。
HCH_012_027_000190	十五年正月，彗星见。
HCH_012_027_000191	嘉靖二年六月，有星孛于天市。
HCH_012_027_000192	十年闰六月乙巳，彗星见于东井，长尺余，扫轩辕第一星。
HCH_012_027_000193	芒渐长，至翼，长七尺余。
HCH_012_027_000194	东北扫天樽，入太微垣，扫郎位，行角度，东南扫亢北第二星，渐敛，积三十四日而没。
HCH_012_027_000195	十一年八月己卯，彗星见东井，长尺许。
HCH_012_027_000196	后东北行，历天津，渐至丈余。
HCH_012_027_000197	扫太微垣诸星及角宿、天门，至十二月甲戌，凡一百十五日而灭。
HCH_012_027_000198	十二年六月辛巳，彗星见于五车，长五尺余，扫大陵及天大将军。
HCH_012_027_000199	渐长丈余，扫阁道，犯螣蛇，至八月戊戌而灭。
HCH_012_027_000200	十八年四月庚戌，彗星见，长三尺许，光指东南。
HCH_012_027_000201	扫轩辕北第八星，旬日始灭。
HCH_012_027_000202	三十三年五月癸亥，彗星见天权旁，犯文昌，行入近浊，积二十七日而没。
HCH_012_027_000203	三十五年正月庚辰，彗星见进贤旁，长尺许，西南指，渐至三尺余。
HCH_012_027_000204	扫太微垣，次相东北，入紫微垣，犯天床，四月二日灭。
HCH_012_027_000205	三十六年九月戊辰，彗星见天市垣列肆旁，东北指，至十月二十三日灭。
HCH_012_027_000206	隆庆三年十月辛丑朔，彗星见天市垣，东北指，至庚申灭。
HCH_012_027_000207	万历五年十月戊子，彗星见西南，苍白色，长数丈，气成白虹。
HCH_012_027_000208	由尾、箕越斗、牛逼女，经月而灭。
HCH_012_027_000209	八年八月庚申，彗星见东南方，每夜渐长，纵横河汉凡七十日有奇。
HCH_012_027_000210	十年四月丙辰，彗星见西北，形如匹练，尾指五车，历二十餘日灭。
HCH_012_027_000211	十三年九月戊子，彗星出羽林旁，长尺许。
HCH_012_027_000212	每夕东行，渐小，至十月癸酉灭。
HCH_012_027_000213	十九年三月丙辰，西北有星如彗，长尺余。
HCH_012_027_000214	历胃、室、壁，长二尺。
HCH_012_027_000215	闰三月丙寅朔，入娄。
HCH_012_027_000216	二十一年七月乙卯，彗星见东井。
HCH_012_027_000217	乙亥，逆行入紫微垣，犯华盖。
HCH_012_027_000218	二十四年七月丁丑，彗星见西北，如弹丸。
HCH_012_027_000219	入翼，长尺余，西北行。
HCH_012_027_000220	三十五年八月辛酉朔，彗星见东井，指西南，渐往西北。
HCH_012_027_000221	壬午，自房历心灭。
HCH_012_027_000222	四十六年十月乙丑，彗星出于氐，长丈余，指东南，渐指西北。
HCH_012_027_000223	扫犯太阳守星，入亢度，西北扫北斗、璇玑、文昌、五车，逼紫微垣右，至十一月甲辰灭。
HCH_012_027_000224	四十七年正月杪，彗见东南，长数百尺，光芒下射，末曲而锐，未几见于东北，又未几见于西。
HCH_012_027_000225	崇祯十二年秋，彗星见参分。
HCH_012_027_000226	十三年十月丙戌，彗星见。
HCH_012_027_000227	洪武二十一年八月壬戌至甲子，天鼓鸣，昼夜不止。
HCH_012_027_000228	二十八年三月戊午，昏刻天鸣，如风水相搏，至一鼓止。
HCH_012_027_000229	九月戊戌，初鼓，天鸣如泻水，自东北而南，至二鼓止。
HCH_012_027_000230	宣德元年八月戊辰，昏刻天鸣，如雨阵迭至，自东南而西南，良久乃息。
HCH_012_027_000231	辛未，东南天鸣，声如万鼓。
HCH_012_027_000232	正统十年三月庚寅，西北天鸣，如鸟群飞。
HCH_012_027_000233	正德元年二月壬子，夜东北天鸣，如风水相搏者五七次。
HCH_012_027_000234	隆庆二年八月甲辰，绛州西北天裂，自丑至寅乃合。
HCH_012_027_000235	万历十六年九月乙丑，甘肃石灰沟天鸣，云中如犬状乱吠，有声。
HCH_012_027_000236	崇祯元年三月辛巳，昧爽，天赤如血，射窗牖皆红。
HCH_012_027_000237	十年九月，每晨夕天色赤黄。
HCH_012_027_000238	洪武二年十二月甲子，日中有黑子。
HCH_012_027_000239	三年九月戊戌，十月丁巳，十一月甲辰，四年三月戊戌，五月壬子至辛巳，九月戊寅，五年正月庚戌，二月丁未，五月甲子，七月辛未，六年十一月戊戌朔，七年二月庚戌至甲寅，八年二月辛亥，九月癸未，十二月癸丑，十四年二月壬午至乙酉，十五年闰二月丙戌，十二月辛巳，并如之。
HCH_012_027_000240	正统元年八月癸酉至己卯，月出入时皆有游气，色赤无光。
HCH_012_027_000241	十四年八月辛未，月昼见，与日争明。
HCH_012_027_000242	十月壬申，日上黑气如烟，寻发红光，散焰如火。
HCH_012_027_000243	景泰二年四月己卯，月色如赭。
HCH_012_027_000244	七年九月丙子，日色变赤。
HCH_012_027_000245	天顺二年闰二月己巳，日无光，旋赤如赭。
HCH_012_027_000246	三年八月丁卯，日色如赭。
HCH_012_027_000247	六年十月丙子，日赤如血。
HCH_012_027_000248	七年四月癸未，如之。
HCH_012_027_000249	乙酉，日色变白。
HCH_012_027_000250	八年二月己亥，日无光。
HCH_012_027_000251	成化五年闰二月己卯，日色变白。
HCH_012_027_000252	十一年二月己亥，日色如赭。
HCH_012_027_000253	四月辛卯，如之。
HCH_012_027_000254	十三年三月壬申，日白无光。
HCH_012_027_000255	十月辛卯，十四年三月庚午，十六年三月丙戌，并如之。
HCH_012_027_000256	十七年三月丁酉，日赤如赭。
HCH_012_027_000257	十八年四月壬寅，日赤无光。
HCH_012_027_000258	十二月癸酉，日赤如赭。
HCH_012_027_000259	二十年二月癸酉，如之。
HCH_012_027_000260	弘治元年十一月己卯，月生芒如齿，长三尺余，色苍白。
HCH_012_027_000261	十八年八月癸酉至九月甲午，日无光。
HCH_012_027_000262	嘉靖元年正月丁卯，日惨白，变青，无光。
HCH_012_027_000263	二十八年三月丙申至庚子，日色惨白。
HCH_012_027_000264	三十四年十二月庚申，晦，日忽暗，有青黑紫日影如盘数十相摩，久之千百，飞荡满天，向西北而散。
HCH_012_027_000265	万历二十五年三月癸丑，黑日二三十餘，回绕日旁，移时云隐不见。
HCH_012_027_000266	五月辛卯朔，日光转荡，旋为黑饼。
HCH_012_027_000267	三十年三月甲申，日光照地黄赤。
HCH_012_027_000268	三十五年十一月丙午，日赤无光，烛地如血。
HCH_012_027_000269	四十二年三月庚辰，日赤黄如赭如血者累日。
HCH_012_027_000270	四十四年八月戊辰，日中有黑光。
HCH_012_027_000271	四十六年闰六月丙戌至戊子，黑气出入日中摩荡。
HCH_012_027_000272	天启四年正月癸未，日赤无光，有黑子二三荡于旁，渐至百许，凡四日。
HCH_012_027_000273	二月壬子，日淡黄无光。
HCH_012_027_000274	癸丑，黑日摩荡日旁。
HCH_012_027_000275	四月癸酉，日中黑气摩荡。
