HCH_012_208_000000	張芹汪應軫蕭鳴鳳齊之鸞袁宗儒許相卿顧濟章僑余珊韋商臣黎貫彭汝實鄭自璧戚賢劉繪錢薇洪垣周思兼顏鯨張芹，字文林，峽江人。
HCH_012_208_000001	弘治十五年進士。
HCH_012_208_000002	授福州推官。
HCH_012_208_000003	正德中，召為南京御史。
HCH_012_208_000004	寧夏既平，大學士李東陽亦進官蔭子。
HCH_012_208_000005	芹抗疏曰：「東陽謹厚有餘，正直不足；儒雅足重，節義無聞。逆瑾亂政，東陽為顧命大臣，既不能遏之於始，及惡跡既彰，又不能力與之抗。脂韋順從，惟其指使。今叛賊底平，東陽何力？冒功受賞，何以服人心？乞立賜罷斥，奪其加恩，為大臣事君不忠者戒。」
HCH_012_208_000006	疏出，東陽涕泣不能辯。
HCH_012_208_000007	帝責芹沽名，令對狀。
HCH_012_208_000008	芹請罪，停俸三月。
HCH_012_208_000009	給事中竇明言事下獄，芹疏救之。
HCH_012_208_000010	帝嘗馳馬傷，編修王思切諫，坐遠戍。
HCH_012_208_000011	芹曰：「彼非諫官尚爾，吾儕可坐視乎！」
HCH_012_208_000012	遂上疏曰：「孟子言：「從獸無厭謂之荒』。老聃曰：「馳騁田獵，使人心發狂』。心狂誌荒，何事不忘？皆甚言無益有害也。今輕萬乘之尊，乘危冒險，萬一有不可諱，皇嗣未誕，如宗廟社稷何！」帝不省。尋出為徽州知府。寧王宸濠反，言者以芹家江西，慮賊劫其親屬，取道出徽。乃改知杭州。已，復還徽州。嘉靖初，遷浙江海道副使。歷右參政、右布政使。坐為海道時倭人爭貢誤傷居民，罷歸。芹事繼母孝，持身儉素，枲袍糲食終其身。汪應軫，字子宿，浙江山陰人。少有誌操。正德十二年成進士，選庶吉士。十四年，詔將南巡。應軫抗言：「自下詔以來，臣民旁皇，莫有固誌。臨清以南，率棄業罷市，逃竄山谷。茍不即收成命，恐變生不測。昔谷永諫漢成帝，謂：「陛下厭高美之尊號，好匹夫之卑字。數離深宮，挺身晨夜，與群小相逐。典門戶奉宿衛者，執幹戈而守空宮』。其言切中於今。夫谷永，諧諛之臣；成帝，庸暗之主。永言而成帝容之。豈以陛下聖明，不能俯納直諫哉？」疏入，留中。繼復偕修撰舒芬等連章以請。跪闕門，受杖幾斃。教習竣，擬授給事中。有旨補外，遂出為泗州知州。土瘠民惰，不知農桑。應軫勸之耕，買桑植之。募江南女工，教以蠶繅織作。由是民足衣食。帝方南征，中使驛騷道路。
HCH_012_208_000013	應軫率壯夫百餘人列水次，舟至，即挽之出境。
HCH_012_208_000014	車駕駐南京，命州進美婦善歌吹者數十人。
HCH_012_208_000015	應軫言：「州子女荒陋，無以應敕旨。臣向募有桑婦，請納之宮中，傳受蠶事。」
HCH_012_208_000016	事遂寢。
HCH_012_208_000017	世宗踐阼，召為戶科給事中。
HCH_012_208_000018	山東礦盜起，掠東昌、兗州，流入畿輔、河南境。
HCH_012_208_000019	應軫奏言：「弭盜與禦寇不同。禦寇之法，驅之境外而已。若弭盜而縱使出境，是嫁禍於鄰國也。凡一方有警，不行撲滅，致延蔓他境者，俱宜重論。」
HCH_012_208_000020	報可。
HCH_012_208_000021	在科歲餘，所上凡三十餘疏，鹹切時弊。
HCH_012_208_000022	以便養，乞改南，遂調南京戶科。
HCH_012_208_000023	張璁、桂萼在南京，方議追尊獻皇帝。
HCH_012_208_000024	雅知應軫名，欲倚以自助。
HCH_012_208_000025	應軫與議不合，即奏請遵禮經、崇正統，以安人心。
HCH_012_208_000026	不報。
HCH_012_208_000027	嘉靖三年春，出為江西僉事。
HCH_012_208_000028	居二年，具疏引疾，不俟命而歸，為巡按所劾。
HCH_012_208_000029	詔所司逮問。
HCH_012_208_000030	應軫自陳親老，鮮兄弟，乞休侍養。
HCH_012_208_000031	吏部為之請，乃免逮。
HCH_012_208_000032	久之，廷臣交薦，起故官，視江西學政。
HCH_012_208_000033	父艱歸，病卒。
HCH_012_208_000034	蕭鳴鳳，字子雝，浙江山陰人。
HCH_012_208_000035	少從王守仁遊，舉鄉試第一。
HCH_012_208_000036	正德九年成進士，授御史。
HCH_012_208_000037	副使胡世寧下獄，抗章救之。
HCH_012_208_000038	同官內江高公韶劾王瓊誤邊計，言：「松潘副將吳坤請增設總兵於成都，瓊即以坤任之。花當本我屬衛，日憑陵。由本兵非人，致小醜輕中國。」
HCH_012_208_000039	瓊怒，奏訐公韶。
HCH_012_208_000040	中旨責公韶陰結外蕃，交通間諜，令首實。
HCH_012_208_000041	鳴鳳上疏曰：「公韶劾瓊，所論者天下之事。瓊不當逞忿恣辯，以箝諫官口。」
HCH_012_208_000042	中旨責鳴鳳黨庇，而謫公韶富民典史。
HCH_012_208_000043	鳴鳳又劾江彬恃寵恣肆，蔓將難圖。
HCH_012_208_000044	士論壯之。
HCH_012_208_000045	尋巡視山海諸關。
HCH_012_208_000046	武宗將出塞捕虎，鳴鳳疏諫，因具陳官司掊克，軍民疾苦狀。
HCH_012_208_000047	不報。
HCH_012_208_000048	引疾歸。
HCH_012_208_000049	起督南畿學政。
HCH_012_208_000050	諸生以比前御史陳選，曰「陳，泰山；蕭，北斗」。
HCH_012_208_000051	嘉靖初，遷河南副使，仍督學政。
HCH_012_208_000052	考察拾遺被劾。
HCH_012_208_000053	吏部惜其學行，調為湖廣兵備副使。
HCH_012_208_000054	明年復改督廣東學政。
HCH_012_208_000055	鳴鳳三督學政，廉無私。
HCH_012_208_000056	然性剛狠，以憤撻肇慶知府鄭璋。
HCH_012_208_000057	璋慚恚，投劾去，由是物論大嘩。
HCH_012_208_000058	八年考察，兩京言官交章論，坐降調。
HCH_012_208_000059	已，與璋相詆訐。
HCH_012_208_000060	皆下巡按御史逮治。
HCH_012_208_000061	鳴鳳遂不出。
HCH_012_208_000062	公韶，正德中為御史，嘗劾總兵官郭勛罪。
HCH_012_208_000063	朵顏花當入寇，又劾總兵官遂安伯陳鏸、中官王欣、巡撫王倬，鏸坐解職。
HCH_012_208_000064	世宗立，起謫籍。
HCH_012_208_000065	歷右副都御史，巡撫江西。
HCH_012_208_000066	終戶部右侍郎。
HCH_012_208_000067	齊之鸞，字瑞卿，桐城人。
HCH_012_208_000068	正德六年進士。
HCH_012_208_000069	改庶吉士，授刑科給事中。
HCH_012_208_000070	十一年冬，帝將置肆於京城西偏。
HCH_012_208_000071	之鸞上言：「近聞有花酒鋪之設，或云車駕將臨幸，或云朝廷收其息。陛下貴為天子，富有四海，乃至競錐刀之利，如倡優館舍乎？」
HCH_012_208_000072	應州奏捷，帝降敕：「總督軍務威武大將軍總兵官朱壽剿寇有功，宜特加公爵」。
HCH_012_208_000073	制下，舉朝大駭。
HCH_012_208_000074	之鸞偕諸給事中上言：「自古天子亦有親臨戰陣勘定禍亂者，成功之後，不過南面受賀，勒之金石，播之歌頌已耳，未有加爵酬勞，如今日之顛倒者。不知陛下何所取義，為此不祥之舉，以駴天下耳目，貽百世之譏笑也。」
HCH_012_208_000075	未幾，請召還編修王思，給事中張原、陳鼎，御史周廣、高公韶、李熙、徐文華、李穩、施儒、劉寓生，僉事韓邦奇，評事羅僑，皆不聽。
HCH_012_208_000076	帝將巡邊，復自稱威武大將軍。
HCH_012_208_000077	御史袁宗儒疏諫，大學士楊廷和、蔣冕、毛紀以去就爭。
HCH_012_208_000078	之鸞偕同官言：「三臣居師保之重，身系安危，邇者先後稱疾。今六飛臨邊逾月矣，宗廟社稷百官萬姓寄空城中。人心危疑，幾務叢積，復杜門求決去。萬一事起倉卒，至於僨敗，三臣將何辭謝天下？乞陛下以社稷為重，亟返宸居，與大臣共圖治理。」
HCH_012_208_000079	已而御史李潤等復爭之，卒不省。
HCH_012_208_000080	之鸞再遷兵科左給事中。
HCH_012_208_000081	中官馬永成死，詔授其家九十餘人官。
HCH_012_208_000082	之鸞言：「永成貴顯，用事十有餘年，兄弟子侄皆高爵美官。而其儕復為陳乞，將及百人。永成何功，恩濫如此，恐天下聞而解體也。」
HCH_012_208_000083	帝將南巡，之鸞偕同官及御史楊秉中等交章力諫。
HCH_012_208_000084	章入二日，未報。
HCH_012_208_000085	之鸞等不知所出，伏闕俟命，自辰至申。
HCH_012_208_000086	帝令中官傳諭，乃退。
HCH_012_208_000087	明日托疾免朝，欲以為之鸞等罪。
HCH_012_208_000088	會諸曹郎黃鞏等聯章力諫，乃止不行。
HCH_012_208_000089	然鞏等下獄杖譴，之鸞輩亦不敢救也。
HCH_012_208_000090	宸濠反，張忠、許泰等南征，命之鸞偕左給事中祝續從軍紀功。
HCH_012_208_000091	未至，賊已滅。
HCH_012_208_000092	群小忌王守仁，譖毀百端，之鸞力白其誣。
HCH_012_208_000093	忠、泰廣搜逆黨，株引無辜，之鸞多所開釋。
HCH_012_208_000094	且請蠲田租、停力役、寬逋負，帝頗采納。
HCH_012_208_000095	初冒徐姓，至是始復焉。
HCH_012_208_000096	世宗踐阼，首上疏言：「祖宗法制，悉紛更於群小。補救之道，在先定聖誌，次廣言路。先朝元兇雖去，根據盤互，連蔓滋多，猶恐巧相營結，或邀定策之賞，或假迎扈之勞，以取憐固寵。天下事豈堪若輩更壞！言者久遏於權奸，欲吐忠鯁懣憤之氣，必有不顧忌諱，至於逆耳者，在嘉納而優容之。若稍或抑裁，則小人又乘之以讎忠直。言路一塞，不可復開，大為新政累矣。陛下誠舉邇年亂政，盡返其初，中興之烈可以立睹。」
HCH_012_208_000097	帝嘉納之。
HCH_012_208_000098	又劾許泰及兵部尚書王憲，二人竟獲譴。
HCH_012_208_000099	其秋大計京官，被中傷，謫崇德丞。
HCH_012_208_000100	屢遷寧夏僉事。
HCH_012_208_000101	饑民采蓬子為食，之鸞為取二封，一進於帝，一以貽閣臣。
HCH_012_208_000102	且言時事可憂者三，可惜者四，語極切。
HCH_012_208_000103	帝付之所司。
HCH_012_208_000104	時方大修邊墻，之鸞董役。
HCH_012_208_000105	巡撫胡東臯稱其能，舉以自代。
HCH_012_208_000106	歷河南、山東副使。
HCH_012_208_000107	召為順天府丞。
HCH_012_208_000108	未行，盜發，留鎮撫。
HCH_012_208_000109	尋擢河南按察使。
HCH_012_208_000110	卒官。
HCH_012_208_000111	袁宗儒，字醇夫，雄縣人。
HCH_012_208_000112	正德三年進士。
HCH_012_208_000113	授御史。
HCH_012_208_000114	十二年冬，帝在大同，以郊祀將回鑾，既而復止。
HCH_012_208_000115	宗儒率同官力諫。
HCH_012_208_000116	明年夏，孝貞純皇后將葬，帝還京。
HCH_012_208_000117	宗儒等復引災異，力請罷皇店，遣邊兵，既又諫帝巡邊。
HCH_012_208_000118	語極危切。
HCH_012_208_000119	皆不報。
HCH_012_208_000120	擢大理寺丞。
HCH_012_208_000121	嘉靖三年爭「大禮」，廷杖。
HCH_012_208_000122	歷官右僉都御史，巡撫貴州。
HCH_012_208_000123	吏部尚書桂萼議宗儒改調，遂解職歸。
HCH_012_208_000124	未幾，起鄖陽，改山東。
HCH_012_208_000125	坐屬吏振饑無術，不能覺察，罷免。
HCH_012_208_000126	以薦起左副都御史。
HCH_012_208_000127	扈蹕承天，還京卒。
HCH_012_208_000128	許相卿，字伯臺，海寧人。
HCH_012_208_000129	正德十二年進士。
HCH_012_208_000130	世宗立，授兵科給事中。
HCH_012_208_000131	宦官張銳、張忠有罪論死，帝復寬之。
HCH_012_208_000132	給事中顧濟疏爭，帝下所司議，卒欲寬其死。
HCH_012_208_000133	相卿言：「天下望陛下為孝皇，陛下奈何自處以正德？」
HCH_012_208_000134	帝議加興獻帝皇號，相卿復爭之。
HCH_012_208_000135	嘉靖二年詔蔭中官張欽義子李賢為錦衣世襲指揮。
HCH_012_208_000136	相卿言：「于謙子冕止錦衣千戶，王守仁子正憲止錦衣百戶。賢中官廝養，反過之。忠勛大臣裔曾不若近幸奴，殉國勤事之臣誰不解體？部臣彭澤、科臣許復禮、安磐相繼言之，悉拒不納。毋乃重內侍而輕士大夫哉！」
HCH_012_208_000137	尋復言：「天下政權出於一則治，二三則亂；公卿大夫參議則治，匪人僭幹則亂。陛下繼統之初，登用老成，嘉納忠讜，裁抑僥幸，竄殛憸邪，可謂明且剛矣。曾未再期，偏聽私昵，秕政亟行，明少蔽，剛少遜，操權未得其術，而陰伺旁竊者得居中制之。如崔文以左道罔上，師保臺諫言之而不聽。羅洪載守職逮系，廷臣疏七十上而不行。近又庇崔文奴奪法司之守，斥林俊以違旨，怒言官之奏擾。事涉中人，曲降溫旨，犯法不罪，請乞必從。此與正德朝何異哉！俊，國之望也，其去誌決矣。俊去，類俊者必不留。陛下將與二三近習私人共理天下乎？今日天下，與先朝異。武宗時，勢已阽危，然元氣猶壯，調劑適宜，可以立起。何也？承孝宗之澤也。今日病雖稍蘇，而元氣已竭，調劑無方，將至不起。何也？承武宗之亂也。伏願深察亂機，收還政柄，取文輩置之重典。然後務學親賢，去讒遠色，延訪忠言，深恤民隱。務使宮府一體，上下一心，而後天下可為也。」
HCH_012_208_000138	同官趙漢等亦皆以文為言，帝卒不聽。
HCH_012_208_000139	未幾，以給事中李學曾、章僑、主事林應驄皆言事奪俸，復上疏諫。
HCH_012_208_000140	指帝氣驕誌怠，甘蹈過愆。
HCH_012_208_000141	詞甚切。
HCH_012_208_000142	為給事三年，所言皆不聽，遂謝病歸。
HCH_012_208_000143	八年，詔養病三年以上不赴都者，悉落職閑住，相卿遂廢。
HCH_012_208_000144	夏言故與同僚相善，既秉政，招之，謝弗應。
HCH_012_208_000145	顧濟，字舟卿，昆山人。
HCH_012_208_000146	正德十二年進士。
HCH_012_208_000147	授行人，擢刑科給事中。
HCH_012_208_000148	武宗自南都還，臥病豹房，惟江彬等侍。
HCH_012_208_000149	濟言：「陛下孤寄於外，兩宮隔絕，骨肉日疏。所恃以為安者，果何人哉？漢高帝臥病數日，樊噲排闥，警以趙高之事。今群臣中豈無噲憂者！願陛下慎擇廷臣更番入直，起居動息鹹使與聞。一切淫巧戲劇，傷生敗德之事，悉行屏絕，則保養有道，聖躬自安。」
HCH_012_208_000150	不報。
HCH_012_208_000151	再逾月而帝崩。
HCH_012_208_000152	世宗即位之月，濟上疏曰：「陛下踐阼，除弊納諫，臣民踴躍，思見德化之成。然立法非難，守法為難；聽諫非難，樂諫為難。今新政所厘，多不便於奸豪權悻。臣恐盤據既深，玩縱未已，非依怙宮闈，必請托左右。持法不固，則此輩將叢聚而壞之。此守法之難也。唐太宗貞觀初，每導群臣使言。及至晚年，諫者乃多忤旨。陛下首辟言路，臣工靡不因事納忠。高遠者似涉於迂闊，切直者或過於犯顏。若怒其犯顏，其言必不入；視為迂闊，則計必不行。此樂諫之難也。」
HCH_012_208_000153	尋復言：「內臣張雄、張銳等，詿誤先帝，業已逮治，又獲寬假。願斷以大義。俾無所售奸。」
HCH_012_208_000154	帝頗嘉納。
HCH_012_208_000155	既又劾司禮蕭敬黨庇銳等，而三法司會訊依違，無大臣節。
HCH_012_208_000156	不聽。
HCH_012_208_000157	帝欲加興獻帝皇號，濟言不可。
HCH_012_208_000158	尋請侍養歸，越數年卒。
HCH_012_208_000159	子章誌，嘉靖三十二年進士。
HCH_012_208_000160	累官南京兵部侍郎。
HCH_012_208_000161	奏減進奉馬快船額，南都人祀之。
HCH_012_208_000162	章僑，字處仁，蘭溪人。
HCH_012_208_000163	正德十二年進士。
HCH_012_208_000164	授行人。
HCH_012_208_000165	嘉靖元年擢禮科給事中。
HCH_012_208_000166	疏劾中官蕭敬、芮景賢等。
HCH_012_208_000167	又言：「三代以下正學莫如朱熹。近有聰明才智，倡異學以號召，天下好高務名者靡然宗之。取陸九淵之簡便，詆朱熹為支離。乞行天下，痛為禁革。」
HCH_012_208_000168	御史梁世驃亦言之。
HCH_012_208_000169	帝為下詔申禁。
HCH_012_208_000170	尋又請依祖宗故事，早朝班退，許百官以次啟事。
HCH_012_208_000171	經筵日講，賜清問，密勿大臣勤召對。
HCH_012_208_000172	又簡儒臣十數人，更番直便殿，以備咨訪。
HCH_012_208_000173	上納其言，而不能用。
HCH_012_208_000174	奸人何淵請立世室於太廟東北，僑力言其不可。
HCH_012_208_000175	未幾，又言：「添設織造內臣，貪橫殊甚。行戶至廢產鬻子以償。惟急停革，與天下更始。」
HCH_012_208_000176	疏入，不省。
HCH_012_208_000177	又因條列營務，劾定國公徐光祚、陽武侯薛倫不職，倫遂解任。
HCH_012_208_000178	尋請斥張璁、霍韜等，不聽。
HCH_012_208_000179	孝陵司香谷大用乞還京治疾。
HCH_012_208_000180	僑言：「大用初連逆瑾，後引寧、彬，樹『八黨』之兇，釀十六年之禍，至先帝不得正其終。若不早遏絕，恐乘間伺隙，群兇競起，不至復亂天下不止。」
HCH_012_208_000181	章下所司。
HCH_012_208_000182	吳廷舉請召家居大臣議禮，僑劾其陰附邪說。
HCH_012_208_000183	孟秋時享太廟，帝遣京山侯崔元。
HCH_012_208_000184	僑言：「奉命臨時，倉皇就位，誠敬何存？」
HCH_012_208_000185	帝怒，奪其俸二月。
HCH_012_208_000186	歷禮科左給事中。
HCH_012_208_000187	出知衡州府，終福建布政使。
HCH_012_208_000188	余珊，字德輝，桐城人。
HCH_012_208_000189	正德三年進士。
HCH_012_208_000190	授行人，擢御史。
HCH_012_208_000191	庶吉士許成名等罷教習，留翰林者十七人。
HCH_012_208_000192	珊以為濫，疏論之。
HCH_012_208_000193	語侵內閣，不納。
HCH_012_208_000194	乾清宮災，疏陳弊政，極指義子、西僧之謬。
HCH_012_208_000195	巡鹽長蘆，發中官奸利事。
HCH_012_208_000196	為所誣，械系詔獄，謫安陸判官。
HCH_012_208_000197	移知澧州。
HCH_012_208_000198	世宗立，擢江西僉事，討平梅花峒賊。
HCH_012_208_000199	遷四川副使，備兵威、茂。
HCH_012_208_000200	嘉靖四年二月應詔陳十漸，其略曰：陛下有堯、舜、湯、武之資，而無稷、契、伊、周之佐，致時事漸不克終者有十。
HCH_012_208_000201	正德間，逆瑾專權，假子亂政，不知紀綱為何物，幸陛下起而振之。
HCH_012_208_000202	未幾而事樂因循，政多茍簡，名實乖謬，宮府異同，紛泄沓。
HCH_012_208_000203	以為在朝廷而不在朝廷，以為在宮省而不在宮省，遂至天子以其心為心，百官萬民亦各以其心為心。
HCH_012_208_000204	此紀綱之頹，其漸一也。
HCH_012_208_000205	正德間，士大夫寡廉鮮恥，趨附權門，幸陛下起而作之。
HCH_012_208_000206	乃今則前日之去者復來，來者不去。
HCH_012_208_000207	自夫浮沈一世之人擢掌銓衡，首取軟美脂韋。
HCH_012_208_000208	重富貴薄名檢者，列之有位，致諛佞成風，廉恥道薄。
HCH_012_208_000209	甚者侯伯專糾彈，罷吏議禮樂。
HCH_012_208_000210	市門復開，賈販仍舊。
HCH_012_208_000211	此風俗之壞，其漸二也。
HCH_012_208_000212	正德間，國柄下移，王靈不振，是以有安化、南昌之變，賴陛下起而整肅之。
HCH_012_208_000213	乃塞上戍卒近益驕恣。
HCH_012_208_000214	曩殺許巡撫而姑息，頃遂殺張巡撫而效尤。
HCH_012_208_000215	曩縛賈參將以立威，近又縛桂總兵而報怨。
HCH_012_208_000216	致榆關妖賊效之而戕主事，北邊庫吏仿之而賊縣官。
HCH_012_208_000217	陛下惑鄙儒姑息之談，牽俗吏權宜之計，遂使廟堂號令出於二三戍卒之口。
HCH_012_208_000218	此國勢之衰，其漸三也。
HCH_012_208_000219	自逆瑾以來，以苞苴易將帥，故邊防盡壞，賴陛下起而申嚴之。
HCH_012_208_000220	然積弊已久，未能驟復。
HCH_012_208_000221	今朵顏蹢躅於遼海，羌戎跳梁於西川，北狄蹂躪於沙漠。
HCH_012_208_000222	寇勢方張，而食肉之徒不能早見預料，亟求制馭之方，乃假鎮靜之虛名，掩無能之實跡。
HCH_012_208_000223	甚且詐飾捷功，濫邀賞賚，虛張勞伐，峻取官階，而塞上多事日甚。
HCH_012_208_000224	此外裔之強，其漸四也。
HCH_012_208_000225	自逆瑾以來，盡天下之脂膏，輸入權貴之室，是以有劉、趙、藍、鄢之亂，賴陛下起而保護之。
HCH_012_208_000226	乃近年以來，黃紙蠲放，白紙催征；額外之斂，下及雞豚；織造之需，自為商賈。
HCH_012_208_000227	江、淮母子相食，兗、豫盜賊橫行，川、陜、湖、貴疲於供餉。
HCH_012_208_000228	田野嗷嗷，無樂生之心。
HCH_012_208_000229	此邦本之搖，其漸五也。
HCH_012_208_000230	正德朝，衣冠蒙禍，家國幾空，幸陛下起而收錄之。
HCH_012_208_000231	乃未幾而狂瞽之言，一鳴輒斥。
HCH_012_208_000232	昔猶謫遷外任，今或編配遐荒。
HCH_012_208_000233	昔猶禁錮終身，今至箠死殿陛。
HCH_012_208_000234	蓋自呂柟、鄒守益等去而殿閣空，顧清、汪俊等去而部寺空，張原、胡瓊等死而言路空。
HCH_012_208_000235	間有一二忠直士，又為權奸排擠而違之，俾不通，致陛下耳囂目眩，忽不自知其在鮑魚之肆矣。
HCH_012_208_000236	此人才之雕，其漸六也。
HCH_012_208_000237	正德朝，奸邪叠進，忠諫不聞，幸陛下起而開通之。
HCH_012_208_000238	顧閱時未久，而此風復見。
HCH_012_208_000239	降心未懲其憤，逆耳或動諸顏。
HCH_012_208_000240	不剿說而折人以言，即臆度而虞人以詐。
HCH_012_208_000241	朝進一封，暮投千里。
HCH_012_208_000242	甚至三木囊頭，九泉含泣。
HCH_012_208_000243	此言路之塞，其漸七也。
HCH_012_208_000244	正德朝，忠賢排斥，天下幾危，賴陛下起而主持之。
HCH_012_208_000245	豈期一轉瞬間，憸邪投隙而起。
HCH_012_208_000246	飾六藝以文奸言，假《周官》而奪漢政。
HCH_012_208_000247	堅白異同，模棱兩可。
HCH_012_208_000248	是蓋大奸似忠，大詐似信。
HCH_012_208_000249	王莽匿情於下士之日，安石垢面於入相之初。
HCH_012_208_000250	雖有聖哲，誰其辨之？
HCH_012_208_000251	臣恐正不敵邪，群陰日盛。
HCH_012_208_000252	此邪正之淆，其漸八也。
HCH_012_208_000253	正德之世，大臣日疏，小人日親，致政事乖亂，賴陛下紹統，堂廉復親。
HCH_012_208_000254	乃自大禮議起，凡偶失聖意者，譴謫之，鞭笞之，流竄之，必一網盡焉而後已。
HCH_012_208_000255	由是小人窺伺，巧發奇中，以投主好，以弋功名。
HCH_012_208_000256	陛下既用先入為主，順之無不合，逆之無不怒。
HCH_012_208_000257	由是大臣顧望，小臣畏懼，上下乖戾，浸成睽孤，而泰交之風息矣。
HCH_012_208_000258	此君臣之睽，其漸九也。
HCH_012_208_000259	正德之世，天鳴地震，物怪人妖，曾無虛歲，賴陛下紹統，災異始除。
HCH_012_208_000260	乃頃歲以來，雨雹殺禽獸，雷風拔樹屋，婦人產子兩頭，無極晝晦如夜，四方早潦，奏報不絕，曾何異正德之季乎？
HCH_012_208_000261	且京師陰霾之氣，上薄太陽，白晝冥冥，罕有暉采，尤為可畏。
HCH_012_208_000262	此災異之臻，其漸十也。
HCH_012_208_000263	此十者，天子有一，無以保四海。
HCH_012_208_000264	陛下聖明，何以致此？
HCH_012_208_000265	無乃輔弼召之歟？
HCH_012_208_000266	竊見今日之為輔弼第一人者，徒以奸佞，伴食怙恩。
HCH_012_208_000267	致上激天變，下召民災，中失物望。
HCH_012_208_000268	臣逆知其非天下之第一流，而陛下乃任信之，不至於魚爛不已。
HCH_012_208_000269	願亟去其人，更求才兼文武如前大學士楊一清，老成厚重如今大學士石缶者，並置左右，庶弊政可除，天下可治。
HCH_012_208_000270	臣又聞獻皇帝好賢下士，容物恕人，天下所共知也。
HCH_012_208_000271	今議禮諸臣，一言未合，輒以悖逆加之。
HCH_012_208_000272	謫配死徙，朝寧為空。
HCH_012_208_000273	此豈獻皇帝意？
HCH_012_208_000274	茍非其意，雖尊以天下，無當也。
HCH_012_208_000275	陛下何不起而用之，使駿奔清廟，以慰獻皇帝在天之靈哉！
HCH_012_208_000276	疏反覆萬四千言，最為剴切，帝付之所司。
HCH_012_208_000277	其所斥輔弼第一人，謂費宏也。
HCH_012_208_000278	珊律己清嚴，居官有威惠。
HCH_012_208_000279	外艱歸，士民祠之名宦。
HCH_012_208_000280	後副使胡東臯謁祠，獨顧珊嘆曰：「此吾師也。」
HCH_012_208_000281	服闋，以故官蒞廣東。
HCH_012_208_000282	終四川按察使。
HCH_012_208_000283	先是，有御史汪珊者，於嘉靖元年七月疏陳十漸。
