HCH_013_052_000249	諸臣言之，陛下行之，在一節省間耳。
HCH_013_052_000250	官之侵漁，將之怯懦，吏之為奸，諸臣必有為陛下言者矣。
HCH_013_052_000251	諸臣言之，陛下行之，在一振作間耳。
HCH_013_052_000252	陛下為此，非勞也。
HCH_013_052_000253	民熙物洽，薰為泰和，陛下性中真藥也。
HCH_013_052_000254	道與天通，命由我立，陛下性中真壽也。
HCH_013_052_000255	此理之所有，可旋至立效。
HCH_013_052_000256	乃縣思服食不終之餌，鑿想遙興輕舉之方，切切然散爵祿、竦精神，求之終身而不得。
HCH_013_052_000257	大臣持祿外為諛，小臣畏罪面為順。
HCH_013_052_000258	君道不正，臣職不明，此天下第一事也。
HCH_013_052_000259	疏上，帝大怒，命逮繫瑞下鎮撫。
HCH_013_052_000260	交城王表𣐬得白兔於藐姑射山，撰頌以獻，賜金袞。
HCH_013_052_000261	四十五年春正月，上久病不痊，諭大學士徐階，欲幸承天，拜顯陵，取藥服氣。
HCH_013_052_000262	階奏止之。
HCH_013_052_000263	是年冬，帝崩於乾清宮，詔曰：「朕奉宗廟四十五年，享國長久，累朝未有。一念惓惓，惟敬天勤民是務。祗緣多病，過求長生，遂至奸人誑惑。自今建言得罪諸臣，存者召用，沒者卹錄，見監者即釋復職。」
HCH_013_052_000264	穆宗踐阼，釋戶部主事海瑞於獄中，逮方士王金、陶倣、申世恩、劉文彬、高守中、陶世恩下詔獄，論死。
