HCH_009_065_000288	上複賞璋及將士如諸軍，以璋為西北路招討使。
HCH_009_065_000289	召為元帥左都監，兼安化軍節度使，賜以弓矢衣帶佩刀。
HCH_009_065_000290	改益都尹，左都監如故。
HCH_009_065_000291	宋人棄海州遁去，焚官民廬舍且盡。
HCH_009_065_000292	璋至海州，得所棄糧三萬六千余石，安集其人，複其屯戍。
HCH_009_065_000293	五年，宋人約和，罷三路都統，複置陝西路統軍司，璋為統軍使。
HCH_009_065_000294	上曰：「監軍合喜年老，故授卿此職。邊境無事，且召卿矣。」
HCH_009_065_000295	以本官兼京兆尹。
HCH_009_065_000296	召為御史大夫。
HCH_009_065_000297	璋奏：「竊觀文武百官有相為朋黨者，今在台自臣外無女直人，乞不限資考，量材奏擬。」
HCH_009_065_000298	上曰：「朋黨為誰，即糾治之。朕選女直人，未得其人，豈以資考為限，論其人材而已。」
HCH_009_065_000299	頃之，璋奏曰：「太祖武元皇帝受天明命，太宗皇帝奄定宋土，自古帝王之興，必稱受命，當制'大金受命之寶'，以明示萬世。」
HCH_009_065_000300	上曰：「卿言正合朕意。」
HCH_009_065_000301	乃遣使夏國市玉，十八年，受命寶成，奏告天地宗廟社稷，上禦正殿。
HCH_009_065_000302	十三年，改大興尹，為賀宋正旦使。
HCH_009_065_000303	璋受命使宋，即行，上遣人馳諭璋曰：「宋人若不遵舊禮，慎勿付書。如不令卿等入見，即持書歸。若迫而取之，亦勿赴宴，其回書及禮物一切勿受。」
HCH_009_065_000304	璋至臨安，宋人請以太子接書，不從。
HCH_009_065_000305	宋人就館迫取書，璋與之，且赴宴，多受禮物。
HCH_009_065_000306	有司以聞，上怒，欲置之極刑。
HCH_009_065_000307	左丞相良弼奏曰：「璋為將，大破宋軍，宋人仇之久矣。將因此陷之死地，未可知也。今若殺璋，或者墮其計中耳。」
HCH_009_065_000308	上以為然，乃杖璋百五十，除名，副使客省使高翊杖百，沒入其所受禮物。
HCH_009_065_000309	後歲餘，上念璋有征伐功，起為景州刺史，遷武定軍節度使，授山東西路蒲底山拏兀魯河謀克，改臨洮尹。
HCH_009_065_000310	十九年，卒。
HCH_009_065_000311	鄆王昂，本名吾都補，世祖最幼子也。
HCH_009_065_000312	常從太祖征伐。
HCH_009_065_000313	天輔六年，昂與稍喝以兵四千監護諸部降人，處之嶺東，就以兵守臨潢府。
HCH_009_065_000314	昂不能撫禦，降人苦之，多叛亡者。
HCH_009_065_000315	上聞之，使出里底戒諭昂。
HCH_009_065_000316	已過上京，諸部皆叛去，惟章湣宮、小室韋二部達內地。
HCH_009_065_000317	詔諳版勃極烈吳乞買曰：「比遣昂徙諸部，多致怨叛，稍喝駐兵不與討襲，致使降人複歸遼主，違命失眾，當置重法。若有所疑，則禁錮之，俟師還定議。」
HCH_009_065_000318	是時，太宗居守，辭不失副之，辭不失勸太宗因國慶可薄其罰，於是杖昂七十，拘之泰州，而殺稍喝。
HCH_009_065_000319	天會六年，權元帥左都監。
HCH_009_065_000320	十五年，為西京留守。
HCH_009_065_000321	天眷三年，為平章政事。
HCH_009_065_000322	皇統元年，封漆水郡王。
HCH_009_065_000323	二年，制詔昂暑銜帶「皇叔祖」字，封鄆王。
HCH_009_065_000324	是歲，薨。
HCH_009_065_000325	子鄭家、鶴壽。
HCH_009_065_000326	鶴壽累官耶魯瓦群牧使，死於契丹撒八之難，語在《忠義傳》。
HCH_009_065_000327	鄭家，皇統初，以宗室子授定遠大將軍，除磁州刺史。
HCH_009_065_000328	天德間，為右諫議大夫，累遷會甯尹、安化軍節度使，改益都尹。
HCH_009_065_000329	海陵伐宋，為浙東道副統制，與工部尚書蘇保衡以舟師自海道趨臨安，至松林島阻風，泊島間。
HCH_009_065_000330	詰旦，舟人望見敵舟，請為備。
HCH_009_065_000331	鄭家問：「去此幾何？」
HCH_009_065_000332	舟人曰：「以水路測之，且三百里。風迅，行即至矣。」
HCH_009_065_000333	鄭家不曉海路舟楫，不之信。
HCH_009_065_000334	有頃，敵果至，見我軍無備，即以火砲擲之。
HCH_009_065_000335	鄭家顧見左右舟中皆火發，度不得脫，赴水死，時年四十一。
