HCH_009_086_000295	祖不剌速，國初授世襲曷懶兀主猛安、曷懶路總管。
HCH_009_086_000296	父謝奴，官至工部尚書。
HCH_009_086_000297	查剌狀貌魁偉，善女直、契丹書。
HCH_009_086_000298	天德初，以功臣子充護衛。
HCH_009_086_000299	二年，授武義將軍。
HCH_009_086_000300	未幾，擢符寶郎，凡再考，出為濼州刺史，改知平定軍事。
HCH_009_086_000301	海陵南征，為武威軍副都總管。
HCH_009_086_000302	軍還，大定二年，授景州刺史，遷同知京兆尹。
HCH_009_086_000303	時彰化軍節度使宗室璋等與宋將吳璘相拒於德順州，元帥左都監徒單合喜遣查剌與諸將議破敵策。
HCH_009_086_000304	璋等議曰：「我兵雖屢勝，而敵兵不退者，知我軍少故也。須都監親至，方可破敵。」
HCH_009_086_000305	於是合喜領兵四萬至，遂下德順州。
HCH_009_086_000306	入為殿前右衛將軍，襲父猛安，改左衛將軍，遷右副點檢。
HCH_009_086_000307	有疾，丞相良弼視之，謂所親曰：「此人國器也。他人有疾，吾未嘗往焉。」
HCH_009_086_000308	九年，出為東北路招討使兼德昌軍節度使，乃賜金帶。
HCH_009_086_000309	到官，治有勤績，邊境以安。
HCH_009_086_000310	其斷獄公平，道不拾遺。
HCH_009_086_000311	遷臨潢尹兼本路兵馬都總管，蕃部畏服。
HCH_009_086_000312	改西北路招討使。
HCH_009_086_000313	上遣使宣諭曰：「今諸部初附，命汝撫綏，當使治聲達於朕聽。」
HCH_009_086_000314	大定十二年卒。
HCH_009_086_000315	查剌性忠實，內明敏，每論大事，超越倫輩。
HCH_009_086_000316	太師勖嘗曰：「查剌不學而知，方之古人，如此者鮮矣。」
HCH_009_086_000317	贊曰：陷泉之捷，震電燁燁。
HCH_009_086_000318	符離之克，我勢攸赫。
HCH_009_086_000319	隴、坻𢶉㩧，淮、濄鉤鈲，成矣。
HCH_009_086_000320	故列敘諸將之功焉。
