HCH_012_158_000001	黃宗載顧佐段民章敞吳訥魏驥魯穆耿九疇軒輗黃孔昭黃宗載，一名垕，字厚夫，豐城人。
HCH_012_158_000002	洪武三十年進士。
HCH_012_158_000003	授行人。
HCH_012_158_000004	奉使四方，未嘗受饋遺，累遷司正。
HCH_012_158_000005	永樂初，以薦為湖廣按察司僉事。
HCH_012_158_000006	巨奸宿猾多謫戍銅鼓、五開間，陰持官吏短長。
HCH_012_158_000007	宗載榜數其罪，曰：「不改，必置之法。」
HCH_012_158_000008	眾莫敢犯。
HCH_012_158_000009	武陵多戎籍，民家慮與為婚姻徭賦將累己。
HCH_012_158_000010	男女至年四十尚不婚。
HCH_012_158_000011	宗載以理諭之，皆解悟，一時婚者三百餘家。
HCH_012_158_000012	鄰邑效之，其俗遂變。
HCH_012_158_000013	征詣文淵閣修《永樂大典》。
HCH_012_158_000014	書成，受賜還任。
HCH_012_158_000015	董造海運巨艦數十艘，事辦而民不擾。
HCH_012_158_000016	車駕北征，征兵湖廣，使者貪暴失期。
HCH_012_158_000017	宗載坐不舉劾，謫楊青驛驛夫。
HCH_012_158_000018	尋起御史，出按交阯。
HCH_012_158_000019	時交阯新定，州縣官多用兩廣、雲南舉人及歲貢生員之願仕遠方者，皆不善撫字。
HCH_012_158_000020	宗載因言：「有司率不稱職。若俟九年黜陟，恐益廢弛。請任二年以上者，巡按御史及兩司核實舉按以聞。」
HCH_012_158_000021	帝是之。
HCH_012_158_000022	及歸，行李蕭然，不攜交阯一物。
HCH_012_158_000023	尚書黃福語人曰：「吾居此久，所接御史多矣，惟宗載知大體。」
HCH_012_158_000024	丁祖母憂，起復，改詹事府丞。
HCH_012_158_000025	洪熙元年擢行在吏部侍郎。
HCH_012_158_000026	少師蹇義領部事，宗載一輔以正。
HCH_012_158_000027	宣德元年奉命清軍浙江。
HCH_012_158_000028	三年督采木湖湘。
HCH_012_158_000029	英宗初，以侍郎羅汝敬巡撫陜西，坐事戴罪辦事。
HCH_012_158_000030	汝敬妄引詔書復職，而吏部不言，為御史所劾，宗載及尚書郭琎俱下獄。
HCH_012_158_000031	未幾，得釋，遷南京吏部尚書。
HCH_012_158_000032	居九年，乞休，章四上，乃許。
HCH_012_158_000033	九年七月卒於家，年七十九。
HCH_012_158_000034	宗載持廉守正，不矯不隨，學問文章俱負時望。
HCH_012_158_000035	公卿大夫齒德之盛，推宗載雲。
HCH_012_158_000036	顧佐，字禮卿，太康人。
HCH_012_158_000037	建文二年進士。
HCH_012_158_000038	除莊浪知縣。
HCH_012_158_000039	端陽日，守將集官僚校射。
HCH_012_158_000040	以佐文士，難之。
HCH_012_158_000041	持弓矢一發而中，守將大服。
HCH_012_158_000042	永樂初，入為御史。
HCH_012_158_000043	七年，成祖在北京，命吏部選御史之才者赴行在，佐預焉。
HCH_012_158_000044	奉命招慶遠蠻。
HCH_012_158_000045	督采木四川。
HCH_012_158_000046	從北征，巡視關隘。
HCH_012_158_000047	遷江西按察副使，召為應天尹。
HCH_012_158_000048	剛直不撓，吏民畏服，人比之包孝肅。
HCH_012_158_000049	北京建，改尹順天。
HCH_012_158_000050	權貴人多不便之，出為貴州按察使。
HCH_012_158_000051	洪熙元年召為通政使。
HCH_012_158_000052	宣德三年，都御史劉觀以貪被黜，大學士楊士奇、楊榮薦佐公廉有威，歷官並著風采，為京尹，政清弊革。
HCH_012_158_000053	帝喜，立擢右都御史，賜敕獎勉。
HCH_012_158_000054	命察諸御史不稱者黜之，御史有缺，舉送吏部補選。
HCH_012_158_000055	佐視事，即奏黜嚴豈、楊居正等二十人，謫遼東各衛為吏，降八人，罷三人；而舉進士鄧棨、國子生程富、謁選知縣孔文英、教官方瑞等四十餘人堪任御史。
HCH_012_158_000056	帝使歷政三月而後任之。
HCH_012_158_000057	居正等六人辨訴。
HCH_012_158_000058	帝怒，並諸為吏者悉戍之。
HCH_012_158_000059	既而豈自戍所潛還京，脅他賄，為佐所奏，且言豈謀害己。
HCH_012_158_000060	詔戮豈於市。
HCH_012_158_000061	帝北巡，命偕尚書張本等居守。
HCH_012_158_000062	還復賜敕。
HCH_012_158_000063	令約束諸御史。
HCH_012_158_000064	於是糾黜貪縱，朝綱肅然。
HCH_012_158_000065	居歲餘，奸吏奏佐受隸金，私遣歸。
HCH_012_158_000066	帝密示士奇曰：「爾不嘗舉佐廉乎？」
HCH_012_158_000067	對曰：「中朝官俸薄，仆馬薪芻資之隸，遣隸半使出資免役。隸得歸耕，官得資費，中朝官皆然，臣亦然。先帝知之，故增中朝官俸。」
HCH_012_158_000068	帝嘆曰：「朝臣貧如此。」
HCH_012_158_000069	因怒訴者曰：「朕方用佐，小人敢誣之，必下法司治！」
HCH_012_158_000070	士奇對曰：「細事不足幹上怒。」
HCH_012_158_000071	帝乃以吏狀付佐曰：「汝自治之。」
HCH_012_158_000072	佐頓首謝，召吏言：「上命我治汝，汝改行，吾當貸汝。」
HCH_012_158_000073	帝聞之益喜，謂佐得大體。
HCH_012_158_000074	或告佐不理冤訴。
HCH_012_158_000075	帝曰：「此必重囚教之。」
HCH_012_158_000076	命法司會鞫，果千戶臧清殺無罪三人當死，使人誣佐。
HCH_012_158_000077	帝曰：「不誅清，則佐法不行。」
HCH_012_158_000078	磔清於市。
HCH_012_158_000079	八年秋，佐有疾，乞歸。
HCH_012_158_000080	不許。
HCH_012_158_000081	以南京右都御史熊概代理其事。
HCH_012_158_000082	逾年而概卒。
HCH_012_158_000083	佐疾良已，入見。
HCH_012_158_000084	帝慰勞之，令免朝賀，視事如故。
HCH_012_158_000085	正統初考察御史不稱者十五人，降黜之。
HCH_012_158_000086	邵宗九載滿，吏部已考稱，亦與焉。
HCH_012_158_000087	宗奏辨，尚書郭琎亦言宗不應與在任者同考。
HCH_012_158_000088	帝遂責佐。
HCH_012_158_000089	而御史張鵬等復劾宗微過。
HCH_012_158_000090	帝以鵬朋欺，並切責佐。
HCH_012_158_000091	佐上章致仕去。
HCH_012_158_000092	賜敕獎慰，賚鈔五十貫，命戶部復其家。
HCH_012_158_000093	十一年九月卒。
HCH_012_158_000094	佐孝友，操履清白，性嚴毅。
HCH_012_158_000095	每旦趨朝，小外廬，立雙藤戶外。
HCH_012_158_000096	百僚過者，皆折旋避之。
HCH_012_158_000097	入內直廬，獨處小夾室，非議政不與諸司群坐。
HCH_012_158_000098	人稱為「顧獨坐」雲。
HCH_012_158_000099	然持法深，論者以為病。
HCH_012_158_000100	時雩都陳勉、嶧縣賈諒先後為副都御史，與佐同舉臺職，而蘭溪邵玘官南京，與佐齊名，繁昌嚴升名亦亞於玘。
HCH_012_158_000101	玘，字以先，永樂中進士。
HCH_012_158_000102	授御史。
HCH_012_158_000103	仁宗監國，知其廉直。
HCH_012_158_000104	每法司缺官，即命玘署，有重獄輒付之。
HCH_012_158_000105	歷仕中外，所過人不敢犯。
HCH_012_158_000106	宣德三年由福建按察使入為南京左副都御史。
HCH_012_158_000107	奏黜御史不職者十三人，簡黜諸司庸懦不肖者八十餘人，風紀大振。
HCH_012_158_000108	居二年，以疾卒官。
HCH_012_158_000109	玘負氣，好侮同列，治獄頗刻深。
HCH_012_158_000110	然持身廉潔，內行修，事母以孝聞。
HCH_012_158_000111	陳勉，與玘同年進士。
HCH_012_158_000112	仁宗初，以楊士奇薦，由廣東副使擢左副都御史。
HCH_012_158_000113	信、豐諸縣盜起，命勉撫之。
HCH_012_158_000114	招徠三千六百餘人，亂遂定。
HCH_012_158_000115	景泰初，仕至南京右都御史，掌院事。
HCH_012_158_000116	致仕，卒。
HCH_012_158_000117	勉外和內剛，精通法律，吏不敢欺。
HCH_012_158_000118	賈諒，字子信。
HCH_012_158_000119	永樂中由鄉舉入太學，選侍皇太孫說書，擢刑科給事中。
HCH_012_158_000120	宣德四年劾清軍侍郎金庠受賄，罷之。
HCH_012_158_000121	郎中胡玨、蕭翔等十一人，御史方鼎三人，以不職被劾。
HCH_012_158_000122	帝未信，命諒及張居傑密察之。
HCH_012_158_000123	得實，悉貶官。
HCH_012_158_000124	明年又劾陽武侯薛祿朋比不敬。
HCH_012_158_000125	廷中肅然。
HCH_012_158_000126	尋拜右副都御史。
HCH_012_158_000127	偕錦衣指揮王裕、參議黃翰、中官張義等巡視四川、江西、湖廣，按治豪強不少假。
HCH_012_158_000128	正統二年，江北、河南大水，命諒及工部侍郎鄭辰往振。
HCH_012_158_000129	芒、碭山盜為患，諒捕獲甚眾。
HCH_012_158_000130	四年還至德州，卒。
HCH_012_158_000131	諒內行修，當官有風采。
HCH_012_158_000132	嚴升，建文時進士。
HCH_012_158_000133	歷官大理寺右少卿。
HCH_012_158_000134	清軍蘇、松，執法不撓。
HCH_012_158_000135	調南京僉都御史，與玘同心治事。
HCH_012_158_000136	剛果自信，嘗著《神羊賦》以見誌焉。
HCH_012_158_000137	段民，字時舉，武進人。
HCH_012_158_000138	永樂二年進士。
HCH_012_158_000139	選庶吉士。
HCH_012_158_000140	與章敞、吾紳輩俱讀書文淵閣，又俱授刑部主事。
HCH_012_158_000141	民旋進郎中。
HCH_012_158_000142	山東妖婦唐賽兒作亂，三司官坐縱寇誅，擢民左參政。
HCH_012_158_000143	當是時索賽兒急，盡逮山東、北京尼及天下出家婦女，先後幾萬人。
HCH_012_158_000144	民力為矜宥，人情始安。
HCH_012_158_000145	車駕北征，餉舟由濟寧達潞河，陸挽出居庸至塞外。
HCH_012_158_000146	民深計曲算，下不擾而事集。
HCH_012_158_000147	既還，敕與巡按御史考所過府縣吏廉墨以聞。
HCH_012_158_000148	宣德三年召入京，命署南京戶部右侍郎，逾年實授。
HCH_012_158_000149	又明年改刑部。
HCH_012_158_000150	初，二部皆以不治聞。
HCH_012_158_000151	民至，紀綱修舉，宿弊以革。
HCH_012_158_000152	上元人有為侄毆者，憤甚，詣通政司告。
HCH_012_158_000153	時方令納米贖罪，而越訴禁甚嚴，犯者戍遼東。
HCH_012_158_000154	民上言：「依定例，卑幼之罪得贖，而尊長反遠竄，揆於理有未安，請更擬。」
HCH_012_158_000155	帝是之。
HCH_012_158_000156	帝以民廉介端謹，特賜敕，令考察南京百官。
HCH_012_158_000157	八年，詔書罪囚自十惡外並減一等。
HCH_012_158_000158	有重囚三十餘人，例不得赦，民亦減其罪。
HCH_012_158_000159	後有旨報決，乃復追還，而逃已數人。
HCH_012_158_000160	民自陳狀，給事中年富等劾民。
HCH_012_158_000161	帝知民賢，不問。
HCH_012_158_000162	九年二月卒於官，年五十九。
HCH_012_158_000163	貧不能殮，都御史吳訥裞以衣衾。
HCH_012_158_000164	帝聞，命有司營葬。
HCH_012_158_000165	成化間，葉盛請褒恤不果。
HCH_012_158_000166	其後百有餘年，始追謚襄介。
HCH_012_158_000167	吾紳，字叔縉，衢州人。
HCH_012_158_000168	官刑部主事，治獄有聲。
HCH_012_158_000169	歷郎中，拜禮部侍郎。
HCH_012_158_000170	成祖謂呂震曰：「紳出自翰林，可佐卿典禮矣。」
HCH_012_158_000171	既而為震所擠，出為廣東參政。
HCH_012_158_000172	尋召為南京刑部侍郎，奉敕考察兩廣、福建方面官。
HCH_012_158_000173	有故人官參政，素貪黷，權要多為之地。
HCH_012_158_000174	紳至，竟黜之，時稱其公。
HCH_012_158_000175	復改禮部。
HCH_012_158_000176	正統六年卒於官。
HCH_012_158_000177	紳清強有執，淡於榮利。
HCH_012_158_000178	初拜侍郎，賀者畢集。
HCH_012_158_000179	而一室蕭然，了無供具，眾笑而起。
HCH_012_158_000180	章敞，字尚文，會稽人。
HCH_012_158_000181	由庶吉士授刑部主事。
HCH_012_158_000182	山西盜發，捕逮數百人。
HCH_012_158_000183	敞察其冤，留詞色異者一人，余悉遣出。
HCH_012_158_000184	明日訊之，留者盜，余非也。
HCH_012_158_000185	遷郎中，改吏部。
HCH_012_158_000186	宣德六年擢禮部侍郎。
HCH_012_158_000187	偕徐琦使安南，命黎利權國事。
HCH_012_158_000188	利遣人白相見禮，敞曰：「汝敬使者，所以尊朝廷，奚白為？」
HCH_012_158_000189	利聽命，趨拜下坐。
HCH_012_158_000190	啖以聲色，不為動。
HCH_012_158_000191	還致厚贐，不受，利以付貢使。
HCH_012_158_000192	及關，悉閱貢物，封其贐，付關吏。
HCH_012_158_000193	利死，子麟嗣，敞復奉詔往，卻贐如初。
HCH_012_158_000194	正統初，纂洪武以來條格，使諸司參酌，吏無能為奸。
HCH_012_158_000195	尚書胡濙寬大，敞佐以嚴肅。
HCH_012_158_000196	二年十二月卒。
HCH_012_158_000197	子瑾亦累官至禮部侍郎。
HCH_012_158_000198	徐琦，字良玉。
HCH_012_158_000199	先世錢塘人，其祖謫戍寧夏，遂家焉。
HCH_012_158_000200	幼力學，通經史。
HCH_012_158_000201	永樂十三年舉進士，授行人。
HCH_012_158_000202	歷兵部員外郎。
HCH_012_158_000203	明敏有斷，居官務持大體。
HCH_012_158_000204	宣德六年擢右通政。
HCH_012_158_000205	副敞使安南，亦不受饋。
HCH_012_158_000206	還拜南京兵部右侍郎。
HCH_012_158_000207	八年，帝以安南貢賦不如額，南征士卒未盡返，命琦復往。
HCH_012_158_000208	時黎利已死，其子麟疑未決。
HCH_012_158_000209	琦曉以禍福，麟懼，鑄代身金人，貢方物以謝。
HCH_012_158_000210	帝悅，命落琦戍籍，宴賚甚厚。
HCH_012_158_000211	正統初，與工部侍郎鄭辰考察南畿有司，黜不法者三十人。
HCH_012_158_000212	時災異屢見，琦陳弭災十事。
HCH_012_158_000213	悉嘉納。
HCH_012_158_000214	五年命參贊南京機務。
HCH_012_158_000215	十四年進尚書，參贊如故。
HCH_012_158_000216	有言往年分調南京軍，家屬悉宜北徙，朝議欲行之。
HCH_012_158_000217	琦奏：「安土重遷，人之情也。今驟徙數萬眾，人心一搖，事或叵測。」
HCH_012_158_000218	事得寢。
HCH_012_158_000219	軍衛無學校，琦請天下衛所視府州縣例皆立學。
HCH_012_158_000220	從之。
HCH_012_158_000221	景泰元年，靖遠伯王驥贊機務，琦專理部事。
HCH_012_158_000222	驥解任，琦仍參贊。
HCH_012_158_000223	四年三月卒，年六十八。
HCH_012_158_000224	謚貞襄。
HCH_012_158_000225	敞、琦皆以使安南不辱命著稱。
HCH_012_158_000226	安南多寶貨，後使者率從水道挾估客往以為利，交人頗輕之。
HCH_012_158_000227	弘治時，侍講劉戩往頒詔，由南寧乘傳抵其國，交人大驚。
HCH_012_158_000228	戩依舊制，受陪臣拜謁，不交一語，越宿即行，饋遺一無所受。
HCH_012_158_000229	使人要於途，固致之，卒麾去，與敞、琦皆為交人所重。
HCH_012_158_000230	戩，字景元，安福人。
HCH_012_158_000231	吳訥，字敏德，常熟人。
HCH_012_158_000232	父遵，任沅陵簿，坐事系京師。
HCH_012_158_000233	訥上書乞身代。
HCH_012_158_000234	事未白而父歿，訥感奮力學。
HCH_012_158_000235	永樂中，以醫薦至京。
HCH_012_158_000236	仁宗監國，聞其名，命教功臣子弟。
HCH_012_158_000237	成祖召對稱旨，俾日侍禁廷，備顧問。
HCH_012_158_000238	洪熙元年，侍講學士沈度薦訥經明行修，授監察御史。
HCH_012_158_000239	敬慎廉直，不務矯飾。
HCH_012_158_000240	宣德初，出按浙江，以振風紀植綱常為務。
HCH_012_158_000241	時軍犯逃者，往往令家人妄訴，逮系至千人。
HCH_012_158_000242	訥請嚴禁，即冤不得越告。
HCH_012_158_000243	從之。
HCH_012_158_000244	繼按貴州，恩威並行，蠻人畏服。
HCH_012_158_000245	將代還，部民詣闕乞留。
HCH_012_158_000246	不許。
HCH_012_158_000247	五年七月，進南京右僉都御史，尋進左副都御史。
HCH_012_158_000248	正統初，光祿丞董正等盜官物，訥發之，謫戍四十四人。
HCH_012_158_000249	右通政李畛者，奉使蘇、松，行事多不謹。
HCH_012_158_000250	訥微誡之，畛不悅，誣訥稽延詔書等事。
HCH_012_158_000251	訥疏辯。
HCH_012_158_000252	互為臺省所劾，俱逮下獄，既而釋之。
HCH_012_158_000253	英宗初禦經筵，錄所輯《小學集解》上之。
HCH_012_158_000254	四年三月，以老致仕，以朱與言代。
HCH_012_158_000255	訥博覽，議論有根柢。
HCH_012_158_000256	於性理之奧，多有發明，所著書皆可垂於後。
HCH_012_158_000257	歸家，布衣蔬食，環堵蕭然。
HCH_012_158_000258	周忱撫江南，欲新其居，不可。
HCH_012_158_000259	家居十六年而卒，年八十六。
HCH_012_158_000260	謚文恪，鄉人祀之言偃祠。
HCH_012_158_000261	朱與言，字一鶚，萬安人。
HCH_012_158_000262	永樂九年進士，授湖廣按察僉事。
HCH_012_158_000263	宣德中遷四川副使。
HCH_012_158_000264	合州盜起，督吏目熊鼎斬六十餘人，賊勢遂衰。
HCH_012_158_000265	事聞，擢鼎合州同知。
HCH_012_158_000266	雅州妖人為亂，與言執送京師，境內以寧。
HCH_012_158_000267	正統元年召為南京右副都御史，入代訥領院事。
HCH_012_158_000268	年老致仕，卒。
HCH_012_158_000269	與言剛方廉慎，為政務大體。
HCH_012_158_000270	數建白，多切時弊。
HCH_012_158_000271	家居門庭清肅，鄉人有不善，惟恐與言知之。
HCH_012_158_000272	魏驥，字仲房，蕭山人。
HCH_012_158_000273	永樂中，以進士副榜授松江訓導。
HCH_012_158_000274	常夜分攜茗粥勞諸生。
HCH_012_158_000275	諸生感奮，多成就者。
HCH_012_158_000276	召修《永樂大典》。
HCH_012_158_000277	書成，還任。
HCH_012_158_000278	用師逵薦，還太常博士。
HCH_012_158_000279	帝謂曰：「劉履節為御史九年，高皇帝方授是官，不輕予人也。」
HCH_012_158_000280	宣德初，遷吏部考功員外郎，歷南京太常寺少卿。
HCH_012_158_000281	正統三年，召試行在吏部左侍郎，逾年實授。
HCH_012_158_000282	屢命巡視畿甸遺蝗，問民疾苦。
HCH_012_158_000283	八年改禮部，尋以老請致仕。
HCH_012_158_000284	吏部尚書王直言驥未衰，如念其老，宜令去繁就簡。
HCH_012_158_000285	乃改南京吏部。
HCH_012_158_000286	復以老辭，不允。
HCH_012_158_000287	十四年進尚書。
HCH_012_158_000288	英宗北狩，驥率諸司條上時務，多施行。
HCH_012_158_000289	景泰元年，年七十七，致仕。
HCH_012_158_000290	驥居官務大體。
HCH_012_158_000291	在太常，山川壇獲雙白兔，圻內生瑞麥，皆卻不進。
HCH_012_158_000292	在吏部，有進士未終制，求考功。
HCH_012_158_000293	同官將許之，驥持不可。
HCH_012_158_000294	法司因旱恤刑，有王綱者，惡逆當辟，或憫其少，欲緩之。
HCH_012_158_000295	驥曰：「此婦人之仁，天道不時，正此故也。」
HCH_012_158_000296	獄決而雨。
HCH_012_158_000297	正統中，王振怙寵，淩公卿，獨嚴重驥，呼「先生」。
HCH_012_158_000298	景泰初，以請老至京師。
HCH_012_158_000299	大學士陳循，驥門生也，請間曰：「公雖位冢宰，然未嘗立朝。願少待，事在循輩。」
HCH_012_158_000300	驥正色曰：「君為輔臣，當為天下進賢才，不得私一座主。」
HCH_012_158_000301	退語人曰：「渠以朝廷事為一己事，安得善終。」
HCH_012_158_000302	竟致仕去。
HCH_012_158_000303	驥端厚祗慎。
HCH_012_158_000304	顧勁直，好別白君子、小人。
HCH_012_158_000305	恒曰：「無是非之心，非人也。」
HCH_012_158_000306	家居，憂國憂民，老而彌篤。
HCH_012_158_000307	蕭山故多水患，有宋時縣令楊時湖堤遺跡。
HCH_012_158_000308	驥倡修螺山、石巖、畢公諸塘堰，捍江潮，興湖利。
HCH_012_158_000309	鄉人賴之。
HCH_012_158_000310	居恒布衣糲食，不殖生產。
HCH_012_158_000311	事兄教諭騏，雖耄益恭。
HCH_012_158_000312	時戴笠行田間。
HCH_012_158_000313	嘗遇錢塘主簿，隸訶之。
HCH_012_158_000314	答曰「蕭山魏驥也」。
HCH_012_158_000315	主簿倉皇謝慰而去。
HCH_012_158_000316	成化七年，御史梁昉言：「臣先任蕭山，見致仕尚書臣魏驥裏居，與裏人稠處，教子孫孝弟力田，增堤浚湖，捍禦災患。所行動應禮法，倡理學，勖後進。雖在林野，有補治化。驥生平學行醇篤，心術正大。諳世事，瞭國體。致仕二十餘年，年九十八歲，四方仰德，有如卿雲。百年化育，滋此人瑞。臣讀前史，有以歸老賜祿畢其身者，有尊養三老五更者，有安車蒲輪召者，有賜幾仗者，上齒德也。驥齒德有餘，爵在上卿，可稱達尊。乞下所司，酌前代故事施行。」
HCH_012_158_000317	帝覽奏嘉嘆。
HCH_012_158_000318	遣行人存問，賜羊酒，命有司月給米三石。
HCH_012_158_000319	使命未至而驥卒。
HCH_012_158_000320	賜祭葬如禮，謚文靖。
HCH_012_158_000321	其子完以驥遺言詣闕辭葬，乞以其金振饑民。
HCH_012_158_000322	帝憮然曰：「驥臨終遺命，猶恐勞民，可謂純臣矣。」
HCH_012_158_000323	許之。
HCH_012_158_000324	蕭山民德驥不已，詣闕請祀於德惠祠，以配楊時。
HCH_012_158_000325	制曰「可」。
HCH_012_158_000326	魯穆，字希文，天臺人。
HCH_012_158_000327	永樂四年進士。
HCH_012_158_000328	家居，褐衣蔬食，足跡不入州府。
HCH_012_158_000329	比謁選，有司饋之贐，穆曰：「吾方從仕，未能利物，乃先厲州裏乎？」
HCH_012_158_000330	弗受。
HCH_012_158_000331	除御史。
HCH_012_158_000332	仁宗監國，屢上封事。
HCH_012_158_000333	漢王官校多不法，人莫敢言。
HCH_012_158_000334	穆上章劾之，不報，然直聲振朝廷。
HCH_012_158_000335	遷福建僉事。
HCH_012_158_000336	理冤濫，摧豪強。
HCH_012_158_000337	泉州人李某調官廣西，其姻富民林某遣仆冘李於道，而室其妻。
HCH_012_158_000338	李之宗人訴於官，所司納林賂，坐訴者，繫獄久。
HCH_012_158_000339	穆廉得其實，立正林罪。
HCH_012_158_000340	漳民周允文無子，以侄為後，晚而妾生子，因析產與侄，屬以妾子。
HCH_012_158_000341	允文死，侄言兒非叔子，逐去，盡奪其資，妾訴之。
HCH_012_158_000342	穆召縣父老及周宗族，密置妾子群兒中。
HCH_012_158_000343	鹹指兒類允文，遂歸其產。
HCH_012_158_000344	民呼「魯鐵面」。
HCH_012_158_000345	時楊榮當國，家人犯法，穆治之不少貸。
HCH_012_158_000346	榮顧謂穆賢，薦之朝。
HCH_012_158_000347	英宗即位，擢右僉都御史。
HCH_012_158_000348	明年奉命捕蝗大名。
HCH_012_158_000349	還，以疾卒。
HCH_012_158_000350	命給舟歸其喪。
HCH_012_158_000351	始穆入為僉都御史，所載不過囊衣，尚書吳中贈以器用，不受。
HCH_012_158_000352	至是中為治棺衾，乃克殯。
HCH_012_158_000353	子崇誌，歷官應天尹，廉直有父風。
HCH_012_158_000354	耿九疇，字禹範，盧氏人。
HCH_012_158_000355	永樂末進士。
HCH_012_158_000356	宣德六年授禮科給事中。
HCH_012_158_000357	議論持大體，有清望。
HCH_012_158_000358	正統初，大臣言兩淮鹽政久壞，宜得重名檢者治之，於是推擇為鹽運司同知。
HCH_012_158_000359	痛革宿弊，條奏便宜五事，著為令。
HCH_012_158_000360	母喪去官，場民數千人詣闕乞留。
HCH_012_158_000361	十年正月起為都轉運使。
HCH_012_158_000362	節儉無他好，公退焚香讀書，廉名益振，婦孺皆知其名。
HCH_012_158_000363	以事見誣，逮下吏，已，得白，即留為刑部右侍郎。
HCH_012_158_000364	屢辨疑獄，無所撓屈。
HCH_012_158_000365	禮部侍郎章瑾下獄，九疇及江淵等議貶其官。
HCH_012_158_000366	瑾婿給事中王汝霖銜之，與同官葉盛、張固、林聰等論刑部不公。
HCH_012_158_000367	九疇、淵遂劾盛等，且言汝霖父永和死土木，嬉笑自如，不宜居職。
HCH_012_158_000368	時景帝新立，急於用人，置汝霖等不問，瑾如奏。
HCH_012_158_000369	鳳陽歲兇，盜且起，敕往巡視招撫。
HCH_012_158_000370	奏留英武、飛熊諸衛軍耕守，招來流民七萬戶，境內以安。
HCH_012_158_000371	兩淮自九疇去，鹽政復弛。
HCH_012_158_000372	景泰元年仍命兼理。
HCH_012_158_000373	尋敕錄諸府重囚，多所平反。
HCH_012_158_000374	十月命兼撫江北諸府。
HCH_012_158_000375	三年三月代陳鎰鎮陜西。
HCH_012_158_000376	都指揮楊得青等私役操卒，九疇劾之。
HCH_012_158_000377	詔按治，且命諸邊如得青者，具劾以聞。
HCH_012_158_000378	邊將請增臨洮諸衛戍，九疇言：「邊城士卒非乏。將帥能嚴紀律，賞罰明信，則人人自奮。不然，徒冗食耳。」
HCH_012_158_000379	乃不增戍。
HCH_012_158_000380	邊民春夏出作田，秋冬輒徙入塞。
HCH_012_158_000381	九疇言：「邊將所以禦寇，衛民也。今使民避寇失業，安用將帥？」
HCH_012_158_000382	因禁民入徙。
HCH_012_158_000383	有被寇者，治守帥罪。
HCH_012_158_000384	四年，布政使許資言：「侍郎出鎮，與巡按御史不相統，事多拘滯，請改授憲職便。」
HCH_012_158_000385	乃轉右副都御史。
HCH_012_158_000386	大臣鎮守、巡撫皆授都御史，自九疇始。
HCH_012_158_000387	有旨市羊角為燈，九疇引宋蘇軾諫神宗買浙燈事，事乃寢。
HCH_012_158_000388	災異求言，請帝延儒碩，公賞罰，擇守令，簡將帥。
HCH_012_158_000389	優詔報焉。
HCH_012_158_000390	天順初，議事京師。
