HCH_012_002_000000	洪武元年春正月乙亥，祀天地於南郊，即皇帝位。
HCH_012_002_000001	定有天下之號曰明，建元洪武。
HCH_012_002_000002	追尊高祖考曰玄皇帝，廟號德祖；曾祖考曰恒皇帝，廟號懿祖；祖考曰裕皇帝，廟號熙祖；皇考曰淳皇帝，廟號仁祖；妣皆皇后。
HCH_012_002_000003	立妃馬氏為皇后，世子標為皇太子。
HCH_012_002_000004	以李善長、徐達為左、右丞相，諸功臣進爵有差。
HCH_012_002_000005	丙子，頒即位詔於天下。
HCH_012_002_000006	追封皇伯考以下皆為王。
HCH_012_002_000007	辛巳，李善長、徐達等兼東宮官。
HCH_012_002_000008	甲申，遣使覈浙西田賦。
HCH_012_002_000009	壬辰，胡廷瑞克建寧。
HCH_012_002_000010	庚子，鄧愈為征戍將軍，略南陽以北州郡。
HCH_012_002_000011	湯和克延平，執元平章陳友定，福建平。
HCH_012_002_000012	是月，天下府州縣官來朝。
HCH_012_002_000013	諭曰：「天下始定，民財力俱困，要在休養安息，惟廉者能約己而利人，勉之。」
HCH_012_002_000014	二月壬寅，定郊社宗廟禮，歲必親祀以為常。
HCH_012_002_000015	癸卯，湯和提督海運。
HCH_012_002_000016	廖永忠為征南將軍，朱亮祖副之，由海道取廣東。
HCH_012_002_000017	丁未，以太牢祀先師孔子於國學。
HCH_012_002_000018	戊申，祀社稷。
HCH_012_002_000019	壬子，詔衣冠如唐制。
HCH_012_002_000020	癸丑，常遇春克東昌，山東平。
HCH_012_002_000021	甲寅，楊璟克寶慶。
HCH_012_002_000022	三月辛未，詔儒臣修女誡，戒后妃毋預政。
HCH_012_002_000023	壬申，周德興克全州。
HCH_012_002_000024	丁酉，鄧愈克南陽。
HCH_012_002_000025	己亥，徐達徇汴梁，左君弼降。
HCH_012_002_000026	夏四月辛丑，蘄州進竹簟，卻之，命四方毋妄獻。
HCH_012_002_000027	廖永忠師至廣州，元守臣何真降，廣東平。
HCH_012_002_000028	丁未，祫享太廟。
HCH_012_002_000029	戊申，徐達、常遇春大破元兵於洛水北，遂圍河南。
HCH_012_002_000030	梁王阿魯溫降，河南平。
HCH_012_002_000031	丁巳，楊璟克永州。
HCH_012_002_000032	甲子，幸汴梁。
HCH_012_002_000033	丙寅，馮勝克潼關，李思齊、張思道遁。
HCH_012_002_000034	五月己卯，廖永忠下梧州，潯、貴、容、鬱林諸州皆降。
HCH_012_002_000035	辛卯，改汴梁路為開封府。
HCH_012_002_000036	六月庚子，徐達朝行在。
HCH_012_002_000037	甲辰，海南、海北諸道降。
HCH_012_002_000038	壬戌，楊璟、朱亮祖克靖江。
HCH_012_002_000039	秋七月戊子，廖永忠下象州，廣西平。
HCH_012_002_000040	庚寅，振恤中原貧民。
HCH_012_002_000041	辛卯，將還應天，諭達等曰：「中原之民，久為羣雄所苦，流離相望，故命將北征，拯民水火。元祖宗功德在人，其子孫罔恤民隱，天厭棄之。君則有罪，民復何辜。前代革命之際，肆行屠戮，違天虐民，朕實不忍。諸將克城，毋肆焚掠妄殺人，元之宗戚，咸俾保全。庶幾上答天心，下慰人望，以副朕伐罪安民之意。不恭命者罰無赦。」
HCH_012_002_000042	丙申，命馮勝留守開封。
HCH_012_002_000043	閏月丁未，至自開封。
HCH_012_002_000044	己酉，徐達會諸將兵於臨清。
HCH_012_002_000045	壬子，常遇春克德州。
HCH_012_002_000046	丙寅，克通州，元帝趨上都。
HCH_012_002_000047	是月，徵天下賢才為守令。
HCH_012_002_000048	免吳江、廣德、太平、寧國、滁、和被災田租。
HCH_012_002_000049	八月己巳，以應天為南京，開封為北京。
HCH_012_002_000050	庚午，徐達入元都，封府庫圖籍，守宮門，禁士卒侵暴，遣將巡古北口諸隘。
HCH_012_002_000051	壬申，以京師火，四方水旱，詔中書省集議便民事。
HCH_012_002_000052	丁丑，定六部官制。
HCH_012_002_000053	御史中丞劉基致仕。
HCH_012_002_000054	己卯，赦殊死以下。
HCH_012_002_000055	將士從征者恤其家，逋逃許自首。
HCH_012_002_000056	新克州郡毋妄殺。
HCH_012_002_000057	輸賦道遠者，官為轉運，災荒以實聞。
HCH_012_002_000058	免鎮江租稅。
HCH_012_002_000059	避亂民復業者，聽墾荒地，復三年。
HCH_012_002_000060	衍聖公襲封及授曲阜知縣，並如前代制。
HCH_012_002_000061	有司以禮聘致賢士，學校毋事虛文。
HCH_012_002_000062	平刑，毋非時決囚。
HCH_012_002_000063	除書籍田器稅，民間逋負免徵。
HCH_012_002_000064	蒙古、色目人有才能者，許擢用。
HCH_012_002_000065	鰥寡孤獨廢疾者，存恤之。
HCH_012_002_000066	民年七十以上，一子復。
HCH_012_002_000067	他利害當興革不在詔內者，有司具以聞。
HCH_012_002_000068	壬午，幸北京。
HCH_012_002_000069	改大都路曰北平府。
HCH_012_002_000070	徵元故臣。
HCH_012_002_000071	癸未，詔徐達、常遇春取山西。
HCH_012_002_000072	甲午，放元宮人。
HCH_012_002_000073	九月癸亥，詔曰：「天下之治，天下之賢共理之。今賢士多隱巖穴，豈有司失於敦勸歟，朝廷疏於禮待歟，抑朕寡昧不足致賢，將在位者壅蔽使不上達歟。不然，賢士大夫，幼學壯行，豈甘沒世而已哉。天下甫定，朕願與諸儒講明治道。有能輔朕濟民者，有司禮遣。」
HCH_012_002_000074	乙丑，常遇春下保定，遂下真定。
HCH_012_002_000075	冬十月庚午，馮勝、湯和下懷慶，澤、潞相繼下。
HCH_012_002_000076	丁丑，至自北京。
HCH_012_002_000077	戊寅，以元都平，詔天下。
HCH_012_002_000078	十一月己亥，遣使分行天下，訪求賢才。
HCH_012_002_000079	庚子，始祀上帝於圜丘。
HCH_012_002_000080	癸亥，詔劉基還。
HCH_012_002_000081	十二月丁卯，徐達克太原，擴廓帖木兒走甘肅，山西平。
HCH_012_002_000082	己巳，置登聞鼓。
HCH_012_002_000083	壬辰，以書諭明昇。
HCH_012_002_000084	二年春正月乙巳，立功臣廟於雞籠山。
HCH_012_002_000085	丁未，享太廟。
HCH_012_002_000086	庚戌，詔曰：「朕淮右布衣，因天下亂，率眾渡江，保民圖治，今十有五年。荷天眷祐，悉皆戡定。用是命將北征，齊、魯之民饋糧給軍，不憚千里。朕軫厥勞，已免元年田租。遭旱民未蘇，其更賜一年。頃者，大軍平燕都，下晉、冀，民被兵燹，困征斂，北平、燕南、河東、山西今年田租亦與蠲免。河南諸郡歸附，久欲惠之，西北未平，師過其地，是以未遑。今晉、冀平矣，西抵潼關，北界大河，南至唐、鄧、光、息，今年稅糧悉除之。」
HCH_012_002_000087	又詔曰：「應天、太平、鎮江、宣城、廣德供億浩穰。去歲蠲租，遇旱惠不及下。其再免諸郡及無為州今年租稅。」
HCH_012_002_000088	庚申，常遇春取大同。
HCH_012_002_000089	是月，倭寇山東濱海郡縣。
HCH_012_002_000090	二月丙寅朔，詔修《元史》。
HCH_012_002_000091	壬午，耕耤田。
HCH_012_002_000092	三月庚子，徐達至奉元，張思道遁。
HCH_012_002_000093	振陝西饑，戶米三石。
HCH_012_002_000094	丙午，常遇春至鳳翔，李思齊奔臨洮。
HCH_012_002_000095	夏四月丙寅，遇春還師北平。
HCH_012_002_000096	己巳，諸王子受經於博士孔克仁。
HCH_012_002_000097	令功臣子弟入學。
HCH_012_002_000098	乙亥，編祖訓錄，定封建諸王之制。
HCH_012_002_000099	徐達下鞏昌。
HCH_012_002_000100	丙子，賜秦、隴新附州縣稅糧。
HCH_012_002_000101	丁丑，馮勝至臨洮，李思齊降。
HCH_012_002_000102	乙酉，徐達襲破元豫王於西安。
HCH_012_002_000103	五月甲午朔，日有食之。
HCH_012_002_000104	丁酉，徐達下平涼、延安。
HCH_012_002_000105	張良臣以慶陽降，尋叛。
HCH_012_002_000106	癸卯，始祀地於方丘。
HCH_012_002_000107	六月己卯，常遇春克開平，元帝北走。
HCH_012_002_000108	壬午，封陳日煃為安南國王。
HCH_012_002_000109	秋七月己亥，鄂國公常遇春卒於軍，詔李文忠領其眾。
HCH_012_002_000110	辛亥，擴廓帖木兒遣將破原州、涇州。
HCH_012_002_000111	辛酉，馮勝擊走之。
HCH_012_002_000112	丙辰，明昇遣使來。
HCH_012_002_000113	八月丙寅，元兵攻大同，李文忠擊敗之。
HCH_012_002_000114	己巳，定內侍官制。
HCH_012_002_000115	諭吏部曰：「內臣但備使令，毋多人。古來若輩擅權，可為鑒戒。馭之之道，當使之畏法，勿令有功，有功則驕恣矣。」
HCH_012_002_000116	癸酉，《元史》成。
HCH_012_002_000117	丙子，封王顓為高麗國王。
HCH_012_002_000118	癸未，徐達克慶陽，斬張良臣，陝西平。
HCH_012_002_000119	是月，命儒臣纂禮書。
HCH_012_002_000120	九月辛丑，召徐達、湯和還，馮勝留總軍事。
HCH_012_002_000121	癸卯，以臨濠為中都。
HCH_012_002_000122	戊午，征南師還。
HCH_012_002_000123	冬十月壬戌，遣楊璟諭明昇。
HCH_012_002_000124	甲戌，甘露降於鍾山，羣臣請告廟，不許。
HCH_012_002_000125	辛卯，詔天下郡縣立學。
HCH_012_002_000126	是月，遣使貽元帝書。
HCH_012_002_000127	十一月乙巳，祀上帝於圜丘，以仁祖配。
HCH_012_002_000128	十二月甲戌，封阿答阿者為占城國王。
HCH_012_002_000129	甲申，振西安諸府饑，戶米二石。
HCH_012_002_000130	己丑，大賚平定中原及征南將士。
HCH_012_002_000131	庚寅，擴廓帖木兒攻蘭州，指揮于光死之。
HCH_012_002_000132	是年，占城、安南、高麗入貢。
HCH_012_002_000133	三年春正月癸巳，徐達為征虜大將軍，李文忠、馮勝、鄧愈、湯和副之，分道北征。
HCH_012_002_000134	二月癸未，追封郭子興滁陽王。
HCH_012_002_000135	戊子，詔求賢才可任六部者。
HCH_012_002_000136	是月，李文忠下興和，進兵察罕腦兒，執元平章竹貞。
HCH_012_002_000137	三月庚寅，免南畿，河南，山東，北平，浙東，江西廣信、饒州今年田租。
HCH_012_002_000138	夏四月乙丑，封皇子樉為秦王，棡晉王，棣燕王，橚吳王，楨楚王，榑齊王，梓潭王，𣏌趙王，檀魯王，從孫守謙靖江王。
HCH_012_002_000139	徐達大破擴廓帖木兒於沈兒峪，盡降其眾，擴廓走和林。
HCH_012_002_000140	丙戌，元帝崩於應昌，子愛猷識理達臘嗣。
HCH_012_002_000141	是月，慈利土官覃垕作亂。
HCH_012_002_000142	五月己丑，徐達取興元。
HCH_012_002_000143	分遣鄧愈招諭吐蕃。
HCH_012_002_000144	丁酉，詔守令舉學識篤行之士。
HCH_012_002_000145	己亥，設科取士。
HCH_012_002_000146	甲辰，李文忠克應昌。
HCH_012_002_000147	元嗣君北走，獲其子買的里八剌，降五萬餘人，窮追至北慶州，不及而還。
HCH_012_002_000148	丁未，詔行大射禮。
HCH_012_002_000149	戊申，祀地於方丘，以仁祖配。
HCH_012_002_000150	辛亥，徐達下興元。
HCH_012_002_000151	鄧愈克河州。
HCH_012_002_000152	丁巳，詔開國時將帥無嗣者祿其家。
HCH_012_002_000153	是月旱，齋戒，后妃親執爨，皇太子諸王饋於齋所。
HCH_012_002_000154	六月戊午朔，素服草屨，步禱山川壇，露宿凡三日，還齋於西廡。
HCH_012_002_000155	辛酉，賚將士，省獄囚，命有司訪求通經術明治道者。
HCH_012_002_000156	壬戌，大雨。
HCH_012_002_000157	壬申，李文忠捷奏至，命仕元者勿賀。
HCH_012_002_000158	諡元主曰順帝。
HCH_012_002_000159	癸酉，買的里八剌至京師，羣臣請獻俘。
HCH_012_002_000160	帝曰：「武王伐殷用之乎？」
HCH_012_002_000161	省臣以唐太宗嘗行之對。
HCH_012_002_000162	帝曰：「太宗是待王世充耳。若遇隋之子孫，恐不爾也。」
HCH_012_002_000163	遂不許。
HCH_012_002_000164	又以捷奏多侈辭，謂宰相曰：「元主中國百年，朕與卿等父母皆賴其生養，奈何為此浮薄之言，亟改之。」
HCH_012_002_000165	乙亥，封買的里八剌為崇禮侯。
HCH_012_002_000166	丙子，告捷於南郊。
HCH_012_002_000167	丁丑，告太廟，詔示天下。
HCH_012_002_000168	辛巳，徙蘇州、松江、嘉興、湖州、杭州民無業者田臨濠，給資糧牛種，復三年。
HCH_012_002_000169	是月，倭寇山東、浙江、福建濱海州縣。
HCH_012_002_000170	秋七月丙辰，明昇將吳友仁寇漢中，參政傅友德擊卻之。
HCH_012_002_000171	中書左丞楊憲有罪誅。
HCH_012_002_000172	八月乙酉，遣使瘞中原遺骸。
HCH_012_002_000173	冬十月丙辰，詔儒士更直午門，為武臣講經史。
HCH_012_002_000174	癸亥，周德興為征南將軍，討覃垕，垕遁。
HCH_012_002_000175	辛巳，貽元嗣君書。
HCH_012_002_000176	十一月壬辰，北征師還。
HCH_012_002_000177	甲午，告武成於郊廟。
HCH_012_002_000178	丙申，大封功臣。
HCH_012_002_000179	進李善長韓國公，徐達魏國公，封李文忠曹國公，馮勝宋國公，鄧愈衞國公，常遇春子茂鄭國公，湯和等侯者二十八人。
HCH_012_002_000180	己亥，設壇親祭戰沒將士。
HCH_012_002_000181	庚戌，有事於圜丘。
HCH_012_002_000182	辛亥，詔戶部置戶籍、戶帖，歲計登耗以聞，著為令。
HCH_012_002_000183	乙卯，封中書右丞汪廣洋忠勤伯，御史中丞劉基誠意伯。
HCH_012_002_000184	十二月癸亥，復貽元嗣君書，並諭和林諸部。
HCH_012_002_000185	甲子，建奉先殿。
HCH_012_002_000186	庚午，遣使祭歷代帝王陵寢，並加修葺。
HCH_012_002_000187	己卯，賜勳臣田。
HCH_012_002_000188	壬午，以正月至是月，日中屢有黑子，詔廷臣言得失。
HCH_012_002_000189	是年，占城、爪哇、西洋入貢。
HCH_012_002_000190	四年春正月丙戌，李善長罷，汪廣洋為右丞相。
HCH_012_002_000191	丁亥，中山侯湯和為征西將軍，江夏侯周德興、德慶侯廖永忠副之，率舟師由瞿塘，潁川侯傅友德為征虜前將軍，濟寧侯顧時副之，率步騎由秦、隴伐蜀。
HCH_012_002_000192	魏國公徐達練兵北平。
HCH_012_002_000193	戊子，衞國公鄧愈督餉給征蜀軍。
HCH_012_002_000194	庚寅，建郊廟於中都。
HCH_012_002_000195	丁未，詔設科取士連舉三年，嗣後三年一舉。
HCH_012_002_000196	戊申，免山西旱災田租。
HCH_012_002_000197	二月甲戌，幸中都。
HCH_012_002_000198	壬午，至自中都。
HCH_012_002_000199	元平章劉益以遼東降。
HCH_012_002_000200	是月，蠲太平、鎮江、寧國田租。
HCH_012_002_000201	三月乙酉朔，始策試天下貢士，賜吳伯宗等進士及第、出身有差。
HCH_012_002_000202	乙巳，徙山後民萬七千戶屯北平。
HCH_012_002_000203	丁未，誠意伯劉基致仕。
HCH_012_002_000204	夏四月丙戌，傅友德克階州，文、隆、綿三州相繼下。
HCH_012_002_000205	五月，免江西、浙江秋糧。
HCH_012_002_000206	六月壬午，傅友德克漢州。
HCH_012_002_000207	辛卯，廖永忠克夔州。
HCH_012_002_000208	戊戌，明昇將丁世貞破文州，守將朱顯忠死之，癸卯，湯和至重慶，明昇降。
HCH_012_002_000209	戊申，倭寇膠州。
HCH_012_002_000210	是月，徙山後民三萬五千戶於內地，又徙沙漠遺民三萬二千戶屯田北平。
HCH_012_002_000211	秋七月辛亥，徐達練兵山西。
HCH_012_002_000212	辛酉，傅友德下成都，四川平。
HCH_012_002_000213	乙丑，明昇至京師，封歸義侯。
HCH_012_002_000214	八月甲午，免中都、淮、揚及泰、滁、無為田租。
HCH_012_002_000215	己酉，振陝西饑。
HCH_012_002_000216	是月，高州海寇亂，通判王名善死之。
HCH_012_002_000217	九月庚戌朔，日有食之。
HCH_012_002_000218	冬十月丙申，征蜀師還。
HCH_012_002_000219	十一月丙辰，有事於圜丘。
HCH_012_002_000220	庚申，命官吏犯贓者罪勿貸。
HCH_012_002_000221	是月，免陝西、河南被災田租。
HCH_012_002_000222	十二月，徐達還。
HCH_012_002_000223	是年，安南、浡泥、高麗、三佛齊、暹羅、日本、真臘入貢。
HCH_012_002_000224	五年春正月癸丑，待制王禕使雲南，詔諭元梁王把匝剌瓦爾密。
HCH_012_002_000225	禕至，不屈死。
HCH_012_002_000226	乙丑，徙陳理、明昇於高麗。
HCH_012_002_000227	甲戌，魏國公徐達為征虜大將軍，出雁門，趨和林，曹國公李文忠為左副將軍，出應昌，宋國公馮勝為征西將軍，取甘肅，征擴廓帖木兒。
HCH_012_002_000228	靖海侯吳禎督海運，餉遼東。
HCH_012_002_000229	衞國公鄧愈為征南將軍，江夏侯周德興、江陰侯吳良副之，分道討湖南、廣西洞蠻。
HCH_012_002_000230	二月丙戌，安南陳叔明弒其主日熞自立，遣使入貢，卻之。
HCH_012_002_000231	三月丁卯，都督僉事藍玉敗擴廓於土剌河。
HCH_012_002_000232	夏四月己卯，振濟南、萊州饑。
HCH_012_002_000233	戊戌，始行鄉飲酒禮。
HCH_012_002_000234	庚子，鄧愈平散毛諸洞蠻。
HCH_012_002_000235	五月壬子，徐達及元兵戰於嶺北，敗績。
HCH_012_002_000236	是月，詔曰：「天下大定，禮儀風俗不可不正。諸遭亂為人奴隸者復為民。凍餒者里中富室假貸之，孤寡殘疾者官養之，毋失所。鄉黨論齒，相見揖拜，毋違禮。婚姻毋論財。喪事稱家有無，毋惑陰陽拘忌，停柩暴露。流民復業者各就丁力耕種，毋以舊田為限。僧道齋醮雜男女，恣飲食，有司嚴治之。閩、粵豪家毋閹人子為火者，犯者抵罪。」
HCH_012_002_000237	六月丙子，定宦官禁令。
HCH_012_002_000238	丁丑，定宮官女職之制。
HCH_012_002_000239	戊寅，馮勝克甘肅，追敗元兵於瓜、沙州。
HCH_012_002_000240	癸巳，定六部職掌及歲終考績法。
HCH_012_002_000241	壬寅，吳良平靖州蠻。
HCH_012_002_000242	甲辰，李文忠敗元兵於阿魯渾河，宣寧侯曹良臣戰沒。
HCH_012_002_000243	乙巳，作鐵榜誡功臣。
HCH_012_002_000244	是月，振山東饑，免被災郡縣田租。
HCH_012_002_000245	秋七月丙辰，湯和及元兵戰於斷頭山，敗績。
HCH_012_002_000246	八月丙申，吳良平五開、古州諸蠻。
HCH_012_002_000247	甲辰，元兵犯雲內，同知黃里死之。
HCH_012_002_000248	九月戊午，周德興平婪鳳、安田諸蠻。
HCH_012_002_000249	冬十月丁酉，馮勝師還。
HCH_012_002_000250	是月，免應天、太平、鎮江、寧國、廣德田租。
HCH_012_002_000251	十一月辛酉，有事於圜丘。
HCH_012_002_000252	甲子，征南師還。
HCH_012_002_000253	壬申，納哈出犯遼東。
HCH_012_002_000254	是月，召徐達、李文忠還。
HCH_012_002_000255	十二月甲戌，詔以農桑學校課有司。
HCH_012_002_000256	辛巳，命百官秦事啟皇太子。
HCH_012_002_000257	庚子，鄧愈為征西將軍，征吐番。
HCH_012_002_000258	壬寅，貽元嗣君書。
HCH_012_002_000259	是年，瑣里、占城、高麗、琉球、烏斯藏入貢。
HCH_012_002_000260	高麗貢使再至，諭自後三年一貢。
HCH_012_002_000261	六年春正月甲寅，謫汪廣洋為廣東參政。
HCH_012_002_000262	二月乙未，諭暫罷科舉，察舉賢才。
HCH_012_002_000263	壬寅，命御史及按察使考察有司。
HCH_012_002_000264	三月癸卯朔，日有食之。
HCH_012_002_000265	頒昭鑒錄，訓誡諸王。
HCH_012_002_000266	戊申，大閱。
HCH_012_002_000267	壬子，徐達為征虜大將軍，李文忠、馮勝、鄧愈、湯和副之，備邊山西、北平。
HCH_012_002_000268	甲子，指揮使於顯為總兵官，備倭。
HCH_012_002_000269	夏四月己丑，令有司上山川險易圖。
HCH_012_002_000270	六月壬午，盱眙獻瑞麥，薦宗廟。
HCH_012_002_000271	壬辰，擴廓帖木兒遣兵攻雁門，指揮吳均擊卻之。
HCH_012_002_000272	是月，免北平、河間、河南、開封、延安、汾州被災田租。
HCH_012_002_000273	秋七月壬寅，命戶部稽渡江以來各省水旱災傷分數，優恤之。
HCH_012_002_000274	壬子，胡惟庸為右丞相。
HCH_012_002_000275	八月乙亥，詔祀三皇及歷代帝王。
HCH_012_002_000276	冬十月辛巳，召徐達、馮勝還。
HCH_012_002_000277	十一月壬子，擴廓帖木兒犯大同，徐達遣將擊敗之，達仍留鎮。
HCH_012_002_000278	甲子，遣兵部尚書劉仁振真定饑。
HCH_012_002_000279	丙寅，冬至，帝不豫，改卜郊。
HCH_012_002_000280	閏月乙亥，錄故功臣子孫未嗣者二百九人。
HCH_012_002_000281	壬午，有事於圜丘。
HCH_012_002_000282	庚寅，頒定大明律。
HCH_012_002_000283	是年，暹羅、高麗、占城、真臘、三佛齊入貢。
HCH_012_002_000284	命安南陳叔明權知國事。
HCH_012_002_000285	七年春正月甲戌，都督僉事王簡、王誠，平章李伯昇，屯田河南、山東、北平。
HCH_012_002_000286	靖海侯吳禎為總兵官，都督於顯副之，巡海捕倭。
HCH_012_002_000287	二月丁酉朔，日有食之。
HCH_012_002_000288	戊午，修曲阜孔子廟，設孔、顏、孟三氏學。
HCH_012_002_000289	是月，平陽、太原、汾州、歷城、汲縣旱蝗，並免租稅。
HCH_012_002_000290	夏四月己亥，都督藍玉敗元兵於白酒泉，遂拔興和。
HCH_012_002_000291	壬寅，金吾指揮陸齡討永、道諸州蠻，平之。
HCH_012_002_000292	五月丙子，免真定等四十二府州縣被災田租。
HCH_012_002_000293	辛巳，振蘇州饑民三十萬戶。
HCH_012_002_000294	癸巳，減蘇、松、嘉、湖極重田租之半。
HCH_012_002_000295	六月，陝西平涼、延安、靖寧、鄜州雨雹，山西、山東、北平、河南蝗，並蠲田租。
HCH_012_002_000296	秋七月甲子，李文忠破元兵於大寧、高州。
HCH_012_002_000297	壬申，倭寇登、萊。
HCH_012_002_000298	八月甲午朔，祀歷代帝王廟。
HCH_012_002_000299	辛丑，詔軍士陣歿，父母妻子不能自存者，官為存養。
HCH_012_002_000300	百姓避兵離散或客死，遺老幼，並資遣還。
HCH_012_002_000301	遠宦卒官，妻子不能歸者，有司給舟車資送。
HCH_012_002_000302	庚申，振河間、廣平、順德、真定饑，蠲租稅。
HCH_012_002_000303	九月丁丑，遣崇禮侯買的里八剌歸，遺元嗣君書。
HCH_012_002_000304	冬十一月壬戌，納哈出犯遼陽，千戶吳壽擊走之。
HCH_012_002_000305	辛未，有事於圜丘。
HCH_012_002_000306	十二月戊戌，召鄧愈、湯和還。
HCH_012_002_000307	是年，阿難功德國、暹羅、琉球、三佛齊、烏斯藏、撒里、畏兀兒入貢。
HCH_012_002_000308	八年春正月辛未，增祀雞籠山功臣廟一百八人。
HCH_012_002_000309	癸酉，命有司察窮民無告者，給屋舍衣食。
HCH_012_002_000310	辛巳，鄧愈、湯和等十三人屯戍北平、陝西、河南。
HCH_012_002_000311	丁亥，詔天下立社學。
HCH_012_002_000312	是月，河決開封，發民夫塞之。
HCH_012_002_000313	二月甲午，宥雜犯死罪以下及官犯私罪者，謫鳳陽輸作屯種贖罪。
HCH_012_002_000314	癸丑，耕耤田。
HCH_012_002_000315	召徐達、李文忠、馮勝還，傅友德等留鎮北平。
HCH_012_002_000316	三月辛酉，立鈔法。
HCH_012_002_000317	辛巳，罷寶源局鑄錢。
HCH_012_002_000318	夏四月辛卯，幸中都。
HCH_012_002_000319	丁巳，至自中都。
HCH_012_002_000320	免彰德、大名、臨洮、平涼、河州被災田租。
HCH_012_002_000321	罷營中都。
HCH_012_002_000322	致仕誠意伯劉基卒。
HCH_012_002_000323	五月己巳，永嘉侯朱亮祖偕傅友德鎮北平。
HCH_012_002_000324	六月壬寅，指揮同知胡汝平貴州蠻。
HCH_012_002_000325	秋七月己未朔，日有食之。
HCH_012_002_000326	辛酉，改作太廟。
HCH_012_002_000327	壬戌，召傅友德、朱亮祖還，李文忠、顧時鎮山西、北平。
HCH_012_002_000328	戊辰，詔百官奔父母喪不俟報。
HCH_012_002_000329	京師地震。
HCH_012_002_000330	丁丑，免應天、太平、寧國、鎮江及蘄、黃諸府被災田租。
HCH_012_002_000331	八月己酉，元擴廓帖木兒卒。
HCH_012_002_000332	冬十月丁亥，詔舉富民素行端潔達時務者。
HCH_012_002_000333	壬子，命皇太子諸王講武中都。
HCH_012_002_000334	十一月丁丑，有事於圜丘。
HCH_012_002_000335	十二月戊子，京師地震。
HCH_012_002_000336	甲寅，遣使振蘇州、湖州、嘉興、松江、常州、太平、寧國、杭州水災。
HCH_012_002_000337	是月，納哈出犯遼東，指揮馬雲、葉旺大敗之。
HCH_012_002_000338	是年，撒里、高麗、占城、暹羅、日本、爪哇、三佛齊入貢。
HCH_012_002_000339	九年春正月，中山侯湯和，潁川侯傅友德，都督僉事藍玉、王弼，中書右丞丁玉，備邊延安。
HCH_012_002_000340	三月己卯，詔曰：「比年西征燉煌，北伐沙漠，軍需甲仗，皆資山、陝，又以秦、晉二府宮殿之役，重困吾民。平定以來，閭閻未息。國都始建，土木屢興。畿輔既極煩勞，外郡疲於轉運。今蓄儲有餘，其淮、揚、安、徽、池五府及山西、陝西、河南、福建、江西、浙江、北平、湖廣今年租賦，悉免之。」
HCH_012_002_000341	夏四月庚戌，京師自去年八月不雨，是日始雨。
HCH_012_002_000342	五月癸酉，自庚戌雨，至是日始霽。
HCH_012_002_000343	六月甲午，改行中書省為承宣布政使司。
HCH_012_002_000344	辛丑，李文忠還。
HCH_012_002_000345	秋七月癸丑朔，日有食之。
HCH_012_002_000346	是月，蠲蘇、松、嘉、湖水災田租，振永平旱災。
