HCH_009_080_000001	熙宗二子濟安道濟斜卯阿里突合速烏延蒲盧渾赤盞暉大㚖本名撻不野磐本名蒲速越阿離補子:方熙宗諸子：悼平皇后生太子濟安，賢妃生魏王道濟。
HCH_009_080_000002	濟安，皇統二年二月戊子生於天開殿。
HCH_009_080_000003	上年二十四始有皇子，喜甚，遣使馳報明德宮太皇太后。
HCH_009_080_000004	五日命名，大赦天下。
HCH_009_080_000005	三月甲寅，告天地宗廟。
HCH_009_080_000006	丁巳，翦鬌，奏告天地宗廟。
HCH_009_080_000007	戊午，冊爲皇太子。
HCH_009_080_000008	封皇后父太尉胡塔爲王，賜人口、馬牛五百、駝五十、羊五千。
HCH_009_080_000009	隨朝職官並遷一資，皆有賜。
HCH_009_080_000010	已未，詔天下。
HCH_009_080_000011	十二月，濟安病劇，上與皇后幸佛寺焚香，流涕哀禱，曲赦五百里內罪囚。
HCH_009_080_000012	是夜，薨。
HCH_009_080_000013	諡英悼太子，葬興陵之側，上送至烏只黑水而還。
HCH_009_080_000014	命工塑其像于儲慶寺，上與皇后幸寺安置之。
HCH_009_080_000015	海陵毀上京宮室，寺亦隨毀。
HCH_009_080_000016	道濟，皇統三年，命爲中京留守，以直學士阿懶爲都提點，張玄素爲同提點，左右輔導之。
HCH_009_080_000017	俄封魏王，封其母爲賢妃。
HCH_009_080_000018	初居外，至是養之宮中。
HCH_009_080_000019	未幾，熙宗怒殺之。
HCH_009_080_000020	贊曰：國初制度未立，太宗、熙宗皆自諳班勃極烈即帝位。
HCH_009_080_000021	諳班勃極烈者，漢語雲最尊官也。
HCH_009_080_000022	熙宗立濟安爲皇太子，始正名位，定制度焉。
HCH_009_080_000023	斜卯阿里，父渾坦，穆宗時內附，數有戰功。
HCH_009_080_000024	阿里年十七，從其伯父胡麻谷討詐都，獲其弟沙里只。
HCH_009_080_000025	高麗築九城於曷懶甸，渾坦攻之，遇敵於木里門甸，力戰久之，阿里挺槍馳刺其將於陣中，敵遂潰。
HCH_009_080_000026	渾坦與石適歡合兵于徒門水，阿里首敗敵兵，取其二城。
HCH_009_080_000027	高麗入寇，以我兵屯守要害，不得進，乃還。
HCH_009_080_000028	阿里追及于曷懶水，高麗人爭走冰上，阿里乘之，殺略幾盡，遂合兵于石適歡。
HCH_009_080_000029	道遇敵兵五萬，擊走之。
HCH_009_080_000030	又與石適歡遇敵七萬，阿里先登，奮擊大敗之。
HCH_009_080_000031	石適歡曰：「汝一日之間，三破重敵，功豈可忘。」
HCH_009_080_000032	乃厚賜之。
HCH_009_080_000033	斡塞、烏睹本攻駝吉城，阿里鑿墉爲門，日已暮，不可入，以兵守之，旦日遂取其城。
HCH_009_080_000034	烏睹本以被甲並乘馬賜之。
HCH_009_080_000035	從攻下甯江州，授猛安。
HCH_009_080_000036	又從攻信州、賓州，皆克之。
HCH_009_080_000037	遼人來攻孛堇忽沙里城，阿里率百餘騎救之。
HCH_009_080_000038	遼兵數萬，阿里兵少，乃令軍士裂衣多爲旗幟，出山谷間，遼兵望見，遁去。
HCH_009_080_000039	蘇、復州叛，眾至十萬。
HCH_009_080_000040	旁近女直皆保于太尉胡沙家，築壘爲固。
HCH_009_080_000041	敵圍之數重，守者糧芻俱盡，牛馬相食其鬃尾，人易子而食。
HCH_009_080_000042	夜，縋二人出，告急于阿里。
HCH_009_080_000043	阿里赴之，內外合擊之，破其眾於辟離密罕水上，剿殺幾盡，水爲之不流。
HCH_009_080_000044	蒲離古胡什吉水、馬韓島凡十余戰，破數十萬眾。
HCH_009_080_000045	契丹、奚人聚舟千艘，將入於海。
HCH_009_080_000046	阿里以二十七舟邀之，中流矢，臥舟中，中夜始蘇。
HCH_009_080_000047	敵船已入王家島，即夜取海路追及之，敵走險以拒，阿里以騎兵邀擊，再中流矢，力戰不退，竟破之，盡獲其舟。
HCH_009_080_000048	於是，蘇、復州、婆速路皆平。
HCH_009_080_000049	攻顯州，下靈山縣，取梁魚務，敗餘睹兵，功皆最。
HCH_009_080_000050	後與散睹魯屯高州，契丹昭古牙、九斤合興中兵數萬攻胡里特寨，阿里以八謀克兵救之。
HCH_009_080_000051	胡里特先往，敗於城下。
HCH_009_080_000052	阿里指陣前緋衣者二十餘人曰：「此必賊酋也。」
HCH_009_080_000053	麾兵奮擊，皆殺之，餘眾大潰。
HCH_009_080_000054	來州、隰州兵圍胡里特城，聞阿里來救，即解圍去。
HCH_009_080_000055	闍母討張覺，有兵出樓峰口山谷間，阿里、散篤魯、忽盧補三猛安擊敗之。
HCH_009_080_000056	宗望代闍母討張覺，阿里再敗平州兵。
HCH_009_080_000057	及伐宋，阿里別擊宋兵，敗之。
HCH_009_080_000058	孟陽之役，阿里扼橋渡力戰。
HCH_009_080_000059	明年，再伐宋，至保州、中山，累破之。
HCH_009_080_000060	進圍真定，阿里與婁室、豁魯乘風縱火，焚其樓櫓，諸軍畢登，克其城。
HCH_009_080_000061	師至河上，粘割胡撒擊走宋人，扼河津，兵數千遂渡河。
HCH_009_080_000062	諸將分出大名境，阿里破敵四百盡殪，遂圍汴。
HCH_009_080_000063	汴中夜出兵來焚攻具，阿里與謀克常孫陽阿禦之，其眾大潰。
HCH_009_080_000064	還攻趙州，降之。
HCH_009_080_000065	天會六年，伐宋主，取陽穀、莘縣，敗海州兵八萬人，海州降。
HCH_009_080_000066	破賊船萬余於梁山泊。
HCH_009_080_000067	招降滕陽、東平、泰山群盜。
HCH_009_080_000068	盜攻範縣，擊走之，獲船七百艘。
HCH_009_080_000069	宗弼攻下睢陽，與烏延蒲盧渾先以二千人往招壽春，具舟淮水上。
HCH_009_080_000070	時康民聚賈船四百與壽春相近，朮列速以騎四百破康民，斬馘數千。
HCH_009_080_000071	與當海、大㚖破賊十萬於淮南。
HCH_009_080_000072	比至江，連破宋兵，獲舟二百艘。
HCH_009_080_000073	宗弼至江甯，阿里、蒲盧渾別降廣德軍，先趣杭州。
HCH_009_080_000074	去杭十餘里，遇宋伏兵二千，取我前驅甲士三十人。
HCH_009_080_000075	阿里使諸軍去馬搏戰，伏兵敗，皆逼死于水。
HCH_009_080_000076	宗弼至余杭，而宋主走明州，阿里與蒲盧渾以精騎四千襲之，破東關兵，濟曹娥江，敗宋兵于高橋鎮。
HCH_009_080_000077	至明州，頗失利。
HCH_009_080_000078	宋主已入於海，乃退軍余姚。
HCH_009_080_000079	宗弼使當海濟師，遂下明州，執宋守臣趙伯諤，進至昌國縣。
HCH_009_080_000080	宋主自昌國走溫州，由海路追三百餘里，弗及。
HCH_009_080_000081	遂隳明州，與宗弼俱北歸。
HCH_009_080_000082	睿宗經略陝西，駐涇州，阿里先取渭州。
HCH_009_080_000083	睿宗趨熙河，阿里、斜喝、韓常三猛安爲前軍。
HCH_009_080_000084	十二年，與高彪監護水運。
HCH_009_080_000085	宋以舟師阻亳州河路，擊敗之，追殺六十餘里，獲其將蕭通。
HCH_009_080_000086	破漣水水寨賊，盡得其大船，遂取漣水軍，招徠安輯之。
HCH_009_080_000087	天眷間，盜據石州，阿里討之。
HCH_009_080_000088	粘割胡撒與所部先登，遂克其城，石州平。
HCH_009_080_000089	宗弼再伐宋，阿里已老，督造戰船。
HCH_009_080_000090	宋稱臣，詔賜阿里錢千萬。
HCH_009_080_000091	自結髮從軍，大小數十戰，尤習舟楫，江、淮用兵，無役不從，時人以水星目之。
HCH_009_080_000092	爲迭里部節度使，曆順義、泰寧軍，歸德、濟南尹。
HCH_009_080_000093	天德初，致仕，加特進，封王。
HCH_009_080_000094	正隆例封韓國公，召赴闕，命造戰船。
HCH_009_080_000095	以疾薨，年七十八，諡智敏。
HCH_009_080_000096	阿里性忠直，多智略。
HCH_009_080_000097	兄弟相友愛，家故饒財，以己猛安及財物盡與弟愛拔里。
HCH_009_080_000098	愛拔里不肯受，逃避歲餘，阿里終與之。
HCH_009_080_000099	突合速，宗室子，拿罕塞人。
HCH_009_080_000100	初隸萬戶石家奴麾下，嘗領偏師破雲中諸山寇盜。
HCH_009_080_000101	宗望攻平州，遣突合速討應州賊，平之，撫安其民而還。
HCH_009_080_000102	及伐宋，在宗翰軍，以八謀克破石嶺關屯兵數萬，殺戮幾盡。
HCH_009_080_000103	師至太原，祁縣降而復叛，突合速攻下之。
HCH_009_080_000104	進取文水縣，後從諸帥列屯汾州之境。
HCH_009_080_000105	宋河東軍帥郝仲連、張思正，陝西軍帥張關索及其統制馬忠，合兵數萬來援，皆敗之。
HCH_009_080_000106	宗翰南伐至潞還，太原猶未下，即留完顏銀朮可總督諸軍，經略其地。
HCH_009_080_000107	於是，宋援兵大至，突合速從馬五、沃魯破宋兵四千于文水。
HCH_009_080_000108	聞宋將黃迪等以兵三十萬柵於縣之西山，復與耿守忠合兵九千擊之，殺八萬餘人，獲馬及資糧甚眾。
HCH_009_080_000109	宋制置使姚古率兵至隆州穀，突合速與拔離速以步騎萬餘禦之。
HCH_009_080_000110	种師中兵十萬據榆次，銀朮可乃召突合速，使中分其兵而還，與活女等合兵八千擊敗之，斬師中于殺熊嶺。
HCH_009_080_000111	宋將張灝以兵十萬營于文水近郊，復與拔離速擊破之。
HCH_009_080_000112	潞州復叛，宋兵號十七萬，骨赧、突合速、拔離速皆被圍。
HCH_009_080_000113	突合速麾軍士，下馬力戰，遂潰圍而出。
HCH_009_080_000114	及再舉伐宋，宗翰命婁室率軍先趨汴。
HCH_009_080_000115	婁室至澤州，突合速、沃魯以五百騎爲前驅，往招河陽。
HCH_009_080_000116	先據黃河津，宋兵萬余背水陣，進擊敗之，皆擠于水，遂降河陽。
HCH_009_080_000117	汴京平，諸將西趣陝津，略定河東郡縣。
HCH_009_080_000118	突合速取憲州，遇其援軍，擊敗之，生擒其將。
HCH_009_080_000119	孛堇濃瑰朮魯等攻保德，未下，突合速進兵助擊，梯沖並進，遂克其城。
HCH_009_080_000120	孛堇烏谷攻石州，屢敗，亡其三將，軍士歿者數百人。
HCH_009_080_000121	突合速謂烏穀曰：「敵皆步兵，吾不可以騎戰。」
HCH_009_080_000122	烏穀曰：「聞賊挾妖術，畫馬以系其足，疾甚奔馬，步戰豈可及之。」
HCH_009_080_000123	突合速笑曰：「豈有是耶!|㚖」乃令諸軍去馬戰，盡殪之。
HCH_009_080_000124	六年，宗輔駐師鄧州，突合速、馬五、拔離速西取均、房，遂下其城。
HCH_009_080_000125	攻唐、蔡、陳州及潁昌府，皆克之。
HCH_009_080_000126	天眷初，除彰德軍節度使。
HCH_009_080_000127	三年，爲元帥左監軍。
HCH_009_080_000128	皇統八年，改濟南尹。
HCH_009_080_000129	天德間，封定國公，授世襲千戶。
HCH_009_080_000130	卒，年七十二。
HCH_009_080_000131	正隆二年，贈應國公。
HCH_009_080_000132	初，突合速以次室受封，次室子因得襲其猛安。
HCH_009_080_000133	及分財異居，次室子取奴婢千二百口，正室子得八百口。
HCH_009_080_000134	久之，正室子爭襲，連年不決，家貲費且盡，正室子奴婢存者二百口，次室子奴婢存者才五六十口。
HCH_009_080_000135	世宗聞突合速諸子貧窘，以問近臣，具以爭襲之故爲對，世宗曰：「次室子豈當受封邪!|㚖」遂以嫡妻長子襲。
HCH_009_080_000136	烏延蒲盧渾，曷懶路烏古敵昏山人。
HCH_009_080_000137	父孛古剌，龍虎衛上將軍。
HCH_009_080_000138	蒲盧渾膂力絕人，能挽強射二百七十步。
HCH_009_080_000139	與兄鶻沙虎俱以勇健隸闍母軍，居帳下。
HCH_009_080_000140	攻黃龍府，力戰有功。
HCH_009_080_000141	闍母敗於兔耳山，張覺復整兵來，諸將皆不敢戰。
HCH_009_080_000142	蒲盧渾登山望之，乃紿諸將曰：「敵軍少，急擊可破也。若入城，不可復製。」
HCH_009_080_000143	遂合戰，破之。
HCH_009_080_000144	郭藥師、蔡靖以燕京降，蒲盧渾率九十騎先伺察城中居民去就。
HCH_009_080_000145	遂將漢兵千，隸完顏蒙適攻真定。
HCH_009_080_000146	進攻贊皇，取之，獲人畜甲仗萬餘。
HCH_009_080_000147	汴城破，日已暮，宋人猶力戰，槍刺中蒲盧渾手，戰益力，遂敗宋軍，賜金五十兩。
HCH_009_080_000148	睿宗爲右副元帥，已定關、陝，議取劍外諸州，遂拔和尚原。
HCH_009_080_000149	元帥府承制以蒲盧渾爲河北西路兵馬都總管。
HCH_009_080_000150	及宋主在揚州，蒲盧渾與蒙適將萬騎襲之，宋主已渡江，破其餘兵。
HCH_009_080_000151	後與斜卯阿里俱從宗弼自淮西渡江取江寧。
HCH_009_080_000152	宗弼入杭州，宋主走明州，再走溫州，由海道追三百餘里，隳明州而歸，語在《阿里傳》。
HCH_009_080_000153	天眷二年，授鎮國上將軍，除安國軍，以疾去官。
HCH_009_080_000154	皇統六年，授世襲謀克，起爲延安尹，賜尚衣一襲，尋致仕。
HCH_009_080_000155	海陵遷中都，起爲歸德尹，就其家授之，賜銀牌、襲衣、玉吐鶻，馳驛之官。
HCH_009_080_000156	蒲盧渾留數十日，已違程，復聽致仕。
HCH_009_080_000157	召赴京師，至薊州，見海陵於獵所。
HCH_009_080_000158	明日，從獵，獲一狐。
HCH_009_080_000159	海陵曰：「卿年老，尚能馳逐擊獸，健捷如此。」
HCH_009_080_000160	賜以禦服，封豳國公。
HCH_009_080_000161	除太子少師，進太子太保，改真定尹，入判大宗正事。
HCH_009_080_000162	頃之伐宋，以本官行右領軍副都督事。
HCH_009_080_000163	師次西採石，海陵欲渡江，蒲盧渾曰：「宋軍船高大，我船庳小，恐不可遽渡。」
HCH_009_080_000164	海陵怒曰：「汝昔從梁王追趙構於海島，皆大舟耶!|㚖今乃沮吾兵事！設不能遽渡江，不過有少損耳。爾年已七十，縱自愛，豈有不死理耶。明日當與奔睹先濟。」
HCH_009_080_000165	既而復止之，乃遣別將先渡江，舟小不可戰，遂失利，兩猛安及兵士二百余人皆陷沒。
HCH_009_080_000166	海陵遇害，軍還。
HCH_009_080_000167	大定二年，至中都上謁，除東京留守。
HCH_009_080_000168	世宗召問年幾何，對曰：「臣今年七十三矣。」
HCH_009_080_000169	上曰：「卿宿將，久練兵事，年雖老，精神不衰。」
HCH_009_080_000170	因命到官，每旬月一視事。
HCH_009_080_000171	賜衣一襲，進階開府儀同三司，仍封豳國公。
HCH_009_080_000172	是歲，卒。
HCH_009_080_000173	十八年，孫紮虎遷廣威將軍，襲烏古敵昏山世襲猛安，並親管謀克。
HCH_009_080_000174	赤盞暉，字仲明，其先附于遼，居張惶堡，故嘗以張爲氏。
HCH_009_080_000175	後家來州。
HCH_009_080_000176	暉體貌雄偉，慷慨有志略。
HCH_009_080_000177	少遊鄉校。
HCH_009_080_000178	遼季以破賊功，授禮賓副使，領來、隰、遷、潤四州屯兵。
HCH_009_080_000179	天輔六年降，仍命領其眾，從闍母定興中府義、錦等州。
HCH_009_080_000180	及破張覺，皆與有功，以粟萬五千石助軍，授洺州刺史。
HCH_009_080_000181	宗望初伐宋，孟陽之戰，敵之中軍徑薄宗望營，暉與諸將擊敗之，追殺至城下。
HCH_009_080_000182	訖師還，數立戰功。
HCH_009_080_000183	明年，再舉伐宋，攻下保州、真定，暉皆與焉。
HCH_009_080_000184	進圍汴，宋人夜出兵二萬焚我攻具，暉以二謀克兵擊走之。
HCH_009_080_000185	凡城中出兵拒戰，暉之所當，無不勝捷。
HCH_009_080_000186	既克宋還，從攻河間。
HCH_009_080_000187	敵將李成以雄、莫之兵來援，暉與所部迎擊，馬傷而墮，暉輒奮起步鬥，竟敗成兵。
HCH_009_080_000188	是日，凡七戰皆勝，敵人多逼死濠隍間，暉兩臂亦數中流矢。
HCH_009_080_000189	賊將劉先生以兵二萬夜襲營，暉力戰達旦，賊始敗走，皆溺死于水。
HCH_009_080_000190	暉復傅城力戰，如是連月，諸軍四面合攻，遂克之。
HCH_009_080_000191	加桂州管內觀察使，因留撫河間。
HCH_009_080_000192	時居民皆爲軍士所掠，老幼存者亡幾。
HCH_009_080_000193	暉下令軍中聽贖還之。
HCH_009_080_000194	未幾，皆按堵如故。
HCH_009_080_000195	從睿宗經略山東，既攻下青州，復從闍母攻濰州。
HCH_009_080_000196	暉督其裨校先登，而城中積芻茭乘風縱火發機石，暉率將士沖冒而下，力戰敗之。
HCH_009_080_000197	軍還，復以三十騎破敵于範橋。
HCH_009_080_000198	帥府承制加靜江軍節度使。
HCH_009_080_000199	進攻，城中砲出，幾中暉，拂其甲裳裂之。
HCH_009_080_000200	暉益奮攻，卒破其城。
HCH_009_080_000201	又從攻泗州，克之。
HCH_009_080_000202	還屯汶陽，破賊眾於梁山濼，獲舟千餘。
HCH_009_080_000203	移軍攻濟州，既敗敵兵，因傅城諭以禍福，乃舉城降。
HCH_009_080_000204	暉約束軍士，無秋毫犯，自是曹、單等州皆聞風而下。
HCH_009_080_000205	從攻壽春、歸德，及渡淮爲先鋒，遇重敵於秀州、蘇州，皆擊敗之，遂至余杭。
HCH_009_080_000206	通糧餉，治橋道，暉之力爲多。
HCH_009_080_000207	乃還，載《資治通鑒》版以歸。
HCH_009_080_000208	大軍過江寧，徙其官民北渡，時暑多疾疫，老弱轉死道路，其知府陳邦光者訴于宗弼，怒將殺之，暉曰：「此義士也。」
HCH_009_080_000209	力營救之，竟得免。
HCH_009_080_000210	富平之戰，暉在右翼，遇濘而敗，睿宗念其前功，杖而釋之。
HCH_009_080_000211	師至熙河，暉別降諸寨將鈐轄及吐蕃酋長等，並民戶萬五千餘。
HCH_009_080_000212	蘭州叛，與訛魯補等攻下之，獲河州安撫使白常、熙河路副都總管劉維輔以獻。
HCH_009_080_000213	還攻慶陽，兩敗重敵，殺其將戴巢。
HCH_009_080_000214	師還，遷歸德軍節度使。
HCH_009_080_000215	宋州舊無學，暉爲營建學舍，勸督生徒，肄業者復其身，人勸趨之。
HCH_009_080_000216	屬縣民家奴王夔者，嘗業進士，暉以錢五十萬贖之，使卒其業，夔後至顯官。
HCH_009_080_000217	密州吏龐乙卒於官，其孤貧，不克葬，暉爲營治葬事，且資給其家。
HCH_009_080_000218	十三年，復從大軍渡淮。
HCH_009_080_000219	還鎮，丁母憂，尋以舊職起復。
HCH_009_080_000220	既廢齊，爲安化軍節度使。
HCH_009_080_000221	天眷三年，復河南，宋人乘間陷海州，帥府以登、萊、沂、密四州委暉經畫，敵無敢窺其境者。
HCH_009_080_000222	爲定海軍節度使，尋改濟南尹，累遷光祿大夫。
HCH_009_080_000223	俄以罪罷。
HCH_009_080_000224	久之，起爲昌武軍節度使。
HCH_009_080_000225	天德二年，遷南京留守，尋改河南路統軍使，授世襲猛安，拜尚書右丞，封河內郡王。
HCH_009_080_000226	歲餘，拜平章政事，封戴王。
HCH_009_080_000227	正隆初，出爲興平軍節度使。
HCH_009_080_000228	正隆降王爵，爲樞密副使，封景國公。
HCH_009_080_000229	未幾，復爲左丞，封濟國公。
HCH_009_080_000230	尋除大興尹，封榮國公。
HCH_009_080_000231	薨，年六十五。
HCH_009_080_000232	大定間諡曰武康。
HCH_009_080_000233	子師直，登進士第。
HCH_009_080_000234	大㚖，本名撻不野，其先遼陽人，世仕遼有顯者。
HCH_009_080_000235	太祖伐遼，遼人徵兵遼陽，時㚖年二十餘，在選中。
HCH_009_080_000236	遼兵敗，㚖脫身走甯江。
HCH_009_080_000237	甯江破，㚖越城而逃，爲軍士所獲，太祖問其家世，因收養之。
HCH_009_080_000238	收國二年，爲東京奚民謀克。
HCH_009_080_000239	是時，初破高永昌，東京旁郡邑未盡服屬，使㚖伺察反側。
HCH_009_080_000240	有聞必達，太祖以爲忠實，授猛安，兼同知東京留守事。
HCH_009_080_000241	取中、西兩京，隸闍母軍。
HCH_009_080_000242	遼軍二十萬來戰，吳王使㚖以本部守營，㚖堅請出戰，不許。
HCH_009_080_000243	或謂㚖曰：「戰，危事，獨苦請，何也？」
HCH_009_080_000244	㚖曰：「丈夫不得一決勝負，尚何爲。苟臨戰不捷，雖死猶生也。」
HCH_009_080_000245	吳王聞而壯之，乃遣出戰。
HCH_009_080_000246	既合戰，闍母軍少卻，遼兵後躡之，㚖麾本部兵橫擊，殺數百人，由是顯名軍中。
HCH_009_080_000247	天會三年，宗望伐宋，信德府居燕、汴之中，可駐軍以濟緩急，欲遂攻之，恐不能亟下，議未決。
HCH_009_080_000248	㚖獨率本部兵，選善射者射其城樓，別以輕銳潛升于樓角之間，遂克其城。
HCH_009_080_000249	明年，軍至浚州，宋人已燒河橋，宗望下令，「軍中有能先濟者功爲上」。
HCH_009_080_000250	㚖捕得十餘舟，使勇悍者徑渡，擊其守者而奪其戍柵，由是大軍俱濟。
HCH_009_080_000251	八月，再伐宋，授萬戶，賜金牌。
HCH_009_080_000252	既破汴京，㚖爲河間路都統。
HCH_009_080_000253	已克河間，闍母怒其不早降，因縱軍大掠，㚖諫止之，已掠者官爲贖還。
HCH_009_080_000254	除河間尹，從攻襲慶府。
HCH_009_080_000255	先一日，㚖命軍士預備畚鍤及薪，既傅城，諸將方經營攻具，未鳴鼓，㚖軍有素備，遂先登。
HCH_009_080_000256	軍帥以㚖未鳴鼓輒戰，不如軍令，請罪㚖，朝廷釋弗問，仍例賞之。
HCH_009_080_000257	宗弼伐江南，濟淮，宋將時康民率兵十七萬來拒，㚖率本部從擊，敗之。
HCH_009_080_000258	復以騎二千與當海擊敗淮南賊十萬，殺萬余人，王善來降。
HCH_009_080_000259	將渡江，㚖軍先渡，舟行去岸尚遠，宋列兵江口，㚖視其水可涉，則麾兵舍舟趨岸疾擊之，宋兵走，大軍相繼而濟。
HCH_009_080_000260	俄遇杜充兵六萬于江寧之西，㚖與鶻盧補擊走之。
HCH_009_080_000261	師還，㚖留爲揚州都統，經略淮、海、高郵之間。
HCH_009_080_000262	再爲河間尹，兼總河北東路兵馬。
HCH_009_080_000263	十一年，入見，太宗賜坐，慰勞甚久，特遷太子太保，賜衣一襲、馬二匹及鞍轡鎧甲，改元帥右都監。
HCH_009_080_000264	齊國廢，㚖守汴京。
HCH_009_080_000265	熙宗念㚖久勞，降禦書寵異之。
HCH_009_080_000266	天眷三年，罷漢、渤海千戶謀克，以㚖舊臣，獨命依舊世襲千戶。
HCH_009_080_000267	是歲，拜元帥右監軍。
HCH_009_080_000268	宗弼再伐宋，宋人稱臣乞和，遂班師，㚖獨留汴，行元帥府事。
HCH_009_080_000269	皇統三年，加開府儀同三司。
HCH_009_080_000270	八年，進左監軍。
HCH_009_080_000271	天德二年，改右副元帥，兼行台左丞。
HCH_009_080_000272	遷平章行台省事，進行台右丞相，右副元帥如故。
HCH_009_080_000273	海陵疑左副元帥撒離喝，以爲行台左丞相，使㚖伺察之，詔軍事不令撒離喝與聞。
HCH_009_080_000274	撒離喝不知海陵意旨，每與㚖爭軍事不能得，遂與㚖有隙。
HCH_009_080_000275	海陵竟殺撒離喝，召㚖入朝，拜尚書右丞相，封神麓郡王。
HCH_009_080_000276	四年，請老，爲東京留守。
HCH_009_080_000277	貞元三年，拜太傅，領三省事，累封漢國王。
HCH_009_080_000278	十二月，有疾，海陵幸其第問之。
HCH_009_080_000279	是歲，薨，年六十八。
HCH_009_080_000280	海陵親臨哭之，詔有司廢務三日，禁樂三日。
HCH_009_080_000281	其三日當賜三國使館燕，以不賜教坊樂，命左宣徽使敬嗣暉宣諭之。
HCH_009_080_000282	贈太師、晉國王，諡傑忠，遣使護喪歸葬。
HCH_009_080_000283	正隆奪王爵，贈太傅、梁國公。
HCH_009_080_000284	子磐。
HCH_009_080_000285	磐，本名蒲速越，以大臣子累官登州刺史，襲猛安。
HCH_009_080_000286	大定三年，除嵩州刺史，從僕散忠義伐宋有功。
HCH_009_080_000287	五年，召爲符寶郎，遷拱衛直都指揮使。
HCH_009_080_000288	初，磐以伐宋功，進官一階，磐心少之，頗形於言。
HCH_009_080_000289	上聞之，下吏按問，杖一百五十，改左衛將軍。
HCH_009_080_000290	詔求良弓，磐多自取，及護衛入直者，輒以己意更代。
HCH_009_080_000291	護衛婁室告其事，詔點檢司詰問。
HCH_009_080_000292	磐有妹在宮中爲寶林，磐屬內侍僧兒員思忠使言于寶林曰：「我無罪，問事者迫我，使自誣服。」
HCH_009_080_000293	寶林訴於上，上怒，杖僧兒一百，磐責隴州防禦使。
HCH_009_080_000294	上戒之曰：「汝在近密，執迷自用，朕以卿父之功，不忍廢棄，姑令補外，其思勉之。」
HCH_009_080_000295	改亳州防禦使，遷武甯軍節度使，坐事除名。
HCH_009_080_000296	起爲韓州刺史。
HCH_009_080_000297	改祁州刺史，復坐事，削四官，解職。
HCH_009_080_000298	久之，尚書省奏「大磐以年當敘」，上曰：「剛暴之人，屢冒刑章，不可復用。太傅大㚖，別無嫡嗣，其世襲猛安謀克，不可易也。」
HCH_009_080_000299	阿離補，宗室子，系出景祖。
HCH_009_080_000300	屢從征伐，滅遼舉宋皆有功。
HCH_009_080_000301	天會九年，睿宗經略陝西，阿離補爲左翼都統，與右翼都統宗弼撫定鞏、洮、河、西寧、蘭、廓等州軍，來賓、定遠、和政、甘峪、甯洮、安隴等城寨，及鎮、堡、蕃、漢營部四十餘處，漢官軍民蕃部酋長甚眾，於是涇原、熙河兩路皆平。
HCH_009_080_000302	詔以兄猛安沙離質親管謀克之餘戶，以阿離補爲世襲謀克。
HCH_009_080_000303	天會十二年，爲元帥右都監。
HCH_009_080_000304	十五年，遷左監軍。
