HCH_009_080_000305	天眷三年，從宗弼復河南，遷左副元帥。
HCH_009_080_000306	皇統三年，封譚國公。
HCH_009_080_000307	六年，爲行台左丞相，元帥如故。
HCH_009_080_000308	是歲，薨。
HCH_009_080_000309	大定間，大褒功臣，圖像衍慶宮。
HCH_009_080_000310	歡都死康宗時，不及與馳騖遼、宋之郊，然而異姓之臣莫先焉。
HCH_009_080_000311	故定衍慶亞次功臣：代國公歡都，金源郡王石土門，徐國公渾黜，鄭國公謾都訶，濮國公石古乃，濟國公蒲查，韓國公斜卯阿里，元帥左監軍拔離速，魯國公蒲察石家奴，銀青光祿大夫蒙適，隨國公活女，特進突合速，齊國公婆盧火，開府儀同三司烏延蒲盧渾，儀同三司阿魯補，鎮國上將軍烏林答泰欲，太師領三省事勖，太傅大㚖，大興尹赤盞暉，金吾衛上將軍耶律馬五，驃騎衛上將軍韓常並阿離補鹹著勳焉。
HCH_009_080_000312	子言、方，言別有傳。
HCH_009_080_000313	方以宗室子累官京兆少尹，遷陝西路統軍都監。
HCH_009_080_000314	方專事財賄，不恤軍旅，詔戒之曰：「卿宗室舊人，乃縱肆敗法，惟利是營，朕甚惡之。自今至於後日，萬一爲之，必罰無赦。」
HCH_009_080_000315	大定三年，遷元帥右都監，轉元帥左監軍，改順天軍節度使，上曰：「卿本無功，曆顯仕，不能接僚友，往往交惡，在京兆貪鄙彰聞，至無謂也。朕念卿已過中年，必能悛改，慎勿復爾。」
HCH_009_080_000316	除西南路招討使，朝廷以兵部郎中高通爲招討都監，以佐之。
HCH_009_080_000317	詔通曰：「卿到天德，毋以其官長曲從之也。簡閱沿邊士卒，毋用孱弱之人，毋以僕隸代役。女直舊風，凡酒食會聚，以騎射爲樂。今則弈棋雙陸，宜悉禁止，令習騎射。從其居處之便，亦不可召集擾之。」
HCH_009_080_000318	久之，方坐強買部人馬二匹，削一階，解職，降耀州刺史。
HCH_009_080_000319	通亦坐贓除名。
HCH_009_080_000320	方後遷橫海軍節度使，人爲同簽大宗正事，簽書樞密院事。
HCH_009_080_000321	初，阿魯補當授謀克，未封而薨，烏帶受之。
HCH_009_080_000322	烏帶死，兀答補襲之。
HCH_009_080_000323	兀答補死，烏也阿補當襲。
HCH_009_080_000324	是時，已降海陵爲庶人，世宗以烏帶在熙宗逆黨中，其子孫不合受封，停封者久之，而阿離補功亦不可廢絕，特詔方襲之雲。
HCH_009_080_000325	贊曰：斜卯阿里、突合速、烏延蒲盧渾、赤盞暉、大㚖、阿離補等六人，皆收國以來所謂熊羆之士、不二心之臣也，其功有可錄者焉。
