HCH_012_042_000926	舊治在縣西，嘉靖二十七年徙於今治。
HCH_012_042_000927	南有汧河。
HCH_012_042_000928	隴州元屬鞏昌總帥府。
HCH_012_042_000929	延祐四年十一月省州治汧源縣入州。
HCH_012_042_000930	洪武二年來屬。
HCH_012_042_000931	西北有隴山，上有關曰隴關，亦曰大震關，一名故關，有故關大寨巡檢司。
HCH_012_042_000932	又有安夷關，亦曰新關。
HCH_012_042_000933	又西有小隴山，一名關山。
HCH_012_042_000934	又西南有岍山，汧水出焉。
HCH_012_042_000935	南有吳山，即吳嶽，古文以爲岍山。
HCH_012_042_000936	西南有白環谷，白環水出焉。
HCH_012_042_000937	西有弦蒲藪，汭水出焉，下流合於涇水。
HCH_012_042_000938	南有渭水。
HCH_012_042_000939	西南有方山原。
HCH_012_042_000940	又南有隴安、西南有香泉二巡檢司。
HCH_012_042_000941	東南距府百八十里。
HCH_012_042_000942	漢中府元興元路，屬陝西行省。
HCH_012_042_000943	洪武三年五月爲府。
HCH_012_042_000944	六月改名漢中府。
HCH_012_042_000945	領州一，縣八。
HCH_012_042_000946	東北距布政司九百六十里。
HCH_012_042_000947	南鄭倚。
HCH_012_042_000948	萬曆二十九年十月建瑞王府。
HCH_012_042_000949	西南有巴嶺山，南連孤雲、兩角、米倉諸山，達四川之巴州。
HCH_012_042_000950	南濱漢水，又曰沔水，源自嶓冢，經縣界，下流至湖廣漢陽府入大江。
HCH_012_042_000951	又有沮水，漢水別源也，又西北有褒水，俱流入漢水。
HCH_012_042_000952	南有青石關巡檢司。
HCH_012_042_000953	褒城府西北。
HCH_012_042_000954	洪武十年六月省入南鄭縣，後復置。
HCH_012_042_000955	東北有褒谷，自此出連雲棧，北抵斜谷之道也。
HCH_012_042_000956	南有沔水，即漢水也。
HCH_012_042_000957	又有廉水，又城東有褒水，西南有讓水，一名遜水，下流俱入沔水。
HCH_012_042_000958	北有雞頭關巡檢司。
HCH_012_042_000959	又有虎頭關。
HCH_012_042_000960	西北有漢陽關。
HCH_012_042_000961	城固府東少北。
HCH_012_042_000962	南有漢水。
HCH_012_042_000963	東北有壻水，又名智水，下流入漢水。
HCH_012_042_000964	又西北有黑水，或云即褒水之上源。
HCH_012_042_000965	洋府東南。
HCH_012_042_000966	元洋州。
HCH_012_042_000967	洪武三年降爲縣。
HCH_012_042_000968	十年六月省入西鄉，後復置。
HCH_012_042_000969	北有興勢山。
HCH_012_042_000970	東有黃金谷。
HCH_012_042_000971	南有漢水。
HCH_012_042_000972	西北有壻水，西有灙水，亦曰駱谷水，又東有酉水，俱南入漢。
HCH_012_042_000973	西鄉府東南。
HCH_012_042_000974	東有饒風嶺，有關。
HCH_012_042_000975	北有漢水。
HCH_012_042_000976	東有洋水，即清涼川也，西北合木馬河入漢。
HCH_012_042_000977	東南有鹽場關、西南有大巴山、東北有子午鎮三巡檢司。
HCH_012_042_000978	鳳府西北。
HCH_012_042_000979	元鳳州。
HCH_012_042_000980	洪武七年七月降爲縣。
HCH_012_042_000981	南有武都山。
HCH_012_042_000982	北有嘉陵江，源出縣之嘉陵谷，下流至四川巴縣入於大江。
HCH_012_042_000983	又東有大散水，亦注於嘉陵江。
HCH_012_042_000984	東北有清風閣巡檢司。
HCH_012_042_000985	南有留壩巡檢司，後遷廢丘關，又遷柴關，仍故名。
HCH_012_042_000986	南有仙人關。
HCH_012_042_000987	西有馬嶺關。
HCH_012_042_000988	沔府西。
HCH_012_042_000989	元沔州，屬四川廣元路。
HCH_012_042_000990	洪武三年改屬漢中府，省州治鐸水縣入州。
HCH_012_042_000991	七年七月降爲縣。
HCH_012_042_000992	十年六月省入略陽，後復置。
HCH_012_042_000993	成化二十一年六月屬寧羌州。
HCH_012_042_000994	嘉靖三十八年十一月仍屬府。
HCH_012_042_000995	北有鐵山。
HCH_012_042_000996	東南有定軍山。
HCH_012_042_000997	南有漢水。
HCH_012_042_000998	西有沮水，又有大安水，南入於漢。
HCH_012_042_000999	西南有大安縣，洪武初廢。
HCH_012_042_001000	又西有石頂關。
HCH_012_042_001001	寧羌州本寧羌衛。
HCH_012_042_001002	洪武三十年九月以沔縣之大安地置。
HCH_012_042_001003	成化二十一年六月置州，屬府。
HCH_012_042_001004	東北有五丁山，亦曰金牛峽。
HCH_012_042_001005	北有嶓冢山，漢水出焉，亦曰漾水，下流至湖廣漢陽縣合大江。
HCH_012_042_001006	又東有嘉陵江，西有西漢水合焉。
HCH_012_042_001007	西南有白水，自洮州衛流經此，亦曰葭萌水，有白水關，其下流至四川昭化縣合於嘉陵江。
HCH_012_042_001008	又東北有濜水，流入漾水，謂之濜口。
HCH_012_042_001009	又東有沮水。
HCH_012_042_001010	北有陽平關巡檢司。
HCH_012_042_001011	東北距府三百里。
HCH_012_042_001012	領縣一：略陽州北。
HCH_012_042_001013	元屬沔州。
HCH_012_042_001014	洪武三年屬府。
HCH_012_042_001015	成化二十一年六月改來屬。
HCH_012_042_001016	西有盤龍山。
HCH_012_042_001017	東南有飛仙嶺，棧道所經也。
HCH_012_042_001018	東有沮水，爲漢水之別源。
HCH_012_042_001019	南有嘉陵江，西北有犀牛江，即西漢水也。
HCH_012_042_001020	又西有白水江。
HCH_012_042_001021	東北有九股樹、西有罝口二巡檢司。
HCH_012_042_001022	又西北有白水鎮巡檢司，後廢。
HCH_012_042_001023	延安府元延安路，屬陝西行省。
HCH_012_042_001024	洪武二年五月爲府。
HCH_012_042_001025	領州三，縣十六。
HCH_012_042_001026	南距布政司七百四十里。
HCH_012_042_001027	膚施倚。
HCH_012_042_001028	東有延水，又有清化水流入焉。
HCH_012_042_001029	安塞府西北。
HCH_012_042_001030	西有洛水。
HCH_012_042_001031	北有延水，出縣西北之蘆關嶺，又東南有西川水，北有金明川，俱流入焉。
HCH_012_042_001032	又北有塞門守禦千戶所，洪武十二年置。
HCH_012_042_001033	西南有敷政巡檢司。
HCH_012_042_001034	甘泉府西南。
HCH_012_042_001035	北有野豬峽。
HCH_012_042_001036	西有洛河，南有伏陸水流入焉。
HCH_012_042_001037	又東北有庫利川。
HCH_012_042_001038	安定府東北。
HCH_012_042_001039	北有高柏山，懷寧河出焉，東流入於無定河。
HCH_012_042_001040	西北有白洛城，洪武三年築。
HCH_012_042_001041	保安府西北。
HCH_012_042_001042	西南有洛河，有吃莫河流入焉。
HCH_012_042_001043	北有大鹽池。
HCH_012_042_001044	又西有靖邊守禦千戶所，隆慶元年二月置。
HCH_012_042_001045	北有順寧巡檢司。
HCH_012_042_001046	宜川府東。
HCH_012_042_001047	南有孟門山，在大河中流。
HCH_012_042_001048	又西南有銀川水，北有汾川水，西南有丹陽諸川，俱流入大河。
HCH_012_042_001049	延川府東少北。
HCH_012_042_001050	東濱大河。
HCH_012_042_001051	北有吐延川，合清澗水，流注於大河。
HCH_012_042_001052	又東北有永寧關，臨河。
HCH_012_042_001053	延長府東。
HCH_012_042_001054	東濱河。
HCH_012_042_001055	南有延水，流入大河。
HCH_012_042_001056	青澗府東北。
HCH_012_042_001057	元屬綏德州。
HCH_012_042_001058	嘉靖四十一年改屬府。
HCH_012_042_001059	東有黃河，東北有無定河流入焉。
HCH_012_042_001060	又西有青澗河。
HCH_012_042_001061	鄜州東有洛水，南與單池水合，又名三川水。
HCH_012_042_001062	西有直羅巡檢司。
HCH_012_042_001063	北距府百八十里。
HCH_012_042_001064	領縣三：洛川州東南。
HCH_012_042_001065	西南有洛水。
HCH_012_042_001066	東南有鄜城巡檢司。
HCH_012_042_001067	中部州南。
HCH_012_042_001068	北有橋山，亦曰子午嶺，沮水出焉。
HCH_012_042_001069	西北有谷河及子午水，俱入於沮水。
HCH_012_042_001070	又東北有洛水。
HCH_012_042_001071	宜君州南。
HCH_012_042_001072	西南有玉華山，又有鳳凰谷。
HCH_012_042_001073	東有洛水。
HCH_012_042_001074	東北有沮水。
HCH_012_042_001075	綏德州洪武十年五月省入府，後復置。
HCH_012_042_001076	南有魏平關。
HCH_012_042_001077	東有黃河。
HCH_012_042_001078	城東有無定河，一名奢延水，亦曰水，西北有大理水流入焉。
HCH_012_042_001079	東北有官菜園渡口巡檢司。
HCH_012_042_001080	西南距府三百六十里。
HCH_012_042_001081	領縣一：米脂州北。
HCH_012_042_001082	西有無定河。
HCH_012_042_001083	有大理水，又有小理水，西北有明堂川，俱流入無定河。
HCH_012_042_001084	北有碎金鎮、西南有克戎寨二巡檢司。
HCH_012_042_001085	又西有銀州關，成化七年修築。
HCH_012_042_001086	葭州洪武七年十一月降爲縣，屬綏德州。
HCH_012_042_001087	十三年十一月復升爲州，屬府。
HCH_012_042_001088	東濱大河，西有葭蘆河，城東有真鄉川流合焉。
HCH_012_042_001089	西南距府五百八十里。
HCH_012_042_001090	領縣三：吳堡州南。
HCH_012_042_001091	元屬州。
HCH_012_042_001092	洪武七年十一月改屬綏德，尋省。
HCH_012_042_001093	十三年十一月復置，還屬。
HCH_012_042_001094	東濱河。
HCH_012_042_001095	神木州北。
HCH_012_042_001096	洪武初省。
HCH_012_042_001097	十三年十一月復置。
HCH_012_042_001098	西北有楊家城，正統五年移縣治焉。
HCH_012_042_001099	成化中，復還故治。
HCH_012_042_001100	南有大河。
HCH_012_042_001101	北有濁輪川。
HCH_012_042_001102	西南有屈野川。
HCH_012_042_001103	府谷州東北。
HCH_012_042_001104	洪武初省。
HCH_012_042_001105	十三年十一月復置。
HCH_012_042_001106	東濱大河，北有清水川入焉。
HCH_012_042_001107	慶陽府元屬鞏昌總帥府。
HCH_012_042_001108	洪武二年五月直隸行省。
HCH_012_042_001109	領州一，縣四。
HCH_012_042_001110	東南距布政司五百七十里。
HCH_012_042_001111	安化倚。
HCH_012_042_001112	洪武二十四年四月建慶王府。
HCH_012_042_001113	二十六年遷於寧夏衛。
HCH_012_042_001114	元省。
HCH_012_042_001115	洪武中復置。
HCH_012_042_001116	東北有白於山，洛水所出。
HCH_012_042_001117	又城東有東河，西有西河，流合焉，下流爲馬蓮河。
HCH_012_042_001118	又西有黑水河，源出縣北之太白山，下流至長武縣合於涇河。
HCH_012_042_001119	東北有槐安、北有定邊二巡檢司。
HCH_012_042_001120	又西南有驛馬關、又有靈州、又有大鹽池三巡檢司，廢。
HCH_012_042_001121	合水府東南。
HCH_012_042_001122	東有建水，西有北岔河，流合焉，謂之合水，西南入馬蓮河。
HCH_012_042_001123	又東北有華池水，有平戎川流合焉，東入鄜州之洛河。
HCH_012_042_001124	有華池巡檢司。
HCH_012_042_001125	環府西北。
HCH_012_042_001126	元環州，屬鞏昌總帥府。
HCH_012_042_001127	洪武初，降爲縣，來屬。
HCH_012_042_001128	西有環河，出縣北青岡峽，下流爲府城之西河。
HCH_012_042_001129	又南有黑水河，又有鹼河，西南有甘河，俱注於環河。
HCH_012_042_001130	又西有葫蘆泉。
HCH_012_042_001131	西北有清平關。
HCH_012_042_001132	西北有安邊守禦千戶所，弘治中置。
HCH_012_042_001133	真寧府東南。
HCH_012_042_001134	元屬寧州。
HCH_012_042_001135	萬曆二十九年改屬府。
HCH_012_042_001136	西有馬蓮河。
HCH_012_042_001137	南有大陵、小陵諸水，即九陵川之上源也。
HCH_012_042_001138	東有雕山嶺巡檢司。
HCH_012_042_001139	寧州元屬鞏昌總帥府。
HCH_012_042_001140	洪武中來屬。
HCH_012_042_001141	東有橫嶺，又有九龍川，亦曰寧江，亦曰九陵川，西南流，會上流羣川，而南注於涇河。
HCH_012_042_001142	東北有襄樂巡檢司。
HCH_012_042_001143	北距府百五十里。
HCH_012_042_001144	平涼府元屬鞏昌總帥府。
HCH_012_042_001145	洪武三年五月直隸行省。
HCH_012_042_001146	領州三，縣七。
HCH_012_042_001147	東南距布政司六百五十里。
HCH_012_042_001148	平涼倚。
HCH_012_042_001149	洪武二十四年建安王府。
HCH_012_042_001150	永樂十五年除。
HCH_012_042_001151	二十二年，韓王府自遼東開原遷此。
HCH_012_042_001152	西南有可藍山。
HCH_012_042_001153	西有崆峒山。
HCH_012_042_001154	又有笄頭山，涇水出焉，下流至高陵縣入渭。
HCH_012_042_001155	又西有橫河，東有湫峪河，俱流入涇河。
HCH_012_042_001156	又西有羣牧監。
HCH_012_042_001157	洪武三十年置陝西行太僕寺。
HCH_012_042_001158	永樂四年置陝西苑馬寺，領長樂等六監，開成等二十四苑，俱在本府及慶陽、鞏昌境內。
HCH_012_042_001159	正統三年又並甘肅苑馬寺入焉。
HCH_012_042_001160	又東有通梢關。
HCH_012_042_001161	崇信府東南。
HCH_012_042_001162	北有汭水。
HCH_012_042_001163	西南有赤城川，南有白石川流合焉。
HCH_012_042_001164	下流合於涇水。
HCH_012_042_001165	華亭府南。
HCH_012_042_001166	西有小隴山。
HCH_012_042_001167	西北有瓦亭山，有瓦亭關巡檢司，所謂東瓦亭也。
HCH_012_042_001168	東北有涇河。
HCH_012_042_001169	東南有汭水。
HCH_012_042_001170	又東南有三鄉鎮，北有馬鋪嶺二巡檢司。
HCH_012_042_001171	鎮原府東北。
HCH_012_042_001172	元鎮原州，屬鞏昌總帥府。
HCH_012_042_001173	洪武初，降爲縣，來屬。
HCH_012_042_001174	西北有胡盧河，分二流，一北注於黃河，其支流東南注於涇河。
HCH_012_042_001175	南有高平川，流入胡盧河。
HCH_012_042_001176	西有安平寨巡檢司。
HCH_012_042_001177	西北有蕭關。
HCH_012_042_001178	西南有木峽關。
HCH_012_042_001179	又西有石峽關。
HCH_012_042_001180	南有驛藏、木靖二關。
HCH_012_042_001181	隆德府西南。
HCH_012_042_001182	元屬靖寧州。
HCH_012_042_001183	嘉靖三十八年十一月改屬府。
HCH_012_042_001184	東有好水，西流與苦水合。
HCH_012_042_001185	西北有武延川，流入好水。
HCH_012_042_001186	東南有捺龍川，流入苦水。
HCH_012_042_001187	涇州元直隸陝西行省。
HCH_012_042_001188	洪武三年以州治涇川縣省入，來屬。
HCH_012_042_001189	舊治在涇水北。
HCH_012_042_001190	今治本皇甫店，洪武三年徙於此。
HCH_012_042_001191	北有涇河，有汭水。
HCH_012_042_001192	東有金家凹巡檢司。
HCH_012_042_001193	西北距府百五十里。
HCH_012_042_001194	領縣一：靈臺州東南。
HCH_012_042_001195	西北有白石原。
HCH_012_042_001196	東北有三香水，一名三交川，下流至邠州合涇水。
HCH_012_042_001197	又西南有細川水，東北流合於三交川。
HCH_012_042_001198	靜寧州元屬鞏昌總帥府。
HCH_012_042_001199	洪武中來屬。
HCH_012_042_001200	南有隴山。
HCH_012_042_001201	北有橫山，即隴山支阜。
HCH_012_042_001202	南有水洛川，一名石門水，下流至秦州入略陽川。
HCH_012_042_001203	又西有苦水河，即高平川之上源。
HCH_012_042_001204	東距府二百三十里。
HCH_012_042_001205	領縣一：莊浪州東南。
HCH_012_042_001206	元莊浪州，直隸陝西行省。
HCH_012_042_001207	洪武三年屬鳳翔府。
HCH_012_042_001208	八年三月降爲縣，來屬。
HCH_012_042_001209	西有苦水川。
HCH_012_042_001210	固原州本固原守禦千戶所，景泰三年以故原州城置。
HCH_012_042_001211	成化四年升爲衛。
HCH_012_042_001212	弘治十五年置州，屬府。
HCH_012_042_001213	西南有六盤山，上有六盤關，東北有清水河出焉，下流合鎮原縣之胡盧河。
HCH_012_042_001214	又北有黑水，北流入於大河。
HCH_012_042_001215	又東西有二朝那湫，其下流注於高平川。
HCH_012_042_001216	南有開成州，元直隸陝西行省，治開成縣。
HCH_012_042_001217	洪武二年省州，以縣屬平涼府。
HCH_012_042_001218	成化三年廢縣。
HCH_012_042_001219	又東南有廣安州，元屬開成州，洪武二年省。
HCH_012_042_001220	又西有甘州羣牧所，永樂中置。
HCH_012_042_001221	又西北有西安守禦千戶所，成化五年以舊西安州置。
HCH_012_042_001222	北有鎮戎守禦千戶所，成化十二年以葫蘆峽城置。
HCH_012_042_001223	東北有平虜守禦千戶所，弘治十四年以舊豫望城置。
HCH_012_042_001224	又北有下馬關，嘉靖五年置。
HCH_012_042_001225	東南距府百七十里。
HCH_012_042_001226	鞏昌府元屬鞏昌總帥府。
HCH_012_042_001227	洪武二年四月直隸行省。
HCH_012_042_001228	領州三，縣十四。
HCH_012_042_001229	東距布政司千六十里。
HCH_012_042_001230	隴西倚。
HCH_012_042_001231	西有首陽山，上有關。
HCH_012_042_001232	北濱渭水，東有赤亭水，西流入焉。
HCH_012_042_001233	安定府北。
HCH_012_042_001234	元定西州，屬鞏昌總帥府。
HCH_012_042_001235	至正十二年三月改名安定州。
HCH_012_042_001236	洪武十年降爲縣，屬府。
HCH_012_042_001237	北有車道峴。
HCH_012_042_001238	西有西河，東有東河，流合焉。
HCH_012_042_001239	北有巉口巡檢司。
HCH_012_042_001240	會寧府東北。
HCH_012_042_001241	元會州，屬鞏昌總帥府。
HCH_012_042_001242	至正十二年三月改爲會寧州。
HCH_012_042_001243	洪武十年降爲縣，屬府。
HCH_012_042_001244	東有響水，北流入大河。
HCH_012_042_001245	東有青家巡檢司。
HCH_012_042_001246	通渭府東北。
HCH_012_042_001247	北濱渭，西有華川，東流入焉。
HCH_012_042_001248	漳府南。
HCH_012_042_001249	西南有故城。
HCH_012_042_001250	今治，正統中所徙。
HCH_012_042_001251	西北有西傾山。
HCH_012_042_001252	南有漳水，北流入渭。
HCH_012_042_001253	東南有鹽井。
HCH_012_042_001254	寧遠府東。
HCH_012_042_001255	南有太陽山，舊產鐵。
HCH_012_042_001256	北有桃花峽，兩山夾峙，渭水經其中。
HCH_012_042_001257	西有廣吳水，又有山丹水，俱源出岷州，並流北注渭。
HCH_012_042_001258	伏羌府東。
HCH_012_042_001259	西南有硃圉山，俗名白崖山。
HCH_012_042_001260	北有渭水，西南有永寧河，西有洛門川，俱東北注於渭。
HCH_012_042_001261	西和府東南。
HCH_012_042_001262	元西和州，屬鞏昌總帥府。
HCH_012_042_001263	洪武十年降爲縣，屬府。
HCH_012_042_001264	舊治在西南白石鎮，洪武中，移於今治。
HCH_012_042_001265	北有祁山。
HCH_012_042_001266	南有黑谷山，上有關。
HCH_012_042_001267	西北有西漢水，亦曰鹽官水。
HCH_012_042_001268	西南有濁水，即白硃江也。
HCH_012_042_001269	東北有鹽井。
HCH_012_042_001270	成府東南。
HCH_012_042_001271	元成州，屬鞏昌總帥府。
HCH_012_042_001272	洪武十年降爲縣，屬府。
HCH_012_042_001273	西北有仇池山。
HCH_012_042_001274	東南有西漢水。
HCH_012_042_001275	西南有濁水，又西有建安水，又有洛谷川，俱流入西漢水。
HCH_012_042_001276	又東有泥陽水，下流至徽州界入嘉陵江。
HCH_012_042_001277	又北有黃渚關巡檢司。
HCH_012_042_001278	秦州元屬鞏昌總帥府。
HCH_012_042_001279	洪武二年屬府，省州治成紀縣入州。
HCH_012_042_001280	西南有嶓冢山，西漢水出焉，下流至寧羌州合嘉陵江。
HCH_012_042_001281	東北有渭水，有秦水東流入渭。
HCH_012_042_001282	又西有西谷水，下流入西漢水。
HCH_012_042_001283	又南有籍水，西南有段谷水流入焉。
HCH_012_042_001284	又東有長離水，即瓦亭川下流也，俱流入於渭。
HCH_012_042_001285	南有高橋巡檢司。
HCH_012_042_001286	又有石榴關。
HCH_012_042_001287	又有現子關。
HCH_012_042_001288	西距府三百里。
HCH_012_042_001289	領縣三：秦安州北。
HCH_012_042_001290	東有大隴山。
HCH_012_042_001291	又東北有瓦亭山，所謂西瓦亭也。
HCH_012_042_001292	城南有渭水。
HCH_012_042_001293	又西有隴水，瓦亭川自東北流合焉。
HCH_012_042_001294	又東有鬆多川，下流入於秦水。
HCH_012_042_001295	又東有隴城關巡檢司。
HCH_012_042_001296	清水州東。
HCH_012_042_001297	東有隴山，有盤嶺巡檢司。
HCH_012_042_001298	西南又有小隴山。
HCH_012_042_001299	西有渭水。
HCH_012_042_001300	東有秦水，南有清水流入焉。
HCH_012_042_001301	禮州西南。
HCH_012_042_001302	元禮店文州軍民元帥府，屬吐蕃宣慰司。
HCH_012_042_001303	洪武四年十一月置禮店千戶所。
HCH_012_042_001304	十一年屬岷州衛。
HCH_012_042_001305	十五年改屬秦州衛。
HCH_012_042_001306	成化九年十二月置禮縣於所城，屬州。
HCH_012_042_001307	故城在東。
HCH_012_042_001308	洪武四年移於今治。
HCH_012_042_001309	東南有西漢水。
HCH_012_042_001310	西南有岷峨山，岷江出焉，東南流入階州界合於西漢水。
HCH_012_042_001311	又西有漩水鎮、南有板橋山二巡檢司。
HCH_012_042_001312	階州元屬鞏昌總帥府。
HCH_012_042_001313	洪武四年降爲縣，屬府。
HCH_012_042_001314	十年六月復爲州。
HCH_012_042_001315	舊城在東南坻龍岡上。
HCH_012_042_001316	今城，洪武五年所置。
HCH_012_042_001317	北有白水江。
HCH_012_042_001318	東北有犀牛江，即西漢水也。
HCH_012_042_001319	又西北有羌水，下流合白水江。
HCH_012_042_001320	又東有七防關巡檢司。
HCH_012_042_001321	西北距府八百里。
HCH_012_042_001322	領縣一：文州東南。
HCH_012_042_001323	元文州。
HCH_012_042_001324	至元九年十月置，屬吐蕃宣慰司。
HCH_012_042_001325	洪武四年降爲縣，屬府。
HCH_012_042_001326	十年六月改屬州。
HCH_012_042_001327	二十三年三月省。
HCH_012_042_001328	成化九年十二月復置，仍屬州。
HCH_012_042_001329	東南有青唐嶺，路入四川龍安府。
HCH_012_042_001330	東有白水，西有黑水，流合焉。
HCH_012_042_001331	又北有羌水，一名太白水。
HCH_012_042_001332	東有文縣守禦千戶所，本文州番漢千戶所，洪武四年四月置。
HCH_012_042_001333	二十三年改文縣守禦軍民千戶所。
HCH_012_042_001334	成化九年更今名。
HCH_012_042_001335	又東有玉壘關。
HCH_012_042_001336	西北有臨江關。
HCH_012_042_001337	徽州元屬鞏昌總帥府。
HCH_012_042_001338	洪武十年六月降爲縣，屬府，後復升爲州。
HCH_012_042_001339	東南有鐵山。
HCH_012_042_001340	南有嘉陵江，又有河池水流入焉。
HCH_012_042_001341	又南有虞關巡檢司。
HCH_012_042_001342	西南有小河關。
HCH_012_042_001343	西北距府四百八十里。
HCH_012_042_001344	領縣一：兩當州東。
HCH_012_042_001345	洪武十年六月省入徽縣，後復置，屬州。
HCH_012_042_001346	南有嘉陵江。
HCH_012_042_001347	臨洮府元臨洮府，屬鞏昌總帥府。
HCH_012_042_001348	泰定元年九月改爲臨兆路。
HCH_012_042_001349	洪武二年九月仍爲府。
HCH_012_042_001350	領州二，縣三。
HCH_012_042_001351	南距布政司千二百六十里。
HCH_012_042_001352	狄道倚。
HCH_012_042_001353	西南有常家山，與西傾山相接。
HCH_012_042_001354	北有馬寒山，浩尾河出於其北，阿幹河出於其南，俱東流入大河。
HCH_012_042_001355	又西南有洮河，自洮州衛流入。
HCH_012_042_001356	又東有東峪河，南有邦金川，皆流會洮河。
HCH_012_042_001357	北有摩雲嶺巡檢司。
HCH_012_042_001358	又北有打壁峪關，有結河關。
HCH_012_042_001359	南有南關，有下襯關，有八角關、十八盤關。
HCH_012_042_001360	西有三坌關，有分水嶺關。
HCH_012_042_001361	渭源府東少南。
HCH_012_042_001362	西有南谷山，渭水所出。
HCH_012_042_001363	又有鳥鼠山，渭水所經，東至華陰縣入大河。
HCH_012_042_001364	又西有分水嶺，東流者入渭，西流者入洮，上有分水嶺關巡檢司。
HCH_012_042_001365	又西南有五竹山，清源河出焉，逕縣東南入渭。
HCH_012_042_001366	蘭州元屬鞏昌總帥府。
HCH_012_042_001367	洪武二年九月降爲縣，來屬。
HCH_012_042_001368	成化十三年九月復爲州。
HCH_012_042_001369	建文元年，肅王府自甘州衛遷此。
HCH_012_042_001370	南有皋蘭山。
HCH_012_042_001371	北濱大河，所謂金城河也，湟水自西，洮水、阿幹河俱自南，先後流入焉。
HCH_012_042_001372	又西南有灕水，合於洮水。
HCH_012_042_001373	北有金城關，下有鎮遠浮橋，有河橋巡檢司。
HCH_012_042_001374	西北有京玉關，南有阿幹鎮關。
HCH_012_042_001375	西南有鳳林關。
HCH_012_042_001376	南距府二百十里。
HCH_012_042_001377	領縣一：金州東少南。
HCH_012_042_001378	元金州，屬鞏昌總帥府。
HCH_012_042_001379	洪武二年九月降爲縣，屬府。
HCH_012_042_001380	成化十三年改屬州。
HCH_012_042_001381	舊城在南，洪武中，移於今治。
HCH_012_042_001382	北有大河，東北流亂山中，入靖虜衛界。
HCH_012_042_001383	又南有浩尾河，一名閃門河，入於大河。
HCH_012_042_001384	東北有一條城，萬曆二十五年置。
HCH_012_042_001385	河州元河州路，屬吐蕃宣慰司。
HCH_012_042_001386	洪武四年正月置河州衛，屬西安都衛。
HCH_012_042_001387	六年正月置河州府，屬陝西行中書省。
HCH_012_042_001388	七年七月置西安行都衛於此，領河州、朵甘、烏斯藏三衛。
HCH_012_042_001389	八年十月改行都衛爲陝西行都指揮使司。
HCH_012_042_001390	九年十二月，行都指揮使司廢，衛屬陝西都指揮使司。
HCH_012_042_001391	十年分衛爲左右。
