HCH_012_042_000001	河南《禹貢》豫、冀、揚、兗四州之域。
HCH_012_042_000002	元以河北地直隸中書省，河南地置河南江北行中書省。
HCH_012_042_000003	治汴梁路。
HCH_012_042_000004	洪武元年五月置中書分省。
HCH_012_042_000005	治開封府。
HCH_012_042_000006	二年四月改分省爲河南等處行中書省。
HCH_012_042_000007	三年十二月置河南都衛。
HCH_012_042_000008	八年十月改都衛爲都指揮使司。
HCH_012_042_000009	九年六月改行中書省爲承宣布政使司。
HCH_012_042_000010	府八，直隸州一，屬州十一，縣九十六。
HCH_012_042_000011	爲裏三千八百八十有奇。
HCH_012_042_000012	北至武安，與北直、山西界。
HCH_012_042_000013	南至信陽，與江南、湖廣界。
HCH_012_042_000014	東至永城，與山東、江南界。
HCH_012_042_000015	西至陝州，與山西、陝西界。
HCH_012_042_000016	距南京一千一百七十五里，京師一千五百八十里。
HCH_012_042_000017	洪武二十六年編戶三十一萬五千六百一十七，口一百九十一萬二千五百四十二。
HCH_012_042_000018	弘治四年，戶五十七萬五千二百四十九，口四百三十六萬四百七十六。
HCH_012_042_000019	萬曆六年，戶六十三萬三千六十七，口五百一十九萬三千六百二。
HCH_012_042_000020	開封府元汴梁路，屬河南江北行省。
HCH_012_042_000021	洪武元年五月曰開封府。
HCH_012_042_000022	八月建北京。
HCH_012_042_000023	十一年，京罷。
HCH_012_042_000024	領州四，縣三十：祥符倚。
HCH_012_042_000025	洪武十一年正月建周王府。
HCH_012_042_000026	大河舊在城北。
HCH_012_042_000027	正統十三年，河決滎陽，東過城西南，而城遂在河北。
HCH_012_042_000028	東爲開封縣，元時同治郭內，洪武中省。
HCH_012_042_000029	南有硃仙鎮。
HCH_012_042_000030	東北有陳橋鎮。
HCH_012_042_000031	陳留府東少南。
HCH_012_042_000032	北有大河。
HCH_012_042_000033	東北有睢水，下流至南直宿遷縣合泗水。
HCH_012_042_000034	杞府東南。
HCH_012_042_000035	北有睢水，又有舊黃河，洪武二十五年河決之故道也。
HCH_012_042_000036	嘉靖三十六年，全河合淮入海，而縣遂無河患。
HCH_012_042_000037	通許府東南。
HCH_012_042_000038	西南有故黃河，弘治後北徙，不經縣界。
HCH_012_042_000039	太康府東南。
HCH_012_042_000040	北有渦水，自通許縣流入，下流至南直懷遠縣入淮。
HCH_012_042_000041	東有馬廠集，正統十三年河決，自杞縣經此。
HCH_012_042_000042	尉氏府南少西。
HCH_012_042_000043	西南有大溝，東北合康溝，入於黃河。
HCH_012_042_000044	洧川府西南。
HCH_012_042_000045	南有故城，洪武二年以河患遷今治。
HCH_012_042_000046	又南有洧水，下流至西華縣合潁水。
HCH_012_042_000047	東南有南席店，弘治九年，河入慄家口，南行經此。
HCH_012_042_000048	鄢陵府南少西。
HCH_012_042_000049	北有洧水。
HCH_012_042_000050	扶溝府南少東。
HCH_012_042_000051	東有沙河，一名惠民河，又名小黃河，即宋蔡河故道也。
HCH_012_042_000052	成化中浚，下流達南直太和縣界。
HCH_012_042_000053	又北有洧水，自西流入焉。
HCH_012_042_000054	又東北有黃河故道，弘治二年淤。
HCH_012_042_000055	中牟府西。
HCH_012_042_000056	東有故城，天順中，徙今治。
HCH_012_042_000057	大河在縣北。
HCH_012_042_000058	又有汴河，舊自滎陽而東，下流經祥符縣南，又東南至南直泗州入於淮。
HCH_012_042_000059	正統六年改從此入河，後淤。
HCH_012_042_000060	西北有圃田澤。
HCH_012_042_000061	陽武府西北。
HCH_012_042_000062	北濱大河，自此至南直徐州，大河所行，皆唐、宋汴河故道。
HCH_012_042_000063	原武府西北。
HCH_012_042_000064	北有黑陽山，下臨大河。
HCH_012_042_000065	洪武二十四年，河決於此。
HCH_012_042_000066	正統十二年復決焉。
HCH_012_042_000067	東南有安城縣，洪武初置，正統中廢。
HCH_012_042_000068	封丘府北。
HCH_012_042_000069	南有大河。
HCH_012_042_000070	西南有荊隆口，一名金龍口。
HCH_012_042_000071	弘治二年、五年，萬曆十五年，崇禎四年、五年，河屢決於此。
HCH_012_042_000072	又西北有沁河，弘治六年淤。
HCH_012_042_000073	西南有中欒鎮巡檢司。
HCH_012_042_000074	延津府西北。
HCH_012_042_000075	大河舊經縣北。
HCH_012_042_000076	成化十四年，河決，徙流縣南，而縣北之流遂絕。
HCH_012_042_000077	西北有沙門鎮，弘治十一年移項城縣西之香臺巡檢司於此。
HCH_012_042_000078	蘭陽府東少北。
HCH_012_042_000079	北濱大河，有李景高口。
HCH_012_042_000080	萬曆十七年，河決於此。
HCH_012_042_000081	儀封府東少北。
HCH_012_042_000082	元屬睢州。
HCH_012_042_000083	洪武十年五月改屬南陽府，後來屬。
HCH_012_042_000084	故城在縣北，洪武二十二年二月圮於河，徙日樓村，即今治也。
HCH_012_042_000085	東北有黃陵岡，大河舊經其下，入曹縣界。
HCH_012_042_000086	弘治五年，河決於此，尋塞之，改徙岡南入睢州界。
HCH_012_042_000087	又賈魯故河亦在縣北，正德四年，河決入焉。
HCH_012_042_000088	新鄭府西南。
HCH_012_042_000089	元屬均州。
HCH_012_042_000090	隆慶五年七月改屬。
HCH_012_042_000091	西南有大隗山，一名具茨山，潩水出焉，一名魯固河，下流入潁。
HCH_012_042_000092	又南有陘山。
HCH_012_042_000093	北有大河。
HCH_012_042_000094	又有溱水，一曰澮水，流合縣南之洧水。
HCH_012_042_000095	陳州洪武初，以州治宛丘縣省入。
HCH_012_042_000096	南有潁水。
HCH_012_042_000097	又西有沙水，亦曰小黃河，至潁岐口，與潁水合，下流分爲二。
HCH_012_042_000098	崇禎間，屢決於西南之苑家埠口。
HCH_012_042_000099	又南有故黃河，喜靖時，黃河南出之道也。
HCH_012_042_000100	西北距府二百六十五里。
HCH_012_042_000101	領縣四：商水州西南。
HCH_012_042_000102	洪武初廢。
HCH_012_042_000103	四年七月復置。
HCH_012_042_000104	北有潁水，又有㶏水，亦曰大㶏水。
HCH_012_042_000105	西華州西少北。
HCH_012_042_000106	北有潁水，又有沙水，即小黃河也。
HCH_012_042_000107	西南有㶏水，又有常社鎮巡檢司。
HCH_012_042_000108	項城州南。
HCH_012_042_000109	東北有故城。
HCH_012_042_000110	今治本南頓縣之殄寇鎮也，宣德三年遷。
HCH_012_042_000111	東有潁水，西有溵水流入焉。
HCH_012_042_000112	洪武二十四年，大河自陳州經縣界合潁，下入於淮。
HCH_012_042_000113	永樂九年，河始復故道。
HCH_012_042_000114	又東北有沙水。
HCH_012_042_000115	沈丘州東南。
HCH_012_042_000116	元屬潁州。
HCH_012_042_000117	洪武初廢。
HCH_012_042_000118	弘治十年改乳香臺巡檢司置，來屬。
HCH_012_042_000119	東北有潁水，東入南直潁州界。
HCH_012_042_000120	又北有沙河，東入南直太和縣界。
HCH_012_042_000121	又東有界首巡檢司。
HCH_012_042_000122	又北有南頓縣，洪武初廢。
HCH_012_042_000123	景泰初，置南頓巡檢司於此。
HCH_012_042_000124	許州洪武初，以州治長社縣省入。
HCH_012_042_000125	西有潁水。
HCH_012_042_000126	北有潩水。
HCH_012_042_000127	又東有東湖，一名秋湖。
HCH_012_042_000128	又西北有石固鎮，與長葛縣界。
HCH_012_042_000129	東北距府二百二十里。
HCH_012_042_000130	領縣四：臨潁州東南。
HCH_012_042_000131	西有潁水，潩水自縣北流入焉。
HCH_012_042_000132	又西南有小㶏水。
HCH_012_042_000133	襄城州西南。
HCH_012_042_000134	南有首山。
HCH_012_042_000135	東北有潁水。
HCH_012_042_000136	南有汝河。
HCH_012_042_000137	郾城州東南。
HCH_012_042_000138	南有沙水，亦曰大溵水，上流即故汝水也，又東南有澧水來入焉。
HCH_012_042_000139	長葛州西北。
HCH_012_042_000140	北有洧水。
HCH_012_042_000141	西有潩水。
HCH_012_042_000142	禹州元曰鈞州。
HCH_012_042_000143	洪武初，以州治陽翟縣省入。
HCH_012_042_000144	萬曆三年四月避諱改曰禹州。
HCH_012_042_000145	成化二年七月建徽王府。
HCH_012_042_000146	嘉靖三十五年除。
HCH_012_042_000147	北有禹山，又西北有礦山，有鐵母山，舊俱產鐵。
HCH_012_042_000148	又北有潁水，下經襄城，一名渚水，至臨潁合沙河。
HCH_012_042_000149	東北距府三百二十里。
HCH_012_042_000150	領縣一：密州西北。
HCH_012_042_000151	南有洧水，又有溱水。
HCH_012_042_000152	鄭州洪武初，以州治管城縣省入。
HCH_012_042_000153	西南有梅山，鄭水出焉，下流舊入汴水，後堙。
HCH_012_042_000154	又西有須水，源出滎陽縣，舊亦入於汴水。
HCH_012_042_000155	正統八年嘗浚以分決河之流，後亦堙。
HCH_012_042_000156	東北距府百四十里。
HCH_012_042_000157	領縣四：滎陽州西。
HCH_012_042_000158	南有大周山，汴水出焉。
HCH_012_042_000159	又東南有嵩渚山，京水出焉。
HCH_012_042_000160	又有索水，源出小徑山，北流與京水合，下流入於鄭水。
HCH_012_042_000161	又大河在北。
HCH_012_042_000162	東有須水鎮，崇禎十年築城。
HCH_012_042_000163	滎澤州北少西。
HCH_012_042_000164	元直隸汴梁路。
HCH_012_042_000165	洪武中，改屬州。
HCH_012_042_000166	北有故城。
HCH_012_042_000167	洪武八年因河患徙於南。
HCH_012_042_000168	成化十五年正月又徙北，濱大河。
HCH_012_042_000169	東南有孫家渡，正統十三年，大河決於此。
HCH_012_042_000170	河陰州西北。
HCH_012_042_000171	舊治在大峪口，洪武三年爲水所圮，徙於此。
HCH_012_042_000172	東北有廣武山，與三皇山連。
HCH_012_042_000173	西有敖倉，北濱大河。
HCH_012_042_000174	汜水州西。
HCH_012_042_000175	故城在縣東，洪武十一年七月徙於成皋。
HCH_012_042_000176	崇禎十六年又遷西北。
HCH_012_042_000177	北濱河，洛水自西，東至滿家溝合汜水入焉。
HCH_012_042_000178	又西有虎牢關，洪武四年九月改曰古崤關，有巡檢司。
HCH_012_042_000179	河南府元河南府路，屬河南江北行中書省。
HCH_012_042_000180	洪武元年爲府。
HCH_012_042_000181	領州一，縣十三。
HCH_012_042_000182	東距布政司三百八十里。
HCH_012_042_000183	洛陽倚。
HCH_012_042_000184	洪武二十四年建伊王府。
HCH_012_042_000185	嘉靖四十三年廢。
HCH_012_042_000186	萬曆二十九年十月建福王府。
HCH_012_042_000187	北有北邙山，西南有闕塞山，亦曰闕口山，亦曰伊闕山，俗曰龍門山。
HCH_012_042_000188	又西北有谷城山，亦曰簪亭山，湹水所出。
HCH_012_042_000189	又東南有大谷，谷口有關。
HCH_012_042_000190	又大河在北。
HCH_012_042_000191	又有洛水，源自洛南冢嶺山，東經盧氏、永寧諸縣，至洛陽、偃師、鞏縣入於河。
HCH_012_042_000192	又東有伊水，自盧氏縣東北流至偃師縣而入洛。
HCH_012_042_000193	又北有朅水，西有澗水，俱流會於洛。
HCH_012_042_000194	又西南有孝水。
HCH_012_042_000195	偃師府東少北。
HCH_012_042_000196	南有緱氏山。
HCH_012_042_000197	又有洛水，西有伊水流合焉。
HCH_012_042_000198	鞏府東北。
HCH_012_042_000199	西南有軒轅山，上有關。
HCH_012_042_000200	北濱河。
HCH_012_042_000201	西北有洛水，舊經縣北入河，謂之洛汭，亦曰洛口。
HCH_012_042_000202	嘉靖後，東過汜水縣入河。
HCH_012_042_000203	又南有鄩水，會洛入河，亦曰鄩口也。
HCH_012_042_000204	又東南有石子河，西南有長羅川，皆流入洛水。
HCH_012_042_000205	又西南有黑石渡巡檢司。
HCH_012_042_000206	孟津府東北。
HCH_012_042_000207	舊治在縣東，今治本聖賢莊，嘉靖十四年七月遷於此。
HCH_012_042_000208	西北有大河。
HCH_012_042_000209	又西有硤石津，又西有委粟津，又有高渚、馬渚、陶渚，皆大河津濟處。
HCH_012_042_000210	東北有孟津巡檢司。
HCH_012_042_000211	宜陽府西南。
HCH_012_042_000212	西有女幾山。
HCH_012_042_000213	東南有鹿蹄山，一名非山，甘水出焉。
HCH_012_042_000214	又北有洛水。
HCH_012_042_000215	西有宜水，又有昌谷水，與甘水俱流注於洛。
HCH_012_042_000216	又西南有趙保鎮、木冊鎮二巡檢司。
HCH_012_042_000217	永寧府西南。
HCH_012_042_000218	北有崤山，崤水出焉，北注於河。
HCH_012_042_000219	其東曰谷陽谷，谷水所出焉。
HCH_012_042_000220	又南有洛水。
HCH_012_042_000221	東北有刀軒川，下流爲昌谷水。
HCH_012_042_000222	又有大宋川，下流爲宜水。
HCH_012_042_000223	又西有崇陽鎮、又有高門關、東有崤底關三巡檢司。
HCH_012_042_000224	新安府西。
HCH_012_042_000225	西有缺門山。
HCH_012_042_000226	北有大河。
HCH_012_042_000227	又南有澗水，谷水自北流入焉。
HCH_012_042_000228	東有慈澗水，亦流入谷水。
HCH_012_042_000229	又有函谷新關。
HCH_012_042_000230	澠池府西。
HCH_012_042_000231	元屬陝州。
HCH_012_042_000232	洪武中改屬。
HCH_012_042_000233	東北有廣陽山，亦曰澠池山，北溪水出焉。
HCH_012_042_000234	又有白石山，澗水所出。
HCH_012_042_000235	西北濱河。
HCH_012_042_000236	南有谷水。
HCH_012_042_000237	又西北有南村巡檢司。
HCH_012_042_000238	登封府東南。
HCH_012_042_000239	北有嵩山，即中嶽也，亦曰太室山。
HCH_012_042_000240	又西有少室山，潁水中源出焉；又有右源，出於山之南溪，又有左源，出於西南之陽乾山，合流至南直壽州入淮。
HCH_012_042_000241	又北有陽城山，洧水所出，下流至扶溝縣入沙河。
HCH_012_042_000242	又東南有崿嶺，即箕山也，上有崿阪關。
HCH_012_042_000243	又東南有五渡水，流入潁，亦曰三交水。
HCH_012_042_000244	又西南有少陽河，亦流入潁。
HCH_012_042_000245	嵩府西南。
HCH_012_042_000246	元嵩州，屬南陽府。
HCH_012_042_000247	洪武二年四月降爲縣，來屬。
HCH_012_042_000248	三塗山在西南。
HCH_012_042_000249	陸渾山在東北。
HCH_012_042_000250	又東有篩山，北有露寶山，西有大礦山，皆產錫。
HCH_012_042_000251	西南有伏牛山，即天息山也，山有分水嶺，汝水出焉，下流至南直潁州入淮，行千三百五十餘里。
HCH_012_042_000252	又南有伊水，西北有高都川流入焉。
HCH_012_042_000253	又西南有舊縣鎮巡檢司。
HCH_012_042_000254	西有沒大嶺巡檢司。
HCH_012_042_000255	盧氏府西南。
HCH_012_042_000256	元屬嵩州。
HCH_012_042_000257	洪武元年四月屬南陽府。
HCH_012_042_000258	三年三月屬陝州。
HCH_012_042_000259	萬曆初，改屬府。
HCH_012_042_000260	西南有熊耳山，洛水自陝西商州流入境，經此。
HCH_012_042_000261	東南有巒山，一名悶頓嶺，伊水所出。
HCH_012_042_000262	北有鐵嶺，東澗水出焉，東南入洛。
HCH_012_042_000263	又東北有馬回川，亦入於洛。
HCH_012_042_000264	又東南有欒州鎮、西南有硃陽鎮、北有杜管鎮三巡檢司。
HCH_012_042_000265	又西有白華關。
HCH_012_042_000266	陝州元屬河南府路。
HCH_012_042_000267	洪武元年四月改屬南陽府，以州治陝縣省入。
HCH_012_042_000268	東有底柱山，在大河中。
HCH_012_042_000269	山有三門，中曰神門，南曰鬼門，北曰人門，惟人門修廣可行舟，鬼門最險。
HCH_012_042_000270	又南有橐水，一名永定澗，亦曰漫澗，西北入河。
HCH_012_042_000271	又東南有硤石關，有巡檢司。
HCH_012_042_000272	又有雁翎關。
HCH_012_042_000273	東距府三百里。
HCH_012_042_000274	領縣二：靈寶州西少南。
HCH_012_042_000275	北濱河。
HCH_012_042_000276	又西有弘農澗。
HCH_012_042_000277	南有虢略鎮巡檢司。
HCH_012_042_000278	又有函谷故關。
HCH_012_042_000279	西南又有洪關。
HCH_012_042_000280	閿鄉州西南。
HCH_012_042_000281	東南有夸父山，一名秦山，中有大谷關。
HCH_012_042_000282	北濱河，自山西芮城縣流入，東南至永城縣，入南直碭山縣界。
HCH_012_042_000283	西有湖水，又有盤澗水北流入焉。
HCH_012_042_000284	又西有潼關，與陝西華陰縣分界。
HCH_012_042_000285	歸德府元直隸河南江北行省。
HCH_012_042_000286	洪武元年五月降爲州，屬開封府。
HCH_012_042_000287	嘉靖二十四年六月升爲府。
HCH_012_042_000288	領州一，縣八。
HCH_012_042_000289	西距布政司三百五十里。
HCH_012_042_000290	商丘倚。
HCH_012_042_000291	元曰睢陽。
HCH_012_042_000292	洪武初省。
HCH_012_042_000293	嘉靖二十四年六月復置，更名。
HCH_012_042_000294	舊治在南，弘治十五年圮於河，十六年九月遷於今治。
HCH_012_042_000295	北濱河。
HCH_012_042_000296	正統後，河決而南。
HCH_012_042_000297	城嘗在河北，正德後，仍在河南。
HCH_012_042_000298	北有丁家道口巡檢司。
HCH_012_042_000299	東南有武津關巡檢司。
HCH_012_042_000300	寧陵府西。
HCH_012_042_000301	南有睢水。
HCH_012_042_000302	北有桃源集巡檢司。
HCH_012_042_000303	鹿邑府南。
HCH_012_042_000304	元屬亳州。
HCH_012_042_000305	洪武中改屬。
HCH_012_042_000306	南有潁水，又蔡河自西流入，謂之蔡河口，即沈丘縣之沙河也。
HCH_012_042_000307	又北有渦水，東流入南直亳州境。
HCH_012_042_000308	夏邑府東。
HCH_012_042_000309	元曰下邑，洪武初更名。
HCH_012_042_000310	北濱大河。
HCH_012_042_000311	又東南有睢水。
HCH_012_042_000312	永城府東南。
HCH_012_042_000313	洪武元年五月屬開封府。
HCH_012_042_000314	十一月來屬。
HCH_012_042_000315	北有碭山，又有芒山，皆與南直碭山縣界，又睢水、澮水皆在縣南。
HCH_012_042_000316	又南有泡水，弘治間淤塞。
HCH_012_042_000317	虞城府東北。
HCH_012_042_000318	元屬濟寧路。
HCH_012_042_000319	洪武二年正月來屬。
HCH_012_042_000320	南有故城。
HCH_012_042_000321	嘉靖九年遷於今治。
HCH_012_042_000322	北有黃河。
HCH_012_042_000323	睢州元屬汴梁路。
HCH_012_042_000324	洪武初，屬開封府，以州治襄邑縣省入。
HCH_012_042_000325	十年五月降爲縣。
HCH_012_042_000326	十三年十一月復升爲州。
HCH_012_042_000327	嘉靖二十四年六月來屬。
HCH_012_042_000328	北濱河。
HCH_012_042_000329	又有睢水亦在州東北。
HCH_012_042_000330	東距府百七十里。
HCH_012_042_000331	領縣二：考城州北。
HCH_012_042_000332	元末省。
HCH_012_042_000333	洪武四年八月復置，屬開封府。
HCH_012_042_000334	十年五月復省。
HCH_012_042_000335	十三年十一月復置，屬州。
HCH_012_042_000336	舊治在縣東南。
HCH_012_042_000337	正統十三年徙。
HCH_012_042_000338	北濱大河。
HCH_012_042_000339	柘城州東南。
HCH_012_042_000340	元末省。
HCH_012_042_000341	洪武四年八月復置，屬開封府。
HCH_012_042_000342	十年五月省入寧陵縣。
HCH_012_042_000343	十三年十一月復置，屬州。
HCH_012_042_000344	北有睢水。
HCH_012_042_000345	南有渦水。
HCH_012_042_000346	汝寧府元直隸河南江北行省。
HCH_012_042_000347	洪武初，因之。
HCH_012_042_000348	領州二，縣十二。
HCH_012_042_000349	距布政司四百六十里。
HCH_012_042_000350	汝陽倚。
HCH_012_042_000351	天順元年三月建秀王府，成化八年除。
HCH_012_042_000352	十年建崇王府。
HCH_012_042_000353	洪武初，縣廢，四年七月復置。
HCH_012_042_000354	北有汝水，源出天息山，東流入境，過新蔡東南入淮。
HCH_012_042_000355	又南有澺水，又有汶水，又有溱水，又西北有犋水，俗名泥河，下流俱入於汝。
HCH_012_042_000356	又城南有柴潭。
HCH_012_042_000357	東有陽埠巡檢司。
HCH_012_042_000358	真陽府東。
HCH_012_042_000359	元屬息州。
HCH_012_042_000360	洪武四年省入汝陽縣。
HCH_012_042_000361	景泰四年置真陽鎮巡檢司於此。
HCH_012_042_000362	弘治十八年十二月仍置縣，而徙巡檢司於縣南銅鐘店，仍故名，尋廢。
HCH_012_042_000363	南有淮水。
HCH_012_042_000364	又汝水在縣東，北有滇水流入焉。
HCH_012_042_000365	上蔡府北。
HCH_012_042_000366	洪武初廢，四年五月復置。
HCH_012_042_000367	西有汝水，西南有沙水流合焉。
HCH_012_042_000368	新蔡府東少南。
HCH_012_042_000369	元屬息州，後廢。
HCH_012_042_000370	洪武四年五月復置，改屬。
HCH_012_042_000371	南有汝水，又澺水自城北流合焉。
HCH_012_042_000372	又東北有瓦店巡檢司。
HCH_012_042_000373	西平府西北。
HCH_012_042_000374	北有汝水，源出縣西南雲莊、諸石二山。
HCH_012_042_000375	自元末堨斷故汝，而此水遂爲汝源。
HCH_012_042_000376	嘉靖九年復塞，改爲洪河之上流。
HCH_012_042_000377	確山府西南。
HCH_012_042_000378	洪武十年五月省入汝陽縣，十三年十一月復置。
HCH_012_042_000379	成化十一年九月改屬信陽州。
HCH_012_042_000380	弘治二年八月仍屬府。
HCH_012_042_000381	西北有郎山，亦曰樂山。
HCH_012_042_000382	北有黃酉河，下流爲練河，流入汝。
HCH_012_042_000383	又西有竹溝巡檢司。
HCH_012_042_000384	南有明港巡檢司。
HCH_012_042_000385	遂平府西少北。
HCH_012_042_000386	西南有查牙山，其東南相接者曰馬鞍山。
HCH_012_042_000387	又西有洪山，龍陂之源出焉，自西平縣雲莊諸山之水既塞，遂以此爲汝源。
HCH_012_042_000388	南有灈水，又有沙河，又北有石洋河，其下流皆入於汝。
HCH_012_042_000389	信陽州元爲信陽縣，屬信陽州，後廢。
HCH_012_042_000390	洪武元年十月置信陽州於此，屬河南分省。
HCH_012_042_000391	四年二月屬中都臨濠府。
HCH_012_042_000392	七年八月改屬。
HCH_012_042_000393	十年五月降爲縣。
HCH_012_042_000394	成化十一年九月復升爲州。
HCH_012_042_000395	西南有賢首山。
HCH_012_042_000396	南有士雅山，又有峴山。
HCH_012_042_000397	東南有石城山，亦曰冥山。
HCH_012_042_000398	北有淮水，又南有溮水流入焉。
HCH_012_042_000399	東北距府二百七十里。
HCH_012_042_000400	領縣一：羅山州東。
HCH_012_042_000401	元信陽州治，後州縣俱廢。
HCH_012_042_000402	洪武元年十月置州於舊信陽縣，復置羅山縣屬焉。
HCH_012_042_000403	十年五月直隸汝寧府。
HCH_012_042_000404	成化十一年九月還屬州。
HCH_012_042_000405	北有淮水，又南有小黃河入焉。
HCH_012_042_000406	東南有大勝關巡檢司，與湖廣黃陂界。
HCH_012_042_000407	西南有九里關，好黃峴關，義陽三關之一，有巡檢司，與湖廣應山縣界。
HCH_012_042_000408	光州洪武初，以州治定城縣省入。
HCH_012_042_000409	四年二月改屬中都臨濠府。
HCH_012_042_000410	十三年仍來屬。
HCH_012_042_000411	北有淮水。
HCH_012_042_000412	又南有潢水，北流入淮水。
HCH_012_042_000413	西南有陰山關。
HCH_012_042_000414	西北距府三百里。
HCH_012_042_000415	領縣四：光山州西南。
HCH_012_042_000416	南有石盤山。
HCH_012_042_000417	北濱淮。
HCH_012_042_000418	南有潢水，亦曰官渡河。
HCH_012_042_000419	又南有木陵關。
HCH_012_042_000420	西南又有白沙、土門、鬥木嶺、黃土嶺、修善衝等五關，與湖廣麻城縣界。
HCH_012_042_000421	東南有牛山鎮巡檢司，後移於長潭。
HCH_012_042_000422	又有沙窩鎮巡檢司，後廢。
HCH_012_042_000423	固始州東北。
HCH_012_042_000424	南有白鹿崖。
HCH_012_042_000425	北濱淮。
HCH_012_042_000426	東有史河，西有淠河，俱入南直霍丘縣界，下流入淮。
HCH_012_042_000427	又東北有硃皋鎮，與南直潁州界，有巡檢司。
HCH_012_042_000428	息州西北。
HCH_012_042_000429	元息州，洪武四年二月屬中都臨濠府。
HCH_012_042_000430	尋降爲縣，屬潁州。
HCH_012_042_000431	七年仍來屬。
HCH_012_042_000432	南濱淮。
HCH_012_042_000433	東北有汝水。
HCH_012_042_000434	北有楊莊店巡檢司，後移於縣東北之固城倉。
HCH_012_042_000435	商城州東南。
HCH_012_042_000436	成化十一年四月析固始縣地置。
HCH_012_042_000437	南有金剛台山。
HCH_012_042_000438	又東南有竹根山。
HCH_012_042_000439	東有大蘇山，灌水出焉，流入南直霍丘縣。
HCH_012_042_000440	又東有牛山河，即史河上源也。
HCH_012_042_000441	西南有五水關河。
HCH_012_042_000442	又南有五河，下流俱入於史河。
HCH_012_042_000443	又南有金剛臺巡檢司，本置金剛台山下，嘉靖二十七年移於縣東南之水東案。
HCH_012_042_000444	又南有長嶺關，東南有松子關，俱接湖廣羅田縣界。
HCH_012_042_000445	南陽府元直隸河南江北行省。
HCH_012_042_000446	洪武初，因之。
HCH_012_042_000447	領州二，縣十一。
HCH_012_042_000448	距布政司六百八十里。
HCH_012_042_000449	南陽倚。
HCH_012_042_000450	洪武二十四年建唐王府。
HCH_012_042_000451	城南有精山。
HCH_012_042_000452	北有百重山、雉衡山。
HCH_012_042_000453	又有分水嶺，其水北流入於汝水，南流入於淯水。
HCH_012_042_000454	西南有臥龍岡。
HCH_012_042_000455	東有淯水，一名白河，下流至湖廣襄陽縣界入漢水。
