HCH_012_042_001392	十二年七月，府廢，改左衛於洮州，升右衛爲軍民指揮使司。
HCH_012_042_001393	成化九年十二月置州，屬府，改軍民指揮使司爲衛。
HCH_012_042_001394	西南有雪山，與洮州界。
HCH_012_042_001395	西北有小積石山，上有關。
HCH_012_042_001396	大河自塞外大積石山東北流，逕此，又逕榆林衛北，折而南，與山西中流分界，至潼關衛北，折而東，入河南界，迴環陝西境四千餘里。
HCH_012_042_001397	南有大夏河，即灕水也，亦曰白石川。
HCH_012_042_001398	又西北有積石州，元屬吐蕃宣慰司，洪武四年正月改置積石州千戶所。
HCH_012_042_001399	西南有貴德州，元屬吐蕃宣慰司，洪武八年正月改置歸德守禦千戶所。
HCH_012_042_001400	又南有寧河縣，東北有安鄉縣，元俱屬河州路，洪武三年廢，六年復置。
HCH_012_042_001401	十二年復廢。
HCH_012_042_001402	又東南有定羌巡檢司。
HCH_012_042_001403	東北距府百八十里。
HCH_012_042_001404	靈州元屬寧夏府路。
HCH_012_042_001405	洪武三年罷。
HCH_012_042_001406	弘治十三年九月復置，直隸布政司。
HCH_012_042_001407	大河在城北，洛浦河自南流入焉。
HCH_012_042_001408	南有小鹽池。
HCH_012_042_001409	距布政司九百九十三里。
HCH_012_042_001410	興安州元金州，屬興元路。
HCH_012_042_001411	萬曆十一年八月更名。
HCH_012_042_001412	二十三年直隸布政司。
HCH_012_042_001413	舊治漢水北，後遷水南。
HCH_012_042_001414	萬曆十一年又遷故城南三里許。
HCH_012_042_001415	北有漢水。
HCH_012_042_001416	又西有衡河，亦曰恆河，下流入漢江。
HCH_012_042_001417	東北有乾祐關巡檢司，廢。
HCH_012_042_001418	領縣六。
HCH_012_042_001419	西北距布政司六百四十里。
HCH_012_042_001420	平利州南少東。
HCH_012_042_001421	元末省。
HCH_012_042_001422	洪武三年置，屬四川大寧州。
HCH_012_042_001423	五年二月來屬。
HCH_012_042_001424	十年六月復省，後復置。
HCH_012_042_001425	東有女媧山，灌溪水出焉，西北與黃洋河合，入於漢。
HCH_012_042_001426	南有鎮坪巡檢司。
HCH_012_042_001427	石泉州西。
HCH_012_042_001428	元末省。
HCH_012_042_001429	洪武三年置，屬四川大寧州。
HCH_012_042_001430	五年二月來屬。
HCH_012_042_001431	嘉靖三十八年十一月改屬漢中府。
HCH_012_042_001432	萬曆十一年還屬州。
HCH_012_042_001433	南有十八盤山，有漢江。
HCH_012_042_001434	西有饒風河，東有遲河，俱入漢。
HCH_012_042_001435	又西有饒風嶺巡檢司，本治縣東遲河口，後遷下饒風鋪，更名。
HCH_012_042_001436	洵陽州東。
HCH_012_042_001437	元末省。
HCH_012_042_001438	洪武三年復置。
HCH_012_042_001439	五年二月來屬。
HCH_012_042_001440	東北有水銀山，產水銀、硃砂。
HCH_012_042_001441	南有漢江，東有旬水流入焉。
HCH_012_042_001442	又有乾祐河，自西北流入旬水。
HCH_012_042_001443	東有閭關、西北有三岔二巡檢司。
HCH_012_042_001444	漢陰州西少北。
HCH_012_042_001445	元末省。
HCH_012_042_001446	洪武三年復置。
HCH_012_042_001447	十年六月省入石泉縣，後復置，屬州。
HCH_012_042_001448	嘉靖三十八年十一月改屬漢中府。
HCH_012_042_001449	萬曆十一年還屬州。
HCH_012_042_001450	南有漢水。
HCH_012_042_001451	東北有直水，又有恆河，俱流入漢水。
HCH_012_042_001452	又西有方山關。
HCH_012_042_001453	白河州東南。
HCH_012_042_001454	成化十二年十二月以洵陽縣白河堡置，屬湖廣鄖陽府。
HCH_012_042_001455	十三年九月來屬。
HCH_012_042_001456	北有漢江，東入湖廣鄖西縣界。
HCH_012_042_001457	南有白石河，分二流，俱北注於漢。
HCH_012_042_001458	紫陽州西南。
HCH_012_042_001459	正德七年十一月以金州紫陽堡置。
HCH_012_042_001460	初治紫陽灘之左，嘉靖三十五年遷於灘右。
HCH_012_042_001461	西有漢江。
HCH_012_042_001462	洮州衛元洮州，屬吐蕃宣慰司。
HCH_012_042_001463	洪武四年正月置洮州軍民千戶所，屬河州衛。
HCH_012_042_001464	十二年二月升爲洮州衛軍民指揮使司，屬陝西都司。
HCH_012_042_001465	西南有西傾山，桓水出焉，下流爲白水江，又漒川亦出焉，一名洮水。
HCH_012_042_001466	又北有石嶺山，上有石嶺關。
HCH_012_042_001467	東有黑松嶺，上有松嶺關。
HCH_012_042_001468	又東有黑石關、三岔關、高樓關。
HCH_012_042_001469	北有羊撒關。
HCH_012_042_001470	西南有新橋關、洮州關。
HCH_012_042_001471	東南有舊橋關。
HCH_012_042_001472	南距布政司千六百七十里。
HCH_012_042_001473	岷州衛元岷州，以舊祐川縣地置，屬吐番宣慰司。
HCH_012_042_001474	洪武四年正月置岷州千戶所，屬河州衛。
HCH_012_042_001475	十一年七月升爲衛，屬陝西都司。
HCH_012_042_001476	十五年四月升軍民指揮使司。
HCH_012_042_001477	嘉靖二十四年又置州，改軍民指揮使司爲衛。
HCH_012_042_001478	四十年閏五月，州廢，仍置軍民指揮使司。
HCH_012_042_001479	洪武二十四年建岷王府。
HCH_012_042_001480	二十六年遷雲南。
HCH_012_042_001481	北有岷山，洮河經其下。
HCH_012_042_001482	南有白水，一名臨江。
HCH_012_042_001483	又東有石關。
HCH_012_042_001484	東北有鐵州，元屬吐蕃宣慰司。
HCH_012_042_001485	洪武四年正月置鐵城千戶所，屬河州衛，後廢。
HCH_012_042_001486	領所一。
HCH_012_042_001487	南距布政司千五百五十里。
HCH_012_042_001488	西固城守禦軍民千戶所衛南。
HCH_012_042_001489	本西固城千戶所，洪武七年三月置，屬鞏昌府。
HCH_012_042_001490	十五年四月改置，來屬。
HCH_012_042_001491	南有白水。
HCH_012_042_001492	北有化石關。
HCH_012_042_001493	西北有平定關。
HCH_012_042_001494	榆林衛成化六年三月以榆林川置。
HCH_012_042_001495	其城，正統二年所築也。
HCH_012_042_001496	西有奢延水，西北有黑水，經衛南，爲三岔川流入焉。
HCH_012_042_001497	又北有大河，自寧夏衛東北流經此，西經舊豐州西，折而東，經三受降城南，折而南，經舊東勝衛，又東入山西平虜衛界，地可二千里。
HCH_012_042_001498	大河三面環之，所謂河套也。
HCH_012_042_001499	洪武中，爲內地。
HCH_012_042_001500	天順後，元裔阿羅出、毛裏孩、孛羅出相繼居之。
HCH_012_042_001501	西南有鹽池，舊屬寧夏衛，嘉靖九年來屬。
HCH_012_042_001502	又衛東有長鹽池、紅鹽池。
HCH_012_042_001503	西有西紅鹽池、鍋底池。
HCH_012_042_001504	又東有長樂堡，分轄雙山等十二營堡，爲中路。
HCH_012_042_001505	又有神木堡，分轄鎮羌等九營堡，爲東路。
HCH_012_042_001506	西有安邊營，分轄永濟等十二營堡，爲西路。
HCH_012_042_001507	俱成化後置。
HCH_012_042_001508	又北有邊牆，成化九年築，長一千七百七十餘里，東起清水營，接山西偏頭關界，西抵定邊營，接寧夏花馬池界。
HCH_012_042_001509	南距布政司千一百二十里。
HCH_012_042_001510	寧夏衛元寧夏府路，屬甘肅行省。
HCH_012_042_001511	洪武三年爲府。
HCH_012_042_001512	五年，府廢。
HCH_012_042_001513	二十六年七月置衛。
HCH_012_042_001514	二十八年四月罷。
HCH_012_042_001515	永樂元年正月復置。
HCH_012_042_001516	洪武二十六年，慶王府自慶陽府遷此。
HCH_012_042_001517	西有賀蘭山。
HCH_012_042_001518	又西南有峽口山，黃河流其中，一名青銅硤。
HCH_012_042_001519	黃河出硤東流，亦曰三岔河。
HCH_012_042_001520	又東有黑水河，南有清水河，即葫蘆河下流也，俱注於黃河。
HCH_012_042_001521	有寧夏羣牧千戶所，洪武二十七年十二月置。
HCH_012_042_001522	領千戶所四。
HCH_012_042_001523	東南距布政司千四百里。
HCH_012_042_001524	靈州守禦千戶所衛東南。
HCH_012_042_001525	洪武十六年十月置，治在河口。
HCH_012_042_001526	宣德三年二月徙於城東。
HCH_012_042_001527	弘治十三年九月復置靈州於所城。
HCH_012_042_001528	興武守禦千戶所衛東南。
HCH_012_042_001529	正德元年以興武營置。
HCH_012_042_001530	韋州守禦千戶所衛東南。
HCH_012_042_001531	弘治十年以故韋州置。
HCH_012_042_001532	西有大蠡山。
HCH_012_042_001533	南有小蠡山。
HCH_012_042_001534	東有東湖。
HCH_012_042_001535	平虜千戶所衛北少東。
HCH_012_042_001536	嘉靖三十年以平虜城置。
HCH_012_042_001537	東北有老虎山，濱大河。
HCH_012_042_001538	北有鎮遠關。
HCH_012_042_001539	寧夏前衛在寧夏城內，洪武十七年置。
HCH_012_042_001540	寧夏右屯衛亦俱在寧夏城內，洪武二十五年二月置，後廢。
HCH_012_042_001541	三十五年十二月復置。
HCH_012_042_001542	寧夏後衛本花馬池守禦千戶所，成化十五年置。
HCH_012_042_001543	正德元年改衛。
HCH_012_042_001544	其城，正統九年所築也。
HCH_012_042_001545	東北有方山。
HCH_012_042_001546	西有花馬池。
HCH_012_042_001547	西北有大鹽池。
HCH_012_042_001548	又西有小鹽池。
HCH_012_042_001549	東有長城關，正德初置。
HCH_012_042_001550	東南距布政司千一百二十里。
HCH_012_042_001551	寧夏中衛元應理州，屬寧夏府路。
HCH_012_042_001552	洪武三年州廢。
HCH_012_042_001553	永樂元年正月置衛。
HCH_012_042_001554	西有沙山，一名萬斛堆。
HCH_012_042_001555	大河在南。
HCH_012_042_001556	又西南有溫圍水，流入大河。
HCH_012_042_001557	又有裴家川。
HCH_012_042_001558	又東南有鳴沙州，元屬寧夏府路。
HCH_012_042_001559	洪武初廢。
HCH_012_042_001560	南距布政司千一百十里。
HCH_012_042_001561	靖虜衛正統二年以故會州地置，屬陝西都司。
HCH_012_042_001562	南有烏蘭山，上有烏蘭關。
HCH_012_042_001563	北有大河。
HCH_012_042_001564	西南有祖厲河，東北有亥刺河，皆注於大河。
HCH_012_042_001565	西南有會寧關。
HCH_012_042_001566	南距布政司千二百二十里。
HCH_012_042_001567	陝西行都指揮使司元甘肅等處行中書省，治甘州路。
HCH_012_042_001568	洪武五年十一月置甘肅衛。
HCH_012_042_001569	二十五年罷。
HCH_012_042_001570	二十六年，陝西行都指揮使司自莊浪徙置於此。
HCH_012_042_001571	領衛十二，守禦千戶所四。
HCH_012_042_001572	距布政司二千六百四十五里。
HCH_012_042_001573	甘州左衛倚。
HCH_012_042_001574	元甘州路。
HCH_012_042_001575	洪武初廢。
HCH_012_042_001576	二十三年十二月置甘州左衛。
HCH_012_042_001577	二十七年十一月罷。
HCH_012_042_001578	二十八年六月復置。
HCH_012_042_001579	洪武二十五年三月建肅王府。
HCH_012_042_001580	建文元年遷於蘭縣。
HCH_012_042_001581	西南有祁連山。
HCH_012_042_001582	西北有合黎山。
HCH_012_042_001583	東北有人祖山，山口有關，曰山南，嘉靖二十七年置。
HCH_012_042_001584	又東北有居延海。
HCH_012_042_001585	西有弱水，出西南山谷中，下流入焉。
HCH_012_042_001586	又有張掖河，流合弱水，其支流曰黑水河，仍合於張掖河。
HCH_012_042_001587	又東南有盧水，亦曰沮渠川。
HCH_012_042_001588	甘州右衛、甘州中衛俱洪武二十五年三月置。
HCH_012_042_001589	甘州前衛、甘州後衛俱洪武二十九年置。
HCH_012_042_001590	四衛俱與甘州左衛同城。
HCH_012_042_001591	肅州衛元肅州路，屬甘肅行省。
HCH_012_042_001592	洪武二十七年十一月置衛。
HCH_012_042_001593	西有嘉峪山，其西麓即嘉峪關也。
HCH_012_042_001594	弘治七年正月扁關曰鎮西。
HCH_012_042_001595	西南有小崑崙山，亦曰雪山，與甘州山相接。
HCH_012_042_001596	北有討來河，東會於張掖河。
HCH_012_042_001597	西南有白水，又西北有黑水，東南有紅水，俱流入白水，下流入西寧衛之西海。
HCH_012_042_001598	又東北有威虜衛，洪武中置，永樂三年三月省。
HCH_012_042_001599	東距行都司五百十里。
HCH_012_042_001600	山丹衛元山丹州，直隸甘肅行省。
HCH_012_042_001601	洪武初廢。
HCH_012_042_001602	二十三年九月置衛，屬陝西都司，後來屬。
HCH_012_042_001603	東南有焉支山。
HCH_012_042_001604	西有刪丹河，即弱水也。
HCH_012_042_001605	北有紅鹽池。
HCH_012_042_001606	西距行都司百八十里。
HCH_012_042_001607	永昌衛元永昌路，屬甘肅行省，至正三年七月改永昌等處宣慰司。
HCH_012_042_001608	洪武初廢。
HCH_012_042_001609	十五年三月置衛，屬陝西都司，後來屬。
HCH_012_042_001610	北有金山，麗水出焉。
HCH_012_042_001611	西南有白嶺山，亦曰雪山。
HCH_012_042_001612	西有水磨川，上有水磨關。
HCH_012_042_001613	又東南有蹇佔河。
HCH_012_042_001614	西北距行都司三百十里。
HCH_012_042_001615	涼州衛元西涼州，屬永昌路。
HCH_012_042_001616	洪武九年十月置衛，屬陝西都司，後來屬。
HCH_012_042_001617	南有天梯山，三岔河出焉。
HCH_012_042_001618	東南有洪池嶺。
HCH_012_042_001619	又東北有白亭海，有瀦野澤。
HCH_012_042_001620	又西有土彌幹川，即五澗水也，亦出天梯山，下流合於三岔河。
HCH_012_042_001621	又東有雜木口關。
HCH_012_042_001622	又有涼州土衛，洪武七年十月置。
HCH_012_042_001623	西北距行都司五百里。
HCH_012_042_001624	鎮番衛本臨河衛，洪武中，以小河灘城置。
HCH_012_042_001625	三十年正月更名。
HCH_012_042_001626	建文中罷。
HCH_012_042_001627	永樂元年六月復置。
HCH_012_042_001628	西有黑河，即張掖河下流也。
HCH_012_042_001629	又東有三岔河。
HCH_012_042_001630	南有小河。
HCH_012_042_001631	西有鹽池。
HCH_012_042_001632	西南有黑山關。
HCH_012_042_001633	西距行都司五百五十里。
HCH_012_042_001634	莊浪衛洪武五年十一月以永昌地置。
HCH_012_042_001635	十二年正月置陝西行都指揮使司於衛城。
HCH_012_042_001636	二十六年，行都司徙於甘州。
HCH_012_042_001637	建文中，改衛爲守禦千戶所。
HCH_012_042_001638	洪武三十五年十月復改所爲衛，屬陝西都司，後來屬。
HCH_012_042_001639	東有大松山。
HCH_012_042_001640	其北有小松山。
HCH_012_042_001641	西有分水嶺，南出者爲莊浪河，北出者爲古浪河。
HCH_012_042_001642	又南有大通河，與莊浪河合，北流經衛西，入於沙漠。
HCH_012_042_001643	北距行都司九百四十里。
HCH_012_042_001644	西寧衛元西寧州，直隸甘肅行省。
HCH_012_042_001645	洪武初廢。
HCH_012_042_001646	六年正月置衛。
HCH_012_042_001647	宣德七年十一月升軍民指揮使司，屬陝西都司，後來屬。
HCH_012_042_001648	西南有小積石山，與河州接界。
HCH_012_042_001649	東南有峽口山，亦曰湟峽。
HCH_012_042_001650	南有大河，自西域流入，迴環於陝西、山西、河南、山東四布政司，及南直隸之地，幾至萬里，至淮安府清河縣，南合長淮，又東至安東縣南入於海。
HCH_012_042_001651	又北有湟水，即蘇木連河也，東入大河。
HCH_012_042_001652	又西南有賜支河，又城北有西寧河，皆流入大河。
HCH_012_042_001653	又西北有浩亹水，西南有宗哥川，俱流合於湟水。
HCH_012_042_001654	又西有西海，亦名卑禾羌海，俗呼青海。
HCH_012_042_001655	西北有赤海。
HCH_012_042_001656	又有烏海鹽池。
HCH_012_042_001657	東南有綏遠關。
HCH_012_042_001658	西北距行都司千三百五十里。
HCH_012_042_001659	碾伯守禦千戶所本碾北地。
HCH_012_042_001660	洪武十一年三月置莊浪分衛。
HCH_012_042_001661	七月改置碾北衛，後廢，而徙西寧衛右千戶所於此。
HCH_012_042_001662	成化中更名。
HCH_012_042_001663	南有碾伯河。
HCH_012_042_001664	西北距行都司千二百三十里。
HCH_012_042_001665	沙州衛元沙州路，屬甘肅行省。
HCH_012_042_001666	洪武初廢。
HCH_012_042_001667	永樂元年置衛。
HCH_012_042_001668	正統間廢。
HCH_012_042_001669	南有鳴沙山。
HCH_012_042_001670	東南有三危山。
HCH_012_042_001671	又東有龍勒山，又有渥窪水。
HCH_012_042_001672	西有瓜州，元屬沙州路，洪武初廢。
HCH_012_042_001673	東距行都司千三百六十里。
HCH_012_042_001674	鎮夷守禦千戶所洪武三十年以甘州衛地置。
HCH_012_042_001675	建文二年罷。
HCH_012_042_001676	永樂元年復置所，舊在西北，天順八年移於今治。
HCH_012_042_001677	南有黑河，即張掖河也。
HCH_012_042_001678	西南有鹽池。
HCH_012_042_001679	北有兔兒關。
HCH_012_042_001680	東南距行都司三百里。
HCH_012_042_001681	古浪守禦千戶所正統三年六月以莊浪衛地置。
HCH_012_042_001682	古浪河在東。
HCH_012_042_001683	又南有古浪關。
HCH_012_042_001684	東有石峽關。
HCH_012_042_001685	東南距行都司六百四十里。
HCH_012_042_001686	高臺守禦千戶所景泰七年以甘州衛之高臺站置。
HCH_012_042_001687	弱水在北。
HCH_012_042_001688	又西有合黎山。
HCH_012_042_001689	西南有白城山。
HCH_012_042_001690	東南距行都司一百六十里。
