HCH_010_017_000001	五年春正月乙酉，如混同江。
HCH_010_017_000002	二月戊午，禁天下服用明金及金線綺；國親當服者，奏而後用。
HCH_010_017_000003	是月，如魚兒濼。
HCH_010_017_000004	三月壬辰，以左丞相張儉為武定軍節度使、同政事門下平章事，鄭弘節臨潢少尹，劉慎行遼興軍節度使，武定軍節度使蕭匹敵契丹行宮都部署，樞密副使楊又玄吏部尚書、參知政事兼樞密使。
HCH_010_017_000005	是月，如長春河魚兒濼，其水一夕有聲如雷，越沙岡四十里，別為一陂。
HCH_010_017_000006	夏五月，清暑永安山。
HCH_010_017_000007	以蕭從順為太子太師，吳叔達翰林學士，道士馮若谷加太子中允，耶律晨武定軍節度使，張儉彰信軍節度使，呂士宗禮部員外郎，李可舉順義軍節度使。
HCH_010_017_000008	秋七月，獵平地松林。
HCH_010_017_000009	九月，駐蹕南京。
HCH_010_017_000010	己亥，以蕭迪烈、李紹琪充賀宋太后生辰使副，耶律守寧、劉四端充賀宋主生辰使副。
HCH_010_017_000011	冬十月辛未，宋太后遣馮元宗、史方來賀順天節。
HCH_010_017_000012	十一月庚子，幸內果園宴，京民聚觀。
HCH_010_017_000013	求進士，得七十二人，命賦詩，第其工拙，以張昱等一十四人為太子校書郎，韓欒等五十八人為崇文館校書郎。
HCH_010_017_000014	辛丑，以左祗候郎君詳穩蕭羅羅為右夷離畢。
HCH_010_017_000015	十二月丁巳，以漢人行宮都部署蕭孝先為上京留守，皇侄長沙郡王謝家奴匡義軍節度使，耶律仁舉興國軍節度使。
HCH_010_017_000016	甲子，蕭守寧為點檢侍衛親軍馬步軍。
HCH_010_017_000017	乙丑，北院樞密使蕭合卓薨。
HCH_010_017_000018	戊辰，以北府宰相蕭普古為北院樞密使。
HCH_010_017_000019	己巳，遣蕭諧、李琪充賀宋正旦使副。
HCH_010_017_000020	庚午，以參知政事劉京為順義軍節度使。
HCH_010_017_000021	乙亥，宋使李維、張綸來賀千齡節。
HCH_010_017_000022	是歲，燕民以年谷豐熟，車駕臨幸，爭以土物來獻。
HCH_010_017_000023	上禮高年，惠鰥寡，賜酺飲。
HCH_010_017_000024	至夕，六街燈火如晝，士庶嬉遊，上亦微行觀之。
HCH_010_017_000025	丁丑，禁工匠不得銷毀金銀器。
HCH_010_017_000026	六年春正月己卯朔，宋遣徐奭、裴繼起、張若谷、崔準來賀。
HCH_010_017_000027	庚辰，如鴛鴦濼。
HCH_010_017_000028	二月己酉，以迷離己同知樞密院，黃翩為兵馬都部署，達骨只副之，赦石為都監，引軍城混同江、疏木河之間。
HCH_010_017_000029	黃龍府請建堡障三、烽臺十，詔以農隙築之。
HCH_010_017_000030	東京留守八哥奏黃翩領兵入女直界徇地，俘獲人、馬、牛、豕，不可勝計，得降戶二百七十，詔獎諭之。
HCH_010_017_000031	戊午，以耶律野為副點檢，以國舅帳蕭柳氏、徒魯骨領西北路十二班軍、奚王府舍利軍。
HCH_010_017_000032	己巳，南京水，遣使振之。
HCH_010_017_000033	庚午，詔党項別部塌西設契丹節度使治之。
HCH_010_017_000034	三月戊寅朔，以大同軍節度使張儉入為南院樞密使、左丞相兼政事令，參知政事吳叔達責授將作少監，出為東州刺史。
HCH_010_017_000035	是月，阻卜來侵，西北路招討使蕭惠破之。
HCH_010_017_000036	夏四月丁未朔，以武定軍節度使耶律洪古為惕隱。
HCH_010_017_000037	戊申，蒲盧毛朵部多兀惹戶，詔索之。
HCH_010_017_000038	丙寅，如永安山。
HCH_010_017_000039	五月辛卯，以東京統軍使蕭慥古為契丹行宮都部署。
HCH_010_017_000040	癸卯，遣西北路招討使蕭惠將兵伐甘州回鶻。
HCH_010_017_000041	六月辛丑，詔凡官畜並印其左以識之。
HCH_010_017_000042	秋七月戊申，獵黑嶺。
HCH_010_017_000043	八月，蕭惠攻甘州不克，師還。
HCH_010_017_000044	自是阻卜諸部皆叛，遼軍與戰，皆為所敗，監軍涅裏姑、國舅帳太保曷不呂死之。
HCH_010_017_000045	詔遣惕隱耶律洪古、林牙化哥等將兵討之。
HCH_010_017_000046	九月，駐蹕遼河滸。
HCH_010_017_000047	冬十月丙子，曷蘇館諸部長來朝。
HCH_010_017_000048	庚辰，遣使問夏國五月與宋交戰之故。
HCH_010_017_000049	辛巳，以前院大王直魯袞為烏古敵烈都詳穩。
HCH_010_017_000050	庚寅，以蕭孝順、蕭紹宗兼侍中，駙馬蕭紹業平章政事，前南院大王胡睹堇同知上京留守，安哥通化州節度使。
HCH_010_017_000051	十一月乙丑，宋遣韓翼、田承說來賀順天節。
HCH_010_017_000052	戊辰，西北路招討司小校掃姑訴招討蕭惠三罪，詔都監奧骨禎按之。
HCH_010_017_000053	十二月庚辰，曷蘇館部乞建旗鼓，許之。
HCH_010_017_000054	辛巳，詔北南諸部廉察州縣及石烈、彌裏之官，不治者罷之。
HCH_010_017_000055	詔大小職官有貪暴殘民者，立罷之，終身不錄；其不廉直，雖處重任，即代之；能清勤自持者，在卑位亦當薦拔；其內族受賂，事發，與常人所犯同科。
HCH_010_017_000056	戊戌，遣杜防、蕭蘊充賀宋生辰使副。
HCH_010_017_000057	庚子，駐蹕遼河。
HCH_010_017_000058	七年春正月壬寅朔，宋遣張保維、孫繼業、孔道輔、馬崇至來賀。
HCH_010_017_000059	如混同江。
HCH_010_017_000060	辛亥，以女直白縷為惕隱，蒲馬為巖母部太師。
HCH_010_017_000061	甲寅，蒲盧毛朵部遣使來貢。
HCH_010_017_000062	夏四月乙未，獵黑嶺。
HCH_010_017_000063	五月，清暑永安山。
HCH_010_017_000064	西南路招討司奏陰山中產金銀，請置冶，從之。
HCH_010_017_000065	復遣使循遼河源求產金銀之礦。
HCH_010_017_000066	六月，禁諸屯田不得擅貨官粟。
HCH_010_017_000067	癸巳，詔蕭惠再討阻卜。
HCH_010_017_000068	秋七月己亥朔，詔更定法令。
HCH_010_017_000069	庚子，詔諭駙馬蕭鉏不、公主粘米袞：「爾於後有父母之尊，後或臨幸，祗謁先祖，祗拜空帳，失致敬之禮，今後可設像拜謁。」
HCH_010_017_000070	乙巳，詔輦路所經，旁三十步內不得耕種者，不在訴訟之限。
HCH_010_017_000071	九月，駐蹕遼河。
HCH_010_017_000072	冬十月丁卯朔，詔諸帳院庶孽，並從其母論貴賤。
HCH_010_017_000073	十一月，宋遣石中立、石貽孫來賀千齡節，王博文、王雙賀順天節。
HCH_010_017_000074	辛亥，以楊又玄、邢祥知貢舉。
HCH_010_017_000075	己未，匡義軍節度使中山郡王查葛、保寧軍節度使長沙郡王謝家奴、廣德軍節度使樂安郡王遂哥奏，各將之官，乞選伴讀書史，從之。
HCH_010_017_000076	癸亥，以三韓王欽為啟聖軍節度使，楊佶刑部侍郎。
HCH_010_017_000077	甲子，以左千牛衛上將軍耶律古昱為北院大王。
HCH_010_017_000078	十二月丁卯朔，遣耶律遂英、王永錫充賀宋太后生辰，蕭速撒、馬保永充賀正旦使副。
HCH_010_017_000079	癸酉，以金吾蕭高六為奚舍利軍詳穩。
HCH_010_017_000080	八年春正月乙亥，如混同江。
HCH_010_017_000081	庚申，党項侵邊，破之。
HCH_010_017_000082	甲子，詔州縣長吏勸農。
HCH_010_017_000083	二月戊子，燕京留守蕭孝穆乞於拒馬河接宋境上置戍長巡察，詔從之。
HCH_010_017_000084	三月，駐蹕長春河。
HCH_010_017_000085	夏五月，清暑永安山。
HCH_010_017_000086	六月，以韓寧、劉湘充賀宋太后生辰使副，吳克荷充賀夏國王李德昭生辰使。
HCH_010_017_000087	癸巳，權北院大王耶律鄭留奏，今歲十一月皇太子納妃，諸族備會親之帳。
HCH_010_017_000088	詔以豪盛者三十戶給其費。
HCH_010_017_000089	秋七月丁酉，以遙輦帳郎君陳哥為西北路巡檢，與蕭諧領同管二招討地。
HCH_010_017_000090	以南院大王耶律敵烈為上京留守。
HCH_010_017_000091	戊戌，獵平地松林。
HCH_010_017_000092	九月壬辰朔，以渤海宰相羅漢權東京統軍使。
HCH_010_017_000093	壬子，幸中京。
HCH_010_017_000094	北敵烈部節度使耶律延壽請視諸部，賜旗鼓，詔從之。
HCH_010_017_000095	癸丑，阻卜別部長胡懶來降。
HCH_010_017_000096	乙卯，阻卜長舂古來降。
HCH_010_017_000097	冬十月，宋遣唐肅、葛懷湣來賀順天節。
HCH_010_017_000098	樞密使、魏王耶律斜軫孫婦阿聒指斥乘輿，其孫骨欲為之隱，事覺，乃並坐之，仍籍其家。
HCH_010_017_000099	詔燕城將士，若敵至，總管備城之東南，統軍守其西北，馬步軍備其野戰，統軍副使繕壁壘，課士卒，各練其事。
HCH_010_017_000100	十一月丙申，皇太子納妃蕭氏。
HCH_010_017_000101	以耶律求翰為北院大王十二月辛酉朔，以遙輦太尉謝佛留為天雲軍詳穩。
HCH_010_017_000102	壬申，以前北院大王耶律留寧為雙州節度使，康筠崇德宮都部署，謝十永興宮都部署，旅墳宜州節度使，菴遼州節度使，耶律野同知中京留守，耶律曷魯突愧為大將軍。
HCH_010_017_000103	丁丑，詔庶孽雖已為良，不得預世選。
HCH_010_017_000104	丁亥，宋遣寇瑊、康德來賀千齡節。
HCH_010_017_000105	朱諫、曹英、張逸、劉永釗賀來歲兩宮正旦。
HCH_010_017_000106	詔兩國舅及南、北王府乃國之貴族，賤庶不得任本部官。
HCH_010_017_000107	是歲，放進士張宥等五十七人。
HCH_010_017_000108	九年春正月，至自中京。
HCH_010_017_000109	二月戊辰，遣使賜高麗王欽物。
HCH_010_017_000110	如斡凜河。
HCH_010_017_000111	夏五月，清暑永安山。
HCH_010_017_000112	六月戊子朔，以長沙郡王謝家奴為廣德軍節度使，樂安郡王遂哥匡義軍節度使，中山郡王查葛保定軍節度使，進封潞王，豫章王貼不長寧軍節度使。
HCH_010_017_000113	以耶律思忠、耶律荷、耶律暠、遙輦謝佛留、陳邈、韓紹一、韓知白、張震充賀宋兩宮生辰及來歲正旦使副。
HCH_010_017_000114	秋七月戊午朔，如黑嶺。
HCH_010_017_000115	八月己丑，東京舍利軍詳穩大延琳囚留守駙馬都尉蕭孝先及南陽公主，殺戶部使韓紹勛、副使王嘉、四捷軍都指揮使蕭頗得，延琳遂僭位，號其國為興遼，年為天慶。
HCH_010_017_000116	初，東遼之地，自神冊來附，未有榷酤鹽曲之法，關市之征亦甚寬弛。
HCH_010_017_000117	馮延休、韓紹勛相繼以燕地平山之法繩之，民不堪命。
HCH_010_017_000118	燕又仍歲大饑，戶部副使王嘉復獻計造船，使其民諳海事者，漕粟以賑燕民。
HCH_010_017_000119	水路艱險，多至覆沒，雖言不信，鞭楚搒掠，民怨思亂。
HCH_010_017_000120	故延琳乘之，首殺紹勛、嘉，以快其眾。
HCH_010_017_000121	延琳先事與副留守王道平謀，道平夜棄其家，逾城走，與延琳所遣召黃龍府黃翩者，俱至行在告變。
HCH_010_017_000122	上即征諸道兵，以時進討。
HCH_010_017_000123	時國舅詳穩蕭匹敵治近延琳，先率本管及家兵據其要害，絕其西渡之計。
HCH_010_017_000124	渤海太保夏行美亦舊主兵，戍保州，延林密馳書，使圖統帥耶律蒲古。
HCH_010_017_000125	行美乃以實告，蒲古得書，遂殺渤海兵八百人，而斷其東路。
HCH_010_017_000126	延琳知黃龍、保州皆不附，遂分兵西取沈州，其節度使蕭王六初至，其副張傑聲言欲降，故不急攻。
HCH_010_017_000127	及知其詐，而已有備，攻之不克而還。
HCH_010_017_000128	時南、北女直皆從延琳，高麗亦稽其貢。
HCH_010_017_000129	及諸道兵次第皆至，延琳嬰城固守。
HCH_010_017_000130	冬十月丙戌朔，以南京留守燕王蕭孝穆為都統，國舅詳穩蕭匹敵為副統，奚六部大王蕭蒲奴為都監以討之。
HCH_010_017_000131	十一月乙卯朔，如顯陵。
HCH_010_017_000132	丙寅，以沈州節度副使張傑為節度使，其皇城進士張人紀、趙睦等二十二人入朝。
HCH_010_017_000133	試以詩賦，皆賜第，超授保州戍將夏行美平章事。
HCH_010_017_000134	壬申，以駙馬劉四端權知宣徽南院事。
HCH_010_017_000135	十二月丁未，宋遣仇永、韓永錫來賀千齡節。
HCH_010_017_000136	命耶律育、吳克荷、蕭可觀、趙利用充賀宋生辰使副，耶律元吉、崔閏、蕭昭古、竇振充來歲賀宋正旦使副。
HCH_010_017_000137	十年春正月乙卯朔，宋遣王夷簡、竇處約、張易、張士宜來賀。
HCH_010_017_000138	二月，幸龍化州。
HCH_010_017_000139	三月甲寅朔，詳穩蕭匹敵至自遼東，言都統蕭孝穆去城四面各五里許，築城堡以圍之。
HCH_010_017_000140	駙馬延寧與其妹穴地遁去，惟公主崔八在後，為守陴者覺而止。
HCH_010_017_000141	夏四月，如乾陵。
HCH_010_017_000142	以耶律行平為廣平軍節度使，夏行美為忠順軍節度使，李延弘知易州，蕭從順加太子太師。
HCH_010_017_000143	五月戊申，清暑柏坡。
HCH_010_017_000144	秋七月壬午，詔來歲行貢舉法。
HCH_010_017_000145	八月丙午，東京賊將楊詳世密送款，夜開南門納遼軍。
HCH_010_017_000146	擒延琳，渤海平。
HCH_010_017_000147	冬十月，駐蹕長寧澱。
HCH_010_017_000148	十一月辛亥，南京留守燕王蕭孝穆以東征將士凱還，戎服見上，上大加宴勞。
HCH_010_017_000149	翌日，以孝穆為東平王、東京留守，國舅詳穩、駙馬都尉蕭匹敵封蘭陵郡王，奚王蒲奴加侍中；以權燕京留守兼侍中蕭惠為燕京統軍使，前統軍委窊大將軍、節度使，宰相兼樞密使馬保忠權知燕京留守，奚王府都監蕭阿古軫東京統軍使。
HCH_010_017_000150	詔渤海舊族有勛勞材力者敘用，餘分居來、隰、遷、潤等州。
HCH_010_017_000151	十二月乙巳，宋遣梅詢、王令傑來賀千齡節。
HCH_010_017_000152	漆水郡王耶律敵烈加尚父，烏古部節度使蕭普達為乙室部大王，尚書左僕射蕭琳為臨海軍節度使。
HCH_010_017_000153	十一年春正月己酉朔，如混同江。
HCH_010_017_000154	二月，如長春河。
HCH_010_017_000155	三月，上不豫。
HCH_010_017_000156	夏五月，大雨水，諸河橫流，皆失故道。
HCH_010_017_000157	六月丁丑朔，駐蹕大福河之北。
HCH_010_017_000158	己卯，帝崩於行宮，年六十一，在位四十九年。
HCH_010_017_000159	景福元年閏十月壬申，上尊謚曰文武大孝宣皇帝，廟號聖宗。
HCH_010_017_000160	贊曰：聖宗幼沖嗣位，政出慈闈。
HCH_010_017_000161	及宋人二道來攻，親禦甲胄，一舉而復燕、雲，破信、彬，再舉而躪河、朔，不亦偉歟！
HCH_010_017_000162	既而侈心一啟，佳兵不祥，東有茶、陀之敗，西有甘州之喪，此狃於常勝之過也。
HCH_010_017_000163	然其踐阼四十九年，理冤滯，舉才行，察貪殘，抑奢僭，錄死事之子孫，振諸部之貧乏，責迎合不忠之罪，卻高麗女樂之歸。
HCH_010_017_000164	遼之諸帝，在位長久，令名無窮，其唯聖宗乎！
HCH_010_017_000165	本元朝作品在全世界都属于公有领域，因为作者逝世已经遠遠超过100年。
